Sheet: Calendario
B1: Ejemplo con asignatura con 3 horas semanales (lunes, miércoles y viernes)
A3: Código Día | B3: Día | C3: Lunes | E3: Curso | H3: Dia | I3: Descripción
A4: 0 | B4: Lunes | C4: 1 | E4: fecha inicio | F4: 2015-09-07 | H4: 2015-10-09 | I4: día de la Comunidad Valenciana | J4: FIESTA
A5: 1 | B5: Martes | C5: 0 | E5: fecha fin | F5: 2016-06-17 | H5: 2015-12-08 | I5: Inmaculada Concepción | J5: FIESTA
A6: 2 | B6: Miercoles | C6: 1 | H6: 2015-12-23 | I6: Vacaciones de Navidad | J6: FIESTA
A7: 3 | B7: Jueves | C7: 0 | E7: 1er trimestre | H7: 2015-12-24 | I7: Vacaciones de Navidad | J7: FIESTA
A8: 4 | B8: Viernes | C8: 1 | E8: fecha inicio | F8: of:=[.F4] -> 2015-09-07 | H8: 2015-12-25 | I8: Vacaciones de Navidad | J8: FIESTA
A9: 5 | B9: Sabado | C9: 0 | E9: fecha fin | F9: 2015-12-11 | H9: 2015-12-26 | I9: Vacaciones de Navidad | J9: FIESTA
A10: 6 | B10: Domingo | C10: 0 | H10: 2015-12-27 | I10: Vacaciones de Navidad | J10: FIESTA
B11: Total | C11: of:=SUM([.C4:.C8]) -> 3 | E11: 2º trimestre | H11: 2015-12-28 | I11: Vacaciones de Navidad | J11: FIESTA
E12: fecha inicio | F12: of:=[.F9]+1 -> 2015-12-12 | H12: 2015-12-29 | I12: Vacaciones de Navidad | J12: FIESTA
E13: fecha fin | F13: 2016-04-01 | H13: 2015-12-30 | I13: Vacaciones de Navidad | J13: FIESTA
H14: 2015-12-31 | I14: Vacaciones de Navidad | J14: FIESTA
E15: 3er trimestre | H15: 2016-01-01 | I15: Vacaciones de Navidad | J15: FIESTA
E16: fecha inicio | F16: of:=[.F13]+1 -> 2016-04-02 | H16: 2016-01-02 | I16: Vacaciones de Navidad | J16: FIESTA
E17: fecha fin | F17: of:=[.F5] -> 2016-06-17 | H17: 2016-01-03 | I17: Vacaciones de Navidad | J17: FIESTA
H18: 2016-01-04 | I18: Vacaciones de Navidad | J18: FIESTA
H19: 2016-01-05 | I19: Vacaciones de Navidad | J19: FIESTA
H20: 2016-01-06 | I20: Vacaciones de Navidad | J20: FIESTA
H21: 2016-03-19 | I21: San José | J21: FIESTA
H22: 2016-04-02 | I22: Vacaciones de Pascua | J22: FIESTA
H23: 2016-04-03 | I23: Vacaciones de Pascua | J23: FIESTA
H24: 2016-04-04 | I24: Vacaciones de Pascua | J24: FIESTA
H25: 2016-04-05 | I25: Vacaciones de Pascua | J25: FIESTA
H26: 2016-04-06 | I26: Vacaciones de Pascua | J26: FIESTA
H27: 2016-04-07 | I27: Vacaciones de Pascua | J27: FIESTA
H28: 2016-04-08 | I28: Vacaciones de Pascua | J28: FIESTA
H29: 2016-04-09 | I29: Vacaciones de Pascua | J29: FIESTA
H30: 2016-04-10 | I30: Vacaciones de Pascua | J30: FIESTA
H31: 2016-04-11 | I31: Vacaciones de Pascua | J31: FIESTA
H32: 2016-04-12 | I32: Vacaciones de Pascua | J32: FIESTA
H33: 2016-04-13 | I33: Vacaciones de Pascua | J33: FIESTA
H34: 2016-05-01 | I34: Fiesta del Trabajo | J34: FIESTA
J35: FIESTA
J36: FIESTA
J37: FIESTA
J38: FIESTA
J39: FIESTA
J40: FIESTA
J41: FIESTA
J42: FIESTA
J43: FIESTA
J44: FIESTA
J45: FIESTA
J46: FIESTA
J47: FIESTA
J48: FIESTA

Sheet: Unidades
B1: HORAS TRIMESTRE
A2: 1 | B2: 2 | C2: 3 | D2: Unidad | E2: Título | F2: Estimación de horas por unidad | G2: Horas Planificadas | H2: Fecha inicial Planificada | I2: Fecha final Planificada | J2: Horas Realizadas | K2: Desviación En horas | L2: Fecha inicio Realizada | M2: Fecha fin Realizada | O2: Subtotal horas
A3: of:=IF(SUMIFS([Seguimiento.$F$2:.$F$1000];[Seguimiento.$H$2:.$H$1000];[.$D3];[Seguimiento.$C$2:.$C$1000];[.A$2])=0;"";SUMIFS([Seguimiento.$F$2:.$F$1000];[Seguimiento.$H$2:.$H$1000];[.$D3];[Seguimiento.$C$2:.$C$1000];[.A$2])) -> 20 | B3: of:=IF(SUMIFS([Seguimiento.$F$2:.$F$1000];[Seguimiento.$H$2:.$H$1000];[.$D3];[Seguimiento.$C$2:.$C$1000];[.B$2])=0;"";SUMIFS([Seguimiento.$F$2:.$F$1000];[Seguimiento.$H$2:.$H$1000];[.$D3];[Seguimiento.$C$2:.$C$1000];[.B$2])) ->  | C3: of:=IF(SUMIFS([Seguimiento.$F$2:.$F$1000];[Seguimiento.$H$2:.$H$1000];[.$D3];[Seguimiento.$C$2:.$C$1000];[.C$2])=0;"";SUMIFS([Seguimiento.$F$2:.$F$1000];[Seguimiento.$H$2:.$H$1000];[.$D3];[Seguimiento.$C$2:.$C$1000];[.C$2])) ->  | D3: 1 | E3: Unidad 1 | F3: 20 | G3: of:=IF(SUM([.A3:.C3])>0;SUM([.A3:.C3]);"") -> 20 | H3: of:=SUMPRODUCT([Seguimiento.H2:.H1000]=1;[Seguimiento.I2:.I1000]="INICIO";[Seguimiento.B2:.B1000]) -> 2015-09-07 | I3: of:=SUMPRODUCT([Seguimiento.H2:.H1000]=1;[Seguimiento.I2:.I1000]="FIN";[Seguimiento.B2:.B1000]) -> 2015-10-25 | J3: of:=IF(ISNUMBER([.G3]);SUMPRODUCT([Seguimiento.$K$2:.$K$236]=[.D3];[Seguimiento.$F$2:.$F$236]);"") -> 0 | K3: of:=IF(ISNUMBER([.G3]);[.J3]-[.G3];"") -> -20 | L3: of:=SUMPRODUCT([Seguimiento.A2:.A1000]=1;[Seguimiento.K2:.K1000]=1;[Seguimiento.J2:.J1000]="INICIO";[Seguimiento.B2:.B1000]) -> 1899-12-30 | M3: of:=SUMPRODUCT([Seguimiento.A2:.A1000]=1;[Seguimiento.K2:.K1000]=1;[Seguimiento.J2:.J1000]="FIN";[Seguimiento.B2:.B1000]) -> 1899-12-30 | N3: of:=[.D3] -> 1 | O3: of:=IF(ISNUMBER([.F3]);[.F3];"") -> 20
A4: of:=IF(SUMIFS([Seguimiento.$F$2:.$F$1000];[Seguimiento.$H$2:.$H$1000];[.$D4];[Seguimiento.$C$2:.$C$1000];[.A$2])=0;"";SUMIFS([Seguimiento.$F$2:.$F$1000];[Seguimiento.$H$2:.$H$1000];[.$D4];[Seguimiento.$C$2:.$C$1000];[.A$2])) -> 10 | B4: of:=IF(SUMIFS([Seguimiento.$F$2:.$F$1000];[Seguimiento.$H$2:.$H$1000];[.$D4];[Seguimiento.$C$2:.$C$1000];[.B$2])=0;"";SUMIFS([Seguimiento.$F$2:.$F$1000];[Seguimiento.$H$2:.$H$1000];[.$D4];[Seguimiento.$C$2:.$C$1000];[.B$2])) ->  | C4: of:=IF(SUMIFS([Seguimiento.$F$2:.$F$1000];[Seguimiento.$H$2:.$H$1000];[.$D4];[Seguimiento.$C$2:.$C$1000];[.C$2])=0;"";SUMIFS([Seguimiento.$F$2:.$F$1000];[Seguimiento.$H$2:.$H$1000];[.$D4];[Seguimiento.$C$2:.$C$1000];[.C$2])) ->  | D4: 2 | E4: Unidad 2 | F4: 10 | G4: of:=IF(SUM([.A4:.C4])>0;SUM([.A4:.C4]);"") -> 10 | H4: of:=SUMPRODUCT([Seguimiento.H2:.H1000]=2;[Seguimiento.I2:.I1000]="INICIO";[Seguimiento.B2:.B1000]) -> 2015-10-26 | I4: of:=SUMPRODUCT([Seguimiento.H2:.H1000]=2;[Seguimiento.I2:.I1000]="FIN";[Seguimiento.B2:.B1000]) -> 2015-11-17 | J4: of:=IF(ISNUMBER([.G4]);SUMPRODUCT([Seguimiento.$K$2:.$K$236]=[.D4];[Seguimiento.$F$2:.$F$236]);"") -> 0 | K4: of:=IF(ISNUMBER([.G4]);[.J4]-[.G4];"") -> -10 | L4: of:=SUMPRODUCT([Seguimiento.A2:.A1000]=1;[Seguimiento.K2:.K1000]=2;[Seguimiento.J2:.J1000]="INICIO";[Seguimiento.B2:.B1000]) -> 1899-12-30 | M4: of:=SUMPRODUCT([Seguimiento.A2:.A1000]=1;[Seguimiento.K2:.K1000]=2;[Seguimiento.J2:.J1000]="FIN";[Seguimiento.B2:.B1000]) -> 1899-12-30 | N4: of:=[.D4] -> 2 | O4: of:=IF(ISNUMBER([.F4]);[.F4]+[.O3];"") -> 30
A5: of:=IF(SUMIFS([Seguimiento.$F$2:.$F$1000];[Seguimiento.$H$2:.$H$1000];[.$D5];[Seguimiento.$C$2:.$C$1000];[.A$2])=0;"";SUMIFS([Seguimiento.$F$2:.$F$1000];[Seguimiento.$H$2:.$H$1000];[.$D5];[Seguimiento.$C$2:.$C$1000];[.A$2])) -> 11 | B5: of:=IF(SUMIFS([Seguimiento.$F$2:.$F$1000];[Seguimiento.$H$2:.$H$1000];[.$D5];[Seguimiento.$C$2:.$C$1000];[.B$2])=0;"";SUMIFS([Seguimiento.$F$2:.$F$1000];[Seguimiento.$H$2:.$H$1000];[.$D5];[Seguimiento.$C$2:.$C$1000];[.B$2])) -> 9 | C5: of:=IF(SUMIFS([Seguimiento.$F$2:.$F$1000];[Seguimiento.$H$2:.$H$1000];[.$D5];[Seguimiento.$C$2:.$C$1000];[.C$2])=0;"";SUMIFS([Seguimiento.$F$2:.$F$1000];[Seguimiento.$H$2:.$H$1000];[.$D5];[Seguimiento.$C$2:.$C$1000];[.C$2])) ->  | D5: 3 | E5: Unidad 3 | F5: 20 | G5: of:=IF(SUM([.A5:.C5])>0;SUM([.A5:.C5]);"") -> 20 | H5: of:=SUMPRODUCT([Seguimiento.H2:.H1000]=3;[Seguimiento.I2:.I1000]="INICIO";[Seguimiento.B2:.B1000]) -> 2015-11-18 | I5: of:=SUMPRODUCT([Seguimiento.H2:.H1000]=3;[Seguimiento.I2:.I1000]="FIN";[Seguimiento.B2:.B1000]) -> 2016-01-19 | J5: of:=IF(ISNUMBER([.G5]);SUMPRODUCT([Seguimiento.$K$2:.$K$236]=[.D5];[Seguimiento.$F$2:.$F$236]);"") -> 0 | K5: of:=IF(ISNUMBER([.G5]);[.J5]-[.G5];"") -> -20 | L5: of:=SUMPRODUCT([Seguimiento.A2:.A1000]=1;[Seguimiento.K2:.K1000]=3;[Seguimiento.J2:.J1000]="INICIO";[Seguimiento.B2:.B1000]) -> 1899-12-30 | M5: of:=SUMPRODUCT([Seguimiento.A2:.A1000]=1;[Seguimiento.K2:.K1000]=3;[Seguimiento.J2:.J1000]="FIN";[Seguimiento.B2:.B1000]) -> 1899-12-30 | N5: of:=[.D5] -> 3 | O5: of:=IF(ISNUMBER([.F5]);[.F5]+[.O4];"") -> 50
A6: of:=IF(SUMIFS([Seguimiento.$F$2:.$F$1000];[Seguimiento.$H$2:.$H$1000];[.$D6];[Seguimiento.$C$2:.$C$1000];[.A$2])=0;"";SUMIFS([Seguimiento.$F$2:.$F$1000];[Seguimiento.$H$2:.$H$1000];[.$D6];[Seguimiento.$C$2:.$C$1000];[.A$2])) ->  | B6: of:=IF(SUMIFS([Seguimiento.$F$2:.$F$1000];[Seguimiento.$H$2:.$H$1000];[.$D6];[Seguimiento.$C$2:.$C$1000];[.B$2])=0;"";SUMIFS([Seguimiento.$F$2:.$F$1000];[Seguimiento.$H$2:.$H$1000];[.$D6];[Seguimiento.$C$2:.$C$1000];[.B$2])) -> 30 | C6: of:=IF(SUMIFS([Seguimiento.$F$2:.$F$1000];[Seguimiento.$H$2:.$H$1000];[.$D6];[Seguimiento.$C$2:.$C$1000];[.C$2])=0;"";SUMIFS([Seguimiento.$F$2:.$F$1000];[Seguimiento.$H$2:.$H$1000];[.$D6];[Seguimiento.$C$2:.$C$1000];[.C$2])) ->  | D6: 4 | E6: Unidad 4 | F6: 30 | G6: of:=IF(SUM([.A6:.C6])>0;SUM([.A6:.C6]);"") -> 30 | H6: of:=SUMPRODUCT([Seguimiento.H2:.H1000]=4;[Seguimiento.I2:.I1000]="INICIO";[Seguimiento.B2:.B1000]) -> 2016-01-20 | I6: of:=SUMPRODUCT([Seguimiento.H2:.H1000]=4;[Seguimiento.I2:.I1000]="FIN";[Seguimiento.B2:.B1000]) -> 2016-03-29 | J6: of:=IF(ISNUMBER([.G6]);SUMPRODUCT([Seguimiento.$K$2:.$K$236]=[.D6];[Seguimiento.$F$2:.$F$236]);"") -> 0 | K6: of:=IF(ISNUMBER([.G6]);[.J6]-[.G6];"") -> -30 | L6: of:=SUMPRODUCT([Seguimiento.A2:.A1000]=1;[Seguimiento.K2:.K1000]=4;[Seguimiento.J2:.J1000]="INICIO";[Seguimiento.B2:.B1000]) -> 1899-12-30 | M6: of:=SUMPRODUCT([Seguimiento.A2:.A1000]=1;[Seguimiento.K2:.K1000]=4;[Seguimiento.J2:.J1000]="FIN";[Seguimiento.B2:.B1000]) -> 1899-12-30 | N6: of:=[.D6] -> 4 | O6: of:=IF(ISNUMBER([.F6]);[.F6]+[.O5];"") -> 80
A7: of:=IF(SUMIFS([Seguimiento.$F$2:.$F$1000];[Seguimiento.$H$2:.$H$1000];[.$D7];[Seguimiento.$C$2:.$C$1000];[.A$2])=0;"";SUMIFS([Seguimiento.$F$2:.$F$1000];[Seguimiento.$H$2:.$H$1000];[.$D7];[Seguimiento.$C$2:.$C$1000];[.A$2])) ->  | B7: of:=IF(SUMIFS([Seguimiento.$F$2:.$F$1000];[Seguimiento.$H$2:.$H$1000];[.$D7];[Seguimiento.$C$2:.$C$1000];[.B$2])=0;"";SUMIFS([Seguimiento.$F$2:.$F$1000];[Seguimiento.$H$2:.$H$1000];[.$D7];[Seguimiento.$C$2:.$C$1000];[.B$2])) -> 2 | C7: of:=IF(SUMIFS([Seguimiento.$F$2:.$F$1000];[Seguimiento.$H$2:.$H$1000];[.$D7];[Seguimiento.$C$2:.$C$1000];[.C$2])=0;"";SUMIFS([Seguimiento.$F$2:.$F$1000];[Seguimiento.$H$2:.$H$1000];[.$D7];[Seguimiento.$C$2:.$C$1000];[.C$2])) -> 18 | D7: 5 | E7: Unidad 5 | F7: 20 | G7: of:=IF(SUM([.A7:.C7])>0;SUM([.A7:.C7]);"") -> 20 | H7: of:=SUMPRODUCT([Seguimiento.H2:.H1000]=5;[Seguimiento.I2:.I1000]="INICIO";[Seguimiento.B2:.B1000]) -> 2016-03-30 | I7: of:=SUMPRODUCT([Seguimiento.H2:.H1000]=5;[Seguimiento.I2:.I1000]="FIN";[Seguimiento.B2:.B1000]) -> 2016-05-26 | J7: of:=IF(ISNUMBER([.G7]);SUMPRODUCT([Seguimiento.$K$2:.$K$236]=[.D7];[Seguimiento.$F$2:.$F$236]);"") -> 0 | K7: of:=IF(ISNUMBER([.G7]);[.J7]-[.G7];"") -> -20 | L7: of:=SUMPRODUCT([Seguimiento.A2:.A1000]=1;[Seguimiento.K2:.K1000]=5;[Seguimiento.J2:.J1000]="INICIO";[Seguimiento.B2:.B1000]) -> 1899-12-30 | M7: of:=SUMPRODUCT([Seguimiento.A2:.A1000]=1;[Seguimiento.K2:.K1000]=5;[Seguimiento.J2:.J1000]="FIN";[Seguimiento.B2:.B1000]) -> 1899-12-30 | N7: of:=[.D7] -> 5 | O7: of:=IF(ISNUMBER([.F7]);[.F7]+[.O6];"") -> 100
A8: of:=IF(SUMIFS([Seguimiento.$F$2:.$F$1000];[Seguimiento.$H$2:.$H$1000];[.$D8];[Seguimiento.$C$2:.$C$1000];[.A$2])=0;"";SUMIFS([Seguimiento.$F$2:.$F$1000];[Seguimiento.$H$2:.$H$1000];[.$D8];[Seguimiento.$C$2:.$C$1000];[.A$2])) ->  | B8: of:=IF(SUMIFS([Seguimiento.$F$2:.$F$1000];[Seguimiento.$H$2:.$H$1000];[.$D8];[Seguimiento.$C$2:.$C$1000];[.B$2])=0;"";SUMIFS([Seguimiento.$F$2:.$F$1000];[Seguimiento.$H$2:.$H$1000];[.$D8];[Seguimiento.$C$2:.$C$1000];[.B$2])) ->  | C8: of:=IF(SUMIFS([Seguimiento.$F$2:.$F$1000];[Seguimiento.$H$2:.$H$1000];[.$D8];[Seguimiento.$C$2:.$C$1000];[.C$2])=0;"";SUMIFS([Seguimiento.$F$2:.$F$1000];[Seguimiento.$H$2:.$H$1000];[.$D8];[Seguimiento.$C$2:.$C$1000];[.C$2])) -> 9 | D8: 6 | E8: Unidad 6 | F8: 9 | G8: of:=IF(SUM([.A8:.C8])>0;SUM([.A8:.C8]);"") -> 9 | H8: of:=SUMPRODUCT([Seguimiento.H2:.H1000]=6;[Seguimiento.I2:.I1000]="INICIO";[Seguimiento.B2:.B1000]) -> 2016-05-27 | I8: of:=SUMPRODUCT([Seguimiento.H2:.H1000]=6;[Seguimiento.I2:.I1000]="FIN";[Seguimiento.B2:.B1000]) -> 2016-06-16 | J8: of:=IF(ISNUMBER([.G8]);SUMPRODUCT([Seguimiento.$K$2:.$K$236]=[.D8];[Seguimiento.$F$2:.$F$236]);"") -> 0 | K8: of:=IF(ISNUMBER([.G8]);[.J8]-[.G8];"") -> -9 | L8: of:=SUMPRODUCT([Seguimiento.A2:.A1000]=1;[Seguimiento.K2:.K1000]=6;[Seguimiento.J2:.J1000]="INICIO";[Seguimiento.B2:.B1000]) -> 1899-12-30 | M8: of:=SUMPRODUCT([Seguimiento.A2:.A1000]=1;[Seguimiento.K2:.K1000]=6;[Seguimiento.J2:.J1000]="FIN";[Seguimiento.B2:.B1000]) -> 1899-12-30 | N8: of:=[.D8] -> 6 | O8: of:=IF(ISNUMBER([.F8]);[.F8]+[.O7];"") -> 109
A9: of:=IF(SUMIFS([Seguimiento.$F$2:.$F$1000];[Seguimiento.$H$2:.$H$1000];[.$D9];[Seguimiento.$C$2:.$C$1000];[.A$2])=0;"";SUMIFS([Seguimiento.$F$2:.$F$1000];[Seguimiento.$H$2:.$H$1000];[.$D9];[Seguimiento.$C$2:.$C$1000];[.A$2])) ->  | B9: of:=IF(SUMIFS([Seguimiento.$F$2:.$F$1000];[Seguimiento.$H$2:.$H$1000];[.$D9];[Seguimiento.$C$2:.$C$1000];[.B$2])=0;"";SUMIFS([Seguimiento.$F$2:.$F$1000];[Seguimiento.$H$2:.$H$1000];[.$D9];[Seguimiento.$C$2:.$C$1000];[.B$2])) ->  | C9: of:=IF(SUMIFS([Seguimiento.$F$2:.$F$1000];[Seguimiento.$H$2:.$H$1000];[.$D9];[Seguimiento.$C$2:.$C$1000];[.C$2])=0;"";SUMIFS([Seguimiento.$F$2:.$F$1000];[Seguimiento.$H$2:.$H$1000];[.$D9];[Seguimiento.$C$2:.$C$1000];[.C$2])) ->  | D9: 7 | G9: of:=IF(SUM([.A9:.C9])>0;SUM([.A9:.C9]);"") ->  | H9: of:=SUMPRODUCT([Seguimiento.H2:.H1000]=7;[Seguimiento.I2:.I1000]="INICIO";[Seguimiento.B2:.B1000]) -> 1899-12-30 | I9: of:=SUMPRODUCT([Seguimiento.H2:.H1000]=7;[Seguimiento.I2:.I1000]="FIN";[Seguimiento.B2:.B1000]) -> 1899-12-30 | J9: of:=IF(ISNUMBER([.G9]);SUMPRODUCT([Seguimiento.$K$2:.$K$236]=[.D9];[Seguimiento.$F$2:.$F$236]);"") ->  | K9: of:=IF(ISNUMBER([.G9]);[.J9]-[.G9];"") ->  | L9: of:=SUMPRODUCT([Seguimiento.A2:.A1000]=1;[Seguimiento.K2:.K1000]=7;[Seguimiento.J2:.J1000]="INICIO";[Seguimiento.B2:.B1000]) -> 1899-12-30 | M9: of:=SUMPRODUCT([Seguimiento.A2:.A1000]=1;[Seguimiento.K2:.K1000]=7;[Seguimiento.J2:.J1000]="FIN";[Seguimiento.B2:.B1000]) -> 1899-12-30 | N9: of:=[.D9] -> 7 | O9: of:=IF(ISNUMBER([.F9]);[.F9]+[.O8];"") -> 
A10: of:=IF(SUMIFS([Seguimiento.$F$2:.$F$1000];[Seguimiento.$H$2:.$H$1000];[.$D10];[Seguimiento.$C$2:.$C$1000];[.A$2])=0;"";SUMIFS([Seguimiento.$F$2:.$F$1000];[Seguimiento.$H$2:.$H$1000];[.$D10];[Seguimiento.$C$2:.$C$1000];[.A$2])) ->  | B10: of:=IF(SUMIFS([Seguimiento.$F$2:.$F$1000];[Seguimiento.$H$2:.$H$1000];[.$D10];[Seguimiento.$C$2:.$C$1000];[.B$2])=0;"";SUMIFS([Seguimiento.$F$2:.$F$1000];[Seguimiento.$H$2:.$H$1000];[.$D10];[Seguimiento.$C$2:.$C$1000];[.B$2])) ->  | C10: of:=IF(SUMIFS([Seguimiento.$F$2:.$F$1000];[Seguimiento.$H$2:.$H$1000];[.$D10];[Seguimiento.$C$2:.$C$1000];[.C$2])=0;"";SUMIFS([Seguimiento.$F$2:.$F$1000];[Seguimiento.$H$2:.$H$1000];[.$D10];[Seguimiento.$C$2:.$C$1000];[.C$2])) ->  | D10: 8 | G10: of:=IF(SUM([.A10:.C10])>0;SUM([.A10:.C10]);"") ->  | H10: of:=SUMPRODUCT([Seguimiento.H2:.H1000]=8;[Seguimiento.I2:.I1000]="INICIO";[Seguimiento.B2:.B1000]) -> 1899-12-30 | I10: of:=SUMPRODUCT([Seguimiento.H2:.H1000]=8;[Seguimiento.I2:.I1000]="FIN";[Seguimiento.B2:.B1000]) -> 1899-12-30 | J10: of:=IF(ISNUMBER([.G10]);SUMPRODUCT([Seguimiento.$K$2:.$K$236]=[.D10];[Seguimiento.$F$2:.$F$236]);"") ->  | K10: of:=IF(ISNUMBER([.G10]);[.J10]-[.G10];"") ->  | L10: of:=SUMPRODUCT([Seguimiento.A2:.A1000]=1;[Seguimiento.K2:.K1000]=8;[Seguimiento.J2:.J1000]="INICIO";[Seguimiento.B2:.B1000]) -> 1899-12-30 | M10: of:=SUMPRODUCT([Seguimiento.A2:.A1000]=1;[Seguimiento.K2:.K1000]=8;[Seguimiento.J2:.J1000]="FIN";[Seguimiento.B2:.B1000]) -> 1899-12-30 | N10: of:=[.D10] -> 8 | O10: of:=IF(ISNUMBER([.F10]);[.F10]+[.O9];"") -> 
A11: of:=IF(SUMIFS([Seguimiento.$F$2:.$F$1000];[Seguimiento.$H$2:.$H$1000];[.$D11];[Seguimiento.$C$2:.$C$1000];[.A$2])=0;"";SUMIFS([Seguimiento.$F$2:.$F$1000];[Seguimiento.$H$2:.$H$1000];[.$D11];[Seguimiento.$C$2:.$C$1000];[.A$2])) ->  | B11: of:=IF(SUMIFS([Seguimiento.$F$2:.$F$1000];[Seguimiento.$H$2:.$H$1000];[.$D11];[Seguimiento.$C$2:.$C$1000];[.B$2])=0;"";SUMIFS([Seguimiento.$F$2:.$F$1000];[Seguimiento.$H$2:.$H$1000];[.$D11];[Seguimiento.$C$2:.$C$1000];[.B$2])) ->  | C11: of:=IF(SUMIFS([Seguimiento.$F$2:.$F$1000];[Seguimiento.$H$2:.$H$1000];[.$D11];[Seguimiento.$C$2:.$C$1000];[.C$2])=0;"";SUMIFS([Seguimiento.$F$2:.$F$1000];[Seguimiento.$H$2:.$H$1000];[.$D11];[Seguimiento.$C$2:.$C$1000];[.C$2])) ->  | D11: 9 | G11: of:=IF(SUM([.A11:.C11])>0;SUM([.A11:.C11]);"") ->  | H11: of:=SUMPRODUCT([Seguimiento.H2:.H1000]=9;[Seguimiento.I2:.I1000]="INICIO";[Seguimiento.B2:.B1000]) -> 1899-12-30 | I11: of:=SUMPRODUCT([Seguimiento.H2:.H1000]=9;[Seguimiento.I2:.I1000]="FIN";[Seguimiento.B2:.B1000]) -> 1899-12-30 | J11: of:=IF(ISNUMBER([.G11]);SUMPRODUCT([Seguimiento.$K$2:.$K$236]=[.D11];[Seguimiento.$F$2:.$F$236]);"") ->  | K11: of:=IF(ISNUMBER([.G11]);[.J11]-[.G11];"") ->  | L11: of:=SUMPRODUCT([Seguimiento.A2:.A1000]=1;[Seguimiento.K2:.K1000]=9;[Seguimiento.J2:.J1000]="INICIO";[Seguimiento.B2:.B1000]) -> 1899-12-30 | M11: of:=SUMPRODUCT([Seguimiento.A2:.A1000]=1;[Seguimiento.K2:.K1000]=9;[Seguimiento.J2:.J1000]="FIN";[Seguimiento.B2:.B1000]) -> 1899-12-30 | N11: of:=[.D11] -> 9 | O11: of:=IF(ISNUMBER([.F11]);[.F11]+[.O10];"") -> 
A12: of:=IF(SUMIFS([Seguimiento.$F$2:.$F$1000];[Seguimiento.$H$2:.$H$1000];[.$D12];[Seguimiento.$C$2:.$C$1000];[.A$2])=0;"";SUMIFS([Seguimiento.$F$2:.$F$1000];[Seguimiento.$H$2:.$H$1000];[.$D12];[Seguimiento.$C$2:.$C$1000];[.A$2])) ->  | B12: of:=IF(SUMIFS([Seguimiento.$F$2:.$F$1000];[Seguimiento.$H$2:.$H$1000];[.$D12];[Seguimiento.$C$2:.$C$1000];[.B$2])=0;"";SUMIFS([Seguimiento.$F$2:.$F$1000];[Seguimiento.$H$2:.$H$1000];[.$D12];[Seguimiento.$C$2:.$C$1000];[.B$2])) ->  | C12: of:=IF(SUMIFS([Seguimiento.$F$2:.$F$1000];[Seguimiento.$H$2:.$H$1000];[.$D12];[Seguimiento.$C$2:.$C$1000];[.C$2])=0;"";SUMIFS([Seguimiento.$F$2:.$F$1000];[Seguimiento.$H$2:.$H$1000];[.$D12];[Seguimiento.$C$2:.$C$1000];[.C$2])) ->  | D12: 10 | G12: of:=IF(SUM([.A12:.C12])>0;SUM([.A12:.C12]);"") ->  | H12: of:=SUMPRODUCT([Seguimiento.H2:.H1000]=10;[Seguimiento.I2:.I1000]="INICIO";[Seguimiento.B2:.B1000]) -> 1899-12-30 | I12: of:=SUMPRODUCT([Seguimiento.H2:.H1000]=10;[Seguimiento.I2:.I1000]="FIN";[Seguimiento.B2:.B1000]) -> 1899-12-30 | J12: of:=IF(ISNUMBER([.G12]);SUMPRODUCT([Seguimiento.$K$2:.$K$236]=[.D12];[Seguimiento.$F$2:.$F$236]);"") ->  | K12: of:=IF(ISNUMBER([.G12]);[.J12]-[.G12];"") ->  | L12: of:=SUMPRODUCT([Seguimiento.A2:.A1000]=1;[Seguimiento.K2:.K1000]=10;[Seguimiento.J2:.J1000]="INICIO";[Seguimiento.B2:.B1000]) -> 1899-12-30 | M12: of:=SUMPRODUCT([Seguimiento.A2:.A1000]=1;[Seguimiento.K2:.K1000]=10;[Seguimiento.J2:.J1000]="FIN";[Seguimiento.B2:.B1000]) -> 1899-12-30 | N12: of:=[.D12] -> 10 | O12: of:=IF(ISNUMBER([.F12]);[.F12]+[.O11];"") -> 
A13: of:=IF(SUMIFS([Seguimiento.$F$2:.$F$1000];[Seguimiento.$H$2:.$H$1000];[.$D13];[Seguimiento.$C$2:.$C$1000];[.A$2])=0;"";SUMIFS([Seguimiento.$F$2:.$F$1000];[Seguimiento.$H$2:.$H$1000];[.$D13];[Seguimiento.$C$2:.$C$1000];[.A$2])) ->  | B13: of:=IF(SUMIFS([Seguimiento.$F$2:.$F$1000];[Seguimiento.$H$2:.$H$1000];[.$D13];[Seguimiento.$C$2:.$C$1000];[.B$2])=0;"";SUMIFS([Seguimiento.$F$2:.$F$1000];[Seguimiento.$H$2:.$H$1000];[.$D13];[Seguimiento.$C$2:.$C$1000];[.B$2])) ->  | C13: of:=IF(SUMIFS([Seguimiento.$F$2:.$F$1000];[Seguimiento.$H$2:.$H$1000];[.$D13];[Seguimiento.$C$2:.$C$1000];[.C$2])=0;"";SUMIFS([Seguimiento.$F$2:.$F$1000];[Seguimiento.$H$2:.$H$1000];[.$D13];[Seguimiento.$C$2:.$C$1000];[.C$2])) ->  | D13: 11 | G13: of:=IF(SUM([.A13:.C13])>0;SUM([.A13:.C13]);"") ->  | H13: of:=SUMPRODUCT([Seguimiento.H2:.H1000]=11;[Seguimiento.I2:.I1000]="INICIO";[Seguimiento.B2:.B1000]) -> 1899-12-30 | I13: of:=SUMPRODUCT([Seguimiento.H2:.H1000]=11;[Seguimiento.I2:.I1000]="FIN";[Seguimiento.B2:.B1000]) -> 1899-12-30 | J13: of:=IF(ISNUMBER([.G13]);SUMPRODUCT([Seguimiento.$K$2:.$K$236]=[.D13];[Seguimiento.$F$2:.$F$236]);"") ->  | K13: of:=IF(ISNUMBER([.G13]);[.J13]-[.G13];"") ->  | L13: of:=SUMPRODUCT([Seguimiento.A2:.A1000]=1;[Seguimiento.K2:.K1000]=11;[Seguimiento.J2:.J1000]="INICIO";[Seguimiento.B2:.B1000]) -> 1899-12-30 | M13: of:=SUMPRODUCT([Seguimiento.A2:.A1000]=1;[Seguimiento.K2:.K1000]=11;[Seguimiento.J2:.J1000]="FIN";[Seguimiento.B2:.B1000]) -> 1899-12-30 | N13: of:=[.D13] -> 11 | O13: of:=IF(ISNUMBER([.F13]);[.F13]+[.O12];"") -> 
A14: of:=IF(SUMIFS([Seguimiento.$F$2:.$F$1000];[Seguimiento.$H$2:.$H$1000];[.$D14];[Seguimiento.$C$2:.$C$1000];[.A$2])=0;"";SUMIFS([Seguimiento.$F$2:.$F$1000];[Seguimiento.$H$2:.$H$1000];[.$D14];[Seguimiento.$C$2:.$C$1000];[.A$2])) ->  | B14: of:=IF(SUMIFS([Seguimiento.$F$2:.$F$1000];[Seguimiento.$H$2:.$H$1000];[.$D14];[Seguimiento.$C$2:.$C$1000];[.B$2])=0;"";SUMIFS([Seguimiento.$F$2:.$F$1000];[Seguimiento.$H$2:.$H$1000];[.$D14];[Seguimiento.$C$2:.$C$1000];[.B$2])) ->  | C14: of:=IF(SUMIFS([Seguimiento.$F$2:.$F$1000];[Seguimiento.$H$2:.$H$1000];[.$D14];[Seguimiento.$C$2:.$C$1000];[.C$2])=0;"";SUMIFS([Seguimiento.$F$2:.$F$1000];[Seguimiento.$H$2:.$H$1000];[.$D14];[Seguimiento.$C$2:.$C$1000];[.C$2])) ->  | D14: 12 | G14: of:=IF(SUM([.A14:.C14])>0;SUM([.A14:.C14]);"") ->  | H14: of:=SUMPRODUCT([Seguimiento.H2:.H1000]=12;[Seguimiento.I2:.I1000]="INICIO";[Seguimiento.B2:.B1000]) -> 1899-12-30 | I14: of:=SUMPRODUCT([Seguimiento.H2:.H1000]=12;[Seguimiento.I2:.I1000]="FIN";[Seguimiento.B2:.B1000]) -> 1899-12-30 | J14: of:=IF(ISNUMBER([.G14]);SUMPRODUCT([Seguimiento.$K$2:.$K$236]=[.D14];[Seguimiento.$F$2:.$F$236]);"") ->  | K14: of:=IF(ISNUMBER([.G14]);[.J14]-[.G14];"") ->  | L14: of:=SUMPRODUCT([Seguimiento.A2:.A1000]=1;[Seguimiento.K2:.K1000]=12;[Seguimiento.J2:.J1000]="INICIO";[Seguimiento.B2:.B1000]) -> 1899-12-30 | M14: of:=SUMPRODUCT([Seguimiento.A2:.A1000]=1;[Seguimiento.K2:.K1000]=12;[Seguimiento.J2:.J1000]="FIN";[Seguimiento.B2:.B1000]) -> 1899-12-30 | N14: of:=[.D14] -> 12 | O14: of:=IF(ISNUMBER([.F14]);[.F14]+[.O13];"") -> 
A15: of:=IF(SUMIFS([Seguimiento.$F$2:.$F$1000];[Seguimiento.$H$2:.$H$1000];[.$D15];[Seguimiento.$C$2:.$C$1000];[.A$2])=0;"";SUMIFS([Seguimiento.$F$2:.$F$1000];[Seguimiento.$H$2:.$H$1000];[.$D15];[Seguimiento.$C$2:.$C$1000];[.A$2])) ->  | B15: of:=IF(SUMIFS([Seguimiento.$F$2:.$F$1000];[Seguimiento.$H$2:.$H$1000];[.$D15];[Seguimiento.$C$2:.$C$1000];[.B$2])=0;"";SUMIFS([Seguimiento.$F$2:.$F$1000];[Seguimiento.$H$2:.$H$1000];[.$D15];[Seguimiento.$C$2:.$C$1000];[.B$2])) ->  | C15: of:=IF(SUMIFS([Seguimiento.$F$2:.$F$1000];[Seguimiento.$H$2:.$H$1000];[.$D15];[Seguimiento.$C$2:.$C$1000];[.C$2])=0;"";SUMIFS([Seguimiento.$F$2:.$F$1000];[Seguimiento.$H$2:.$H$1000];[.$D15];[Seguimiento.$C$2:.$C$1000];[.C$2])) ->  | D15: 13 | G15: of:=IF(SUM([.A15:.C15])>0;SUM([.A15:.C15]);"") ->  | H15: of:=SUMPRODUCT([Seguimiento.H2:.H1000]=13;[Seguimiento.I2:.I1000]="INICIO";[Seguimiento.B2:.B1000]) -> 1899-12-30 | I15: of:=SUMPRODUCT([Seguimiento.H2:.H1000]=13;[Seguimiento.I2:.I1000]="FIN";[Seguimiento.B2:.B1000]) -> 1899-12-30 | J15: of:=IF(ISNUMBER([.G15]);SUMPRODUCT([Seguimiento.$K$2:.$K$236]=[.D15];[Seguimiento.$F$2:.$F$236]);"") ->  | K15: of:=IF(ISNUMBER([.G15]);[.J15]-[.G15];"") ->  | L15: of:=SUMPRODUCT([Seguimiento.A2:.A1000]=1;[Seguimiento.K2:.K1000]=13;[Seguimiento.J2:.J1000]="INICIO";[Seguimiento.B2:.B1000]) -> 1899-12-30 | M15: of:=SUMPRODUCT([Seguimiento.A2:.A1000]=1;[Seguimiento.K2:.K1000]=13;[Seguimiento.J2:.J1000]="FIN";[Seguimiento.B2:.B1000]) -> 1899-12-30 | N15: of:=[.D15] -> 13 | O15: of:=IF(ISNUMBER([.F15]);[.F15]+[.O14];"") -> 
A16: of:=IF(SUMIFS([Seguimiento.$F$2:.$F$1000];[Seguimiento.$H$2:.$H$1000];[.$D16];[Seguimiento.$C$2:.$C$1000];[.A$2])=0;"";SUMIFS([Seguimiento.$F$2:.$F$1000];[Seguimiento.$H$2:.$H$1000];[.$D16];[Seguimiento.$C$2:.$C$1000];[.A$2])) ->  | B16: of:=IF(SUMIFS([Seguimiento.$F$2:.$F$1000];[Seguimiento.$H$2:.$H$1000];[.$D16];[Seguimiento.$C$2:.$C$1000];[.B$2])=0;"";SUMIFS([Seguimiento.$F$2:.$F$1000];[Seguimiento.$H$2:.$H$1000];[.$D16];[Seguimiento.$C$2:.$C$1000];[.B$2])) ->  | C16: of:=IF(SUMIFS([Seguimiento.$F$2:.$F$1000];[Seguimiento.$H$2:.$H$1000];[.$D16];[Seguimiento.$C$2:.$C$1000];[.C$2])=0;"";SUMIFS([Seguimiento.$F$2:.$F$1000];[Seguimiento.$H$2:.$H$1000];[.$D16];[Seguimiento.$C$2:.$C$1000];[.C$2])) ->  | D16: 14 | G16: of:=IF(SUM([.A16:.C16])>0;SUM([.A16:.C16]);"") ->  | H16: of:=SUMPRODUCT([Seguimiento.H2:.H1000]=14;[Seguimiento.I2:.I1000]="INICIO";[Seguimiento.B2:.B1000]) -> 1899-12-30 | I16: of:=SUMPRODUCT([Seguimiento.H2:.H1000]=14;[Seguimiento.I2:.I1000]="FIN";[Seguimiento.B2:.B1000]) -> 1899-12-30 | J16: of:=IF(ISNUMBER([.G16]);SUMPRODUCT([Seguimiento.$K$2:.$K$236]=[.D16];[Seguimiento.$F$2:.$F$236]);"") ->  | K16: of:=IF(ISNUMBER([.G16]);[.J16]-[.G16];"") ->  | L16: of:=SUMPRODUCT([Seguimiento.A2:.A1000]=1;[Seguimiento.K2:.K1000]=14;[Seguimiento.J2:.J1000]="INICIO";[Seguimiento.B2:.B1000]) -> 1899-12-30 | M16: of:=SUMPRODUCT([Seguimiento.A2:.A1000]=1;[Seguimiento.K2:.K1000]=14;[Seguimiento.J2:.J1000]="FIN";[Seguimiento.B2:.B1000]) -> 1899-12-30 | N16: of:=[.D16] -> 14 | O16: of:=IF(ISNUMBER([.F16]);[.F16]+[.O15];"") -> 
A17: of:=IF(SUMIFS([Seguimiento.$F$2:.$F$1000];[Seguimiento.$H$2:.$H$1000];[.$D17];[Seguimiento.$C$2:.$C$1000];[.A$2])=0;"";SUMIFS([Seguimiento.$F$2:.$F$1000];[Seguimiento.$H$2:.$H$1000];[.$D17];[Seguimiento.$C$2:.$C$1000];[.A$2])) ->  | B17: of:=IF(SUMIFS([Seguimiento.$F$2:.$F$1000];[Seguimiento.$H$2:.$H$1000];[.$D17];[Seguimiento.$C$2:.$C$1000];[.B$2])=0;"";SUMIFS([Seguimiento.$F$2:.$F$1000];[Seguimiento.$H$2:.$H$1000];[.$D17];[Seguimiento.$C$2:.$C$1000];[.B$2])) ->  | C17: of:=IF(SUMIFS([Seguimiento.$F$2:.$F$1000];[Seguimiento.$H$2:.$H$1000];[.$D17];[Seguimiento.$C$2:.$C$1000];[.C$2])=0;"";SUMIFS([Seguimiento.$F$2:.$F$1000];[Seguimiento.$H$2:.$H$1000];[.$D17];[Seguimiento.$C$2:.$C$1000];[.C$2])) ->  | D17: 15 | G17: of:=IF(SUM([.A17:.C17])>0;SUM([.A17:.C17]);"") ->  | H17: of:=SUMPRODUCT([Seguimiento.H2:.H1000]=15;[Seguimiento.I2:.I1000]="INICIO";[Seguimiento.B2:.B1000]) -> 1899-12-30 | I17: of:=SUMPRODUCT([Seguimiento.H2:.H1000]=15;[Seguimiento.I2:.I1000]="FIN";[Seguimiento.B2:.B1000]) -> 1899-12-30 | J17: of:=IF(ISNUMBER([.G17]);SUMPRODUCT([Seguimiento.$K$2:.$K$236]=[.D17];[Seguimiento.$F$2:.$F$236]);"") ->  | K17: of:=IF(ISNUMBER([.G17]);[.J17]-[.G17];"") ->  | L17: of:=SUMPRODUCT([Seguimiento.A2:.A1000]=1;[Seguimiento.K2:.K1000]=15;[Seguimiento.J2:.J1000]="INICIO";[Seguimiento.B2:.B1000]) -> 1899-12-30 | M17: of:=SUMPRODUCT([Seguimiento.A2:.A1000]=1;[Seguimiento.K2:.K1000]=15;[Seguimiento.J2:.J1000]="FIN";[Seguimiento.B2:.B1000]) -> 1899-12-30 | N17: of:=[.D17] -> 15 | O17: of:=IF(ISNUMBER([.F17]);[.F17]+[.O16];"") -> 
A18: of:=SUM([.A3:.A17]) -> 41 | B18: of:=SUM([.B3:.B17]) -> 41 | C18: of:=SUM([.C3:.C17]) -> 27 | D18: of:=COUNTIF([.F3:.F17];">0") -> 6 | E18: Total planificadas | F18: of:=SUM([.F3:.F17]) -> 109 | G18: of:=SUM([.G3:.G17]) -> 109
G22: Horas Disponibles | H22: Horas Planificadas | I22: Horas por Planificar | J22: Horas Realizadas | K22: Desviación Planificación Inicial
F23: 1er trimestre | G23: of:=SUMPRODUCT([Seguimiento.B2:.B1000]<=[Calendario.F9];[Seguimiento.B2:.B1000]>=[Calendario.F8];[Seguimiento.F2:.F1000]) -> 41 | H23: of:=[.A18] -> 41 | I23: of:=[.G23]-[.H23] -> 0 | J23: of:=SUMPRODUCT([Seguimiento.$C$2:.$C$1000]=1;[Seguimiento.$K$2:.$K$1000]>0;[Seguimiento.$F$2:.$F$1000]) -> 0 | K23: of:=IF(ISNUMBER([.H23]);[.J23]-[.H23];"") -> -41
F24: 2º trimestre | G24: of:=SUMPRODUCT([Seguimiento.B2:.B1000]<=[Calendario.F13];[Seguimiento.B2:.B1000]>=[Calendario.F12];[Seguimiento.F2:.F1000]) -> 41 | H24: of:=[.B18] -> 41 | I24: of:=[.G24]-[.H24] -> 0 | J24: of:=SUMPRODUCT([Seguimiento.$C$2:.$C$1000]=2;[Seguimiento.$K$2:.$K$1000]>0;[Seguimiento.$F$2:.$F$1000]) -> 0 | K24: of:=IF(ISNUMBER([.H24]);[.J24]-[.H24];"") -> -41
F25: 3er trimestre | G25: of:=SUMPRODUCT([Seguimiento.B2:.B1000]<=[Calendario.F17];[Seguimiento.B2:.B1000]>=[Calendario.F16];[Seguimiento.F2:.F1000]) -> 27 | H25: of:=[.C18] -> 27 | I25: of:=[.G25]-[.H25] -> 0 | J25: of:=SUMPRODUCT([Seguimiento.$C$2:.$C$1000]=3;[Seguimiento.$K$2:.$K$1000]>0;[Seguimiento.$F$2:.$F$1000]) -> 0 | K25: of:=IF(ISNUMBER([.H25]);[.J25]-[.H25];"") -> -27
F26: Total | G26: of:=SUM([Seguimiento.F2:.F1000]) -> 109 | H26: of:=SUM([.H23:.H25]) -> 109 | I26: of:=[.G26]-[.H26] -> 0 | J26: of:=SUM([.J23:.J25]) -> 0 | K26: of:=[.G26]-[.H26] -> 0

Sheet: Seguimiento
A1: dada | B1: día | C1: Evaluación | D1: Tipo | E1: Dia Semana | F1: Horas | G1: Subotal horas | H1: Unidad Planificada | I1: Unidad planificada | J1: Unidad realizada | K1: Unidad Realizada | L1: Actividad
A2: of:=IF([.B2]<>"";TODAY()>[.B2];"") -> 0 | B2: of:=[Calendario.F4] -> 2015-09-07 | C2: of:=IF(AND([.B2]>=[Calendario.$F$8];[.B2]<=[Calendario.$F$9];1);1;IF(AND([.B2]>=[Calendario.$F$12];[.B2]<=[Calendario.$F$13]);2;IF(AND([.B2]>=[Calendario.$F$16];[.B2]<=[Calendario.$F$17]);3;""))) -> 1 | D2: of:=IF(COUNTIF([Calendario.$H$4:.$H$48];[.B2])>0;"FIESTA";"") ->  | E2: of:=IF([.B2]<>"";VLOOKUP(WEEKDAY([.B2];3);[Calendario.$A$4:.$C$11];2);"") -> Lunes | F2: of:=IF([.B2]<>"";IF([.D2]<>"FIESTA";VLOOKUP(WEEKDAY([.B2];3);[Calendario.$A$4:.$C$11];3);0);"") -> 1 | G2: of:=[.F2] -> 1 | H2: of:=IF(AND([.G2]<=[Unidades.$G$26];[.G2]<=[Unidades.$F$18];[Unidades.$F$18]>0);[Unidades.$D$18]+1-COUNTIFS([Unidades.$O$3:.$O$17];">="&[.G2]);"") -> 1 | I2: of:=IF([.H1]<>[.H2];"INICIO";IF([.H3]<>[.H2];"FIN";"")) -> INICIO | J2: of:=IF([.K1]<>[.K2];"INICIO";IF([.K3]<>[.K2];"FIN";"")) -> INICIO
A3: of:=IF([.B3]<>"";TODAY()>[.B3];"") -> 0 | B3: of:=IFERROR(IF(AND(ISNUMBER([.B2]);([.B2]+1)<[Calendario.$F$5]);[.B2]+1;"");"") -> 2015-09-08 | C3: of:=IF(AND([.B3]>=[Calendario.$F$8];[.B3]<=[Calendario.$F$9];1);1;IF(AND([.B3]>=[Calendario.$F$12];[.B3]<=[Calendario.$F$13]);2;IF(AND([.B3]>=[Calendario.$F$16];[.B3]<=[Calendario.$F$17]);3;""))) -> 1 | D3: of:=IF(COUNTIF([Calendario.$H$4:.$H$48];[.B3])>0;"FIESTA";"") ->  | E3: of:=IF([.B3]<>"";VLOOKUP(WEEKDAY([.B3];3);[Calendario.$A$4:.$C$11];2);"") -> Martes | F3: of:=IF([.B3]<>"";IF([.D3]<>"FIESTA";VLOOKUP(WEEKDAY([.B3];3);[Calendario.$A$4:.$C$11];3);0);"") -> 0 | G3: of:=IF(ISNUMBER([.F3]);[.F3]+[.G2];"") -> 1 | H3: of:=IF(AND([.G3]<=[Unidades.$G$26];[.G3]<=[Unidades.$F$18];[Unidades.$F$18]>0);[Unidades.$D$18]+1-COUNTIFS([Unidades.$O$3:.$O$17];">="&[.G3]);"") -> 1 | I3: of:=IF([.H2]<>[.H3];"INICIO";IF([.H4]<>[.H3];"FIN";"")) ->  | J3: of:=IF([.K2]<>[.K3];"INICIO";IF([.K4]<>[.K3];"FIN";"")) -> 
A4: of:=IF([.B4]<>"";TODAY()>[.B4];"") -> 0 | B4: of:=IFERROR(IF(AND(ISNUMBER([.B3]);([.B3]+1)<[Calendario.$F$5]);[.B3]+1;"");"") -> 2015-09-09 | C4: of:=IF(AND([.B4]>=[Calendario.$F$8];[.B4]<=[Calendario.$F$9];1);1;IF(AND([.B4]>=[Calendario.$F$12];[.B4]<=[Calendario.$F$13]);2;IF(AND([.B4]>=[Calendario.$F$16];[.B4]<=[Calendario.$F$17]);3;""))) -> 1 | D4: of:=IF(COUNTIF([Calendario.$H$4:.$H$48];[.B4])>0;"FIESTA";"") ->  | E4: of:=IF([.B4]<>"";VLOOKUP(WEEKDAY([.B4];3);[Calendario.$A$4:.$C$11];2);"") -> Miercoles | F4: of:=IF([.B4]<>"";IF([.D4]<>"FIESTA";VLOOKUP(WEEKDAY([.B4];3);[Calendario.$A$4:.$C$11];3);0);"") -> 1 | G4: of:=IF(ISNUMBER([.F4]);[.F4]+[.G3];"") -> 2 | H4: of:=IF(AND([.G4]<=[Unidades.$G$26];[.G4]<=[Unidades.$F$18];[Unidades.$F$18]>0);[Unidades.$D$18]+1-COUNTIFS([Unidades.$O$3:.$O$17];">="&[.G4]);"") -> 1 | I4: of:=IF([.H3]<>[.H4];"INICIO";IF([.H5]<>[.H4];"FIN";"")) ->  | J4: of:=IF([.K3]<>[.K4];"INICIO";IF([.K5]<>[.K4];"FIN";"")) -> 
A5: of:=IF([.B5]<>"";TODAY()>[.B5];"") -> 0 | B5: of:=IFERROR(IF(AND(ISNUMBER([.B4]);([.B4]+1)<[Calendario.$F$5]);[.B4]+1;"");"") -> 2015-09-10 | C5: of:=IF(AND([.B5]>=[Calendario.$F$8];[.B5]<=[Calendario.$F$9];1);1;IF(AND([.B5]>=[Calendario.$F$12];[.B5]<=[Calendario.$F$13]);2;IF(AND([.B5]>=[Calendario.$F$16];[.B5]<=[Calendario.$F$17]);3;""))) -> 1 | D5: of:=IF(COUNTIF([Calendario.$H$4:.$H$48];[.B5])>0;"FIESTA";"") ->  | E5: of:=IF([.B5]<>"";VLOOKUP(WEEKDAY([.B5];3);[Calendario.$A$4:.$C$11];2);"") -> Jueves | F5: of:=IF([.B5]<>"";IF([.D5]<>"FIESTA";VLOOKUP(WEEKDAY([.B5];3);[Calendario.$A$4:.$C$11];3);0);"") -> 0 | G5: of:=IF(ISNUMBER([.F5]);[.F5]+[.G4];"") -> 2 | H5: of:=IF(AND([.G5]<=[Unidades.$G$26];[.G5]<=[Unidades.$F$18];[Unidades.$F$18]>0);[Unidades.$D$18]+1-COUNTIFS([Unidades.$O$3:.$O$17];">="&[.G5]);"") -> 1 | I5: of:=IF([.H4]<>[.H5];"INICIO";IF([.H6]<>[.H5];"FIN";"")) ->  | J5: of:=IF([.K4]<>[.K5];"INICIO";IF([.K6]<>[.K5];"FIN";"")) -> 
A6: of:=IF([.B6]<>"";TODAY()>[.B6];"") -> 0 | B6: of:=IFERROR(IF(AND(ISNUMBER([.B5]);([.B5]+1)<[Calendario.$F$5]);[.B5]+1;"");"") -> 2015-09-11 | C6: of:=IF(AND([.B6]>=[Calendario.$F$8];[.B6]<=[Calendario.$F$9];1);1;IF(AND([.B6]>=[Calendario.$F$12];[.B6]<=[Calendario.$F$13]);2;IF(AND([.B6]>=[Calendario.$F$16];[.B6]<=[Calendario.$F$17]);3;""))) -> 1 | D6: of:=IF(COUNTIF([Calendario.$H$4:.$H$48];[.B6])>0;"FIESTA";"") ->  | E6: of:=IF([.B6]<>"";VLOOKUP(WEEKDAY([.B6];3);[Calendario.$A$4:.$C$11];2);"") -> Viernes | F6: of:=IF([.B6]<>"";IF([.D6]<>"FIESTA";VLOOKUP(WEEKDAY([.B6];3);[Calendario.$A$4:.$C$11];3);0);"") -> 1 | G6: of:=IF(ISNUMBER([.F6]);[.F6]+[.G5];"") -> 3 | H6: of:=IF(AND([.G6]<=[Unidades.$G$26];[.G6]<=[Unidades.$F$18];[Unidades.$F$18]>0);[Unidades.$D$18]+1-COUNTIFS([Unidades.$O$3:.$O$17];">="&[.G6]);"") -> 1 | I6: of:=IF([.H5]<>[.H6];"INICIO";IF([.H7]<>[.H6];"FIN";"")) ->  | J6: of:=IF([.K5]<>[.K6];"INICIO";IF([.K7]<>[.K6];"FIN";"")) -> 
A7: of:=IF([.B7]<>"";TODAY()>[.B7];"") -> 0 | B7: of:=IFERROR(IF(AND(ISNUMBER([.B6]);([.B6]+1)<[Calendario.$F$5]);[.B6]+1;"");"") -> 2015-09-12 | C7: of:=IF(AND([.B7]>=[Calendario.$F$8];[.B7]<=[Calendario.$F$9];1);1;IF(AND([.B7]>=[Calendario.$F$12];[.B7]<=[Calendario.$F$13]);2;IF(AND([.B7]>=[Calendario.$F$16];[.B7]<=[Calendario.$F$17]);3;""))) -> 1 | D7: of:=IF(COUNTIF([Calendario.$H$4:.$H$48];[.B7])>0;"FIESTA";"") ->  | E7: of:=IF([.B7]<>"";VLOOKUP(WEEKDAY([.B7];3);[Calendario.$A$4:.$C$11];2);"") -> Sabado | F7: of:=IF([.B7]<>"";IF([.D7]<>"FIESTA";VLOOKUP(WEEKDAY([.B7];3);[Calendario.$A$4:.$C$11];3);0);"") -> 0 | G7: of:=IF(ISNUMBER([.F7]);[.F7]+[.G6];"") -> 3 | H7: of:=IF(AND([.G7]<=[Unidades.$G$26];[.G7]<=[Unidades.$F$18];[Unidades.$F$18]>0);[Unidades.$D$18]+1-COUNTIFS([Unidades.$O$3:.$O$17];">="&[.G7]);"") -> 1 | I7: of:=IF([.H6]<>[.H7];"INICIO";IF([.H8]<>[.H7];"FIN";"")) ->  | J7: of:=IF([.K6]<>[.K7];"INICIO";IF([.K8]<>[.K7];"FIN";"")) -> 
A8: of:=IF([.B8]<>"";TODAY()>[.B8];"") -> 0 | B8: of:=IFERROR(IF(AND(ISNUMBER([.B7]);([.B7]+1)<[Calendario.$F$5]);[.B7]+1;"");"") -> 2015-09-13 | C8: of:=IF(AND([.B8]>=[Calendario.$F$8];[.B8]<=[Calendario.$F$9];1);1;IF(AND([.B8]>=[Calendario.$F$12];[.B8]<=[Calendario.$F$13]);2;IF(AND([.B8]>=[Calendario.$F$16];[.B8]<=[Calendario.$F$17]);3;""))) -> 1 | D8: of:=IF(COUNTIF([Calendario.$H$4:.$H$48];[.B8])>0;"FIESTA";"") ->  | E8: of:=IF([.B8]<>"";VLOOKUP(WEEKDAY([.B8];3);[Calendario.$A$4:.$C$11];2);"") -> Domingo | F8: of:=IF([.B8]<>"";IF([.D8]<>"FIESTA";VLOOKUP(WEEKDAY([.B8];3);[Calendario.$A$4:.$C$11];3);0);"") -> 0 | G8: of:=IF(ISNUMBER([.F8]);[.F8]+[.G7];"") -> 3 | H8: of:=IF(AND([.G8]<=[Unidades.$G$26];[.G8]<=[Unidades.$F$18];[Unidades.$F$18]>0);[Unidades.$D$18]+1-COUNTIFS([Unidades.$O$3:.$O$17];">="&[.G8]);"") -> 1 | I8: of:=IF([.H7]<>[.H8];"INICIO";IF([.H9]<>[.H8];"FIN";"")) ->  | J8: of:=IF([.K7]<>[.K8];"INICIO";IF([.K9]<>[.K8];"FIN";"")) -> 
A9: of:=IF([.B9]<>"";TODAY()>[.B9];"") -> 0 | B9: of:=IFERROR(IF(AND(ISNUMBER([.B8]);([.B8]+1)<[Calendario.$F$5]);[.B8]+1;"");"") -> 2015-09-14 | C9: of:=IF(AND([.B9]>=[Calendario.$F$8];[.B9]<=[Calendario.$F$9];1);1;IF(AND([.B9]>=[Calendario.$F$12];[.B9]<=[Calendario.$F$13]);2;IF(AND([.B9]>=[Calendario.$F$16];[.B9]<=[Calendario.$F$17]);3;""))) -> 1 | D9: of:=IF(COUNTIF([Calendario.$H$4:.$H$48];[.B9])>0;"FIESTA";"") ->  | E9: of:=IF([.B9]<>"";VLOOKUP(WEEKDAY([.B9];3);[Calendario.$A$4:.$C$11];2);"") -> Lunes | F9: of:=IF([.B9]<>"";IF([.D9]<>"FIESTA";VLOOKUP(WEEKDAY([.B9];3);[Calendario.$A$4:.$C$11];3);0);"") -> 1 | G9: of:=IF(ISNUMBER([.F9]);[.F9]+[.G8];"") -> 4 | H9: of:=IF(AND([.G9]<=[Unidades.$G$26];[.G9]<=[Unidades.$F$18];[Unidades.$F$18]>0);[Unidades.$D$18]+1-COUNTIFS([Unidades.$O$3:.$O$17];">="&[.G9]);"") -> 1 | I9: of:=IF([.H8]<>[.H9];"INICIO";IF([.H10]<>[.H9];"FIN";"")) ->  | J9: of:=IF([.K8]<>[.K9];"INICIO";IF([.K10]<>[.K9];"FIN";"")) -> 
A10: of:=IF([.B10]<>"";TODAY()>[.B10];"") -> 0 | B10: of:=IFERROR(IF(AND(ISNUMBER([.B9]);([.B9]+1)<[Calendario.$F$5]);[.B9]+1;"");"") -> 2015-09-15 | C10: of:=IF(AND([.B10]>=[Calendario.$F$8];[.B10]<=[Calendario.$F$9];1);1;IF(AND([.B10]>=[Calendario.$F$12];[.B10]<=[Calendario.$F$13]);2;IF(AND([.B10]>=[Calendario.$F$16];[.B10]<=[Calendario.$F$17]);3;""))) -> 1 | D10: of:=IF(COUNTIF([Calendario.$H$4:.$H$48];[.B10])>0;"FIESTA";"") ->  | E10: of:=IF([.B10]<>"";VLOOKUP(WEEKDAY([.B10];3);[Calendario.$A$4:.$C$11];2);"") -> Martes | F10: of:=IF([.B10]<>"";IF([.D10]<>"FIESTA";VLOOKUP(WEEKDAY([.B10];3);[Calendario.$A$4:.$C$11];3);0);"") -> 0 | G10: of:=IF(ISNUMBER([.F10]);[.F10]+[.G9];"") -> 4 | H10: of:=IF(AND([.G10]<=[Unidades.$G$26];[.G10]<=[Unidades.$F$18];[Unidades.$F$18]>0);[Unidades.$D$18]+1-COUNTIFS([Unidades.$O$3:.$O$17];">="&[.G10]);"") -> 1 | I10: of:=IF([.H9]<>[.H10];"INICIO";IF([.H11]<>[.H10];"FIN";"")) ->  | J10: of:=IF([.K9]<>[.K10];"INICIO";IF([.K11]<>[.K10];"FIN";"")) -> 
A11: of:=IF([.B11]<>"";TODAY()>[.B11];"") -> 0 | B11: of:=IFERROR(IF(AND(ISNUMBER([.B10]);([.B10]+1)<[Calendario.$F$5]);[.B10]+1;"");"") -> 2015-09-16 | C11: of:=IF(AND([.B11]>=[Calendario.$F$8];[.B11]<=[Calendario.$F$9];1);1;IF(AND([.B11]>=[Calendario.$F$12];[.B11]<=[Calendario.$F$13]);2;IF(AND([.B11]>=[Calendario.$F$16];[.B11]<=[Calendario.$F$17]);3;""))) -> 1 | D11: of:=IF(COUNTIF([Calendario.$H$4:.$H$48];[.B11])>0;"FIESTA";"") ->  | E11: of:=IF([.B11]<>"";VLOOKUP(WEEKDAY([.B11];3);[Calendario.$A$4:.$C$11];2);"") -> Miercoles | F11: of:=IF([.B11]<>"";IF([.D11]<>"FIESTA";VLOOKUP(WEEKDAY([.B11];3);[Calendario.$A$4:.$C$11];3);0);"") -> 1 | G11: of:=IF(ISNUMBER([.F11]);[.F11]+[.G10];"") -> 5 | H11: of:=IF(AND([.G11]<=[Unidades.$G$26];[.G11]<=[Unidades.$F$18];[Unidades.$F$18]>0);[Unidades.$D$18]+1-COUNTIFS([Unidades.$O$3:.$O$17];">="&[.G11]);"") -> 1 | I11: of:=IF([.H10]<>[.H11];"INICIO";IF([.H12]<>[.H11];"FIN";"")) ->  | J11: of:=IF([.K10]<>[.K11];"INICIO";IF([.K12]<>[.K11];"FIN";"")) -> 
A12: of:=IF([.B12]<>"";TODAY()>[.B12];"") -> 0 | B12: of:=IFERROR(IF(AND(ISNUMBER([.B11]);([.B11]+1)<[Calendario.$F$5]);[.B11]+1;"");"") -> 2015-09-17 | C12: of:=IF(AND([.B12]>=[Calendario.$F$8];[.B12]<=[Calendario.$F$9];1);1;IF(AND([.B12]>=[Calendario.$F$12];[.B12]<=[Calendario.$F$13]);2;IF(AND([.B12]>=[Calendario.$F$16];[.B12]<=[Calendario.$F$17]);3;""))) -> 1 | D12: of:=IF(COUNTIF([Calendario.$H$4:.$H$48];[.B12])>0;"FIESTA";"") ->  | E12: of:=IF([.B12]<>"";VLOOKUP(WEEKDAY([.B12];3);[Calendario.$A$4:.$C$11];2);"") -> Jueves | F12: of:=IF([.B12]<>"";IF([.D12]<>"FIESTA";VLOOKUP(WEEKDAY([.B12];3);[Calendario.$A$4:.$C$11];3);0);"") -> 0 | G12: of:=IF(ISNUMBER([.F12]);[.F12]+[.G11];"") -> 5 | H12: of:=IF(AND([.G12]<=[Unidades.$G$26];[.G12]<=[Unidades.$F$18];[Unidades.$F$18]>0);[Unidades.$D$18]+1-COUNTIFS([Unidades.$O$3:.$O$17];">="&[.G12]);"") -> 1 | I12: of:=IF([.H11]<>[.H12];"INICIO";IF([.H13]<>[.H12];"FIN";"")) ->  | J12: of:=IF([.K11]<>[.K12];"INICIO";IF([.K13]<>[.K12];"FIN";"")) -> 
A13: of:=IF([.B13]<>"";TODAY()>[.B13];"") -> 0 | B13: of:=IFERROR(IF(AND(ISNUMBER([.B12]);([.B12]+1)<[Calendario.$F$5]);[.B12]+1;"");"") -> 2015-09-18 | C13: of:=IF(AND([.B13]>=[Calendario.$F$8];[.B13]<=[Calendario.$F$9];1);1;IF(AND([.B13]>=[Calendario.$F$12];[.B13]<=[Calendario.$F$13]);2;IF(AND([.B13]>=[Calendario.$F$16];[.B13]<=[Calendario.$F$17]);3;""))) -> 1 | D13: of:=IF(COUNTIF([Calendario.$H$4:.$H$48];[.B13])>0;"FIESTA";"") ->  | E13: of:=IF([.B13]<>"";VLOOKUP(WEEKDAY([.B13];3);[Calendario.$A$4:.$C$11];2);"") -> Viernes | F13: of:=IF([.B13]<>"";IF([.D13]<>"FIESTA";VLOOKUP(WEEKDAY([.B13];3);[Calendario.$A$4:.$C$11];3);0);"") -> 1 | G13: of:=IF(ISNUMBER([.F13]);[.F13]+[.G12];"") -> 6 | H13: of:=IF(AND([.G13]<=[Unidades.$G$26];[.G13]<=[Unidades.$F$18];[Unidades.$F$18]>0);[Unidades.$D$18]+1-COUNTIFS([Unidades.$O$3:.$O$17];">="&[.G13]);"") -> 1 | I13: of:=IF([.H12]<>[.H13];"INICIO";IF([.H14]<>[.H13];"FIN";"")) ->  | J13: of:=IF([.K12]<>[.K13];"INICIO";IF([.K14]<>[.K13];"FIN";"")) -> 
A14: of:=IF([.B14]<>"";TODAY()>[.B14];"") -> 0 | B14: of:=IFERROR(IF(AND(ISNUMBER([.B13]);([.B13]+1)<[Calendario.$F$5]);[.B13]+1;"");"") -> 2015-09-19 | C14: of:=IF(AND([.B14]>=[Calendario.$F$8];[.B14]<=[Calendario.$F$9];1);1;IF(AND([.B14]>=[Calendario.$F$12];[.B14]<=[Calendario.$F$13]);2;IF(AND([.B14]>=[Calendario.$F$16];[.B14]<=[Calendario.$F$17]);3;""))) -> 1 | D14: of:=IF(COUNTIF([Calendario.$H$4:.$H$48];[.B14])>0;"FIESTA";"") ->  | E14: of:=IF([.B14]<>"";VLOOKUP(WEEKDAY([.B14];3);[Calendario.$A$4:.$C$11];2);"") -> Sabado | F14: of:=IF([.B14]<>"";IF([.D14]<>"FIESTA";VLOOKUP(WEEKDAY([.B14];3);[Calendario.$A$4:.$C$11];3);0);"") -> 0 | G14: of:=IF(ISNUMBER([.F14]);[.F14]+[.G13];"") -> 6 | H14: of:=IF(AND([.G14]<=[Unidades.$G$26];[.G14]<=[Unidades.$F$18];[Unidades.$F$18]>0);[Unidades.$D$18]+1-COUNTIFS([Unidades.$O$3:.$O$17];">="&[.G14]);"") -> 1 | I14: of:=IF([.H13]<>[.H14];"INICIO";IF([.H15]<>[.H14];"FIN";"")) ->  | J14: of:=IF([.K13]<>[.K14];"INICIO";IF([.K15]<>[.K14];"FIN";"")) -> 
A15: of:=IF([.B15]<>"";TODAY()>[.B15];"") -> 0 | B15: of:=IFERROR(IF(AND(ISNUMBER([.B14]);([.B14]+1)<[Calendario.$F$5]);[.B14]+1;"");"") -> 2015-09-20 | C15: of:=IF(AND([.B15]>=[Calendario.$F$8];[.B15]<=[Calendario.$F$9];1);1;IF(AND([.B15]>=[Calendario.$F$12];[.B15]<=[Calendario.$F$13]);2;IF(AND([.B15]>=[Calendario.$F$16];[.B15]<=[Calendario.$F$17]);3;""))) -> 1 | D15: of:=IF(COUNTIF([Calendario.$H$4:.$H$48];[.B15])>0;"FIESTA";"") ->  | E15: of:=IF([.B15]<>"";VLOOKUP(WEEKDAY([.B15];3);[Calendario.$A$4:.$C$11];2);"") -> Domingo | F15: of:=IF([.B15]<>"";IF([.D15]<>"FIESTA";VLOOKUP(WEEKDAY([.B15];3);[Calendario.$A$4:.$C$11];3);0);"") -> 0 | G15: of:=IF(ISNUMBER([.F15]);[.F15]+[.G14];"") -> 6 | H15: of:=IF(AND([.G15]<=[Unidades.$G$26];[.G15]<=[Unidades.$F$18];[Unidades.$F$18]>0);[Unidades.$D$18]+1-COUNTIFS([Unidades.$O$3:.$O$17];">="&[.G15]);"") -> 1 | I15: of:=IF([.H14]<>[.H15];"INICIO";IF([.H16]<>[.H15];"FIN";"")) ->  | J15: of:=IF([.K14]<>[.K15];"INICIO";IF([.K16]<>[.K15];"FIN";"")) -> 
A16: of:=IF([.B16]<>"";TODAY()>[.B16];"") -> 0 | B16: of:=IFERROR(IF(AND(ISNUMBER([.B15]);([.B15]+1)<[Calendario.$F$5]);[.B15]+1;"");"") -> 2015-09-21 | C16: of:=IF(AND([.B16]>=[Calendario.$F$8];[.B16]<=[Calendario.$F$9];1);1;IF(AND([.B16]>=[Calendario.$F$12];[.B16]<=[Calendario.$F$13]);2;IF(AND([.B16]>=[Calendario.$F$16];[.B16]<=[Calendario.$F$17]);3;""))) -> 1 | D16: of:=IF(COUNTIF([Calendario.$H$4:.$H$48];[.B16])>0;"FIESTA";"") ->  | E16: of:=IF([.B16]<>"";VLOOKUP(WEEKDAY([.B16];3);[Calendario.$A$4:.$C$11];2);"") -> Lunes | F16: of:=IF([.B16]<>"";IF([.D16]<>"FIESTA";VLOOKUP(WEEKDAY([.B16];3);[Calendario.$A$4:.$C$11];3);0);"") -> 1 | G16: of:=IF(ISNUMBER([.F16]);[.F16]+[.G15];"") -> 7 | H16: of:=IF(AND([.G16]<=[Unidades.$G$26];[.G16]<=[Unidades.$F$18];[Unidades.$F$18]>0);[Unidades.$D$18]+1-COUNTIFS([Unidades.$O$3:.$O$17];">="&[.G16]);"") -> 1 | I16: of:=IF([.H15]<>[.H16];"INICIO";IF([.H17]<>[.H16];"FIN";"")) ->  | J16: of:=IF([.K15]<>[.K16];"INICIO";IF([.K17]<>[.K16];"FIN";"")) -> 
A17: of:=IF([.B17]<>"";TODAY()>[.B17];"") -> 0 | B17: of:=IFERROR(IF(AND(ISNUMBER([.B16]);([.B16]+1)<[Calendario.$F$5]);[.B16]+1;"");"") -> 2015-09-22 | C17: of:=IF(AND([.B17]>=[Calendario.$F$8];[.B17]<=[Calendario.$F$9];1);1;IF(AND([.B17]>=[Calendario.$F$12];[.B17]<=[Calendario.$F$13]);2;IF(AND([.B17]>=[Calendario.$F$16];[.B17]<=[Calendario.$F$17]);3;""))) -> 1 | D17: of:=IF(COUNTIF([Calendario.$H$4:.$H$48];[.B17])>0;"FIESTA";"") ->  | E17: of:=IF([.B17]<>"";VLOOKUP(WEEKDAY([.B17];3);[Calendario.$A$4:.$C$11];2);"") -> Martes | F17: of:=IF([.B17]<>"";IF([.D17]<>"FIESTA";VLOOKUP(WEEKDAY([.B17];3);[Calendario.$A$4:.$C$11];3);0);"") -> 0 | G17: of:=IF(ISNUMBER([.F17]);[.F17]+[.G16];"") -> 7 | H17: of:=IF(AND([.G17]<=[Unidades.$G$26];[.G17]<=[Unidades.$F$18];[Unidades.$F$18]>0);[Unidades.$D$18]+1-COUNTIFS([Unidades.$O$3:.$O$17];">="&[.G17]);"") -> 1 | I17: of:=IF([.H16]<>[.H17];"INICIO";IF([.H18]<>[.H17];"FIN";"")) ->  | J17: of:=IF([.K16]<>[.K17];"INICIO";IF([.K18]<>[.K17];"FIN";"")) -> 
A18: of:=IF([.B18]<>"";TODAY()>[.B18];"") -> 0 | B18: of:=IFERROR(IF(AND(ISNUMBER([.B17]);([.B17]+1)<[Calendario.$F$5]);[.B17]+1;"");"") -> 2015-09-23 | C18: of:=IF(AND([.B18]>=[Calendario.$F$8];[.B18]<=[Calendario.$F$9];1);1;IF(AND([.B18]>=[Calendario.$F$12];[.B18]<=[Calendario.$F$13]);2;IF(AND([.B18]>=[Calendario.$F$16];[.B18]<=[Calendario.$F$17]);3;""))) -> 1 | D18: of:=IF(COUNTIF([Calendario.$H$4:.$H$48];[.B18])>0;"FIESTA";"") ->  | E18: of:=IF([.B18]<>"";VLOOKUP(WEEKDAY([.B18];3);[Calendario.$A$4:.$C$11];2);"") -> Miercoles | F18: of:=IF([.B18]<>"";IF([.D18]<>"FIESTA";VLOOKUP(WEEKDAY([.B18];3);[Calendario.$A$4:.$C$11];3);0);"") -> 1 | G18: of:=IF(ISNUMBER([.F18]);[.F18]+[.G17];"") -> 8 | H18: of:=IF(AND([.G18]<=[Unidades.$G$26];[.G18]<=[Unidades.$F$18];[Unidades.$F$18]>0);[Unidades.$D$18]+1-COUNTIFS([Unidades.$O$3:.$O$17];">="&[.G18]);"") -> 1 | I18: of:=IF([.H17]<>[.H18];"INICIO";IF([.H19]<>[.H18];"FIN";"")) ->  | J18: of:=IF([.K17]<>[.K18];"INICIO";IF([.K19]<>[.K18];"FIN";"")) -> 
A19: of:=IF([.B19]<>"";TODAY()>[.B19];"") -> 0 | B19: of:=IFERROR(IF(AND(ISNUMBER([.B18]);([.B18]+1)<[Calendario.$F$5]);[.B18]+1;"");"") -> 2015-09-24 | C19: of:=IF(AND([.B19]>=[Calendario.$F$8];[.B19]<=[Calendario.$F$9];1);1;IF(AND([.B19]>=[Calendario.$F$12];[.B19]<=[Calendario.$F$13]);2;IF(AND([.B19]>=[Calendario.$F$16];[.B19]<=[Calendario.$F$17]);3;""))) -> 1 | D19: of:=IF(COUNTIF([Calendario.$H$4:.$H$48];[.B19])>0;"FIESTA";"") ->  | E19: of:=IF([.B19]<>"";VLOOKUP(WEEKDAY([.B19];3);[Calendario.$A$4:.$C$11];2);"") -> Jueves | F19: of:=IF([.B19]<>"";IF([.D19]<>"FIESTA";VLOOKUP(WEEKDAY([.B19];3);[Calendario.$A$4:.$C$11];3);0);"") -> 0 | G19: of:=IF(ISNUMBER([.F19]);[.F19]+[.G18];"") -> 8 | H19: of:=IF(AND([.G19]<=[Unidades.$G$26];[.G19]<=[Unidades.$F$18];[Unidades.$F$18]>0);[Unidades.$D$18]+1-COUNTIFS([Unidades.$O$3:.$O$17];">="&[.G19]);"") -> 1 | I19: of:=IF([.H18]<>[.H19];"INICIO";IF([.H20]<>[.H19];"FIN";"")) ->  | J19: of:=IF([.K18]<>[.K19];"INICIO";IF([.K20]<>[.K19];"FIN";"")) -> 
A20: of:=IF([.B20]<>"";TODAY()>[.B20];"") -> 0 | B20: of:=IFERROR(IF(AND(ISNUMBER([.B19]);([.B19]+1)<[Calendario.$F$5]);[.B19]+1;"");"") -> 2015-09-25 | C20: of:=IF(AND([.B20]>=[Calendario.$F$8];[.B20]<=[Calendario.$F$9];1);1;IF(AND([.B20]>=[Calendario.$F$12];[.B20]<=[Calendario.$F$13]);2;IF(AND([.B20]>=[Calendario.$F$16];[.B20]<=[Calendario.$F$17]);3;""))) -> 1 | D20: of:=IF(COUNTIF([Calendario.$H$4:.$H$48];[.B20])>0;"FIESTA";"") ->  | E20: of:=IF([.B20]<>"";VLOOKUP(WEEKDAY([.B20];3);[Calendario.$A$4:.$C$11];2);"") -> Viernes | F20: of:=IF([.B20]<>"";IF([.D20]<>"FIESTA";VLOOKUP(WEEKDAY([.B20];3);[Calendario.$A$4:.$C$11];3);0);"") -> 1 | G20: of:=IF(ISNUMBER([.F20]);[.F20]+[.G19];"") -> 9 | H20: of:=IF(AND([.G20]<=[Unidades.$G$26];[.G20]<=[Unidades.$F$18];[Unidades.$F$18]>0);[Unidades.$D$18]+1-COUNTIFS([Unidades.$O$3:.$O$17];">="&[.G20]);"") -> 1 | I20: of:=IF([.H19]<>[.H20];"INICIO";IF([.H21]<>[.H20];"FIN";"")) ->  | J20: of:=IF([.K19]<>[.K20];"INICIO";IF([.K21]<>[.K20];"FIN";"")) -> 
A21: of:=IF([.B21]<>"";TODAY()>[.B21];"") -> 0 | B21: of:=IFERROR(IF(AND(ISNUMBER([.B20]);([.B20]+1)<[Calendario.$F$5]);[.B20]+1;"");"") -> 2015-09-26 | C21: of:=IF(AND([.B21]>=[Calendario.$F$8];[.B21]<=[Calendario.$F$9];1);1;IF(AND([.B21]>=[Calendario.$F$12];[.B21]<=[Calendario.$F$13]);2;IF(AND([.B21]>=[Calendario.$F$16];[.B21]<=[Calendario.$F$17]);3;""))) -> 1 | D21: of:=IF(COUNTIF([Calendario.$H$4:.$H$48];[.B21])>0;"FIESTA";"") ->  | E21: of:=IF([.B21]<>"";VLOOKUP(WEEKDAY([.B21];3);[Calendario.$A$4:.$C$11];2);"") -> Sabado | F21: of:=IF([.B21]<>"";IF([.D21]<>"FIESTA";VLOOKUP(WEEKDAY([.B21];3);[Calendario.$A$4:.$C$11];3);0);"") -> 0 | G21: of:=IF(ISNUMBER([.F21]);[.F21]+[.G20];"") -> 9 | H21: of:=IF(AND([.G21]<=[Unidades.$G$26];[.G21]<=[Unidades.$F$18];[Unidades.$F$18]>0);[Unidades.$D$18]+1-COUNTIFS([Unidades.$O$3:.$O$17];">="&[.G21]);"") -> 1 | I21: of:=IF([.H20]<>[.H21];"INICIO";IF([.H22]<>[.H21];"FIN";"")) ->  | J21: of:=IF([.K20]<>[.K21];"INICIO";IF([.K22]<>[.K21];"FIN";"")) -> 
A22: of:=IF([.B22]<>"";TODAY()>[.B22];"") -> 0 | B22: of:=IFERROR(IF(AND(ISNUMBER([.B21]);([.B21]+1)<[Calendario.$F$5]);[.B21]+1;"");"") -> 2015-09-27 | C22: of:=IF(AND([.B22]>=[Calendario.$F$8];[.B22]<=[Calendario.$F$9];1);1;IF(AND([.B22]>=[Calendario.$F$12];[.B22]<=[Calendario.$F$13]);2;IF(AND([.B22]>=[Calendario.$F$16];[.B22]<=[Calendario.$F$17]);3;""))) -> 1 | D22: of:=IF(COUNTIF([Calendario.$H$4:.$H$48];[.B22])>0;"FIESTA";"") ->  | E22: of:=IF([.B22]<>"";VLOOKUP(WEEKDAY([.B22];3);[Calendario.$A$4:.$C$11];2);"") -> Domingo | F22: of:=IF([.B22]<>"";IF([.D22]<>"FIESTA";VLOOKUP(WEEKDAY([.B22];3);[Calendario.$A$4:.$C$11];3);0);"") -> 0 | G22: of:=IF(ISNUMBER([.F22]);[.F22]+[.G21];"") -> 9 | H22: of:=IF(AND([.G22]<=[Unidades.$F$26];[.G22]<=[Unidades.$F$18];[Unidades.$F$18]>0);[Unidades.$D$18]+1-COUNTIFS([Unidades.$O$3:.$O$17];">="&[.G22]);"") -> 1 | I22: of:=IF([.H21]<>[.H22];"INICIO";IF([.H23]<>[.H22];"FIN";"")) ->  | J22: of:=IF([.K21]<>[.K22];"INICIO";IF([.K23]<>[.K22];"FIN";"")) -> 
A23: of:=IF([.B23]<>"";TODAY()>[.B23];"") -> 0 | B23: of:=IFERROR(IF(AND(ISNUMBER([.B22]);([.B22]+1)<[Calendario.$F$5]);[.B22]+1;"");"") -> 2015-09-28 | C23: of:=IF(AND([.B23]>=[Calendario.$F$8];[.B23]<=[Calendario.$F$9];1);1;IF(AND([.B23]>=[Calendario.$F$12];[.B23]<=[Calendario.$F$13]);2;IF(AND([.B23]>=[Calendario.$F$16];[.B23]<=[Calendario.$F$17]);3;""))) -> 1 | D23: of:=IF(COUNTIF([Calendario.$H$4:.$H$48];[.B23])>0;"FIESTA";"") ->  | E23: of:=IF([.B23]<>"";VLOOKUP(WEEKDAY([.B23];3);[Calendario.$A$4:.$C$11];2);"") -> Lunes | F23: of:=IF([.B23]<>"";IF([.D23]<>"FIESTA";VLOOKUP(WEEKDAY([.B23];3);[Calendario.$A$4:.$C$11];3);0);"") -> 1 | G23: of:=IF(ISNUMBER([.F23]);[.F23]+[.G22];"") -> 10 | H23: of:=IF(AND([.G23]<=[Unidades.$F$26];[.G23]<=[Unidades.$F$18];[Unidades.$F$18]>0);[Unidades.$D$18]+1-COUNTIFS([Unidades.$O$3:.$O$17];">="&[.G23]);"") -> 1 | I23: of:=IF([.H22]<>[.H23];"INICIO";IF([.H24]<>[.H23];"FIN";"")) ->  | J23: of:=IF([.K22]<>[.K23];"INICIO";IF([.K24]<>[.K23];"FIN";"")) -> 
A24: of:=IF([.B24]<>"";TODAY()>[.B24];"") -> 0 | B24: of:=IFERROR(IF(AND(ISNUMBER([.B23]);([.B23]+1)<[Calendario.$F$5]);[.B23]+1;"");"") -> 2015-09-29 | C24: of:=IF(AND([.B24]>=[Calendario.$F$8];[.B24]<=[Calendario.$F$9];1);1;IF(AND([.B24]>=[Calendario.$F$12];[.B24]<=[Calendario.$F$13]);2;IF(AND([.B24]>=[Calendario.$F$16];[.B24]<=[Calendario.$F$17]);3;""))) -> 1 | D24: of:=IF(COUNTIF([Calendario.$H$4:.$H$48];[.B24])>0;"FIESTA";"") ->  | E24: of:=IF([.B24]<>"";VLOOKUP(WEEKDAY([.B24];3);[Calendario.$A$4:.$C$11];2);"") -> Martes | F24: of:=IF([.B24]<>"";IF([.D24]<>"FIESTA";VLOOKUP(WEEKDAY([.B24];3);[Calendario.$A$4:.$C$11];3);0);"") -> 0 | G24: of:=IF(ISNUMBER([.F24]);[.F24]+[.G23];"") -> 10 | H24: of:=IF(AND([.G24]<=[Unidades.$F$26];[.G24]<=[Unidades.$F$18];[Unidades.$F$18]>0);[Unidades.$D$18]+1-COUNTIFS([Unidades.$O$3:.$O$17];">="&[.G24]);"") -> 1 | I24: of:=IF([.H23]<>[.H24];"INICIO";IF([.H25]<>[.H24];"FIN";"")) ->  | J24: of:=IF([.K23]<>[.K24];"INICIO";IF([.K25]<>[.K24];"FIN";"")) -> 
A25: of:=IF([.B25]<>"";TODAY()>[.B25];"") -> 0 | B25: of:=IFERROR(IF(AND(ISNUMBER([.B24]);([.B24]+1)<[Calendario.$F$5]);[.B24]+1;"");"") -> 2015-09-30 | C25: of:=IF(AND([.B25]>=[Calendario.$F$8];[.B25]<=[Calendario.$F$9];1);1;IF(AND([.B25]>=[Calendario.$F$12];[.B25]<=[Calendario.$F$13]);2;IF(AND([.B25]>=[Calendario.$F$16];[.B25]<=[Calendario.$F$17]);3;""))) -> 1 | D25: of:=IF(COUNTIF([Calendario.$H$4:.$H$48];[.B25])>0;"FIESTA";"") ->  | E25: of:=IF([.B25]<>"";VLOOKUP(WEEKDAY([.B25];3);[Calendario.$A$4:.$C$11];2);"") -> Miercoles | F25: of:=IF([.B25]<>"";IF([.D25]<>"FIESTA";VLOOKUP(WEEKDAY([.B25];3);[Calendario.$A$4:.$C$11];3);0);"") -> 1 | G25: of:=IF(ISNUMBER([.F25]);[.F25]+[.G24];"") -> 11 | H25: of:=IF(AND([.G25]<=[Unidades.$F$26];[.G25]<=[Unidades.$F$18];[Unidades.$F$18]>0);[Unidades.$D$18]+1-COUNTIFS([Unidades.$O$3:.$O$17];">="&[.G25]);"") -> 1 | I25: of:=IF([.H24]<>[.H25];"INICIO";IF([.H26]<>[.H25];"FIN";"")) ->  | J25: of:=IF([.K24]<>[.K25];"INICIO";IF([.K26]<>[.K25];"FIN";"")) -> 
A26: of:=IF([.B26]<>"";TODAY()>[.B26];"") -> 0 | B26: of:=IFERROR(IF(AND(ISNUMBER([.B25]);([.B25]+1)<[Calendario.$F$5]);[.B25]+1;"");"") -> 2015-10-01 | C26: of:=IF(AND([.B26]>=[Calendario.$F$8];[.B26]<=[Calendario.$F$9];1);1;IF(AND([.B26]>=[Calendario.$F$12];[.B26]<=[Calendario.$F$13]);2;IF(AND([.B26]>=[Calendario.$F$16];[.B26]<=[Calendario.$F$17]);3;""))) -> 1 | D26: of:=IF(COUNTIF([Calendario.$H$4:.$H$48];[.B26])>0;"FIESTA";"") ->  | E26: of:=IF([.B26]<>"";VLOOKUP(WEEKDAY([.B26];3);[Calendario.$A$4:.$C$11];2);"") -> Jueves | F26: of:=IF([.B26]<>"";IF([.D26]<>"FIESTA";VLOOKUP(WEEKDAY([.B26];3);[Calendario.$A$4:.$C$11];3);0);"") -> 0 | G26: of:=IF(ISNUMBER([.F26]);[.F26]+[.G25];"") -> 11 | H26: of:=IF(AND([.G26]<=[Unidades.$F$26];[.G26]<=[Unidades.$F$18];[Unidades.$F$18]>0);[Unidades.$D$18]+1-COUNTIFS([Unidades.$O$3:.$O$17];">="&[.G26]);"") -> 1 | I26: of:=IF([.H25]<>[.H26];"INICIO";IF([.H27]<>[.H26];"FIN";"")) ->  | J26: of:=IF([.K25]<>[.K26];"INICIO";IF([.K27]<>[.K26];"FIN";"")) -> 
A27: of:=IF([.B27]<>"";TODAY()>[.B27];"") -> 0 | B27: of:=IFERROR(IF(AND(ISNUMBER([.B26]);([.B26]+1)<[Calendario.$F$5]);[.B26]+1;"");"") -> 2015-10-02 | C27: of:=IF(AND([.B27]>=[Calendario.$F$8];[.B27]<=[Calendario.$F$9];1);1;IF(AND([.B27]>=[Calendario.$F$12];[.B27]<=[Calendario.$F$13]);2;IF(AND([.B27]>=[Calendario.$F$16];[.B27]<=[Calendario.$F$17]);3;""))) -> 1 | D27: of:=IF(COUNTIF([Calendario.$H$4:.$H$48];[.B27])>0;"FIESTA";"") ->  | E27: of:=IF([.B27]<>"";VLOOKUP(WEEKDAY([.B27];3);[Calendario.$A$4:.$C$11];2);"") -> Viernes | F27: of:=IF([.B27]<>"";IF([.D27]<>"FIESTA";VLOOKUP(WEEKDAY([.B27];3);[Calendario.$A$4:.$C$11];3);0);"") -> 1 | G27: of:=IF(ISNUMBER([.F27]);[.F27]+[.G26];"") -> 12 | H27: of:=IF(AND([.G27]<=[Unidades.$G$26];[.G27]<=[Unidades.$F$18];[Unidades.$F$18]>0);[Unidades.$D$18]+1-COUNTIFS([Unidades.$O$3:.$O$17];">="&[.G27]);"") -> 1 | I27: of:=IF([.H26]<>[.H27];"INICIO";IF([.H28]<>[.H27];"FIN";"")) ->  | J27: of:=IF([.K26]<>[.K27];"INICIO";IF([.K28]<>[.K27];"FIN";"")) -> 
A28: of:=IF([.B28]<>"";TODAY()>[.B28];"") -> 0 | B28: of:=IFERROR(IF(AND(ISNUMBER([.B27]);([.B27]+1)<[Calendario.$F$5]);[.B27]+1;"");"") -> 2015-10-03 | C28: of:=IF(AND([.B28]>=[Calendario.$F$8];[.B28]<=[Calendario.$F$9];1);1;IF(AND([.B28]>=[Calendario.$F$12];[.B28]<=[Calendario.$F$13]);2;IF(AND([.B28]>=[Calendario.$F$16];[.B28]<=[Calendario.$F$17]);3;""))) -> 1 | D28: of:=IF(COUNTIF([Calendario.$H$4:.$H$48];[.B28])>0;"FIESTA";"") ->  | E28: of:=IF([.B28]<>"";VLOOKUP(WEEKDAY([.B28];3);[Calendario.$A$4:.$C$11];2);"") -> Sabado | F28: of:=IF([.B28]<>"";IF([.D28]<>"FIESTA";VLOOKUP(WEEKDAY([.B28];3);[Calendario.$A$4:.$C$11];3);0);"") -> 0 | G28: of:=IF(ISNUMBER([.F28]);[.F28]+[.G27];"") -> 12 | H28: of:=IF(AND([.G28]<=[Unidades.$G$26];[.G28]<=[Unidades.$F$18];[Unidades.$F$18]>0);[Unidades.$D$18]+1-COUNTIFS([Unidades.$O$3:.$O$17];">="&[.G28]);"") -> 1 | I28: of:=IF([.H27]<>[.H28];"INICIO";IF([.H29]<>[.H28];"FIN";"")) ->  | J28: of:=IF([.K27]<>[.K28];"INICIO";IF([.K29]<>[.K28];"FIN";"")) -> 
A29: of:=IF([.B29]<>"";TODAY()>[.B29];"") -> 0 | B29: of:=IFERROR(IF(AND(ISNUMBER([.B28]);([.B28]+1)<[Calendario.$F$5]);[.B28]+1;"");"") -> 2015-10-04 | C29: of:=IF(AND([.B29]>=[Calendario.$F$8];[.B29]<=[Calendario.$F$9];1);1;IF(AND([.B29]>=[Calendario.$F$12];[.B29]<=[Calendario.$F$13]);2;IF(AND([.B29]>=[Calendario.$F$16];[.B29]<=[Calendario.$F$17]);3;""))) -> 1 | D29: of:=IF(COUNTIF([Calendario.$H$4:.$H$48];[.B29])>0;"FIESTA";"") ->  | E29: of:=IF([.B29]<>"";VLOOKUP(WEEKDAY([.B29];3);[Calendario.$A$4:.$C$11];2);"") -> Domingo | F29: of:=IF([.B29]<>"";IF([.D29]<>"FIESTA";VLOOKUP(WEEKDAY([.B29];3);[Calendario.$A$4:.$C$11];3);0);"") -> 0 | G29: of:=IF(ISNUMBER([.F29]);[.F29]+[.G28];"") -> 12 | H29: of:=IF(AND([.G29]<=[Unidades.$G$26];[.G29]<=[Unidades.$F$18];[Unidades.$F$18]>0);[Unidades.$D$18]+1-COUNTIFS([Unidades.$O$3:.$O$17];">="&[.G29]);"") -> 1 | I29: of:=IF([.H28]<>[.H29];"INICIO";IF([.H30]<>[.H29];"FIN";"")) ->  | J29: of:=IF([.K28]<>[.K29];"INICIO";IF([.K30]<>[.K29];"FIN";"")) -> 
A30: of:=IF([.B30]<>"";TODAY()>[.B30];"") -> 0 | B30: of:=IFERROR(IF(AND(ISNUMBER([.B29]);([.B29]+1)<[Calendario.$F$5]);[.B29]+1;"");"") -> 2015-10-05 | C30: of:=IF(AND([.B30]>=[Calendario.$F$8];[.B30]<=[Calendario.$F$9];1);1;IF(AND([.B30]>=[Calendario.$F$12];[.B30]<=[Calendario.$F$13]);2;IF(AND([.B30]>=[Calendario.$F$16];[.B30]<=[Calendario.$F$17]);3;""))) -> 1 | D30: of:=IF(COUNTIF([Calendario.$H$4:.$H$48];[.B30])>0;"FIESTA";"") ->  | E30: of:=IF([.B30]<>"";VLOOKUP(WEEKDAY([.B30];3);[Calendario.$A$4:.$C$11];2);"") -> Lunes | F30: of:=IF([.B30]<>"";IF([.D30]<>"FIESTA";VLOOKUP(WEEKDAY([.B30];3);[Calendario.$A$4:.$C$11];3);0);"") -> 1 | G30: of:=IF(ISNUMBER([.F30]);[.F30]+[.G29];"") -> 13 | H30: of:=IF(AND([.G30]<=[Unidades.$G$26];[.G30]<=[Unidades.$F$18];[Unidades.$F$18]>0);[Unidades.$D$18]+1-COUNTIFS([Unidades.$O$3:.$O$17];">="&[.G30]);"") -> 1 | I30: of:=IF([.H29]<>[.H30];"INICIO";IF([.H31]<>[.H30];"FIN";"")) ->  | J30: of:=IF([.K29]<>[.K30];"INICIO";IF([.K31]<>[.K30];"FIN";"")) -> 
A31: of:=IF([.B31]<>"";TODAY()>[.B31];"") -> 0 | B31: of:=IFERROR(IF(AND(ISNUMBER([.B30]);([.B30]+1)<[Calendario.$F$5]);[.B30]+1;"");"") -> 2015-10-06 | C31: of:=IF(AND([.B31]>=[Calendario.$F$8];[.B31]<=[Calendario.$F$9];1);1;IF(AND([.B31]>=[Calendario.$F$12];[.B31]<=[Calendario.$F$13]);2;IF(AND([.B31]>=[Calendario.$F$16];[.B31]<=[Calendario.$F$17]);3;""))) -> 1 | D31: of:=IF(COUNTIF([Calendario.$H$4:.$H$48];[.B31])>0;"FIESTA";"") ->  | E31: of:=IF([.B31]<>"";VLOOKUP(WEEKDAY([.B31];3);[Calendario.$A$4:.$C$11];2);"") -> Martes | F31: of:=IF([.B31]<>"";IF([.D31]<>"FIESTA";VLOOKUP(WEEKDAY([.B31];3);[Calendario.$A$4:.$C$11];3);0);"") -> 0 | G31: of:=IF(ISNUMBER([.F31]);[.F31]+[.G30];"") -> 13 | H31: of:=IF(AND([.G31]<=[Unidades.$G$26];[.G31]<=[Unidades.$F$18];[Unidades.$F$18]>0);[Unidades.$D$18]+1-COUNTIFS([Unidades.$O$3:.$O$17];">="&[.G31]);"") -> 1 | I31: of:=IF([.H30]<>[.H31];"INICIO";IF([.H32]<>[.H31];"FIN";"")) ->  | J31: of:=IF([.K30]<>[.K31];"INICIO";IF([.K32]<>[.K31];"FIN";"")) -> 
A32: of:=IF([.B32]<>"";TODAY()>[.B32];"") -> 0 | B32: of:=IFERROR(IF(AND(ISNUMBER([.B31]);([.B31]+1)<[Calendario.$F$5]);[.B31]+1;"");"") -> 2015-10-07 | C32: of:=IF(AND([.B32]>=[Calendario.$F$8];[.B32]<=[Calendario.$F$9];1);1;IF(AND([.B32]>=[Calendario.$F$12];[.B32]<=[Calendario.$F$13]);2;IF(AND([.B32]>=[Calendario.$F$16];[.B32]<=[Calendario.$F$17]);3;""))) -> 1 | D32: of:=IF(COUNTIF([Calendario.$H$4:.$H$48];[.B32])>0;"FIESTA";"") ->  | E32: of:=IF([.B32]<>"";VLOOKUP(WEEKDAY([.B32];3);[Calendario.$A$4:.$C$11];2);"") -> Miercoles | F32: of:=IF([.B32]<>"";IF([.D32]<>"FIESTA";VLOOKUP(WEEKDAY([.B32];3);[Calendario.$A$4:.$C$11];3);0);"") -> 1 | G32: of:=IF(ISNUMBER([.F32]);[.F32]+[.G31];"") -> 14 | H32: of:=IF(AND([.G32]<=[Unidades.$G$26];[.G32]<=[Unidades.$F$18];[Unidades.$F$18]>0);[Unidades.$D$18]+1-COUNTIFS([Unidades.$O$3:.$O$17];">="&[.G32]);"") -> 1 | I32: of:=IF([.H31]<>[.H32];"INICIO";IF([.H33]<>[.H32];"FIN";"")) ->  | J32: of:=IF([.K31]<>[.K32];"INICIO";IF([.K33]<>[.K32];"FIN";"")) -> 
A33: of:=IF([.B33]<>"";TODAY()>[.B33];"") -> 0 | B33: of:=IFERROR(IF(AND(ISNUMBER([.B32]);([.B32]+1)<[Calendario.$F$5]);[.B32]+1;"");"") -> 2015-10-08 | C33: of:=IF(AND([.B33]>=[Calendario.$F$8];[.B33]<=[Calendario.$F$9];1);1;IF(AND([.B33]>=[Calendario.$F$12];[.B33]<=[Calendario.$F$13]);2;IF(AND([.B33]>=[Calendario.$F$16];[.B33]<=[Calendario.$F$17]);3;""))) -> 1 | D33: of:=IF(COUNTIF([Calendario.$H$4:.$H$48];[.B33])>0;"FIESTA";"") ->  | E33: of:=IF([.B33]<>"";VLOOKUP(WEEKDAY([.B33];3);[Calendario.$A$4:.$C$11];2);"") -> Jueves | F33: of:=IF([.B33]<>"";IF([.D33]<>"FIESTA";VLOOKUP(WEEKDAY([.B33];3);[Calendario.$A$4:.$C$11];3);0);"") -> 0 | G33: of:=IF(ISNUMBER([.F33]);[.F33]+[.G32];"") -> 14 | H33: of:=IF(AND([.G33]<=[Unidades.$G$26];[.G33]<=[Unidades.$F$18];[Unidades.$F$18]>0);[Unidades.$D$18]+1-COUNTIFS([Unidades.$O$3:.$O$17];">="&[.G33]);"") -> 1 | I33: of:=IF([.H32]<>[.H33];"INICIO";IF([.H34]<>[.H33];"FIN";"")) ->  | J33: of:=IF([.K32]<>[.K33];"INICIO";IF([.K34]<>[.K33];"FIN";"")) -> 
A34: of:=IF([.B34]<>"";TODAY()>[.B34];"") -> 0 | B34: of:=IFERROR(IF(AND(ISNUMBER([.B33]);([.B33]+1)<[Calendario.$F$5]);[.B33]+1;"");"") -> 2015-10-09 | C34: of:=IF(AND([.B34]>=[Calendario.$F$8];[.B34]<=[Calendario.$F$9];1);1;IF(AND([.B34]>=[Calendario.$F$12];[.B34]<=[Calendario.$F$13]);2;IF(AND([.B34]>=[Calendario.$F$16];[.B34]<=[Calendario.$F$17]);3;""))) -> 1 | D34: of:=IF(COUNTIF([Calendario.$H$4:.$H$48];[.B34])>0;"FIESTA";"") -> FIESTA | E34: of:=IF([.B34]<>"";VLOOKUP(WEEKDAY([.B34];3);[Calendario.$A$4:.$C$11];2);"") -> Viernes | F34: of:=IF([.B34]<>"";IF([.D34]<>"FIESTA";VLOOKUP(WEEKDAY([.B34];3);[Calendario.$A$4:.$C$11];3);0);"") -> 0 | G34: of:=IF(ISNUMBER([.F34]);[.F34]+[.G33];"") -> 14 | H34: of:=IF(AND([.G34]<=[Unidades.$G$26];[.G34]<=[Unidades.$F$18];[Unidades.$F$18]>0);[Unidades.$D$18]+1-COUNTIFS([Unidades.$O$3:.$O$17];">="&[.G34]);"") -> 1 | I34: of:=IF([.H33]<>[.H34];"INICIO";IF([.H35]<>[.H34];"FIN";"")) ->  | J34: of:=IF([.K33]<>[.K34];"INICIO";IF([.K35]<>[.K34];"FIN";"")) -> 
A35: of:=IF([.B35]<>"";TODAY()>[.B35];"") -> 0 | B35: of:=IFERROR(IF(AND(ISNUMBER([.B34]);([.B34]+1)<[Calendario.$F$5]);[.B34]+1;"");"") -> 2015-10-10 | C35: of:=IF(AND([.B35]>=[Calendario.$F$8];[.B35]<=[Calendario.$F$9];1);1;IF(AND([.B35]>=[Calendario.$F$12];[.B35]<=[Calendario.$F$13]);2;IF(AND([.B35]>=[Calendario.$F$16];[.B35]<=[Calendario.$F$17]);3;""))) -> 1 | D35: of:=IF(COUNTIF([Calendario.$H$4:.$H$48];[.B35])>0;"FIESTA";"") ->  | E35: of:=IF([.B35]<>"";VLOOKUP(WEEKDAY([.B35];3);[Calendario.$A$4:.$C$11];2);"") -> Sabado | F35: of:=IF([.B35]<>"";IF([.D35]<>"FIESTA";VLOOKUP(WEEKDAY([.B35];3);[Calendario.$A$4:.$C$11];3);0);"") -> 0 | G35: of:=IF(ISNUMBER([.F35]);[.F35]+[.G34];"") -> 14 | H35: of:=IF(AND([.G35]<=[Unidades.$G$26];[.G35]<=[Unidades.$F$18];[Unidades.$F$18]>0);[Unidades.$D$18]+1-COUNTIFS([Unidades.$O$3:.$O$17];">="&[.G35]);"") -> 1 | I35: of:=IF([.H34]<>[.H35];"INICIO";IF([.H36]<>[.H35];"FIN";"")) ->  | J35: of:=IF([.K34]<>[.K35];"INICIO";IF([.K36]<>[.K35];"FIN";"")) -> 
A36: of:=IF([.B36]<>"";TODAY()>[.B36];"") -> 0 | B36: of:=IFERROR(IF(AND(ISNUMBER([.B35]);([.B35]+1)<[Calendario.$F$5]);[.B35]+1;"");"") -> 2015-10-11 | C36: of:=IF(AND([.B36]>=[Calendario.$F$8];[.B36]<=[Calendario.$F$9];1);1;IF(AND([.B36]>=[Calendario.$F$12];[.B36]<=[Calendario.$F$13]);2;IF(AND([.B36]>=[Calendario.$F$16];[.B36]<=[Calendario.$F$17]);3;""))) -> 1 | D36: of:=IF(COUNTIF([Calendario.$H$4:.$H$48];[.B36])>0;"FIESTA";"") ->  | E36: of:=IF([.B36]<>"";VLOOKUP(WEEKDAY([.B36];3);[Calendario.$A$4:.$C$11];2);"") -> Domingo | F36: of:=IF([.B36]<>"";IF([.D36]<>"FIESTA";VLOOKUP(WEEKDAY([.B36];3);[Calendario.$A$4:.$C$11];3);0);"") -> 0 | G36: of:=IF(ISNUMBER([.F36]);[.F36]+[.G35];"") -> 14 | H36: of:=IF(AND([.G36]<=[Unidades.$G$26];[.G36]<=[Unidades.$F$18];[Unidades.$F$18]>0);[Unidades.$D$18]+1-COUNTIFS([Unidades.$O$3:.$O$17];">="&[.G36]);"") -> 1 | I36: of:=IF([.H35]<>[.H36];"INICIO";IF([.H37]<>[.H36];"FIN";"")) ->  | J36: of:=IF([.K35]<>[.K36];"INICIO";IF([.K37]<>[.K36];"FIN";"")) -> 
A37: of:=IF([.B37]<>"";TODAY()>[.B37];"") -> 0 | B37: of:=IFERROR(IF(AND(ISNUMBER([.B36]);([.B36]+1)<[Calendario.$F$5]);[.B36]+1;"");"") -> 2015-10-12 | C37: of:=IF(AND([.B37]>=[Calendario.$F$8];[.B37]<=[Calendario.$F$9];1);1;IF(AND([.B37]>=[Calendario.$F$12];[.B37]<=[Calendario.$F$13]);2;IF(AND([.B37]>=[Calendario.$F$16];[.B37]<=[Calendario.$F$17]);3;""))) -> 1 | D37: of:=IF(COUNTIF([Calendario.$H$4:.$H$48];[.B37])>0;"FIESTA";"") ->  | E37: of:=IF([.B37]<>"";VLOOKUP(WEEKDAY([.B37];3);[Calendario.$A$4:.$C$11];2);"") -> Lunes | F37: of:=IF([.B37]<>"";IF([.D37]<>"FIESTA";VLOOKUP(WEEKDAY([.B37];3);[Calendario.$A$4:.$C$11];3);0);"") -> 1 | G37: of:=IF(ISNUMBER([.F37]);[.F37]+[.G36];"") -> 15 | H37: of:=IF(AND([.G37]<=[Unidades.$G$26];[.G37]<=[Unidades.$F$18];[Unidades.$F$18]>0);[Unidades.$D$18]+1-COUNTIFS([Unidades.$O$3:.$O$17];">="&[.G37]);"") -> 1 | I37: of:=IF([.H36]<>[.H37];"INICIO";IF([.H38]<>[.H37];"FIN";"")) ->  | J37: of:=IF([.K36]<>[.K37];"INICIO";IF([.K38]<>[.K37];"FIN";"")) -> 
A38: of:=IF([.B38]<>"";TODAY()>[.B38];"") -> 0 | B38: of:=IFERROR(IF(AND(ISNUMBER([.B37]);([.B37]+1)<[Calendario.$F$5]);[.B37]+1;"");"") -> 2015-10-13 | C38: of:=IF(AND([.B38]>=[Calendario.$F$8];[.B38]<=[Calendario.$F$9];1);1;IF(AND([.B38]>=[Calendario.$F$12];[.B38]<=[Calendario.$F$13]);2;IF(AND([.B38]>=[Calendario.$F$16];[.B38]<=[Calendario.$F$17]);3;""))) -> 1 | D38: of:=IF(COUNTIF([Calendario.$H$4:.$H$48];[.B38])>0;"FIESTA";"") ->  | E38: of:=IF([.B38]<>"";VLOOKUP(WEEKDAY([.B38];3);[Calendario.$A$4:.$C$11];2);"") -> Martes | F38: of:=IF([.B38]<>"";IF([.D38]<>"FIESTA";VLOOKUP(WEEKDAY([.B38];3);[Calendario.$A$4:.$C$11];3);0);"") -> 0 | G38: of:=IF(ISNUMBER([.F38]);[.F38]+[.G37];"") -> 15 | H38: of:=IF(AND([.G38]<=[Unidades.$G$26];[.G38]<=[Unidades.$F$18];[Unidades.$F$18]>0);[Unidades.$D$18]+1-COUNTIFS([Unidades.$O$3:.$O$17];">="&[.G38]);"") -> 1 | I38: of:=IF([.H37]<>[.H38];"INICIO";IF([.H39]<>[.H38];"FIN";"")) ->  | J38: of:=IF([.K37]<>[.K38];"INICIO";IF([.K39]<>[.K38];"FIN";"")) -> 
A39: of:=IF([.B39]<>"";TODAY()>[.B39];"") -> 0 | B39: of:=IFERROR(IF(AND(ISNUMBER([.B38]);([.B38]+1)<[Calendario.$F$5]);[.B38]+1;"");"") -> 2015-10-14 | C39: of:=IF(AND([.B39]>=[Calendario.$F$8];[.B39]<=[Calendario.$F$9];1);1;IF(AND([.B39]>=[Calendario.$F$12];[.B39]<=[Calendario.$F$13]);2;IF(AND([.B39]>=[Calendario.$F$16];[.B39]<=[Calendario.$F$17]);3;""))) -> 1 | D39: of:=IF(COUNTIF([Calendario.$H$4:.$H$48];[.B39])>0;"FIESTA";"") ->  | E39: of:=IF([.B39]<>"";VLOOKUP(WEEKDAY([.B39];3);[Calendario.$A$4:.$C$11];2);"") -> Miercoles | F39: of:=IF([.B39]<>"";IF([.D39]<>"FIESTA";VLOOKUP(WEEKDAY([.B39];3);[Calendario.$A$4:.$C$11];3);0);"") -> 1 | G39: of:=IF(ISNUMBER([.F39]);[.F39]+[.G38];"") -> 16 | H39: of:=IF(AND([.G39]<=[Unidades.$G$26];[.G39]<=[Unidades.$F$18];[Unidades.$F$18]>0);[Unidades.$D$18]+1-COUNTIFS([Unidades.$O$3:.$O$17];">="&[.G39]);"") -> 1 | I39: of:=IF([.H38]<>[.H39];"INICIO";IF([.H40]<>[.H39];"FIN";"")) ->  | J39: of:=IF([.K38]<>[.K39];"INICIO";IF([.K40]<>[.K39];"FIN";"")) -> 
A40: of:=IF([.B40]<>"";TODAY()>[.B40];"") -> 0 | B40: of:=IFERROR(IF(AND(ISNUMBER([.B39]);([.B39]+1)<[Calendario.$F$5]);[.B39]+1;"");"") -> 2015-10-15 | C40: of:=IF(AND([.B40]>=[Calendario.$F$8];[.B40]<=[Calendario.$F$9];1);1;IF(AND([.B40]>=[Calendario.$F$12];[.B40]<=[Calendario.$F$13]);2;IF(AND([.B40]>=[Calendario.$F$16];[.B40]<=[Calendario.$F$17]);3;""))) -> 1 | D40: of:=IF(COUNTIF([Calendario.$H$4:.$H$48];[.B40])>0;"FIESTA";"") ->  | E40: of:=IF([.B40]<>"";VLOOKUP(WEEKDAY([.B40];3);[Calendario.$A$4:.$C$11];2);"") -> Jueves | F40: of:=IF([.B40]<>"";IF([.D40]<>"FIESTA";VLOOKUP(WEEKDAY([.B40];3);[Calendario.$A$4:.$C$11];3);0);"") -> 0 | G40: of:=IF(ISNUMBER([.F40]);[.F40]+[.G39];"") -> 16 | H40: of:=IF(AND([.G40]<=[Unidades.$G$26];[.G40]<=[Unidades.$F$18];[Unidades.$F$18]>0);[Unidades.$D$18]+1-COUNTIFS([Unidades.$O$3:.$O$17];">="&[.G40]);"") -> 1 | I40: of:=IF([.H39]<>[.H40];"INICIO";IF([.H41]<>[.H40];"FIN";"")) ->  | J40: of:=IF([.K39]<>[.K40];"INICIO";IF([.K41]<>[.K40];"FIN";"")) -> 
A41: of:=IF([.B41]<>"";TODAY()>[.B41];"") -> 0 | B41: of:=IFERROR(IF(AND(ISNUMBER([.B40]);([.B40]+1)<[Calendario.$F$5]);[.B40]+1;"");"") -> 2015-10-16 | C41: of:=IF(AND([.B41]>=[Calendario.$F$8];[.B41]<=[Calendario.$F$9];1);1;IF(AND([.B41]>=[Calendario.$F$12];[.B41]<=[Calendario.$F$13]);2;IF(AND([.B41]>=[Calendario.$F$16];[.B41]<=[Calendario.$F$17]);3;""))) -> 1 | D41: of:=IF(COUNTIF([Calendario.$H$4:.$H$48];[.B41])>0;"FIESTA";"") ->  | E41: of:=IF([.B41]<>"";VLOOKUP(WEEKDAY([.B41];3);[Calendario.$A$4:.$C$11];2);"") -> Viernes | F41: of:=IF([.B41]<>"";IF([.D41]<>"FIESTA";VLOOKUP(WEEKDAY([.B41];3);[Calendario.$A$4:.$C$11];3);0);"") -> 1 | G41: of:=IF(ISNUMBER([.F41]);[.F41]+[.G40];"") -> 17 | H41: of:=IF(AND([.G41]<=[Unidades.$G$26];[.G41]<=[Unidades.$F$18];[Unidades.$F$18]>0);[Unidades.$D$18]+1-COUNTIFS([Unidades.$O$3:.$O$17];">="&[.G41]);"") -> 1 | I41: of:=IF([.H40]<>[.H41];"INICIO";IF([.H42]<>[.H41];"FIN";"")) ->  | J41: of:=IF([.K40]<>[.K41];"INICIO";IF([.K42]<>[.K41];"FIN";"")) -> 
A42: of:=IF([.B42]<>"";TODAY()>[.B42];"") -> 0 | B42: of:=IFERROR(IF(AND(ISNUMBER([.B41]);([.B41]+1)<[Calendario.$F$5]);[.B41]+1;"");"") -> 2015-10-17 | C42: of:=IF(AND([.B42]>=[Calendario.$F$8];[.B42]<=[Calendario.$F$9];1);1;IF(AND([.B42]>=[Calendario.$F$12];[.B42]<=[Calendario.$F$13]);2;IF(AND([.B42]>=[Calendario.$F$16];[.B42]<=[Calendario.$F$17]);3;""))) -> 1 | D42: of:=IF(COUNTIF([Calendario.$H$4:.$H$48];[.B42])>0;"FIESTA";"") ->  | E42: of:=IF([.B42]<>"";VLOOKUP(WEEKDAY([.B42];3);[Calendario.$A$4:.$C$11];2);"") -> Sabado | F42: of:=IF([.B42]<>"";IF([.D42]<>"FIESTA";VLOOKUP(WEEKDAY([.B42];3);[Calendario.$A$4:.$C$11];3);0);"") -> 0 | G42: of:=IF(ISNUMBER([.F42]);[.F42]+[.G41];"") -> 17 | H42: of:=IF(AND([.G42]<=[Unidades.$G$26];[.G42]<=[Unidades.$F$18];[Unidades.$F$18]>0);[Unidades.$D$18]+1-COUNTIFS([Unidades.$O$3:.$O$17];">="&[.G42]);"") -> 1 | I42: of:=IF([.H41]<>[.H42];"INICIO";IF([.H43]<>[.H42];"FIN";"")) ->  | J42: of:=IF([.K41]<>[.K42];"INICIO";IF([.K43]<>[.K42];"FIN";"")) -> 
A43: of:=IF([.B43]<>"";TODAY()>[.B43];"") -> 0 | B43: of:=IFERROR(IF(AND(ISNUMBER([.B42]);([.B42]+1)<[Calendario.$F$5]);[.B42]+1;"");"") -> 2015-10-18 | C43: of:=IF(AND([.B43]>=[Calendario.$F$8];[.B43]<=[Calendario.$F$9];1);1;IF(AND([.B43]>=[Calendario.$F$12];[.B43]<=[Calendario.$F$13]);2;IF(AND([.B43]>=[Calendario.$F$16];[.B43]<=[Calendario.$F$17]);3;""))) -> 1 | D43: of:=IF(COUNTIF([Calendario.$H$4:.$H$48];[.B43])>0;"FIESTA";"") ->  | E43: of:=IF([.B43]<>"";VLOOKUP(WEEKDAY([.B43];3);[Calendario.$A$4:.$C$11];2);"") -> Domingo | F43: of:=IF([.B43]<>"";IF([.D43]<>"FIESTA";VLOOKUP(WEEKDAY([.B43];3);[Calendario.$A$4:.$C$11];3);0);"") -> 0 | G43: of:=IF(ISNUMBER([.F43]);[.F43]+[.G42];"") -> 17 | H43: of:=IF(AND([.G43]<=[Unidades.$G$26];[.G43]<=[Unidades.$F$18];[Unidades.$F$18]>0);[Unidades.$D$18]+1-COUNTIFS([Unidades.$O$3:.$O$17];">="&[.G43]);"") -> 1 | I43: of:=IF([.H42]<>[.H43];"INICIO";IF([.H44]<>[.H43];"FIN";"")) ->  | J43: of:=IF([.K42]<>[.K43];"INICIO";IF([.K44]<>[.K43];"FIN";"")) -> 
A44: of:=IF([.B44]<>"";TODAY()>[.B44];"") -> 0 | B44: of:=IFERROR(IF(AND(ISNUMBER([.B43]);([.B43]+1)<[Calendario.$F$5]);[.B43]+1;"");"") -> 2015-10-19 | C44: of:=IF(AND([.B44]>=[Calendario.$F$8];[.B44]<=[Calendario.$F$9];1);1;IF(AND([.B44]>=[Calendario.$F$12];[.B44]<=[Calendario.$F$13]);2;IF(AND([.B44]>=[Calendario.$F$16];[.B44]<=[Calendario.$F$17]);3;""))) -> 1 | D44: of:=IF(COUNTIF([Calendario.$H$4:.$H$48];[.B44])>0;"FIESTA";"") ->  | E44: of:=IF([.B44]<>"";VLOOKUP(WEEKDAY([.B44];3);[Calendario.$A$4:.$C$11];2);"") -> Lunes | F44: of:=IF([.B44]<>"";IF([.D44]<>"FIESTA";VLOOKUP(WEEKDAY([.B44];3);[Calendario.$A$4:.$C$11];3);0);"") -> 1 | G44: of:=IF(ISNUMBER([.F44]);[.F44]+[.G43];"") -> 18 | H44: of:=IF(AND([.G44]<=[Unidades.$G$26];[.G44]<=[Unidades.$F$18];[Unidades.$F$18]>0);[Unidades.$D$18]+1-COUNTIFS([Unidades.$O$3:.$O$17];">="&[.G44]);"") -> 1 | I44: of:=IF([.H43]<>[.H44];"INICIO";IF([.H45]<>[.H44];"FIN";"")) ->  | J44: of:=IF([.K43]<>[.K44];"INICIO";IF([.K45]<>[.K44];"FIN";"")) -> 
A45: of:=IF([.B45]<>"";TODAY()>[.B45];"") -> 0 | B45: of:=IFERROR(IF(AND(ISNUMBER([.B44]);([.B44]+1)<[Calendario.$F$5]);[.B44]+1;"");"") -> 2015-10-20 | C45: of:=IF(AND([.B45]>=[Calendario.$F$8];[.B45]<=[Calendario.$F$9];1);1;IF(AND([.B45]>=[Calendario.$F$12];[.B45]<=[Calendario.$F$13]);2;IF(AND([.B45]>=[Calendario.$F$16];[.B45]<=[Calendario.$F$17]);3;""))) -> 1 | D45: of:=IF(COUNTIF([Calendario.$H$4:.$H$48];[.B45])>0;"FIESTA";"") ->  | E45: of:=IF([.B45]<>"";VLOOKUP(WEEKDAY([.B45];3);[Calendario.$A$4:.$C$11];2);"") -> Martes | F45: of:=IF([.B45]<>"";IF([.D45]<>"FIESTA";VLOOKUP(WEEKDAY([.B45];3);[Calendario.$A$4:.$C$11];3);0);"") -> 0 | G45: of:=IF(ISNUMBER([.F45]);[.F45]+[.G44];"") -> 18 | H45: of:=IF(AND([.G45]<=[Unidades.$G$26];[.G45]<=[Unidades.$F$18];[Unidades.$F$18]>0);[Unidades.$D$18]+1-COUNTIFS([Unidades.$O$3:.$O$17];">="&[.G45]);"") -> 1 | I45: of:=IF([.H44]<>[.H45];"INICIO";IF([.H46]<>[.H45];"FIN";"")) ->  | J45: of:=IF([.K44]<>[.K45];"INICIO";IF([.K46]<>[.K45];"FIN";"")) -> 
A46: of:=IF([.B46]<>"";TODAY()>[.B46];"") -> 0 | B46: of:=IFERROR(IF(AND(ISNUMBER([.B45]);([.B45]+1)<[Calendario.$F$5]);[.B45]+1;"");"") -> 2015-10-21 | C46: of:=IF(AND([.B46]>=[Calendario.$F$8];[.B46]<=[Calendario.$F$9];1);1;IF(AND([.B46]>=[Calendario.$F$12];[.B46]<=[Calendario.$F$13]);2;IF(AND([.B46]>=[Calendario.$F$16];[.B46]<=[Calendario.$F$17]);3;""))) -> 1 | D46: of:=IF(COUNTIF([Calendario.$H$4:.$H$48];[.B46])>0;"FIESTA";"") ->  | E46: of:=IF([.B46]<>"";VLOOKUP(WEEKDAY([.B46];3);[Calendario.$A$4:.$C$11];2);"") -> Miercoles | F46: of:=IF([.B46]<>"";IF([.D46]<>"FIESTA";VLOOKUP(WEEKDAY([.B46];3);[Calendario.$A$4:.$C$11];3);0);"") -> 1 | G46: of:=IF(ISNUMBER([.F46]);[.F46]+[.G45];"") -> 19 | H46: of:=IF(AND([.G46]<=[Unidades.$G$26];[.G46]<=[Unidades.$F$18];[Unidades.$F$18]>0);[Unidades.$D$18]+1-COUNTIFS([Unidades.$O$3:.$O$17];">="&[.G46]);"") -> 1 | I46: of:=IF([.H45]<>[.H46];"INICIO";IF([.H47]<>[.H46];"FIN";"")) ->  | J46: of:=IF([.K45]<>[.K46];"INICIO";IF([.K47]<>[.K46];"FIN";"")) -> 
A47: of:=IF([.B47]<>"";TODAY()>[.B47];"") -> 0 | B47: of:=IFERROR(IF(AND(ISNUMBER([.B46]);([.B46]+1)<[Calendario.$F$5]);[.B46]+1;"");"") -> 2015-10-22 | C47: of:=IF(AND([.B47]>=[Calendario.$F$8];[.B47]<=[Calendario.$F$9];1);1;IF(AND([.B47]>=[Calendario.$F$12];[.B47]<=[Calendario.$F$13]);2;IF(AND([.B47]>=[Calendario.$F$16];[.B47]<=[Calendario.$F$17]);3;""))) -> 1 | D47: of:=IF(COUNTIF([Calendario.$H$4:.$H$48];[.B47])>0;"FIESTA";"") ->  | E47: of:=IF([.B47]<>"";VLOOKUP(WEEKDAY([.B47];3);[Calendario.$A$4:.$C$11];2);"") -> Jueves | F47: of:=IF([.B47]<>"";IF([.D47]<>"FIESTA";VLOOKUP(WEEKDAY([.B47];3);[Calendario.$A$4:.$C$11];3);0);"") -> 0 | G47: of:=IF(ISNUMBER([.F47]);[.F47]+[.G46];"") -> 19 | H47: of:=IF(AND([.G47]<=[Unidades.$G$26];[.G47]<=[Unidades.$F$18];[Unidades.$F$18]>0);[Unidades.$D$18]+1-COUNTIFS([Unidades.$O$3:.$O$17];">="&[.G47]);"") -> 1 | I47: of:=IF([.H46]<>[.H47];"INICIO";IF([.H48]<>[.H47];"FIN";"")) ->  | J47: of:=IF([.K46]<>[.K47];"INICIO";IF([.K48]<>[.K47];"FIN";"")) -> 
A48: of:=IF([.B48]<>"";TODAY()>[.B48];"") -> 0 | B48: of:=IFERROR(IF(AND(ISNUMBER([.B47]);([.B47]+1)<[Calendario.$F$5]);[.B47]+1;"");"") -> 2015-10-23 | C48: of:=IF(AND([.B48]>=[Calendario.$F$8];[.B48]<=[Calendario.$F$9];1);1;IF(AND([.B48]>=[Calendario.$F$12];[.B48]<=[Calendario.$F$13]);2;IF(AND([.B48]>=[Calendario.$F$16];[.B48]<=[Calendario.$F$17]);3;""))) -> 1 | D48: of:=IF(COUNTIF([Calendario.$H$4:.$H$48];[.B48])>0;"FIESTA";"") ->  | E48: of:=IF([.B48]<>"";VLOOKUP(WEEKDAY([.B48];3);[Calendario.$A$4:.$C$11];2);"") -> Viernes | F48: of:=IF([.B48]<>"";IF([.D48]<>"FIESTA";VLOOKUP(WEEKDAY([.B48];3);[Calendario.$A$4:.$C$11];3);0);"") -> 1 | G48: of:=IF(ISNUMBER([.F48]);[.F48]+[.G47];"") -> 20 | H48: of:=IF(AND([.G48]<=[Unidades.$G$26];[.G48]<=[Unidades.$F$18];[Unidades.$F$18]>0);[Unidades.$D$18]+1-COUNTIFS([Unidades.$O$3:.$O$17];">="&[.G48]);"") -> 1 | I48: of:=IF([.H47]<>[.H48];"INICIO";IF([.H49]<>[.H48];"FIN";"")) ->  | J48: of:=IF([.K47]<>[.K48];"INICIO";IF([.K49]<>[.K48];"FIN";"")) -> 
A49: of:=IF([.B49]<>"";TODAY()>[.B49];"") -> 0 | B49: of:=IFERROR(IF(AND(ISNUMBER([.B48]);([.B48]+1)<[Calendario.$F$5]);[.B48]+1;"");"") -> 2015-10-24 | C49: of:=IF(AND([.B49]>=[Calendario.$F$8];[.B49]<=[Calendario.$F$9];1);1;IF(AND([.B49]>=[Calendario.$F$12];[.B49]<=[Calendario.$F$13]);2;IF(AND([.B49]>=[Calendario.$F$16];[.B49]<=[Calendario.$F$17]);3;""))) -> 1 | D49: of:=IF(COUNTIF([Calendario.$H$4:.$H$48];[.B49])>0;"FIESTA";"") ->  | E49: of:=IF([.B49]<>"";VLOOKUP(WEEKDAY([.B49];3);[Calendario.$A$4:.$C$11];2);"") -> Sabado | F49: of:=IF([.B49]<>"";IF([.D49]<>"FIESTA";VLOOKUP(WEEKDAY([.B49];3);[Calendario.$A$4:.$C$11];3);0);"") -> 0 | G49: of:=IF(ISNUMBER([.F49]);[.F49]+[.G48];"") -> 20 | H49: of:=IF(AND([.G49]<=[Unidades.$G$26];[.G49]<=[Unidades.$F$18];[Unidades.$F$18]>0);[Unidades.$D$18]+1-COUNTIFS([Unidades.$O$3:.$O$17];">="&[.G49]);"") -> 1 | I49: of:=IF([.H48]<>[.H49];"INICIO";IF([.H50]<>[.H49];"FIN";"")) ->  | J49: of:=IF([.K48]<>[.K49];"INICIO";IF([.K50]<>[.K49];"FIN";"")) -> 
A50: of:=IF([.B50]<>"";TODAY()>[.B50];"") -> 0 | B50: of:=IFERROR(IF(AND(ISNUMBER([.B49]);([.B49]+1)<[Calendario.$F$5]);[.B49]+1;"");"") -> 2015-10-25 | C50: of:=IF(AND([.B50]>=[Calendario.$F$8];[.B50]<=[Calendario.$F$9];1);1;IF(AND([.B50]>=[Calendario.$F$12];[.B50]<=[Calendario.$F$13]);2;IF(AND([.B50]>=[Calendario.$F$16];[.B50]<=[Calendario.$F$17]);3;""))) -> 1 | D50: of:=IF(COUNTIF([Calendario.$H$4:.$H$48];[.B50])>0;"FIESTA";"") ->  | E50: of:=IF([.B50]<>"";VLOOKUP(WEEKDAY([.B50];3);[Calendario.$A$4:.$C$11];2);"") -> Domingo | F50: of:=IF([.B50]<>"";IF([.D50]<>"FIESTA";VLOOKUP(WEEKDAY([.B50];3);[Calendario.$A$4:.$C$11];3);0);"") -> 0 | G50: of:=IF(ISNUMBER([.F50]);[.F50]+[.G49];"") -> 20 | H50: of:=IF(AND([.G50]<=[Unidades.$G$26];[.G50]<=[Unidades.$F$18];[Unidades.$F$18]>0);[Unidades.$D$18]+1-COUNTIFS([Unidades.$O$3:.$O$17];">="&[.G50]);"") -> 1 | I50: of:=IF([.H49]<>[.H50];"INICIO";IF([.H51]<>[.H50];"FIN";"")) -> FIN | J50: of:=IF([.K49]<>[.K50];"INICIO";IF([.K51]<>[.K50];"FIN";"")) -> 
A51: of:=IF([.B51]<>"";TODAY()>[.B51];"") -> 0 | B51: of:=IFERROR(IF(AND(ISNUMBER([.B50]);([.B50]+1)<[Calendario.$F$5]);[.B50]+1;"");"") -> 2015-10-26 | C51: of:=IF(AND([.B51]>=[Calendario.$F$8];[.B51]<=[Calendario.$F$9];1);1;IF(AND([.B51]>=[Calendario.$F$12];[.B51]<=[Calendario.$F$13]);2;IF(AND([.B51]>=[Calendario.$F$16];[.B51]<=[Calendario.$F$17]);3;""))) -> 1 | D51: of:=IF(COUNTIF([Calendario.$H$4:.$H$48];[.B51])>0;"FIESTA";"") ->  | E51: of:=IF([.B51]<>"";VLOOKUP(WEEKDAY([.B51];3);[Calendario.$A$4:.$C$11];2);"") -> Lunes | F51: of:=IF([.B51]<>"";IF([.D51]<>"FIESTA";VLOOKUP(WEEKDAY([.B51];3);[Calendario.$A$4:.$C$11];3);0);"") -> 1 | G51: of:=IF(ISNUMBER([.F51]);[.F51]+[.G50];"") -> 21 | H51: of:=IF(AND([.G51]<=[Unidades.$G$26];[.G51]<=[Unidades.$F$18];[Unidades.$F$18]>0);[Unidades.$D$18]+1-COUNTIFS([Unidades.$O$3:.$O$17];">="&[.G51]);"") -> 2 | I51: of:=IF([.H50]<>[.H51];"INICIO";IF([.H52]<>[.H51];"FIN";"")) -> INICIO | J51: of:=IF([.K50]<>[.K51];"INICIO";IF([.K52]<>[.K51];"FIN";"")) -> 
A52: of:=IF([.B52]<>"";TODAY()>[.B52];"") -> 0 | B52: of:=IFERROR(IF(AND(ISNUMBER([.B51]);([.B51]+1)<[Calendario.$F$5]);[.B51]+1;"");"") -> 2015-10-27 | C52: of:=IF(AND([.B52]>=[Calendario.$F$8];[.B52]<=[Calendario.$F$9];1);1;IF(AND([.B52]>=[Calendario.$F$12];[.B52]<=[Calendario.$F$13]);2;IF(AND([.B52]>=[Calendario.$F$16];[.B52]<=[Calendario.$F$17]);3;""))) -> 1 | D52: of:=IF(COUNTIF([Calendario.$H$4:.$H$48];[.B52])>0;"FIESTA";"") ->  | E52: of:=IF([.B52]<>"";VLOOKUP(WEEKDAY([.B52];3);[Calendario.$A$4:.$C$11];2);"") -> Martes | F52: of:=IF([.B52]<>"";IF([.D52]<>"FIESTA";VLOOKUP(WEEKDAY([.B52];3);[Calendario.$A$4:.$C$11];3);0);"") -> 0 | G52: of:=IF(ISNUMBER([.F52]);[.F52]+[.G51];"") -> 21 | H52: of:=IF(AND([.G52]<=[Unidades.$G$26];[.G52]<=[Unidades.$F$18];[Unidades.$F$18]>0);[Unidades.$D$18]+1-COUNTIFS([Unidades.$O$3:.$O$17];">="&[.G52]);"") -> 2 | I52: of:=IF([.H51]<>[.H52];"INICIO";IF([.H53]<>[.H52];"FIN";"")) ->  | J52: of:=IF([.K51]<>[.K52];"INICIO";IF([.K53]<>[.K52];"FIN";"")) -> 
A53: of:=IF([.B53]<>"";TODAY()>[.B53];"") -> 0 | B53: of:=IFERROR(IF(AND(ISNUMBER([.B52]);([.B52]+1)<[Calendario.$F$5]);[.B52]+1;"");"") -> 2015-10-28 | C53: of:=IF(AND([.B53]>=[Calendario.$F$8];[.B53]<=[Calendario.$F$9];1);1;IF(AND([.B53]>=[Calendario.$F$12];[.B53]<=[Calendario.$F$13]);2;IF(AND([.B53]>=[Calendario.$F$16];[.B53]<=[Calendario.$F$17]);3;""))) -> 1 | D53: of:=IF(COUNTIF([Calendario.$H$4:.$H$48];[.B53])>0;"FIESTA";"") ->  | E53: of:=IF([.B53]<>"";VLOOKUP(WEEKDAY([.B53];3);[Calendario.$A$4:.$C$11];2);"") -> Miercoles | F53: of:=IF([.B53]<>"";IF([.D53]<>"FIESTA";VLOOKUP(WEEKDAY([.B53];3);[Calendario.$A$4:.$C$11];3);0);"") -> 1 | G53: of:=IF(ISNUMBER([.F53]);[.F53]+[.G52];"") -> 22 | H53: of:=IF(AND([.G53]<=[Unidades.$G$26];[.G53]<=[Unidades.$F$18];[Unidades.$F$18]>0);[Unidades.$D$18]+1-COUNTIFS([Unidades.$O$3:.$O$17];">="&[.G53]);"") -> 2 | I53: of:=IF([.H52]<>[.H53];"INICIO";IF([.H54]<>[.H53];"FIN";"")) ->  | J53: of:=IF([.K52]<>[.K53];"INICIO";IF([.K54]<>[.K53];"FIN";"")) -> 
A54: of:=IF([.B54]<>"";TODAY()>[.B54];"") -> 0 | B54: of:=IFERROR(IF(AND(ISNUMBER([.B53]);([.B53]+1)<[Calendario.$F$5]);[.B53]+1;"");"") -> 2015-10-29 | C54: of:=IF(AND([.B54]>=[Calendario.$F$8];[.B54]<=[Calendario.$F$9];1);1;IF(AND([.B54]>=[Calendario.$F$12];[.B54]<=[Calendario.$F$13]);2;IF(AND([.B54]>=[Calendario.$F$16];[.B54]<=[Calendario.$F$17]);3;""))) -> 1 | D54: of:=IF(COUNTIF([Calendario.$H$4:.$H$48];[.B54])>0;"FIESTA";"") ->  | E54: of:=IF([.B54]<>"";VLOOKUP(WEEKDAY([.B54];3);[Calendario.$A$4:.$C$11];2);"") -> Jueves | F54: of:=IF([.B54]<>"";IF([.D54]<>"FIESTA";VLOOKUP(WEEKDAY([.B54];3);[Calendario.$A$4:.$C$11];3);0);"") -> 0 | G54: of:=IF(ISNUMBER([.F54]);[.F54]+[.G53];"") -> 22 | H54: of:=IF(AND([.G54]<=[Unidades.$G$26];[.G54]<=[Unidades.$F$18];[Unidades.$F$18]>0);[Unidades.$D$18]+1-COUNTIFS([Unidades.$O$3:.$O$17];">="&[.G54]);"") -> 2 | I54: of:=IF([.H53]<>[.H54];"INICIO";IF([.H55]<>[.H54];"FIN";"")) ->  | J54: of:=IF([.K53]<>[.K54];"INICIO";IF([.K55]<>[.K54];"FIN";"")) -> 
A55: of:=IF([.B55]<>"";TODAY()>[.B55];"") -> 0 | B55: of:=IFERROR(IF(AND(ISNUMBER([.B54]);([.B54]+1)<[Calendario.$F$5]);[.B54]+1;"");"") -> 2015-10-30 | C55: of:=IF(AND([.B55]>=[Calendario.$F$8];[.B55]<=[Calendario.$F$9];1);1;IF(AND([.B55]>=[Calendario.$F$12];[.B55]<=[Calendario.$F$13]);2;IF(AND([.B55]>=[Calendario.$F$16];[.B55]<=[Calendario.$F$17]);3;""))) -> 1 | D55: of:=IF(COUNTIF([Calendario.$H$4:.$H$48];[.B55])>0;"FIESTA";"") ->  | E55: of:=IF([.B55]<>"";VLOOKUP(WEEKDAY([.B55];3);[Calendario.$A$4:.$C$11];2);"") -> Viernes | F55: of:=IF([.B55]<>"";IF([.D55]<>"FIESTA";VLOOKUP(WEEKDAY([.B55];3);[Calendario.$A$4:.$C$11];3);0);"") -> 1 | G55: of:=IF(ISNUMBER([.F55]);[.F55]+[.G54];"") -> 23 | H55: of:=IF(AND([.G55]<=[Unidades.$G$26];[.G55]<=[Unidades.$F$18];[Unidades.$F$18]>0);[Unidades.$D$18]+1-COUNTIFS([Unidades.$O$3:.$O$17];">="&[.G55]);"") -> 2 | I55: of:=IF([.H54]<>[.H55];"INICIO";IF([.H56]<>[.H55];"FIN";"")) ->  | J55: of:=IF([.K54]<>[.K55];"INICIO";IF([.K56]<>[.K55];"FIN";"")) -> 
A56: of:=IF([.B56]<>"";TODAY()>[.B56];"") -> 0 | B56: of:=IFERROR(IF(AND(ISNUMBER([.B55]);([.B55]+1)<[Calendario.$F$5]);[.B55]+1;"");"") -> 2015-10-31 | C56: of:=IF(AND([.B56]>=[Calendario.$F$8];[.B56]<=[Calendario.$F$9];1);1;IF(AND([.B56]>=[Calendario.$F$12];[.B56]<=[Calendario.$F$13]);2;IF(AND([.B56]>=[Calendario.$F$16];[.B56]<=[Calendario.$F$17]);3;""))) -> 1 | D56: of:=IF(COUNTIF([Calendario.$H$4:.$H$48];[.B56])>0;"FIESTA";"") ->  | E56: of:=IF([.B56]<>"";VLOOKUP(WEEKDAY([.B56];3);[Calendario.$A$4:.$C$11];2);"") -> Sabado | F56: of:=IF([.B56]<>"";IF([.D56]<>"FIESTA";VLOOKUP(WEEKDAY([.B56];3);[Calendario.$A$4:.$C$11];3);0);"") -> 0 | G56: of:=IF(ISNUMBER([.F56]);[.F56]+[.G55];"") -> 23 | H56: of:=IF(AND([.G56]<=[Unidades.$G$26];[.G56]<=[Unidades.$F$18];[Unidades.$F$18]>0);[Unidades.$D$18]+1-COUNTIFS([Unidades.$O$3:.$O$17];">="&[.G56]);"") -> 2 | I56: of:=IF([.H55]<>[.H56];"INICIO";IF([.H57]<>[.H56];"FIN";"")) ->  | J56: of:=IF([.K55]<>[.K56];"INICIO";IF([.K57]<>[.K56];"FIN";"")) -> 
A57: of:=IF([.B57]<>"";TODAY()>[.B57];"") -> 0 | B57: of:=IFERROR(IF(AND(ISNUMBER([.B56]);([.B56]+1)<[Calendario.$F$5]);[.B56]+1;"");"") -> 2015-11-01 | C57: of:=IF(AND([.B57]>=[Calendario.$F$8];[.B57]<=[Calendario.$F$9];1);1;IF(AND([.B57]>=[Calendario.$F$12];[.B57]<=[Calendario.$F$13]);2;IF(AND([.B57]>=[Calendario.$F$16];[.B57]<=[Calendario.$F$17]);3;""))) -> 1 | D57: of:=IF(COUNTIF([Calendario.$H$4:.$H$48];[.B57])>0;"FIESTA";"") ->  | E57: of:=IF([.B57]<>"";VLOOKUP(WEEKDAY([.B57];3);[Calendario.$A$4:.$C$11];2);"") -> Domingo | F57: of:=IF([.B57]<>"";IF([.D57]<>"FIESTA";VLOOKUP(WEEKDAY([.B57];3);[Calendario.$A$4:.$C$11];3);0);"") -> 0 | G57: of:=IF(ISNUMBER([.F57]);[.F57]+[.G56];"") -> 23 | H57: of:=IF(AND([.G57]<=[Unidades.$G$26];[.G57]<=[Unidades.$F$18];[Unidades.$F$18]>0);[Unidades.$D$18]+1-COUNTIFS([Unidades.$O$3:.$O$17];">="&[.G57]);"") -> 2 | I57: of:=IF([.H56]<>[.H57];"INICIO";IF([.H58]<>[.H57];"FIN";"")) ->  | J57: of:=IF([.K56]<>[.K57];"INICIO";IF([.K58]<>[.K57];"FIN";"")) -> 
A58: of:=IF([.B58]<>"";TODAY()>[.B58];"") -> 0 | B58: of:=IFERROR(IF(AND(ISNUMBER([.B57]);([.B57]+1)<[Calendario.$F$5]);[.B57]+1;"");"") -> 2015-11-02 | C58: of:=IF(AND([.B58]>=[Calendario.$F$8];[.B58]<=[Calendario.$F$9];1);1;IF(AND([.B58]>=[Calendario.$F$12];[.B58]<=[Calendario.$F$13]);2;IF(AND([.B58]>=[Calendario.$F$16];[.B58]<=[Calendario.$F$17]);3;""))) -> 1 | D58: of:=IF(COUNTIF([Calendario.$H$4:.$H$48];[.B58])>0;"FIESTA";"") ->  | E58: of:=IF([.B58]<>"";VLOOKUP(WEEKDAY([.B58];3);[Calendario.$A$4:.$C$11];2);"") -> Lunes | F58: of:=IF([.B58]<>"";IF([.D58]<>"FIESTA";VLOOKUP(WEEKDAY([.B58];3);[Calendario.$A$4:.$C$11];3);0);"") -> 1 | G58: of:=IF(ISNUMBER([.F58]);[.F58]+[.G57];"") -> 24 | H58: of:=IF(AND([.G58]<=[Unidades.$G$26];[.G58]<=[Unidades.$F$18];[Unidades.$F$18]>0);[Unidades.$D$18]+1-COUNTIFS([Unidades.$O$3:.$O$17];">="&[.G58]);"") -> 2 | I58: of:=IF([.H57]<>[.H58];"INICIO";IF([.H59]<>[.H58];"FIN";"")) ->  | J58: of:=IF([.K57]<>[.K58];"INICIO";IF([.K59]<>[.K58];"FIN";"")) -> 
A59: of:=IF([.B59]<>"";TODAY()>[.B59];"") -> 0 | B59: of:=IFERROR(IF(AND(ISNUMBER([.B58]);([.B58]+1)<[Calendario.$F$5]);[.B58]+1;"");"") -> 2015-11-03 | C59: of:=IF(AND([.B59]>=[Calendario.$F$8];[.B59]<=[Calendario.$F$9];1);1;IF(AND([.B59]>=[Calendario.$F$12];[.B59]<=[Calendario.$F$13]);2;IF(AND([.B59]>=[Calendario.$F$16];[.B59]<=[Calendario.$F$17]);3;""))) -> 1 | D59: of:=IF(COUNTIF([Calendario.$H$4:.$H$48];[.B59])>0;"FIESTA";"") ->  | E59: of:=IF([.B59]<>"";VLOOKUP(WEEKDAY([.B59];3);[Calendario.$A$4:.$C$11];2);"") -> Martes | F59: of:=IF([.B59]<>"";IF([.D59]<>"FIESTA";VLOOKUP(WEEKDAY([.B59];3);[Calendario.$A$4:.$C$11];3);0);"") -> 0 | G59: of:=IF(ISNUMBER([.F59]);[.F59]+[.G58];"") -> 24 | H59: of:=IF(AND([.G59]<=[Unidades.$G$26];[.G59]<=[Unidades.$F$18];[Unidades.$F$18]>0);[Unidades.$D$18]+1-COUNTIFS([Unidades.$O$3:.$O$17];">="&[.G59]);"") -> 2 | I59: of:=IF([.H58]<>[.H59];"INICIO";IF([.H60]<>[.H59];"FIN";"")) ->  | J59: of:=IF([.K58]<>[.K59];"INICIO";IF([.K60]<>[.K59];"FIN";"")) -> 
A60: of:=IF([.B60]<>"";TODAY()>[.B60];"") -> 0 | B60: of:=IFERROR(IF(AND(ISNUMBER([.B59]);([.B59]+1)<[Calendario.$F$5]);[.B59]+1;"");"") -> 2015-11-04 | C60: of:=IF(AND([.B60]>=[Calendario.$F$8];[.B60]<=[Calendario.$F$9];1);1;IF(AND([.B60]>=[Calendario.$F$12];[.B60]<=[Calendario.$F$13]);2;IF(AND([.B60]>=[Calendario.$F$16];[.B60]<=[Calendario.$F$17]);3;""))) -> 1 | D60: of:=IF(COUNTIF([Calendario.$H$4:.$H$48];[.B60])>0;"FIESTA";"") ->  | E60: of:=IF([.B60]<>"";VLOOKUP(WEEKDAY([.B60];3);[Calendario.$A$4:.$C$11];2);"") -> Miercoles | F60: of:=IF([.B60]<>"";IF([.D60]<>"FIESTA";VLOOKUP(WEEKDAY([.B60];3);[Calendario.$A$4:.$C$11];3);0);"") -> 1 | G60: of:=IF(ISNUMBER([.F60]);[.F60]+[.G59];"") -> 25 | H60: of:=IF(AND([.G60]<=[Unidades.$G$26];[.G60]<=[Unidades.$F$18];[Unidades.$F$18]>0);[Unidades.$D$18]+1-COUNTIFS([Unidades.$O$3:.$O$17];">="&[.G60]);"") -> 2 | I60: of:=IF([.H59]<>[.H60];"INICIO";IF([.H61]<>[.H60];"FIN";"")) ->  | J60: of:=IF([.K59]<>[.K60];"INICIO";IF([.K61]<>[.K60];"FIN";"")) -> 
A61: of:=IF([.B61]<>"";TODAY()>[.B61];"") -> 0 | B61: of:=IFERROR(IF(AND(ISNUMBER([.B60]);([.B60]+1)<[Calendario.$F$5]);[.B60]+1;"");"") -> 2015-11-05 | C61: of:=IF(AND([.B61]>=[Calendario.$F$8];[.B61]<=[Calendario.$F$9];1);1;IF(AND([.B61]>=[Calendario.$F$12];[.B61]<=[Calendario.$F$13]);2;IF(AND([.B61]>=[Calendario.$F$16];[.B61]<=[Calendario.$F$17]);3;""))) -> 1 | D61: of:=IF(COUNTIF([Calendario.$H$4:.$H$48];[.B61])>0;"FIESTA";"") ->  | E61: of:=IF([.B61]<>"";VLOOKUP(WEEKDAY([.B61];3);[Calendario.$A$4:.$C$11];2);"") -> Jueves | F61: of:=IF([.B61]<>"";IF([.D61]<>"FIESTA";VLOOKUP(WEEKDAY([.B61];3);[Calendario.$A$4:.$C$11];3);0);"") -> 0 | G61: of:=IF(ISNUMBER([.F61]);[.F61]+[.G60];"") -> 25 | H61: of:=IF(AND([.G61]<=[Unidades.$G$26];[.G61]<=[Unidades.$F$18];[Unidades.$F$18]>0);[Unidades.$D$18]+1-COUNTIFS([Unidades.$O$3:.$O$17];">="&[.G61]);"") -> 2 | I61: of:=IF([.H60]<>[.H61];"INICIO";IF([.H62]<>[.H61];"FIN";"")) ->  | J61: of:=IF([.K60]<>[.K61];"INICIO";IF([.K62]<>[.K61];"FIN";"")) -> 
A62: of:=IF([.B62]<>"";TODAY()>[.B62];"") -> 0 | B62: of:=IFERROR(IF(AND(ISNUMBER([.B61]);([.B61]+1)<[Calendario.$F$5]);[.B61]+1;"");"") -> 2015-11-06 | C62: of:=IF(AND([.B62]>=[Calendario.$F$8];[.B62]<=[Calendario.$F$9];1);1;IF(AND([.B62]>=[Calendario.$F$12];[.B62]<=[Calendario.$F$13]);2;IF(AND([.B62]>=[Calendario.$F$16];[.B62]<=[Calendario.$F$17]);3;""))) -> 1 | D62: of:=IF(COUNTIF([Calendario.$H$4:.$H$48];[.B62])>0;"FIESTA";"") ->  | E62: of:=IF([.B62]<>"";VLOOKUP(WEEKDAY([.B62];3);[Calendario.$A$4:.$C$11];2);"") -> Viernes | F62: of:=IF([.B62]<>"";IF([.D62]<>"FIESTA";VLOOKUP(WEEKDAY([.B62];3);[Calendario.$A$4:.$C$11];3);0);"") -> 1 | G62: of:=IF(ISNUMBER([.F62]);[.F62]+[.G61];"") -> 26 | H62: of:=IF(AND([.G62]<=[Unidades.$G$26];[.G62]<=[Unidades.$F$18];[Unidades.$F$18]>0);[Unidades.$D$18]+1-COUNTIFS([Unidades.$O$3:.$O$17];">="&[.G62]);"") -> 2 | I62: of:=IF([.H61]<>[.H62];"INICIO";IF([.H63]<>[.H62];"FIN";"")) ->  | J62: of:=IF([.K61]<>[.K62];"INICIO";IF([.K63]<>[.K62];"FIN";"")) -> 
A63: of:=IF([.B63]<>"";TODAY()>[.B63];"") -> 0 | B63: of:=IFERROR(IF(AND(ISNUMBER([.B62]);([.B62]+1)<[Calendario.$F$5]);[.B62]+1;"");"") -> 2015-11-07 | C63: of:=IF(AND([.B63]>=[Calendario.$F$8];[.B63]<=[Calendario.$F$9];1);1;IF(AND([.B63]>=[Calendario.$F$12];[.B63]<=[Calendario.$F$13]);2;IF(AND([.B63]>=[Calendario.$F$16];[.B63]<=[Calendario.$F$17]);3;""))) -> 1 | D63: of:=IF(COUNTIF([Calendario.$H$4:.$H$48];[.B63])>0;"FIESTA";"") ->  | E63: of:=IF([.B63]<>"";VLOOKUP(WEEKDAY([.B63];3);[Calendario.$A$4:.$C$11];2);"") -> Sabado | F63: of:=IF([.B63]<>"";IF([.D63]<>"FIESTA";VLOOKUP(WEEKDAY([.B63];3);[Calendario.$A$4:.$C$11];3);0);"") -> 0 | G63: of:=IF(ISNUMBER([.F63]);[.F63]+[.G62];"") -> 26 | H63: of:=IF(AND([.G63]<=[Unidades.$G$26];[.G63]<=[Unidades.$F$18];[Unidades.$F$18]>0);[Unidades.$D$18]+1-COUNTIFS([Unidades.$O$3:.$O$17];">="&[.G63]);"") -> 2 | I63: of:=IF([.H62]<>[.H63];"INICIO";IF([.H64]<>[.H63];"FIN";"")) ->  | J63: of:=IF([.K62]<>[.K63];"INICIO";IF([.K64]<>[.K63];"FIN";"")) -> 
A64: of:=IF([.B64]<>"";TODAY()>[.B64];"") -> 0 | B64: of:=IFERROR(IF(AND(ISNUMBER([.B63]);([.B63]+1)<[Calendario.$F$5]);[.B63]+1;"");"") -> 2015-11-08 | C64: of:=IF(AND([.B64]>=[Calendario.$F$8];[.B64]<=[Calendario.$F$9];1);1;IF(AND([.B64]>=[Calendario.$F$12];[.B64]<=[Calendario.$F$13]);2;IF(AND([.B64]>=[Calendario.$F$16];[.B64]<=[Calendario.$F$17]);3;""))) -> 1 | D64: of:=IF(COUNTIF([Calendario.$H$4:.$H$48];[.B64])>0;"FIESTA";"") ->  | E64: of:=IF([.B64]<>"";VLOOKUP(WEEKDAY([.B64];3);[Calendario.$A$4:.$C$11];2);"") -> Domingo | F64: of:=IF([.B64]<>"";IF([.D64]<>"FIESTA";VLOOKUP(WEEKDAY([.B64];3);[Calendario.$A$4:.$C$11];3);0);"") -> 0 | G64: of:=IF(ISNUMBER([.F64]);[.F64]+[.G63];"") -> 26 | H64: of:=IF(AND([.G64]<=[Unidades.$G$26];[.G64]<=[Unidades.$F$18];[Unidades.$F$18]>0);[Unidades.$D$18]+1-COUNTIFS([Unidades.$O$3:.$O$17];">="&[.G64]);"") -> 2 | I64: of:=IF([.H63]<>[.H64];"INICIO";IF([.H65]<>[.H64];"FIN";"")) ->  | J64: of:=IF([.K63]<>[.K64];"INICIO";IF([.K65]<>[.K64];"FIN";"")) -> 
A65: of:=IF([.B65]<>"";TODAY()>[.B65];"") -> 0 | B65: of:=IFERROR(IF(AND(ISNUMBER([.B64]);([.B64]+1)<[Calendario.$F$5]);[.B64]+1;"");"") -> 2015-11-09 | C65: of:=IF(AND([.B65]>=[Calendario.$F$8];[.B65]<=[Calendario.$F$9];1);1;IF(AND([.B65]>=[Calendario.$F$12];[.B65]<=[Calendario.$F$13]);2;IF(AND([.B65]>=[Calendario.$F$16];[.B65]<=[Calendario.$F$17]);3;""))) -> 1 | D65: of:=IF(COUNTIF([Calendario.$H$4:.$H$48];[.B65])>0;"FIESTA";"") ->  | E65: of:=IF([.B65]<>"";VLOOKUP(WEEKDAY([.B65];3);[Calendario.$A$4:.$C$11];2);"") -> Lunes | F65: of:=IF([.B65]<>"";IF([.D65]<>"FIESTA";VLOOKUP(WEEKDAY([.B65];3);[Calendario.$A$4:.$C$11];3);0);"") -> 1 | G65: of:=IF(ISNUMBER([.F65]);[.F65]+[.G64];"") -> 27 | H65: of:=IF(AND([.G65]<=[Unidades.$G$26];[.G65]<=[Unidades.$F$18];[Unidades.$F$18]>0);[Unidades.$D$18]+1-COUNTIFS([Unidades.$O$3:.$O$17];">="&[.G65]);"") -> 2 | I65: of:=IF([.H64]<>[.H65];"INICIO";IF([.H66]<>[.H65];"FIN";"")) ->  | J65: of:=IF([.K64]<>[.K65];"INICIO";IF([.K66]<>[.K65];"FIN";"")) -> 
A66: of:=IF([.B66]<>"";TODAY()>[.B66];"") -> 0 | B66: of:=IFERROR(IF(AND(ISNUMBER([.B65]);([.B65]+1)<[Calendario.$F$5]);[.B65]+1;"");"") -> 2015-11-10 | C66: of:=IF(AND([.B66]>=[Calendario.$F$8];[.B66]<=[Calendario.$F$9];1);1;IF(AND([.B66]>=[Calendario.$F$12];[.B66]<=[Calendario.$F$13]);2;IF(AND([.B66]>=[Calendario.$F$16];[.B66]<=[Calendario.$F$17]);3;""))) -> 1 | D66: of:=IF(COUNTIF([Calendario.$H$4:.$H$48];[.B66])>0;"FIESTA";"") ->  | E66: of:=IF([.B66]<>"";VLOOKUP(WEEKDAY([.B66];3);[Calendario.$A$4:.$C$11];2);"") -> Martes | F66: of:=IF([.B66]<>"";IF([.D66]<>"FIESTA";VLOOKUP(WEEKDAY([.B66];3);[Calendario.$A$4:.$C$11];3);0);"") -> 0 | G66: of:=IF(ISNUMBER([.F66]);[.F66]+[.G65];"") -> 27 | H66: of:=IF(AND([.G66]<=[Unidades.$G$26];[.G66]<=[Unidades.$F$18];[Unidades.$F$18]>0);[Unidades.$D$18]+1-COUNTIFS([Unidades.$O$3:.$O$17];">="&[.G66]);"") -> 2 | I66: of:=IF([.H65]<>[.H66];"INICIO";IF([.H67]<>[.H66];"FIN";"")) ->  | J66: of:=IF([.K65]<>[.K66];"INICIO";IF([.K67]<>[.K66];"FIN";"")) -> 
A67: of:=IF([.B67]<>"";TODAY()>[.B67];"") -> 0 | B67: of:=IFERROR(IF(AND(ISNUMBER([.B66]);([.B66]+1)<[Calendario.$F$5]);[.B66]+1;"");"") -> 2015-11-11 | C67: of:=IF(AND([.B67]>=[Calendario.$F$8];[.B67]<=[Calendario.$F$9];1);1;IF(AND([.B67]>=[Calendario.$F$12];[.B67]<=[Calendario.$F$13]);2;IF(AND([.B67]>=[Calendario.$F$16];[.B67]<=[Calendario.$F$17]);3;""))) -> 1 | D67: of:=IF(COUNTIF([Calendario.$H$4:.$H$48];[.B67])>0;"FIESTA";"") ->  | E67: of:=IF([.B67]<>"";VLOOKUP(WEEKDAY([.B67];3);[Calendario.$A$4:.$C$11];2);"") -> Miercoles | F67: of:=IF([.B67]<>"";IF([.D67]<>"FIESTA";VLOOKUP(WEEKDAY([.B67];3);[Calendario.$A$4:.$C$11];3);0);"") -> 1 | G67: of:=IF(ISNUMBER([.F67]);[.F67]+[.G66];"") -> 28 | H67: of:=IF(AND([.G67]<=[Unidades.$G$26];[.G67]<=[Unidades.$F$18];[Unidades.$F$18]>0);[Unidades.$D$18]+1-COUNTIFS([Unidades.$O$3:.$O$17];">="&[.G67]);"") -> 2 | I67: of:=IF([.H66]<>[.H67];"INICIO";IF([.H68]<>[.H67];"FIN";"")) ->  | J67: of:=IF([.K66]<>[.K67];"INICIO";IF([.K68]<>[.K67];"FIN";"")) -> 
A68: of:=IF([.B68]<>"";TODAY()>[.B68];"") -> 0 | B68: of:=IFERROR(IF(AND(ISNUMBER([.B67]);([.B67]+1)<[Calendario.$F$5]);[.B67]+1;"");"") -> 2015-11-12 | C68: of:=IF(AND([.B68]>=[Calendario.$F$8];[.B68]<=[Calendario.$F$9];1);1;IF(AND([.B68]>=[Calendario.$F$12];[.B68]<=[Calendario.$F$13]);2;IF(AND([.B68]>=[Calendario.$F$16];[.B68]<=[Calendario.$F$17]);3;""))) -> 1 | D68: of:=IF(COUNTIF([Calendario.$H$4:.$H$48];[.B68])>0;"FIESTA";"") ->  | E68: of:=IF([.B68]<>"";VLOOKUP(WEEKDAY([.B68];3);[Calendario.$A$4:.$C$11];2);"") -> Jueves | F68: of:=IF([.B68]<>"";IF([.D68]<>"FIESTA";VLOOKUP(WEEKDAY([.B68];3);[Calendario.$A$4:.$C$11];3);0);"") -> 0 | G68: of:=IF(ISNUMBER([.F68]);[.F68]+[.G67];"") -> 28 | H68: of:=IF(AND([.G68]<=[Unidades.$G$26];[.G68]<=[Unidades.$F$18];[Unidades.$F$18]>0);[Unidades.$D$18]+1-COUNTIFS([Unidades.$O$3:.$O$17];">="&[.G68]);"") -> 2 | I68: of:=IF([.H67]<>[.H68];"INICIO";IF([.H69]<>[.H68];"FIN";"")) ->  | J68: of:=IF([.K67]<>[.K68];"INICIO";IF([.K69]<>[.K68];"FIN";"")) -> 
A69: of:=IF([.B69]<>"";TODAY()>[.B69];"") -> 0 | B69: of:=IFERROR(IF(AND(ISNUMBER([.B68]);([.B68]+1)<[Calendario.$F$5]);[.B68]+1;"");"") -> 2015-11-13 | C69: of:=IF(AND([.B69]>=[Calendario.$F$8];[.B69]<=[Calendario.$F$9];1);1;IF(AND([.B69]>=[Calendario.$F$12];[.B69]<=[Calendario.$F$13]);2;IF(AND([.B69]>=[Calendario.$F$16];[.B69]<=[Calendario.$F$17]);3;""))) -> 1 | D69: of:=IF(COUNTIF([Calendario.$H$4:.$H$48];[.B69])>0;"FIESTA";"") ->  | E69: of:=IF([.B69]<>"";VLOOKUP(WEEKDAY([.B69];3);[Calendario.$A$4:.$C$11];2);"") -> Viernes | F69: of:=IF([.B69]<>"";IF([.D69]<>"FIESTA";VLOOKUP(WEEKDAY([.B69];3);[Calendario.$A$4:.$C$11];3);0);"") -> 1 | G69: of:=IF(ISNUMBER([.F69]);[.F69]+[.G68];"") -> 29 | H69: of:=IF(AND([.G69]<=[Unidades.$G$26];[.G69]<=[Unidades.$F$18];[Unidades.$F$18]>0);[Unidades.$D$18]+1-COUNTIFS([Unidades.$O$3:.$O$17];">="&[.G69]);"") -> 2 | I69: of:=IF([.H68]<>[.H69];"INICIO";IF([.H70]<>[.H69];"FIN";"")) ->  | J69: of:=IF([.K68]<>[.K69];"INICIO";IF([.K70]<>[.K69];"FIN";"")) -> 
A70: of:=IF([.B70]<>"";TODAY()>[.B70];"") -> 0 | B70: of:=IFERROR(IF(AND(ISNUMBER([.B69]);([.B69]+1)<[Calendario.$F$5]);[.B69]+1;"");"") -> 2015-11-14 | C70: of:=IF(AND([.B70]>=[Calendario.$F$8];[.B70]<=[Calendario.$F$9];1);1;IF(AND([.B70]>=[Calendario.$F$12];[.B70]<=[Calendario.$F$13]);2;IF(AND([.B70]>=[Calendario.$F$16];[.B70]<=[Calendario.$F$17]);3;""))) -> 1 | D70: of:=IF(COUNTIF([Calendario.$H$4:.$H$48];[.B70])>0;"FIESTA";"") ->  | E70: of:=IF([.B70]<>"";VLOOKUP(WEEKDAY([.B70];3);[Calendario.$A$4:.$C$11];2);"") -> Sabado | F70: of:=IF([.B70]<>"";IF([.D70]<>"FIESTA";VLOOKUP(WEEKDAY([.B70];3);[Calendario.$A$4:.$C$11];3);0);"") -> 0 | G70: of:=IF(ISNUMBER([.F70]);[.F70]+[.G69];"") -> 29 | H70: of:=IF(AND([.G70]<=[Unidades.$G$26];[.G70]<=[Unidades.$F$18];[Unidades.$F$18]>0);[Unidades.$D$18]+1-COUNTIFS([Unidades.$O$3:.$O$17];">="&[.G70]);"") -> 2 | I70: of:=IF([.H69]<>[.H70];"INICIO";IF([.H71]<>[.H70];"FIN";"")) ->  | J70: of:=IF([.K69]<>[.K70];"INICIO";IF([.K71]<>[.K70];"FIN";"")) -> 
A71: of:=IF([.B71]<>"";TODAY()>[.B71];"") -> 0 | B71: of:=IFERROR(IF(AND(ISNUMBER([.B70]);([.B70]+1)<[Calendario.$F$5]);[.B70]+1;"");"") -> 2015-11-15 | C71: of:=IF(AND([.B71]>=[Calendario.$F$8];[.B71]<=[Calendario.$F$9];1);1;IF(AND([.B71]>=[Calendario.$F$12];[.B71]<=[Calendario.$F$13]);2;IF(AND([.B71]>=[Calendario.$F$16];[.B71]<=[Calendario.$F$17]);3;""))) -> 1 | D71: of:=IF(COUNTIF([Calendario.$H$4:.$H$48];[.B71])>0;"FIESTA";"") ->  | E71: of:=IF([.B71]<>"";VLOOKUP(WEEKDAY([.B71];3);[Calendario.$A$4:.$C$11];2);"") -> Domingo | F71: of:=IF([.B71]<>"";IF([.D71]<>"FIESTA";VLOOKUP(WEEKDAY([.B71];3);[Calendario.$A$4:.$C$11];3);0);"") -> 0 | G71: of:=IF(ISNUMBER([.F71]);[.F71]+[.G70];"") -> 29 | H71: of:=IF(AND([.G71]<=[Unidades.$G$26];[.G71]<=[Unidades.$F$18];[Unidades.$F$18]>0);[Unidades.$D$18]+1-COUNTIFS([Unidades.$O$3:.$O$17];">="&[.G71]);"") -> 2 | I71: of:=IF([.H70]<>[.H71];"INICIO";IF([.H72]<>[.H71];"FIN";"")) ->  | J71: of:=IF([.K70]<>[.K71];"INICIO";IF([.K72]<>[.K71];"FIN";"")) -> 
A72: of:=IF([.B72]<>"";TODAY()>[.B72];"") -> 0 | B72: of:=IFERROR(IF(AND(ISNUMBER([.B71]);([.B71]+1)<[Calendario.$F$5]);[.B71]+1;"");"") -> 2015-11-16 | C72: of:=IF(AND([.B72]>=[Calendario.$F$8];[.B72]<=[Calendario.$F$9];1);1;IF(AND([.B72]>=[Calendario.$F$12];[.B72]<=[Calendario.$F$13]);2;IF(AND([.B72]>=[Calendario.$F$16];[.B72]<=[Calendario.$F$17]);3;""))) -> 1 | D72: of:=IF(COUNTIF([Calendario.$H$4:.$H$48];[.B72])>0;"FIESTA";"") ->  | E72: of:=IF([.B72]<>"";VLOOKUP(WEEKDAY([.B72];3);[Calendario.$A$4:.$C$11];2);"") -> Lunes | F72: of:=IF([.B72]<>"";IF([.D72]<>"FIESTA";VLOOKUP(WEEKDAY([.B72];3);[Calendario.$A$4:.$C$11];3);0);"") -> 1 | G72: of:=IF(ISNUMBER([.F72]);[.F72]+[.G71];"") -> 30 | H72: of:=IF(AND([.G72]<=[Unidades.$G$26];[.G72]<=[Unidades.$F$18];[Unidades.$F$18]>0);[Unidades.$D$18]+1-COUNTIFS([Unidades.$O$3:.$O$17];">="&[.G72]);"") -> 2 | I72: of:=IF([.H71]<>[.H72];"INICIO";IF([.H73]<>[.H72];"FIN";"")) ->  | J72: of:=IF([.K71]<>[.K72];"INICIO";IF([.K73]<>[.K72];"FIN";"")) -> 
A73: of:=IF([.B73]<>"";TODAY()>[.B73];"") -> 0 | B73: of:=IFERROR(IF(AND(ISNUMBER([.B72]);([.B72]+1)<[Calendario.$F$5]);[.B72]+1;"");"") -> 2015-11-17 | C73: of:=IF(AND([.B73]>=[Calendario.$F$8];[.B73]<=[Calendario.$F$9];1);1;IF(AND([.B73]>=[Calendario.$F$12];[.B73]<=[Calendario.$F$13]);2;IF(AND([.B73]>=[Calendario.$F$16];[.B73]<=[Calendario.$F$17]);3;""))) -> 1 | D73: of:=IF(COUNTIF([Calendario.$H$4:.$H$48];[.B73])>0;"FIESTA";"") ->  | E73: of:=IF([.B73]<>"";VLOOKUP(WEEKDAY([.B73];3);[Calendario.$A$4:.$C$11];2);"") -> Martes | F73: of:=IF([.B73]<>"";IF([.D73]<>"FIESTA";VLOOKUP(WEEKDAY([.B73];3);[Calendario.$A$4:.$C$11];3);0);"") -> 0 | G73: of:=IF(ISNUMBER([.F73]);[.F73]+[.G72];"") -> 30 | H73: of:=IF(AND([.G73]<=[Unidades.$G$26];[.G73]<=[Unidades.$F$18];[Unidades.$F$18]>0);[Unidades.$D$18]+1-COUNTIFS([Unidades.$O$3:.$O$17];">="&[.G73]);"") -> 2 | I73: of:=IF([.H72]<>[.H73];"INICIO";IF([.H74]<>[.H73];"FIN";"")) -> FIN | J73: of:=IF([.K72]<>[.K73];"INICIO";IF([.K74]<>[.K73];"FIN";"")) -> 
A74: of:=IF([.B74]<>"";TODAY()>[.B74];"") -> 0 | B74: of:=IFERROR(IF(AND(ISNUMBER([.B73]);([.B73]+1)<[Calendario.$F$5]);[.B73]+1;"");"") -> 2015-11-18 | C74: of:=IF(AND([.B74]>=[Calendario.$F$8];[.B74]<=[Calendario.$F$9];1);1;IF(AND([.B74]>=[Calendario.$F$12];[.B74]<=[Calendario.$F$13]);2;IF(AND([.B74]>=[Calendario.$F$16];[.B74]<=[Calendario.$F$17]);3;""))) -> 1 | D74: of:=IF(COUNTIF([Calendario.$H$4:.$H$48];[.B74])>0;"FIESTA";"") ->  | E74: of:=IF([.B74]<>"";VLOOKUP(WEEKDAY([.B74];3);[Calendario.$A$4:.$C$11];2);"") -> Miercoles | F74: of:=IF([.B74]<>"";IF([.D74]<>"FIESTA";VLOOKUP(WEEKDAY([.B74];3);[Calendario.$A$4:.$C$11];3);0);"") -> 1 | G74: of:=IF(ISNUMBER([.F74]);[.F74]+[.G73];"") -> 31 | H74: of:=IF(AND([.G74]<=[Unidades.$G$26];[.G74]<=[Unidades.$F$18];[Unidades.$F$18]>0);[Unidades.$D$18]+1-COUNTIFS([Unidades.$O$3:.$O$17];">="&[.G74]);"") -> 3 | I74: of:=IF([.H73]<>[.H74];"INICIO";IF([.H75]<>[.H74];"FIN";"")) -> INICIO | J74: of:=IF([.K73]<>[.K74];"INICIO";IF([.K75]<>[.K74];"FIN";"")) -> 
A75: of:=IF([.B75]<>"";TODAY()>[.B75];"") -> 0 | B75: of:=IFERROR(IF(AND(ISNUMBER([.B74]);([.B74]+1)<[Calendario.$F$5]);[.B74]+1;"");"") -> 2015-11-19 | C75: of:=IF(AND([.B75]>=[Calendario.$F$8];[.B75]<=[Calendario.$F$9];1);1;IF(AND([.B75]>=[Calendario.$F$12];[.B75]<=[Calendario.$F$13]);2;IF(AND([.B75]>=[Calendario.$F$16];[.B75]<=[Calendario.$F$17]);3;""))) -> 1 | D75: of:=IF(COUNTIF([Calendario.$H$4:.$H$48];[.B75])>0;"FIESTA";"") ->  | E75: of:=IF([.B75]<>"";VLOOKUP(WEEKDAY([.B75];3);[Calendario.$A$4:.$C$11];2);"") -> Jueves | F75: of:=IF([.B75]<>"";IF([.D75]<>"FIESTA";VLOOKUP(WEEKDAY([.B75];3);[Calendario.$A$4:.$C$11];3);0);"") -> 0 | G75: of:=IF(ISNUMBER([.F75]);[.F75]+[.G74];"") -> 31 | H75: of:=IF(AND([.G75]<=[Unidades.$G$26];[.G75]<=[Unidades.$F$18];[Unidades.$F$18]>0);[Unidades.$D$18]+1-COUNTIFS([Unidades.$O$3:.$O$17];">="&[.G75]);"") -> 3 | I75: of:=IF([.H74]<>[.H75];"INICIO";IF([.H76]<>[.H75];"FIN";"")) ->  | J75: of:=IF([.K74]<>[.K75];"INICIO";IF([.K76]<>[.K75];"FIN";"")) -> 
A76: of:=IF([.B76]<>"";TODAY()>[.B76];"") -> 0 | B76: of:=IFERROR(IF(AND(ISNUMBER([.B75]);([.B75]+1)<[Calendario.$F$5]);[.B75]+1;"");"") -> 2015-11-20 | C76: of:=IF(AND([.B76]>=[Calendario.$F$8];[.B76]<=[Calendario.$F$9];1);1;IF(AND([.B76]>=[Calendario.$F$12];[.B76]<=[Calendario.$F$13]);2;IF(AND([.B76]>=[Calendario.$F$16];[.B76]<=[Calendario.$F$17]);3;""))) -> 1 | D76: of:=IF(COUNTIF([Calendario.$H$4:.$H$48];[.B76])>0;"FIESTA";"") ->  | E76: of:=IF([.B76]<>"";VLOOKUP(WEEKDAY([.B76];3);[Calendario.$A$4:.$C$11];2);"") -> Viernes | F76: of:=IF([.B76]<>"";IF([.D76]<>"FIESTA";VLOOKUP(WEEKDAY([.B76];3);[Calendario.$A$4:.$C$11];3);0);"") -> 1 | G76: of:=IF(ISNUMBER([.F76]);[.F76]+[.G75];"") -> 32 | H76: of:=IF(AND([.G76]<=[Unidades.$G$26];[.G76]<=[Unidades.$F$18];[Unidades.$F$18]>0);[Unidades.$D$18]+1-COUNTIFS([Unidades.$O$3:.$O$17];">="&[.G76]);"") -> 3 | I76: of:=IF([.H75]<>[.H76];"INICIO";IF([.H77]<>[.H76];"FIN";"")) ->  | J76: of:=IF([.K75]<>[.K76];"INICIO";IF([.K77]<>[.K76];"FIN";"")) -> 
A77: of:=IF([.B77]<>"";TODAY()>[.B77];"") -> 0 | B77: of:=IFERROR(IF(AND(ISNUMBER([.B76]);([.B76]+1)<[Calendario.$F$5]);[.B76]+1;"");"") -> 2015-11-21 | C77: of:=IF(AND([.B77]>=[Calendario.$F$8];[.B77]<=[Calendario.$F$9];1);1;IF(AND([.B77]>=[Calendario.$F$12];[.B77]<=[Calendario.$F$13]);2;IF(AND([.B77]>=[Calendario.$F$16];[.B77]<=[Calendario.$F$17]);3;""))) -> 1 | D77: of:=IF(COUNTIF([Calendario.$H$4:.$H$48];[.B77])>0;"FIESTA";"") ->  | E77: of:=IF([.B77]<>"";VLOOKUP(WEEKDAY([.B77];3);[Calendario.$A$4:.$C$11];2);"") -> Sabado | F77: of:=IF([.B77]<>"";IF([.D77]<>"FIESTA";VLOOKUP(WEEKDAY([.B77];3);[Calendario.$A$4:.$C$11];3);0);"") -> 0 | G77: of:=IF(ISNUMBER([.F77]);[.F77]+[.G76];"") -> 32 | H77: of:=IF(AND([.G77]<=[Unidades.$G$26];[.G77]<=[Unidades.$F$18];[Unidades.$F$18]>0);[Unidades.$D$18]+1-COUNTIFS([Unidades.$O$3:.$O$17];">="&[.G77]);"") -> 3 | I77: of:=IF([.H76]<>[.H77];"INICIO";IF([.H78]<>[.H77];"FIN";"")) ->  | J77: of:=IF([.K76]<>[.K77];"INICIO";IF([.K78]<>[.K77];"FIN";"")) -> 
A78: of:=IF([.B78]<>"";TODAY()>[.B78];"") -> 0 | B78: of:=IFERROR(IF(AND(ISNUMBER([.B77]);([.B77]+1)<[Calendario.$F$5]);[.B77]+1;"");"") -> 2015-11-22 | C78: of:=IF(AND([.B78]>=[Calendario.$F$8];[.B78]<=[Calendario.$F$9];1);1;IF(AND([.B78]>=[Calendario.$F$12];[.B78]<=[Calendario.$F$13]);2;IF(AND([.B78]>=[Calendario.$F$16];[.B78]<=[Calendario.$F$17]);3;""))) -> 1 | D78: of:=IF(COUNTIF([Calendario.$H$4:.$H$48];[.B78])>0;"FIESTA";"") ->  | E78: of:=IF([.B78]<>"";VLOOKUP(WEEKDAY([.B78];3);[Calendario.$A$4:.$C$11];2);"") -> Domingo | F78: of:=IF([.B78]<>"";IF([.D78]<>"FIESTA";VLOOKUP(WEEKDAY([.B78];3);[Calendario.$A$4:.$C$11];3);0);"") -> 0 | G78: of:=IF(ISNUMBER([.F78]);[.F78]+[.G77];"") -> 32 | H78: of:=IF(AND([.G78]<=[Unidades.$G$26];[.G78]<=[Unidades.$F$18];[Unidades.$F$18]>0);[Unidades.$D$18]+1-COUNTIFS([Unidades.$O$3:.$O$17];">="&[.G78]);"") -> 3 | I78: of:=IF([.H77]<>[.H78];"INICIO";IF([.H79]<>[.H78];"FIN";"")) ->  | J78: of:=IF([.K77]<>[.K78];"INICIO";IF([.K79]<>[.K78];"FIN";"")) -> 
A79: of:=IF([.B79]<>"";TODAY()>[.B79];"") -> 0 | B79: of:=IFERROR(IF(AND(ISNUMBER([.B78]);([.B78]+1)<[Calendario.$F$5]);[.B78]+1;"");"") -> 2015-11-23 | C79: of:=IF(AND([.B79]>=[Calendario.$F$8];[.B79]<=[Calendario.$F$9];1);1;IF(AND([.B79]>=[Calendario.$F$12];[.B79]<=[Calendario.$F$13]);2;IF(AND([.B79]>=[Calendario.$F$16];[.B79]<=[Calendario.$F$17]);3;""))) -> 1 | D79: of:=IF(COUNTIF([Calendario.$H$4:.$H$48];[.B79])>0;"FIESTA";"") ->  | E79: of:=IF([.B79]<>"";VLOOKUP(WEEKDAY([.B79];3);[Calendario.$A$4:.$C$11];2);"") -> Lunes | F79: of:=IF([.B79]<>"";IF([.D79]<>"FIESTA";VLOOKUP(WEEKDAY([.B79];3);[Calendario.$A$4:.$C$11];3);0);"") -> 1 | G79: of:=IF(ISNUMBER([.F79]);[.F79]+[.G78];"") -> 33 | H79: of:=IF(AND([.G79]<=[Unidades.$G$26];[.G79]<=[Unidades.$F$18];[Unidades.$F$18]>0);[Unidades.$D$18]+1-COUNTIFS([Unidades.$O$3:.$O$17];">="&[.G79]);"") -> 3 | I79: of:=IF([.H78]<>[.H79];"INICIO";IF([.H80]<>[.H79];"FIN";"")) ->  | J79: of:=IF([.K78]<>[.K79];"INICIO";IF([.K80]<>[.K79];"FIN";"")) -> 
A80: of:=IF([.B80]<>"";TODAY()>[.B80];"") -> 0 | B80: of:=IFERROR(IF(AND(ISNUMBER([.B79]);([.B79]+1)<[Calendario.$F$5]);[.B79]+1;"");"") -> 2015-11-24 | C80: of:=IF(AND([.B80]>=[Calendario.$F$8];[.B80]<=[Calendario.$F$9];1);1;IF(AND([.B80]>=[Calendario.$F$12];[.B80]<=[Calendario.$F$13]);2;IF(AND([.B80]>=[Calendario.$F$16];[.B80]<=[Calendario.$F$17]);3;""))) -> 1 | D80: of:=IF(COUNTIF([Calendario.$H$4:.$H$48];[.B80])>0;"FIESTA";"") ->  | E80: of:=IF([.B80]<>"";VLOOKUP(WEEKDAY([.B80];3);[Calendario.$A$4:.$C$11];2);"") -> Martes | F80: of:=IF([.B80]<>"";IF([.D80]<>"FIESTA";VLOOKUP(WEEKDAY([.B80];3);[Calendario.$A$4:.$C$11];3);0);"") -> 0 | G80: of:=IF(ISNUMBER([.F80]);[.F80]+[.G79];"") -> 33 | H80: of:=IF(AND([.G80]<=[Unidades.$G$26];[.G80]<=[Unidades.$F$18];[Unidades.$F$18]>0);[Unidades.$D$18]+1-COUNTIFS([Unidades.$O$3:.$O$17];">="&[.G80]);"") -> 3 | I80: of:=IF([.H79]<>[.H80];"INICIO";IF([.H81]<>[.H80];"FIN";"")) ->  | J80: of:=IF([.K79]<>[.K80];"INICIO";IF([.K81]<>[.K80];"FIN";"")) -> 
A81: of:=IF([.B81]<>"";TODAY()>[.B81];"") -> 0 | B81: of:=IFERROR(IF(AND(ISNUMBER([.B80]);([.B80]+1)<[Calendario.$F$5]);[.B80]+1;"");"") -> 2015-11-25 | C81: of:=IF(AND([.B81]>=[Calendario.$F$8];[.B81]<=[Calendario.$F$9];1);1;IF(AND([.B81]>=[Calendario.$F$12];[.B81]<=[Calendario.$F$13]);2;IF(AND([.B81]>=[Calendario.$F$16];[.B81]<=[Calendario.$F$17]);3;""))) -> 1 | D81: of:=IF(COUNTIF([Calendario.$H$4:.$H$48];[.B81])>0;"FIESTA";"") ->  | E81: of:=IF([.B81]<>"";VLOOKUP(WEEKDAY([.B81];3);[Calendario.$A$4:.$C$11];2);"") -> Miercoles | F81: of:=IF([.B81]<>"";IF([.D81]<>"FIESTA";VLOOKUP(WEEKDAY([.B81];3);[Calendario.$A$4:.$C$11];3);0);"") -> 1 | G81: of:=IF(ISNUMBER([.F81]);[.F81]+[.G80];"") -> 34 | H81: of:=IF(AND([.G81]<=[Unidades.$G$26];[.G81]<=[Unidades.$F$18];[Unidades.$F$18]>0);[Unidades.$D$18]+1-COUNTIFS([Unidades.$O$3:.$O$17];">="&[.G81]);"") -> 3 | I81: of:=IF([.H80]<>[.H81];"INICIO";IF([.H82]<>[.H81];"FIN";"")) ->  | J81: of:=IF([.K80]<>[.K81];"INICIO";IF([.K82]<>[.K81];"FIN";"")) -> 
A82: of:=IF([.B82]<>"";TODAY()>[.B82];"") -> 0 | B82: of:=IFERROR(IF(AND(ISNUMBER([.B81]);([.B81]+1)<[Calendario.$F$5]);[.B81]+1;"");"") -> 2015-11-26 | C82: of:=IF(AND([.B82]>=[Calendario.$F$8];[.B82]<=[Calendario.$F$9];1);1;IF(AND([.B82]>=[Calendario.$F$12];[.B82]<=[Calendario.$F$13]);2;IF(AND([.B82]>=[Calendario.$F$16];[.B82]<=[Calendario.$F$17]);3;""))) -> 1 | D82: of:=IF(COUNTIF([Calendario.$H$4:.$H$48];[.B82])>0;"FIESTA";"") ->  | E82: of:=IF([.B82]<>"";VLOOKUP(WEEKDAY([.B82];3);[Calendario.$A$4:.$C$11];2);"") -> Jueves | F82: of:=IF([.B82]<>"";IF([.D82]<>"FIESTA";VLOOKUP(WEEKDAY([.B82];3);[Calendario.$A$4:.$C$11];3);0);"") -> 0 | G82: of:=IF(ISNUMBER([.F82]);[.F82]+[.G81];"") -> 34 | H82: of:=IF(AND([.G82]<=[Unidades.$G$26];[.G82]<=[Unidades.$F$18];[Unidades.$F$18]>0);[Unidades.$D$18]+1-COUNTIFS([Unidades.$O$3:.$O$17];">="&[.G82]);"") -> 3 | I82: of:=IF([.H81]<>[.H82];"INICIO";IF([.H83]<>[.H82];"FIN";"")) ->  | J82: of:=IF([.K81]<>[.K82];"INICIO";IF([.K83]<>[.K82];"FIN";"")) -> 
A83: of:=IF([.B83]<>"";TODAY()>[.B83];"") -> 0 | B83: of:=IFERROR(IF(AND(ISNUMBER([.B82]);([.B82]+1)<[Calendario.$F$5]);[.B82]+1;"");"") -> 2015-11-27 | C83: of:=IF(AND([.B83]>=[Calendario.$F$8];[.B83]<=[Calendario.$F$9];1);1;IF(AND([.B83]>=[Calendario.$F$12];[.B83]<=[Calendario.$F$13]);2;IF(AND([.B83]>=[Calendario.$F$16];[.B83]<=[Calendario.$F$17]);3;""))) -> 1 | D83: of:=IF(COUNTIF([Calendario.$H$4:.$H$48];[.B83])>0;"FIESTA";"") ->  | E83: of:=IF([.B83]<>"";VLOOKUP(WEEKDAY([.B83];3);[Calendario.$A$4:.$C$11];2);"") -> Viernes | F83: of:=IF([.B83]<>"";IF([.D83]<>"FIESTA";VLOOKUP(WEEKDAY([.B83];3);[Calendario.$A$4:.$C$11];3);0);"") -> 1 | G83: of:=IF(ISNUMBER([.F83]);[.F83]+[.G82];"") -> 35 | H83: of:=IF(AND([.G83]<=[Unidades.$G$26];[.G83]<=[Unidades.$F$18];[Unidades.$F$18]>0);[Unidades.$D$18]+1-COUNTIFS([Unidades.$O$3:.$O$17];">="&[.G83]);"") -> 3 | I83: of:=IF([.H82]<>[.H83];"INICIO";IF([.H84]<>[.H83];"FIN";"")) ->  | J83: of:=IF([.K82]<>[.K83];"INICIO";IF([.K84]<>[.K83];"FIN";"")) -> 
A84: of:=IF([.B84]<>"";TODAY()>[.B84];"") -> 0 | B84: of:=IFERROR(IF(AND(ISNUMBER([.B83]);([.B83]+1)<[Calendario.$F$5]);[.B83]+1;"");"") -> 2015-11-28 | C84: of:=IF(AND([.B84]>=[Calendario.$F$8];[.B84]<=[Calendario.$F$9];1);1;IF(AND([.B84]>=[Calendario.$F$12];[.B84]<=[Calendario.$F$13]);2;IF(AND([.B84]>=[Calendario.$F$16];[.B84]<=[Calendario.$F$17]);3;""))) -> 1 | D84: of:=IF(COUNTIF([Calendario.$H$4:.$H$48];[.B84])>0;"FIESTA";"") ->  | E84: of:=IF([.B84]<>"";VLOOKUP(WEEKDAY([.B84];3);[Calendario.$A$4:.$C$11];2);"") -> Sabado | F84: of:=IF([.B84]<>"";IF([.D84]<>"FIESTA";VLOOKUP(WEEKDAY([.B84];3);[Calendario.$A$4:.$C$11];3);0);"") -> 0 | G84: of:=IF(ISNUMBER([.F84]);[.F84]+[.G83];"") -> 35 | H84: of:=IF(AND([.G84]<=[Unidades.$G$26];[.G84]<=[Unidades.$F$18];[Unidades.$F$18]>0);[Unidades.$D$18]+1-COUNTIFS([Unidades.$O$3:.$O$17];">="&[.G84]);"") -> 3 | I84: of:=IF([.H83]<>[.H84];"INICIO";IF([.H85]<>[.H84];"FIN";"")) ->  | J84: of:=IF([.K83]<>[.K84];"INICIO";IF([.K85]<>[.K84];"FIN";"")) -> 
A85: of:=IF([.B85]<>"";TODAY()>[.B85];"") -> 0 | B85: of:=IFERROR(IF(AND(ISNUMBER([.B84]);([.B84]+1)<[Calendario.$F$5]);[.B84]+1;"");"") -> 2015-11-29 | C85: of:=IF(AND([.B85]>=[Calendario.$F$8];[.B85]<=[Calendario.$F$9];1);1;IF(AND([.B85]>=[Calendario.$F$12];[.B85]<=[Calendario.$F$13]);2;IF(AND([.B85]>=[Calendario.$F$16];[.B85]<=[Calendario.$F$17]);3;""))) -> 1 | D85: of:=IF(COUNTIF([Calendario.$H$4:.$H$48];[.B85])>0;"FIESTA";"") ->  | E85: of:=IF([.B85]<>"";VLOOKUP(WEEKDAY([.B85];3);[Calendario.$A$4:.$C$11];2);"") -> Domingo | F85: of:=IF([.B85]<>"";IF([.D85]<>"FIESTA";VLOOKUP(WEEKDAY([.B85];3);[Calendario.$A$4:.$C$11];3);0);"") -> 0 | G85: of:=IF(ISNUMBER([.F85]);[.F85]+[.G84];"") -> 35 | H85: of:=IF(AND([.G85]<=[Unidades.$G$26];[.G85]<=[Unidades.$F$18];[Unidades.$F$18]>0);[Unidades.$D$18]+1-COUNTIFS([Unidades.$O$3:.$O$17];">="&[.G85]);"") -> 3 | I85: of:=IF([.H84]<>[.H85];"INICIO";IF([.H86]<>[.H85];"FIN";"")) ->  | J85: of:=IF([.K84]<>[.K85];"INICIO";IF([.K86]<>[.K85];"FIN";"")) -> 
A86: of:=IF([.B86]<>"";TODAY()>[.B86];"") -> 0 | B86: of:=IFERROR(IF(AND(ISNUMBER([.B85]);([.B85]+1)<[Calendario.$F$5]);[.B85]+1;"");"") -> 2015-11-30 | C86: of:=IF(AND([.B86]>=[Calendario.$F$8];[.B86]<=[Calendario.$F$9];1);1;IF(AND([.B86]>=[Calendario.$F$12];[.B86]<=[Calendario.$F$13]);2;IF(AND([.B86]>=[Calendario.$F$16];[.B86]<=[Calendario.$F$17]);3;""))) -> 1 | D86: of:=IF(COUNTIF([Calendario.$H$4:.$H$48];[.B86])>0;"FIESTA";"") ->  | E86: of:=IF([.B86]<>"";VLOOKUP(WEEKDAY([.B86];3);[Calendario.$A$4:.$C$11];2);"") -> Lunes | F86: of:=IF([.B86]<>"";IF([.D86]<>"FIESTA";VLOOKUP(WEEKDAY([.B86];3);[Calendario.$A$4:.$C$11];3);0);"") -> 1 | G86: of:=IF(ISNUMBER([.F86]);[.F86]+[.G85];"") -> 36 | H86: of:=IF(AND([.G86]<=[Unidades.$G$26];[.G86]<=[Unidades.$F$18];[Unidades.$F$18]>0);[Unidades.$D$18]+1-COUNTIFS([Unidades.$O$3:.$O$17];">="&[.G86]);"") -> 3 | I86: of:=IF([.H85]<>[.H86];"INICIO";IF([.H87]<>[.H86];"FIN";"")) ->  | J86: of:=IF([.K85]<>[.K86];"INICIO";IF([.K87]<>[.K86];"FIN";"")) -> 
A87: of:=IF([.B87]<>"";TODAY()>[.B87];"") -> 0 | B87: of:=IFERROR(IF(AND(ISNUMBER([.B86]);([.B86]+1)<[Calendario.$F$5]);[.B86]+1;"");"") -> 2015-12-01 | C87: of:=IF(AND([.B87]>=[Calendario.$F$8];[.B87]<=[Calendario.$F$9];1);1;IF(AND([.B87]>=[Calendario.$F$12];[.B87]<=[Calendario.$F$13]);2;IF(AND([.B87]>=[Calendario.$F$16];[.B87]<=[Calendario.$F$17]);3;""))) -> 1 | D87: of:=IF(COUNTIF([Calendario.$H$4:.$H$48];[.B87])>0;"FIESTA";"") ->  | E87: of:=IF([.B87]<>"";VLOOKUP(WEEKDAY([.B87];3);[Calendario.$A$4:.$C$11];2);"") -> Martes | F87: of:=IF([.B87]<>"";IF([.D87]<>"FIESTA";VLOOKUP(WEEKDAY([.B87];3);[Calendario.$A$4:.$C$11];3);0);"") -> 0 | G87: of:=IF(ISNUMBER([.F87]);[.F87]+[.G86];"") -> 36 | H87: of:=IF(AND([.G87]<=[Unidades.$G$26];[.G87]<=[Unidades.$F$18];[Unidades.$F$18]>0);[Unidades.$D$18]+1-COUNTIFS([Unidades.$O$3:.$O$17];">="&[.G87]);"") -> 3 | I87: of:=IF([.H86]<>[.H87];"INICIO";IF([.H88]<>[.H87];"FIN";"")) ->  | J87: of:=IF([.K86]<>[.K87];"INICIO";IF([.K88]<>[.K87];"FIN";"")) -> 
A88: of:=IF([.B88]<>"";TODAY()>[.B88];"") -> 0 | B88: of:=IFERROR(IF(AND(ISNUMBER([.B87]);([.B87]+1)<[Calendario.$F$5]);[.B87]+1;"");"") -> 2015-12-02 | C88: of:=IF(AND([.B88]>=[Calendario.$F$8];[.B88]<=[Calendario.$F$9];1);1;IF(AND([.B88]>=[Calendario.$F$12];[.B88]<=[Calendario.$F$13]);2;IF(AND([.B88]>=[Calendario.$F$16];[.B88]<=[Calendario.$F$17]);3;""))) -> 1 | D88: of:=IF(COUNTIF([Calendario.$H$4:.$H$48];[.B88])>0;"FIESTA";"") ->  | E88: of:=IF([.B88]<>"";VLOOKUP(WEEKDAY([.B88];3);[Calendario.$A$4:.$C$11];2);"") -> Miercoles | F88: of:=IF([.B88]<>"";IF([.D88]<>"FIESTA";VLOOKUP(WEEKDAY([.B88];3);[Calendario.$A$4:.$C$11];3);0);"") -> 1 | G88: of:=IF(ISNUMBER([.F88]);[.F88]+[.G87];"") -> 37 | H88: of:=IF(AND([.G88]<=[Unidades.$G$26];[.G88]<=[Unidades.$F$18];[Unidades.$F$18]>0);[Unidades.$D$18]+1-COUNTIFS([Unidades.$O$3:.$O$17];">="&[.G88]);"") -> 3 | I88: of:=IF([.H87]<>[.H88];"INICIO";IF([.H89]<>[.H88];"FIN";"")) ->  | J88: of:=IF([.K87]<>[.K88];"INICIO";IF([.K89]<>[.K88];"FIN";"")) -> 
A89: of:=IF([.B89]<>"";TODAY()>[.B89];"") -> 0 | B89: of:=IFERROR(IF(AND(ISNUMBER([.B88]);([.B88]+1)<[Calendario.$F$5]);[.B88]+1;"");"") -> 2015-12-03 | C89: of:=IF(AND([.B89]>=[Calendario.$F$8];[.B89]<=[Calendario.$F$9];1);1;IF(AND([.B89]>=[Calendario.$F$12];[.B89]<=[Calendario.$F$13]);2;IF(AND([.B89]>=[Calendario.$F$16];[.B89]<=[Calendario.$F$17]);3;""))) -> 1 | D89: of:=IF(COUNTIF([Calendario.$H$4:.$H$48];[.B89])>0;"FIESTA";"") ->  | E89: of:=IF([.B89]<>"";VLOOKUP(WEEKDAY([.B89];3);[Calendario.$A$4:.$C$11];2);"") -> Jueves | F89: of:=IF([.B89]<>"";IF([.D89]<>"FIESTA";VLOOKUP(WEEKDAY([.B89];3);[Calendario.$A$4:.$C$11];3);0);"") -> 0 | G89: of:=IF(ISNUMBER([.F89]);[.F89]+[.G88];"") -> 37 | H89: of:=IF(AND([.G89]<=[Unidades.$G$26];[.G89]<=[Unidades.$F$18];[Unidades.$F$18]>0);[Unidades.$D$18]+1-COUNTIFS([Unidades.$O$3:.$O$17];">="&[.G89]);"") -> 3 | I89: of:=IF([.H88]<>[.H89];"INICIO";IF([.H90]<>[.H89];"FIN";"")) ->  | J89: of:=IF([.K88]<>[.K89];"INICIO";IF([.K90]<>[.K89];"FIN";"")) -> 
A90: of:=IF([.B90]<>"";TODAY()>[.B90];"") -> 0 | B90: of:=IFERROR(IF(AND(ISNUMBER([.B89]);([.B89]+1)<[Calendario.$F$5]);[.B89]+1;"");"") -> 2015-12-04 | C90: of:=IF(AND([.B90]>=[Calendario.$F$8];[.B90]<=[Calendario.$F$9];1);1;IF(AND([.B90]>=[Calendario.$F$12];[.B90]<=[Calendario.$F$13]);2;IF(AND([.B90]>=[Calendario.$F$16];[.B90]<=[Calendario.$F$17]);3;""))) -> 1 | D90: of:=IF(COUNTIF([Calendario.$H$4:.$H$48];[.B90])>0;"FIESTA";"") ->  | E90: of:=IF([.B90]<>"";VLOOKUP(WEEKDAY([.B90];3);[Calendario.$A$4:.$C$11];2);"") -> Viernes | F90: of:=IF([.B90]<>"";IF([.D90]<>"FIESTA";VLOOKUP(WEEKDAY([.B90];3);[Calendario.$A$4:.$C$11];3);0);"") -> 1 | G90: of:=IF(ISNUMBER([.F90]);[.F90]+[.G89];"") -> 38 | H90: of:=IF(AND([.G90]<=[Unidades.$G$26];[.G90]<=[Unidades.$F$18];[Unidades.$F$18]>0);[Unidades.$D$18]+1-COUNTIFS([Unidades.$O$3:.$O$17];">="&[.G90]);"") -> 3 | I90: of:=IF([.H89]<>[.H90];"INICIO";IF([.H91]<>[.H90];"FIN";"")) ->  | J90: of:=IF([.K89]<>[.K90];"INICIO";IF([.K91]<>[.K90];"FIN";"")) -> 
A91: of:=IF([.B91]<>"";TODAY()>[.B91];"") -> 0 | B91: of:=IFERROR(IF(AND(ISNUMBER([.B90]);([.B90]+1)<[Calendario.$F$5]);[.B90]+1;"");"") -> 2015-12-05 | C91: of:=IF(AND([.B91]>=[Calendario.$F$8];[.B91]<=[Calendario.$F$9];1);1;IF(AND([.B91]>=[Calendario.$F$12];[.B91]<=[Calendario.$F$13]);2;IF(AND([.B91]>=[Calendario.$F$16];[.B91]<=[Calendario.$F$17]);3;""))) -> 1 | D91: of:=IF(COUNTIF([Calendario.$H$4:.$H$48];[.B91])>0;"FIESTA";"") ->  | E91: of:=IF([.B91]<>"";VLOOKUP(WEEKDAY([.B91];3);[Calendario.$A$4:.$C$11];2);"") -> Sabado | F91: of:=IF([.B91]<>"";IF([.D91]<>"FIESTA";VLOOKUP(WEEKDAY([.B91];3);[Calendario.$A$4:.$C$11];3);0);"") -> 0 | G91: of:=IF(ISNUMBER([.F91]);[.F91]+[.G90];"") -> 38 | H91: of:=IF(AND([.G91]<=[Unidades.$G$26];[.G91]<=[Unidades.$F$18];[Unidades.$F$18]>0);[Unidades.$D$18]+1-COUNTIFS([Unidades.$O$3:.$O$17];">="&[.G91]);"") -> 3 | I91: of:=IF([.H90]<>[.H91];"INICIO";IF([.H92]<>[.H91];"FIN";"")) ->  | J91: of:=IF([.K90]<>[.K91];"INICIO";IF([.K92]<>[.K91];"FIN";"")) -> 
A92: of:=IF([.B92]<>"";TODAY()>[.B92];"") -> 0 | B92: of:=IFERROR(IF(AND(ISNUMBER([.B91]);([.B91]+1)<[Calendario.$F$5]);[.B91]+1;"");"") -> 2015-12-06 | C92: of:=IF(AND([.B92]>=[Calendario.$F$8];[.B92]<=[Calendario.$F$9];1);1;IF(AND([.B92]>=[Calendario.$F$12];[.B92]<=[Calendario.$F$13]);2;IF(AND([.B92]>=[Calendario.$F$16];[.B92]<=[Calendario.$F$17]);3;""))) -> 1 | D92: of:=IF(COUNTIF([Calendario.$H$4:.$H$48];[.B92])>0;"FIESTA";"") ->  | E92: of:=IF([.B92]<>"";VLOOKUP(WEEKDAY([.B92];3);[Calendario.$A$4:.$C$11];2);"") -> Domingo | F92: of:=IF([.B92]<>"";IF([.D92]<>"FIESTA";VLOOKUP(WEEKDAY([.B92];3);[Calendario.$A$4:.$C$11];3);0);"") -> 0 | G92: of:=IF(ISNUMBER([.F92]);[.F92]+[.G91];"") -> 38 | H92: of:=IF(AND([.G92]<=[Unidades.$G$26];[.G92]<=[Unidades.$F$18];[Unidades.$F$18]>0);[Unidades.$D$18]+1-COUNTIFS([Unidades.$O$3:.$O$17];">="&[.G92]);"") -> 3 | I92: of:=IF([.H91]<>[.H92];"INICIO";IF([.H93]<>[.H92];"FIN";"")) ->  | J92: of:=IF([.K91]<>[.K92];"INICIO";IF([.K93]<>[.K92];"FIN";"")) -> 
A93: of:=IF([.B93]<>"";TODAY()>[.B93];"") -> 0 | B93: of:=IFERROR(IF(AND(ISNUMBER([.B92]);([.B92]+1)<[Calendario.$F$5]);[.B92]+1;"");"") -> 2015-12-07 | C93: of:=IF(AND([.B93]>=[Calendario.$F$8];[.B93]<=[Calendario.$F$9];1);1;IF(AND([.B93]>=[Calendario.$F$12];[.B93]<=[Calendario.$F$13]);2;IF(AND([.B93]>=[Calendario.$F$16];[.B93]<=[Calendario.$F$17]);3;""))) -> 1 | D93: of:=IF(COUNTIF([Calendario.$H$4:.$H$48];[.B93])>0;"FIESTA";"") ->  | E93: of:=IF([.B93]<>"";VLOOKUP(WEEKDAY([.B93];3);[Calendario.$A$4:.$C$11];2);"") -> Lunes | F93: of:=IF([.B93]<>"";IF([.D93]<>"FIESTA";VLOOKUP(WEEKDAY([.B93];3);[Calendario.$A$4:.$C$11];3);0);"") -> 1 | G93: of:=IF(ISNUMBER([.F93]);[.F93]+[.G92];"") -> 39 | H93: of:=IF(AND([.G93]<=[Unidades.$G$26];[.G93]<=[Unidades.$F$18];[Unidades.$F$18]>0);[Unidades.$D$18]+1-COUNTIFS([Unidades.$O$3:.$O$17];">="&[.G93]);"") -> 3 | I93: of:=IF([.H92]<>[.H93];"INICIO";IF([.H94]<>[.H93];"FIN";"")) ->  | J93: of:=IF([.K92]<>[.K93];"INICIO";IF([.K94]<>[.K93];"FIN";"")) -> 
A94: of:=IF([.B94]<>"";TODAY()>[.B94];"") -> 0 | B94: of:=IFERROR(IF(AND(ISNUMBER([.B93]);([.B93]+1)<[Calendario.$F$5]);[.B93]+1;"");"") -> 2015-12-08 | C94: of:=IF(AND([.B94]>=[Calendario.$F$8];[.B94]<=[Calendario.$F$9];1);1;IF(AND([.B94]>=[Calendario.$F$12];[.B94]<=[Calendario.$F$13]);2;IF(AND([.B94]>=[Calendario.$F$16];[.B94]<=[Calendario.$F$17]);3;""))) -> 1 | D94: of:=IF(COUNTIF([Calendario.$H$4:.$H$48];[.B94])>0;"FIESTA";"") -> FIESTA | E94: of:=IF([.B94]<>"";VLOOKUP(WEEKDAY([.B94];3);[Calendario.$A$4:.$C$11];2);"") -> Martes | F94: of:=IF([.B94]<>"";IF([.D94]<>"FIESTA";VLOOKUP(WEEKDAY([.B94];3);[Calendario.$A$4:.$C$11];3);0);"") -> 0 | G94: of:=IF(ISNUMBER([.F94]);[.F94]+[.G93];"") -> 39 | H94: of:=IF(AND([.G94]<=[Unidades.$G$26];[.G94]<=[Unidades.$F$18];[Unidades.$F$18]>0);[Unidades.$D$18]+1-COUNTIFS([Unidades.$O$3:.$O$17];">="&[.G94]);"") -> 3 | I94: of:=IF([.H93]<>[.H94];"INICIO";IF([.H95]<>[.H94];"FIN";"")) ->  | J94: of:=IF([.K93]<>[.K94];"INICIO";IF([.K95]<>[.K94];"FIN";"")) -> 
A95: of:=IF([.B95]<>"";TODAY()>[.B95];"") -> 0 | B95: of:=IFERROR(IF(AND(ISNUMBER([.B94]);([.B94]+1)<[Calendario.$F$5]);[.B94]+1;"");"") -> 2015-12-09 | C95: of:=IF(AND([.B95]>=[Calendario.$F$8];[.B95]<=[Calendario.$F$9];1);1;IF(AND([.B95]>=[Calendario.$F$12];[.B95]<=[Calendario.$F$13]);2;IF(AND([.B95]>=[Calendario.$F$16];[.B95]<=[Calendario.$F$17]);3;""))) -> 1 | D95: of:=IF(COUNTIF([Calendario.$H$4:.$H$48];[.B95])>0;"FIESTA";"") ->  | E95: of:=IF([.B95]<>"";VLOOKUP(WEEKDAY([.B95];3);[Calendario.$A$4:.$C$11];2);"") -> Miercoles | F95: of:=IF([.B95]<>"";IF([.D95]<>"FIESTA";VLOOKUP(WEEKDAY([.B95];3);[Calendario.$A$4:.$C$11];3);0);"") -> 1 | G95: of:=IF(ISNUMBER([.F95]);[.F95]+[.G94];"") -> 40 | H95: of:=IF(AND([.G95]<=[Unidades.$G$26];[.G95]<=[Unidades.$F$18];[Unidades.$F$18]>0);[Unidades.$D$18]+1-COUNTIFS([Unidades.$O$3:.$O$17];">="&[.G95]);"") -> 3 | I95: of:=IF([.H94]<>[.H95];"INICIO";IF([.H96]<>[.H95];"FIN";"")) ->  | J95: of:=IF([.K94]<>[.K95];"INICIO";IF([.K96]<>[.K95];"FIN";"")) -> 
A96: of:=IF([.B96]<>"";TODAY()>[.B96];"") -> 0 | B96: of:=IFERROR(IF(AND(ISNUMBER([.B95]);([.B95]+1)<[Calendario.$F$5]);[.B95]+1;"");"") -> 2015-12-10 | C96: of:=IF(AND([.B96]>=[Calendario.$F$8];[.B96]<=[Calendario.$F$9];1);1;IF(AND([.B96]>=[Calendario.$F$12];[.B96]<=[Calendario.$F$13]);2;IF(AND([.B96]>=[Calendario.$F$16];[.B96]<=[Calendario.$F$17]);3;""))) -> 1 | D96: of:=IF(COUNTIF([Calendario.$H$4:.$H$48];[.B96])>0;"FIESTA";"") ->  | E96: of:=IF([.B96]<>"";VLOOKUP(WEEKDAY([.B96];3);[Calendario.$A$4:.$C$11];2);"") -> Jueves | F96: of:=IF([.B96]<>"";IF([.D96]<>"FIESTA";VLOOKUP(WEEKDAY([.B96];3);[Calendario.$A$4:.$C$11];3);0);"") -> 0 | G96: of:=IF(ISNUMBER([.F96]);[.F96]+[.G95];"") -> 40 | H96: of:=IF(AND([.G96]<=[Unidades.$G$26];[.G96]<=[Unidades.$F$18];[Unidades.$F$18]>0);[Unidades.$D$18]+1-COUNTIFS([Unidades.$O$3:.$O$17];">="&[.G96]);"") -> 3 | I96: of:=IF([.H95]<>[.H96];"INICIO";IF([.H97]<>[.H96];"FIN";"")) ->  | J96: of:=IF([.K95]<>[.K96];"INICIO";IF([.K97]<>[.K96];"FIN";"")) -> 
A97: of:=IF([.B97]<>"";TODAY()>[.B97];"") -> 0 | B97: of:=IFERROR(IF(AND(ISNUMBER([.B96]);([.B96]+1)<[Calendario.$F$5]);[.B96]+1;"");"") -> 2015-12-11 | C97: of:=IF(AND([.B97]>=[Calendario.$F$8];[.B97]<=[Calendario.$F$9];1);1;IF(AND([.B97]>=[Calendario.$F$12];[.B97]<=[Calendario.$F$13]);2;IF(AND([.B97]>=[Calendario.$F$16];[.B97]<=[Calendario.$F$17]);3;""))) -> 1 | D97: of:=IF(COUNTIF([Calendario.$H$4:.$H$48];[.B97])>0;"FIESTA";"") ->  | E97: of:=IF([.B97]<>"";VLOOKUP(WEEKDAY([.B97];3);[Calendario.$A$4:.$C$11];2);"") -> Viernes | F97: of:=IF([.B97]<>"";IF([.D97]<>"FIESTA";VLOOKUP(WEEKDAY([.B97];3);[Calendario.$A$4:.$C$11];3);0);"") -> 1 | G97: of:=IF(ISNUMBER([.F97]);[.F97]+[.G96];"") -> 41 | H97: of:=IF(AND([.G97]<=[Unidades.$G$26];[.G97]<=[Unidades.$F$18];[Unidades.$F$18]>0);[Unidades.$D$18]+1-COUNTIFS([Unidades.$O$3:.$O$17];">="&[.G97]);"") -> 3 | I97: of:=IF([.H96]<>[.H97];"INICIO";IF([.H98]<>[.H97];"FIN";"")) ->  | J97: of:=IF([.K96]<>[.K97];"INICIO";IF([.K98]<>[.K97];"FIN";"")) -> 
A98: of:=IF([.B98]<>"";TODAY()>[.B98];"") -> 0 | B98: of:=IFERROR(IF(AND(ISNUMBER([.B97]);([.B97]+1)<[Calendario.$F$5]);[.B97]+1;"");"") -> 2015-12-12 | C98: of:=IF(AND([.B98]>=[Calendario.$F$8];[.B98]<=[Calendario.$F$9];1);1;IF(AND([.B98]>=[Calendario.$F$12];[.B98]<=[Calendario.$F$13]);2;IF(AND([.B98]>=[Calendario.$F$16];[.B98]<=[Calendario.$F$17]);3;""))) -> 2 | D98: of:=IF(COUNTIF([Calendario.$H$4:.$H$48];[.B98])>0;"FIESTA";"") ->  | E98: of:=IF([.B98]<>"";VLOOKUP(WEEKDAY([.B98];3);[Calendario.$A$4:.$C$11];2);"") -> Sabado | F98: of:=IF([.B98]<>"";IF([.D98]<>"FIESTA";VLOOKUP(WEEKDAY([.B98];3);[Calendario.$A$4:.$C$11];3);0);"") -> 0 | G98: of:=IF(ISNUMBER([.F98]);[.F98]+[.G97];"") -> 41 | H98: of:=IF(AND([.G98]<=[Unidades.$G$26];[.G98]<=[Unidades.$F$18];[Unidades.$F$18]>0);[Unidades.$D$18]+1-COUNTIFS([Unidades.$O$3:.$O$17];">="&[.G98]);"") -> 3 | I98: of:=IF([.H97]<>[.H98];"INICIO";IF([.H99]<>[.H98];"FIN";"")) ->  | J98: of:=IF([.K97]<>[.K98];"INICIO";IF([.K99]<>[.K98];"FIN";"")) -> 
A99: of:=IF([.B99]<>"";TODAY()>[.B99];"") -> 0 | B99: of:=IFERROR(IF(AND(ISNUMBER([.B98]);([.B98]+1)<[Calendario.$F$5]);[.B98]+1;"");"") -> 2015-12-13 | C99: of:=IF(AND([.B99]>=[Calendario.$F$8];[.B99]<=[Calendario.$F$9];1);1;IF(AND([.B99]>=[Calendario.$F$12];[.B99]<=[Calendario.$F$13]);2;IF(AND([.B99]>=[Calendario.$F$16];[.B99]<=[Calendario.$F$17]);3;""))) -> 2 | D99: of:=IF(COUNTIF([Calendario.$H$4:.$H$48];[.B99])>0;"FIESTA";"") ->  | E99: of:=IF([.B99]<>"";VLOOKUP(WEEKDAY([.B99];3);[Calendario.$A$4:.$C$11];2);"") -> Domingo | F99: of:=IF([.B99]<>"";IF([.D99]<>"FIESTA";VLOOKUP(WEEKDAY([.B99];3);[Calendario.$A$4:.$C$11];3);0);"") -> 0 | G99: of:=IF(ISNUMBER([.F99]);[.F99]+[.G98];"") -> 41 | H99: of:=IF(AND([.G99]<=[Unidades.$G$26];[.G99]<=[Unidades.$F$18];[Unidades.$F$18]>0);[Unidades.$D$18]+1-COUNTIFS([Unidades.$O$3:.$O$17];">="&[.G99]);"") -> 3 | I99: of:=IF([.H98]<>[.H99];"INICIO";IF([.H100]<>[.H99];"FIN";"")) ->  | J99: of:=IF([.K98]<>[.K99];"INICIO";IF([.K100]<>[.K99];"FIN";"")) -> 
A100: of:=IF([.B100]<>"";TODAY()>[.B100];"") -> 0 | B100: of:=IFERROR(IF(AND(ISNUMBER([.B99]);([.B99]+1)<[Calendario.$F$5]);[.B99]+1;"");"") -> 2015-12-14 | C100: of:=IF(AND([.B100]>=[Calendario.$F$8];[.B100]<=[Calendario.$F$9];1);1;IF(AND([.B100]>=[Calendario.$F$12];[.B100]<=[Calendario.$F$13]);2;IF(AND([.B100]>=[Calendario.$F$16];[.B100]<=[Calendario.$F$17]);3;""))) -> 2 | D100: of:=IF(COUNTIF([Calendario.$H$4:.$H$48];[.B100])>0;"FIESTA";"") ->  | E100: of:=IF([.B100]<>"";VLOOKUP(WEEKDAY([.B100];3);[Calendario.$A$4:.$C$11];2);"") -> Lunes | F100: of:=IF([.B100]<>"";IF([.D100]<>"FIESTA";VLOOKUP(WEEKDAY([.B100];3);[Calendario.$A$4:.$C$11];3);0);"") -> 1 | G100: of:=IF(ISNUMBER([.F100]);[.F100]+[.G99];"") -> 42 | H100: of:=IF(AND([.G100]<=[Unidades.$G$26];[.G100]<=[Unidades.$F$18];[Unidades.$F$18]>0);[Unidades.$D$18]+1-COUNTIFS([Unidades.$O$3:.$O$17];">="&[.G100]);"") -> 3 | I100: of:=IF([.H99]<>[.H100];"INICIO";IF([.H101]<>[.H100];"FIN";"")) ->  | J100: of:=IF([.K99]<>[.K100];"INICIO";IF([.K101]<>[.K100];"FIN";"")) -> 
A101: of:=IF([.B101]<>"";TODAY()>[.B101];"") -> 0 | B101: of:=IFERROR(IF(AND(ISNUMBER([.B100]);([.B100]+1)<[Calendario.$F$5]);[.B100]+1;"");"") -> 2015-12-15 | C101: of:=IF(AND([.B101]>=[Calendario.$F$8];[.B101]<=[Calendario.$F$9];1);1;IF(AND([.B101]>=[Calendario.$F$12];[.B101]<=[Calendario.$F$13]);2;IF(AND([.B101]>=[Calendario.$F$16];[.B101]<=[Calendario.$F$17]);3;""))) -> 2 | D101: of:=IF(COUNTIF([Calendario.$H$4:.$H$48];[.B101])>0;"FIESTA";"") ->  | E101: of:=IF([.B101]<>"";VLOOKUP(WEEKDAY([.B101];3);[Calendario.$A$4:.$C$11];2);"") -> Martes | F101: of:=IF([.B101]<>"";IF([.D101]<>"FIESTA";VLOOKUP(WEEKDAY([.B101];3);[Calendario.$A$4:.$C$11];3);0);"") -> 0 | G101: of:=IF(ISNUMBER([.F101]);[.F101]+[.G100];"") -> 42 | H101: of:=IF(AND([.G101]<=[Unidades.$G$26];[.G101]<=[Unidades.$F$18];[Unidades.$F$18]>0);[Unidades.$D$18]+1-COUNTIFS([Unidades.$O$3:.$O$17];">="&[.G101]);"") -> 3 | I101: of:=IF([.H100]<>[.H101];"INICIO";IF([.H102]<>[.H101];"FIN";"")) ->  | J101: of:=IF([.K100]<>[.K101];"INICIO";IF([.K102]<>[.K101];"FIN";"")) -> 
A102: of:=IF([.B102]<>"";TODAY()>[.B102];"") -> 0 | B102: of:=IFERROR(IF(AND(ISNUMBER([.B101]);([.B101]+1)<[Calendario.$F$5]);[.B101]+1;"");"") -> 2015-12-16 | C102: of:=IF(AND([.B102]>=[Calendario.$F$8];[.B102]<=[Calendario.$F$9];1);1;IF(AND([.B102]>=[Calendario.$F$12];[.B102]<=[Calendario.$F$13]);2;IF(AND([.B102]>=[Calendario.$F$16];[.B102]<=[Calendario.$F$17]);3;""))) -> 2 | D102: of:=IF(COUNTIF([Calendario.$H$4:.$H$48];[.B102])>0;"FIESTA";"") ->  | E102: of:=IF([.B102]<>"";VLOOKUP(WEEKDAY([.B102];3);[Calendario.$A$4:.$C$11];2);"") -> Miercoles | F102: of:=IF([.B102]<>"";IF([.D102]<>"FIESTA";VLOOKUP(WEEKDAY([.B102];3);[Calendario.$A$4:.$C$11];3);0);"") -> 1 | G102: of:=IF(ISNUMBER([.F102]);[.F102]+[.G101];"") -> 43 | H102: of:=IF(AND([.G102]<=[Unidades.$G$26];[.G102]<=[Unidades.$F$18];[Unidades.$F$18]>0);[Unidades.$D$18]+1-COUNTIFS([Unidades.$O$3:.$O$17];">="&[.G102]);"") -> 3 | I102: of:=IF([.H101]<>[.H102];"INICIO";IF([.H103]<>[.H102];"FIN";"")) ->  | J102: of:=IF([.K101]<>[.K102];"INICIO";IF([.K103]<>[.K102];"FIN";"")) -> 
A103: of:=IF([.B103]<>"";TODAY()>[.B103];"") -> 0 | B103: of:=IFERROR(IF(AND(ISNUMBER([.B102]);([.B102]+1)<[Calendario.$F$5]);[.B102]+1;"");"") -> 2015-12-17 | C103: of:=IF(AND([.B103]>=[Calendario.$F$8];[.B103]<=[Calendario.$F$9];1);1;IF(AND([.B103]>=[Calendario.$F$12];[.B103]<=[Calendario.$F$13]);2;IF(AND([.B103]>=[Calendario.$F$16];[.B103]<=[Calendario.$F$17]);3;""))) -> 2 | D103: of:=IF(COUNTIF([Calendario.$H$4:.$H$48];[.B103])>0;"FIESTA";"") ->  | E103: of:=IF([.B103]<>"";VLOOKUP(WEEKDAY([.B103];3);[Calendario.$A$4:.$C$11];2);"") -> Jueves | F103: of:=IF([.B103]<>"";IF([.D103]<>"FIESTA";VLOOKUP(WEEKDAY([.B103];3);[Calendario.$A$4:.$C$11];3);0);"") -> 0 | G103: of:=IF(ISNUMBER([.F103]);[.F103]+[.G102];"") -> 43 | H103: of:=IF(AND([.G103]<=[Unidades.$G$26];[.G103]<=[Unidades.$F$18];[Unidades.$F$18]>0);[Unidades.$D$18]+1-COUNTIFS([Unidades.$O$3:.$O$17];">="&[.G103]);"") -> 3 | I103: of:=IF([.H102]<>[.H103];"INICIO";IF([.H104]<>[.H103];"FIN";"")) ->  | J103: of:=IF([.K102]<>[.K103];"INICIO";IF([.K104]<>[.K103];"FIN";"")) -> 
A104: of:=IF([.B104]<>"";TODAY()>[.B104];"") -> 0 | B104: of:=IFERROR(IF(AND(ISNUMBER([.B103]);([.B103]+1)<[Calendario.$F$5]);[.B103]+1;"");"") -> 2015-12-18 | C104: of:=IF(AND([.B104]>=[Calendario.$F$8];[.B104]<=[Calendario.$F$9];1);1;IF(AND([.B104]>=[Calendario.$F$12];[.B104]<=[Calendario.$F$13]);2;IF(AND([.B104]>=[Calendario.$F$16];[.B104]<=[Calendario.$F$17]);3;""))) -> 2 | D104: of:=IF(COUNTIF([Calendario.$H$4:.$H$48];[.B104])>0;"FIESTA";"") ->  | E104: of:=IF([.B104]<>"";VLOOKUP(WEEKDAY([.B104];3);[Calendario.$A$4:.$C$11];2);"") -> Viernes | F104: of:=IF([.B104]<>"";IF([.D104]<>"FIESTA";VLOOKUP(WEEKDAY([.B104];3);[Calendario.$A$4:.$C$11];3);0);"") -> 1 | G104: of:=IF(ISNUMBER([.F104]);[.F104]+[.G103];"") -> 44 | H104: of:=IF(AND([.G104]<=[Unidades.$G$26];[.G104]<=[Unidades.$F$18];[Unidades.$F$18]>0);[Unidades.$D$18]+1-COUNTIFS([Unidades.$O$3:.$O$17];">="&[.G104]);"") -> 3 | I104: of:=IF([.H103]<>[.H104];"INICIO";IF([.H105]<>[.H104];"FIN";"")) ->  | J104: of:=IF([.K103]<>[.K104];"INICIO";IF([.K105]<>[.K104];"FIN";"")) -> 
A105: of:=IF([.B105]<>"";TODAY()>[.B105];"") -> 0 | B105: of:=IFERROR(IF(AND(ISNUMBER([.B104]);([.B104]+1)<[Calendario.$F$5]);[.B104]+1;"");"") -> 2015-12-19 | C105: of:=IF(AND([.B105]>=[Calendario.$F$8];[.B105]<=[Calendario.$F$9];1);1;IF(AND([.B105]>=[Calendario.$F$12];[.B105]<=[Calendario.$F$13]);2;IF(AND([.B105]>=[Calendario.$F$16];[.B105]<=[Calendario.$F$17]);3;""))) -> 2 | D105: of:=IF(COUNTIF([Calendario.$H$4:.$H$48];[.B105])>0;"FIESTA";"") ->  | E105: of:=IF([.B105]<>"";VLOOKUP(WEEKDAY([.B105];3);[Calendario.$A$4:.$C$11];2);"") -> Sabado | F105: of:=IF([.B105]<>"";IF([.D105]<>"FIESTA";VLOOKUP(WEEKDAY([.B105];3);[Calendario.$A$4:.$C$11];3);0);"") -> 0 | G105: of:=IF(ISNUMBER([.F105]);[.F105]+[.G104];"") -> 44 | H105: of:=IF(AND([.G105]<=[Unidades.$G$26];[.G105]<=[Unidades.$F$18];[Unidades.$F$18]>0);[Unidades.$D$18]+1-COUNTIFS([Unidades.$O$3:.$O$17];">="&[.G105]);"") -> 3 | I105: of:=IF([.H104]<>[.H105];"INICIO";IF([.H106]<>[.H105];"FIN";"")) ->  | J105: of:=IF([.K104]<>[.K105];"INICIO";IF([.K106]<>[.K105];"FIN";"")) -> 
A106: of:=IF([.B106]<>"";TODAY()>[.B106];"") -> 0 | B106: of:=IFERROR(IF(AND(ISNUMBER([.B105]);([.B105]+1)<[Calendario.$F$5]);[.B105]+1;"");"") -> 2015-12-20 | C106: of:=IF(AND([.B106]>=[Calendario.$F$8];[.B106]<=[Calendario.$F$9];1);1;IF(AND([.B106]>=[Calendario.$F$12];[.B106]<=[Calendario.$F$13]);2;IF(AND([.B106]>=[Calendario.$F$16];[.B106]<=[Calendario.$F$17]);3;""))) -> 2 | D106: of:=IF(COUNTIF([Calendario.$H$4:.$H$48];[.B106])>0;"FIESTA";"") ->  | E106: of:=IF([.B106]<>"";VLOOKUP(WEEKDAY([.B106];3);[Calendario.$A$4:.$C$11];2);"") -> Domingo | F106: of:=IF([.B106]<>"";IF([.D106]<>"FIESTA";VLOOKUP(WEEKDAY([.B106];3);[Calendario.$A$4:.$C$11];3);0);"") -> 0 | G106: of:=IF(ISNUMBER([.F106]);[.F106]+[.G105];"") -> 44 | H106: of:=IF(AND([.G106]<=[Unidades.$G$26];[.G106]<=[Unidades.$F$18];[Unidades.$F$18]>0);[Unidades.$D$18]+1-COUNTIFS([Unidades.$O$3:.$O$17];">="&[.G106]);"") -> 3 | I106: of:=IF([.H105]<>[.H106];"INICIO";IF([.H107]<>[.H106];"FIN";"")) ->  | J106: of:=IF([.K105]<>[.K106];"INICIO";IF([.K107]<>[.K106];"FIN";"")) -> 
A107: of:=IF([.B107]<>"";TODAY()>[.B107];"") -> 0 | B107: of:=IFERROR(IF(AND(ISNUMBER([.B106]);([.B106]+1)<[Calendario.$F$5]);[.B106]+1;"");"") -> 2015-12-21 | C107: of:=IF(AND([.B107]>=[Calendario.$F$8];[.B107]<=[Calendario.$F$9];1);1;IF(AND([.B107]>=[Calendario.$F$12];[.B107]<=[Calendario.$F$13]);2;IF(AND([.B107]>=[Calendario.$F$16];[.B107]<=[Calendario.$F$17]);3;""))) -> 2 | D107: of:=IF(COUNTIF([Calendario.$H$4:.$H$48];[.B107])>0;"FIESTA";"") ->  | E107: of:=IF([.B107]<>"";VLOOKUP(WEEKDAY([.B107];3);[Calendario.$A$4:.$C$11];2);"") -> Lunes | F107: of:=IF([.B107]<>"";IF([.D107]<>"FIESTA";VLOOKUP(WEEKDAY([.B107];3);[Calendario.$A$4:.$C$11];3);0);"") -> 1 | G107: of:=IF(ISNUMBER([.F107]);[.F107]+[.G106];"") -> 45 | H107: of:=IF(AND([.G107]<=[Unidades.$G$26];[.G107]<=[Unidades.$F$18];[Unidades.$F$18]>0);[Unidades.$D$18]+1-COUNTIFS([Unidades.$O$3:.$O$17];">="&[.G107]);"") -> 3 | I107: of:=IF([.H106]<>[.H107];"INICIO";IF([.H108]<>[.H107];"FIN";"")) ->  | J107: of:=IF([.K106]<>[.K107];"INICIO";IF([.K108]<>[.K107];"FIN";"")) -> 
A108: of:=IF([.B108]<>"";TODAY()>[.B108];"") -> 0 | B108: of:=IFERROR(IF(AND(ISNUMBER([.B107]);([.B107]+1)<[Calendario.$F$5]);[.B107]+1;"");"") -> 2015-12-22 | C108: of:=IF(AND([.B108]>=[Calendario.$F$8];[.B108]<=[Calendario.$F$9];1);1;IF(AND([.B108]>=[Calendario.$F$12];[.B108]<=[Calendario.$F$13]);2;IF(AND([.B108]>=[Calendario.$F$16];[.B108]<=[Calendario.$F$17]);3;""))) -> 2 | D108: of:=IF(COUNTIF([Calendario.$H$4:.$H$48];[.B108])>0;"FIESTA";"") ->  | E108: of:=IF([.B108]<>"";VLOOKUP(WEEKDAY([.B108];3);[Calendario.$A$4:.$C$11];2);"") -> Martes | F108: of:=IF([.B108]<>"";IF([.D108]<>"FIESTA";VLOOKUP(WEEKDAY([.B108];3);[Calendario.$A$4:.$C$11];3);0);"") -> 0 | G108: of:=IF(ISNUMBER([.F108]);[.F108]+[.G107];"") -> 45 | H108: of:=IF(AND([.G108]<=[Unidades.$G$26];[.G108]<=[Unidades.$F$18];[Unidades.$F$18]>0);[Unidades.$D$18]+1-COUNTIFS([Unidades.$O$3:.$O$17];">="&[.G108]);"") -> 3 | I108: of:=IF([.H107]<>[.H108];"INICIO";IF([.H109]<>[.H108];"FIN";"")) ->  | J108: of:=IF([.K107]<>[.K108];"INICIO";IF([.K109]<>[.K108];"FIN";"")) -> 
A109: of:=IF([.B109]<>"";TODAY()>[.B109];"") -> 0 | B109: of:=IFERROR(IF(AND(ISNUMBER([.B108]);([.B108]+1)<[Calendario.$F$5]);[.B108]+1;"");"") -> 2015-12-23 | C109: of:=IF(AND([.B109]>=[Calendario.$F$8];[.B109]<=[Calendario.$F$9];1);1;IF(AND([.B109]>=[Calendario.$F$12];[.B109]<=[Calendario.$F$13]);2;IF(AND([.B109]>=[Calendario.$F$16];[.B109]<=[Calendario.$F$17]);3;""))) -> 2 | D109: of:=IF(COUNTIF([Calendario.$H$4:.$H$48];[.B109])>0;"FIESTA";"") -> FIESTA | E109: of:=IF([.B109]<>"";VLOOKUP(WEEKDAY([.B109];3);[Calendario.$A$4:.$C$11];2);"") -> Miercoles | F109: of:=IF([.B109]<>"";IF([.D109]<>"FIESTA";VLOOKUP(WEEKDAY([.B109];3);[Calendario.$A$4:.$C$11];3);0);"") -> 0 | G109: of:=IF(ISNUMBER([.F109]);[.F109]+[.G108];"") -> 45 | H109: of:=IF(AND([.G109]<=[Unidades.$G$26];[.G109]<=[Unidades.$F$18];[Unidades.$F$18]>0);[Unidades.$D$18]+1-COUNTIFS([Unidades.$O$3:.$O$17];">="&[.G109]);"") -> 3 | I109: of:=IF([.H108]<>[.H109];"INICIO";IF([.H110]<>[.H109];"FIN";"")) ->  | J109: of:=IF([.K108]<>[.K109];"INICIO";IF([.K110]<>[.K109];"FIN";"")) -> 
A110: of:=IF([.B110]<>"";TODAY()>[.B110];"") -> 0 | B110: of:=IFERROR(IF(AND(ISNUMBER([.B109]);([.B109]+1)<[Calendario.$F$5]);[.B109]+1;"");"") -> 2015-12-24 | C110: of:=IF(AND([.B110]>=[Calendario.$F$8];[.B110]<=[Calendario.$F$9];1);1;IF(AND([.B110]>=[Calendario.$F$12];[.B110]<=[Calendario.$F$13]);2;IF(AND([.B110]>=[Calendario.$F$16];[.B110]<=[Calendario.$F$17]);3;""))) -> 2 | D110: of:=IF(COUNTIF([Calendario.$H$4:.$H$48];[.B110])>0;"FIESTA";"") -> FIESTA | E110: of:=IF([.B110]<>"";VLOOKUP(WEEKDAY([.B110];3);[Calendario.$A$4:.$C$11];2);"") -> Jueves | F110: of:=IF([.B110]<>"";IF([.D110]<>"FIESTA";VLOOKUP(WEEKDAY([.B110];3);[Calendario.$A$4:.$C$11];3);0);"") -> 0 | G110: of:=IF(ISNUMBER([.F110]);[.F110]+[.G109];"") -> 45 | H110: of:=IF(AND([.G110]<=[Unidades.$G$26];[.G110]<=[Unidades.$F$18];[Unidades.$F$18]>0);[Unidades.$D$18]+1-COUNTIFS([Unidades.$O$3:.$O$17];">="&[.G110]);"") -> 3 | I110: of:=IF([.H109]<>[.H110];"INICIO";IF([.H111]<>[.H110];"FIN";"")) ->  | J110: of:=IF([.K109]<>[.K110];"INICIO";IF([.K111]<>[.K110];"FIN";"")) -> 
A111: of:=IF([.B111]<>"";TODAY()>[.B111];"") -> 0 | B111: of:=IFERROR(IF(AND(ISNUMBER([.B110]);([.B110]+1)<[Calendario.$F$5]);[.B110]+1;"");"") -> 2015-12-25 | C111: of:=IF(AND([.B111]>=[Calendario.$F$8];[.B111]<=[Calendario.$F$9];1);1;IF(AND([.B111]>=[Calendario.$F$12];[.B111]<=[Calendario.$F$13]);2;IF(AND([.B111]>=[Calendario.$F$16];[.B111]<=[Calendario.$F$17]);3;""))) -> 2 | D111: of:=IF(COUNTIF([Calendario.$H$4:.$H$48];[.B111])>0;"FIESTA";"") -> FIESTA | E111: of:=IF([.B111]<>"";VLOOKUP(WEEKDAY([.B111];3);[Calendario.$A$4:.$C$11];2);"") -> Viernes | F111: of:=IF([.B111]<>"";IF([.D111]<>"FIESTA";VLOOKUP(WEEKDAY([.B111];3);[Calendario.$A$4:.$C$11];3);0);"") -> 0 | G111: of:=IF(ISNUMBER([.F111]);[.F111]+[.G110];"") -> 45 | H111: of:=IF(AND([.G111]<=[Unidades.$G$26];[.G111]<=[Unidades.$F$18];[Unidades.$F$18]>0);[Unidades.$D$18]+1-COUNTIFS([Unidades.$O$3:.$O$17];">="&[.G111]);"") -> 3 | I111: of:=IF([.H110]<>[.H111];"INICIO";IF([.H112]<>[.H111];"FIN";"")) ->  | J111: of:=IF([.K110]<>[.K111];"INICIO";IF([.K112]<>[.K111];"FIN";"")) -> 
A112: of:=IF([.B112]<>"";TODAY()>[.B112];"") -> 0 | B112: of:=IFERROR(IF(AND(ISNUMBER([.B111]);([.B111]+1)<[Calendario.$F$5]);[.B111]+1;"");"") -> 2015-12-26 | C112: of:=IF(AND([.B112]>=[Calendario.$F$8];[.B112]<=[Calendario.$F$9];1);1;IF(AND([.B112]>=[Calendario.$F$12];[.B112]<=[Calendario.$F$13]);2;IF(AND([.B112]>=[Calendario.$F$16];[.B112]<=[Calendario.$F$17]);3;""))) -> 2 | D112: of:=IF(COUNTIF([Calendario.$H$4:.$H$48];[.B112])>0;"FIESTA";"") -> FIESTA | E112: of:=IF([.B112]<>"";VLOOKUP(WEEKDAY([.B112];3);[Calendario.$A$4:.$C$11];2);"") -> Sabado | F112: of:=IF([.B112]<>"";IF([.D112]<>"FIESTA";VLOOKUP(WEEKDAY([.B112];3);[Calendario.$A$4:.$C$11];3);0);"") -> 0 | G112: of:=IF(ISNUMBER([.F112]);[.F112]+[.G111];"") -> 45 | H112: of:=IF(AND([.G112]<=[Unidades.$G$26];[.G112]<=[Unidades.$F$18];[Unidades.$F$18]>0);[Unidades.$D$18]+1-COUNTIFS([Unidades.$O$3:.$O$17];">="&[.G112]);"") -> 3 | I112: of:=IF([.H111]<>[.H112];"INICIO";IF([.H113]<>[.H112];"FIN";"")) ->  | J112: of:=IF([.K111]<>[.K112];"INICIO";IF([.K113]<>[.K112];"FIN";"")) -> 
A113: of:=IF([.B113]<>"";TODAY()>[.B113];"") -> 0 | B113: of:=IFERROR(IF(AND(ISNUMBER([.B112]);([.B112]+1)<[Calendario.$F$5]);[.B112]+1;"");"") -> 2015-12-27 | C113: of:=IF(AND([.B113]>=[Calendario.$F$8];[.B113]<=[Calendario.$F$9];1);1;IF(AND([.B113]>=[Calendario.$F$12];[.B113]<=[Calendario.$F$13]);2;IF(AND([.B113]>=[Calendario.$F$16];[.B113]<=[Calendario.$F$17]);3;""))) -> 2 | D113: of:=IF(COUNTIF([Calendario.$H$4:.$H$48];[.B113])>0;"FIESTA";"") -> FIESTA | E113: of:=IF([.B113]<>"";VLOOKUP(WEEKDAY([.B113];3);[Calendario.$A$4:.$C$11];2);"") -> Domingo | F113: of:=IF([.B113]<>"";IF([.D113]<>"FIESTA";VLOOKUP(WEEKDAY([.B113];3);[Calendario.$A$4:.$C$11];3);0);"") -> 0 | G113: of:=IF(ISNUMBER([.F113]);[.F113]+[.G112];"") -> 45 | H113: of:=IF(AND([.G113]<=[Unidades.$G$26];[.G113]<=[Unidades.$F$18];[Unidades.$F$18]>0);[Unidades.$D$18]+1-COUNTIFS([Unidades.$O$3:.$O$17];">="&[.G113]);"") -> 3 | I113: of:=IF([.H112]<>[.H113];"INICIO";IF([.H114]<>[.H113];"FIN";"")) ->  | J113: of:=IF([.K112]<>[.K113];"INICIO";IF([.K114]<>[.K113];"FIN";"")) -> 
A114: of:=IF([.B114]<>"";TODAY()>[.B114];"") -> 0 | B114: of:=IFERROR(IF(AND(ISNUMBER([.B113]);([.B113]+1)<[Calendario.$F$5]);[.B113]+1;"");"") -> 2015-12-28 | C114: of:=IF(AND([.B114]>=[Calendario.$F$8];[.B114]<=[Calendario.$F$9];1);1;IF(AND([.B114]>=[Calendario.$F$12];[.B114]<=[Calendario.$F$13]);2;IF(AND([.B114]>=[Calendario.$F$16];[.B114]<=[Calendario.$F$17]);3;""))) -> 2 | D114: of:=IF(COUNTIF([Calendario.$H$4:.$H$48];[.B114])>0;"FIESTA";"") -> FIESTA | E114: of:=IF([.B114]<>"";VLOOKUP(WEEKDAY([.B114];3);[Calendario.$A$4:.$C$11];2);"") -> Lunes | F114: of:=IF([.B114]<>"";IF([.D114]<>"FIESTA";VLOOKUP(WEEKDAY([.B114];3);[Calendario.$A$4:.$C$11];3);0);"") -> 0 | G114: of:=IF(ISNUMBER([.F114]);[.F114]+[.G113];"") -> 45 | H114: of:=IF(AND([.G114]<=[Unidades.$G$26];[.G114]<=[Unidades.$F$18];[Unidades.$F$18]>0);[Unidades.$D$18]+1-COUNTIFS([Unidades.$O$3:.$O$17];">="&[.G114]);"") -> 3 | I114: of:=IF([.H113]<>[.H114];"INICIO";IF([.H115]<>[.H114];"FIN";"")) ->  | J114: of:=IF([.K113]<>[.K114];"INICIO";IF([.K115]<>[.K114];"FIN";"")) -> 
A115: of:=IF([.B115]<>"";TODAY()>[.B115];"") -> 0 | B115: of:=IFERROR(IF(AND(ISNUMBER([.B114]);([.B114]+1)<[Calendario.$F$5]);[.B114]+1;"");"") -> 2015-12-29 | C115: of:=IF(AND([.B115]>=[Calendario.$F$8];[.B115]<=[Calendario.$F$9];1);1;IF(AND([.B115]>=[Calendario.$F$12];[.B115]<=[Calendario.$F$13]);2;IF(AND([.B115]>=[Calendario.$F$16];[.B115]<=[Calendario.$F$17]);3;""))) -> 2 | D115: of:=IF(COUNTIF([Calendario.$H$4:.$H$48];[.B115])>0;"FIESTA";"") -> FIESTA | E115: of:=IF([.B115]<>"";VLOOKUP(WEEKDAY([.B115];3);[Calendario.$A$4:.$C$11];2);"") -> Martes | F115: of:=IF([.B115]<>"";IF([.D115]<>"FIESTA";VLOOKUP(WEEKDAY([.B115];3);[Calendario.$A$4:.$C$11];3);0);"") -> 0 | G115: of:=IF(ISNUMBER([.F115]);[.F115]+[.G114];"") -> 45 | H115: of:=IF(AND([.G115]<=[Unidades.$G$26];[.G115]<=[Unidades.$F$18];[Unidades.$F$18]>0);[Unidades.$D$18]+1-COUNTIFS([Unidades.$O$3:.$O$17];">="&[.G115]);"") -> 3 | I115: of:=IF([.H114]<>[.H115];"INICIO";IF([.H116]<>[.H115];"FIN";"")) ->  | J115: of:=IF([.K114]<>[.K115];"INICIO";IF([.K116]<>[.K115];"FIN";"")) -> 
A116: of:=IF([.B116]<>"";TODAY()>[.B116];"") -> 0 | B116: of:=IFERROR(IF(AND(ISNUMBER([.B115]);([.B115]+1)<[Calendario.$F$5]);[.B115]+1;"");"") -> 2015-12-30 | C116: of:=IF(AND([.B116]>=[Calendario.$F$8];[.B116]<=[Calendario.$F$9];1);1;IF(AND([.B116]>=[Calendario.$F$12];[.B116]<=[Calendario.$F$13]);2;IF(AND([.B116]>=[Calendario.$F$16];[.B116]<=[Calendario.$F$17]);3;""))) -> 2 | D116: of:=IF(COUNTIF([Calendario.$H$4:.$H$48];[.B116])>0;"FIESTA";"") -> FIESTA | E116: of:=IF([.B116]<>"";VLOOKUP(WEEKDAY([.B116];3);[Calendario.$A$4:.$C$11];2);"") -> Miercoles | F116: of:=IF([.B116]<>"";IF([.D116]<>"FIESTA";VLOOKUP(WEEKDAY([.B116];3);[Calendario.$A$4:.$C$11];3);0);"") -> 0 | G116: of:=IF(ISNUMBER([.F116]);[.F116]+[.G115];"") -> 45 | H116: of:=IF(AND([.G116]<=[Unidades.$G$26];[.G116]<=[Unidades.$F$18];[Unidades.$F$18]>0);[Unidades.$D$18]+1-COUNTIFS([Unidades.$O$3:.$O$17];">="&[.G116]);"") -> 3 | I116: of:=IF([.H115]<>[.H116];"INICIO";IF([.H117]<>[.H116];"FIN";"")) ->  | J116: of:=IF([.K115]<>[.K116];"INICIO";IF([.K117]<>[.K116];"FIN";"")) -> 
A117: of:=IF([.B117]<>"";TODAY()>[.B117];"") -> 0 | B117: of:=IFERROR(IF(AND(ISNUMBER([.B116]);([.B116]+1)<[Calendario.$F$5]);[.B116]+1;"");"") -> 2015-12-31 | C117: of:=IF(AND([.B117]>=[Calendario.$F$8];[.B117]<=[Calendario.$F$9];1);1;IF(AND([.B117]>=[Calendario.$F$12];[.B117]<=[Calendario.$F$13]);2;IF(AND([.B117]>=[Calendario.$F$16];[.B117]<=[Calendario.$F$17]);3;""))) -> 2 | D117: of:=IF(COUNTIF([Calendario.$H$4:.$H$48];[.B117])>0;"FIESTA";"") -> FIESTA | E117: of:=IF([.B117]<>"";VLOOKUP(WEEKDAY([.B117];3);[Calendario.$A$4:.$C$11];2);"") -> Jueves | F117: of:=IF([.B117]<>"";IF([.D117]<>"FIESTA";VLOOKUP(WEEKDAY([.B117];3);[Calendario.$A$4:.$C$11];3);0);"") -> 0 | G117: of:=IF(ISNUMBER([.F117]);[.F117]+[.G116];"") -> 45 | H117: of:=IF(AND([.G117]<=[Unidades.$G$26];[.G117]<=[Unidades.$F$18];[Unidades.$F$18]>0);[Unidades.$D$18]+1-COUNTIFS([Unidades.$O$3:.$O$17];">="&[.G117]);"") -> 3 | I117: of:=IF([.H116]<>[.H117];"INICIO";IF([.H118]<>[.H117];"FIN";"")) ->  | J117: of:=IF([.K116]<>[.K117];"INICIO";IF([.K118]<>[.K117];"FIN";"")) -> 
A118: of:=IF([.B118]<>"";TODAY()>[.B118];"") -> 0 | B118: of:=IFERROR(IF(AND(ISNUMBER([.B117]);([.B117]+1)<[Calendario.$F$5]);[.B117]+1;"");"") -> 2016-01-01 | C118: of:=IF(AND([.B118]>=[Calendario.$F$8];[.B118]<=[Calendario.$F$9];1);1;IF(AND([.B118]>=[Calendario.$F$12];[.B118]<=[Calendario.$F$13]);2;IF(AND([.B118]>=[Calendario.$F$16];[.B118]<=[Calendario.$F$17]);3;""))) -> 2 | D118: of:=IF(COUNTIF([Calendario.$H$4:.$H$48];[.B118])>0;"FIESTA";"") -> FIESTA | E118: of:=IF([.B118]<>"";VLOOKUP(WEEKDAY([.B118];3);[Calendario.$A$4:.$C$11];2);"") -> Viernes | F118: of:=IF([.B118]<>"";IF([.D118]<>"FIESTA";VLOOKUP(WEEKDAY([.B118];3);[Calendario.$A$4:.$C$11];3);0);"") -> 0 | G118: of:=IF(ISNUMBER([.F118]);[.F118]+[.G117];"") -> 45 | H118: of:=IF(AND([.G118]<=[Unidades.$G$26];[.G118]<=[Unidades.$F$18];[Unidades.$F$18]>0);[Unidades.$D$18]+1-COUNTIFS([Unidades.$O$3:.$O$17];">="&[.G118]);"") -> 3 | I118: of:=IF([.H117]<>[.H118];"INICIO";IF([.H119]<>[.H118];"FIN";"")) ->  | J118: of:=IF([.K117]<>[.K118];"INICIO";IF([.K119]<>[.K118];"FIN";"")) -> 
A119: of:=IF([.B119]<>"";TODAY()>[.B119];"") -> 0 | B119: of:=IFERROR(IF(AND(ISNUMBER([.B118]);([.B118]+1)<[Calendario.$F$5]);[.B118]+1;"");"") -> 2016-01-02 | C119: of:=IF(AND([.B119]>=[Calendario.$F$8];[.B119]<=[Calendario.$F$9];1);1;IF(AND([.B119]>=[Calendario.$F$12];[.B119]<=[Calendario.$F$13]);2;IF(AND([.B119]>=[Calendario.$F$16];[.B119]<=[Calendario.$F$17]);3;""))) -> 2 | D119: of:=IF(COUNTIF([Calendario.$H$4:.$H$48];[.B119])>0;"FIESTA";"") -> FIESTA | E119: of:=IF([.B119]<>"";VLOOKUP(WEEKDAY([.B119];3);[Calendario.$A$4:.$C$11];2);"") -> Sabado | F119: of:=IF([.B119]<>"";IF([.D119]<>"FIESTA";VLOOKUP(WEEKDAY([.B119];3);[Calendario.$A$4:.$C$11];3);0);"") -> 0 | G119: of:=IF(ISNUMBER([.F119]);[.F119]+[.G118];"") -> 45 | H119: of:=IF(AND([.G119]<=[Unidades.$G$26];[.G119]<=[Unidades.$F$18];[Unidades.$F$18]>0);[Unidades.$D$18]+1-COUNTIFS([Unidades.$O$3:.$O$17];">="&[.G119]);"") -> 3 | I119: of:=IF([.H118]<>[.H119];"INICIO";IF([.H120]<>[.H119];"FIN";"")) ->  | J119: of:=IF([.K118]<>[.K119];"INICIO";IF([.K120]<>[.K119];"FIN";"")) -> 
A120: of:=IF([.B120]<>"";TODAY()>[.B120];"") -> 0 | B120: of:=IFERROR(IF(AND(ISNUMBER([.B119]);([.B119]+1)<[Calendario.$F$5]);[.B119]+1;"");"") -> 2016-01-03 | C120: of:=IF(AND([.B120]>=[Calendario.$F$8];[.B120]<=[Calendario.$F$9];1);1;IF(AND([.B120]>=[Calendario.$F$12];[.B120]<=[Calendario.$F$13]);2;IF(AND([.B120]>=[Calendario.$F$16];[.B120]<=[Calendario.$F$17]);3;""))) -> 2 | D120: of:=IF(COUNTIF([Calendario.$H$4:.$H$48];[.B120])>0;"FIESTA";"") -> FIESTA | E120: of:=IF([.B120]<>"";VLOOKUP(WEEKDAY([.B120];3);[Calendario.$A$4:.$C$11];2);"") -> Domingo | F120: of:=IF([.B120]<>"";IF([.D120]<>"FIESTA";VLOOKUP(WEEKDAY([.B120];3);[Calendario.$A$4:.$C$11];3);0);"") -> 0 | G120: of:=IF(ISNUMBER([.F120]);[.F120]+[.G119];"") -> 45 | H120: of:=IF(AND([.G120]<=[Unidades.$G$26];[.G120]<=[Unidades.$F$18];[Unidades.$F$18]>0);[Unidades.$D$18]+1-COUNTIFS([Unidades.$O$3:.$O$17];">="&[.G120]);"") -> 3 | I120: of:=IF([.H119]<>[.H120];"INICIO";IF([.H121]<>[.H120];"FIN";"")) ->  | J120: of:=IF([.K119]<>[.K120];"INICIO";IF([.K121]<>[.K120];"FIN";"")) -> 
A121: of:=IF([.B121]<>"";TODAY()>[.B121];"") -> 0 | B121: of:=IFERROR(IF(AND(ISNUMBER([.B120]);([.B120]+1)<[Calendario.$F$5]);[.B120]+1;"");"") -> 2016-01-04 | C121: of:=IF(AND([.B121]>=[Calendario.$F$8];[.B121]<=[Calendario.$F$9];1);1;IF(AND([.B121]>=[Calendario.$F$12];[.B121]<=[Calendario.$F$13]);2;IF(AND([.B121]>=[Calendario.$F$16];[.B121]<=[Calendario.$F$17]);3;""))) -> 2 | D121: of:=IF(COUNTIF([Calendario.$H$4:.$H$48];[.B121])>0;"FIESTA";"") -> FIESTA | E121: of:=IF([.B121]<>"";VLOOKUP(WEEKDAY([.B121];3);[Calendario.$A$4:.$C$11];2);"") -> Lunes | F121: of:=IF([.B121]<>"";IF([.D121]<>"FIESTA";VLOOKUP(WEEKDAY([.B121];3);[Calendario.$A$4:.$C$11];3);0);"") -> 0 | G121: of:=IF(ISNUMBER([.F121]);[.F121]+[.G120];"") -> 45 | H121: of:=IF(AND([.G121]<=[Unidades.$G$26];[.G121]<=[Unidades.$F$18];[Unidades.$F$18]>0);[Unidades.$D$18]+1-COUNTIFS([Unidades.$O$3:.$O$17];">="&[.G121]);"") -> 3 | I121: of:=IF([.H120]<>[.H121];"INICIO";IF([.H122]<>[.H121];"FIN";"")) ->  | J121: of:=IF([.K120]<>[.K121];"INICIO";IF([.K122]<>[.K121];"FIN";"")) -> 
A122: of:=IF([.B122]<>"";TODAY()>[.B122];"") -> 0 | B122: of:=IFERROR(IF(AND(ISNUMBER([.B121]);([.B121]+1)<[Calendario.$F$5]);[.B121]+1;"");"") -> 2016-01-05 | C122: of:=IF(AND([.B122]>=[Calendario.$F$8];[.B122]<=[Calendario.$F$9];1);1;IF(AND([.B122]>=[Calendario.$F$12];[.B122]<=[Calendario.$F$13]);2;IF(AND([.B122]>=[Calendario.$F$16];[.B122]<=[Calendario.$F$17]);3;""))) -> 2 | D122: of:=IF(COUNTIF([Calendario.$H$4:.$H$48];[.B122])>0;"FIESTA";"") -> FIESTA | E122: of:=IF([.B122]<>"";VLOOKUP(WEEKDAY([.B122];3);[Calendario.$A$4:.$C$11];2);"") -> Martes | F122: of:=IF([.B122]<>"";IF([.D122]<>"FIESTA";VLOOKUP(WEEKDAY([.B122];3);[Calendario.$A$4:.$C$11];3);0);"") -> 0 | G122: of:=IF(ISNUMBER([.F122]);[.F122]+[.G121];"") -> 45 | H122: of:=IF(AND([.G122]<=[Unidades.$G$26];[.G122]<=[Unidades.$F$18];[Unidades.$F$18]>0);[Unidades.$D$18]+1-COUNTIFS([Unidades.$O$3:.$O$17];">="&[.G122]);"") -> 3 | I122: of:=IF([.H121]<>[.H122];"INICIO";IF([.H123]<>[.H122];"FIN";"")) ->  | J122: of:=IF([.K121]<>[.K122];"INICIO";IF([.K123]<>[.K122];"FIN";"")) -> 
A123: of:=IF([.B123]<>"";TODAY()>[.B123];"") -> 0 | B123: of:=IFERROR(IF(AND(ISNUMBER([.B122]);([.B122]+1)<[Calendario.$F$5]);[.B122]+1;"");"") -> 2016-01-06 | C123: of:=IF(AND([.B123]>=[Calendario.$F$8];[.B123]<=[Calendario.$F$9];1);1;IF(AND([.B123]>=[Calendario.$F$12];[.B123]<=[Calendario.$F$13]);2;IF(AND([.B123]>=[Calendario.$F$16];[.B123]<=[Calendario.$F$17]);3;""))) -> 2 | D123: of:=IF(COUNTIF([Calendario.$H$4:.$H$48];[.B123])>0;"FIESTA";"") -> FIESTA | E123: of:=IF([.B123]<>"";VLOOKUP(WEEKDAY([.B123];3);[Calendario.$A$4:.$C$11];2);"") -> Miercoles | F123: of:=IF([.B123]<>"";IF([.D123]<>"FIESTA";VLOOKUP(WEEKDAY([.B123];3);[Calendario.$A$4:.$C$11];3);0);"") -> 0 | G123: of:=IF(ISNUMBER([.F123]);[.F123]+[.G122];"") -> 45 | H123: of:=IF(AND([.G123]<=[Unidades.$G$26];[.G123]<=[Unidades.$F$18];[Unidades.$F$18]>0);[Unidades.$D$18]+1-COUNTIFS([Unidades.$O$3:.$O$17];">="&[.G123]);"") -> 3 | I123: of:=IF([.H122]<>[.H123];"INICIO";IF([.H124]<>[.H123];"FIN";"")) ->  | J123: of:=IF([.K122]<>[.K123];"INICIO";IF([.K124]<>[.K123];"FIN";"")) -> 
A124: of:=IF([.B124]<>"";TODAY()>[.B124];"") -> 0 | B124: of:=IFERROR(IF(AND(ISNUMBER([.B123]);([.B123]+1)<[Calendario.$F$5]);[.B123]+1;"");"") -> 2016-01-07 | C124: of:=IF(AND([.B124]>=[Calendario.$F$8];[.B124]<=[Calendario.$F$9];1);1;IF(AND([.B124]>=[Calendario.$F$12];[.B124]<=[Calendario.$F$13]);2;IF(AND([.B124]>=[Calendario.$F$16];[.B124]<=[Calendario.$F$17]);3;""))) -> 2 | D124: of:=IF(COUNTIF([Calendario.$H$4:.$H$48];[.B124])>0;"FIESTA";"") ->  | E124: of:=IF([.B124]<>"";VLOOKUP(WEEKDAY([.B124];3);[Calendario.$A$4:.$C$11];2);"") -> Jueves | F124: of:=IF([.B124]<>"";IF([.D124]<>"FIESTA";VLOOKUP(WEEKDAY([.B124];3);[Calendario.$A$4:.$C$11];3);0);"") -> 0 | G124: of:=IF(ISNUMBER([.F124]);[.F124]+[.G123];"") -> 45 | H124: of:=IF(AND([.G124]<=[Unidades.$G$26];[.G124]<=[Unidades.$F$18];[Unidades.$F$18]>0);[Unidades.$D$18]+1-COUNTIFS([Unidades.$O$3:.$O$17];">="&[.G124]);"") -> 3 | I124: of:=IF([.H123]<>[.H124];"INICIO";IF([.H125]<>[.H124];"FIN";"")) ->  | J124: of:=IF([.K123]<>[.K124];"INICIO";IF([.K125]<>[.K124];"FIN";"")) -> 
A125: of:=IF([.B125]<>"";TODAY()>[.B125];"") -> 0 | B125: of:=IFERROR(IF(AND(ISNUMBER([.B124]);([.B124]+1)<[Calendario.$F$5]);[.B124]+1;"");"") -> 2016-01-08 | C125: of:=IF(AND([.B125]>=[Calendario.$F$8];[.B125]<=[Calendario.$F$9];1);1;IF(AND([.B125]>=[Calendario.$F$12];[.B125]<=[Calendario.$F$13]);2;IF(AND([.B125]>=[Calendario.$F$16];[.B125]<=[Calendario.$F$17]);3;""))) -> 2 | D125: of:=IF(COUNTIF([Calendario.$H$4:.$H$48];[.B125])>0;"FIESTA";"") ->  | E125: of:=IF([.B125]<>"";VLOOKUP(WEEKDAY([.B125];3);[Calendario.$A$4:.$C$11];2);"") -> Viernes | F125: of:=IF([.B125]<>"";IF([.D125]<>"FIESTA";VLOOKUP(WEEKDAY([.B125];3);[Calendario.$A$4:.$C$11];3);0);"") -> 1 | G125: of:=IF(ISNUMBER([.F125]);[.F125]+[.G124];"") -> 46 | H125: of:=IF(AND([.G125]<=[Unidades.$G$26];[.G125]<=[Unidades.$F$18];[Unidades.$F$18]>0);[Unidades.$D$18]+1-COUNTIFS([Unidades.$O$3:.$O$17];">="&[.G125]);"") -> 3 | I125: of:=IF([.H124]<>[.H125];"INICIO";IF([.H126]<>[.H125];"FIN";"")) ->  | J125: of:=IF([.K124]<>[.K125];"INICIO";IF([.K126]<>[.K125];"FIN";"")) -> 
A126: of:=IF([.B126]<>"";TODAY()>[.B126];"") -> 0 | B126: of:=IFERROR(IF(AND(ISNUMBER([.B125]);([.B125]+1)<[Calendario.$F$5]);[.B125]+1;"");"") -> 2016-01-09 | C126: of:=IF(AND([.B126]>=[Calendario.$F$8];[.B126]<=[Calendario.$F$9];1);1;IF(AND([.B126]>=[Calendario.$F$12];[.B126]<=[Calendario.$F$13]);2;IF(AND([.B126]>=[Calendario.$F$16];[.B126]<=[Calendario.$F$17]);3;""))) -> 2 | D126: of:=IF(COUNTIF([Calendario.$H$4:.$H$48];[.B126])>0;"FIESTA";"") ->  | E126: of:=IF([.B126]<>"";VLOOKUP(WEEKDAY([.B126];3);[Calendario.$A$4:.$C$11];2);"") -> Sabado | F126: of:=IF([.B126]<>"";IF([.D126]<>"FIESTA";VLOOKUP(WEEKDAY([.B126];3);[Calendario.$A$4:.$C$11];3);0);"") -> 0 | G126: of:=IF(ISNUMBER([.F126]);[.F126]+[.G125];"") -> 46 | H126: of:=IF(AND([.G126]<=[Unidades.$G$26];[.G126]<=[Unidades.$F$18];[Unidades.$F$18]>0);[Unidades.$D$18]+1-COUNTIFS([Unidades.$O$3:.$O$17];">="&[.G126]);"") -> 3 | I126: of:=IF([.H125]<>[.H126];"INICIO";IF([.H127]<>[.H126];"FIN";"")) ->  | J126: of:=IF([.K125]<>[.K126];"INICIO";IF([.K127]<>[.K126];"FIN";"")) -> 
A127: of:=IF([.B127]<>"";TODAY()>[.B127];"") -> 0 | B127: of:=IFERROR(IF(AND(ISNUMBER([.B126]);([.B126]+1)<[Calendario.$F$5]);[.B126]+1;"");"") -> 2016-01-10 | C127: of:=IF(AND([.B127]>=[Calendario.$F$8];[.B127]<=[Calendario.$F$9];1);1;IF(AND([.B127]>=[Calendario.$F$12];[.B127]<=[Calendario.$F$13]);2;IF(AND([.B127]>=[Calendario.$F$16];[.B127]<=[Calendario.$F$17]);3;""))) -> 2 | D127: of:=IF(COUNTIF([Calendario.$H$4:.$H$48];[.B127])>0;"FIESTA";"") ->  | E127: of:=IF([.B127]<>"";VLOOKUP(WEEKDAY([.B127];3);[Calendario.$A$4:.$C$11];2);"") -> Domingo | F127: of:=IF([.B127]<>"";IF([.D127]<>"FIESTA";VLOOKUP(WEEKDAY([.B127];3);[Calendario.$A$4:.$C$11];3);0);"") -> 0 | G127: of:=IF(ISNUMBER([.F127]);[.F127]+[.G126];"") -> 46 | H127: of:=IF(AND([.G127]<=[Unidades.$G$26];[.G127]<=[Unidades.$F$18];[Unidades.$F$18]>0);[Unidades.$D$18]+1-COUNTIFS([Unidades.$O$3:.$O$17];">="&[.G127]);"") -> 3 | I127: of:=IF([.H126]<>[.H127];"INICIO";IF([.H128]<>[.H127];"FIN";"")) ->  | J127: of:=IF([.K126]<>[.K127];"INICIO";IF([.K128]<>[.K127];"FIN";"")) -> 
A128: of:=IF([.B128]<>"";TODAY()>[.B128];"") -> 0 | B128: of:=IFERROR(IF(AND(ISNUMBER([.B127]);([.B127]+1)<[Calendario.$F$5]);[.B127]+1;"");"") -> 2016-01-11 | C128: of:=IF(AND([.B128]>=[Calendario.$F$8];[.B128]<=[Calendario.$F$9];1);1;IF(AND([.B128]>=[Calendario.$F$12];[.B128]<=[Calendario.$F$13]);2;IF(AND([.B128]>=[Calendario.$F$16];[.B128]<=[Calendario.$F$17]);3;""))) -> 2 | D128: of:=IF(COUNTIF([Calendario.$H$4:.$H$48];[.B128])>0;"FIESTA";"") ->  | E128: of:=IF([.B128]<>"";VLOOKUP(WEEKDAY([.B128];3);[Calendario.$A$4:.$C$11];2);"") -> Lunes | F128: of:=IF([.B128]<>"";IF([.D128]<>"FIESTA";VLOOKUP(WEEKDAY([.B128];3);[Calendario.$A$4:.$C$11];3);0);"") -> 1 | G128: of:=IF(ISNUMBER([.F128]);[.F128]+[.G127];"") -> 47 | H128: of:=IF(AND([.G128]<=[Unidades.$G$26];[.G128]<=[Unidades.$F$18];[Unidades.$F$18]>0);[Unidades.$D$18]+1-COUNTIFS([Unidades.$O$3:.$O$17];">="&[.G128]);"") -> 3 | I128: of:=IF([.H127]<>[.H128];"INICIO";IF([.H129]<>[.H128];"FIN";"")) ->  | J128: of:=IF([.K127]<>[.K128];"INICIO";IF([.K129]<>[.K128];"FIN";"")) -> 
A129: of:=IF([.B129]<>"";TODAY()>[.B129];"") -> 0 | B129: of:=IFERROR(IF(AND(ISNUMBER([.B128]);([.B128]+1)<[Calendario.$F$5]);[.B128]+1;"");"") -> 2016-01-12 | C129: of:=IF(AND([.B129]>=[Calendario.$F$8];[.B129]<=[Calendario.$F$9];1);1;IF(AND([.B129]>=[Calendario.$F$12];[.B129]<=[Calendario.$F$13]);2;IF(AND([.B129]>=[Calendario.$F$16];[.B129]<=[Calendario.$F$17]);3;""))) -> 2 | D129: of:=IF(COUNTIF([Calendario.$H$4:.$H$48];[.B129])>0;"FIESTA";"") ->  | E129: of:=IF([.B129]<>"";VLOOKUP(WEEKDAY([.B129];3);[Calendario.$A$4:.$C$11];2);"") -> Martes | F129: of:=IF([.B129]<>"";IF([.D129]<>"FIESTA";VLOOKUP(WEEKDAY([.B129];3);[Calendario.$A$4:.$C$11];3);0);"") -> 0 | G129: of:=IF(ISNUMBER([.F129]);[.F129]+[.G128];"") -> 47 | H129: of:=IF(AND([.G129]<=[Unidades.$G$26];[.G129]<=[Unidades.$F$18];[Unidades.$F$18]>0);[Unidades.$D$18]+1-COUNTIFS([Unidades.$O$3:.$O$17];">="&[.G129]);"") -> 3 | I129: of:=IF([.H128]<>[.H129];"INICIO";IF([.H130]<>[.H129];"FIN";"")) ->  | J129: of:=IF([.K128]<>[.K129];"INICIO";IF([.K130]<>[.K129];"FIN";"")) -> 
A130: of:=IF([.B130]<>"";TODAY()>[.B130];"") -> 0 | B130: of:=IFERROR(IF(AND(ISNUMBER([.B129]);([.B129]+1)<[Calendario.$F$5]);[.B129]+1;"");"") -> 2016-01-13 | C130: of:=IF(AND([.B130]>=[Calendario.$F$8];[.B130]<=[Calendario.$F$9];1);1;IF(AND([.B130]>=[Calendario.$F$12];[.B130]<=[Calendario.$F$13]);2;IF(AND([.B130]>=[Calendario.$F$16];[.B130]<=[Calendario.$F$17]);3;""))) -> 2 | D130: of:=IF(COUNTIF([Calendario.$H$4:.$H$48];[.B130])>0;"FIESTA";"") ->  | E130: of:=IF([.B130]<>"";VLOOKUP(WEEKDAY([.B130];3);[Calendario.$A$4:.$C$11];2);"") -> Miercoles | F130: of:=IF([.B130]<>"";IF([.D130]<>"FIESTA";VLOOKUP(WEEKDAY([.B130];3);[Calendario.$A$4:.$C$11];3);0);"") -> 1 | G130: of:=IF(ISNUMBER([.F130]);[.F130]+[.G129];"") -> 48 | H130: of:=IF(AND([.G130]<=[Unidades.$G$26];[.G130]<=[Unidades.$F$18];[Unidades.$F$18]>0);[Unidades.$D$18]+1-COUNTIFS([Unidades.$O$3:.$O$17];">="&[.G130]);"") -> 3 | I130: of:=IF([.H129]<>[.H130];"INICIO";IF([.H131]<>[.H130];"FIN";"")) ->  | J130: of:=IF([.K129]<>[.K130];"INICIO";IF([.K131]<>[.K130];"FIN";"")) -> 
A131: of:=IF([.B131]<>"";TODAY()>[.B131];"") -> 0 | B131: of:=IFERROR(IF(AND(ISNUMBER([.B130]);([.B130]+1)<[Calendario.$F$5]);[.B130]+1;"");"") -> 2016-01-14 | C131: of:=IF(AND([.B131]>=[Calendario.$F$8];[.B131]<=[Calendario.$F$9];1);1;IF(AND([.B131]>=[Calendario.$F$12];[.B131]<=[Calendario.$F$13]);2;IF(AND([.B131]>=[Calendario.$F$16];[.B131]<=[Calendario.$F$17]);3;""))) -> 2 | D131: of:=IF(COUNTIF([Calendario.$H$4:.$H$48];[.B131])>0;"FIESTA";"") ->  | E131: of:=IF([.B131]<>"";VLOOKUP(WEEKDAY([.B131];3);[Calendario.$A$4:.$C$11];2);"") -> Jueves | F131: of:=IF([.B131]<>"";IF([.D131]<>"FIESTA";VLOOKUP(WEEKDAY([.B131];3);[Calendario.$A$4:.$C$11];3);0);"") -> 0 | G131: of:=IF(ISNUMBER([.F131]);[.F131]+[.G130];"") -> 48 | H131: of:=IF(AND([.G131]<=[Unidades.$G$26];[.G131]<=[Unidades.$F$18];[Unidades.$F$18]>0);[Unidades.$D$18]+1-COUNTIFS([Unidades.$O$3:.$O$17];">="&[.G131]);"") -> 3 | I131: of:=IF([.H130]<>[.H131];"INICIO";IF([.H132]<>[.H131];"FIN";"")) ->  | J131: of:=IF([.K130]<>[.K131];"INICIO";IF([.K132]<>[.K131];"FIN";"")) -> 
A132: of:=IF([.B132]<>"";TODAY()>[.B132];"") -> 0 | B132: of:=IFERROR(IF(AND(ISNUMBER([.B131]);([.B131]+1)<[Calendario.$F$5]);[.B131]+1;"");"") -> 2016-01-15 | C132: of:=IF(AND([.B132]>=[Calendario.$F$8];[.B132]<=[Calendario.$F$9];1);1;IF(AND([.B132]>=[Calendario.$F$12];[.B132]<=[Calendario.$F$13]);2;IF(AND([.B132]>=[Calendario.$F$16];[.B132]<=[Calendario.$F$17]);3;""))) -> 2 | D132: of:=IF(COUNTIF([Calendario.$H$4:.$H$48];[.B132])>0;"FIESTA";"") ->  | E132: of:=IF([.B132]<>"";VLOOKUP(WEEKDAY([.B132];3);[Calendario.$A$4:.$C$11];2);"") -> Viernes | F132: of:=IF([.B132]<>"";IF([.D132]<>"FIESTA";VLOOKUP(WEEKDAY([.B132];3);[Calendario.$A$4:.$C$11];3);0);"") -> 1 | G132: of:=IF(ISNUMBER([.F132]);[.F132]+[.G131];"") -> 49 | H132: of:=IF(AND([.G132]<=[Unidades.$G$26];[.G132]<=[Unidades.$F$18];[Unidades.$F$18]>0);[Unidades.$D$18]+1-COUNTIFS([Unidades.$O$3:.$O$17];">="&[.G132]);"") -> 3 | I132: of:=IF([.H131]<>[.H132];"INICIO";IF([.H133]<>[.H132];"FIN";"")) ->  | J132: of:=IF([.K131]<>[.K132];"INICIO";IF([.K133]<>[.K132];"FIN";"")) -> 
A133: of:=IF([.B133]<>"";TODAY()>[.B133];"") -> 0 | B133: of:=IFERROR(IF(AND(ISNUMBER([.B132]);([.B132]+1)<[Calendario.$F$5]);[.B132]+1;"");"") -> 2016-01-16 | C133: of:=IF(AND([.B133]>=[Calendario.$F$8];[.B133]<=[Calendario.$F$9];1);1;IF(AND([.B133]>=[Calendario.$F$12];[.B133]<=[Calendario.$F$13]);2;IF(AND([.B133]>=[Calendario.$F$16];[.B133]<=[Calendario.$F$17]);3;""))) -> 2 | D133: of:=IF(COUNTIF([Calendario.$H$4:.$H$48];[.B133])>0;"FIESTA";"") ->  | E133: of:=IF([.B133]<>"";VLOOKUP(WEEKDAY([.B133];3);[Calendario.$A$4:.$C$11];2);"") -> Sabado | F133: of:=IF([.B133]<>"";IF([.D133]<>"FIESTA";VLOOKUP(WEEKDAY([.B133];3);[Calendario.$A$4:.$C$11];3);0);"") -> 0 | G133: of:=IF(ISNUMBER([.F133]);[.F133]+[.G132];"") -> 49 | H133: of:=IF(AND([.G133]<=[Unidades.$G$26];[.G133]<=[Unidades.$F$18];[Unidades.$F$18]>0);[Unidades.$D$18]+1-COUNTIFS([Unidades.$O$3:.$O$17];">="&[.G133]);"") -> 3 | I133: of:=IF([.H132]<>[.H133];"INICIO";IF([.H134]<>[.H133];"FIN";"")) ->  | J133: of:=IF([.K132]<>[.K133];"INICIO";IF([.K134]<>[.K133];"FIN";"")) -> 
A134: of:=IF([.B134]<>"";TODAY()>[.B134];"") -> 0 | B134: of:=IFERROR(IF(AND(ISNUMBER([.B133]);([.B133]+1)<[Calendario.$F$5]);[.B133]+1;"");"") -> 2016-01-17 | C134: of:=IF(AND([.B134]>=[Calendario.$F$8];[.B134]<=[Calendario.$F$9];1);1;IF(AND([.B134]>=[Calendario.$F$12];[.B134]<=[Calendario.$F$13]);2;IF(AND([.B134]>=[Calendario.$F$16];[.B134]<=[Calendario.$F$17]);3;""))) -> 2 | D134: of:=IF(COUNTIF([Calendario.$H$4:.$H$48];[.B134])>0;"FIESTA";"") ->  | E134: of:=IF([.B134]<>"";VLOOKUP(WEEKDAY([.B134];3);[Calendario.$A$4:.$C$11];2);"") -> Domingo | F134: of:=IF([.B134]<>"";IF([.D134]<>"FIESTA";VLOOKUP(WEEKDAY([.B134];3);[Calendario.$A$4:.$C$11];3);0);"") -> 0 | G134: of:=IF(ISNUMBER([.F134]);[.F134]+[.G133];"") -> 49 | H134: of:=IF(AND([.G134]<=[Unidades.$G$26];[.G134]<=[Unidades.$F$18];[Unidades.$F$18]>0);[Unidades.$D$18]+1-COUNTIFS([Unidades.$O$3:.$O$17];">="&[.G134]);"") -> 3 | I134: of:=IF([.H133]<>[.H134];"INICIO";IF([.H135]<>[.H134];"FIN";"")) ->  | J134: of:=IF([.K133]<>[.K134];"INICIO";IF([.K135]<>[.K134];"FIN";"")) -> 
A135: of:=IF([.B135]<>"";TODAY()>[.B135];"") -> 0 | B135: of:=IFERROR(IF(AND(ISNUMBER([.B134]);([.B134]+1)<[Calendario.$F$5]);[.B134]+1;"");"") -> 2016-01-18 | C135: of:=IF(AND([.B135]>=[Calendario.$F$8];[.B135]<=[Calendario.$F$9];1);1;IF(AND([.B135]>=[Calendario.$F$12];[.B135]<=[Calendario.$F$13]);2;IF(AND([.B135]>=[Calendario.$F$16];[.B135]<=[Calendario.$F$17]);3;""))) -> 2 | D135: of:=IF(COUNTIF([Calendario.$H$4:.$H$48];[.B135])>0;"FIESTA";"") ->  | E135: of:=IF([.B135]<>"";VLOOKUP(WEEKDAY([.B135];3);[Calendario.$A$4:.$C$11];2);"") -> Lunes | F135: of:=IF([.B135]<>"";IF([.D135]<>"FIESTA";VLOOKUP(WEEKDAY([.B135];3);[Calendario.$A$4:.$C$11];3);0);"") -> 1 | G135: of:=IF(ISNUMBER([.F135]);[.F135]+[.G134];"") -> 50 | H135: of:=IF(AND([.G135]<=[Unidades.$G$26];[.G135]<=[Unidades.$F$18];[Unidades.$F$18]>0);[Unidades.$D$18]+1-COUNTIFS([Unidades.$O$3:.$O$17];">="&[.G135]);"") -> 3 | I135: of:=IF([.H134]<>[.H135];"INICIO";IF([.H136]<>[.H135];"FIN";"")) ->  | J135: of:=IF([.K134]<>[.K135];"INICIO";IF([.K136]<>[.K135];"FIN";"")) -> 
A136: of:=IF([.B136]<>"";TODAY()>[.B136];"") -> 0 | B136: of:=IFERROR(IF(AND(ISNUMBER([.B135]);([.B135]+1)<[Calendario.$F$5]);[.B135]+1;"");"") -> 2016-01-19 | C136: of:=IF(AND([.B136]>=[Calendario.$F$8];[.B136]<=[Calendario.$F$9];1);1;IF(AND([.B136]>=[Calendario.$F$12];[.B136]<=[Calendario.$F$13]);2;IF(AND([.B136]>=[Calendario.$F$16];[.B136]<=[Calendario.$F$17]);3;""))) -> 2 | D136: of:=IF(COUNTIF([Calendario.$H$4:.$H$48];[.B136])>0;"FIESTA";"") ->  | E136: of:=IF([.B136]<>"";VLOOKUP(WEEKDAY([.B136];3);[Calendario.$A$4:.$C$11];2);"") -> Martes | F136: of:=IF([.B136]<>"";IF([.D136]<>"FIESTA";VLOOKUP(WEEKDAY([.B136];3);[Calendario.$A$4:.$C$11];3);0);"") -> 0 | G136: of:=IF(ISNUMBER([.F136]);[.F136]+[.G135];"") -> 50 | H136: of:=IF(AND([.G136]<=[Unidades.$G$26];[.G136]<=[Unidades.$F$18];[Unidades.$F$18]>0);[Unidades.$D$18]+1-COUNTIFS([Unidades.$O$3:.$O$17];">="&[.G136]);"") -> 3 | I136: of:=IF([.H135]<>[.H136];"INICIO";IF([.H137]<>[.H136];"FIN";"")) -> FIN | J136: of:=IF([.K135]<>[.K136];"INICIO";IF([.K137]<>[.K136];"FIN";"")) -> 
A137: of:=IF([.B137]<>"";TODAY()>[.B137];"") -> 0 | B137: of:=IFERROR(IF(AND(ISNUMBER([.B136]);([.B136]+1)<[Calendario.$F$5]);[.B136]+1;"");"") -> 2016-01-20 | C137: of:=IF(AND([.B137]>=[Calendario.$F$8];[.B137]<=[Calendario.$F$9];1);1;IF(AND([.B137]>=[Calendario.$F$12];[.B137]<=[Calendario.$F$13]);2;IF(AND([.B137]>=[Calendario.$F$16];[.B137]<=[Calendario.$F$17]);3;""))) -> 2 | D137: of:=IF(COUNTIF([Calendario.$H$4:.$H$48];[.B137])>0;"FIESTA";"") ->  | E137: of:=IF([.B137]<>"";VLOOKUP(WEEKDAY([.B137];3);[Calendario.$A$4:.$C$11];2);"") -> Miercoles | F137: of:=IF([.B137]<>"";IF([.D137]<>"FIESTA";VLOOKUP(WEEKDAY([.B137];3);[Calendario.$A$4:.$C$11];3);0);"") -> 1 | G137: of:=IF(ISNUMBER([.F137]);[.F137]+[.G136];"") -> 51 | H137: of:=IF(AND([.G137]<=[Unidades.$G$26];[.G137]<=[Unidades.$F$18];[Unidades.$F$18]>0);[Unidades.$D$18]+1-COUNTIFS([Unidades.$O$3:.$O$17];">="&[.G137]);"") -> 4 | I137: of:=IF([.H136]<>[.H137];"INICIO";IF([.H138]<>[.H137];"FIN";"")) -> INICIO | J137: of:=IF([.K136]<>[.K137];"INICIO";IF([.K138]<>[.K137];"FIN";"")) -> 
A138: of:=IF([.B138]<>"";TODAY()>[.B138];"") -> 0 | B138: of:=IFERROR(IF(AND(ISNUMBER([.B137]);([.B137]+1)<[Calendario.$F$5]);[.B137]+1;"");"") -> 2016-01-21 | C138: of:=IF(AND([.B138]>=[Calendario.$F$8];[.B138]<=[Calendario.$F$9];1);1;IF(AND([.B138]>=[Calendario.$F$12];[.B138]<=[Calendario.$F$13]);2;IF(AND([.B138]>=[Calendario.$F$16];[.B138]<=[Calendario.$F$17]);3;""))) -> 2 | D138: of:=IF(COUNTIF([Calendario.$H$4:.$H$48];[.B138])>0;"FIESTA";"") ->  | E138: of:=IF([.B138]<>"";VLOOKUP(WEEKDAY([.B138];3);[Calendario.$A$4:.$C$11];2);"") -> Jueves | F138: of:=IF([.B138]<>"";IF([.D138]<>"FIESTA";VLOOKUP(WEEKDAY([.B138];3);[Calendario.$A$4:.$C$11];3);0);"") -> 0 | G138: of:=IF(ISNUMBER([.F138]);[.F138]+[.G137];"") -> 51 | H138: of:=IF(AND([.G138]<=[Unidades.$G$26];[.G138]<=[Unidades.$F$18];[Unidades.$F$18]>0);[Unidades.$D$18]+1-COUNTIFS([Unidades.$O$3:.$O$17];">="&[.G138]);"") -> 4 | I138: of:=IF([.H137]<>[.H138];"INICIO";IF([.H139]<>[.H138];"FIN";"")) ->  | J138: of:=IF([.K137]<>[.K138];"INICIO";IF([.K139]<>[.K138];"FIN";"")) -> 
A139: of:=IF([.B139]<>"";TODAY()>[.B139];"") -> 0 | B139: of:=IFERROR(IF(AND(ISNUMBER([.B138]);([.B138]+1)<[Calendario.$F$5]);[.B138]+1;"");"") -> 2016-01-22 | C139: of:=IF(AND([.B139]>=[Calendario.$F$8];[.B139]<=[Calendario.$F$9];1);1;IF(AND([.B139]>=[Calendario.$F$12];[.B139]<=[Calendario.$F$13]);2;IF(AND([.B139]>=[Calendario.$F$16];[.B139]<=[Calendario.$F$17]);3;""))) -> 2 | D139: of:=IF(COUNTIF([Calendario.$H$4:.$H$48];[.B139])>0;"FIESTA";"") ->  | E139: of:=IF([.B139]<>"";VLOOKUP(WEEKDAY([.B139];3);[Calendario.$A$4:.$C$11];2);"") -> Viernes | F139: of:=IF([.B139]<>"";IF([.D139]<>"FIESTA";VLOOKUP(WEEKDAY([.B139];3);[Calendario.$A$4:.$C$11];3);0);"") -> 1 | G139: of:=IF(ISNUMBER([.F139]);[.F139]+[.G138];"") -> 52 | H139: of:=IF(AND([.G139]<=[Unidades.$G$26];[.G139]<=[Unidades.$F$18];[Unidades.$F$18]>0);[Unidades.$D$18]+1-COUNTIFS([Unidades.$O$3:.$O$17];">="&[.G139]);"") -> 4 | I139: of:=IF([.H138]<>[.H139];"INICIO";IF([.H140]<>[.H139];"FIN";"")) ->  | J139: of:=IF([.K138]<>[.K139];"INICIO";IF([.K140]<>[.K139];"FIN";"")) -> 
A140: of:=IF([.B140]<>"";TODAY()>[.B140];"") -> 0 | B140: of:=IFERROR(IF(AND(ISNUMBER([.B139]);([.B139]+1)<[Calendario.$F$5]);[.B139]+1;"");"") -> 2016-01-23 | C140: of:=IF(AND([.B140]>=[Calendario.$F$8];[.B140]<=[Calendario.$F$9];1);1;IF(AND([.B140]>=[Calendario.$F$12];[.B140]<=[Calendario.$F$13]);2;IF(AND([.B140]>=[Calendario.$F$16];[.B140]<=[Calendario.$F$17]);3;""))) -> 2 | D140: of:=IF(COUNTIF([Calendario.$H$4:.$H$48];[.B140])>0;"FIESTA";"") ->  | E140: of:=IF([.B140]<>"";VLOOKUP(WEEKDAY([.B140];3);[Calendario.$A$4:.$C$11];2);"") -> Sabado | F140: of:=IF([.B140]<>"";IF([.D140]<>"FIESTA";VLOOKUP(WEEKDAY([.B140];3);[Calendario.$A$4:.$C$11];3);0);"") -> 0 | G140: of:=IF(ISNUMBER([.F140]);[.F140]+[.G139];"") -> 52 | H140: of:=IF(AND([.G140]<=[Unidades.$G$26];[.G140]<=[Unidades.$F$18];[Unidades.$F$18]>0);[Unidades.$D$18]+1-COUNTIFS([Unidades.$O$3:.$O$17];">="&[.G140]);"") -> 4 | I140: of:=IF([.H139]<>[.H140];"INICIO";IF([.H141]<>[.H140];"FIN";"")) ->  | J140: of:=IF([.K139]<>[.K140];"INICIO";IF([.K141]<>[.K140];"FIN";"")) -> 
A141: of:=IF([.B141]<>"";TODAY()>[.B141];"") -> 0 | B141: of:=IFERROR(IF(AND(ISNUMBER([.B140]);([.B140]+1)<[Calendario.$F$5]);[.B140]+1;"");"") -> 2016-01-24 | C141: of:=IF(AND([.B141]>=[Calendario.$F$8];[.B141]<=[Calendario.$F$9];1);1;IF(AND([.B141]>=[Calendario.$F$12];[.B141]<=[Calendario.$F$13]);2;IF(AND([.B141]>=[Calendario.$F$16];[.B141]<=[Calendario.$F$17]);3;""))) -> 2 | D141: of:=IF(COUNTIF([Calendario.$H$4:.$H$48];[.B141])>0;"FIESTA";"") ->  | E141: of:=IF([.B141]<>"";VLOOKUP(WEEKDAY([.B141];3);[Calendario.$A$4:.$C$11];2);"") -> Domingo | F141: of:=IF([.B141]<>"";IF([.D141]<>"FIESTA";VLOOKUP(WEEKDAY([.B141];3);[Calendario.$A$4:.$C$11];3);0);"") -> 0 | G141: of:=IF(ISNUMBER([.F141]);[.F141]+[.G140];"") -> 52 | H141: of:=IF(AND([.G141]<=[Unidades.$G$26];[.G141]<=[Unidades.$F$18];[Unidades.$F$18]>0);[Unidades.$D$18]+1-COUNTIFS([Unidades.$O$3:.$O$17];">="&[.G141]);"") -> 4 | I141: of:=IF([.H140]<>[.H141];"INICIO";IF([.H142]<>[.H141];"FIN";"")) ->  | J141: of:=IF([.K140]<>[.K141];"INICIO";IF([.K142]<>[.K141];"FIN";"")) -> 
A142: of:=IF([.B142]<>"";TODAY()>[.B142];"") -> 0 | B142: of:=IFERROR(IF(AND(ISNUMBER([.B141]);([.B141]+1)<[Calendario.$F$5]);[.B141]+1;"");"") -> 2016-01-25 | C142: of:=IF(AND([.B142]>=[Calendario.$F$8];[.B142]<=[Calendario.$F$9];1);1;IF(AND([.B142]>=[Calendario.$F$12];[.B142]<=[Calendario.$F$13]);2;IF(AND([.B142]>=[Calendario.$F$16];[.B142]<=[Calendario.$F$17]);3;""))) -> 2 | D142: of:=IF(COUNTIF([Calendario.$H$4:.$H$48];[.B142])>0;"FIESTA";"") ->  | E142: of:=IF([.B142]<>"";VLOOKUP(WEEKDAY([.B142];3);[Calendario.$A$4:.$C$11];2);"") -> Lunes | F142: of:=IF([.B142]<>"";IF([.D142]<>"FIESTA";VLOOKUP(WEEKDAY([.B142];3);[Calendario.$A$4:.$C$11];3);0);"") -> 1 | G142: of:=IF(ISNUMBER([.F142]);[.F142]+[.G141];"") -> 53 | H142: of:=IF(AND([.G142]<=[Unidades.$G$26];[.G142]<=[Unidades.$F$18];[Unidades.$F$18]>0);[Unidades.$D$18]+1-COUNTIFS([Unidades.$O$3:.$O$17];">="&[.G142]);"") -> 4 | I142: of:=IF([.H141]<>[.H142];"INICIO";IF([.H143]<>[.H142];"FIN";"")) ->  | J142: of:=IF([.K141]<>[.K142];"INICIO";IF([.K143]<>[.K142];"FIN";"")) -> 
A143: of:=IF([.B143]<>"";TODAY()>[.B143];"") -> 0 | B143: of:=IFERROR(IF(AND(ISNUMBER([.B142]);([.B142]+1)<[Calendario.$F$5]);[.B142]+1;"");"") -> 2016-01-26 | C143: of:=IF(AND([.B143]>=[Calendario.$F$8];[.B143]<=[Calendario.$F$9];1);1;IF(AND([.B143]>=[Calendario.$F$12];[.B143]<=[Calendario.$F$13]);2;IF(AND([.B143]>=[Calendario.$F$16];[.B143]<=[Calendario.$F$17]);3;""))) -> 2 | D143: of:=IF(COUNTIF([Calendario.$H$4:.$H$48];[.B143])>0;"FIESTA";"") ->  | E143: of:=IF([.B143]<>"";VLOOKUP(WEEKDAY([.B143];3);[Calendario.$A$4:.$C$11];2);"") -> Martes | F143: of:=IF([.B143]<>"";IF([.D143]<>"FIESTA";VLOOKUP(WEEKDAY([.B143];3);[Calendario.$A$4:.$C$11];3);0);"") -> 0 | G143: of:=IF(ISNUMBER([.F143]);[.F143]+[.G142];"") -> 53 | H143: of:=IF(AND([.G143]<=[Unidades.$G$26];[.G143]<=[Unidades.$F$18];[Unidades.$F$18]>0);[Unidades.$D$18]+1-COUNTIFS([Unidades.$O$3:.$O$17];">="&[.G143]);"") -> 4 | I143: of:=IF([.H142]<>[.H143];"INICIO";IF([.H144]<>[.H143];"FIN";"")) ->  | J143: of:=IF([.K142]<>[.K143];"INICIO";IF([.K144]<>[.K143];"FIN";"")) -> 
A144: of:=IF([.B144]<>"";TODAY()>[.B144];"") -> 0 | B144: of:=IFERROR(IF(AND(ISNUMBER([.B143]);([.B143]+1)<[Calendario.$F$5]);[.B143]+1;"");"") -> 2016-01-27 | C144: of:=IF(AND([.B144]>=[Calendario.$F$8];[.B144]<=[Calendario.$F$9];1);1;IF(AND([.B144]>=[Calendario.$F$12];[.B144]<=[Calendario.$F$13]);2;IF(AND([.B144]>=[Calendario.$F$16];[.B144]<=[Calendario.$F$17]);3;""))) -> 2 | D144: of:=IF(COUNTIF([Calendario.$H$4:.$H$48];[.B144])>0;"FIESTA";"") ->  | E144: of:=IF([.B144]<>"";VLOOKUP(WEEKDAY([.B144];3);[Calendario.$A$4:.$C$11];2);"") -> Miercoles | F144: of:=IF([.B144]<>"";IF([.D144]<>"FIESTA";VLOOKUP(WEEKDAY([.B144];3);[Calendario.$A$4:.$C$11];3);0);"") -> 1 | G144: of:=IF(ISNUMBER([.F144]);[.F144]+[.G143];"") -> 54 | H144: of:=IF(AND([.G144]<=[Unidades.$G$26];[.G144]<=[Unidades.$F$18];[Unidades.$F$18]>0);[Unidades.$D$18]+1-COUNTIFS([Unidades.$O$3:.$O$17];">="&[.G144]);"") -> 4 | I144: of:=IF([.H143]<>[.H144];"INICIO";IF([.H145]<>[.H144];"FIN";"")) ->  | J144: of:=IF([.K143]<>[.K144];"INICIO";IF([.K145]<>[.K144];"FIN";"")) -> 
A145: of:=IF([.B145]<>"";TODAY()>[.B145];"") -> 0 | B145: of:=IFERROR(IF(AND(ISNUMBER([.B144]);([.B144]+1)<[Calendario.$F$5]);[.B144]+1;"");"") -> 2016-01-28 | C145: of:=IF(AND([.B145]>=[Calendario.$F$8];[.B145]<=[Calendario.$F$9];1);1;IF(AND([.B145]>=[Calendario.$F$12];[.B145]<=[Calendario.$F$13]);2;IF(AND([.B145]>=[Calendario.$F$16];[.B145]<=[Calendario.$F$17]);3;""))) -> 2 | D145: of:=IF(COUNTIF([Calendario.$H$4:.$H$48];[.B145])>0;"FIESTA";"") ->  | E145: of:=IF([.B145]<>"";VLOOKUP(WEEKDAY([.B145];3);[Calendario.$A$4:.$C$11];2);"") -> Jueves | F145: of:=IF([.B145]<>"";IF([.D145]<>"FIESTA";VLOOKUP(WEEKDAY([.B145];3);[Calendario.$A$4:.$C$11];3);0);"") -> 0 | G145: of:=IF(ISNUMBER([.F145]);[.F145]+[.G144];"") -> 54 | H145: of:=IF(AND([.G145]<=[Unidades.$G$26];[.G145]<=[Unidades.$F$18];[Unidades.$F$18]>0);[Unidades.$D$18]+1-COUNTIFS([Unidades.$O$3:.$O$17];">="&[.G145]);"") -> 4 | I145: of:=IF([.H144]<>[.H145];"INICIO";IF([.H146]<>[.H145];"FIN";"")) ->  | J145: of:=IF([.K144]<>[.K145];"INICIO";IF([.K146]<>[.K145];"FIN";"")) -> 
A146: of:=IF([.B146]<>"";TODAY()>[.B146];"") -> 0 | B146: of:=IFERROR(IF(AND(ISNUMBER([.B145]);([.B145]+1)<[Calendario.$F$5]);[.B145]+1;"");"") -> 2016-01-29 | C146: of:=IF(AND([.B146]>=[Calendario.$F$8];[.B146]<=[Calendario.$F$9];1);1;IF(AND([.B146]>=[Calendario.$F$12];[.B146]<=[Calendario.$F$13]);2;IF(AND([.B146]>=[Calendario.$F$16];[.B146]<=[Calendario.$F$17]);3;""))) -> 2 | D146: of:=IF(COUNTIF([Calendario.$H$4:.$H$48];[.B146])>0;"FIESTA";"") ->  | E146: of:=IF([.B146]<>"";VLOOKUP(WEEKDAY([.B146];3);[Calendario.$A$4:.$C$11];2);"") -> Viernes | F146: of:=IF([.B146]<>"";IF([.D146]<>"FIESTA";VLOOKUP(WEEKDAY([.B146];3);[Calendario.$A$4:.$C$11];3);0);"") -> 1 | G146: of:=IF(ISNUMBER([.F146]);[.F146]+[.G145];"") -> 55 | H146: of:=IF(AND([.G146]<=[Unidades.$G$26];[.G146]<=[Unidades.$F$18];[Unidades.$F$18]>0);[Unidades.$D$18]+1-COUNTIFS([Unidades.$O$3:.$O$17];">="&[.G146]);"") -> 4 | I146: of:=IF([.H145]<>[.H146];"INICIO";IF([.H147]<>[.H146];"FIN";"")) ->  | J146: of:=IF([.K145]<>[.K146];"INICIO";IF([.K147]<>[.K146];"FIN";"")) -> 
A147: of:=IF([.B147]<>"";TODAY()>[.B147];"") -> 0 | B147: of:=IFERROR(IF(AND(ISNUMBER([.B146]);([.B146]+1)<[Calendario.$F$5]);[.B146]+1;"");"") -> 2016-01-30 | C147: of:=IF(AND([.B147]>=[Calendario.$F$8];[.B147]<=[Calendario.$F$9];1);1;IF(AND([.B147]>=[Calendario.$F$12];[.B147]<=[Calendario.$F$13]);2;IF(AND([.B147]>=[Calendario.$F$16];[.B147]<=[Calendario.$F$17]);3;""))) -> 2 | D147: of:=IF(COUNTIF([Calendario.$H$4:.$H$48];[.B147])>0;"FIESTA";"") ->  | E147: of:=IF([.B147]<>"";VLOOKUP(WEEKDAY([.B147];3);[Calendario.$A$4:.$C$11];2);"") -> Sabado | F147: of:=IF([.B147]<>"";IF([.D147]<>"FIESTA";VLOOKUP(WEEKDAY([.B147];3);[Calendario.$A$4:.$C$11];3);0);"") -> 0 | G147: of:=IF(ISNUMBER([.F147]);[.F147]+[.G146];"") -> 55 | H147: of:=IF(AND([.G147]<=[Unidades.$G$26];[.G147]<=[Unidades.$F$18];[Unidades.$F$18]>0);[Unidades.$D$18]+1-COUNTIFS([Unidades.$O$3:.$O$17];">="&[.G147]);"") -> 4 | I147: of:=IF([.H146]<>[.H147];"INICIO";IF([.H148]<>[.H147];"FIN";"")) ->  | J147: of:=IF([.K146]<>[.K147];"INICIO";IF([.K148]<>[.K147];"FIN";"")) -> 
A148: of:=IF([.B148]<>"";TODAY()>[.B148];"") -> 0 | B148: of:=IFERROR(IF(AND(ISNUMBER([.B147]);([.B147]+1)<[Calendario.$F$5]);[.B147]+1;"");"") -> 2016-01-31 | C148: of:=IF(AND([.B148]>=[Calendario.$F$8];[.B148]<=[Calendario.$F$9];1);1;IF(AND([.B148]>=[Calendario.$F$12];[.B148]<=[Calendario.$F$13]);2;IF(AND([.B148]>=[Calendario.$F$16];[.B148]<=[Calendario.$F$17]);3;""))) -> 2 | D148: of:=IF(COUNTIF([Calendario.$H$4:.$H$48];[.B148])>0;"FIESTA";"") ->  | E148: of:=IF([.B148]<>"";VLOOKUP(WEEKDAY([.B148];3);[Calendario.$A$4:.$C$11];2);"") -> Domingo | F148: of:=IF([.B148]<>"";IF([.D148]<>"FIESTA";VLOOKUP(WEEKDAY([.B148];3);[Calendario.$A$4:.$C$11];3);0);"") -> 0 | G148: of:=IF(ISNUMBER([.F148]);[.F148]+[.G147];"") -> 55 | H148: of:=IF(AND([.G148]<=[Unidades.$G$26];[.G148]<=[Unidades.$F$18];[Unidades.$F$18]>0);[Unidades.$D$18]+1-COUNTIFS([Unidades.$O$3:.$O$17];">="&[.G148]);"") -> 4 | I148: of:=IF([.H147]<>[.H148];"INICIO";IF([.H149]<>[.H148];"FIN";"")) ->  | J148: of:=IF([.K147]<>[.K148];"INICIO";IF([.K149]<>[.K148];"FIN";"")) -> 
A149: of:=IF([.B149]<>"";TODAY()>[.B149];"") -> 0 | B149: of:=IFERROR(IF(AND(ISNUMBER([.B148]);([.B148]+1)<[Calendario.$F$5]);[.B148]+1;"");"") -> 2016-02-01 | C149: of:=IF(AND([.B149]>=[Calendario.$F$8];[.B149]<=[Calendario.$F$9];1);1;IF(AND([.B149]>=[Calendario.$F$12];[.B149]<=[Calendario.$F$13]);2;IF(AND([.B149]>=[Calendario.$F$16];[.B149]<=[Calendario.$F$17]);3;""))) -> 2 | D149: of:=IF(COUNTIF([Calendario.$H$4:.$H$48];[.B149])>0;"FIESTA";"") ->  | E149: of:=IF([.B149]<>"";VLOOKUP(WEEKDAY([.B149];3);[Calendario.$A$4:.$C$11];2);"") -> Lunes | F149: of:=IF([.B149]<>"";IF([.D149]<>"FIESTA";VLOOKUP(WEEKDAY([.B149];3);[Calendario.$A$4:.$C$11];3);0);"") -> 1 | G149: of:=IF(ISNUMBER([.F149]);[.F149]+[.G148];"") -> 56 | H149: of:=IF(AND([.G149]<=[Unidades.$G$26];[.G149]<=[Unidades.$F$18];[Unidades.$F$18]>0);[Unidades.$D$18]+1-COUNTIFS([Unidades.$O$3:.$O$17];">="&[.G149]);"") -> 4 | I149: of:=IF([.H148]<>[.H149];"INICIO";IF([.H150]<>[.H149];"FIN";"")) ->  | J149: of:=IF([.K148]<>[.K149];"INICIO";IF([.K150]<>[.K149];"FIN";"")) -> 
A150: of:=IF([.B150]<>"";TODAY()>[.B150];"") -> 0 | B150: of:=IFERROR(IF(AND(ISNUMBER([.B149]);([.B149]+1)<[Calendario.$F$5]);[.B149]+1;"");"") -> 2016-02-02 | C150: of:=IF(AND([.B150]>=[Calendario.$F$8];[.B150]<=[Calendario.$F$9];1);1;IF(AND([.B150]>=[Calendario.$F$12];[.B150]<=[Calendario.$F$13]);2;IF(AND([.B150]>=[Calendario.$F$16];[.B150]<=[Calendario.$F$17]);3;""))) -> 2 | D150: of:=IF(COUNTIF([Calendario.$H$4:.$H$48];[.B150])>0;"FIESTA";"") ->  | E150: of:=IF([.B150]<>"";VLOOKUP(WEEKDAY([.B150];3);[Calendario.$A$4:.$C$11];2);"") -> Martes | F150: of:=IF([.B150]<>"";IF([.D150]<>"FIESTA";VLOOKUP(WEEKDAY([.B150];3);[Calendario.$A$4:.$C$11];3);0);"") -> 0 | G150: of:=IF(ISNUMBER([.F150]);[.F150]+[.G149];"") -> 56 | H150: of:=IF(AND([.G150]<=[Unidades.$G$26];[.G150]<=[Unidades.$F$18];[Unidades.$F$18]>0);[Unidades.$D$18]+1-COUNTIFS([Unidades.$O$3:.$O$17];">="&[.G150]);"") -> 4 | I150: of:=IF([.H149]<>[.H150];"INICIO";IF([.H151]<>[.H150];"FIN";"")) ->  | J150: of:=IF([.K149]<>[.K150];"INICIO";IF([.K151]<>[.K150];"FIN";"")) -> 
A151: of:=IF([.B151]<>"";TODAY()>[.B151];"") -> 0 | B151: of:=IFERROR(IF(AND(ISNUMBER([.B150]);([.B150]+1)<[Calendario.$F$5]);[.B150]+1;"");"") -> 2016-02-03 | C151: of:=IF(AND([.B151]>=[Calendario.$F$8];[.B151]<=[Calendario.$F$9];1);1;IF(AND([.B151]>=[Calendario.$F$12];[.B151]<=[Calendario.$F$13]);2;IF(AND([.B151]>=[Calendario.$F$16];[.B151]<=[Calendario.$F$17]);3;""))) -> 2 | D151: of:=IF(COUNTIF([Calendario.$H$4:.$H$48];[.B151])>0;"FIESTA";"") ->  | E151: of:=IF([.B151]<>"";VLOOKUP(WEEKDAY([.B151];3);[Calendario.$A$4:.$C$11];2);"") -> Miercoles | F151: of:=IF([.B151]<>"";IF([.D151]<>"FIESTA";VLOOKUP(WEEKDAY([.B151];3);[Calendario.$A$4:.$C$11];3);0);"") -> 1 | G151: of:=IF(ISNUMBER([.F151]);[.F151]+[.G150];"") -> 57 | H151: of:=IF(AND([.G151]<=[Unidades.$G$26];[.G151]<=[Unidades.$F$18];[Unidades.$F$18]>0);[Unidades.$D$18]+1-COUNTIFS([Unidades.$O$3:.$O$17];">="&[.G151]);"") -> 4 | I151: of:=IF([.H150]<>[.H151];"INICIO";IF([.H152]<>[.H151];"FIN";"")) ->  | J151: of:=IF([.K150]<>[.K151];"INICIO";IF([.K152]<>[.K151];"FIN";"")) -> 
A152: of:=IF([.B152]<>"";TODAY()>[.B152];"") -> 0 | B152: of:=IFERROR(IF(AND(ISNUMBER([.B151]);([.B151]+1)<[Calendario.$F$5]);[.B151]+1;"");"") -> 2016-02-04 | C152: of:=IF(AND([.B152]>=[Calendario.$F$8];[.B152]<=[Calendario.$F$9];1);1;IF(AND([.B152]>=[Calendario.$F$12];[.B152]<=[Calendario.$F$13]);2;IF(AND([.B152]>=[Calendario.$F$16];[.B152]<=[Calendario.$F$17]);3;""))) -> 2 | D152: of:=IF(COUNTIF([Calendario.$H$4:.$H$48];[.B152])>0;"FIESTA";"") ->  | E152: of:=IF([.B152]<>"";VLOOKUP(WEEKDAY([.B152];3);[Calendario.$A$4:.$C$11];2);"") -> Jueves | F152: of:=IF([.B152]<>"";IF([.D152]<>"FIESTA";VLOOKUP(WEEKDAY([.B152];3);[Calendario.$A$4:.$C$11];3);0);"") -> 0 | G152: of:=IF(ISNUMBER([.F152]);[.F152]+[.G151];"") -> 57 | H152: of:=IF(AND([.G152]<=[Unidades.$G$26];[.G152]<=[Unidades.$F$18];[Unidades.$F$18]>0);[Unidades.$D$18]+1-COUNTIFS([Unidades.$O$3:.$O$17];">="&[.G152]);"") -> 4 | I152: of:=IF([.H151]<>[.H152];"INICIO";IF([.H153]<>[.H152];"FIN";"")) ->  | J152: of:=IF([.K151]<>[.K152];"INICIO";IF([.K153]<>[.K152];"FIN";"")) -> 
A153: of:=IF([.B153]<>"";TODAY()>[.B153];"") -> 0 | B153: of:=IFERROR(IF(AND(ISNUMBER([.B152]);([.B152]+1)<[Calendario.$F$5]);[.B152]+1;"");"") -> 2016-02-05 | C153: of:=IF(AND([.B153]>=[Calendario.$F$8];[.B153]<=[Calendario.$F$9];1);1;IF(AND([.B153]>=[Calendario.$F$12];[.B153]<=[Calendario.$F$13]);2;IF(AND([.B153]>=[Calendario.$F$16];[.B153]<=[Calendario.$F$17]);3;""))) -> 2 | D153: of:=IF(COUNTIF([Calendario.$H$4:.$H$48];[.B153])>0;"FIESTA";"") ->  | E153: of:=IF([.B153]<>"";VLOOKUP(WEEKDAY([.B153];3);[Calendario.$A$4:.$C$11];2);"") -> Viernes | F153: of:=IF([.B153]<>"";IF([.D153]<>"FIESTA";VLOOKUP(WEEKDAY([.B153];3);[Calendario.$A$4:.$C$11];3);0);"") -> 1 | G153: of:=IF(ISNUMBER([.F153]);[.F153]+[.G152];"") -> 58 | H153: of:=IF(AND([.G153]<=[Unidades.$G$26];[.G153]<=[Unidades.$F$18];[Unidades.$F$18]>0);[Unidades.$D$18]+1-COUNTIFS([Unidades.$O$3:.$O$17];">="&[.G153]);"") -> 4 | I153: of:=IF([.H152]<>[.H153];"INICIO";IF([.H154]<>[.H153];"FIN";"")) ->  | J153: of:=IF([.K152]<>[.K153];"INICIO";IF([.K154]<>[.K153];"FIN";"")) -> 
A154: of:=IF([.B154]<>"";TODAY()>[.B154];"") -> 0 | B154: of:=IFERROR(IF(AND(ISNUMBER([.B153]);([.B153]+1)<[Calendario.$F$5]);[.B153]+1;"");"") -> 2016-02-06 | C154: of:=IF(AND([.B154]>=[Calendario.$F$8];[.B154]<=[Calendario.$F$9];1);1;IF(AND([.B154]>=[Calendario.$F$12];[.B154]<=[Calendario.$F$13]);2;IF(AND([.B154]>=[Calendario.$F$16];[.B154]<=[Calendario.$F$17]);3;""))) -> 2 | D154: of:=IF(COUNTIF([Calendario.$H$4:.$H$48];[.B154])>0;"FIESTA";"") ->  | E154: of:=IF([.B154]<>"";VLOOKUP(WEEKDAY([.B154];3);[Calendario.$A$4:.$C$11];2);"") -> Sabado | F154: of:=IF([.B154]<>"";IF([.D154]<>"FIESTA";VLOOKUP(WEEKDAY([.B154];3);[Calendario.$A$4:.$C$11];3);0);"") -> 0 | G154: of:=IF(ISNUMBER([.F154]);[.F154]+[.G153];"") -> 58 | H154: of:=IF(AND([.G154]<=[Unidades.$G$26];[.G154]<=[Unidades.$F$18];[Unidades.$F$18]>0);[Unidades.$D$18]+1-COUNTIFS([Unidades.$O$3:.$O$17];">="&[.G154]);"") -> 4 | I154: of:=IF([.H153]<>[.H154];"INICIO";IF([.H155]<>[.H154];"FIN";"")) ->  | J154: of:=IF([.K153]<>[.K154];"INICIO";IF([.K155]<>[.K154];"FIN";"")) -> 
A155: of:=IF([.B155]<>"";TODAY()>[.B155];"") -> 0 | B155: of:=IFERROR(IF(AND(ISNUMBER([.B154]);([.B154]+1)<[Calendario.$F$5]);[.B154]+1;"");"") -> 2016-02-07 | C155: of:=IF(AND([.B155]>=[Calendario.$F$8];[.B155]<=[Calendario.$F$9];1);1;IF(AND([.B155]>=[Calendario.$F$12];[.B155]<=[Calendario.$F$13]);2;IF(AND([.B155]>=[Calendario.$F$16];[.B155]<=[Calendario.$F$17]);3;""))) -> 2 | D155: of:=IF(COUNTIF([Calendario.$H$4:.$H$48];[.B155])>0;"FIESTA";"") ->  | E155: of:=IF([.B155]<>"";VLOOKUP(WEEKDAY([.B155];3);[Calendario.$A$4:.$C$11];2);"") -> Domingo | F155: of:=IF([.B155]<>"";IF([.D155]<>"FIESTA";VLOOKUP(WEEKDAY([.B155];3);[Calendario.$A$4:.$C$11];3);0);"") -> 0 | G155: of:=IF(ISNUMBER([.F155]);[.F155]+[.G154];"") -> 58 | H155: of:=IF(AND([.G155]<=[Unidades.$G$26];[.G155]<=[Unidades.$F$18];[Unidades.$F$18]>0);[Unidades.$D$18]+1-COUNTIFS([Unidades.$O$3:.$O$17];">="&[.G155]);"") -> 4 | I155: of:=IF([.H154]<>[.H155];"INICIO";IF([.H156]<>[.H155];"FIN";"")) ->  | J155: of:=IF([.K154]<>[.K155];"INICIO";IF([.K156]<>[.K155];"FIN";"")) -> 
A156: of:=IF([.B156]<>"";TODAY()>[.B156];"") -> 0 | B156: of:=IFERROR(IF(AND(ISNUMBER([.B155]);([.B155]+1)<[Calendario.$F$5]);[.B155]+1;"");"") -> 2016-02-08 | C156: of:=IF(AND([.B156]>=[Calendario.$F$8];[.B156]<=[Calendario.$F$9];1);1;IF(AND([.B156]>=[Calendario.$F$12];[.B156]<=[Calendario.$F$13]);2;IF(AND([.B156]>=[Calendario.$F$16];[.B156]<=[Calendario.$F$17]);3;""))) -> 2 | D156: of:=IF(COUNTIF([Calendario.$H$4:.$H$48];[.B156])>0;"FIESTA";"") ->  | E156: of:=IF([.B156]<>"";VLOOKUP(WEEKDAY([.B156];3);[Calendario.$A$4:.$C$11];2);"") -> Lunes | F156: of:=IF([.B156]<>"";IF([.D156]<>"FIESTA";VLOOKUP(WEEKDAY([.B156];3);[Calendario.$A$4:.$C$11];3);0);"") -> 1 | G156: of:=IF(ISNUMBER([.F156]);[.F156]+[.G155];"") -> 59 | H156: of:=IF(AND([.G156]<=[Unidades.$G$26];[.G156]<=[Unidades.$F$18];[Unidades.$F$18]>0);[Unidades.$D$18]+1-COUNTIFS([Unidades.$O$3:.$O$17];">="&[.G156]);"") -> 4 | I156: of:=IF([.H155]<>[.H156];"INICIO";IF([.H157]<>[.H156];"FIN";"")) ->  | J156: of:=IF([.K155]<>[.K156];"INICIO";IF([.K157]<>[.K156];"FIN";"")) -> 
A157: of:=IF([.B157]<>"";TODAY()>[.B157];"") -> 0 | B157: of:=IFERROR(IF(AND(ISNUMBER([.B156]);([.B156]+1)<[Calendario.$F$5]);[.B156]+1;"");"") -> 2016-02-09 | C157: of:=IF(AND([.B157]>=[Calendario.$F$8];[.B157]<=[Calendario.$F$9];1);1;IF(AND([.B157]>=[Calendario.$F$12];[.B157]<=[Calendario.$F$13]);2;IF(AND([.B157]>=[Calendario.$F$16];[.B157]<=[Calendario.$F$17]);3;""))) -> 2 | D157: of:=IF(COUNTIF([Calendario.$H$4:.$H$48];[.B157])>0;"FIESTA";"") ->  | E157: of:=IF([.B157]<>"";VLOOKUP(WEEKDAY([.B157];3);[Calendario.$A$4:.$C$11];2);"") -> Martes | F157: of:=IF([.B157]<>"";IF([.D157]<>"FIESTA";VLOOKUP(WEEKDAY([.B157];3);[Calendario.$A$4:.$C$11];3);0);"") -> 0 | G157: of:=IF(ISNUMBER([.F157]);[.F157]+[.G156];"") -> 59 | H157: of:=IF(AND([.G157]<=[Unidades.$G$26];[.G157]<=[Unidades.$F$18];[Unidades.$F$18]>0);[Unidades.$D$18]+1-COUNTIFS([Unidades.$O$3:.$O$17];">="&[.G157]);"") -> 4 | I157: of:=IF([.H156]<>[.H157];"INICIO";IF([.H158]<>[.H157];"FIN";"")) ->  | J157: of:=IF([.K156]<>[.K157];"INICIO";IF([.K158]<>[.K157];"FIN";"")) -> 
A158: of:=IF([.B158]<>"";TODAY()>[.B158];"") -> 0 | B158: of:=IFERROR(IF(AND(ISNUMBER([.B157]);([.B157]+1)<[Calendario.$F$5]);[.B157]+1;"");"") -> 2016-02-10 | C158: of:=IF(AND([.B158]>=[Calendario.$F$8];[.B158]<=[Calendario.$F$9];1);1;IF(AND([.B158]>=[Calendario.$F$12];[.B158]<=[Calendario.$F$13]);2;IF(AND([.B158]>=[Calendario.$F$16];[.B158]<=[Calendario.$F$17]);3;""))) -> 2 | D158: of:=IF(COUNTIF([Calendario.$H$4:.$H$48];[.B158])>0;"FIESTA";"") ->  | E158: of:=IF([.B158]<>"";VLOOKUP(WEEKDAY([.B158];3);[Calendario.$A$4:.$C$11];2);"") -> Miercoles | F158: of:=IF([.B158]<>"";IF([.D158]<>"FIESTA";VLOOKUP(WEEKDAY([.B158];3);[Calendario.$A$4:.$C$11];3);0);"") -> 1 | G158: of:=IF(ISNUMBER([.F158]);[.F158]+[.G157];"") -> 60 | H158: of:=IF(AND([.G158]<=[Unidades.$G$26];[.G158]<=[Unidades.$F$18];[Unidades.$F$18]>0);[Unidades.$D$18]+1-COUNTIFS([Unidades.$O$3:.$O$17];">="&[.G158]);"") -> 4 | I158: of:=IF([.H157]<>[.H158];"INICIO";IF([.H159]<>[.H158];"FIN";"")) ->  | J158: of:=IF([.K157]<>[.K158];"INICIO";IF([.K159]<>[.K158];"FIN";"")) -> 
A159: of:=IF([.B159]<>"";TODAY()>[.B159];"") -> 0 | B159: of:=IFERROR(IF(AND(ISNUMBER([.B158]);([.B158]+1)<[Calendario.$F$5]);[.B158]+1;"");"") -> 2016-02-11 | C159: of:=IF(AND([.B159]>=[Calendario.$F$8];[.B159]<=[Calendario.$F$9];1);1;IF(AND([.B159]>=[Calendario.$F$12];[.B159]<=[Calendario.$F$13]);2;IF(AND([.B159]>=[Calendario.$F$16];[.B159]<=[Calendario.$F$17]);3;""))) -> 2 | D159: of:=IF(COUNTIF([Calendario.$H$4:.$H$48];[.B159])>0;"FIESTA";"") ->  | E159: of:=IF([.B159]<>"";VLOOKUP(WEEKDAY([.B159];3);[Calendario.$A$4:.$C$11];2);"") -> Jueves | F159: of:=IF([.B159]<>"";IF([.D159]<>"FIESTA";VLOOKUP(WEEKDAY([.B159];3);[Calendario.$A$4:.$C$11];3);0);"") -> 0 | G159: of:=IF(ISNUMBER([.F159]);[.F159]+[.G158];"") -> 60 | H159: of:=IF(AND([.G159]<=[Unidades.$G$26];[.G159]<=[Unidades.$F$18];[Unidades.$F$18]>0);[Unidades.$D$18]+1-COUNTIFS([Unidades.$O$3:.$O$17];">="&[.G159]);"") -> 4 | I159: of:=IF([.H158]<>[.H159];"INICIO";IF([.H160]<>[.H159];"FIN";"")) ->  | J159: of:=IF([.K158]<>[.K159];"INICIO";IF([.K160]<>[.K159];"FIN";"")) -> 
A160: of:=IF([.B160]<>"";TODAY()>[.B160];"") -> 0 | B160: of:=IFERROR(IF(AND(ISNUMBER([.B159]);([.B159]+1)<[Calendario.$F$5]);[.B159]+1;"");"") -> 2016-02-12 | C160: of:=IF(AND([.B160]>=[Calendario.$F$8];[.B160]<=[Calendario.$F$9];1);1;IF(AND([.B160]>=[Calendario.$F$12];[.B160]<=[Calendario.$F$13]);2;IF(AND([.B160]>=[Calendario.$F$16];[.B160]<=[Calendario.$F$17]);3;""))) -> 2 | D160: of:=IF(COUNTIF([Calendario.$H$4:.$H$48];[.B160])>0;"FIESTA";"") ->  | E160: of:=IF([.B160]<>"";VLOOKUP(WEEKDAY([.B160];3);[Calendario.$A$4:.$C$11];2);"") -> Viernes | F160: of:=IF([.B160]<>"";IF([.D160]<>"FIESTA";VLOOKUP(WEEKDAY([.B160];3);[Calendario.$A$4:.$C$11];3);0);"") -> 1 | G160: of:=IF(ISNUMBER([.F160]);[.F160]+[.G159];"") -> 61 | H160: of:=IF(AND([.G160]<=[Unidades.$G$26];[.G160]<=[Unidades.$F$18];[Unidades.$F$18]>0);[Unidades.$D$18]+1-COUNTIFS([Unidades.$O$3:.$O$17];">="&[.G160]);"") -> 4 | I160: of:=IF([.H159]<>[.H160];"INICIO";IF([.H161]<>[.H160];"FIN";"")) ->  | J160: of:=IF([.K159]<>[.K160];"INICIO";IF([.K161]<>[.K160];"FIN";"")) -> 
A161: of:=IF([.B161]<>"";TODAY()>[.B161];"") -> 0 | B161: of:=IFERROR(IF(AND(ISNUMBER([.B160]);([.B160]+1)<[Calendario.$F$5]);[.B160]+1;"");"") -> 2016-02-13 | C161: of:=IF(AND([.B161]>=[Calendario.$F$8];[.B161]<=[Calendario.$F$9];1);1;IF(AND([.B161]>=[Calendario.$F$12];[.B161]<=[Calendario.$F$13]);2;IF(AND([.B161]>=[Calendario.$F$16];[.B161]<=[Calendario.$F$17]);3;""))) -> 2 | D161: of:=IF(COUNTIF([Calendario.$H$4:.$H$48];[.B161])>0;"FIESTA";"") ->  | E161: of:=IF([.B161]<>"";VLOOKUP(WEEKDAY([.B161];3);[Calendario.$A$4:.$C$11];2);"") -> Sabado | F161: of:=IF([.B161]<>"";IF([.D161]<>"FIESTA";VLOOKUP(WEEKDAY([.B161];3);[Calendario.$A$4:.$C$11];3);0);"") -> 0 | G161: of:=IF(ISNUMBER([.F161]);[.F161]+[.G160];"") -> 61 | H161: of:=IF(AND([.G161]<=[Unidades.$G$26];[.G161]<=[Unidades.$F$18];[Unidades.$F$18]>0);[Unidades.$D$18]+1-COUNTIFS([Unidades.$O$3:.$O$17];">="&[.G161]);"") -> 4 | I161: of:=IF([.H160]<>[.H161];"INICIO";IF([.H162]<>[.H161];"FIN";"")) ->  | J161: of:=IF([.K160]<>[.K161];"INICIO";IF([.K162]<>[.K161];"FIN";"")) -> 
A162: of:=IF([.B162]<>"";TODAY()>[.B162];"") -> 0 | B162: of:=IFERROR(IF(AND(ISNUMBER([.B161]);([.B161]+1)<[Calendario.$F$5]);[.B161]+1;"");"") -> 2016-02-14 | C162: of:=IF(AND([.B162]>=[Calendario.$F$8];[.B162]<=[Calendario.$F$9];1);1;IF(AND([.B162]>=[Calendario.$F$12];[.B162]<=[Calendario.$F$13]);2;IF(AND([.B162]>=[Calendario.$F$16];[.B162]<=[Calendario.$F$17]);3;""))) -> 2 | D162: of:=IF(COUNTIF([Calendario.$H$4:.$H$48];[.B162])>0;"FIESTA";"") ->  | E162: of:=IF([.B162]<>"";VLOOKUP(WEEKDAY([.B162];3);[Calendario.$A$4:.$C$11];2);"") -> Domingo | F162: of:=IF([.B162]<>"";IF([.D162]<>"FIESTA";VLOOKUP(WEEKDAY([.B162];3);[Calendario.$A$4:.$C$11];3);0);"") -> 0 | G162: of:=IF(ISNUMBER([.F162]);[.F162]+[.G161];"") -> 61 | H162: of:=IF(AND([.G162]<=[Unidades.$G$26];[.G162]<=[Unidades.$F$18];[Unidades.$F$18]>0);[Unidades.$D$18]+1-COUNTIFS([Unidades.$O$3:.$O$17];">="&[.G162]);"") -> 4 | I162: of:=IF([.H161]<>[.H162];"INICIO";IF([.H163]<>[.H162];"FIN";"")) ->  | J162: of:=IF([.K161]<>[.K162];"INICIO";IF([.K163]<>[.K162];"FIN";"")) -> 
A163: of:=IF([.B163]<>"";TODAY()>[.B163];"") -> 0 | B163: of:=IFERROR(IF(AND(ISNUMBER([.B162]);([.B162]+1)<[Calendario.$F$5]);[.B162]+1;"");"") -> 2016-02-15 | C163: of:=IF(AND([.B163]>=[Calendario.$F$8];[.B163]<=[Calendario.$F$9];1);1;IF(AND([.B163]>=[Calendario.$F$12];[.B163]<=[Calendario.$F$13]);2;IF(AND([.B163]>=[Calendario.$F$16];[.B163]<=[Calendario.$F$17]);3;""))) -> 2 | D163: of:=IF(COUNTIF([Calendario.$H$4:.$H$48];[.B163])>0;"FIESTA";"") ->  | E163: of:=IF([.B163]<>"";VLOOKUP(WEEKDAY([.B163];3);[Calendario.$A$4:.$C$11];2);"") -> Lunes | F163: of:=IF([.B163]<>"";IF([.D163]<>"FIESTA";VLOOKUP(WEEKDAY([.B163];3);[Calendario.$A$4:.$C$11];3);0);"") -> 1 | G163: of:=IF(ISNUMBER([.F163]);[.F163]+[.G162];"") -> 62 | H163: of:=IF(AND([.G163]<=[Unidades.$G$26];[.G163]<=[Unidades.$F$18];[Unidades.$F$18]>0);[Unidades.$D$18]+1-COUNTIFS([Unidades.$O$3:.$O$17];">="&[.G163]);"") -> 4 | I163: of:=IF([.H162]<>[.H163];"INICIO";IF([.H164]<>[.H163];"FIN";"")) ->  | J163: of:=IF([.K162]<>[.K163];"INICIO";IF([.K164]<>[.K163];"FIN";"")) -> 
A164: of:=IF([.B164]<>"";TODAY()>[.B164];"") -> 0 | B164: of:=IFERROR(IF(AND(ISNUMBER([.B163]);([.B163]+1)<[Calendario.$F$5]);[.B163]+1;"");"") -> 2016-02-16 | C164: of:=IF(AND([.B164]>=[Calendario.$F$8];[.B164]<=[Calendario.$F$9];1);1;IF(AND([.B164]>=[Calendario.$F$12];[.B164]<=[Calendario.$F$13]);2;IF(AND([.B164]>=[Calendario.$F$16];[.B164]<=[Calendario.$F$17]);3;""))) -> 2 | D164: of:=IF(COUNTIF([Calendario.$H$4:.$H$48];[.B164])>0;"FIESTA";"") ->  | E164: of:=IF([.B164]<>"";VLOOKUP(WEEKDAY([.B164];3);[Calendario.$A$4:.$C$11];2);"") -> Martes | F164: of:=IF([.B164]<>"";IF([.D164]<>"FIESTA";VLOOKUP(WEEKDAY([.B164];3);[Calendario.$A$4:.$C$11];3);0);"") -> 0 | G164: of:=IF(ISNUMBER([.F164]);[.F164]+[.G163];"") -> 62 | H164: of:=IF(AND([.G164]<=[Unidades.$G$26];[.G164]<=[Unidades.$F$18];[Unidades.$F$18]>0);[Unidades.$D$18]+1-COUNTIFS([Unidades.$O$3:.$O$17];">="&[.G164]);"") -> 4 | I164: of:=IF([.H163]<>[.H164];"INICIO";IF([.H165]<>[.H164];"FIN";"")) ->  | J164: of:=IF([.K163]<>[.K164];"INICIO";IF([.K165]<>[.K164];"FIN";"")) -> 
A165: of:=IF([.B165]<>"";TODAY()>[.B165];"") -> 0 | B165: of:=IFERROR(IF(AND(ISNUMBER([.B164]);([.B164]+1)<[Calendario.$F$5]);[.B164]+1;"");"") -> 2016-02-17 | C165: of:=IF(AND([.B165]>=[Calendario.$F$8];[.B165]<=[Calendario.$F$9];1);1;IF(AND([.B165]>=[Calendario.$F$12];[.B165]<=[Calendario.$F$13]);2;IF(AND([.B165]>=[Calendario.$F$16];[.B165]<=[Calendario.$F$17]);3;""))) -> 2 | D165: of:=IF(COUNTIF([Calendario.$H$4:.$H$48];[.B165])>0;"FIESTA";"") ->  | E165: of:=IF([.B165]<>"";VLOOKUP(WEEKDAY([.B165];3);[Calendario.$A$4:.$C$11];2);"") -> Miercoles | F165: of:=IF([.B165]<>"";IF([.D165]<>"FIESTA";VLOOKUP(WEEKDAY([.B165];3);[Calendario.$A$4:.$C$11];3);0);"") -> 1 | G165: of:=IF(ISNUMBER([.F165]);[.F165]+[.G164];"") -> 63 | H165: of:=IF(AND([.G165]<=[Unidades.$G$26];[.G165]<=[Unidades.$F$18];[Unidades.$F$18]>0);[Unidades.$D$18]+1-COUNTIFS([Unidades.$O$3:.$O$17];">="&[.G165]);"") -> 4 | I165: of:=IF([.H164]<>[.H165];"INICIO";IF([.H166]<>[.H165];"FIN";"")) ->  | J165: of:=IF([.K164]<>[.K165];"INICIO";IF([.K166]<>[.K165];"FIN";"")) -> 
A166: of:=IF([.B166]<>"";TODAY()>[.B166];"") -> 0 | B166: of:=IFERROR(IF(AND(ISNUMBER([.B165]);([.B165]+1)<[Calendario.$F$5]);[.B165]+1;"");"") -> 2016-02-18 | C166: of:=IF(AND([.B166]>=[Calendario.$F$8];[.B166]<=[Calendario.$F$9];1);1;IF(AND([.B166]>=[Calendario.$F$12];[.B166]<=[Calendario.$F$13]);2;IF(AND([.B166]>=[Calendario.$F$16];[.B166]<=[Calendario.$F$17]);3;""))) -> 2 | D166: of:=IF(COUNTIF([Calendario.$H$4:.$H$48];[.B166])>0;"FIESTA";"") ->  | E166: of:=IF([.B166]<>"";VLOOKUP(WEEKDAY([.B166];3);[Calendario.$A$4:.$C$11];2);"") -> Jueves | F166: of:=IF([.B166]<>"";IF([.D166]<>"FIESTA";VLOOKUP(WEEKDAY([.B166];3);[Calendario.$A$4:.$C$11];3);0);"") -> 0 | G166: of:=IF(ISNUMBER([.F166]);[.F166]+[.G165];"") -> 63 | H166: of:=IF(AND([.G166]<=[Unidades.$G$26];[.G166]<=[Unidades.$F$18];[Unidades.$F$18]>0);[Unidades.$D$18]+1-COUNTIFS([Unidades.$O$3:.$O$17];">="&[.G166]);"") -> 4 | I166: of:=IF([.H165]<>[.H166];"INICIO";IF([.H167]<>[.H166];"FIN";"")) ->  | J166: of:=IF([.K165]<>[.K166];"INICIO";IF([.K167]<>[.K166];"FIN";"")) -> 
A167: of:=IF([.B167]<>"";TODAY()>[.B167];"") -> 0 | B167: of:=IFERROR(IF(AND(ISNUMBER([.B166]);([.B166]+1)<[Calendario.$F$5]);[.B166]+1;"");"") -> 2016-02-19 | C167: of:=IF(AND([.B167]>=[Calendario.$F$8];[.B167]<=[Calendario.$F$9];1);1;IF(AND([.B167]>=[Calendario.$F$12];[.B167]<=[Calendario.$F$13]);2;IF(AND([.B167]>=[Calendario.$F$16];[.B167]<=[Calendario.$F$17]);3;""))) -> 2 | D167: of:=IF(COUNTIF([Calendario.$H$4:.$H$48];[.B167])>0;"FIESTA";"") ->  | E167: of:=IF([.B167]<>"";VLOOKUP(WEEKDAY([.B167];3);[Calendario.$A$4:.$C$11];2);"") -> Viernes | F167: of:=IF([.B167]<>"";IF([.D167]<>"FIESTA";VLOOKUP(WEEKDAY([.B167];3);[Calendario.$A$4:.$C$11];3);0);"") -> 1 | G167: of:=IF(ISNUMBER([.F167]);[.F167]+[.G166];"") -> 64 | H167: of:=IF(AND([.G167]<=[Unidades.$G$26];[.G167]<=[Unidades.$F$18];[Unidades.$F$18]>0);[Unidades.$D$18]+1-COUNTIFS([Unidades.$O$3:.$O$17];">="&[.G167]);"") -> 4 | I167: of:=IF([.H166]<>[.H167];"INICIO";IF([.H168]<>[.H167];"FIN";"")) ->  | J167: of:=IF([.K166]<>[.K167];"INICIO";IF([.K168]<>[.K167];"FIN";"")) -> 
A168: of:=IF([.B168]<>"";TODAY()>[.B168];"") -> 0 | B168: of:=IFERROR(IF(AND(ISNUMBER([.B167]);([.B167]+1)<[Calendario.$F$5]);[.B167]+1;"");"") -> 2016-02-20 | C168: of:=IF(AND([.B168]>=[Calendario.$F$8];[.B168]<=[Calendario.$F$9];1);1;IF(AND([.B168]>=[Calendario.$F$12];[.B168]<=[Calendario.$F$13]);2;IF(AND([.B168]>=[Calendario.$F$16];[.B168]<=[Calendario.$F$17]);3;""))) -> 2 | D168: of:=IF(COUNTIF([Calendario.$H$4:.$H$48];[.B168])>0;"FIESTA";"") ->  | E168: of:=IF([.B168]<>"";VLOOKUP(WEEKDAY([.B168];3);[Calendario.$A$4:.$C$11];2);"") -> Sabado | F168: of:=IF([.B168]<>"";IF([.D168]<>"FIESTA";VLOOKUP(WEEKDAY([.B168];3);[Calendario.$A$4:.$C$11];3);0);"") -> 0 | G168: of:=IF(ISNUMBER([.F168]);[.F168]+[.G167];"") -> 64 | H168: of:=IF(AND([.G168]<=[Unidades.$G$26];[.G168]<=[Unidades.$F$18];[Unidades.$F$18]>0);[Unidades.$D$18]+1-COUNTIFS([Unidades.$O$3:.$O$17];">="&[.G168]);"") -> 4 | I168: of:=IF([.H167]<>[.H168];"INICIO";IF([.H169]<>[.H168];"FIN";"")) ->  | J168: of:=IF([.K167]<>[.K168];"INICIO";IF([.K169]<>[.K168];"FIN";"")) -> 
A169: of:=IF([.B169]<>"";TODAY()>[.B169];"") -> 0 | B169: of:=IFERROR(IF(AND(ISNUMBER([.B168]);([.B168]+1)<[Calendario.$F$5]);[.B168]+1;"");"") -> 2016-02-21 | C169: of:=IF(AND([.B169]>=[Calendario.$F$8];[.B169]<=[Calendario.$F$9];1);1;IF(AND([.B169]>=[Calendario.$F$12];[.B169]<=[Calendario.$F$13]);2;IF(AND([.B169]>=[Calendario.$F$16];[.B169]<=[Calendario.$F$17]);3;""))) -> 2 | D169: of:=IF(COUNTIF([Calendario.$H$4:.$H$48];[.B169])>0;"FIESTA";"") ->  | E169: of:=IF([.B169]<>"";VLOOKUP(WEEKDAY([.B169];3);[Calendario.$A$4:.$C$11];2);"") -> Domingo | F169: of:=IF([.B169]<>"";IF([.D169]<>"FIESTA";VLOOKUP(WEEKDAY([.B169];3);[Calendario.$A$4:.$C$11];3);0);"") -> 0 | G169: of:=IF(ISNUMBER([.F169]);[.F169]+[.G168];"") -> 64 | H169: of:=IF(AND([.G169]<=[Unidades.$G$26];[.G169]<=[Unidades.$F$18];[Unidades.$F$18]>0);[Unidades.$D$18]+1-COUNTIFS([Unidades.$O$3:.$O$17];">="&[.G169]);"") -> 4 | I169: of:=IF([.H168]<>[.H169];"INICIO";IF([.H170]<>[.H169];"FIN";"")) ->  | J169: of:=IF([.K168]<>[.K169];"INICIO";IF([.K170]<>[.K169];"FIN";"")) -> 
A170: of:=IF([.B170]<>"";TODAY()>[.B170];"") -> 0 | B170: of:=IFERROR(IF(AND(ISNUMBER([.B169]);([.B169]+1)<[Calendario.$F$5]);[.B169]+1;"");"") -> 2016-02-22 | C170: of:=IF(AND([.B170]>=[Calendario.$F$8];[.B170]<=[Calendario.$F$9];1);1;IF(AND([.B170]>=[Calendario.$F$12];[.B170]<=[Calendario.$F$13]);2;IF(AND([.B170]>=[Calendario.$F$16];[.B170]<=[Calendario.$F$17]);3;""))) -> 2 | D170: of:=IF(COUNTIF([Calendario.$H$4:.$H$48];[.B170])>0;"FIESTA";"") ->  | E170: of:=IF([.B170]<>"";VLOOKUP(WEEKDAY([.B170];3);[Calendario.$A$4:.$C$11];2);"") -> Lunes | F170: of:=IF([.B170]<>"";IF([.D170]<>"FIESTA";VLOOKUP(WEEKDAY([.B170];3);[Calendario.$A$4:.$C$11];3);0);"") -> 1 | G170: of:=IF(ISNUMBER([.F170]);[.F170]+[.G169];"") -> 65 | H170: of:=IF(AND([.G170]<=[Unidades.$G$26];[.G170]<=[Unidades.$F$18];[Unidades.$F$18]>0);[Unidades.$D$18]+1-COUNTIFS([Unidades.$O$3:.$O$17];">="&[.G170]);"") -> 4 | I170: of:=IF([.H169]<>[.H170];"INICIO";IF([.H171]<>[.H170];"FIN";"")) ->  | J170: of:=IF([.K169]<>[.K170];"INICIO";IF([.K171]<>[.K170];"FIN";"")) -> 
A171: of:=IF([.B171]<>"";TODAY()>[.B171];"") -> 0 | B171: of:=IFERROR(IF(AND(ISNUMBER([.B170]);([.B170]+1)<[Calendario.$F$5]);[.B170]+1;"");"") -> 2016-02-23 | C171: of:=IF(AND([.B171]>=[Calendario.$F$8];[.B171]<=[Calendario.$F$9];1);1;IF(AND([.B171]>=[Calendario.$F$12];[.B171]<=[Calendario.$F$13]);2;IF(AND([.B171]>=[Calendario.$F$16];[.B171]<=[Calendario.$F$17]);3;""))) -> 2 | D171: of:=IF(COUNTIF([Calendario.$H$4:.$H$48];[.B171])>0;"FIESTA";"") ->  | E171: of:=IF([.B171]<>"";VLOOKUP(WEEKDAY([.B171];3);[Calendario.$A$4:.$C$11];2);"") -> Martes | F171: of:=IF([.B171]<>"";IF([.D171]<>"FIESTA";VLOOKUP(WEEKDAY([.B171];3);[Calendario.$A$4:.$C$11];3);0);"") -> 0 | G171: of:=IF(ISNUMBER([.F171]);[.F171]+[.G170];"") -> 65 | H171: of:=IF(AND([.G171]<=[Unidades.$G$26];[.G171]<=[Unidades.$F$18];[Unidades.$F$18]>0);[Unidades.$D$18]+1-COUNTIFS([Unidades.$O$3:.$O$17];">="&[.G171]);"") -> 4 | I171: of:=IF([.H170]<>[.H171];"INICIO";IF([.H172]<>[.H171];"FIN";"")) ->  | J171: of:=IF([.K170]<>[.K171];"INICIO";IF([.K172]<>[.K171];"FIN";"")) -> 
A172: of:=IF([.B172]<>"";TODAY()>[.B172];"") -> 0 | B172: of:=IFERROR(IF(AND(ISNUMBER([.B171]);([.B171]+1)<[Calendario.$F$5]);[.B171]+1;"");"") -> 2016-02-24 | C172: of:=IF(AND([.B172]>=[Calendario.$F$8];[.B172]<=[Calendario.$F$9];1);1;IF(AND([.B172]>=[Calendario.$F$12];[.B172]<=[Calendario.$F$13]);2;IF(AND([.B172]>=[Calendario.$F$16];[.B172]<=[Calendario.$F$17]);3;""))) -> 2 | D172: of:=IF(COUNTIF([Calendario.$H$4:.$H$48];[.B172])>0;"FIESTA";"") ->  | E172: of:=IF([.B172]<>"";VLOOKUP(WEEKDAY([.B172];3);[Calendario.$A$4:.$C$11];2);"") -> Miercoles | F172: of:=IF([.B172]<>"";IF([.D172]<>"FIESTA";VLOOKUP(WEEKDAY([.B172];3);[Calendario.$A$4:.$C$11];3);0);"") -> 1 | G172: of:=IF(ISNUMBER([.F172]);[.F172]+[.G171];"") -> 66 | H172: of:=IF(AND([.G172]<=[Unidades.$G$26];[.G172]<=[Unidades.$F$18];[Unidades.$F$18]>0);[Unidades.$D$18]+1-COUNTIFS([Unidades.$O$3:.$O$17];">="&[.G172]);"") -> 4 | I172: of:=IF([.H171]<>[.H172];"INICIO";IF([.H173]<>[.H172];"FIN";"")) ->  | J172: of:=IF([.K171]<>[.K172];"INICIO";IF([.K173]<>[.K172];"FIN";"")) -> 
A173: of:=IF([.B173]<>"";TODAY()>[.B173];"") -> 0 | B173: of:=IFERROR(IF(AND(ISNUMBER([.B172]);([.B172]+1)<[Calendario.$F$5]);[.B172]+1;"");"") -> 2016-02-25 | C173: of:=IF(AND([.B173]>=[Calendario.$F$8];[.B173]<=[Calendario.$F$9];1);1;IF(AND([.B173]>=[Calendario.$F$12];[.B173]<=[Calendario.$F$13]);2;IF(AND([.B173]>=[Calendario.$F$16];[.B173]<=[Calendario.$F$17]);3;""))) -> 2 | D173: of:=IF(COUNTIF([Calendario.$H$4:.$H$48];[.B173])>0;"FIESTA";"") ->  | E173: of:=IF([.B173]<>"";VLOOKUP(WEEKDAY([.B173];3);[Calendario.$A$4:.$C$11];2);"") -> Jueves | F173: of:=IF([.B173]<>"";IF([.D173]<>"FIESTA";VLOOKUP(WEEKDAY([.B173];3);[Calendario.$A$4:.$C$11];3);0);"") -> 0 | G173: of:=IF(ISNUMBER([.F173]);[.F173]+[.G172];"") -> 66 | H173: of:=IF(AND([.G173]<=[Unidades.$G$26];[.G173]<=[Unidades.$F$18];[Unidades.$F$18]>0);[Unidades.$D$18]+1-COUNTIFS([Unidades.$O$3:.$O$17];">="&[.G173]);"") -> 4 | I173: of:=IF([.H172]<>[.H173];"INICIO";IF([.H174]<>[.H173];"FIN";"")) ->  | J173: of:=IF([.K172]<>[.K173];"INICIO";IF([.K174]<>[.K173];"FIN";"")) -> 
A174: of:=IF([.B174]<>"";TODAY()>[.B174];"") -> 0 | B174: of:=IFERROR(IF(AND(ISNUMBER([.B173]);([.B173]+1)<[Calendario.$F$5]);[.B173]+1;"");"") -> 2016-02-26 | C174: of:=IF(AND([.B174]>=[Calendario.$F$8];[.B174]<=[Calendario.$F$9];1);1;IF(AND([.B174]>=[Calendario.$F$12];[.B174]<=[Calendario.$F$13]);2;IF(AND([.B174]>=[Calendario.$F$16];[.B174]<=[Calendario.$F$17]);3;""))) -> 2 | D174: of:=IF(COUNTIF([Calendario.$H$4:.$H$48];[.B174])>0;"FIESTA";"") ->  | E174: of:=IF([.B174]<>"";VLOOKUP(WEEKDAY([.B174];3);[Calendario.$A$4:.$C$11];2);"") -> Viernes | F174: of:=IF([.B174]<>"";IF([.D174]<>"FIESTA";VLOOKUP(WEEKDAY([.B174];3);[Calendario.$A$4:.$C$11];3);0);"") -> 1 | G174: of:=IF(ISNUMBER([.F174]);[.F174]+[.G173];"") -> 67 | H174: of:=IF(AND([.G174]<=[Unidades.$G$26];[.G174]<=[Unidades.$F$18];[Unidades.$F$18]>0);[Unidades.$D$18]+1-COUNTIFS([Unidades.$O$3:.$O$17];">="&[.G174]);"") -> 4 | I174: of:=IF([.H173]<>[.H174];"INICIO";IF([.H175]<>[.H174];"FIN";"")) ->  | J174: of:=IF([.K173]<>[.K174];"INICIO";IF([.K175]<>[.K174];"FIN";"")) -> 
A175: of:=IF([.B175]<>"";TODAY()>[.B175];"") -> 0 | B175: of:=IFERROR(IF(AND(ISNUMBER([.B174]);([.B174]+1)<[Calendario.$F$5]);[.B174]+1;"");"") -> 2016-02-27 | C175: of:=IF(AND([.B175]>=[Calendario.$F$8];[.B175]<=[Calendario.$F$9];1);1;IF(AND([.B175]>=[Calendario.$F$12];[.B175]<=[Calendario.$F$13]);2;IF(AND([.B175]>=[Calendario.$F$16];[.B175]<=[Calendario.$F$17]);3;""))) -> 2 | D175: of:=IF(COUNTIF([Calendario.$H$4:.$H$48];[.B175])>0;"FIESTA";"") ->  | E175: of:=IF([.B175]<>"";VLOOKUP(WEEKDAY([.B175];3);[Calendario.$A$4:.$C$11];2);"") -> Sabado | F175: of:=IF([.B175]<>"";IF([.D175]<>"FIESTA";VLOOKUP(WEEKDAY([.B175];3);[Calendario.$A$4:.$C$11];3);0);"") -> 0 | G175: of:=IF(ISNUMBER([.F175]);[.F175]+[.G174];"") -> 67 | H175: of:=IF(AND([.G175]<=[Unidades.$G$26];[.G175]<=[Unidades.$F$18];[Unidades.$F$18]>0);[Unidades.$D$18]+1-COUNTIFS([Unidades.$O$3:.$O$17];">="&[.G175]);"") -> 4 | I175: of:=IF([.H174]<>[.H175];"INICIO";IF([.H176]<>[.H175];"FIN";"")) ->  | J175: of:=IF([.K174]<>[.K175];"INICIO";IF([.K176]<>[.K175];"FIN";"")) -> 
A176: of:=IF([.B176]<>"";TODAY()>[.B176];"") -> 0 | B176: of:=IFERROR(IF(AND(ISNUMBER([.B175]);([.B175]+1)<[Calendario.$F$5]);[.B175]+1;"");"") -> 2016-02-28 | C176: of:=IF(AND([.B176]>=[Calendario.$F$8];[.B176]<=[Calendario.$F$9];1);1;IF(AND([.B176]>=[Calendario.$F$12];[.B176]<=[Calendario.$F$13]);2;IF(AND([.B176]>=[Calendario.$F$16];[.B176]<=[Calendario.$F$17]);3;""))) -> 2 | D176: of:=IF(COUNTIF([Calendario.$H$4:.$H$48];[.B176])>0;"FIESTA";"") ->  | E176: of:=IF([.B176]<>"";VLOOKUP(WEEKDAY([.B176];3);[Calendario.$A$4:.$C$11];2);"") -> Domingo | F176: of:=IF([.B176]<>"";IF([.D176]<>"FIESTA";VLOOKUP(WEEKDAY([.B176];3);[Calendario.$A$4:.$C$11];3);0);"") -> 0 | G176: of:=IF(ISNUMBER([.F176]);[.F176]+[.G175];"") -> 67 | H176: of:=IF(AND([.G176]<=[Unidades.$G$26];[.G176]<=[Unidades.$F$18];[Unidades.$F$18]>0);[Unidades.$D$18]+1-COUNTIFS([Unidades.$O$3:.$O$17];">="&[.G176]);"") -> 4 | I176: of:=IF([.H175]<>[.H176];"INICIO";IF([.H177]<>[.H176];"FIN";"")) ->  | J176: of:=IF([.K175]<>[.K176];"INICIO";IF([.K177]<>[.K176];"FIN";"")) -> 
A177: of:=IF([.B177]<>"";TODAY()>[.B177];"") -> 0 | B177: of:=IFERROR(IF(AND(ISNUMBER([.B176]);([.B176]+1)<[Calendario.$F$5]);[.B176]+1;"");"") -> 2016-02-29 | C177: of:=IF(AND([.B177]>=[Calendario.$F$8];[.B177]<=[Calendario.$F$9];1);1;IF(AND([.B177]>=[Calendario.$F$12];[.B177]<=[Calendario.$F$13]);2;IF(AND([.B177]>=[Calendario.$F$16];[.B177]<=[Calendario.$F$17]);3;""))) -> 2 | D177: of:=IF(COUNTIF([Calendario.$H$4:.$H$48];[.B177])>0;"FIESTA";"") ->  | E177: of:=IF([.B177]<>"";VLOOKUP(WEEKDAY([.B177];3);[Calendario.$A$4:.$C$11];2);"") -> Lunes | F177: of:=IF([.B177]<>"";IF([.D177]<>"FIESTA";VLOOKUP(WEEKDAY([.B177];3);[Calendario.$A$4:.$C$11];3);0);"") -> 1 | G177: of:=IF(ISNUMBER([.F177]);[.F177]+[.G176];"") -> 68 | H177: of:=IF(AND([.G177]<=[Unidades.$G$26];[.G177]<=[Unidades.$F$18];[Unidades.$F$18]>0);[Unidades.$D$18]+1-COUNTIFS([Unidades.$O$3:.$O$17];">="&[.G177]);"") -> 4 | I177: of:=IF([.H176]<>[.H177];"INICIO";IF([.H178]<>[.H177];"FIN";"")) ->  | J177: of:=IF([.K176]<>[.K177];"INICIO";IF([.K178]<>[.K177];"FIN";"")) -> 
A178: of:=IF([.B178]<>"";TODAY()>[.B178];"") -> 0 | B178: of:=IFERROR(IF(AND(ISNUMBER([.B177]);([.B177]+1)<[Calendario.$F$5]);[.B177]+1;"");"") -> 2016-03-01 | C178: of:=IF(AND([.B178]>=[Calendario.$F$8];[.B178]<=[Calendario.$F$9];1);1;IF(AND([.B178]>=[Calendario.$F$12];[.B178]<=[Calendario.$F$13]);2;IF(AND([.B178]>=[Calendario.$F$16];[.B178]<=[Calendario.$F$17]);3;""))) -> 2 | D178: of:=IF(COUNTIF([Calendario.$H$4:.$H$48];[.B178])>0;"FIESTA";"") ->  | E178: of:=IF([.B178]<>"";VLOOKUP(WEEKDAY([.B178];3);[Calendario.$A$4:.$C$11];2);"") -> Martes | F178: of:=IF([.B178]<>"";IF([.D178]<>"FIESTA";VLOOKUP(WEEKDAY([.B178];3);[Calendario.$A$4:.$C$11];3);0);"") -> 0 | G178: of:=IF(ISNUMBER([.F178]);[.F178]+[.G177];"") -> 68 | H178: of:=IF(AND([.G178]<=[Unidades.$G$26];[.G178]<=[Unidades.$F$18];[Unidades.$F$18]>0);[Unidades.$D$18]+1-COUNTIFS([Unidades.$O$3:.$O$17];">="&[.G178]);"") -> 4 | I178: of:=IF([.H177]<>[.H178];"INICIO";IF([.H179]<>[.H178];"FIN";"")) ->  | J178: of:=IF([.K177]<>[.K178];"INICIO";IF([.K179]<>[.K178];"FIN";"")) -> 
A179: of:=IF([.B179]<>"";TODAY()>[.B179];"") -> 0 | B179: of:=IFERROR(IF(AND(ISNUMBER([.B178]);([.B178]+1)<[Calendario.$F$5]);[.B178]+1;"");"") -> 2016-03-02 | C179: of:=IF(AND([.B179]>=[Calendario.$F$8];[.B179]<=[Calendario.$F$9];1);1;IF(AND([.B179]>=[Calendario.$F$12];[.B179]<=[Calendario.$F$13]);2;IF(AND([.B179]>=[Calendario.$F$16];[.B179]<=[Calendario.$F$17]);3;""))) -> 2 | D179: of:=IF(COUNTIF([Calendario.$H$4:.$H$48];[.B179])>0;"FIESTA";"") ->  | E179: of:=IF([.B179]<>"";VLOOKUP(WEEKDAY([.B179];3);[Calendario.$A$4:.$C$11];2);"") -> Miercoles | F179: of:=IF([.B179]<>"";IF([.D179]<>"FIESTA";VLOOKUP(WEEKDAY([.B179];3);[Calendario.$A$4:.$C$11];3);0);"") -> 1 | G179: of:=IF(ISNUMBER([.F179]);[.F179]+[.G178];"") -> 69 | H179: of:=IF(AND([.G179]<=[Unidades.$G$26];[.G179]<=[Unidades.$F$18];[Unidades.$F$18]>0);[Unidades.$D$18]+1-COUNTIFS([Unidades.$O$3:.$O$17];">="&[.G179]);"") -> 4 | I179: of:=IF([.H178]<>[.H179];"INICIO";IF([.H180]<>[.H179];"FIN";"")) ->  | J179: of:=IF([.K178]<>[.K179];"INICIO";IF([.K180]<>[.K179];"FIN";"")) -> 
A180: of:=IF([.B180]<>"";TODAY()>[.B180];"") -> 0 | B180: of:=IFERROR(IF(AND(ISNUMBER([.B179]);([.B179]+1)<[Calendario.$F$5]);[.B179]+1;"");"") -> 2016-03-03 | C180: of:=IF(AND([.B180]>=[Calendario.$F$8];[.B180]<=[Calendario.$F$9];1);1;IF(AND([.B180]>=[Calendario.$F$12];[.B180]<=[Calendario.$F$13]);2;IF(AND([.B180]>=[Calendario.$F$16];[.B180]<=[Calendario.$F$17]);3;""))) -> 2 | D180: of:=IF(COUNTIF([Calendario.$H$4:.$H$48];[.B180])>0;"FIESTA";"") ->  | E180: of:=IF([.B180]<>"";VLOOKUP(WEEKDAY([.B180];3);[Calendario.$A$4:.$C$11];2);"") -> Jueves | F180: of:=IF([.B180]<>"";IF([.D180]<>"FIESTA";VLOOKUP(WEEKDAY([.B180];3);[Calendario.$A$4:.$C$11];3);0);"") -> 0 | G180: of:=IF(ISNUMBER([.F180]);[.F180]+[.G179];"") -> 69 | H180: of:=IF(AND([.G180]<=[Unidades.$G$26];[.G180]<=[Unidades.$F$18];[Unidades.$F$18]>0);[Unidades.$D$18]+1-COUNTIFS([Unidades.$O$3:.$O$17];">="&[.G180]);"") -> 4 | I180: of:=IF([.H179]<>[.H180];"INICIO";IF([.H181]<>[.H180];"FIN";"")) ->  | J180: of:=IF([.K179]<>[.K180];"INICIO";IF([.K181]<>[.K180];"FIN";"")) -> 
A181: of:=IF([.B181]<>"";TODAY()>[.B181];"") -> 0 | B181: of:=IFERROR(IF(AND(ISNUMBER([.B180]);([.B180]+1)<[Calendario.$F$5]);[.B180]+1;"");"") -> 2016-03-04 | C181: of:=IF(AND([.B181]>=[Calendario.$F$8];[.B181]<=[Calendario.$F$9];1);1;IF(AND([.B181]>=[Calendario.$F$12];[.B181]<=[Calendario.$F$13]);2;IF(AND([.B181]>=[Calendario.$F$16];[.B181]<=[Calendario.$F$17]);3;""))) -> 2 | D181: of:=IF(COUNTIF([Calendario.$H$4:.$H$48];[.B181])>0;"FIESTA";"") ->  | E181: of:=IF([.B181]<>"";VLOOKUP(WEEKDAY([.B181];3);[Calendario.$A$4:.$C$11];2);"") -> Viernes | F181: of:=IF([.B181]<>"";IF([.D181]<>"FIESTA";VLOOKUP(WEEKDAY([.B181];3);[Calendario.$A$4:.$C$11];3);0);"") -> 1 | G181: of:=IF(ISNUMBER([.F181]);[.F181]+[.G180];"") -> 70 | H181: of:=IF(AND([.G181]<=[Unidades.$G$26];[.G181]<=[Unidades.$F$18];[Unidades.$F$18]>0);[Unidades.$D$18]+1-COUNTIFS([Unidades.$O$3:.$O$17];">="&[.G181]);"") -> 4 | I181: of:=IF([.H180]<>[.H181];"INICIO";IF([.H182]<>[.H181];"FIN";"")) ->  | J181: of:=IF([.K180]<>[.K181];"INICIO";IF([.K182]<>[.K181];"FIN";"")) -> 
A182: of:=IF([.B182]<>"";TODAY()>[.B182];"") -> 0 | B182: of:=IFERROR(IF(AND(ISNUMBER([.B181]);([.B181]+1)<[Calendario.$F$5]);[.B181]+1;"");"") -> 2016-03-05 | C182: of:=IF(AND([.B182]>=[Calendario.$F$8];[.B182]<=[Calendario.$F$9];1);1;IF(AND([.B182]>=[Calendario.$F$12];[.B182]<=[Calendario.$F$13]);2;IF(AND([.B182]>=[Calendario.$F$16];[.B182]<=[Calendario.$F$17]);3;""))) -> 2 | D182: of:=IF(COUNTIF([Calendario.$H$4:.$H$48];[.B182])>0;"FIESTA";"") ->  | E182: of:=IF([.B182]<>"";VLOOKUP(WEEKDAY([.B182];3);[Calendario.$A$4:.$C$11];2);"") -> Sabado | F182: of:=IF([.B182]<>"";IF([.D182]<>"FIESTA";VLOOKUP(WEEKDAY([.B182];3);[Calendario.$A$4:.$C$11];3);0);"") -> 0 | G182: of:=IF(ISNUMBER([.F182]);[.F182]+[.G181];"") -> 70 | H182: of:=IF(AND([.G182]<=[Unidades.$G$26];[.G182]<=[Unidades.$F$18];[Unidades.$F$18]>0);[Unidades.$D$18]+1-COUNTIFS([Unidades.$O$3:.$O$17];">="&[.G182]);"") -> 4 | I182: of:=IF([.H181]<>[.H182];"INICIO";IF([.H183]<>[.H182];"FIN";"")) ->  | J182: of:=IF([.K181]<>[.K182];"INICIO";IF([.K183]<>[.K182];"FIN";"")) -> 
A183: of:=IF([.B183]<>"";TODAY()>[.B183];"") -> 0 | B183: of:=IFERROR(IF(AND(ISNUMBER([.B182]);([.B182]+1)<[Calendario.$F$5]);[.B182]+1;"");"") -> 2016-03-06 | C183: of:=IF(AND([.B183]>=[Calendario.$F$8];[.B183]<=[Calendario.$F$9];1);1;IF(AND([.B183]>=[Calendario.$F$12];[.B183]<=[Calendario.$F$13]);2;IF(AND([.B183]>=[Calendario.$F$16];[.B183]<=[Calendario.$F$17]);3;""))) -> 2 | D183: of:=IF(COUNTIF([Calendario.$H$4:.$H$48];[.B183])>0;"FIESTA";"") ->  | E183: of:=IF([.B183]<>"";VLOOKUP(WEEKDAY([.B183];3);[Calendario.$A$4:.$C$11];2);"") -> Domingo | F183: of:=IF([.B183]<>"";IF([.D183]<>"FIESTA";VLOOKUP(WEEKDAY([.B183];3);[Calendario.$A$4:.$C$11];3);0);"") -> 0 | G183: of:=IF(ISNUMBER([.F183]);[.F183]+[.G182];"") -> 70 | H183: of:=IF(AND([.G183]<=[Unidades.$G$26];[.G183]<=[Unidades.$F$18];[Unidades.$F$18]>0);[Unidades.$D$18]+1-COUNTIFS([Unidades.$O$3:.$O$17];">="&[.G183]);"") -> 4 | I183: of:=IF([.H182]<>[.H183];"INICIO";IF([.H184]<>[.H183];"FIN";"")) ->  | J183: of:=IF([.K182]<>[.K183];"INICIO";IF([.K184]<>[.K183];"FIN";"")) -> 
A184: of:=IF([.B184]<>"";TODAY()>[.B184];"") -> 0 | B184: of:=IFERROR(IF(AND(ISNUMBER([.B183]);([.B183]+1)<[Calendario.$F$5]);[.B183]+1;"");"") -> 2016-03-07 | C184: of:=IF(AND([.B184]>=[Calendario.$F$8];[.B184]<=[Calendario.$F$9];1);1;IF(AND([.B184]>=[Calendario.$F$12];[.B184]<=[Calendario.$F$13]);2;IF(AND([.B184]>=[Calendario.$F$16];[.B184]<=[Calendario.$F$17]);3;""))) -> 2 | D184: of:=IF(COUNTIF([Calendario.$H$4:.$H$48];[.B184])>0;"FIESTA";"") ->  | E184: of:=IF([.B184]<>"";VLOOKUP(WEEKDAY([.B184];3);[Calendario.$A$4:.$C$11];2);"") -> Lunes | F184: of:=IF([.B184]<>"";IF([.D184]<>"FIESTA";VLOOKUP(WEEKDAY([.B184];3);[Calendario.$A$4:.$C$11];3);0);"") -> 1 | G184: of:=IF(ISNUMBER([.F184]);[.F184]+[.G183];"") -> 71 | H184: of:=IF(AND([.G184]<=[Unidades.$G$26];[.G184]<=[Unidades.$F$18];[Unidades.$F$18]>0);[Unidades.$D$18]+1-COUNTIFS([Unidades.$O$3:.$O$17];">="&[.G184]);"") -> 4 | I184: of:=IF([.H183]<>[.H184];"INICIO";IF([.H185]<>[.H184];"FIN";"")) ->  | J184: of:=IF([.K183]<>[.K184];"INICIO";IF([.K185]<>[.K184];"FIN";"")) -> 
A185: of:=IF([.B185]<>"";TODAY()>[.B185];"") -> 0 | B185: of:=IFERROR(IF(AND(ISNUMBER([.B184]);([.B184]+1)<[Calendario.$F$5]);[.B184]+1;"");"") -> 2016-03-08 | C185: of:=IF(AND([.B185]>=[Calendario.$F$8];[.B185]<=[Calendario.$F$9];1);1;IF(AND([.B185]>=[Calendario.$F$12];[.B185]<=[Calendario.$F$13]);2;IF(AND([.B185]>=[Calendario.$F$16];[.B185]<=[Calendario.$F$17]);3;""))) -> 2 | D185: of:=IF(COUNTIF([Calendario.$H$4:.$H$48];[.B185])>0;"FIESTA";"") ->  | E185: of:=IF([.B185]<>"";VLOOKUP(WEEKDAY([.B185];3);[Calendario.$A$4:.$C$11];2);"") -> Martes | F185: of:=IF([.B185]<>"";IF([.D185]<>"FIESTA";VLOOKUP(WEEKDAY([.B185];3);[Calendario.$A$4:.$C$11];3);0);"") -> 0 | G185: of:=IF(ISNUMBER([.F185]);[.F185]+[.G184];"") -> 71 | H185: of:=IF(AND([.G185]<=[Unidades.$G$26];[.G185]<=[Unidades.$F$18];[Unidades.$F$18]>0);[Unidades.$D$18]+1-COUNTIFS([Unidades.$O$3:.$O$17];">="&[.G185]);"") -> 4 | I185: of:=IF([.H184]<>[.H185];"INICIO";IF([.H186]<>[.H185];"FIN";"")) ->  | J185: of:=IF([.K184]<>[.K185];"INICIO";IF([.K186]<>[.K185];"FIN";"")) -> 
A186: of:=IF([.B186]<>"";TODAY()>[.B186];"") -> 0 | B186: of:=IFERROR(IF(AND(ISNUMBER([.B185]);([.B185]+1)<[Calendario.$F$5]);[.B185]+1;"");"") -> 2016-03-09 | C186: of:=IF(AND([.B186]>=[Calendario.$F$8];[.B186]<=[Calendario.$F$9];1);1;IF(AND([.B186]>=[Calendario.$F$12];[.B186]<=[Calendario.$F$13]);2;IF(AND([.B186]>=[Calendario.$F$16];[.B186]<=[Calendario.$F$17]);3;""))) -> 2 | D186: of:=IF(COUNTIF([Calendario.$H$4:.$H$48];[.B186])>0;"FIESTA";"") ->  | E186: of:=IF([.B186]<>"";VLOOKUP(WEEKDAY([.B186];3);[Calendario.$A$4:.$C$11];2);"") -> Miercoles | F186: of:=IF([.B186]<>"";IF([.D186]<>"FIESTA";VLOOKUP(WEEKDAY([.B186];3);[Calendario.$A$4:.$C$11];3);0);"") -> 1 | G186: of:=IF(ISNUMBER([.F186]);[.F186]+[.G185];"") -> 72 | H186: of:=IF(AND([.G186]<=[Unidades.$G$26];[.G186]<=[Unidades.$F$18];[Unidades.$F$18]>0);[Unidades.$D$18]+1-COUNTIFS([Unidades.$O$3:.$O$17];">="&[.G186]);"") -> 4 | I186: of:=IF([.H185]<>[.H186];"INICIO";IF([.H187]<>[.H186];"FIN";"")) ->  | J186: of:=IF([.K185]<>[.K186];"INICIO";IF([.K187]<>[.K186];"FIN";"")) -> 
A187: of:=IF([.B187]<>"";TODAY()>[.B187];"") -> 0 | B187: of:=IFERROR(IF(AND(ISNUMBER([.B186]);([.B186]+1)<[Calendario.$F$5]);[.B186]+1;"");"") -> 2016-03-10 | C187: of:=IF(AND([.B187]>=[Calendario.$F$8];[.B187]<=[Calendario.$F$9];1);1;IF(AND([.B187]>=[Calendario.$F$12];[.B187]<=[Calendario.$F$13]);2;IF(AND([.B187]>=[Calendario.$F$16];[.B187]<=[Calendario.$F$17]);3;""))) -> 2 | D187: of:=IF(COUNTIF([Calendario.$H$4:.$H$48];[.B187])>0;"FIESTA";"") ->  | E187: of:=IF([.B187]<>"";VLOOKUP(WEEKDAY([.B187];3);[Calendario.$A$4:.$C$11];2);"") -> Jueves | F187: of:=IF([.B187]<>"";IF([.D187]<>"FIESTA";VLOOKUP(WEEKDAY([.B187];3);[Calendario.$A$4:.$C$11];3);0);"") -> 0 | G187: of:=IF(ISNUMBER([.F187]);[.F187]+[.G186];"") -> 72 | H187: of:=IF(AND([.G187]<=[Unidades.$G$26];[.G187]<=[Unidades.$F$18];[Unidades.$F$18]>0);[Unidades.$D$18]+1-COUNTIFS([Unidades.$O$3:.$O$17];">="&[.G187]);"") -> 4 | I187: of:=IF([.H186]<>[.H187];"INICIO";IF([.H188]<>[.H187];"FIN";"")) ->  | J187: of:=IF([.K186]<>[.K187];"INICIO";IF([.K188]<>[.K187];"FIN";"")) -> 
A188: of:=IF([.B188]<>"";TODAY()>[.B188];"") -> 0 | B188: of:=IFERROR(IF(AND(ISNUMBER([.B187]);([.B187]+1)<[Calendario.$F$5]);[.B187]+1;"");"") -> 2016-03-11 | C188: of:=IF(AND([.B188]>=[Calendario.$F$8];[.B188]<=[Calendario.$F$9];1);1;IF(AND([.B188]>=[Calendario.$F$12];[.B188]<=[Calendario.$F$13]);2;IF(AND([.B188]>=[Calendario.$F$16];[.B188]<=[Calendario.$F$17]);3;""))) -> 2 | D188: of:=IF(COUNTIF([Calendario.$H$4:.$H$48];[.B188])>0;"FIESTA";"") ->  | E188: of:=IF([.B188]<>"";VLOOKUP(WEEKDAY([.B188];3);[Calendario.$A$4:.$C$11];2);"") -> Viernes | F188: of:=IF([.B188]<>"";IF([.D188]<>"FIESTA";VLOOKUP(WEEKDAY([.B188];3);[Calendario.$A$4:.$C$11];3);0);"") -> 1 | G188: of:=IF(ISNUMBER([.F188]);[.F188]+[.G187];"") -> 73 | H188: of:=IF(AND([.G188]<=[Unidades.$G$26];[.G188]<=[Unidades.$F$18];[Unidades.$F$18]>0);[Unidades.$D$18]+1-COUNTIFS([Unidades.$O$3:.$O$17];">="&[.G188]);"") -> 4 | I188: of:=IF([.H187]<>[.H188];"INICIO";IF([.H189]<>[.H188];"FIN";"")) ->  | J188: of:=IF([.K187]<>[.K188];"INICIO";IF([.K189]<>[.K188];"FIN";"")) -> 
A189: of:=IF([.B189]<>"";TODAY()>[.B189];"") -> 0 | B189: of:=IFERROR(IF(AND(ISNUMBER([.B188]);([.B188]+1)<[Calendario.$F$5]);[.B188]+1;"");"") -> 2016-03-12 | C189: of:=IF(AND([.B189]>=[Calendario.$F$8];[.B189]<=[Calendario.$F$9];1);1;IF(AND([.B189]>=[Calendario.$F$12];[.B189]<=[Calendario.$F$13]);2;IF(AND([.B189]>=[Calendario.$F$16];[.B189]<=[Calendario.$F$17]);3;""))) -> 2 | D189: of:=IF(COUNTIF([Calendario.$H$4:.$H$48];[.B189])>0;"FIESTA";"") ->  | E189: of:=IF([.B189]<>"";VLOOKUP(WEEKDAY([.B189];3);[Calendario.$A$4:.$C$11];2);"") -> Sabado | F189: of:=IF([.B189]<>"";IF([.D189]<>"FIESTA";VLOOKUP(WEEKDAY([.B189];3);[Calendario.$A$4:.$C$11];3);0);"") -> 0 | G189: of:=IF(ISNUMBER([.F189]);[.F189]+[.G188];"") -> 73 | H189: of:=IF(AND([.G189]<=[Unidades.$G$26];[.G189]<=[Unidades.$F$18];[Unidades.$F$18]>0);[Unidades.$D$18]+1-COUNTIFS([Unidades.$O$3:.$O$17];">="&[.G189]);"") -> 4 | I189: of:=IF([.H188]<>[.H189];"INICIO";IF([.H190]<>[.H189];"FIN";"")) ->  | J189: of:=IF([.K188]<>[.K189];"INICIO";IF([.K190]<>[.K189];"FIN";"")) -> 
A190: of:=IF([.B190]<>"";TODAY()>[.B190];"") -> 0 | B190: of:=IFERROR(IF(AND(ISNUMBER([.B189]);([.B189]+1)<[Calendario.$F$5]);[.B189]+1;"");"") -> 2016-03-13 | C190: of:=IF(AND([.B190]>=[Calendario.$F$8];[.B190]<=[Calendario.$F$9];1);1;IF(AND([.B190]>=[Calendario.$F$12];[.B190]<=[Calendario.$F$13]);2;IF(AND([.B190]>=[Calendario.$F$16];[.B190]<=[Calendario.$F$17]);3;""))) -> 2 | D190: of:=IF(COUNTIF([Calendario.$H$4:.$H$48];[.B190])>0;"FIESTA";"") ->  | E190: of:=IF([.B190]<>"";VLOOKUP(WEEKDAY([.B190];3);[Calendario.$A$4:.$C$11];2);"") -> Domingo | F190: of:=IF([.B190]<>"";IF([.D190]<>"FIESTA";VLOOKUP(WEEKDAY([.B190];3);[Calendario.$A$4:.$C$11];3);0);"") -> 0 | G190: of:=IF(ISNUMBER([.F190]);[.F190]+[.G189];"") -> 73 | H190: of:=IF(AND([.G190]<=[Unidades.$G$26];[.G190]<=[Unidades.$F$18];[Unidades.$F$18]>0);[Unidades.$D$18]+1-COUNTIFS([Unidades.$O$3:.$O$17];">="&[.G190]);"") -> 4 | I190: of:=IF([.H189]<>[.H190];"INICIO";IF([.H191]<>[.H190];"FIN";"")) ->  | J190: of:=IF([.K189]<>[.K190];"INICIO";IF([.K191]<>[.K190];"FIN";"")) -> 
A191: of:=IF([.B191]<>"";TODAY()>[.B191];"") -> 0 | B191: of:=IFERROR(IF(AND(ISNUMBER([.B190]);([.B190]+1)<[Calendario.$F$5]);[.B190]+1;"");"") -> 2016-03-14 | C191: of:=IF(AND([.B191]>=[Calendario.$F$8];[.B191]<=[Calendario.$F$9];1);1;IF(AND([.B191]>=[Calendario.$F$12];[.B191]<=[Calendario.$F$13]);2;IF(AND([.B191]>=[Calendario.$F$16];[.B191]<=[Calendario.$F$17]);3;""))) -> 2 | D191: of:=IF(COUNTIF([Calendario.$H$4:.$H$48];[.B191])>0;"FIESTA";"") ->  | E191: of:=IF([.B191]<>"";VLOOKUP(WEEKDAY([.B191];3);[Calendario.$A$4:.$C$11];2);"") -> Lunes | F191: of:=IF([.B191]<>"";IF([.D191]<>"FIESTA";VLOOKUP(WEEKDAY([.B191];3);[Calendario.$A$4:.$C$11];3);0);"") -> 1 | G191: of:=IF(ISNUMBER([.F191]);[.F191]+[.G190];"") -> 74 | H191: of:=IF(AND([.G191]<=[Unidades.$G$26];[.G191]<=[Unidades.$F$18];[Unidades.$F$18]>0);[Unidades.$D$18]+1-COUNTIFS([Unidades.$O$3:.$O$17];">="&[.G191]);"") -> 4 | I191: of:=IF([.H190]<>[.H191];"INICIO";IF([.H192]<>[.H191];"FIN";"")) ->  | J191: of:=IF([.K190]<>[.K191];"INICIO";IF([.K192]<>[.K191];"FIN";"")) -> 
A192: of:=IF([.B192]<>"";TODAY()>[.B192];"") -> 0 | B192: of:=IFERROR(IF(AND(ISNUMBER([.B191]);([.B191]+1)<[Calendario.$F$5]);[.B191]+1;"");"") -> 2016-03-15 | C192: of:=IF(AND([.B192]>=[Calendario.$F$8];[.B192]<=[Calendario.$F$9];1);1;IF(AND([.B192]>=[Calendario.$F$12];[.B192]<=[Calendario.$F$13]);2;IF(AND([.B192]>=[Calendario.$F$16];[.B192]<=[Calendario.$F$17]);3;""))) -> 2 | D192: of:=IF(COUNTIF([Calendario.$H$4:.$H$48];[.B192])>0;"FIESTA";"") ->  | E192: of:=IF([.B192]<>"";VLOOKUP(WEEKDAY([.B192];3);[Calendario.$A$4:.$C$11];2);"") -> Martes | F192: of:=IF([.B192]<>"";IF([.D192]<>"FIESTA";VLOOKUP(WEEKDAY([.B192];3);[Calendario.$A$4:.$C$11];3);0);"") -> 0 | G192: of:=IF(ISNUMBER([.F192]);[.F192]+[.G191];"") -> 74 | H192: of:=IF(AND([.G192]<=[Unidades.$G$26];[.G192]<=[Unidades.$F$18];[Unidades.$F$18]>0);[Unidades.$D$18]+1-COUNTIFS([Unidades.$O$3:.$O$17];">="&[.G192]);"") -> 4 | I192: of:=IF([.H191]<>[.H192];"INICIO";IF([.H193]<>[.H192];"FIN";"")) ->  | J192: of:=IF([.K191]<>[.K192];"INICIO";IF([.K193]<>[.K192];"FIN";"")) -> 
A193: of:=IF([.B193]<>"";TODAY()>[.B193];"") -> 0 | B193: of:=IFERROR(IF(AND(ISNUMBER([.B192]);([.B192]+1)<[Calendario.$F$5]);[.B192]+1;"");"") -> 2016-03-16 | C193: of:=IF(AND([.B193]>=[Calendario.$F$8];[.B193]<=[Calendario.$F$9];1);1;IF(AND([.B193]>=[Calendario.$F$12];[.B193]<=[Calendario.$F$13]);2;IF(AND([.B193]>=[Calendario.$F$16];[.B193]<=[Calendario.$F$17]);3;""))) -> 2 | D193: of:=IF(COUNTIF([Calendario.$H$4:.$H$48];[.B193])>0;"FIESTA";"") ->  | E193: of:=IF([.B193]<>"";VLOOKUP(WEEKDAY([.B193];3);[Calendario.$A$4:.$C$11];2);"") -> Miercoles | F193: of:=IF([.B193]<>"";IF([.D193]<>"FIESTA";VLOOKUP(WEEKDAY([.B193];3);[Calendario.$A$4:.$C$11];3);0);"") -> 1 | G193: of:=IF(ISNUMBER([.F193]);[.F193]+[.G192];"") -> 75 | H193: of:=IF(AND([.G193]<=[Unidades.$G$26];[.G193]<=[Unidades.$F$18];[Unidades.$F$18]>0);[Unidades.$D$18]+1-COUNTIFS([Unidades.$O$3:.$O$17];">="&[.G193]);"") -> 4 | I193: of:=IF([.H192]<>[.H193];"INICIO";IF([.H194]<>[.H193];"FIN";"")) ->  | J193: of:=IF([.K192]<>[.K193];"INICIO";IF([.K194]<>[.K193];"FIN";"")) -> 
A194: of:=IF([.B194]<>"";TODAY()>[.B194];"") -> 0 | B194: of:=IFERROR(IF(AND(ISNUMBER([.B193]);([.B193]+1)<[Calendario.$F$5]);[.B193]+1;"");"") -> 2016-03-17 | C194: of:=IF(AND([.B194]>=[Calendario.$F$8];[.B194]<=[Calendario.$F$9];1);1;IF(AND([.B194]>=[Calendario.$F$12];[.B194]<=[Calendario.$F$13]);2;IF(AND([.B194]>=[Calendario.$F$16];[.B194]<=[Calendario.$F$17]);3;""))) -> 2 | D194: of:=IF(COUNTIF([Calendario.$H$4:.$H$48];[.B194])>0;"FIESTA";"") ->  | E194: of:=IF([.B194]<>"";VLOOKUP(WEEKDAY([.B194];3);[Calendario.$A$4:.$C$11];2);"") -> Jueves | F194: of:=IF([.B194]<>"";IF([.D194]<>"FIESTA";VLOOKUP(WEEKDAY([.B194];3);[Calendario.$A$4:.$C$11];3);0);"") -> 0 | G194: of:=IF(ISNUMBER([.F194]);[.F194]+[.G193];"") -> 75 | H194: of:=IF(AND([.G194]<=[Unidades.$G$26];[.G194]<=[Unidades.$F$18];[Unidades.$F$18]>0);[Unidades.$D$18]+1-COUNTIFS([Unidades.$O$3:.$O$17];">="&[.G194]);"") -> 4 | I194: of:=IF([.H193]<>[.H194];"INICIO";IF([.H195]<>[.H194];"FIN";"")) ->  | J194: of:=IF([.K193]<>[.K194];"INICIO";IF([.K195]<>[.K194];"FIN";"")) -> 
A195: of:=IF([.B195]<>"";TODAY()>[.B195];"") -> 0 | B195: of:=IFERROR(IF(AND(ISNUMBER([.B194]);([.B194]+1)<[Calendario.$F$5]);[.B194]+1;"");"") -> 2016-03-18 | C195: of:=IF(AND([.B195]>=[Calendario.$F$8];[.B195]<=[Calendario.$F$9];1);1;IF(AND([.B195]>=[Calendario.$F$12];[.B195]<=[Calendario.$F$13]);2;IF(AND([.B195]>=[Calendario.$F$16];[.B195]<=[Calendario.$F$17]);3;""))) -> 2 | D195: of:=IF(COUNTIF([Calendario.$H$4:.$H$48];[.B195])>0;"FIESTA";"") ->  | E195: of:=IF([.B195]<>"";VLOOKUP(WEEKDAY([.B195];3);[Calendario.$A$4:.$C$11];2);"") -> Viernes | F195: of:=IF([.B195]<>"";IF([.D195]<>"FIESTA";VLOOKUP(WEEKDAY([.B195];3);[Calendario.$A$4:.$C$11];3);0);"") -> 1 | G195: of:=IF(ISNUMBER([.F195]);[.F195]+[.G194];"") -> 76 | H195: of:=IF(AND([.G195]<=[Unidades.$G$26];[.G195]<=[Unidades.$F$18];[Unidades.$F$18]>0);[Unidades.$D$18]+1-COUNTIFS([Unidades.$O$3:.$O$17];">="&[.G195]);"") -> 4 | I195: of:=IF([.H194]<>[.H195];"INICIO";IF([.H196]<>[.H195];"FIN";"")) ->  | J195: of:=IF([.K194]<>[.K195];"INICIO";IF([.K196]<>[.K195];"FIN";"")) -> 
A196: of:=IF([.B196]<>"";TODAY()>[.B196];"") -> 0 | B196: of:=IFERROR(IF(AND(ISNUMBER([.B195]);([.B195]+1)<[Calendario.$F$5]);[.B195]+1;"");"") -> 2016-03-19 | C196: of:=IF(AND([.B196]>=[Calendario.$F$8];[.B196]<=[Calendario.$F$9];1);1;IF(AND([.B196]>=[Calendario.$F$12];[.B196]<=[Calendario.$F$13]);2;IF(AND([.B196]>=[Calendario.$F$16];[.B196]<=[Calendario.$F$17]);3;""))) -> 2 | D196: of:=IF(COUNTIF([Calendario.$H$4:.$H$48];[.B196])>0;"FIESTA";"") -> FIESTA | E196: of:=IF([.B196]<>"";VLOOKUP(WEEKDAY([.B196];3);[Calendario.$A$4:.$C$11];2);"") -> Sabado | F196: of:=IF([.B196]<>"";IF([.D196]<>"FIESTA";VLOOKUP(WEEKDAY([.B196];3);[Calendario.$A$4:.$C$11];3);0);"") -> 0 | G196: of:=IF(ISNUMBER([.F196]);[.F196]+[.G195];"") -> 76 | H196: of:=IF(AND([.G196]<=[Unidades.$G$26];[.G196]<=[Unidades.$F$18];[Unidades.$F$18]>0);[Unidades.$D$18]+1-COUNTIFS([Unidades.$O$3:.$O$17];">="&[.G196]);"") -> 4 | I196: of:=IF([.H195]<>[.H196];"INICIO";IF([.H197]<>[.H196];"FIN";"")) ->  | J196: of:=IF([.K195]<>[.K196];"INICIO";IF([.K197]<>[.K196];"FIN";"")) -> 
A197: of:=IF([.B197]<>"";TODAY()>[.B197];"") -> 0 | B197: of:=IFERROR(IF(AND(ISNUMBER([.B196]);([.B196]+1)<[Calendario.$F$5]);[.B196]+1;"");"") -> 2016-03-20 | C197: of:=IF(AND([.B197]>=[Calendario.$F$8];[.B197]<=[Calendario.$F$9];1);1;IF(AND([.B197]>=[Calendario.$F$12];[.B197]<=[Calendario.$F$13]);2;IF(AND([.B197]>=[Calendario.$F$16];[.B197]<=[Calendario.$F$17]);3;""))) -> 2 | D197: of:=IF(COUNTIF([Calendario.$H$4:.$H$48];[.B197])>0;"FIESTA";"") ->  | E197: of:=IF([.B197]<>"";VLOOKUP(WEEKDAY([.B197];3);[Calendario.$A$4:.$C$11];2);"") -> Domingo | F197: of:=IF([.B197]<>"";IF([.D197]<>"FIESTA";VLOOKUP(WEEKDAY([.B197];3);[Calendario.$A$4:.$C$11];3);0);"") -> 0 | G197: of:=IF(ISNUMBER([.F197]);[.F197]+[.G196];"") -> 76 | H197: of:=IF(AND([.G197]<=[Unidades.$G$26];[.G197]<=[Unidades.$F$18];[Unidades.$F$18]>0);[Unidades.$D$18]+1-COUNTIFS([Unidades.$O$3:.$O$17];">="&[.G197]);"") -> 4 | I197: of:=IF([.H196]<>[.H197];"INICIO";IF([.H198]<>[.H197];"FIN";"")) ->  | J197: of:=IF([.K196]<>[.K197];"INICIO";IF([.K198]<>[.K197];"FIN";"")) -> 
A198: of:=IF([.B198]<>"";TODAY()>[.B198];"") -> 0 | B198: of:=IFERROR(IF(AND(ISNUMBER([.B197]);([.B197]+1)<[Calendario.$F$5]);[.B197]+1;"");"") -> 2016-03-21 | C198: of:=IF(AND([.B198]>=[Calendario.$F$8];[.B198]<=[Calendario.$F$9];1);1;IF(AND([.B198]>=[Calendario.$F$12];[.B198]<=[Calendario.$F$13]);2;IF(AND([.B198]>=[Calendario.$F$16];[.B198]<=[Calendario.$F$17]);3;""))) -> 2 | D198: of:=IF(COUNTIF([Calendario.$H$4:.$H$48];[.B198])>0;"FIESTA";"") ->  | E198: of:=IF([.B198]<>"";VLOOKUP(WEEKDAY([.B198];3);[Calendario.$A$4:.$C$11];2);"") -> Lunes | F198: of:=IF([.B198]<>"";IF([.D198]<>"FIESTA";VLOOKUP(WEEKDAY([.B198];3);[Calendario.$A$4:.$C$11];3);0);"") -> 1 | G198: of:=IF(ISNUMBER([.F198]);[.F198]+[.G197];"") -> 77 | H198: of:=IF(AND([.G198]<=[Unidades.$G$26];[.G198]<=[Unidades.$F$18];[Unidades.$F$18]>0);[Unidades.$D$18]+1-COUNTIFS([Unidades.$O$3:.$O$17];">="&[.G198]);"") -> 4 | I198: of:=IF([.H197]<>[.H198];"INICIO";IF([.H199]<>[.H198];"FIN";"")) ->  | J198: of:=IF([.K197]<>[.K198];"INICIO";IF([.K199]<>[.K198];"FIN";"")) -> 
A199: of:=IF([.B199]<>"";TODAY()>[.B199];"") -> 0 | B199: of:=IFERROR(IF(AND(ISNUMBER([.B198]);([.B198]+1)<[Calendario.$F$5]);[.B198]+1;"");"") -> 2016-03-22 | C199: of:=IF(AND([.B199]>=[Calendario.$F$8];[.B199]<=[Calendario.$F$9];1);1;IF(AND([.B199]>=[Calendario.$F$12];[.B199]<=[Calendario.$F$13]);2;IF(AND([.B199]>=[Calendario.$F$16];[.B199]<=[Calendario.$F$17]);3;""))) -> 2 | D199: of:=IF(COUNTIF([Calendario.$H$4:.$H$48];[.B199])>0;"FIESTA";"") ->  | E199: of:=IF([.B199]<>"";VLOOKUP(WEEKDAY([.B199];3);[Calendario.$A$4:.$C$11];2);"") -> Martes | F199: of:=IF([.B199]<>"";IF([.D199]<>"FIESTA";VLOOKUP(WEEKDAY([.B199];3);[Calendario.$A$4:.$C$11];3);0);"") -> 0 | G199: of:=IF(ISNUMBER([.F199]);[.F199]+[.G198];"") -> 77 | H199: of:=IF(AND([.G199]<=[Unidades.$G$26];[.G199]<=[Unidades.$F$18];[Unidades.$F$18]>0);[Unidades.$D$18]+1-COUNTIFS([Unidades.$O$3:.$O$17];">="&[.G199]);"") -> 4 | I199: of:=IF([.H198]<>[.H199];"INICIO";IF([.H200]<>[.H199];"FIN";"")) ->  | J199: of:=IF([.K198]<>[.K199];"INICIO";IF([.K200]<>[.K199];"FIN";"")) -> 
A200: of:=IF([.B200]<>"";TODAY()>[.B200];"") -> 0 | B200: of:=IFERROR(IF(AND(ISNUMBER([.B199]);([.B199]+1)<[Calendario.$F$5]);[.B199]+1;"");"") -> 2016-03-23 | C200: of:=IF(AND([.B200]>=[Calendario.$F$8];[.B200]<=[Calendario.$F$9];1);1;IF(AND([.B200]>=[Calendario.$F$12];[.B200]<=[Calendario.$F$13]);2;IF(AND([.B200]>=[Calendario.$F$16];[.B200]<=[Calendario.$F$17]);3;""))) -> 2 | D200: of:=IF(COUNTIF([Calendario.$H$4:.$H$48];[.B200])>0;"FIESTA";"") ->  | E200: of:=IF([.B200]<>"";VLOOKUP(WEEKDAY([.B200];3);[Calendario.$A$4:.$C$11];2);"") -> Miercoles | F200: of:=IF([.B200]<>"";IF([.D200]<>"FIESTA";VLOOKUP(WEEKDAY([.B200];3);[Calendario.$A$4:.$C$11];3);0);"") -> 1 | G200: of:=IF(ISNUMBER([.F200]);[.F200]+[.G199];"") -> 78 | H200: of:=IF(AND([.G200]<=[Unidades.$G$26];[.G200]<=[Unidades.$F$18];[Unidades.$F$18]>0);[Unidades.$D$18]+1-COUNTIFS([Unidades.$O$3:.$O$17];">="&[.G200]);"") -> 4 | I200: of:=IF([.H199]<>[.H200];"INICIO";IF([.H201]<>[.H200];"FIN";"")) ->  | J200: of:=IF([.K199]<>[.K200];"INICIO";IF([.K201]<>[.K200];"FIN";"")) -> 
A201: of:=IF([.B201]<>"";TODAY()>[.B201];"") -> 0 | B201: of:=IFERROR(IF(AND(ISNUMBER([.B200]);([.B200]+1)<[Calendario.$F$5]);[.B200]+1;"");"") -> 2016-03-24 | C201: of:=IF(AND([.B201]>=[Calendario.$F$8];[.B201]<=[Calendario.$F$9];1);1;IF(AND([.B201]>=[Calendario.$F$12];[.B201]<=[Calendario.$F$13]);2;IF(AND([.B201]>=[Calendario.$F$16];[.B201]<=[Calendario.$F$17]);3;""))) -> 2 | D201: of:=IF(COUNTIF([Calendario.$H$4:.$H$48];[.B201])>0;"FIESTA";"") ->  | E201: of:=IF([.B201]<>"";VLOOKUP(WEEKDAY([.B201];3);[Calendario.$A$4:.$C$11];2);"") -> Jueves | F201: of:=IF([.B201]<>"";IF([.D201]<>"FIESTA";VLOOKUP(WEEKDAY([.B201];3);[Calendario.$A$4:.$C$11];3);0);"") -> 0 | G201: of:=IF(ISNUMBER([.F201]);[.F201]+[.G200];"") -> 78 | H201: of:=IF(AND([.G201]<=[Unidades.$G$26];[.G201]<=[Unidades.$F$18];[Unidades.$F$18]>0);[Unidades.$D$18]+1-COUNTIFS([Unidades.$O$3:.$O$17];">="&[.G201]);"") -> 4 | I201: of:=IF([.H200]<>[.H201];"INICIO";IF([.H202]<>[.H201];"FIN";"")) ->  | J201: of:=IF([.K200]<>[.K201];"INICIO";IF([.K202]<>[.K201];"FIN";"")) -> 
A202: of:=IF([.B202]<>"";TODAY()>[.B202];"") -> 0 | B202: of:=IFERROR(IF(AND(ISNUMBER([.B201]);([.B201]+1)<[Calendario.$F$5]);[.B201]+1;"");"") -> 2016-03-25 | C202: of:=IF(AND([.B202]>=[Calendario.$F$8];[.B202]<=[Calendario.$F$9];1);1;IF(AND([.B202]>=[Calendario.$F$12];[.B202]<=[Calendario.$F$13]);2;IF(AND([.B202]>=[Calendario.$F$16];[.B202]<=[Calendario.$F$17]);3;""))) -> 2 | D202: of:=IF(COUNTIF([Calendario.$H$4:.$H$48];[.B202])>0;"FIESTA";"") ->  | E202: of:=IF([.B202]<>"";VLOOKUP(WEEKDAY([.B202];3);[Calendario.$A$4:.$C$11];2);"") -> Viernes | F202: of:=IF([.B202]<>"";IF([.D202]<>"FIESTA";VLOOKUP(WEEKDAY([.B202];3);[Calendario.$A$4:.$C$11];3);0);"") -> 1 | G202: of:=IF(ISNUMBER([.F202]);[.F202]+[.G201];"") -> 79 | H202: of:=IF(AND([.G202]<=[Unidades.$G$26];[.G202]<=[Unidades.$F$18];[Unidades.$F$18]>0);[Unidades.$D$18]+1-COUNTIFS([Unidades.$O$3:.$O$17];">="&[.G202]);"") -> 4 | I202: of:=IF([.H201]<>[.H202];"INICIO";IF([.H203]<>[.H202];"FIN";"")) ->  | J202: of:=IF([.K201]<>[.K202];"INICIO";IF([.K203]<>[.K202];"FIN";"")) -> 
A203: of:=IF([.B203]<>"";TODAY()>[.B203];"") -> 0 | B203: of:=IFERROR(IF(AND(ISNUMBER([.B202]);([.B202]+1)<[Calendario.$F$5]);[.B202]+1;"");"") -> 2016-03-26 | C203: of:=IF(AND([.B203]>=[Calendario.$F$8];[.B203]<=[Calendario.$F$9];1);1;IF(AND([.B203]>=[Calendario.$F$12];[.B203]<=[Calendario.$F$13]);2;IF(AND([.B203]>=[Calendario.$F$16];[.B203]<=[Calendario.$F$17]);3;""))) -> 2 | D203: of:=IF(COUNTIF([Calendario.$H$4:.$H$48];[.B203])>0;"FIESTA";"") ->  | E203: of:=IF([.B203]<>"";VLOOKUP(WEEKDAY([.B203];3);[Calendario.$A$4:.$C$11];2);"") -> Sabado | F203: of:=IF([.B203]<>"";IF([.D203]<>"FIESTA";VLOOKUP(WEEKDAY([.B203];3);[Calendario.$A$4:.$C$11];3);0);"") -> 0 | G203: of:=IF(ISNUMBER([.F203]);[.F203]+[.G202];"") -> 79 | H203: of:=IF(AND([.G203]<=[Unidades.$G$26];[.G203]<=[Unidades.$F$18];[Unidades.$F$18]>0);[Unidades.$D$18]+1-COUNTIFS([Unidades.$O$3:.$O$17];">="&[.G203]);"") -> 4 | I203: of:=IF([.H202]<>[.H203];"INICIO";IF([.H204]<>[.H203];"FIN";"")) ->  | J203: of:=IF([.K202]<>[.K203];"INICIO";IF([.K204]<>[.K203];"FIN";"")) -> 
A204: of:=IF([.B204]<>"";TODAY()>[.B204];"") -> 0 | B204: of:=IFERROR(IF(AND(ISNUMBER([.B203]);([.B203]+1)<[Calendario.$F$5]);[.B203]+1;"");"") -> 2016-03-27 | C204: of:=IF(AND([.B204]>=[Calendario.$F$8];[.B204]<=[Calendario.$F$9];1);1;IF(AND([.B204]>=[Calendario.$F$12];[.B204]<=[Calendario.$F$13]);2;IF(AND([.B204]>=[Calendario.$F$16];[.B204]<=[Calendario.$F$17]);3;""))) -> 2 | D204: of:=IF(COUNTIF([Calendario.$H$4:.$H$48];[.B204])>0;"FIESTA";"") ->  | E204: of:=IF([.B204]<>"";VLOOKUP(WEEKDAY([.B204];3);[Calendario.$A$4:.$C$11];2);"") -> Domingo | F204: of:=IF([.B204]<>"";IF([.D204]<>"FIESTA";VLOOKUP(WEEKDAY([.B204];3);[Calendario.$A$4:.$C$11];3);0);"") -> 0 | G204: of:=IF(ISNUMBER([.F204]);[.F204]+[.G203];"") -> 79 | H204: of:=IF(AND([.G204]<=[Unidades.$G$26];[.G204]<=[Unidades.$F$18];[Unidades.$F$18]>0);[Unidades.$D$18]+1-COUNTIFS([Unidades.$O$3:.$O$17];">="&[.G204]);"") -> 4 | I204: of:=IF([.H203]<>[.H204];"INICIO";IF([.H205]<>[.H204];"FIN";"")) ->  | J204: of:=IF([.K203]<>[.K204];"INICIO";IF([.K205]<>[.K204];"FIN";"")) -> 
A205: of:=IF([.B205]<>"";TODAY()>[.B205];"") -> 0 | B205: of:=IFERROR(IF(AND(ISNUMBER([.B204]);([.B204]+1)<[Calendario.$F$5]);[.B204]+1;"");"") -> 2016-03-28 | C205: of:=IF(AND([.B205]>=[Calendario.$F$8];[.B205]<=[Calendario.$F$9];1);1;IF(AND([.B205]>=[Calendario.$F$12];[.B205]<=[Calendario.$F$13]);2;IF(AND([.B205]>=[Calendario.$F$16];[.B205]<=[Calendario.$F$17]);3;""))) -> 2 | D205: of:=IF(COUNTIF([Calendario.$H$4:.$H$48];[.B205])>0;"FIESTA";"") ->  | E205: of:=IF([.B205]<>"";VLOOKUP(WEEKDAY([.B205];3);[Calendario.$A$4:.$C$11];2);"") -> Lunes | F205: of:=IF([.B205]<>"";IF([.D205]<>"FIESTA";VLOOKUP(WEEKDAY([.B205];3);[Calendario.$A$4:.$C$11];3);0);"") -> 1 | G205: of:=IF(ISNUMBER([.F205]);[.F205]+[.G204];"") -> 80 | H205: of:=IF(AND([.G205]<=[Unidades.$G$26];[.G205]<=[Unidades.$F$18];[Unidades.$F$18]>0);[Unidades.$D$18]+1-COUNTIFS([Unidades.$O$3:.$O$17];">="&[.G205]);"") -> 4 | I205: of:=IF([.H204]<>[.H205];"INICIO";IF([.H206]<>[.H205];"FIN";"")) ->  | J205: of:=IF([.K204]<>[.K205];"INICIO";IF([.K206]<>[.K205];"FIN";"")) -> 
A206: of:=IF([.B206]<>"";TODAY()>[.B206];"") -> 0 | B206: of:=IFERROR(IF(AND(ISNUMBER([.B205]);([.B205]+1)<[Calendario.$F$5]);[.B205]+1;"");"") -> 2016-03-29 | C206: of:=IF(AND([.B206]>=[Calendario.$F$8];[.B206]<=[Calendario.$F$9];1);1;IF(AND([.B206]>=[Calendario.$F$12];[.B206]<=[Calendario.$F$13]);2;IF(AND([.B206]>=[Calendario.$F$16];[.B206]<=[Calendario.$F$17]);3;""))) -> 2 | D206: of:=IF(COUNTIF([Calendario.$H$4:.$H$48];[.B206])>0;"FIESTA";"") ->  | E206: of:=IF([.B206]<>"";VLOOKUP(WEEKDAY([.B206];3);[Calendario.$A$4:.$C$11];2);"") -> Martes | F206: of:=IF([.B206]<>"";IF([.D206]<>"FIESTA";VLOOKUP(WEEKDAY([.B206];3);[Calendario.$A$4:.$C$11];3);0);"") -> 0 | G206: of:=IF(ISNUMBER([.F206]);[.F206]+[.G205];"") -> 80 | H206: of:=IF(AND([.G206]<=[Unidades.$G$26];[.G206]<=[Unidades.$F$18];[Unidades.$F$18]>0);[Unidades.$D$18]+1-COUNTIFS([Unidades.$O$3:.$O$17];">="&[.G206]);"") -> 4 | I206: of:=IF([.H205]<>[.H206];"INICIO";IF([.H207]<>[.H206];"FIN";"")) -> FIN | J206: of:=IF([.K205]<>[.K206];"INICIO";IF([.K207]<>[.K206];"FIN";"")) -> 
A207: of:=IF([.B207]<>"";TODAY()>[.B207];"") -> 0 | B207: of:=IFERROR(IF(AND(ISNUMBER([.B206]);([.B206]+1)<[Calendario.$F$5]);[.B206]+1;"");"") -> 2016-03-30 | C207: of:=IF(AND([.B207]>=[Calendario.$F$8];[.B207]<=[Calendario.$F$9];1);1;IF(AND([.B207]>=[Calendario.$F$12];[.B207]<=[Calendario.$F$13]);2;IF(AND([.B207]>=[Calendario.$F$16];[.B207]<=[Calendario.$F$17]);3;""))) -> 2 | D207: of:=IF(COUNTIF([Calendario.$H$4:.$H$48];[.B207])>0;"FIESTA";"") ->  | E207: of:=IF([.B207]<>"";VLOOKUP(WEEKDAY([.B207];3);[Calendario.$A$4:.$C$11];2);"") -> Miercoles | F207: of:=IF([.B207]<>"";IF([.D207]<>"FIESTA";VLOOKUP(WEEKDAY([.B207];3);[Calendario.$A$4:.$C$11];3);0);"") -> 1 | G207: of:=IF(ISNUMBER([.F207]);[.F207]+[.G206];"") -> 81 | H207: of:=IF(AND([.G207]<=[Unidades.$G$26];[.G207]<=[Unidades.$F$18];[Unidades.$F$18]>0);[Unidades.$D$18]+1-COUNTIFS([Unidades.$O$3:.$O$17];">="&[.G207]);"") -> 5 | I207: of:=IF([.H206]<>[.H207];"INICIO";IF([.H208]<>[.H207];"FIN";"")) -> INICIO | J207: of:=IF([.K206]<>[.K207];"INICIO";IF([.K208]<>[.K207];"FIN";"")) -> 
A208: of:=IF([.B208]<>"";TODAY()>[.B208];"") -> 0 | B208: of:=IFERROR(IF(AND(ISNUMBER([.B207]);([.B207]+1)<[Calendario.$F$5]);[.B207]+1;"");"") -> 2016-03-31 | C208: of:=IF(AND([.B208]>=[Calendario.$F$8];[.B208]<=[Calendario.$F$9];1);1;IF(AND([.B208]>=[Calendario.$F$12];[.B208]<=[Calendario.$F$13]);2;IF(AND([.B208]>=[Calendario.$F$16];[.B208]<=[Calendario.$F$17]);3;""))) -> 2 | D208: of:=IF(COUNTIF([Calendario.$H$4:.$H$48];[.B208])>0;"FIESTA";"") ->  | E208: of:=IF([.B208]<>"";VLOOKUP(WEEKDAY([.B208];3);[Calendario.$A$4:.$C$11];2);"") -> Jueves | F208: of:=IF([.B208]<>"";IF([.D208]<>"FIESTA";VLOOKUP(WEEKDAY([.B208];3);[Calendario.$A$4:.$C$11];3);0);"") -> 0 | G208: of:=IF(ISNUMBER([.F208]);[.F208]+[.G207];"") -> 81 | H208: of:=IF(AND([.G208]<=[Unidades.$G$26];[.G208]<=[Unidades.$F$18];[Unidades.$F$18]>0);[Unidades.$D$18]+1-COUNTIFS([Unidades.$O$3:.$O$17];">="&[.G208]);"") -> 5 | I208: of:=IF([.H207]<>[.H208];"INICIO";IF([.H209]<>[.H208];"FIN";"")) ->  | J208: of:=IF([.K207]<>[.K208];"INICIO";IF([.K209]<>[.K208];"FIN";"")) -> 
A209: of:=IF([.B209]<>"";TODAY()>[.B209];"") -> 0 | B209: of:=IFERROR(IF(AND(ISNUMBER([.B208]);([.B208]+1)<[Calendario.$F$5]);[.B208]+1;"");"") -> 2016-04-01 | C209: of:=IF(AND([.B209]>=[Calendario.$F$8];[.B209]<=[Calendario.$F$9];1);1;IF(AND([.B209]>=[Calendario.$F$12];[.B209]<=[Calendario.$F$13]);2;IF(AND([.B209]>=[Calendario.$F$16];[.B209]<=[Calendario.$F$17]);3;""))) -> 2 | D209: of:=IF(COUNTIF([Calendario.$H$4:.$H$48];[.B209])>0;"FIESTA";"") ->  | E209: of:=IF([.B209]<>"";VLOOKUP(WEEKDAY([.B209];3);[Calendario.$A$4:.$C$11];2);"") -> Viernes | F209: of:=IF([.B209]<>"";IF([.D209]<>"FIESTA";VLOOKUP(WEEKDAY([.B209];3);[Calendario.$A$4:.$C$11];3);0);"") -> 1 | G209: of:=IF(ISNUMBER([.F209]);[.F209]+[.G208];"") -> 82 | H209: of:=IF(AND([.G209]<=[Unidades.$G$26];[.G209]<=[Unidades.$F$18];[Unidades.$F$18]>0);[Unidades.$D$18]+1-COUNTIFS([Unidades.$O$3:.$O$17];">="&[.G209]);"") -> 5 | I209: of:=IF([.H208]<>[.H209];"INICIO";IF([.H210]<>[.H209];"FIN";"")) ->  | J209: of:=IF([.K208]<>[.K209];"INICIO";IF([.K210]<>[.K209];"FIN";"")) -> 
A210: of:=IF([.B210]<>"";TODAY()>[.B210];"") -> 0 | B210: of:=IFERROR(IF(AND(ISNUMBER([.B209]);([.B209]+1)<[Calendario.$F$5]);[.B209]+1;"");"") -> 2016-04-02 | C210: of:=IF(AND([.B210]>=[Calendario.$F$8];[.B210]<=[Calendario.$F$9];1);1;IF(AND([.B210]>=[Calendario.$F$12];[.B210]<=[Calendario.$F$13]);2;IF(AND([.B210]>=[Calendario.$F$16];[.B210]<=[Calendario.$F$17]);3;""))) -> 3 | D210: of:=IF(COUNTIF([Calendario.$H$4:.$H$48];[.B210])>0;"FIESTA";"") -> FIESTA | E210: of:=IF([.B210]<>"";VLOOKUP(WEEKDAY([.B210];3);[Calendario.$A$4:.$C$11];2);"") -> Sabado | F210: of:=IF([.B210]<>"";IF([.D210]<>"FIESTA";VLOOKUP(WEEKDAY([.B210];3);[Calendario.$A$4:.$C$11];3);0);"") -> 0 | G210: of:=IF(ISNUMBER([.F210]);[.F210]+[.G209];"") -> 82 | H210: of:=IF(AND([.G210]<=[Unidades.$G$26];[.G210]<=[Unidades.$F$18];[Unidades.$F$18]>0);[Unidades.$D$18]+1-COUNTIFS([Unidades.$O$3:.$O$17];">="&[.G210]);"") -> 5 | I210: of:=IF([.H209]<>[.H210];"INICIO";IF([.H211]<>[.H210];"FIN";"")) ->  | J210: of:=IF([.K209]<>[.K210];"INICIO";IF([.K211]<>[.K210];"FIN";"")) -> 
A211: of:=IF([.B211]<>"";TODAY()>[.B211];"") -> 0 | B211: of:=IFERROR(IF(AND(ISNUMBER([.B210]);([.B210]+1)<[Calendario.$F$5]);[.B210]+1;"");"") -> 2016-04-03 | C211: of:=IF(AND([.B211]>=[Calendario.$F$8];[.B211]<=[Calendario.$F$9];1);1;IF(AND([.B211]>=[Calendario.$F$12];[.B211]<=[Calendario.$F$13]);2;IF(AND([.B211]>=[Calendario.$F$16];[.B211]<=[Calendario.$F$17]);3;""))) -> 3 | D211: of:=IF(COUNTIF([Calendario.$H$4:.$H$48];[.B211])>0;"FIESTA";"") -> FIESTA | E211: of:=IF([.B211]<>"";VLOOKUP(WEEKDAY([.B211];3);[Calendario.$A$4:.$C$11];2);"") -> Domingo | F211: of:=IF([.B211]<>"";IF([.D211]<>"FIESTA";VLOOKUP(WEEKDAY([.B211];3);[Calendario.$A$4:.$C$11];3);0);"") -> 0 | G211: of:=IF(ISNUMBER([.F211]);[.F211]+[.G210];"") -> 82 | H211: of:=IF(AND([.G211]<=[Unidades.$G$26];[.G211]<=[Unidades.$F$18];[Unidades.$F$18]>0);[Unidades.$D$18]+1-COUNTIFS([Unidades.$O$3:.$O$17];">="&[.G211]);"") -> 5 | I211: of:=IF([.H210]<>[.H211];"INICIO";IF([.H212]<>[.H211];"FIN";"")) ->  | J211: of:=IF([.K210]<>[.K211];"INICIO";IF([.K212]<>[.K211];"FIN";"")) -> 
A212: of:=IF([.B212]<>"";TODAY()>[.B212];"") -> 0 | B212: of:=IFERROR(IF(AND(ISNUMBER([.B211]);([.B211]+1)<[Calendario.$F$5]);[.B211]+1;"");"") -> 2016-04-04 | C212: of:=IF(AND([.B212]>=[Calendario.$F$8];[.B212]<=[Calendario.$F$9];1);1;IF(AND([.B212]>=[Calendario.$F$12];[.B212]<=[Calendario.$F$13]);2;IF(AND([.B212]>=[Calendario.$F$16];[.B212]<=[Calendario.$F$17]);3;""))) -> 3 | D212: of:=IF(COUNTIF([Calendario.$H$4:.$H$48];[.B212])>0;"FIESTA";"") -> FIESTA | E212: of:=IF([.B212]<>"";VLOOKUP(WEEKDAY([.B212];3);[Calendario.$A$4:.$C$11];2);"") -> Lunes | F212: of:=IF([.B212]<>"";IF([.D212]<>"FIESTA";VLOOKUP(WEEKDAY([.B212];3);[Calendario.$A$4:.$C$11];3);0);"") -> 0 | G212: of:=IF(ISNUMBER([.F212]);[.F212]+[.G211];"") -> 82 | H212: of:=IF(AND([.G212]<=[Unidades.$G$26];[.G212]<=[Unidades.$F$18];[Unidades.$F$18]>0);[Unidades.$D$18]+1-COUNTIFS([Unidades.$O$3:.$O$17];">="&[.G212]);"") -> 5 | I212: of:=IF([.H211]<>[.H212];"INICIO";IF([.H213]<>[.H212];"FIN";"")) ->  | J212: of:=IF([.K211]<>[.K212];"INICIO";IF([.K213]<>[.K212];"FIN";"")) -> 
A213: of:=IF([.B213]<>"";TODAY()>[.B213];"") -> 0 | B213: of:=IFERROR(IF(AND(ISNUMBER([.B212]);([.B212]+1)<[Calendario.$F$5]);[.B212]+1;"");"") -> 2016-04-05 | C213: of:=IF(AND([.B213]>=[Calendario.$F$8];[.B213]<=[Calendario.$F$9];1);1;IF(AND([.B213]>=[Calendario.$F$12];[.B213]<=[Calendario.$F$13]);2;IF(AND([.B213]>=[Calendario.$F$16];[.B213]<=[Calendario.$F$17]);3;""))) -> 3 | D213: of:=IF(COUNTIF([Calendario.$H$4:.$H$48];[.B213])>0;"FIESTA";"") -> FIESTA | E213: of:=IF([.B213]<>"";VLOOKUP(WEEKDAY([.B213];3);[Calendario.$A$4:.$C$11];2);"") -> Martes | F213: of:=IF([.B213]<>"";IF([.D213]<>"FIESTA";VLOOKUP(WEEKDAY([.B213];3);[Calendario.$A$4:.$C$11];3);0);"") -> 0 | G213: of:=IF(ISNUMBER([.F213]);[.F213]+[.G212];"") -> 82 | H213: of:=IF(AND([.G213]<=[Unidades.$G$26];[.G213]<=[Unidades.$F$18];[Unidades.$F$18]>0);[Unidades.$D$18]+1-COUNTIFS([Unidades.$O$3:.$O$17];">="&[.G213]);"") -> 5 | I213: of:=IF([.H212]<>[.H213];"INICIO";IF([.H214]<>[.H213];"FIN";"")) ->  | J213: of:=IF([.K212]<>[.K213];"INICIO";IF([.K214]<>[.K213];"FIN";"")) -> 
A214: of:=IF([.B214]<>"";TODAY()>[.B214];"") -> 0 | B214: of:=IFERROR(IF(AND(ISNUMBER([.B213]);([.B213]+1)<[Calendario.$F$5]);[.B213]+1;"");"") -> 2016-04-06 | C214: of:=IF(AND([.B214]>=[Calendario.$F$8];[.B214]<=[Calendario.$F$9];1);1;IF(AND([.B214]>=[Calendario.$F$12];[.B214]<=[Calendario.$F$13]);2;IF(AND([.B214]>=[Calendario.$F$16];[.B214]<=[Calendario.$F$17]);3;""))) -> 3 | D214: of:=IF(COUNTIF([Calendario.$H$4:.$H$48];[.B214])>0;"FIESTA";"") -> FIESTA | E214: of:=IF([.B214]<>"";VLOOKUP(WEEKDAY([.B214];3);[Calendario.$A$4:.$C$11];2);"") -> Miercoles | F214: of:=IF([.B214]<>"";IF([.D214]<>"FIESTA";VLOOKUP(WEEKDAY([.B214];3);[Calendario.$A$4:.$C$11];3);0);"") -> 0 | G214: of:=IF(ISNUMBER([.F214]);[.F214]+[.G213];"") -> 82 | H214: of:=IF(AND([.G214]<=[Unidades.$G$26];[.G214]<=[Unidades.$F$18];[Unidades.$F$18]>0);[Unidades.$D$18]+1-COUNTIFS([Unidades.$O$3:.$O$17];">="&[.G214]);"") -> 5 | I214: of:=IF([.H213]<>[.H214];"INICIO";IF([.H215]<>[.H214];"FIN";"")) ->  | J214: of:=IF([.K213]<>[.K214];"INICIO";IF([.K215]<>[.K214];"FIN";"")) -> 
A215: of:=IF([.B215]<>"";TODAY()>[.B215];"") -> 0 | B215: of:=IFERROR(IF(AND(ISNUMBER([.B214]);([.B214]+1)<[Calendario.$F$5]);[.B214]+1;"");"") -> 2016-04-07 | C215: of:=IF(AND([.B215]>=[Calendario.$F$8];[.B215]<=[Calendario.$F$9];1);1;IF(AND([.B215]>=[Calendario.$F$12];[.B215]<=[Calendario.$F$13]);2;IF(AND([.B215]>=[Calendario.$F$16];[.B215]<=[Calendario.$F$17]);3;""))) -> 3 | D215: of:=IF(COUNTIF([Calendario.$H$4:.$H$48];[.B215])>0;"FIESTA";"") -> FIESTA | E215: of:=IF([.B215]<>"";VLOOKUP(WEEKDAY([.B215];3);[Calendario.$A$4:.$C$11];2);"") -> Jueves | F215: of:=IF([.B215]<>"";IF([.D215]<>"FIESTA";VLOOKUP(WEEKDAY([.B215];3);[Calendario.$A$4:.$C$11];3);0);"") -> 0 | G215: of:=IF(ISNUMBER([.F215]);[.F215]+[.G214];"") -> 82 | H215: of:=IF(AND([.G215]<=[Unidades.$G$26];[.G215]<=[Unidades.$F$18];[Unidades.$F$18]>0);[Unidades.$D$18]+1-COUNTIFS([Unidades.$O$3:.$O$17];">="&[.G215]);"") -> 5 | I215: of:=IF([.H214]<>[.H215];"INICIO";IF([.H216]<>[.H215];"FIN";"")) ->  | J215: of:=IF([.K214]<>[.K215];"INICIO";IF([.K216]<>[.K215];"FIN";"")) -> 
A216: of:=IF([.B216]<>"";TODAY()>[.B216];"") -> 0 | B216: of:=IFERROR(IF(AND(ISNUMBER([.B215]);([.B215]+1)<[Calendario.$F$5]);[.B215]+1;"");"") -> 2016-04-08 | C216: of:=IF(AND([.B216]>=[Calendario.$F$8];[.B216]<=[Calendario.$F$9];1);1;IF(AND([.B216]>=[Calendario.$F$12];[.B216]<=[Calendario.$F$13]);2;IF(AND([.B216]>=[Calendario.$F$16];[.B216]<=[Calendario.$F$17]);3;""))) -> 3 | D216: of:=IF(COUNTIF([Calendario.$H$4:.$H$48];[.B216])>0;"FIESTA";"") -> FIESTA | E216: of:=IF([.B216]<>"";VLOOKUP(WEEKDAY([.B216];3);[Calendario.$A$4:.$C$11];2);"") -> Viernes | F216: of:=IF([.B216]<>"";IF([.D216]<>"FIESTA";VLOOKUP(WEEKDAY([.B216];3);[Calendario.$A$4:.$C$11];3);0);"") -> 0 | G216: of:=IF(ISNUMBER([.F216]);[.F216]+[.G215];"") -> 82 | H216: of:=IF(AND([.G216]<=[Unidades.$G$26];[.G216]<=[Unidades.$F$18];[Unidades.$F$18]>0);[Unidades.$D$18]+1-COUNTIFS([Unidades.$O$3:.$O$17];">="&[.G216]);"") -> 5 | I216: of:=IF([.H215]<>[.H216];"INICIO";IF([.H217]<>[.H216];"FIN";"")) ->  | J216: of:=IF([.K215]<>[.K216];"INICIO";IF([.K217]<>[.K216];"FIN";"")) -> 
A217: of:=IF([.B217]<>"";TODAY()>[.B217];"") -> 0 | B217: of:=IFERROR(IF(AND(ISNUMBER([.B216]);([.B216]+1)<[Calendario.$F$5]);[.B216]+1;"");"") -> 2016-04-09 | C217: of:=IF(AND([.B217]>=[Calendario.$F$8];[.B217]<=[Calendario.$F$9];1);1;IF(AND([.B217]>=[Calendario.$F$12];[.B217]<=[Calendario.$F$13]);2;IF(AND([.B217]>=[Calendario.$F$16];[.B217]<=[Calendario.$F$17]);3;""))) -> 3 | D217: of:=IF(COUNTIF([Calendario.$H$4:.$H$48];[.B217])>0;"FIESTA";"") -> FIESTA | E217: of:=IF([.B217]<>"";VLOOKUP(WEEKDAY([.B217];3);[Calendario.$A$4:.$C$11];2);"") -> Sabado | F217: of:=IF([.B217]<>"";IF([.D217]<>"FIESTA";VLOOKUP(WEEKDAY([.B217];3);[Calendario.$A$4:.$C$11];3);0);"") -> 0 | G217: of:=IF(ISNUMBER([.F217]);[.F217]+[.G216];"") -> 82 | H217: of:=IF(AND([.G217]<=[Unidades.$G$26];[.G217]<=[Unidades.$F$18];[Unidades.$F$18]>0);[Unidades.$D$18]+1-COUNTIFS([Unidades.$O$3:.$O$17];">="&[.G217]);"") -> 5 | I217: of:=IF([.H216]<>[.H217];"INICIO";IF([.H218]<>[.H217];"FIN";"")) ->  | J217: of:=IF([.K216]<>[.K217];"INICIO";IF([.K218]<>[.K217];"FIN";"")) -> 
A218: of:=IF([.B218]<>"";TODAY()>[.B218];"") -> 0 | B218: of:=IFERROR(IF(AND(ISNUMBER([.B217]);([.B217]+1)<[Calendario.$F$5]);[.B217]+1;"");"") -> 2016-04-10 | C218: of:=IF(AND([.B218]>=[Calendario.$F$8];[.B218]<=[Calendario.$F$9];1);1;IF(AND([.B218]>=[Calendario.$F$12];[.B218]<=[Calendario.$F$13]);2;IF(AND([.B218]>=[Calendario.$F$16];[.B218]<=[Calendario.$F$17]);3;""))) -> 3 | D218: of:=IF(COUNTIF([Calendario.$H$4:.$H$48];[.B218])>0;"FIESTA";"") -> FIESTA | E218: of:=IF([.B218]<>"";VLOOKUP(WEEKDAY([.B218];3);[Calendario.$A$4:.$C$11];2);"") -> Domingo | F218: of:=IF([.B218]<>"";IF([.D218]<>"FIESTA";VLOOKUP(WEEKDAY([.B218];3);[Calendario.$A$4:.$C$11];3);0);"") -> 0 | G218: of:=IF(ISNUMBER([.F218]);[.F218]+[.G217];"") -> 82 | H218: of:=IF(AND([.G218]<=[Unidades.$G$26];[.G218]<=[Unidades.$F$18];[Unidades.$F$18]>0);[Unidades.$D$18]+1-COUNTIFS([Unidades.$O$3:.$O$17];">="&[.G218]);"") -> 5 | I218: of:=IF([.H217]<>[.H218];"INICIO";IF([.H219]<>[.H218];"FIN";"")) ->  | J218: of:=IF([.K217]<>[.K218];"INICIO";IF([.K219]<>[.K218];"FIN";"")) -> 
A219: of:=IF([.B219]<>"";TODAY()>[.B219];"") -> 0 | B219: of:=IFERROR(IF(AND(ISNUMBER([.B218]);([.B218]+1)<[Calendario.$F$5]);[.B218]+1;"");"") -> 2016-04-11 | C219: of:=IF(AND([.B219]>=[Calendario.$F$8];[.B219]<=[Calendario.$F$9];1);1;IF(AND([.B219]>=[Calendario.$F$12];[.B219]<=[Calendario.$F$13]);2;IF(AND([.B219]>=[Calendario.$F$16];[.B219]<=[Calendario.$F$17]);3;""))) -> 3 | D219: of:=IF(COUNTIF([Calendario.$H$4:.$H$48];[.B219])>0;"FIESTA";"") -> FIESTA | E219: of:=IF([.B219]<>"";VLOOKUP(WEEKDAY([.B219];3);[Calendario.$A$4:.$C$11];2);"") -> Lunes | F219: of:=IF([.B219]<>"";IF([.D219]<>"FIESTA";VLOOKUP(WEEKDAY([.B219];3);[Calendario.$A$4:.$C$11];3);0);"") -> 0 | G219: of:=IF(ISNUMBER([.F219]);[.F219]+[.G218];"") -> 82 | H219: of:=IF(AND([.G219]<=[Unidades.$G$26];[.G219]<=[Unidades.$F$18];[Unidades.$F$18]>0);[Unidades.$D$18]+1-COUNTIFS([Unidades.$O$3:.$O$17];">="&[.G219]);"") -> 5 | I219: of:=IF([.H218]<>[.H219];"INICIO";IF([.H220]<>[.H219];"FIN";"")) ->  | J219: of:=IF([.K218]<>[.K219];"INICIO";IF([.K220]<>[.K219];"FIN";"")) -> 
A220: of:=IF([.B220]<>"";TODAY()>[.B220];"") -> 0 | B220: of:=IFERROR(IF(AND(ISNUMBER([.B219]);([.B219]+1)<[Calendario.$F$5]);[.B219]+1;"");"") -> 2016-04-12 | C220: of:=IF(AND([.B220]>=[Calendario.$F$8];[.B220]<=[Calendario.$F$9];1);1;IF(AND([.B220]>=[Calendario.$F$12];[.B220]<=[Calendario.$F$13]);2;IF(AND([.B220]>=[Calendario.$F$16];[.B220]<=[Calendario.$F$17]);3;""))) -> 3 | D220: of:=IF(COUNTIF([Calendario.$H$4:.$H$48];[.B220])>0;"FIESTA";"") -> FIESTA | E220: of:=IF([.B220]<>"";VLOOKUP(WEEKDAY([.B220];3);[Calendario.$A$4:.$C$11];2);"") -> Martes | F220: of:=IF([.B220]<>"";IF([.D220]<>"FIESTA";VLOOKUP(WEEKDAY([.B220];3);[Calendario.$A$4:.$C$11];3);0);"") -> 0 | G220: of:=IF(ISNUMBER([.F220]);[.F220]+[.G219];"") -> 82 | H220: of:=IF(AND([.G220]<=[Unidades.$G$26];[.G220]<=[Unidades.$F$18];[Unidades.$F$18]>0);[Unidades.$D$18]+1-COUNTIFS([Unidades.$O$3:.$O$17];">="&[.G220]);"") -> 5 | I220: of:=IF([.H219]<>[.H220];"INICIO";IF([.H221]<>[.H220];"FIN";"")) ->  | J220: of:=IF([.K219]<>[.K220];"INICIO";IF([.K221]<>[.K220];"FIN";"")) -> 
A221: of:=IF([.B221]<>"";TODAY()>[.B221];"") -> 0 | B221: of:=IFERROR(IF(AND(ISNUMBER([.B220]);([.B220]+1)<[Calendario.$F$5]);[.B220]+1;"");"") -> 2016-04-13 | C221: of:=IF(AND([.B221]>=[Calendario.$F$8];[.B221]<=[Calendario.$F$9];1);1;IF(AND([.B221]>=[Calendario.$F$12];[.B221]<=[Calendario.$F$13]);2;IF(AND([.B221]>=[Calendario.$F$16];[.B221]<=[Calendario.$F$17]);3;""))) -> 3 | D221: of:=IF(COUNTIF([Calendario.$H$4:.$H$48];[.B221])>0;"FIESTA";"") -> FIESTA | E221: of:=IF([.B221]<>"";VLOOKUP(WEEKDAY([.B221];3);[Calendario.$A$4:.$C$11];2);"") -> Miercoles | F221: of:=IF([.B221]<>"";IF([.D221]<>"FIESTA";VLOOKUP(WEEKDAY([.B221];3);[Calendario.$A$4:.$C$11];3);0);"") -> 0 | G221: of:=IF(ISNUMBER([.F221]);[.F221]+[.G220];"") -> 82 | H221: of:=IF(AND([.G221]<=[Unidades.$G$26];[.G221]<=[Unidades.$F$18];[Unidades.$F$18]>0);[Unidades.$D$18]+1-COUNTIFS([Unidades.$O$3:.$O$17];">="&[.G221]);"") -> 5 | I221: of:=IF([.H220]<>[.H221];"INICIO";IF([.H222]<>[.H221];"FIN";"")) ->  | J221: of:=IF([.K220]<>[.K221];"INICIO";IF([.K222]<>[.K221];"FIN";"")) -> 
A222: of:=IF([.B222]<>"";TODAY()>[.B222];"") -> 0 | B222: of:=IFERROR(IF(AND(ISNUMBER([.B221]);([.B221]+1)<[Calendario.$F$5]);[.B221]+1;"");"") -> 2016-04-14 | C222: of:=IF(AND([.B222]>=[Calendario.$F$8];[.B222]<=[Calendario.$F$9];1);1;IF(AND([.B222]>=[Calendario.$F$12];[.B222]<=[Calendario.$F$13]);2;IF(AND([.B222]>=[Calendario.$F$16];[.B222]<=[Calendario.$F$17]);3;""))) -> 3 | D222: of:=IF(COUNTIF([Calendario.$H$4:.$H$48];[.B222])>0;"FIESTA";"") ->  | E222: of:=IF([.B222]<>"";VLOOKUP(WEEKDAY([.B222];3);[Calendario.$A$4:.$C$11];2);"") -> Jueves | F222: of:=IF([.B222]<>"";IF([.D222]<>"FIESTA";VLOOKUP(WEEKDAY([.B222];3);[Calendario.$A$4:.$C$11];3);0);"") -> 0 | G222: of:=IF(ISNUMBER([.F222]);[.F222]+[.G221];"") -> 82 | H222: of:=IF(AND([.G222]<=[Unidades.$G$26];[.G222]<=[Unidades.$F$18];[Unidades.$F$18]>0);[Unidades.$D$18]+1-COUNTIFS([Unidades.$O$3:.$O$17];">="&[.G222]);"") -> 5 | I222: of:=IF([.H221]<>[.H222];"INICIO";IF([.H223]<>[.H222];"FIN";"")) ->  | J222: of:=IF([.K221]<>[.K222];"INICIO";IF([.K223]<>[.K222];"FIN";"")) -> 
A223: of:=IF([.B223]<>"";TODAY()>[.B223];"") -> 0 | B223: of:=IFERROR(IF(AND(ISNUMBER([.B222]);([.B222]+1)<[Calendario.$F$5]);[.B222]+1;"");"") -> 2016-04-15 | C223: of:=IF(AND([.B223]>=[Calendario.$F$8];[.B223]<=[Calendario.$F$9];1);1;IF(AND([.B223]>=[Calendario.$F$12];[.B223]<=[Calendario.$F$13]);2;IF(AND([.B223]>=[Calendario.$F$16];[.B223]<=[Calendario.$F$17]);3;""))) -> 3 | D223: of:=IF(COUNTIF([Calendario.$H$4:.$H$48];[.B223])>0;"FIESTA";"") ->  | E223: of:=IF([.B223]<>"";VLOOKUP(WEEKDAY([.B223];3);[Calendario.$A$4:.$C$11];2);"") -> Viernes | F223: of:=IF([.B223]<>"";IF([.D223]<>"FIESTA";VLOOKUP(WEEKDAY([.B223];3);[Calendario.$A$4:.$C$11];3);0);"") -> 1 | G223: of:=IF(ISNUMBER([.F223]);[.F223]+[.G222];"") -> 83 | H223: of:=IF(AND([.G223]<=[Unidades.$G$26];[.G223]<=[Unidades.$F$18];[Unidades.$F$18]>0);[Unidades.$D$18]+1-COUNTIFS([Unidades.$O$3:.$O$17];">="&[.G223]);"") -> 5 | I223: of:=IF([.H222]<>[.H223];"INICIO";IF([.H224]<>[.H223];"FIN";"")) ->  | J223: of:=IF([.K222]<>[.K223];"INICIO";IF([.K224]<>[.K223];"FIN";"")) -> 
A224: of:=IF([.B224]<>"";TODAY()>[.B224];"") -> 0 | B224: of:=IFERROR(IF(AND(ISNUMBER([.B223]);([.B223]+1)<[Calendario.$F$5]);[.B223]+1;"");"") -> 2016-04-16 | C224: of:=IF(AND([.B224]>=[Calendario.$F$8];[.B224]<=[Calendario.$F$9];1);1;IF(AND([.B224]>=[Calendario.$F$12];[.B224]<=[Calendario.$F$13]);2;IF(AND([.B224]>=[Calendario.$F$16];[.B224]<=[Calendario.$F$17]);3;""))) -> 3 | D224: of:=IF(COUNTIF([Calendario.$H$4:.$H$48];[.B224])>0;"FIESTA";"") ->  | E224: of:=IF([.B224]<>"";VLOOKUP(WEEKDAY([.B224];3);[Calendario.$A$4:.$C$11];2);"") -> Sabado | F224: of:=IF([.B224]<>"";IF([.D224]<>"FIESTA";VLOOKUP(WEEKDAY([.B224];3);[Calendario.$A$4:.$C$11];3);0);"") -> 0 | G224: of:=IF(ISNUMBER([.F224]);[.F224]+[.G223];"") -> 83 | H224: of:=IF(AND([.G224]<=[Unidades.$G$26];[.G224]<=[Unidades.$F$18];[Unidades.$F$18]>0);[Unidades.$D$18]+1-COUNTIFS([Unidades.$O$3:.$O$17];">="&[.G224]);"") -> 5 | I224: of:=IF([.H223]<>[.H224];"INICIO";IF([.H225]<>[.H224];"FIN";"")) ->  | J224: of:=IF([.K223]<>[.K224];"INICIO";IF([.K225]<>[.K224];"FIN";"")) -> 
A225: of:=IF([.B225]<>"";TODAY()>[.B225];"") -> 0 | B225: of:=IFERROR(IF(AND(ISNUMBER([.B224]);([.B224]+1)<[Calendario.$F$5]);[.B224]+1;"");"") -> 2016-04-17 | C225: of:=IF(AND([.B225]>=[Calendario.$F$8];[.B225]<=[Calendario.$F$9];1);1;IF(AND([.B225]>=[Calendario.$F$12];[.B225]<=[Calendario.$F$13]);2;IF(AND([.B225]>=[Calendario.$F$16];[.B225]<=[Calendario.$F$17]);3;""))) -> 3 | D225: of:=IF(COUNTIF([Calendario.$H$4:.$H$48];[.B225])>0;"FIESTA";"") ->  | E225: of:=IF([.B225]<>"";VLOOKUP(WEEKDAY([.B225];3);[Calendario.$A$4:.$C$11];2);"") -> Domingo | F225: of:=IF([.B225]<>"";IF([.D225]<>"FIESTA";VLOOKUP(WEEKDAY([.B225];3);[Calendario.$A$4:.$C$11];3);0);"") -> 0 | G225: of:=IF(ISNUMBER([.F225]);[.F225]+[.G224];"") -> 83 | H225: of:=IF(AND([.G225]<=[Unidades.$G$26];[.G225]<=[Unidades.$F$18];[Unidades.$F$18]>0);[Unidades.$D$18]+1-COUNTIFS([Unidades.$O$3:.$O$17];">="&[.G225]);"") -> 5 | I225: of:=IF([.H224]<>[.H225];"INICIO";IF([.H226]<>[.H225];"FIN";"")) ->  | J225: of:=IF([.K224]<>[.K225];"INICIO";IF([.K226]<>[.K225];"FIN";"")) -> 
A226: of:=IF([.B226]<>"";TODAY()>[.B226];"") -> 0 | B226: of:=IFERROR(IF(AND(ISNUMBER([.B225]);([.B225]+1)<[Calendario.$F$5]);[.B225]+1;"");"") -> 2016-04-18 | C226: of:=IF(AND([.B226]>=[Calendario.$F$8];[.B226]<=[Calendario.$F$9];1);1;IF(AND([.B226]>=[Calendario.$F$12];[.B226]<=[Calendario.$F$13]);2;IF(AND([.B226]>=[Calendario.$F$16];[.B226]<=[Calendario.$F$17]);3;""))) -> 3 | D226: of:=IF(COUNTIF([Calendario.$H$4:.$H$48];[.B226])>0;"FIESTA";"") ->  | E226: of:=IF([.B226]<>"";VLOOKUP(WEEKDAY([.B226];3);[Calendario.$A$4:.$C$11];2);"") -> Lunes | F226: of:=IF([.B226]<>"";IF([.D226]<>"FIESTA";VLOOKUP(WEEKDAY([.B226];3);[Calendario.$A$4:.$C$11];3);0);"") -> 1 | G226: of:=IF(ISNUMBER([.F226]);[.F226]+[.G225];"") -> 84 | H226: of:=IF(AND([.G226]<=[Unidades.$G$26];[.G226]<=[Unidades.$F$18];[Unidades.$F$18]>0);[Unidades.$D$18]+1-COUNTIFS([Unidades.$O$3:.$O$17];">="&[.G226]);"") -> 5 | I226: of:=IF([.H225]<>[.H226];"INICIO";IF([.H227]<>[.H226];"FIN";"")) ->  | J226: of:=IF([.K225]<>[.K226];"INICIO";IF([.K227]<>[.K226];"FIN";"")) -> 
A227: of:=IF([.B227]<>"";TODAY()>[.B227];"") -> 0 | B227: of:=IFERROR(IF(AND(ISNUMBER([.B226]);([.B226]+1)<[Calendario.$F$5]);[.B226]+1;"");"") -> 2016-04-19 | C227: of:=IF(AND([.B227]>=[Calendario.$F$8];[.B227]<=[Calendario.$F$9];1);1;IF(AND([.B227]>=[Calendario.$F$12];[.B227]<=[Calendario.$F$13]);2;IF(AND([.B227]>=[Calendario.$F$16];[.B227]<=[Calendario.$F$17]);3;""))) -> 3 | D227: of:=IF(COUNTIF([Calendario.$H$4:.$H$48];[.B227])>0;"FIESTA";"") ->  | E227: of:=IF([.B227]<>"";VLOOKUP(WEEKDAY([.B227];3);[Calendario.$A$4:.$C$11];2);"") -> Martes | F227: of:=IF([.B227]<>"";IF([.D227]<>"FIESTA";VLOOKUP(WEEKDAY([.B227];3);[Calendario.$A$4:.$C$11];3);0);"") -> 0 | G227: of:=IF(ISNUMBER([.F227]);[.F227]+[.G226];"") -> 84 | H227: of:=IF(AND([.G227]<=[Unidades.$G$26];[.G227]<=[Unidades.$F$18];[Unidades.$F$18]>0);[Unidades.$D$18]+1-COUNTIFS([Unidades.$O$3:.$O$17];">="&[.G227]);"") -> 5 | I227: of:=IF([.H226]<>[.H227];"INICIO";IF([.H228]<>[.H227];"FIN";"")) ->  | J227: of:=IF([.K226]<>[.K227];"INICIO";IF([.K228]<>[.K227];"FIN";"")) -> 
A228: of:=IF([.B228]<>"";TODAY()>[.B228];"") -> 0 | B228: of:=IFERROR(IF(AND(ISNUMBER([.B227]);([.B227]+1)<[Calendario.$F$5]);[.B227]+1;"");"") -> 2016-04-20 | C228: of:=IF(AND([.B228]>=[Calendario.$F$8];[.B228]<=[Calendario.$F$9];1);1;IF(AND([.B228]>=[Calendario.$F$12];[.B228]<=[Calendario.$F$13]);2;IF(AND([.B228]>=[Calendario.$F$16];[.B228]<=[Calendario.$F$17]);3;""))) -> 3 | D228: of:=IF(COUNTIF([Calendario.$H$4:.$H$48];[.B228])>0;"FIESTA";"") ->  | E228: of:=IF([.B228]<>"";VLOOKUP(WEEKDAY([.B228];3);[Calendario.$A$4:.$C$11];2);"") -> Miercoles | F228: of:=IF([.B228]<>"";IF([.D228]<>"FIESTA";VLOOKUP(WEEKDAY([.B228];3);[Calendario.$A$4:.$C$11];3);0);"") -> 1 | G228: of:=IF(ISNUMBER([.F228]);[.F228]+[.G227];"") -> 85 | H228: of:=IF(AND([.G228]<=[Unidades.$G$26];[.G228]<=[Unidades.$F$18];[Unidades.$F$18]>0);[Unidades.$D$18]+1-COUNTIFS([Unidades.$O$3:.$O$17];">="&[.G228]);"") -> 5 | I228: of:=IF([.H227]<>[.H228];"INICIO";IF([.H229]<>[.H228];"FIN";"")) ->  | J228: of:=IF([.K227]<>[.K228];"INICIO";IF([.K229]<>[.K228];"FIN";"")) -> 
A229: of:=IF([.B229]<>"";TODAY()>[.B229];"") -> 0 | B229: of:=IFERROR(IF(AND(ISNUMBER([.B228]);([.B228]+1)<[Calendario.$F$5]);[.B228]+1;"");"") -> 2016-04-21 | C229: of:=IF(AND([.B229]>=[Calendario.$F$8];[.B229]<=[Calendario.$F$9];1);1;IF(AND([.B229]>=[Calendario.$F$12];[.B229]<=[Calendario.$F$13]);2;IF(AND([.B229]>=[Calendario.$F$16];[.B229]<=[Calendario.$F$17]);3;""))) -> 3 | D229: of:=IF(COUNTIF([Calendario.$H$4:.$H$48];[.B229])>0;"FIESTA";"") ->  | E229: of:=IF([.B229]<>"";VLOOKUP(WEEKDAY([.B229];3);[Calendario.$A$4:.$C$11];2);"") -> Jueves | F229: of:=IF([.B229]<>"";IF([.D229]<>"FIESTA";VLOOKUP(WEEKDAY([.B229];3);[Calendario.$A$4:.$C$11];3);0);"") -> 0 | G229: of:=IF(ISNUMBER([.F229]);[.F229]+[.G228];"") -> 85 | H229: of:=IF(AND([.G229]<=[Unidades.$G$26];[.G229]<=[Unidades.$F$18];[Unidades.$F$18]>0);[Unidades.$D$18]+1-COUNTIFS([Unidades.$O$3:.$O$17];">="&[.G229]);"") -> 5 | I229: of:=IF([.H228]<>[.H229];"INICIO";IF([.H230]<>[.H229];"FIN";"")) ->  | J229: of:=IF([.K228]<>[.K229];"INICIO";IF([.K230]<>[.K229];"FIN";"")) -> 
A230: of:=IF([.B230]<>"";TODAY()>[.B230];"") -> 0 | B230: of:=IFERROR(IF(AND(ISNUMBER([.B229]);([.B229]+1)<[Calendario.$F$5]);[.B229]+1;"");"") -> 2016-04-22 | C230: of:=IF(AND([.B230]>=[Calendario.$F$8];[.B230]<=[Calendario.$F$9];1);1;IF(AND([.B230]>=[Calendario.$F$12];[.B230]<=[Calendario.$F$13]);2;IF(AND([.B230]>=[Calendario.$F$16];[.B230]<=[Calendario.$F$17]);3;""))) -> 3 | D230: of:=IF(COUNTIF([Calendario.$H$4:.$H$48];[.B230])>0;"FIESTA";"") ->  | E230: of:=IF([.B230]<>"";VLOOKUP(WEEKDAY([.B230];3);[Calendario.$A$4:.$C$11];2);"") -> Viernes | F230: of:=IF([.B230]<>"";IF([.D230]<>"FIESTA";VLOOKUP(WEEKDAY([.B230];3);[Calendario.$A$4:.$C$11];3);0);"") -> 1 | G230: of:=IF(ISNUMBER([.F230]);[.F230]+[.G229];"") -> 86 | H230: of:=IF(AND([.G230]<=[Unidades.$G$26];[.G230]<=[Unidades.$F$18];[Unidades.$F$18]>0);[Unidades.$D$18]+1-COUNTIFS([Unidades.$O$3:.$O$17];">="&[.G230]);"") -> 5 | I230: of:=IF([.H229]<>[.H230];"INICIO";IF([.H231]<>[.H230];"FIN";"")) ->  | J230: of:=IF([.K229]<>[.K230];"INICIO";IF([.K231]<>[.K230];"FIN";"")) -> 
A231: of:=IF([.B231]<>"";TODAY()>[.B231];"") -> 0 | B231: of:=IFERROR(IF(AND(ISNUMBER([.B230]);([.B230]+1)<[Calendario.$F$5]);[.B230]+1;"");"") -> 2016-04-23 | C231: of:=IF(AND([.B231]>=[Calendario.$F$8];[.B231]<=[Calendario.$F$9];1);1;IF(AND([.B231]>=[Calendario.$F$12];[.B231]<=[Calendario.$F$13]);2;IF(AND([.B231]>=[Calendario.$F$16];[.B231]<=[Calendario.$F$17]);3;""))) -> 3 | D231: of:=IF(COUNTIF([Calendario.$H$4:.$H$48];[.B231])>0;"FIESTA";"") ->  | E231: of:=IF([.B231]<>"";VLOOKUP(WEEKDAY([.B231];3);[Calendario.$A$4:.$C$11];2);"") -> Sabado | F231: of:=IF([.B231]<>"";IF([.D231]<>"FIESTA";VLOOKUP(WEEKDAY([.B231];3);[Calendario.$A$4:.$C$11];3);0);"") -> 0 | G231: of:=IF(ISNUMBER([.F231]);[.F231]+[.G230];"") -> 86 | H231: of:=IF(AND([.G231]<=[Unidades.$G$26];[.G231]<=[Unidades.$F$18];[Unidades.$F$18]>0);[Unidades.$D$18]+1-COUNTIFS([Unidades.$O$3:.$O$17];">="&[.G231]);"") -> 5 | I231: of:=IF([.H230]<>[.H231];"INICIO";IF([.H232]<>[.H231];"FIN";"")) ->  | J231: of:=IF([.K230]<>[.K231];"INICIO";IF([.K232]<>[.K231];"FIN";"")) -> 
A232: of:=IF([.B232]<>"";TODAY()>[.B232];"") -> 0 | B232: of:=IFERROR(IF(AND(ISNUMBER([.B231]);([.B231]+1)<[Calendario.$F$5]);[.B231]+1;"");"") -> 2016-04-24 | C232: of:=IF(AND([.B232]>=[Calendario.$F$8];[.B232]<=[Calendario.$F$9];1);1;IF(AND([.B232]>=[Calendario.$F$12];[.B232]<=[Calendario.$F$13]);2;IF(AND([.B232]>=[Calendario.$F$16];[.B232]<=[Calendario.$F$17]);3;""))) -> 3 | D232: of:=IF(COUNTIF([Calendario.$H$4:.$H$48];[.B232])>0;"FIESTA";"") ->  | E232: of:=IF([.B232]<>"";VLOOKUP(WEEKDAY([.B232];3);[Calendario.$A$4:.$C$11];2);"") -> Domingo | F232: of:=IF([.B232]<>"";IF([.D232]<>"FIESTA";VLOOKUP(WEEKDAY([.B232];3);[Calendario.$A$4:.$C$11];3);0);"") -> 0 | G232: of:=IF(ISNUMBER([.F232]);[.F232]+[.G231];"") -> 86 | H232: of:=IF(AND([.G232]<=[Unidades.$G$26];[.G232]<=[Unidades.$F$18];[Unidades.$F$18]>0);[Unidades.$D$18]+1-COUNTIFS([Unidades.$O$3:.$O$17];">="&[.G232]);"") -> 5 | I232: of:=IF([.H231]<>[.H232];"INICIO";IF([.H233]<>[.H232];"FIN";"")) ->  | J232: of:=IF([.K231]<>[.K232];"INICIO";IF([.K233]<>[.K232];"FIN";"")) -> 
A233: of:=IF([.B233]<>"";TODAY()>[.B233];"") -> 0 | B233: of:=IFERROR(IF(AND(ISNUMBER([.B232]);([.B232]+1)<[Calendario.$F$5]);[.B232]+1;"");"") -> 2016-04-25 | C233: of:=IF(AND([.B233]>=[Calendario.$F$8];[.B233]<=[Calendario.$F$9];1);1;IF(AND([.B233]>=[Calendario.$F$12];[.B233]<=[Calendario.$F$13]);2;IF(AND([.B233]>=[Calendario.$F$16];[.B233]<=[Calendario.$F$17]);3;""))) -> 3 | D233: of:=IF(COUNTIF([Calendario.$H$4:.$H$48];[.B233])>0;"FIESTA";"") ->  | E233: of:=IF([.B233]<>"";VLOOKUP(WEEKDAY([.B233];3);[Calendario.$A$4:.$C$11];2);"") -> Lunes | F233: of:=IF([.B233]<>"";IF([.D233]<>"FIESTA";VLOOKUP(WEEKDAY([.B233];3);[Calendario.$A$4:.$C$11];3);0);"") -> 1 | G233: of:=IF(ISNUMBER([.F233]);[.F233]+[.G232];"") -> 87 | H233: of:=IF(AND([.G233]<=[Unidades.$G$26];[.G233]<=[Unidades.$F$18];[Unidades.$F$18]>0);[Unidades.$D$18]+1-COUNTIFS([Unidades.$O$3:.$O$17];">="&[.G233]);"") -> 5 | I233: of:=IF([.H232]<>[.H233];"INICIO";IF([.H234]<>[.H233];"FIN";"")) ->  | J233: of:=IF([.K232]<>[.K233];"INICIO";IF([.K234]<>[.K233];"FIN";"")) -> 
A234: of:=IF([.B234]<>"";TODAY()>[.B234];"") -> 0 | B234: of:=IFERROR(IF(AND(ISNUMBER([.B233]);([.B233]+1)<[Calendario.$F$5]);[.B233]+1;"");"") -> 2016-04-26 | C234: of:=IF(AND([.B234]>=[Calendario.$F$8];[.B234]<=[Calendario.$F$9];1);1;IF(AND([.B234]>=[Calendario.$F$12];[.B234]<=[Calendario.$F$13]);2;IF(AND([.B234]>=[Calendario.$F$16];[.B234]<=[Calendario.$F$17]);3;""))) -> 3 | D234: of:=IF(COUNTIF([Calendario.$H$4:.$H$48];[.B234])>0;"FIESTA";"") ->  | E234: of:=IF([.B234]<>"";VLOOKUP(WEEKDAY([.B234];3);[Calendario.$A$4:.$C$11];2);"") -> Martes | F234: of:=IF([.B234]<>"";IF([.D234]<>"FIESTA";VLOOKUP(WEEKDAY([.B234];3);[Calendario.$A$4:.$C$11];3);0);"") -> 0 | G234: of:=IF(ISNUMBER([.F234]);[.F234]+[.G233];"") -> 87 | H234: of:=IF(AND([.G234]<=[Unidades.$G$26];[.G234]<=[Unidades.$F$18];[Unidades.$F$18]>0);[Unidades.$D$18]+1-COUNTIFS([Unidades.$O$3:.$O$17];">="&[.G234]);"") -> 5 | I234: of:=IF([.H233]<>[.H234];"INICIO";IF([.H235]<>[.H234];"FIN";"")) ->  | J234: of:=IF([.K233]<>[.K234];"INICIO";IF([.K235]<>[.K234];"FIN";"")) -> 
A235: of:=IF([.B235]<>"";TODAY()>[.B235];"") -> 0 | B235: of:=IFERROR(IF(AND(ISNUMBER([.B234]);([.B234]+1)<[Calendario.$F$5]);[.B234]+1;"");"") -> 2016-04-27 | C235: of:=IF(AND([.B235]>=[Calendario.$F$8];[.B235]<=[Calendario.$F$9];1);1;IF(AND([.B235]>=[Calendario.$F$12];[.B235]<=[Calendario.$F$13]);2;IF(AND([.B235]>=[Calendario.$F$16];[.B235]<=[Calendario.$F$17]);3;""))) -> 3 | D235: of:=IF(COUNTIF([Calendario.$H$4:.$H$48];[.B235])>0;"FIESTA";"") ->  | E235: of:=IF([.B235]<>"";VLOOKUP(WEEKDAY([.B235];3);[Calendario.$A$4:.$C$11];2);"") -> Miercoles | F235: of:=IF([.B235]<>"";IF([.D235]<>"FIESTA";VLOOKUP(WEEKDAY([.B235];3);[Calendario.$A$4:.$C$11];3);0);"") -> 1 | G235: of:=IF(ISNUMBER([.F235]);[.F235]+[.G234];"") -> 88 | H235: of:=IF(AND([.G235]<=[Unidades.$G$26];[.G235]<=[Unidades.$F$18];[Unidades.$F$18]>0);[Unidades.$D$18]+1-COUNTIFS([Unidades.$O$3:.$O$17];">="&[.G235]);"") -> 5 | I235: of:=IF([.H234]<>[.H235];"INICIO";IF([.H236]<>[.H235];"FIN";"")) ->  | J235: of:=IF([.K234]<>[.K235];"INICIO";IF([.K236]<>[.K235];"FIN";"")) -> 
A236: of:=IF([.B236]<>"";TODAY()>[.B236];"") -> 0 | B236: of:=IFERROR(IF(AND(ISNUMBER([.B235]);([.B235]+1)<[Calendario.$F$5]);[.B235]+1;"");"") -> 2016-04-28 | C236: of:=IF(AND([.B236]>=[Calendario.$F$8];[.B236]<=[Calendario.$F$9];1);1;IF(AND([.B236]>=[Calendario.$F$12];[.B236]<=[Calendario.$F$13]);2;IF(AND([.B236]>=[Calendario.$F$16];[.B236]<=[Calendario.$F$17]);3;""))) -> 3 | D236: of:=IF(COUNTIF([Calendario.$H$4:.$H$48];[.B236])>0;"FIESTA";"") ->  | E236: of:=IF([.B236]<>"";VLOOKUP(WEEKDAY([.B236];3);[Calendario.$A$4:.$C$11];2);"") -> Jueves | F236: of:=IF([.B236]<>"";IF([.D236]<>"FIESTA";VLOOKUP(WEEKDAY([.B236];3);[Calendario.$A$4:.$C$11];3);0);"") -> 0 | G236: of:=IF(ISNUMBER([.F236]);[.F236]+[.G235];"") -> 88 | H236: of:=IF(AND([.G236]<=[Unidades.$G$26];[.G236]<=[Unidades.$F$18];[Unidades.$F$18]>0);[Unidades.$D$18]+1-COUNTIFS([Unidades.$O$3:.$O$17];">="&[.G236]);"") -> 5 | I236: of:=IF([.H235]<>[.H236];"INICIO";IF([.H237]<>[.H236];"FIN";"")) ->  | J236: of:=IF([.K235]<>[.K236];"INICIO";IF([.K237]<>[.K236];"FIN";"")) -> 
A237: of:=IF([.B237]<>"";TODAY()>[.B237];"") -> 0 | B237: of:=IFERROR(IF(AND(ISNUMBER([.B236]);([.B236]+1)<[Calendario.$F$5]);[.B236]+1;"");"") -> 2016-04-29 | C237: of:=IF(AND([.B237]>=[Calendario.$F$8];[.B237]<=[Calendario.$F$9];1);1;IF(AND([.B237]>=[Calendario.$F$12];[.B237]<=[Calendario.$F$13]);2;IF(AND([.B237]>=[Calendario.$F$16];[.B237]<=[Calendario.$F$17]);3;""))) -> 3 | D237: of:=IF(COUNTIF([Calendario.$H$4:.$H$48];[.B237])>0;"FIESTA";"") ->  | E237: of:=IF([.B237]<>"";VLOOKUP(WEEKDAY([.B237];3);[Calendario.$A$4:.$C$11];2);"") -> Viernes | F237: of:=IF([.B237]<>"";IF([.D237]<>"FIESTA";VLOOKUP(WEEKDAY([.B237];3);[Calendario.$A$4:.$C$11];3);0);"") -> 1 | G237: of:=IF(ISNUMBER([.F237]);[.F237]+[.G236];"") -> 89 | H237: of:=IF(AND([.G237]<=[Unidades.$G$26];[.G237]<=[Unidades.$F$18];[Unidades.$F$18]>0);[Unidades.$D$18]+1-COUNTIFS([Unidades.$O$3:.$O$17];">="&[.G237]);"") -> 5 | I237: of:=IF([.H236]<>[.H237];"INICIO";IF([.H238]<>[.H237];"FIN";"")) ->  | J237: of:=IF([.K236]<>[.K237];"INICIO";IF([.K238]<>[.K237];"FIN";"")) -> 
A238: of:=IF([.B238]<>"";TODAY()>[.B238];"") -> 0 | B238: of:=IFERROR(IF(AND(ISNUMBER([.B237]);([.B237]+1)<[Calendario.$F$5]);[.B237]+1;"");"") -> 2016-04-30 | C238: of:=IF(AND([.B238]>=[Calendario.$F$8];[.B238]<=[Calendario.$F$9];1);1;IF(AND([.B238]>=[Calendario.$F$12];[.B238]<=[Calendario.$F$13]);2;IF(AND([.B238]>=[Calendario.$F$16];[.B238]<=[Calendario.$F$17]);3;""))) -> 3 | D238: of:=IF(COUNTIF([Calendario.$H$4:.$H$48];[.B238])>0;"FIESTA";"") ->  | E238: of:=IF([.B238]<>"";VLOOKUP(WEEKDAY([.B238];3);[Calendario.$A$4:.$C$11];2);"") -> Sabado | F238: of:=IF([.B238]<>"";IF([.D238]<>"FIESTA";VLOOKUP(WEEKDAY([.B238];3);[Calendario.$A$4:.$C$11];3);0);"") -> 0 | G238: of:=IF(ISNUMBER([.F238]);[.F238]+[.G237];"") -> 89 | H238: of:=IF(AND([.G238]<=[Unidades.$G$26];[.G238]<=[Unidades.$F$18];[Unidades.$F$18]>0);[Unidades.$D$18]+1-COUNTIFS([Unidades.$O$3:.$O$17];">="&[.G238]);"") -> 5 | I238: of:=IF([.H237]<>[.H238];"INICIO";IF([.H239]<>[.H238];"FIN";"")) ->  | J238: of:=IF([.K237]<>[.K238];"INICIO";IF([.K239]<>[.K238];"FIN";"")) -> 
A239: of:=IF([.B239]<>"";TODAY()>[.B239];"") -> 0 | B239: of:=IFERROR(IF(AND(ISNUMBER([.B238]);([.B238]+1)<[Calendario.$F$5]);[.B238]+1;"");"") -> 2016-05-01 | C239: of:=IF(AND([.B239]>=[Calendario.$F$8];[.B239]<=[Calendario.$F$9];1);1;IF(AND([.B239]>=[Calendario.$F$12];[.B239]<=[Calendario.$F$13]);2;IF(AND([.B239]>=[Calendario.$F$16];[.B239]<=[Calendario.$F$17]);3;""))) -> 3 | D239: of:=IF(COUNTIF([Calendario.$H$4:.$H$48];[.B239])>0;"FIESTA";"") -> FIESTA | E239: of:=IF([.B239]<>"";VLOOKUP(WEEKDAY([.B239];3);[Calendario.$A$4:.$C$11];2);"") -> Domingo | F239: of:=IF([.B239]<>"";IF([.D239]<>"FIESTA";VLOOKUP(WEEKDAY([.B239];3);[Calendario.$A$4:.$C$11];3);0);"") -> 0 | G239: of:=IF(ISNUMBER([.F239]);[.F239]+[.G238];"") -> 89 | H239: of:=IF(AND([.G239]<=[Unidades.$G$26];[.G239]<=[Unidades.$F$18];[Unidades.$F$18]>0);[Unidades.$D$18]+1-COUNTIFS([Unidades.$O$3:.$O$17];">="&[.G239]);"") -> 5 | I239: of:=IF([.H238]<>[.H239];"INICIO";IF([.H240]<>[.H239];"FIN";"")) ->  | J239: of:=IF([.K238]<>[.K239];"INICIO";IF([.K240]<>[.K239];"FIN";"")) -> 
A240: of:=IF([.B240]<>"";TODAY()>[.B240];"") -> 0 | B240: of:=IFERROR(IF(AND(ISNUMBER([.B239]);([.B239]+1)<[Calendario.$F$5]);[.B239]+1;"");"") -> 2016-05-02 | C240: of:=IF(AND([.B240]>=[Calendario.$F$8];[.B240]<=[Calendario.$F$9];1);1;IF(AND([.B240]>=[Calendario.$F$12];[.B240]<=[Calendario.$F$13]);2;IF(AND([.B240]>=[Calendario.$F$16];[.B240]<=[Calendario.$F$17]);3;""))) -> 3 | D240: of:=IF(COUNTIF([Calendario.$H$4:.$H$48];[.B240])>0;"FIESTA";"") ->  | E240: of:=IF([.B240]<>"";VLOOKUP(WEEKDAY([.B240];3);[Calendario.$A$4:.$C$11];2);"") -> Lunes | F240: of:=IF([.B240]<>"";IF([.D240]<>"FIESTA";VLOOKUP(WEEKDAY([.B240];3);[Calendario.$A$4:.$C$11];3);0);"") -> 1 | G240: of:=IF(ISNUMBER([.F240]);[.F240]+[.G239];"") -> 90 | H240: of:=IF(AND([.G240]<=[Unidades.$G$26];[.G240]<=[Unidades.$F$18];[Unidades.$F$18]>0);[Unidades.$D$18]+1-COUNTIFS([Unidades.$O$3:.$O$17];">="&[.G240]);"") -> 5 | I240: of:=IF([.H239]<>[.H240];"INICIO";IF([.H241]<>[.H240];"FIN";"")) ->  | J240: of:=IF([.K239]<>[.K240];"INICIO";IF([.K241]<>[.K240];"FIN";"")) -> 
A241: of:=IF([.B241]<>"";TODAY()>[.B241];"") -> 0 | B241: of:=IFERROR(IF(AND(ISNUMBER([.B240]);([.B240]+1)<[Calendario.$F$5]);[.B240]+1;"");"") -> 2016-05-03 | C241: of:=IF(AND([.B241]>=[Calendario.$F$8];[.B241]<=[Calendario.$F$9];1);1;IF(AND([.B241]>=[Calendario.$F$12];[.B241]<=[Calendario.$F$13]);2;IF(AND([.B241]>=[Calendario.$F$16];[.B241]<=[Calendario.$F$17]);3;""))) -> 3 | D241: of:=IF(COUNTIF([Calendario.$H$4:.$H$48];[.B241])>0;"FIESTA";"") ->  | E241: of:=IF([.B241]<>"";VLOOKUP(WEEKDAY([.B241];3);[Calendario.$A$4:.$C$11];2);"") -> Martes | F241: of:=IF([.B241]<>"";IF([.D241]<>"FIESTA";VLOOKUP(WEEKDAY([.B241];3);[Calendario.$A$4:.$C$11];3);0);"") -> 0 | G241: of:=IF(ISNUMBER([.F241]);[.F241]+[.G240];"") -> 90 | H241: of:=IF(AND([.G241]<=[Unidades.$G$26];[.G241]<=[Unidades.$F$18];[Unidades.$F$18]>0);[Unidades.$D$18]+1-COUNTIFS([Unidades.$O$3:.$O$17];">="&[.G241]);"") -> 5 | I241: of:=IF([.H240]<>[.H241];"INICIO";IF([.H242]<>[.H241];"FIN";"")) ->  | J241: of:=IF([.K240]<>[.K241];"INICIO";IF([.K242]<>[.K241];"FIN";"")) -> 
A242: of:=IF([.B242]<>"";TODAY()>[.B242];"") -> 0 | B242: of:=IFERROR(IF(AND(ISNUMBER([.B241]);([.B241]+1)<[Calendario.$F$5]);[.B241]+1;"");"") -> 2016-05-04 | C242: of:=IF(AND([.B242]>=[Calendario.$F$8];[.B242]<=[Calendario.$F$9];1);1;IF(AND([.B242]>=[Calendario.$F$12];[.B242]<=[Calendario.$F$13]);2;IF(AND([.B242]>=[Calendario.$F$16];[.B242]<=[Calendario.$F$17]);3;""))) -> 3 | D242: of:=IF(COUNTIF([Calendario.$H$4:.$H$48];[.B242])>0;"FIESTA";"") ->  | E242: of:=IF([.B242]<>"";VLOOKUP(WEEKDAY([.B242];3);[Calendario.$A$4:.$C$11];2);"") -> Miercoles | F242: of:=IF([.B242]<>"";IF([.D242]<>"FIESTA";VLOOKUP(WEEKDAY([.B242];3);[Calendario.$A$4:.$C$11];3);0);"") -> 1 | G242: of:=IF(ISNUMBER([.F242]);[.F242]+[.G241];"") -> 91 | H242: of:=IF(AND([.G242]<=[Unidades.$G$26];[.G242]<=[Unidades.$F$18];[Unidades.$F$18]>0);[Unidades.$D$18]+1-COUNTIFS([Unidades.$O$3:.$O$17];">="&[.G242]);"") -> 5 | I242: of:=IF([.H241]<>[.H242];"INICIO";IF([.H243]<>[.H242];"FIN";"")) ->  | J242: of:=IF([.K241]<>[.K242];"INICIO";IF([.K243]<>[.K242];"FIN";"")) -> 
A243: of:=IF([.B243]<>"";TODAY()>[.B243];"") -> 0 | B243: of:=IFERROR(IF(AND(ISNUMBER([.B242]);([.B242]+1)<[Calendario.$F$5]);[.B242]+1;"");"") -> 2016-05-05 | C243: of:=IF(AND([.B243]>=[Calendario.$F$8];[.B243]<=[Calendario.$F$9];1);1;IF(AND([.B243]>=[Calendario.$F$12];[.B243]<=[Calendario.$F$13]);2;IF(AND([.B243]>=[Calendario.$F$16];[.B243]<=[Calendario.$F$17]);3;""))) -> 3 | D243: of:=IF(COUNTIF([Calendario.$H$4:.$H$48];[.B243])>0;"FIESTA";"") ->  | E243: of:=IF([.B243]<>"";VLOOKUP(WEEKDAY([.B243];3);[Calendario.$A$4:.$C$11];2);"") -> Jueves | F243: of:=IF([.B243]<>"";IF([.D243]<>"FIESTA";VLOOKUP(WEEKDAY([.B243];3);[Calendario.$A$4:.$C$11];3);0);"") -> 0 | G243: of:=IF(ISNUMBER([.F243]);[.F243]+[.G242];"") -> 91 | H243: of:=IF(AND([.G243]<=[Unidades.$G$26];[.G243]<=[Unidades.$F$18];[Unidades.$F$18]>0);[Unidades.$D$18]+1-COUNTIFS([Unidades.$O$3:.$O$17];">="&[.G243]);"") -> 5 | I243: of:=IF([.H242]<>[.H243];"INICIO";IF([.H244]<>[.H243];"FIN";"")) ->  | J243: of:=IF([.K242]<>[.K243];"INICIO";IF([.K244]<>[.K243];"FIN";"")) -> 
A244: of:=IF([.B244]<>"";TODAY()>[.B244];"") -> 0 | B244: of:=IFERROR(IF(AND(ISNUMBER([.B243]);([.B243]+1)<[Calendario.$F$5]);[.B243]+1;"");"") -> 2016-05-06 | C244: of:=IF(AND([.B244]>=[Calendario.$F$8];[.B244]<=[Calendario.$F$9];1);1;IF(AND([.B244]>=[Calendario.$F$12];[.B244]<=[Calendario.$F$13]);2;IF(AND([.B244]>=[Calendario.$F$16];[.B244]<=[Calendario.$F$17]);3;""))) -> 3 | D244: of:=IF(COUNTIF([Calendario.$H$4:.$H$48];[.B244])>0;"FIESTA";"") ->  | E244: of:=IF([.B244]<>"";VLOOKUP(WEEKDAY([.B244];3);[Calendario.$A$4:.$C$11];2);"") -> Viernes | F244: of:=IF([.B244]<>"";IF([.D244]<>"FIESTA";VLOOKUP(WEEKDAY([.B244];3);[Calendario.$A$4:.$C$11];3);0);"") -> 1 | G244: of:=IF(ISNUMBER([.F244]);[.F244]+[.G243];"") -> 92 | H244: of:=IF(AND([.G244]<=[Unidades.$G$26];[.G244]<=[Unidades.$F$18];[Unidades.$F$18]>0);[Unidades.$D$18]+1-COUNTIFS([Unidades.$O$3:.$O$17];">="&[.G244]);"") -> 5 | I244: of:=IF([.H243]<>[.H244];"INICIO";IF([.H245]<>[.H244];"FIN";"")) ->  | J244: of:=IF([.K243]<>[.K244];"INICIO";IF([.K245]<>[.K244];"FIN";"")) -> 
A245: of:=IF([.B245]<>"";TODAY()>[.B245];"") -> 0 | B245: of:=IFERROR(IF(AND(ISNUMBER([.B244]);([.B244]+1)<[Calendario.$F$5]);[.B244]+1;"");"") -> 2016-05-07 | C245: of:=IF(AND([.B245]>=[Calendario.$F$8];[.B245]<=[Calendario.$F$9];1);1;IF(AND([.B245]>=[Calendario.$F$12];[.B245]<=[Calendario.$F$13]);2;IF(AND([.B245]>=[Calendario.$F$16];[.B245]<=[Calendario.$F$17]);3;""))) -> 3 | D245: of:=IF(COUNTIF([Calendario.$H$4:.$H$48];[.B245])>0;"FIESTA";"") ->  | E245: of:=IF([.B245]<>"";VLOOKUP(WEEKDAY([.B245];3);[Calendario.$A$4:.$C$11];2);"") -> Sabado | F245: of:=IF([.B245]<>"";IF([.D245]<>"FIESTA";VLOOKUP(WEEKDAY([.B245];3);[Calendario.$A$4:.$C$11];3);0);"") -> 0 | G245: of:=IF(ISNUMBER([.F245]);[.F245]+[.G244];"") -> 92 | H245: of:=IF(AND([.G245]<=[Unidades.$G$26];[.G245]<=[Unidades.$F$18];[Unidades.$F$18]>0);[Unidades.$D$18]+1-COUNTIFS([Unidades.$O$3:.$O$17];">="&[.G245]);"") -> 5 | I245: of:=IF([.H244]<>[.H245];"INICIO";IF([.H246]<>[.H245];"FIN";"")) ->  | J245: of:=IF([.K244]<>[.K245];"INICIO";IF([.K246]<>[.K245];"FIN";"")) -> 
A246: of:=IF([.B246]<>"";TODAY()>[.B246];"") -> 0 | B246: of:=IFERROR(IF(AND(ISNUMBER([.B245]);([.B245]+1)<[Calendario.$F$5]);[.B245]+1;"");"") -> 2016-05-08 | C246: of:=IF(AND([.B246]>=[Calendario.$F$8];[.B246]<=[Calendario.$F$9];1);1;IF(AND([.B246]>=[Calendario.$F$12];[.B246]<=[Calendario.$F$13]);2;IF(AND([.B246]>=[Calendario.$F$16];[.B246]<=[Calendario.$F$17]);3;""))) -> 3 | D246: of:=IF(COUNTIF([Calendario.$H$4:.$H$48];[.B246])>0;"FIESTA";"") ->  | E246: of:=IF([.B246]<>"";VLOOKUP(WEEKDAY([.B246];3);[Calendario.$A$4:.$C$11];2);"") -> Domingo | F246: of:=IF([.B246]<>"";IF([.D246]<>"FIESTA";VLOOKUP(WEEKDAY([.B246];3);[Calendario.$A$4:.$C$11];3);0);"") -> 0 | G246: of:=IF(ISNUMBER([.F246]);[.F246]+[.G245];"") -> 92 | H246: of:=IF(AND([.G246]<=[Unidades.$G$26];[.G246]<=[Unidades.$F$18];[Unidades.$F$18]>0);[Unidades.$D$18]+1-COUNTIFS([Unidades.$O$3:.$O$17];">="&[.G246]);"") -> 5 | I246: of:=IF([.H245]<>[.H246];"INICIO";IF([.H247]<>[.H246];"FIN";"")) ->  | J246: of:=IF([.K245]<>[.K246];"INICIO";IF([.K247]<>[.K246];"FIN";"")) -> 
A247: of:=IF([.B247]<>"";TODAY()>[.B247];"") -> 0 | B247: of:=IFERROR(IF(AND(ISNUMBER([.B246]);([.B246]+1)<[Calendario.$F$5]);[.B246]+1;"");"") -> 2016-05-09 | C247: of:=IF(AND([.B247]>=[Calendario.$F$8];[.B247]<=[Calendario.$F$9];1);1;IF(AND([.B247]>=[Calendario.$F$12];[.B247]<=[Calendario.$F$13]);2;IF(AND([.B247]>=[Calendario.$F$16];[.B247]<=[Calendario.$F$17]);3;""))) -> 3 | D247: of:=IF(COUNTIF([Calendario.$H$4:.$H$48];[.B247])>0;"FIESTA";"") ->  | E247: of:=IF([.B247]<>"";VLOOKUP(WEEKDAY([.B247];3);[Calendario.$A$4:.$C$11];2);"") -> Lunes | F247: of:=IF([.B247]<>"";IF([.D247]<>"FIESTA";VLOOKUP(WEEKDAY([.B247];3);[Calendario.$A$4:.$C$11];3);0);"") -> 1 | G247: of:=IF(ISNUMBER([.F247]);[.F247]+[.G246];"") -> 93 | H247: of:=IF(AND([.G247]<=[Unidades.$G$26];[.G247]<=[Unidades.$F$18];[Unidades.$F$18]>0);[Unidades.$D$18]+1-COUNTIFS([Unidades.$O$3:.$O$17];">="&[.G247]);"") -> 5 | I247: of:=IF([.H246]<>[.H247];"INICIO";IF([.H248]<>[.H247];"FIN";"")) ->  | J247: of:=IF([.K246]<>[.K247];"INICIO";IF([.K248]<>[.K247];"FIN";"")) -> 
A248: of:=IF([.B248]<>"";TODAY()>[.B248];"") -> 0 | B248: of:=IFERROR(IF(AND(ISNUMBER([.B247]);([.B247]+1)<[Calendario.$F$5]);[.B247]+1;"");"") -> 2016-05-10 | C248: of:=IF(AND([.B248]>=[Calendario.$F$8];[.B248]<=[Calendario.$F$9];1);1;IF(AND([.B248]>=[Calendario.$F$12];[.B248]<=[Calendario.$F$13]);2;IF(AND([.B248]>=[Calendario.$F$16];[.B248]<=[Calendario.$F$17]);3;""))) -> 3 | D248: of:=IF(COUNTIF([Calendario.$H$4:.$H$48];[.B248])>0;"FIESTA";"") ->  | E248: of:=IF([.B248]<>"";VLOOKUP(WEEKDAY([.B248];3);[Calendario.$A$4:.$C$11];2);"") -> Martes | F248: of:=IF([.B248]<>"";IF([.D248]<>"FIESTA";VLOOKUP(WEEKDAY([.B248];3);[Calendario.$A$4:.$C$11];3);0);"") -> 0 | G248: of:=IF(ISNUMBER([.F248]);[.F248]+[.G247];"") -> 93 | H248: of:=IF(AND([.G248]<=[Unidades.$G$26];[.G248]<=[Unidades.$F$18];[Unidades.$F$18]>0);[Unidades.$D$18]+1-COUNTIFS([Unidades.$O$3:.$O$17];">="&[.G248]);"") -> 5 | I248: of:=IF([.H247]<>[.H248];"INICIO";IF([.H249]<>[.H248];"FIN";"")) ->  | J248: of:=IF([.K247]<>[.K248];"INICIO";IF([.K249]<>[.K248];"FIN";"")) -> 
A249: of:=IF([.B249]<>"";TODAY()>[.B249];"") -> 0 | B249: of:=IFERROR(IF(AND(ISNUMBER([.B248]);([.B248]+1)<[Calendario.$F$5]);[.B248]+1;"");"") -> 2016-05-11 | C249: of:=IF(AND([.B249]>=[Calendario.$F$8];[.B249]<=[Calendario.$F$9];1);1;IF(AND([.B249]>=[Calendario.$F$12];[.B249]<=[Calendario.$F$13]);2;IF(AND([.B249]>=[Calendario.$F$16];[.B249]<=[Calendario.$F$17]);3;""))) -> 3 | D249: of:=IF(COUNTIF([Calendario.$H$4:.$H$48];[.B249])>0;"FIESTA";"") ->  | E249: of:=IF([.B249]<>"";VLOOKUP(WEEKDAY([.B249];3);[Calendario.$A$4:.$C$11];2);"") -> Miercoles | F249: of:=IF([.B249]<>"";IF([.D249]<>"FIESTA";VLOOKUP(WEEKDAY([.B249];3);[Calendario.$A$4:.$C$11];3);0);"") -> 1 | G249: of:=IF(ISNUMBER([.F249]);[.F249]+[.G248];"") -> 94 | H249: of:=IF(AND([.G249]<=[Unidades.$G$26];[.G249]<=[Unidades.$F$18];[Unidades.$F$18]>0);[Unidades.$D$18]+1-COUNTIFS([Unidades.$O$3:.$O$17];">="&[.G249]);"") -> 5 | I249: of:=IF([.H248]<>[.H249];"INICIO";IF([.H250]<>[.H249];"FIN";"")) ->  | J249: of:=IF([.K248]<>[.K249];"INICIO";IF([.K250]<>[.K249];"FIN";"")) -> 
A250: of:=IF([.B250]<>"";TODAY()>[.B250];"") -> 0 | B250: of:=IFERROR(IF(AND(ISNUMBER([.B249]);([.B249]+1)<[Calendario.$F$5]);[.B249]+1;"");"") -> 2016-05-12 | C250: of:=IF(AND([.B250]>=[Calendario.$F$8];[.B250]<=[Calendario.$F$9];1);1;IF(AND([.B250]>=[Calendario.$F$12];[.B250]<=[Calendario.$F$13]);2;IF(AND([.B250]>=[Calendario.$F$16];[.B250]<=[Calendario.$F$17]);3;""))) -> 3 | D250: of:=IF(COUNTIF([Calendario.$H$4:.$H$48];[.B250])>0;"FIESTA";"") ->  | E250: of:=IF([.B250]<>"";VLOOKUP(WEEKDAY([.B250];3);[Calendario.$A$4:.$C$11];2);"") -> Jueves | F250: of:=IF([.B250]<>"";IF([.D250]<>"FIESTA";VLOOKUP(WEEKDAY([.B250];3);[Calendario.$A$4:.$C$11];3);0);"") -> 0 | G250: of:=IF(ISNUMBER([.F250]);[.F250]+[.G249];"") -> 94 | H250: of:=IF(AND([.G250]<=[Unidades.$G$26];[.G250]<=[Unidades.$F$18];[Unidades.$F$18]>0);[Unidades.$D$18]+1-COUNTIFS([Unidades.$O$3:.$O$17];">="&[.G250]);"") -> 5 | I250: of:=IF([.H249]<>[.H250];"INICIO";IF([.H251]<>[.H250];"FIN";"")) ->  | J250: of:=IF([.K249]<>[.K250];"INICIO";IF([.K251]<>[.K250];"FIN";"")) -> 
A251: of:=IF([.B251]<>"";TODAY()>[.B251];"") -> 0 | B251: of:=IFERROR(IF(AND(ISNUMBER([.B250]);([.B250]+1)<[Calendario.$F$5]);[.B250]+1;"");"") -> 2016-05-13 | C251: of:=IF(AND([.B251]>=[Calendario.$F$8];[.B251]<=[Calendario.$F$9];1);1;IF(AND([.B251]>=[Calendario.$F$12];[.B251]<=[Calendario.$F$13]);2;IF(AND([.B251]>=[Calendario.$F$16];[.B251]<=[Calendario.$F$17]);3;""))) -> 3 | D251: of:=IF(COUNTIF([Calendario.$H$4:.$H$48];[.B251])>0;"FIESTA";"") ->  | E251: of:=IF([.B251]<>"";VLOOKUP(WEEKDAY([.B251];3);[Calendario.$A$4:.$C$11];2);"") -> Viernes | F251: of:=IF([.B251]<>"";IF([.D251]<>"FIESTA";VLOOKUP(WEEKDAY([.B251];3);[Calendario.$A$4:.$C$11];3);0);"") -> 1 | G251: of:=IF(ISNUMBER([.F251]);[.F251]+[.G250];"") -> 95 | H251: of:=IF(AND([.G251]<=[Unidades.$G$26];[.G251]<=[Unidades.$F$18];[Unidades.$F$18]>0);[Unidades.$D$18]+1-COUNTIFS([Unidades.$O$3:.$O$17];">="&[.G251]);"") -> 5 | I251: of:=IF([.H250]<>[.H251];"INICIO";IF([.H252]<>[.H251];"FIN";"")) ->  | J251: of:=IF([.K250]<>[.K251];"INICIO";IF([.K252]<>[.K251];"FIN";"")) -> 
A252: of:=IF([.B252]<>"";TODAY()>[.B252];"") -> 0 | B252: of:=IFERROR(IF(AND(ISNUMBER([.B251]);([.B251]+1)<[Calendario.$F$5]);[.B251]+1;"");"") -> 2016-05-14 | C252: of:=IF(AND([.B252]>=[Calendario.$F$8];[.B252]<=[Calendario.$F$9];1);1;IF(AND([.B252]>=[Calendario.$F$12];[.B252]<=[Calendario.$F$13]);2;IF(AND([.B252]>=[Calendario.$F$16];[.B252]<=[Calendario.$F$17]);3;""))) -> 3 | D252: of:=IF(COUNTIF([Calendario.$H$4:.$H$48];[.B252])>0;"FIESTA";"") ->  | E252: of:=IF([.B252]<>"";VLOOKUP(WEEKDAY([.B252];3);[Calendario.$A$4:.$C$11];2);"") -> Sabado | F252: of:=IF([.B252]<>"";IF([.D252]<>"FIESTA";VLOOKUP(WEEKDAY([.B252];3);[Calendario.$A$4:.$C$11];3);0);"") -> 0 | G252: of:=IF(ISNUMBER([.F252]);[.F252]+[.G251];"") -> 95 | H252: of:=IF(AND([.G252]<=[Unidades.$G$26];[.G252]<=[Unidades.$F$18];[Unidades.$F$18]>0);[Unidades.$D$18]+1-COUNTIFS([Unidades.$O$3:.$O$17];">="&[.G252]);"") -> 5 | I252: of:=IF([.H251]<>[.H252];"INICIO";IF([.H253]<>[.H252];"FIN";"")) ->  | J252: of:=IF([.K251]<>[.K252];"INICIO";IF([.K253]<>[.K252];"FIN";"")) -> 
A253: of:=IF([.B253]<>"";TODAY()>[.B253];"") -> 0 | B253: of:=IFERROR(IF(AND(ISNUMBER([.B252]);([.B252]+1)<[Calendario.$F$5]);[.B252]+1;"");"") -> 2016-05-15 | C253: of:=IF(AND([.B253]>=[Calendario.$F$8];[.B253]<=[Calendario.$F$9];1);1;IF(AND([.B253]>=[Calendario.$F$12];[.B253]<=[Calendario.$F$13]);2;IF(AND([.B253]>=[Calendario.$F$16];[.B253]<=[Calendario.$F$17]);3;""))) -> 3 | D253: of:=IF(COUNTIF([Calendario.$H$4:.$H$48];[.B253])>0;"FIESTA";"") ->  | E253: of:=IF([.B253]<>"";VLOOKUP(WEEKDAY([.B253];3);[Calendario.$A$4:.$C$11];2);"") -> Domingo | F253: of:=IF([.B253]<>"";IF([.D253]<>"FIESTA";VLOOKUP(WEEKDAY([.B253];3);[Calendario.$A$4:.$C$11];3);0);"") -> 0 | G253: of:=IF(ISNUMBER([.F253]);[.F253]+[.G252];"") -> 95 | H253: of:=IF(AND([.G253]<=[Unidades.$G$26];[.G253]<=[Unidades.$F$18];[Unidades.$F$18]>0);[Unidades.$D$18]+1-COUNTIFS([Unidades.$O$3:.$O$17];">="&[.G253]);"") -> 5 | I253: of:=IF([.H252]<>[.H253];"INICIO";IF([.H254]<>[.H253];"FIN";"")) ->  | J253: of:=IF([.K252]<>[.K253];"INICIO";IF([.K254]<>[.K253];"FIN";"")) -> 
A254: of:=IF([.B254]<>"";TODAY()>[.B254];"") -> 0 | B254: of:=IFERROR(IF(AND(ISNUMBER([.B253]);([.B253]+1)<[Calendario.$F$5]);[.B253]+1;"");"") -> 2016-05-16 | C254: of:=IF(AND([.B254]>=[Calendario.$F$8];[.B254]<=[Calendario.$F$9];1);1;IF(AND([.B254]>=[Calendario.$F$12];[.B254]<=[Calendario.$F$13]);2;IF(AND([.B254]>=[Calendario.$F$16];[.B254]<=[Calendario.$F$17]);3;""))) -> 3 | D254: of:=IF(COUNTIF([Calendario.$H$4:.$H$48];[.B254])>0;"FIESTA";"") ->  | E254: of:=IF([.B254]<>"";VLOOKUP(WEEKDAY([.B254];3);[Calendario.$A$4:.$C$11];2);"") -> Lunes | F254: of:=IF([.B254]<>"";IF([.D254]<>"FIESTA";VLOOKUP(WEEKDAY([.B254];3);[Calendario.$A$4:.$C$11];3);0);"") -> 1 | G254: of:=IF(ISNUMBER([.F254]);[.F254]+[.G253];"") -> 96 | H254: of:=IF(AND([.G254]<=[Unidades.$G$26];[.G254]<=[Unidades.$F$18];[Unidades.$F$18]>0);[Unidades.$D$18]+1-COUNTIFS([Unidades.$O$3:.$O$17];">="&[.G254]);"") -> 5 | I254: of:=IF([.H253]<>[.H254];"INICIO";IF([.H255]<>[.H254];"FIN";"")) ->  | J254: of:=IF([.K253]<>[.K254];"INICIO";IF([.K255]<>[.K254];"FIN";"")) -> 
A255: of:=IF([.B255]<>"";TODAY()>[.B255];"") -> 0 | B255: of:=IFERROR(IF(AND(ISNUMBER([.B254]);([.B254]+1)<[Calendario.$F$5]);[.B254]+1;"");"") -> 2016-05-17 | C255: of:=IF(AND([.B255]>=[Calendario.$F$8];[.B255]<=[Calendario.$F$9];1);1;IF(AND([.B255]>=[Calendario.$F$12];[.B255]<=[Calendario.$F$13]);2;IF(AND([.B255]>=[Calendario.$F$16];[.B255]<=[Calendario.$F$17]);3;""))) -> 3 | D255: of:=IF(COUNTIF([Calendario.$H$4:.$H$48];[.B255])>0;"FIESTA";"") ->  | E255: of:=IF([.B255]<>"";VLOOKUP(WEEKDAY([.B255];3);[Calendario.$A$4:.$C$11];2);"") -> Martes | F255: of:=IF([.B255]<>"";IF([.D255]<>"FIESTA";VLOOKUP(WEEKDAY([.B255];3);[Calendario.$A$4:.$C$11];3);0);"") -> 0 | G255: of:=IF(ISNUMBER([.F255]);[.F255]+[.G254];"") -> 96 | H255: of:=IF(AND([.G255]<=[Unidades.$G$26];[.G255]<=[Unidades.$F$18];[Unidades.$F$18]>0);[Unidades.$D$18]+1-COUNTIFS([Unidades.$O$3:.$O$17];">="&[.G255]);"") -> 5 | I255: of:=IF([.H254]<>[.H255];"INICIO";IF([.H256]<>[.H255];"FIN";"")) ->  | J255: of:=IF([.K254]<>[.K255];"INICIO";IF([.K256]<>[.K255];"FIN";"")) -> 
A256: of:=IF([.B256]<>"";TODAY()>[.B256];"") -> 0 | B256: of:=IFERROR(IF(AND(ISNUMBER([.B255]);([.B255]+1)<[Calendario.$F$5]);[.B255]+1;"");"") -> 2016-05-18 | C256: of:=IF(AND([.B256]>=[Calendario.$F$8];[.B256]<=[Calendario.$F$9];1);1;IF(AND([.B256]>=[Calendario.$F$12];[.B256]<=[Calendario.$F$13]);2;IF(AND([.B256]>=[Calendario.$F$16];[.B256]<=[Calendario.$F$17]);3;""))) -> 3 | D256: of:=IF(COUNTIF([Calendario.$H$4:.$H$48];[.B256])>0;"FIESTA";"") ->  | E256: of:=IF([.B256]<>"";VLOOKUP(WEEKDAY([.B256];3);[Calendario.$A$4:.$C$11];2);"") -> Miercoles | F256: of:=IF([.B256]<>"";IF([.D256]<>"FIESTA";VLOOKUP(WEEKDAY([.B256];3);[Calendario.$A$4:.$C$11];3);0);"") -> 1 | G256: of:=IF(ISNUMBER([.F256]);[.F256]+[.G255];"") -> 97 | H256: of:=IF(AND([.G256]<=[Unidades.$G$26];[.G256]<=[Unidades.$F$18];[Unidades.$F$18]>0);[Unidades.$D$18]+1-COUNTIFS([Unidades.$O$3:.$O$17];">="&[.G256]);"") -> 5 | I256: of:=IF([.H255]<>[.H256];"INICIO";IF([.H257]<>[.H256];"FIN";"")) ->  | J256: of:=IF([.K255]<>[.K256];"INICIO";IF([.K257]<>[.K256];"FIN";"")) -> 
A257: of:=IF([.B257]<>"";TODAY()>[.B257];"") -> 0 | B257: of:=IFERROR(IF(AND(ISNUMBER([.B256]);([.B256]+1)<[Calendario.$F$5]);[.B256]+1;"");"") -> 2016-05-19 | C257: of:=IF(AND([.B257]>=[Calendario.$F$8];[.B257]<=[Calendario.$F$9];1);1;IF(AND([.B257]>=[Calendario.$F$12];[.B257]<=[Calendario.$F$13]);2;IF(AND([.B257]>=[Calendario.$F$16];[.B257]<=[Calendario.$F$17]);3;""))) -> 3 | D257: of:=IF(COUNTIF([Calendario.$H$4:.$H$48];[.B257])>0;"FIESTA";"") ->  | E257: of:=IF([.B257]<>"";VLOOKUP(WEEKDAY([.B257];3);[Calendario.$A$4:.$C$11];2);"") -> Jueves | F257: of:=IF([.B257]<>"";IF([.D257]<>"FIESTA";VLOOKUP(WEEKDAY([.B257];3);[Calendario.$A$4:.$C$11];3);0);"") -> 0 | G257: of:=IF(ISNUMBER([.F257]);[.F257]+[.G256];"") -> 97 | H257: of:=IF(AND([.G257]<=[Unidades.$G$26];[.G257]<=[Unidades.$F$18];[Unidades.$F$18]>0);[Unidades.$D$18]+1-COUNTIFS([Unidades.$O$3:.$O$17];">="&[.G257]);"") -> 5 | I257: of:=IF([.H256]<>[.H257];"INICIO";IF([.H258]<>[.H257];"FIN";"")) ->  | J257: of:=IF([.K256]<>[.K257];"INICIO";IF([.K258]<>[.K257];"FIN";"")) -> 
A258: of:=IF([.B258]<>"";TODAY()>[.B258];"") -> 0 | B258: of:=IFERROR(IF(AND(ISNUMBER([.B257]);([.B257]+1)<[Calendario.$F$5]);[.B257]+1;"");"") -> 2016-05-20 | C258: of:=IF(AND([.B258]>=[Calendario.$F$8];[.B258]<=[Calendario.$F$9];1);1;IF(AND([.B258]>=[Calendario.$F$12];[.B258]<=[Calendario.$F$13]);2;IF(AND([.B258]>=[Calendario.$F$16];[.B258]<=[Calendario.$F$17]);3;""))) -> 3 | D258: of:=IF(COUNTIF([Calendario.$H$4:.$H$48];[.B258])>0;"FIESTA";"") ->  | E258: of:=IF([.B258]<>"";VLOOKUP(WEEKDAY([.B258];3);[Calendario.$A$4:.$C$11];2);"") -> Viernes | F258: of:=IF([.B258]<>"";IF([.D258]<>"FIESTA";VLOOKUP(WEEKDAY([.B258];3);[Calendario.$A$4:.$C$11];3);0);"") -> 1 | G258: of:=IF(ISNUMBER([.F258]);[.F258]+[.G257];"") -> 98 | H258: of:=IF(AND([.G258]<=[Unidades.$G$26];[.G258]<=[Unidades.$F$18];[Unidades.$F$18]>0);[Unidades.$D$18]+1-COUNTIFS([Unidades.$O$3:.$O$17];">="&[.G258]);"") -> 5 | I258: of:=IF([.H257]<>[.H258];"INICIO";IF([.H259]<>[.H258];"FIN";"")) ->  | J258: of:=IF([.K257]<>[.K258];"INICIO";IF([.K259]<>[.K258];"FIN";"")) -> 
A259: of:=IF([.B259]<>"";TODAY()>[.B259];"") -> 0 | B259: of:=IFERROR(IF(AND(ISNUMBER([.B258]);([.B258]+1)<[Calendario.$F$5]);[.B258]+1;"");"") -> 2016-05-21 | C259: of:=IF(AND([.B259]>=[Calendario.$F$8];[.B259]<=[Calendario.$F$9];1);1;IF(AND([.B259]>=[Calendario.$F$12];[.B259]<=[Calendario.$F$13]);2;IF(AND([.B259]>=[Calendario.$F$16];[.B259]<=[Calendario.$F$17]);3;""))) -> 3 | D259: of:=IF(COUNTIF([Calendario.$H$4:.$H$48];[.B259])>0;"FIESTA";"") ->  | E259: of:=IF([.B259]<>"";VLOOKUP(WEEKDAY([.B259];3);[Calendario.$A$4:.$C$11];2);"") -> Sabado | F259: of:=IF([.B259]<>"";IF([.D259]<>"FIESTA";VLOOKUP(WEEKDAY([.B259];3);[Calendario.$A$4:.$C$11];3);0);"") -> 0 | G259: of:=IF(ISNUMBER([.F259]);[.F259]+[.G258];"") -> 98 | H259: of:=IF(AND([.G259]<=[Unidades.$G$26];[.G259]<=[Unidades.$F$18];[Unidades.$F$18]>0);[Unidades.$D$18]+1-COUNTIFS([Unidades.$O$3:.$O$17];">="&[.G259]);"") -> 5 | I259: of:=IF([.H258]<>[.H259];"INICIO";IF([.H260]<>[.H259];"FIN";"")) ->  | J259: of:=IF([.K258]<>[.K259];"INICIO";IF([.K260]<>[.K259];"FIN";"")) -> 
A260: of:=IF([.B260]<>"";TODAY()>[.B260];"") -> 0 | B260: of:=IFERROR(IF(AND(ISNUMBER([.B259]);([.B259]+1)<[Calendario.$F$5]);[.B259]+1;"");"") -> 2016-05-22 | C260: of:=IF(AND([.B260]>=[Calendario.$F$8];[.B260]<=[Calendario.$F$9];1);1;IF(AND([.B260]>=[Calendario.$F$12];[.B260]<=[Calendario.$F$13]);2;IF(AND([.B260]>=[Calendario.$F$16];[.B260]<=[Calendario.$F$17]);3;""))) -> 3 | D260: of:=IF(COUNTIF([Calendario.$H$4:.$H$48];[.B260])>0;"FIESTA";"") ->  | E260: of:=IF([.B260]<>"";VLOOKUP(WEEKDAY([.B260];3);[Calendario.$A$4:.$C$11];2);"") -> Domingo | F260: of:=IF([.B260]<>"";IF([.D260]<>"FIESTA";VLOOKUP(WEEKDAY([.B260];3);[Calendario.$A$4:.$C$11];3);0);"") -> 0 | G260: of:=IF(ISNUMBER([.F260]);[.F260]+[.G259];"") -> 98 | H260: of:=IF(AND([.G260]<=[Unidades.$G$26];[.G260]<=[Unidades.$F$18];[Unidades.$F$18]>0);[Unidades.$D$18]+1-COUNTIFS([Unidades.$O$3:.$O$17];">="&[.G260]);"") -> 5 | I260: of:=IF([.H259]<>[.H260];"INICIO";IF([.H261]<>[.H260];"FIN";"")) ->  | J260: of:=IF([.K259]<>[.K260];"INICIO";IF([.K261]<>[.K260];"FIN";"")) -> 
A261: of:=IF([.B261]<>"";TODAY()>[.B261];"") -> 0 | B261: of:=IFERROR(IF(AND(ISNUMBER([.B260]);([.B260]+1)<[Calendario.$F$5]);[.B260]+1;"");"") -> 2016-05-23 | C261: of:=IF(AND([.B261]>=[Calendario.$F$8];[.B261]<=[Calendario.$F$9];1);1;IF(AND([.B261]>=[Calendario.$F$12];[.B261]<=[Calendario.$F$13]);2;IF(AND([.B261]>=[Calendario.$F$16];[.B261]<=[Calendario.$F$17]);3;""))) -> 3 | D261: of:=IF(COUNTIF([Calendario.$H$4:.$H$48];[.B261])>0;"FIESTA";"") ->  | E261: of:=IF([.B261]<>"";VLOOKUP(WEEKDAY([.B261];3);[Calendario.$A$4:.$C$11];2);"") -> Lunes | F261: of:=IF([.B261]<>"";IF([.D261]<>"FIESTA";VLOOKUP(WEEKDAY([.B261];3);[Calendario.$A$4:.$C$11];3);0);"") -> 1 | G261: of:=IF(ISNUMBER([.F261]);[.F261]+[.G260];"") -> 99 | H261: of:=IF(AND([.G261]<=[Unidades.$G$26];[.G261]<=[Unidades.$F$18];[Unidades.$F$18]>0);[Unidades.$D$18]+1-COUNTIFS([Unidades.$O$3:.$O$17];">="&[.G261]);"") -> 5 | I261: of:=IF([.H260]<>[.H261];"INICIO";IF([.H262]<>[.H261];"FIN";"")) ->  | J261: of:=IF([.K260]<>[.K261];"INICIO";IF([.K262]<>[.K261];"FIN";"")) -> 
A262: of:=IF([.B262]<>"";TODAY()>[.B262];"") -> 0 | B262: of:=IFERROR(IF(AND(ISNUMBER([.B261]);([.B261]+1)<[Calendario.$F$5]);[.B261]+1;"");"") -> 2016-05-24 | C262: of:=IF(AND([.B262]>=[Calendario.$F$8];[.B262]<=[Calendario.$F$9];1);1;IF(AND([.B262]>=[Calendario.$F$12];[.B262]<=[Calendario.$F$13]);2;IF(AND([.B262]>=[Calendario.$F$16];[.B262]<=[Calendario.$F$17]);3;""))) -> 3 | D262: of:=IF(COUNTIF([Calendario.$H$4:.$H$48];[.B262])>0;"FIESTA";"") ->  | E262: of:=IF([.B262]<>"";VLOOKUP(WEEKDAY([.B262];3);[Calendario.$A$4:.$C$11];2);"") -> Martes | F262: of:=IF([.B262]<>"";IF([.D262]<>"FIESTA";VLOOKUP(WEEKDAY([.B262];3);[Calendario.$A$4:.$C$11];3);0);"") -> 0 | G262: of:=IF(ISNUMBER([.F262]);[.F262]+[.G261];"") -> 99 | H262: of:=IF(AND([.G262]<=[Unidades.$G$26];[.G262]<=[Unidades.$F$18];[Unidades.$F$18]>0);[Unidades.$D$18]+1-COUNTIFS([Unidades.$O$3:.$O$17];">="&[.G262]);"") -> 5 | I262: of:=IF([.H261]<>[.H262];"INICIO";IF([.H263]<>[.H262];"FIN";"")) ->  | J262: of:=IF([.K261]<>[.K262];"INICIO";IF([.K263]<>[.K262];"FIN";"")) -> 
A263: of:=IF([.B263]<>"";TODAY()>[.B263];"") -> 0 | B263: of:=IFERROR(IF(AND(ISNUMBER([.B262]);([.B262]+1)<[Calendario.$F$5]);[.B262]+1;"");"") -> 2016-05-25 | C263: of:=IF(AND([.B263]>=[Calendario.$F$8];[.B263]<=[Calendario.$F$9];1);1;IF(AND([.B263]>=[Calendario.$F$12];[.B263]<=[Calendario.$F$13]);2;IF(AND([.B263]>=[Calendario.$F$16];[.B263]<=[Calendario.$F$17]);3;""))) -> 3 | D263: of:=IF(COUNTIF([Calendario.$H$4:.$H$48];[.B263])>0;"FIESTA";"") ->  | E263: of:=IF([.B263]<>"";VLOOKUP(WEEKDAY([.B263];3);[Calendario.$A$4:.$C$11];2);"") -> Miercoles | F263: of:=IF([.B263]<>"";IF([.D263]<>"FIESTA";VLOOKUP(WEEKDAY([.B263];3);[Calendario.$A$4:.$C$11];3);0);"") -> 1 | G263: of:=IF(ISNUMBER([.F263]);[.F263]+[.G262];"") -> 100 | H263: of:=IF(AND([.G263]<=[Unidades.$G$26];[.G263]<=[Unidades.$F$18];[Unidades.$F$18]>0);[Unidades.$D$18]+1-COUNTIFS([Unidades.$O$3:.$O$17];">="&[.G263]);"") -> 5 | I263: of:=IF([.H262]<>[.H263];"INICIO";IF([.H264]<>[.H263];"FIN";"")) ->  | J263: of:=IF([.K262]<>[.K263];"INICIO";IF([.K264]<>[.K263];"FIN";"")) -> 
A264: of:=IF([.B264]<>"";TODAY()>[.B264];"") -> 0 | B264: of:=IFERROR(IF(AND(ISNUMBER([.B263]);([.B263]+1)<[Calendario.$F$5]);[.B263]+1;"");"") -> 2016-05-26 | C264: of:=IF(AND([.B264]>=[Calendario.$F$8];[.B264]<=[Calendario.$F$9];1);1;IF(AND([.B264]>=[Calendario.$F$12];[.B264]<=[Calendario.$F$13]);2;IF(AND([.B264]>=[Calendario.$F$16];[.B264]<=[Calendario.$F$17]);3;""))) -> 3 | D264: of:=IF(COUNTIF([Calendario.$H$4:.$H$48];[.B264])>0;"FIESTA";"") ->  | E264: of:=IF([.B264]<>"";VLOOKUP(WEEKDAY([.B264];3);[Calendario.$A$4:.$C$11];2);"") -> Jueves | F264: of:=IF([.B264]<>"";IF([.D264]<>"FIESTA";VLOOKUP(WEEKDAY([.B264];3);[Calendario.$A$4:.$C$11];3);0);"") -> 0 | G264: of:=IF(ISNUMBER([.F264]);[.F264]+[.G263];"") -> 100 | H264: of:=IF(AND([.G264]<=[Unidades.$G$26];[.G264]<=[Unidades.$F$18];[Unidades.$F$18]>0);[Unidades.$D$18]+1-COUNTIFS([Unidades.$O$3:.$O$17];">="&[.G264]);"") -> 5 | I264: of:=IF([.H263]<>[.H264];"INICIO";IF([.H265]<>[.H264];"FIN";"")) -> FIN | J264: of:=IF([.K263]<>[.K264];"INICIO";IF([.K265]<>[.K264];"FIN";"")) -> 
A265: of:=IF([.B265]<>"";TODAY()>[.B265];"") -> 0 | B265: of:=IFERROR(IF(AND(ISNUMBER([.B264]);([.B264]+1)<[Calendario.$F$5]);[.B264]+1;"");"") -> 2016-05-27 | C265: of:=IF(AND([.B265]>=[Calendario.$F$8];[.B265]<=[Calendario.$F$9];1);1;IF(AND([.B265]>=[Calendario.$F$12];[.B265]<=[Calendario.$F$13]);2;IF(AND([.B265]>=[Calendario.$F$16];[.B265]<=[Calendario.$F$17]);3;""))) -> 3 | D265: of:=IF(COUNTIF([Calendario.$H$4:.$H$48];[.B265])>0;"FIESTA";"") ->  | E265: of:=IF([.B265]<>"";VLOOKUP(WEEKDAY([.B265];3);[Calendario.$A$4:.$C$11];2);"") -> Viernes | F265: of:=IF([.B265]<>"";IF([.D265]<>"FIESTA";VLOOKUP(WEEKDAY([.B265];3);[Calendario.$A$4:.$C$11];3);0);"") -> 1 | G265: of:=IF(ISNUMBER([.F265]);[.F265]+[.G264];"") -> 101 | H265: of:=IF(AND([.G265]<=[Unidades.$G$26];[.G265]<=[Unidades.$F$18];[Unidades.$F$18]>0);[Unidades.$D$18]+1-COUNTIFS([Unidades.$O$3:.$O$17];">="&[.G265]);"") -> 6 | I265: of:=IF([.H264]<>[.H265];"INICIO";IF([.H266]<>[.H265];"FIN";"")) -> INICIO | J265: of:=IF([.K264]<>[.K265];"INICIO";IF([.K266]<>[.K265];"FIN";"")) -> 
A266: of:=IF([.B266]<>"";TODAY()>[.B266];"") -> 0 | B266: of:=IFERROR(IF(AND(ISNUMBER([.B265]);([.B265]+1)<[Calendario.$F$5]);[.B265]+1;"");"") -> 2016-05-28 | C266: of:=IF(AND([.B266]>=[Calendario.$F$8];[.B266]<=[Calendario.$F$9];1);1;IF(AND([.B266]>=[Calendario.$F$12];[.B266]<=[Calendario.$F$13]);2;IF(AND([.B266]>=[Calendario.$F$16];[.B266]<=[Calendario.$F$17]);3;""))) -> 3 | D266: of:=IF(COUNTIF([Calendario.$H$4:.$H$48];[.B266])>0;"FIESTA";"") ->  | E266: of:=IF([.B266]<>"";VLOOKUP(WEEKDAY([.B266];3);[Calendario.$A$4:.$C$11];2);"") -> Sabado | F266: of:=IF([.B266]<>"";IF([.D266]<>"FIESTA";VLOOKUP(WEEKDAY([.B266];3);[Calendario.$A$4:.$C$11];3);0);"") -> 0 | G266: of:=IF(ISNUMBER([.F266]);[.F266]+[.G265];"") -> 101 | H266: of:=IF(AND([.G266]<=[Unidades.$G$26];[.G266]<=[Unidades.$F$18];[Unidades.$F$18]>0);[Unidades.$D$18]+1-COUNTIFS([Unidades.$O$3:.$O$17];">="&[.G266]);"") -> 6 | I266: of:=IF([.H265]<>[.H266];"INICIO";IF([.H267]<>[.H266];"FIN";"")) ->  | J266: of:=IF([.K265]<>[.K266];"INICIO";IF([.K267]<>[.K266];"FIN";"")) -> 
A267: of:=IF([.B267]<>"";TODAY()>[.B267];"") -> 0 | B267: of:=IFERROR(IF(AND(ISNUMBER([.B266]);([.B266]+1)<[Calendario.$F$5]);[.B266]+1;"");"") -> 2016-05-29 | C267: of:=IF(AND([.B267]>=[Calendario.$F$8];[.B267]<=[Calendario.$F$9];1);1;IF(AND([.B267]>=[Calendario.$F$12];[.B267]<=[Calendario.$F$13]);2;IF(AND([.B267]>=[Calendario.$F$16];[.B267]<=[Calendario.$F$17]);3;""))) -> 3 | D267: of:=IF(COUNTIF([Calendario.$H$4:.$H$48];[.B267])>0;"FIESTA";"") ->  | E267: of:=IF([.B267]<>"";VLOOKUP(WEEKDAY([.B267];3);[Calendario.$A$4:.$C$11];2);"") -> Domingo | F267: of:=IF([.B267]<>"";IF([.D267]<>"FIESTA";VLOOKUP(WEEKDAY([.B267];3);[Calendario.$A$4:.$C$11];3);0);"") -> 0 | G267: of:=IF(ISNUMBER([.F267]);[.F267]+[.G266];"") -> 101 | H267: of:=IF(AND([.G267]<=[Unidades.$G$26];[.G267]<=[Unidades.$F$18];[Unidades.$F$18]>0);[Unidades.$D$18]+1-COUNTIFS([Unidades.$O$3:.$O$17];">="&[.G267]);"") -> 6 | I267: of:=IF([.H266]<>[.H267];"INICIO";IF([.H268]<>[.H267];"FIN";"")) ->  | J267: of:=IF([.K266]<>[.K267];"INICIO";IF([.K268]<>[.K267];"FIN";"")) -> 
A268: of:=IF([.B268]<>"";TODAY()>[.B268];"") -> 0 | B268: of:=IFERROR(IF(AND(ISNUMBER([.B267]);([.B267]+1)<[Calendario.$F$5]);[.B267]+1;"");"") -> 2016-05-30 | C268: of:=IF(AND([.B268]>=[Calendario.$F$8];[.B268]<=[Calendario.$F$9];1);1;IF(AND([.B268]>=[Calendario.$F$12];[.B268]<=[Calendario.$F$13]);2;IF(AND([.B268]>=[Calendario.$F$16];[.B268]<=[Calendario.$F$17]);3;""))) -> 3 | D268: of:=IF(COUNTIF([Calendario.$H$4:.$H$48];[.B268])>0;"FIESTA";"") ->  | E268: of:=IF([.B268]<>"";VLOOKUP(WEEKDAY([.B268];3);[Calendario.$A$4:.$C$11];2);"") -> Lunes | F268: of:=IF([.B268]<>"";IF([.D268]<>"FIESTA";VLOOKUP(WEEKDAY([.B268];3);[Calendario.$A$4:.$C$11];3);0);"") -> 1 | G268: of:=IF(ISNUMBER([.F268]);[.F268]+[.G267];"") -> 102 | H268: of:=IF(AND([.G268]<=[Unidades.$G$26];[.G268]<=[Unidades.$F$18];[Unidades.$F$18]>0);[Unidades.$D$18]+1-COUNTIFS([Unidades.$O$3:.$O$17];">="&[.G268]);"") -> 6 | I268: of:=IF([.H267]<>[.H268];"INICIO";IF([.H269]<>[.H268];"FIN";"")) ->  | J268: of:=IF([.K267]<>[.K268];"INICIO";IF([.K269]<>[.K268];"FIN";"")) -> 
A269: of:=IF([.B269]<>"";TODAY()>[.B269];"") -> 0 | B269: of:=IFERROR(IF(AND(ISNUMBER([.B268]);([.B268]+1)<[Calendario.$F$5]);[.B268]+1;"");"") -> 2016-05-31 | C269: of:=IF(AND([.B269]>=[Calendario.$F$8];[.B269]<=[Calendario.$F$9];1);1;IF(AND([.B269]>=[Calendario.$F$12];[.B269]<=[Calendario.$F$13]);2;IF(AND([.B269]>=[Calendario.$F$16];[.B269]<=[Calendario.$F$17]);3;""))) -> 3 | D269: of:=IF(COUNTIF([Calendario.$H$4:.$H$48];[.B269])>0;"FIESTA";"") ->  | E269: of:=IF([.B269]<>"";VLOOKUP(WEEKDAY([.B269];3);[Calendario.$A$4:.$C$11];2);"") -> Martes | F269: of:=IF([.B269]<>"";IF([.D269]<>"FIESTA";VLOOKUP(WEEKDAY([.B269];3);[Calendario.$A$4:.$C$11];3);0);"") -> 0 | G269: of:=IF(ISNUMBER([.F269]);[.F269]+[.G268];"") -> 102 | H269: of:=IF(AND([.G269]<=[Unidades.$G$26];[.G269]<=[Unidades.$F$18];[Unidades.$F$18]>0);[Unidades.$D$18]+1-COUNTIFS([Unidades.$O$3:.$O$17];">="&[.G269]);"") -> 6 | I269: of:=IF([.H268]<>[.H269];"INICIO";IF([.H270]<>[.H269];"FIN";"")) ->  | J269: of:=IF([.K268]<>[.K269];"INICIO";IF([.K270]<>[.K269];"FIN";"")) -> 
A270: of:=IF([.B270]<>"";TODAY()>[.B270];"") -> 0 | B270: of:=IFERROR(IF(AND(ISNUMBER([.B269]);([.B269]+1)<[Calendario.$F$5]);[.B269]+1;"");"") -> 2016-06-01 | C270: of:=IF(AND([.B270]>=[Calendario.$F$8];[.B270]<=[Calendario.$F$9];1);1;IF(AND([.B270]>=[Calendario.$F$12];[.B270]<=[Calendario.$F$13]);2;IF(AND([.B270]>=[Calendario.$F$16];[.B270]<=[Calendario.$F$17]);3;""))) -> 3 | D270: of:=IF(COUNTIF([Calendario.$H$4:.$H$48];[.B270])>0;"FIESTA";"") ->  | E270: of:=IF([.B270]<>"";VLOOKUP(WEEKDAY([.B270];3);[Calendario.$A$4:.$C$11];2);"") -> Miercoles | F270: of:=IF([.B270]<>"";IF([.D270]<>"FIESTA";VLOOKUP(WEEKDAY([.B270];3);[Calendario.$A$4:.$C$11];3);0);"") -> 1 | G270: of:=IF(ISNUMBER([.F270]);[.F270]+[.G269];"") -> 103 | H270: of:=IF(AND([.G270]<=[Unidades.$G$26];[.G270]<=[Unidades.$F$18];[Unidades.$F$18]>0);[Unidades.$D$18]+1-COUNTIFS([Unidades.$O$3:.$O$17];">="&[.G270]);"") -> 6 | I270: of:=IF([.H269]<>[.H270];"INICIO";IF([.H271]<>[.H270];"FIN";"")) ->  | J270: of:=IF([.K269]<>[.K270];"INICIO";IF([.K271]<>[.K270];"FIN";"")) -> 
A271: of:=IF([.B271]<>"";TODAY()>[.B271];"") -> 0 | B271: of:=IFERROR(IF(AND(ISNUMBER([.B270]);([.B270]+1)<[Calendario.$F$5]);[.B270]+1;"");"") -> 2016-06-02 | C271: of:=IF(AND([.B271]>=[Calendario.$F$8];[.B271]<=[Calendario.$F$9];1);1;IF(AND([.B271]>=[Calendario.$F$12];[.B271]<=[Calendario.$F$13]);2;IF(AND([.B271]>=[Calendario.$F$16];[.B271]<=[Calendario.$F$17]);3;""))) -> 3 | D271: of:=IF(COUNTIF([Calendario.$H$4:.$H$48];[.B271])>0;"FIESTA";"") ->  | E271: of:=IF([.B271]<>"";VLOOKUP(WEEKDAY([.B271];3);[Calendario.$A$4:.$C$11];2);"") -> Jueves | F271: of:=IF([.B271]<>"";IF([.D271]<>"FIESTA";VLOOKUP(WEEKDAY([.B271];3);[Calendario.$A$4:.$C$11];3);0);"") -> 0 | G271: of:=IF(ISNUMBER([.F271]);[.F271]+[.G270];"") -> 103 | H271: of:=IF(AND([.G271]<=[Unidades.$G$26];[.G271]<=[Unidades.$F$18];[Unidades.$F$18]>0);[Unidades.$D$18]+1-COUNTIFS([Unidades.$O$3:.$O$17];">="&[.G271]);"") -> 6 | I271: of:=IF([.H270]<>[.H271];"INICIO";IF([.H272]<>[.H271];"FIN";"")) ->  | J271: of:=IF([.K270]<>[.K271];"INICIO";IF([.K272]<>[.K271];"FIN";"")) -> 
A272: of:=IF([.B272]<>"";TODAY()>[.B272];"") -> 0 | B272: of:=IFERROR(IF(AND(ISNUMBER([.B271]);([.B271]+1)<[Calendario.$F$5]);[.B271]+1;"");"") -> 2016-06-03 | C272: of:=IF(AND([.B272]>=[Calendario.$F$8];[.B272]<=[Calendario.$F$9];1);1;IF(AND([.B272]>=[Calendario.$F$12];[.B272]<=[Calendario.$F$13]);2;IF(AND([.B272]>=[Calendario.$F$16];[.B272]<=[Calendario.$F$17]);3;""))) -> 3 | D272: of:=IF(COUNTIF([Calendario.$H$4:.$H$48];[.B272])>0;"FIESTA";"") ->  | E272: of:=IF([.B272]<>"";VLOOKUP(WEEKDAY([.B272];3);[Calendario.$A$4:.$C$11];2);"") -> Viernes | F272: of:=IF([.B272]<>"";IF([.D272]<>"FIESTA";VLOOKUP(WEEKDAY([.B272];3);[Calendario.$A$4:.$C$11];3);0);"") -> 1 | G272: of:=IF(ISNUMBER([.F272]);[.F272]+[.G271];"") -> 104 | H272: of:=IF(AND([.G272]<=[Unidades.$G$26];[.G272]<=[Unidades.$F$18];[Unidades.$F$18]>0);[Unidades.$D$18]+1-COUNTIFS([Unidades.$O$3:.$O$17];">="&[.G272]);"") -> 6 | I272: of:=IF([.H271]<>[.H272];"INICIO";IF([.H273]<>[.H272];"FIN";"")) ->  | J272: of:=IF([.K271]<>[.K272];"INICIO";IF([.K273]<>[.K272];"FIN";"")) -> 
A273: of:=IF([.B273]<>"";TODAY()>[.B273];"") -> 0 | B273: of:=IFERROR(IF(AND(ISNUMBER([.B272]);([.B272]+1)<[Calendario.$F$5]);[.B272]+1;"");"") -> 2016-06-04 | C273: of:=IF(AND([.B273]>=[Calendario.$F$8];[.B273]<=[Calendario.$F$9];1);1;IF(AND([.B273]>=[Calendario.$F$12];[.B273]<=[Calendario.$F$13]);2;IF(AND([.B273]>=[Calendario.$F$16];[.B273]<=[Calendario.$F$17]);3;""))) -> 3 | D273: of:=IF(COUNTIF([Calendario.$H$4:.$H$48];[.B273])>0;"FIESTA";"") ->  | E273: of:=IF([.B273]<>"";VLOOKUP(WEEKDAY([.B273];3);[Calendario.$A$4:.$C$11];2);"") -> Sabado | F273: of:=IF([.B273]<>"";IF([.D273]<>"FIESTA";VLOOKUP(WEEKDAY([.B273];3);[Calendario.$A$4:.$C$11];3);0);"") -> 0 | G273: of:=IF(ISNUMBER([.F273]);[.F273]+[.G272];"") -> 104 | H273: of:=IF(AND([.G273]<=[Unidades.$G$26];[.G273]<=[Unidades.$F$18];[Unidades.$F$18]>0);[Unidades.$D$18]+1-COUNTIFS([Unidades.$O$3:.$O$17];">="&[.G273]);"") -> 6 | I273: of:=IF([.H272]<>[.H273];"INICIO";IF([.H274]<>[.H273];"FIN";"")) ->  | J273: of:=IF([.K272]<>[.K273];"INICIO";IF([.K274]<>[.K273];"FIN";"")) -> 
A274: of:=IF([.B274]<>"";TODAY()>[.B274];"") -> 0 | B274: of:=IFERROR(IF(AND(ISNUMBER([.B273]);([.B273]+1)<[Calendario.$F$5]);[.B273]+1;"");"") -> 2016-06-05 | C274: of:=IF(AND([.B274]>=[Calendario.$F$8];[.B274]<=[Calendario.$F$9];1);1;IF(AND([.B274]>=[Calendario.$F$12];[.B274]<=[Calendario.$F$13]);2;IF(AND([.B274]>=[Calendario.$F$16];[.B274]<=[Calendario.$F$17]);3;""))) -> 3 | D274: of:=IF(COUNTIF([Calendario.$H$4:.$H$48];[.B274])>0;"FIESTA";"") ->  | E274: of:=IF([.B274]<>"";VLOOKUP(WEEKDAY([.B274];3);[Calendario.$A$4:.$C$11];2);"") -> Domingo | F274: of:=IF([.B274]<>"";IF([.D274]<>"FIESTA";VLOOKUP(WEEKDAY([.B274];3);[Calendario.$A$4:.$C$11];3);0);"") -> 0 | G274: of:=IF(ISNUMBER([.F274]);[.F274]+[.G273];"") -> 104 | H274: of:=IF(AND([.G274]<=[Unidades.$G$26];[.G274]<=[Unidades.$F$18];[Unidades.$F$18]>0);[Unidades.$D$18]+1-COUNTIFS([Unidades.$O$3:.$O$17];">="&[.G274]);"") -> 6 | I274: of:=IF([.H273]<>[.H274];"INICIO";IF([.H275]<>[.H274];"FIN";"")) ->  | J274: of:=IF([.K273]<>[.K274];"INICIO";IF([.K275]<>[.K274];"FIN";"")) -> 
A275: of:=IF([.B275]<>"";TODAY()>[.B275];"") -> 0 | B275: of:=IFERROR(IF(AND(ISNUMBER([.B274]);([.B274]+1)<[Calendario.$F$5]);[.B274]+1;"");"") -> 2016-06-06 | C275: of:=IF(AND([.B275]>=[Calendario.$F$8];[.B275]<=[Calendario.$F$9];1);1;IF(AND([.B275]>=[Calendario.$F$12];[.B275]<=[Calendario.$F$13]);2;IF(AND([.B275]>=[Calendario.$F$16];[.B275]<=[Calendario.$F$17]);3;""))) -> 3 | D275: of:=IF(COUNTIF([Calendario.$H$4:.$H$48];[.B275])>0;"FIESTA";"") ->  | E275: of:=IF([.B275]<>"";VLOOKUP(WEEKDAY([.B275];3);[Calendario.$A$4:.$C$11];2);"") -> Lunes | F275: of:=IF([.B275]<>"";IF([.D275]<>"FIESTA";VLOOKUP(WEEKDAY([.B275];3);[Calendario.$A$4:.$C$11];3);0);"") -> 1 | G275: of:=IF(ISNUMBER([.F275]);[.F275]+[.G274];"") -> 105 | H275: of:=IF(AND([.G275]<=[Unidades.$G$26];[.G275]<=[Unidades.$F$18];[Unidades.$F$18]>0);[Unidades.$D$18]+1-COUNTIFS([Unidades.$O$3:.$O$17];">="&[.G275]);"") -> 6 | I275: of:=IF([.H274]<>[.H275];"INICIO";IF([.H276]<>[.H275];"FIN";"")) ->  | J275: of:=IF([.K274]<>[.K275];"INICIO";IF([.K276]<>[.K275];"FIN";"")) -> 
A276: of:=IF([.B276]<>"";TODAY()>[.B276];"") -> 0 | B276: of:=IFERROR(IF(AND(ISNUMBER([.B275]);([.B275]+1)<[Calendario.$F$5]);[.B275]+1;"");"") -> 2016-06-07 | C276: of:=IF(AND([.B276]>=[Calendario.$F$8];[.B276]<=[Calendario.$F$9];1);1;IF(AND([.B276]>=[Calendario.$F$12];[.B276]<=[Calendario.$F$13]);2;IF(AND([.B276]>=[Calendario.$F$16];[.B276]<=[Calendario.$F$17]);3;""))) -> 3 | D276: of:=IF(COUNTIF([Calendario.$H$4:.$H$48];[.B276])>0;"FIESTA";"") ->  | E276: of:=IF([.B276]<>"";VLOOKUP(WEEKDAY([.B276];3);[Calendario.$A$4:.$C$11];2);"") -> Martes | F276: of:=IF([.B276]<>"";IF([.D276]<>"FIESTA";VLOOKUP(WEEKDAY([.B276];3);[Calendario.$A$4:.$C$11];3);0);"") -> 0 | G276: of:=IF(ISNUMBER([.F276]);[.F276]+[.G275];"") -> 105 | H276: of:=IF(AND([.G276]<=[Unidades.$G$26];[.G276]<=[Unidades.$F$18];[Unidades.$F$18]>0);[Unidades.$D$18]+1-COUNTIFS([Unidades.$O$3:.$O$17];">="&[.G276]);"") -> 6 | I276: of:=IF([.H275]<>[.H276];"INICIO";IF([.H277]<>[.H276];"FIN";"")) ->  | J276: of:=IF([.K275]<>[.K276];"INICIO";IF([.K277]<>[.K276];"FIN";"")) -> 
A277: of:=IF([.B277]<>"";TODAY()>[.B277];"") -> 0 | B277: of:=IFERROR(IF(AND(ISNUMBER([.B276]);([.B276]+1)<[Calendario.$F$5]);[.B276]+1;"");"") -> 2016-06-08 | C277: of:=IF(AND([.B277]>=[Calendario.$F$8];[.B277]<=[Calendario.$F$9];1);1;IF(AND([.B277]>=[Calendario.$F$12];[.B277]<=[Calendario.$F$13]);2;IF(AND([.B277]>=[Calendario.$F$16];[.B277]<=[Calendario.$F$17]);3;""))) -> 3 | D277: of:=IF(COUNTIF([Calendario.$H$4:.$H$48];[.B277])>0;"FIESTA";"") ->  | E277: of:=IF([.B277]<>"";VLOOKUP(WEEKDAY([.B277];3);[Calendario.$A$4:.$C$11];2);"") -> Miercoles | F277: of:=IF([.B277]<>"";IF([.D277]<>"FIESTA";VLOOKUP(WEEKDAY([.B277];3);[Calendario.$A$4:.$C$11];3);0);"") -> 1 | G277: of:=IF(ISNUMBER([.F277]);[.F277]+[.G276];"") -> 106 | H277: of:=IF(AND([.G277]<=[Unidades.$G$26];[.G277]<=[Unidades.$F$18];[Unidades.$F$18]>0);[Unidades.$D$18]+1-COUNTIFS([Unidades.$O$3:.$O$17];">="&[.G277]);"") -> 6 | I277: of:=IF([.H276]<>[.H277];"INICIO";IF([.H278]<>[.H277];"FIN";"")) ->  | J277: of:=IF([.K276]<>[.K277];"INICIO";IF([.K278]<>[.K277];"FIN";"")) -> 
A278: of:=IF([.B278]<>"";TODAY()>[.B278];"") -> 0 | B278: of:=IFERROR(IF(AND(ISNUMBER([.B277]);([.B277]+1)<[Calendario.$F$5]);[.B277]+1;"");"") -> 2016-06-09 | C278: of:=IF(AND([.B278]>=[Calendario.$F$8];[.B278]<=[Calendario.$F$9];1);1;IF(AND([.B278]>=[Calendario.$F$12];[.B278]<=[Calendario.$F$13]);2;IF(AND([.B278]>=[Calendario.$F$16];[.B278]<=[Calendario.$F$17]);3;""))) -> 3 | D278: of:=IF(COUNTIF([Calendario.$H$4:.$H$48];[.B278])>0;"FIESTA";"") ->  | E278: of:=IF([.B278]<>"";VLOOKUP(WEEKDAY([.B278];3);[Calendario.$A$4:.$C$11];2);"") -> Jueves | F278: of:=IF([.B278]<>"";IF([.D278]<>"FIESTA";VLOOKUP(WEEKDAY([.B278];3);[Calendario.$A$4:.$C$11];3);0);"") -> 0 | G278: of:=IF(ISNUMBER([.F278]);[.F278]+[.G277];"") -> 106 | H278: of:=IF(AND([.G278]<=[Unidades.$G$26];[.G278]<=[Unidades.$F$18];[Unidades.$F$18]>0);[Unidades.$D$18]+1-COUNTIFS([Unidades.$O$3:.$O$17];">="&[.G278]);"") -> 6 | I278: of:=IF([.H277]<>[.H278];"INICIO";IF([.H279]<>[.H278];"FIN";"")) ->  | J278: of:=IF([.K277]<>[.K278];"INICIO";IF([.K279]<>[.K278];"FIN";"")) -> 
A279: of:=IF([.B279]<>"";TODAY()>[.B279];"") -> 0 | B279: of:=IFERROR(IF(AND(ISNUMBER([.B278]);([.B278]+1)<[Calendario.$F$5]);[.B278]+1;"");"") -> 2016-06-10 | C279: of:=IF(AND([.B279]>=[Calendario.$F$8];[.B279]<=[Calendario.$F$9];1);1;IF(AND([.B279]>=[Calendario.$F$12];[.B279]<=[Calendario.$F$13]);2;IF(AND([.B279]>=[Calendario.$F$16];[.B279]<=[Calendario.$F$17]);3;""))) -> 3 | D279: of:=IF(COUNTIF([Calendario.$H$4:.$H$48];[.B279])>0;"FIESTA";"") ->  | E279: of:=IF([.B279]<>"";VLOOKUP(WEEKDAY([.B279];3);[Calendario.$A$4:.$C$11];2);"") -> Viernes | F279: of:=IF([.B279]<>"";IF([.D279]<>"FIESTA";VLOOKUP(WEEKDAY([.B279];3);[Calendario.$A$4:.$C$11];3);0);"") -> 1 | G279: of:=IF(ISNUMBER([.F279]);[.F279]+[.G278];"") -> 107 | H279: of:=IF(AND([.G279]<=[Unidades.$G$26];[.G279]<=[Unidades.$F$18];[Unidades.$F$18]>0);[Unidades.$D$18]+1-COUNTIFS([Unidades.$O$3:.$O$17];">="&[.G279]);"") -> 6 | I279: of:=IF([.H278]<>[.H279];"INICIO";IF([.H280]<>[.H279];"FIN";"")) ->  | J279: of:=IF([.K278]<>[.K279];"INICIO";IF([.K280]<>[.K279];"FIN";"")) -> 
A280: of:=IF([.B280]<>"";TODAY()>[.B280];"") -> 0 | B280: of:=IFERROR(IF(AND(ISNUMBER([.B279]);([.B279]+1)<[Calendario.$F$5]);[.B279]+1;"");"") -> 2016-06-11 | C280: of:=IF(AND([.B280]>=[Calendario.$F$8];[.B280]<=[Calendario.$F$9];1);1;IF(AND([.B280]>=[Calendario.$F$12];[.B280]<=[Calendario.$F$13]);2;IF(AND([.B280]>=[Calendario.$F$16];[.B280]<=[Calendario.$F$17]);3;""))) -> 3 | D280: of:=IF(COUNTIF([Calendario.$H$4:.$H$48];[.B280])>0;"FIESTA";"") ->  | E280: of:=IF([.B280]<>"";VLOOKUP(WEEKDAY([.B280];3);[Calendario.$A$4:.$C$11];2);"") -> Sabado | F280: of:=IF([.B280]<>"";IF([.D280]<>"FIESTA";VLOOKUP(WEEKDAY([.B280];3);[Calendario.$A$4:.$C$11];3);0);"") -> 0 | G280: of:=IF(ISNUMBER([.F280]);[.F280]+[.G279];"") -> 107 | H280: of:=IF(AND([.G280]<=[Unidades.$G$26];[.G280]<=[Unidades.$F$18];[Unidades.$F$18]>0);[Unidades.$D$18]+1-COUNTIFS([Unidades.$O$3:.$O$17];">="&[.G280]);"") -> 6 | I280: of:=IF([.H279]<>[.H280];"INICIO";IF([.H281]<>[.H280];"FIN";"")) ->  | J280: of:=IF([.K279]<>[.K280];"INICIO";IF([.K281]<>[.K280];"FIN";"")) -> 
A281: of:=IF([.B281]<>"";TODAY()>[.B281];"") -> 0 | B281: of:=IFERROR(IF(AND(ISNUMBER([.B280]);([.B280]+1)<[Calendario.$F$5]);[.B280]+1;"");"") -> 2016-06-12 | C281: of:=IF(AND([.B281]>=[Calendario.$F$8];[.B281]<=[Calendario.$F$9];1);1;IF(AND([.B281]>=[Calendario.$F$12];[.B281]<=[Calendario.$F$13]);2;IF(AND([.B281]>=[Calendario.$F$16];[.B281]<=[Calendario.$F$17]);3;""))) -> 3 | D281: of:=IF(COUNTIF([Calendario.$H$4:.$H$48];[.B281])>0;"FIESTA";"") ->  | E281: of:=IF([.B281]<>"";VLOOKUP(WEEKDAY([.B281];3);[Calendario.$A$4:.$C$11];2);"") -> Domingo | F281: of:=IF([.B281]<>"";IF([.D281]<>"FIESTA";VLOOKUP(WEEKDAY([.B281];3);[Calendario.$A$4:.$C$11];3);0);"") -> 0 | G281: of:=IF(ISNUMBER([.F281]);[.F281]+[.G280];"") -> 107 | H281: of:=IF(AND([.G281]<=[Unidades.$G$26];[.G281]<=[Unidades.$F$18];[Unidades.$F$18]>0);[Unidades.$D$18]+1-COUNTIFS([Unidades.$O$3:.$O$17];">="&[.G281]);"") -> 6 | I281: of:=IF([.H280]<>[.H281];"INICIO";IF([.H282]<>[.H281];"FIN";"")) ->  | J281: of:=IF([.K280]<>[.K281];"INICIO";IF([.K282]<>[.K281];"FIN";"")) -> 
A282: of:=IF([.B282]<>"";TODAY()>[.B282];"") -> 0 | B282: of:=IFERROR(IF(AND(ISNUMBER([.B281]);([.B281]+1)<[Calendario.$F$5]);[.B281]+1;"");"") -> 2016-06-13 | C282: of:=IF(AND([.B282]>=[Calendario.$F$8];[.B282]<=[Calendario.$F$9];1);1;IF(AND([.B282]>=[Calendario.$F$12];[.B282]<=[Calendario.$F$13]);2;IF(AND([.B282]>=[Calendario.$F$16];[.B282]<=[Calendario.$F$17]);3;""))) -> 3 | D282: of:=IF(COUNTIF([Calendario.$H$4:.$H$48];[.B282])>0;"FIESTA";"") ->  | E282: of:=IF([.B282]<>"";VLOOKUP(WEEKDAY([.B282];3);[Calendario.$A$4:.$C$11];2);"") -> Lunes | F282: of:=IF([.B282]<>"";IF([.D282]<>"FIESTA";VLOOKUP(WEEKDAY([.B282];3);[Calendario.$A$4:.$C$11];3);0);"") -> 1 | G282: of:=IF(ISNUMBER([.F282]);[.F282]+[.G281];"") -> 108 | H282: of:=IF(AND([.G282]<=[Unidades.$G$26];[.G282]<=[Unidades.$F$18];[Unidades.$F$18]>0);[Unidades.$D$18]+1-COUNTIFS([Unidades.$O$3:.$O$17];">="&[.G282]);"") -> 6 | I282: of:=IF([.H281]<>[.H282];"INICIO";IF([.H283]<>[.H282];"FIN";"")) ->  | J282: of:=IF([.K281]<>[.K282];"INICIO";IF([.K283]<>[.K282];"FIN";"")) -> 
A283: of:=IF([.B283]<>"";TODAY()>[.B283];"") -> 0 | B283: of:=IFERROR(IF(AND(ISNUMBER([.B282]);([.B282]+1)<[Calendario.$F$5]);[.B282]+1;"");"") -> 2016-06-14 | C283: of:=IF(AND([.B283]>=[Calendario.$F$8];[.B283]<=[Calendario.$F$9];1);1;IF(AND([.B283]>=[Calendario.$F$12];[.B283]<=[Calendario.$F$13]);2;IF(AND([.B283]>=[Calendario.$F$16];[.B283]<=[Calendario.$F$17]);3;""))) -> 3 | D283: of:=IF(COUNTIF([Calendario.$H$4:.$H$48];[.B283])>0;"FIESTA";"") ->  | E283: of:=IF([.B283]<>"";VLOOKUP(WEEKDAY([.B283];3);[Calendario.$A$4:.$C$11];2);"") -> Martes | F283: of:=IF([.B283]<>"";IF([.D283]<>"FIESTA";VLOOKUP(WEEKDAY([.B283];3);[Calendario.$A$4:.$C$11];3);0);"") -> 0 | G283: of:=IF(ISNUMBER([.F283]);[.F283]+[.G282];"") -> 108 | H283: of:=IF(AND([.G283]<=[Unidades.$G$26];[.G283]<=[Unidades.$F$18];[Unidades.$F$18]>0);[Unidades.$D$18]+1-COUNTIFS([Unidades.$O$3:.$O$17];">="&[.G283]);"") -> 6 | I283: of:=IF([.H282]<>[.H283];"INICIO";IF([.H284]<>[.H283];"FIN";"")) ->  | J283: of:=IF([.K282]<>[.K283];"INICIO";IF([.K284]<>[.K283];"FIN";"")) -> 
A284: of:=IF([.B284]<>"";TODAY()>[.B284];"") -> 0 | B284: of:=IFERROR(IF(AND(ISNUMBER([.B283]);([.B283]+1)<[Calendario.$F$5]);[.B283]+1;"");"") -> 2016-06-15 | C284: of:=IF(AND([.B284]>=[Calendario.$F$8];[.B284]<=[Calendario.$F$9];1);1;IF(AND([.B284]>=[Calendario.$F$12];[.B284]<=[Calendario.$F$13]);2;IF(AND([.B284]>=[Calendario.$F$16];[.B284]<=[Calendario.$F$17]);3;""))) -> 3 | D284: of:=IF(COUNTIF([Calendario.$H$4:.$H$48];[.B284])>0;"FIESTA";"") ->  | E284: of:=IF([.B284]<>"";VLOOKUP(WEEKDAY([.B284];3);[Calendario.$A$4:.$C$11];2);"") -> Miercoles | F284: of:=IF([.B284]<>"";IF([.D284]<>"FIESTA";VLOOKUP(WEEKDAY([.B284];3);[Calendario.$A$4:.$C$11];3);0);"") -> 1 | G284: of:=IF(ISNUMBER([.F284]);[.F284]+[.G283];"") -> 109 | H284: of:=IF(AND([.G284]<=[Unidades.$G$26];[.G284]<=[Unidades.$F$18];[Unidades.$F$18]>0);[Unidades.$D$18]+1-COUNTIFS([Unidades.$O$3:.$O$17];">="&[.G284]);"") -> 6 | I284: of:=IF([.H283]<>[.H284];"INICIO";IF([.H285]<>[.H284];"FIN";"")) ->  | J284: of:=IF([.K283]<>[.K284];"INICIO";IF([.K285]<>[.K284];"FIN";"")) -> 
A285: of:=IF([.B285]<>"";TODAY()>[.B285];"") -> 0 | B285: of:=IFERROR(IF(AND(ISNUMBER([.B284]);([.B284]+1)<[Calendario.$F$5]);[.B284]+1;"");"") -> 2016-06-16 | C285: of:=IF(AND([.B285]>=[Calendario.$F$8];[.B285]<=[Calendario.$F$9];1);1;IF(AND([.B285]>=[Calendario.$F$12];[.B285]<=[Calendario.$F$13]);2;IF(AND([.B285]>=[Calendario.$F$16];[.B285]<=[Calendario.$F$17]);3;""))) -> 3 | D285: of:=IF(COUNTIF([Calendario.$H$4:.$H$48];[.B285])>0;"FIESTA";"") ->  | E285: of:=IF([.B285]<>"";VLOOKUP(WEEKDAY([.B285];3);[Calendario.$A$4:.$C$11];2);"") -> Jueves | F285: of:=IF([.B285]<>"";IF([.D285]<>"FIESTA";VLOOKUP(WEEKDAY([.B285];3);[Calendario.$A$4:.$C$11];3);0);"") -> 0 | G285: of:=IF(ISNUMBER([.F285]);[.F285]+[.G284];"") -> 109 | H285: of:=IF(AND([.G285]<=[Unidades.$G$26];[.G285]<=[Unidades.$F$18];[Unidades.$F$18]>0);[Unidades.$D$18]+1-COUNTIFS([Unidades.$O$3:.$O$17];">="&[.G285]);"") -> 6 | I285: of:=IF([.H284]<>[.H285];"INICIO";IF([.H286]<>[.H285];"FIN";"")) -> FIN | J285: of:=IF([.K284]<>[.K285];"INICIO";IF([.K286]<>[.K285];"FIN";"")) -> 
A286: of:=IF([.B286]<>"";TODAY()>[.B286];"") ->  | B286: of:=IFERROR(IF(AND(ISNUMBER([.B285]);([.B285]+1)<[Calendario.$F$5]);[.B285]+1;"");"") ->  | C286: of:=IF(AND([.B286]>=[Calendario.$F$8];[.B286]<=[Calendario.$F$9];1);1;IF(AND([.B286]>=[Calendario.$F$12];[.B286]<=[Calendario.$F$13]);2;IF(AND([.B286]>=[Calendario.$F$16];[.B286]<=[Calendario.$F$17]);3;""))) ->  | D286: of:=IF(COUNTIF([Calendario.$H$4:.$H$48];[.B286])>0;"FIESTA";"") -> FIESTA | E286: of:=IF([.B286]<>"";VLOOKUP(WEEKDAY([.B286];3);[Calendario.$A$4:.$C$11];2);"") ->  | F286: of:=IF([.B286]<>"";IF([.D286]<>"FIESTA";VLOOKUP(WEEKDAY([.B286];3);[Calendario.$A$4:.$C$11];3);0);"") ->  | G286: of:=IF(ISNUMBER([.F286]);[.F286]+[.G285];"") ->  | H286: of:=IF(AND([.G286]<=[Unidades.$G$26];[.G286]<=[Unidades.$F$18];[Unidades.$F$18]>0);[Unidades.$D$18]+1-COUNTIFS([Unidades.$O$3:.$O$17];">="&[.G286]);"") ->  | I286: of:=IF([.H285]<>[.H286];"INICIO";IF([.H287]<>[.H286];"FIN";"")) -> INICIO | J286: of:=IF([.K285]<>[.K286];"INICIO";IF([.K287]<>[.K286];"FIN";"")) -> 
A287: of:=IF([.B287]<>"";TODAY()>[.B287];"") ->  | B287: of:=IFERROR(IF(([.B286]+1)<[Calendario.$F$5];[.B286]+1;"");"") ->  | C287: of:=IF(AND([.B287]>=[Calendario.$F$8];[.B287]<=[Calendario.$F$9];1);1;IF(AND([.B287]>=[Calendario.$F$12];[.B287]<=[Calendario.$F$13]);2;IF(AND([.B287]>=[Calendario.$F$16];[.B287]<=[Calendario.$F$17]);3;""))) ->  | D287: of:=IF(COUNTIF([Calendario.$H$4:.$H$48];[.B287])>0;"FIESTA";"") -> FIESTA | E287: of:=IF([.B287]<>"";VLOOKUP(WEEKDAY([.B287];3);[Calendario.$A$4:.$C$11];2);"") ->  | F287: of:=IF([.B287]<>"";IF([.D287]<>"FIESTA";VLOOKUP(WEEKDAY([.B287];3);[Calendario.$A$4:.$C$11];3);0);"") ->  | G287: of:=IF(ISNUMBER([.F287]);[.F287]+[.G286];"") ->  | H287: of:=IF(AND([.G287]<=[Unidades.$G$26];[.G287]<=[Unidades.$F$18];[Unidades.$F$18]>0);[Unidades.$D$18]+1-COUNTIFS([Unidades.$O$3:.$O$17];">="&[.G287]);"") ->  | I287: of:=IF([.H286]<>[.H287];"INICIO";IF([.H288]<>[.H287];"FIN";"")) ->  | J287: of:=IF([.K286]<>[.K287];"INICIO";IF([.K288]<>[.K287];"FIN";"")) -> 
A288: of:=IF([.B288]<>"";TODAY()>[.B288];"") ->  | B288: of:=IFERROR(IF(([.B287]+1)<[Calendario.$F$5];[.B287]+1;"");"") ->  | C288: of:=IF(AND([.B288]>=[Calendario.$F$8];[.B288]<=[Calendario.$F$9];1);1;IF(AND([.B288]>=[Calendario.$F$12];[.B288]<=[Calendario.$F$13]);2;IF(AND([.B288]>=[Calendario.$F$16];[.B288]<=[Calendario.$F$17]);3;""))) ->  | D288: of:=IF(COUNTIF([Calendario.$H$4:.$H$48];[.B288])>0;"FIESTA";"") -> FIESTA | E288: of:=IF([.B288]<>"";VLOOKUP(WEEKDAY([.B288];3);[Calendario.$A$4:.$C$11];2);"") ->  | F288: of:=IF([.B288]<>"";IF([.D288]<>"FIESTA";VLOOKUP(WEEKDAY([.B288];3);[Calendario.$A$4:.$C$11];3);0);"") ->  | G288: of:=IF(ISNUMBER([.F288]);[.F288]+[.G287];"") ->  | H288: of:=IF(AND([.G288]<=[Unidades.$G$26];[.G288]<=[Unidades.$F$18];[Unidades.$F$18]>0);[Unidades.$D$18]+1-COUNTIFS([Unidades.$O$3:.$O$17];">="&[.G288]);"") ->  | I288: of:=IF([.H287]<>[.H288];"INICIO";IF([.H289]<>[.H288];"FIN";"")) ->  | J288: of:=IF([.K287]<>[.K288];"INICIO";IF([.K289]<>[.K288];"FIN";"")) -> 
A289: of:=IF([.B289]<>"";TODAY()>[.B289];"") ->  | B289: of:=IFERROR(IF(([.B288]+1)<[Calendario.$F$5];[.B288]+1;"");"") ->  | C289: of:=IF(AND([.B289]>=[Calendario.$F$8];[.B289]<=[Calendario.$F$9];1);1;IF(AND([.B289]>=[Calendario.$F$12];[.B289]<=[Calendario.$F$13]);2;IF(AND([.B289]>=[Calendario.$F$16];[.B289]<=[Calendario.$F$17]);3;""))) ->  | D289: of:=IF(COUNTIF([Calendario.$H$4:.$H$48];[.B289])>0;"FIESTA";"") -> FIESTA | E289: of:=IF([.B289]<>"";VLOOKUP(WEEKDAY([.B289];3);[Calendario.$A$4:.$C$11];2);"") ->  | F289: of:=IF([.B289]<>"";IF([.D289]<>"FIESTA";VLOOKUP(WEEKDAY([.B289];3);[Calendario.$A$4:.$C$11];3);0);"") ->  | G289: of:=IF(ISNUMBER([.F289]);[.F289]+[.G288];"") ->  | H289: of:=IF(AND([.G289]<=[Unidades.$G$26];[.G289]<=[Unidades.$F$18];[Unidades.$F$18]>0);[Unidades.$D$18]+1-COUNTIFS([Unidades.$O$3:.$O$17];">="&[.G289]);"") ->  | I289: of:=IF([.H288]<>[.H289];"INICIO";IF([.H290]<>[.H289];"FIN";"")) ->  | J289: of:=IF([.K288]<>[.K289];"INICIO";IF([.K290]<>[.K289];"FIN";"")) -> 
A290: of:=IF([.B290]<>"";TODAY()>[.B290];"") ->  | B290: of:=IFERROR(IF(([.B289]+1)<[Calendario.$F$5];[.B289]+1;"");"") ->  | C290: of:=IF(AND([.B290]>=[Calendario.$F$8];[.B290]<=[Calendario.$F$9];1);1;IF(AND([.B290]>=[Calendario.$F$12];[.B290]<=[Calendario.$F$13]);2;IF(AND([.B290]>=[Calendario.$F$16];[.B290]<=[Calendario.$F$17]);3;""))) ->  | D290: of:=IF(COUNTIF([Calendario.$H$4:.$H$48];[.B290])>0;"FIESTA";"") -> FIESTA | E290: of:=IF([.B290]<>"";VLOOKUP(WEEKDAY([.B290];3);[Calendario.$A$4:.$C$11];2);"") ->  | F290: of:=IF([.B290]<>"";IF([.D290]<>"FIESTA";VLOOKUP(WEEKDAY([.B290];3);[Calendario.$A$4:.$C$11];3);0);"") ->  | G290: of:=IF(ISNUMBER([.F290]);[.F290]+[.G289];"") ->  | H290: of:=IF(AND([.G290]<=[Unidades.$G$26];[.G290]<=[Unidades.$F$18];[Unidades.$F$18]>0);[Unidades.$D$18]+1-COUNTIFS([Unidades.$O$3:.$O$17];">="&[.G290]);"") ->  | I290: of:=IF([.H289]<>[.H290];"INICIO";IF([.H291]<>[.H290];"FIN";"")) ->  | J290: of:=IF([.K289]<>[.K290];"INICIO";IF([.K291]<>[.K290];"FIN";"")) -> 
A291: of:=IF([.B291]<>"";TODAY()>[.B291];"") ->  | B291: of:=IFERROR(IF(([.B290]+1)<[Calendario.$F$5];[.B290]+1;"");"") ->  | C291: of:=IF(AND([.B291]>=[Calendario.$F$8];[.B291]<=[Calendario.$F$9];1);1;IF(AND([.B291]>=[Calendario.$F$12];[.B291]<=[Calendario.$F$13]);2;IF(AND([.B291]>=[Calendario.$F$16];[.B291]<=[Calendario.$F$17]);3;""))) ->  | D291: of:=IF(COUNTIF([Calendario.$H$4:.$H$48];[.B291])>0;"FIESTA";"") -> FIESTA | E291: of:=IF([.B291]<>"";VLOOKUP(WEEKDAY([.B291];3);[Calendario.$A$4:.$C$11];2);"") ->  | F291: of:=IF([.B291]<>"";IF([.D291]<>"FIESTA";VLOOKUP(WEEKDAY([.B291];3);[Calendario.$A$4:.$C$11];3);0);"") ->  | G291: of:=IF(ISNUMBER([.F291]);[.F291]+[.G290];"") ->  | H291: of:=IF(AND([.G291]<=[Unidades.$G$26];[.G291]<=[Unidades.$F$18];[Unidades.$F$18]>0);[Unidades.$D$18]+1-COUNTIFS([Unidades.$O$3:.$O$17];">="&[.G291]);"") ->  | I291: of:=IF([.H290]<>[.H291];"INICIO";IF([.H292]<>[.H291];"FIN";"")) ->  | J291: of:=IF([.K290]<>[.K291];"INICIO";IF([.K292]<>[.K291];"FIN";"")) -> 
A292: of:=IF([.B292]<>"";TODAY()>[.B292];"") ->  | B292: of:=IFERROR(IF(([.B291]+1)<[Calendario.$F$5];[.B291]+1;"");"") ->  | C292: of:=IF(AND([.B292]>=[Calendario.$F$8];[.B292]<=[Calendario.$F$9];1);1;IF(AND([.B292]>=[Calendario.$F$12];[.B292]<=[Calendario.$F$13]);2;IF(AND([.B292]>=[Calendario.$F$16];[.B292]<=[Calendario.$F$17]);3;""))) ->  | D292: of:=IF(COUNTIF([Calendario.$H$4:.$H$48];[.B292])>0;"FIESTA";"") -> FIESTA | E292: of:=IF([.B292]<>"";VLOOKUP(WEEKDAY([.B292];3);[Calendario.$A$4:.$C$11];2);"") ->  | F292: of:=IF([.B292]<>"";IF([.D292]<>"FIESTA";VLOOKUP(WEEKDAY([.B292];3);[Calendario.$A$4:.$C$11];3);0);"") ->  | G292: of:=IF(ISNUMBER([.F292]);[.F292]+[.G291];"") ->  | H292: of:=IF(AND([.G292]<=[Unidades.$G$26];[.G292]<=[Unidades.$F$18];[Unidades.$F$18]>0);[Unidades.$D$18]+1-COUNTIFS([Unidades.$O$3:.$O$17];">="&[.G292]);"") ->  | I292: of:=IF([.H291]<>[.H292];"INICIO";IF([.H293]<>[.H292];"FIN";"")) ->  | J292: of:=IF([.K291]<>[.K292];"INICIO";IF([.K293]<>[.K292];"FIN";"")) -> 
A293: of:=IF([.B293]<>"";TODAY()>[.B293];"") ->  | B293: of:=IFERROR(IF(([.B292]+1)<[Calendario.$F$5];[.B292]+1;"");"") ->  | C293: of:=IF(AND([.B293]>=[Calendario.$F$8];[.B293]<=[Calendario.$F$9];1);1;IF(AND([.B293]>=[Calendario.$F$12];[.B293]<=[Calendario.$F$13]);2;IF(AND([.B293]>=[Calendario.$F$16];[.B293]<=[Calendario.$F$17]);3;""))) ->  | D293: of:=IF(COUNTIF([Calendario.$H$4:.$H$48];[.B293])>0;"FIESTA";"") -> FIESTA | E293: of:=IF([.B293]<>"";VLOOKUP(WEEKDAY([.B293];3);[Calendario.$A$4:.$C$11];2);"") ->  | F293: of:=IF([.B293]<>"";IF([.D293]<>"FIESTA";VLOOKUP(WEEKDAY([.B293];3);[Calendario.$A$4:.$C$11];3);0);"") ->  | G293: of:=IF(ISNUMBER([.F293]);[.F293]+[.G292];"") ->  | H293: of:=IF(AND([.G293]<=[Unidades.$G$26];[.G293]<=[Unidades.$F$18];[Unidades.$F$18]>0);[Unidades.$D$18]+1-COUNTIFS([Unidades.$O$3:.$O$17];">="&[.G293]);"") ->  | I293: of:=IF([.H292]<>[.H293];"INICIO";IF([.H294]<>[.H293];"FIN";"")) ->  | J293: of:=IF([.K292]<>[.K293];"INICIO";IF([.K294]<>[.K293];"FIN";"")) -> 
A294: of:=IF([.B294]<>"";TODAY()>[.B294];"") ->  | B294: of:=IFERROR(IF(([.B293]+1)<[Calendario.$F$5];[.B293]+1;"");"") ->  | C294: of:=IF(AND([.B294]>=[Calendario.$F$8];[.B294]<=[Calendario.$F$9];1);1;IF(AND([.B294]>=[Calendario.$F$12];[.B294]<=[Calendario.$F$13]);2;IF(AND([.B294]>=[Calendario.$F$16];[.B294]<=[Calendario.$F$17]);3;""))) ->  | D294: of:=IF(COUNTIF([Calendario.$H$4:.$H$48];[.B294])>0;"FIESTA";"") -> FIESTA | E294: of:=IF([.B294]<>"";VLOOKUP(WEEKDAY([.B294];3);[Calendario.$A$4:.$C$11];2);"") ->  | F294: of:=IF([.B294]<>"";IF([.D294]<>"FIESTA";VLOOKUP(WEEKDAY([.B294];3);[Calendario.$A$4:.$C$11];3);0);"") ->  | G294: of:=IF(ISNUMBER([.F294]);[.F294]+[.G293];"") ->  | H294: of:=IF(AND([.G294]<=[Unidades.$G$26];[.G294]<=[Unidades.$F$18];[Unidades.$F$18]>0);[Unidades.$D$18]+1-COUNTIFS([Unidades.$O$3:.$O$17];">="&[.G294]);"") ->  | I294: of:=IF([.H293]<>[.H294];"INICIO";IF([.H295]<>[.H294];"FIN";"")) ->  | J294: of:=IF([.K293]<>[.K294];"INICIO";IF([.K295]<>[.K294];"FIN";"")) -> 
A295: of:=IF([.B295]<>"";TODAY()>[.B295];"") ->  | B295: of:=IFERROR(IF(([.B294]+1)<[Calendario.$F$5];[.B294]+1;"");"") ->  | C295: of:=IF(AND([.B295]>=[Calendario.$F$8];[.B295]<=[Calendario.$F$9];1);1;IF(AND([.B295]>=[Calendario.$F$12];[.B295]<=[Calendario.$F$13]);2;IF(AND([.B295]>=[Calendario.$F$16];[.B295]<=[Calendario.$F$17]);3;""))) ->  | D295: of:=IF(COUNTIF([Calendario.$H$4:.$H$48];[.B295])>0;"FIESTA";"") -> FIESTA | E295: of:=IF([.B295]<>"";VLOOKUP(WEEKDAY([.B295];3);[Calendario.$A$4:.$C$11];2);"") ->  | F295: of:=IF([.B295]<>"";IF([.D295]<>"FIESTA";VLOOKUP(WEEKDAY([.B295];3);[Calendario.$A$4:.$C$11];3);0);"") ->  | G295: of:=IF(ISNUMBER([.F295]);[.F295]+[.G294];"") ->  | H295: of:=IF(AND([.G295]<=[Unidades.$G$26];[.G295]<=[Unidades.$F$18];[Unidades.$F$18]>0);[Unidades.$D$18]+1-COUNTIFS([Unidades.$O$3:.$O$17];">="&[.G295]);"") ->  | I295: of:=IF([.H294]<>[.H295];"INICIO";IF([.H296]<>[.H295];"FIN";"")) ->  | J295: of:=IF([.K294]<>[.K295];"INICIO";IF([.K296]<>[.K295];"FIN";"")) -> 
A296: of:=IF([.B296]<>"";TODAY()>[.B296];"") ->  | B296: of:=IFERROR(IF(([.B295]+1)<[Calendario.$F$5];[.B295]+1;"");"") ->  | C296: of:=IF(AND([.B296]>=[Calendario.$F$8];[.B296]<=[Calendario.$F$9];1);1;IF(AND([.B296]>=[Calendario.$F$12];[.B296]<=[Calendario.$F$13]);2;IF(AND([.B296]>=[Calendario.$F$16];[.B296]<=[Calendario.$F$17]);3;""))) ->  | D296: of:=IF(COUNTIF([Calendario.$H$4:.$H$48];[.B296])>0;"FIESTA";"") -> FIESTA | E296: of:=IF([.B296]<>"";VLOOKUP(WEEKDAY([.B296];3);[Calendario.$A$4:.$C$11];2);"") ->  | F296: of:=IF([.B296]<>"";IF([.D296]<>"FIESTA";VLOOKUP(WEEKDAY([.B296];3);[Calendario.$A$4:.$C$11];3);0);"") ->  | G296: of:=IF(ISNUMBER([.F296]);[.F296]+[.G295];"") ->  | H296: of:=IF(AND([.G296]<=[Unidades.$G$26];[.G296]<=[Unidades.$F$18];[Unidades.$F$18]>0);[Unidades.$D$18]+1-COUNTIFS([Unidades.$O$3:.$O$17];">="&[.G296]);"") ->  | I296: of:=IF([.H295]<>[.H296];"INICIO";IF([.H297]<>[.H296];"FIN";"")) ->  | J296: of:=IF([.K295]<>[.K296];"INICIO";IF([.K297]<>[.K296];"FIN";"")) -> 
A297: of:=IF([.B297]<>"";TODAY()>[.B297];"") ->  | B297: of:=IFERROR(IF(([.B296]+1)<[Calendario.$F$5];[.B296]+1;"");"") ->  | C297: of:=IF(AND([.B297]>=[Calendario.$F$8];[.B297]<=[Calendario.$F$9];1);1;IF(AND([.B297]>=[Calendario.$F$12];[.B297]<=[Calendario.$F$13]);2;IF(AND([.B297]>=[Calendario.$F$16];[.B297]<=[Calendario.$F$17]);3;""))) ->  | D297: of:=IF(COUNTIF([Calendario.$H$4:.$H$48];[.B297])>0;"FIESTA";"") -> FIESTA | E297: of:=IF([.B297]<>"";VLOOKUP(WEEKDAY([.B297];3);[Calendario.$A$4:.$C$11];2);"") ->  | F297: of:=IF([.B297]<>"";IF([.D297]<>"FIESTA";VLOOKUP(WEEKDAY([.B297];3);[Calendario.$A$4:.$C$11];3);0);"") ->  | G297: of:=IF(ISNUMBER([.F297]);[.F297]+[.G296];"") ->  | H297: of:=IF(AND([.G297]<=[Unidades.$G$26];[.G297]<=[Unidades.$F$18];[Unidades.$F$18]>0);[Unidades.$D$18]+1-COUNTIFS([Unidades.$O$3:.$O$17];">="&[.G297]);"") ->  | I297: of:=IF([.H296]<>[.H297];"INICIO";IF([.H298]<>[.H297];"FIN";"")) ->  | J297: of:=IF([.K296]<>[.K297];"INICIO";IF([.K298]<>[.K297];"FIN";"")) -> 
A298: of:=IF([.B298]<>"";TODAY()>[.B298];"") ->  | B298: of:=IFERROR(IF(([.B297]+1)<[Calendario.$F$5];[.B297]+1;"");"") ->  | C298: of:=IF(AND([.B298]>=[Calendario.$F$8];[.B298]<=[Calendario.$F$9];1);1;IF(AND([.B298]>=[Calendario.$F$12];[.B298]<=[Calendario.$F$13]);2;IF(AND([.B298]>=[Calendario.$F$16];[.B298]<=[Calendario.$F$17]);3;""))) ->  | D298: of:=IF(COUNTIF([Calendario.$H$4:.$H$48];[.B298])>0;"FIESTA";"") -> FIESTA | E298: of:=IF([.B298]<>"";VLOOKUP(WEEKDAY([.B298];3);[Calendario.$A$4:.$C$11];2);"") ->  | F298: of:=IF([.B298]<>"";IF([.D298]<>"FIESTA";VLOOKUP(WEEKDAY([.B298];3);[Calendario.$A$4:.$C$11];3);0);"") ->  | G298: of:=IF(ISNUMBER([.F298]);[.F298]+[.G297];"") ->  | H298: of:=IF(AND([.G298]<=[Unidades.$G$26];[.G298]<=[Unidades.$F$18];[Unidades.$F$18]>0);[Unidades.$D$18]+1-COUNTIFS([Unidades.$O$3:.$O$17];">="&[.G298]);"") ->  | I298: of:=IF([.H297]<>[.H298];"INICIO";IF([.H299]<>[.H298];"FIN";"")) ->  | J298: of:=IF([.K297]<>[.K298];"INICIO";IF([.K299]<>[.K298];"FIN";"")) -> 
A299: of:=IF([.B299]<>"";TODAY()>[.B299];"") ->  | B299: of:=IFERROR(IF(([.B298]+1)<[Calendario.$F$5];[.B298]+1;"");"") ->  | C299: of:=IF(AND([.B299]>=[Calendario.$F$8];[.B299]<=[Calendario.$F$9];1);1;IF(AND([.B299]>=[Calendario.$F$12];[.B299]<=[Calendario.$F$13]);2;IF(AND([.B299]>=[Calendario.$F$16];[.B299]<=[Calendario.$F$17]);3;""))) ->  | D299: of:=IF(COUNTIF([Calendario.$H$4:.$H$48];[.B299])>0;"FIESTA";"") -> FIESTA | E299: of:=IF([.B299]<>"";VLOOKUP(WEEKDAY([.B299];3);[Calendario.$A$4:.$C$11];2);"") ->  | F299: of:=IF([.B299]<>"";IF([.D299]<>"FIESTA";VLOOKUP(WEEKDAY([.B299];3);[Calendario.$A$4:.$C$11];3);0);"") ->  | G299: of:=IF(ISNUMBER([.F299]);[.F299]+[.G298];"") ->  | H299: of:=IF(AND([.G299]<=[Unidades.$G$26];[.G299]<=[Unidades.$F$18];[Unidades.$F$18]>0);[Unidades.$D$18]+1-COUNTIFS([Unidades.$O$3:.$O$17];">="&[.G299]);"") ->  | I299: of:=IF([.H298]<>[.H299];"INICIO";IF([.H300]<>[.H299];"FIN";"")) ->  | J299: of:=IF([.K298]<>[.K299];"INICIO";IF([.K300]<>[.K299];"FIN";"")) -> 
A300: of:=IF([.B300]<>"";TODAY()>[.B300];"") ->  | B300: of:=IFERROR(IF(([.B299]+1)<[Calendario.$F$5];[.B299]+1;"");"") ->  | C300: of:=IF(AND([.B300]>=[Calendario.$F$8];[.B300]<=[Calendario.$F$9];1);1;IF(AND([.B300]>=[Calendario.$F$12];[.B300]<=[Calendario.$F$13]);2;IF(AND([.B300]>=[Calendario.$F$16];[.B300]<=[Calendario.$F$17]);3;""))) ->  | D300: of:=IF(COUNTIF([Calendario.$H$4:.$H$48];[.B300])>0;"FIESTA";"") -> FIESTA | E300: of:=IF([.B300]<>"";VLOOKUP(WEEKDAY([.B300];3);[Calendario.$A$4:.$C$11];2);"") ->  | F300: of:=IF([.B300]<>"";IF([.D300]<>"FIESTA";VLOOKUP(WEEKDAY([.B300];3);[Calendario.$A$4:.$C$11];3);0);"") ->  | G300: of:=IF(ISNUMBER([.F300]);[.F300]+[.G299];"") ->  | H300: of:=IF(AND([.G300]<=[Unidades.$G$26];[.G300]<=[Unidades.$F$18];[Unidades.$F$18]>0);[Unidades.$D$18]+1-COUNTIFS([Unidades.$O$3:.$O$17];">="&[.G300]);"") ->  | I300: of:=IF([.H299]<>[.H300];"INICIO";IF([.H301]<>[.H300];"FIN";"")) ->  | J300: of:=IF([.K299]<>[.K300];"INICIO";IF([.K301]<>[.K300];"FIN";"")) -> 
A301: of:=IF([.B301]<>"";TODAY()>[.B301];"") ->  | B301: of:=IFERROR(IF(([.B300]+1)<[Calendario.$F$5];[.B300]+1;"");"") ->  | C301: of:=IF(AND([.B301]>=[Calendario.$F$8];[.B301]<=[Calendario.$F$9];1);1;IF(AND([.B301]>=[Calendario.$F$12];[.B301]<=[Calendario.$F$13]);2;IF(AND([.B301]>=[Calendario.$F$16];[.B301]<=[Calendario.$F$17]);3;""))) ->  | D301: of:=IF(COUNTIF([Calendario.$H$4:.$H$48];[.B301])>0;"FIESTA";"") -> FIESTA | E301: of:=IF([.B301]<>"";VLOOKUP(WEEKDAY([.B301];3);[Calendario.$A$4:.$C$11];2);"") ->  | F301: of:=IF([.B301]<>"";IF([.D301]<>"FIESTA";VLOOKUP(WEEKDAY([.B301];3);[Calendario.$A$4:.$C$11];3);0);"") ->  | G301: of:=IF(ISNUMBER([.F301]);[.F301]+[.G300];"") ->  | H301: of:=IF(AND([.G301]<=[Unidades.$G$26];[.G301]<=[Unidades.$F$18];[Unidades.$F$18]>0);[Unidades.$D$18]+1-COUNTIFS([Unidades.$O$3:.$O$17];">="&[.G301]);"") ->  | I301: of:=IF([.H300]<>[.H301];"INICIO";IF([.H302]<>[.H301];"FIN";"")) ->  | J301: of:=IF([.K300]<>[.K301];"INICIO";IF([.K302]<>[.K301];"FIN";"")) -> 
A302: of:=IF([.B302]<>"";TODAY()>[.B302];"") ->  | B302: of:=IFERROR(IF(([.B301]+1)<[Calendario.$F$5];[.B301]+1;"");"") ->  | C302: of:=IF(AND([.B302]>=[Calendario.$F$8];[.B302]<=[Calendario.$F$9];1);1;IF(AND([.B302]>=[Calendario.$F$12];[.B302]<=[Calendario.$F$13]);2;IF(AND([.B302]>=[Calendario.$F$16];[.B302]<=[Calendario.$F$17]);3;""))) ->  | D302: of:=IF(COUNTIF([Calendario.$H$4:.$H$48];[.B302])>0;"FIESTA";"") -> FIESTA | E302: of:=IF([.B302]<>"";VLOOKUP(WEEKDAY([.B302];3);[Calendario.$A$4:.$C$11];2);"") ->  | F302: of:=IF([.B302]<>"";IF([.D302]<>"FIESTA";VLOOKUP(WEEKDAY([.B302];3);[Calendario.$A$4:.$C$11];3);0);"") ->  | G302: of:=IF(ISNUMBER([.F302]);[.F302]+[.G301];"") ->  | H302: of:=IF(AND([.G302]<=[Unidades.$G$26];[.G302]<=[Unidades.$F$18];[Unidades.$F$18]>0);[Unidades.$D$18]+1-COUNTIFS([Unidades.$O$3:.$O$17];">="&[.G302]);"") ->  | I302: of:=IF([.H301]<>[.H302];"INICIO";IF([.H303]<>[.H302];"FIN";"")) ->  | J302: of:=IF([.K301]<>[.K302];"INICIO";IF([.K303]<>[.K302];"FIN";"")) -> 
A303: of:=IF([.B303]<>"";TODAY()>[.B303];"") ->  | B303: of:=IFERROR(IF(([.B302]+1)<[Calendario.$F$5];[.B302]+1;"");"") ->  | C303: of:=IF(AND([.B303]>=[Calendario.$F$8];[.B303]<=[Calendario.$F$9];1);1;IF(AND([.B303]>=[Calendario.$F$12];[.B303]<=[Calendario.$F$13]);2;IF(AND([.B303]>=[Calendario.$F$16];[.B303]<=[Calendario.$F$17]);3;""))) ->  | D303: of:=IF(COUNTIF([Calendario.$H$4:.$H$48];[.B303])>0;"FIESTA";"") -> FIESTA | E303: of:=IF([.B303]<>"";VLOOKUP(WEEKDAY([.B303];3);[Calendario.$A$4:.$C$11];2);"") ->  | F303: of:=IF([.B303]<>"";IF([.D303]<>"FIESTA";VLOOKUP(WEEKDAY([.B303];3);[Calendario.$A$4:.$C$11];3);0);"") ->  | G303: of:=IF(ISNUMBER([.F303]);[.F303]+[.G302];"") ->  | H303: of:=IF(AND([.G303]<=[Unidades.$G$26];[.G303]<=[Unidades.$F$18];[Unidades.$F$18]>0);[Unidades.$D$18]+1-COUNTIFS([Unidades.$O$3:.$O$17];">="&[.G303]);"") ->  | I303: of:=IF([.H302]<>[.H303];"INICIO";IF([.H304]<>[.H303];"FIN";"")) ->  | J303: of:=IF([.K302]<>[.K303];"INICIO";IF([.K304]<>[.K303];"FIN";"")) -> 
A304: of:=IF([.B304]<>"";TODAY()>[.B304];"") ->  | B304: of:=IFERROR(IF(([.B303]+1)<[Calendario.$F$5];[.B303]+1;"");"") ->  | C304: of:=IF(AND([.B304]>=[Calendario.$F$8];[.B304]<=[Calendario.$F$9];1);1;IF(AND([.B304]>=[Calendario.$F$12];[.B304]<=[Calendario.$F$13]);2;IF(AND([.B304]>=[Calendario.$F$16];[.B304]<=[Calendario.$F$17]);3;""))) ->  | D304: of:=IF(COUNTIF([Calendario.$H$4:.$H$48];[.B304])>0;"FIESTA";"") -> FIESTA | E304: of:=IF([.B304]<>"";VLOOKUP(WEEKDAY([.B304];3);[Calendario.$A$4:.$C$11];2);"") ->  | F304: of:=IF([.B304]<>"";IF([.D304]<>"FIESTA";VLOOKUP(WEEKDAY([.B304];3);[Calendario.$A$4:.$C$11];3);0);"") ->  | G304: of:=IF(ISNUMBER([.F304]);[.F304]+[.G303];"") ->  | H304: of:=IF(AND([.G304]<=[Unidades.$G$26];[.G304]<=[Unidades.$F$18];[Unidades.$F$18]>0);[Unidades.$D$18]+1-COUNTIFS([Unidades.$O$3:.$O$17];">="&[.G304]);"") ->  | I304: of:=IF([.H303]<>[.H304];"INICIO";IF([.H305]<>[.H304];"FIN";"")) ->  | J304: of:=IF([.K303]<>[.K304];"INICIO";IF([.K305]<>[.K304];"FIN";"")) -> 
A305: of:=IF([.B305]<>"";TODAY()>[.B305];"") ->  | B305: of:=IFERROR(IF(([.B304]+1)<[Calendario.$F$5];[.B304]+1;"");"") ->  | C305: of:=IF(AND([.B305]>=[Calendario.$F$8];[.B305]<=[Calendario.$F$9];1);1;IF(AND([.B305]>=[Calendario.$F$12];[.B305]<=[Calendario.$F$13]);2;IF(AND([.B305]>=[Calendario.$F$16];[.B305]<=[Calendario.$F$17]);3;""))) ->  | D305: of:=IF(COUNTIF([Calendario.$H$4:.$H$48];[.B305])>0;"FIESTA";"") -> FIESTA | E305: of:=IF([.B305]<>"";VLOOKUP(WEEKDAY([.B305];3);[Calendario.$A$4:.$C$11];2);"") ->  | F305: of:=IF([.B305]<>"";IF([.D305]<>"FIESTA";VLOOKUP(WEEKDAY([.B305];3);[Calendario.$A$4:.$C$11];3);0);"") ->  | G305: of:=IF(ISNUMBER([.F305]);[.F305]+[.G304];"") ->  | H305: of:=IF(AND([.G305]<=[Unidades.$G$26];[.G305]<=[Unidades.$F$18];[Unidades.$F$18]>0);[Unidades.$D$18]+1-COUNTIFS([Unidades.$O$3:.$O$17];">="&[.G305]);"") ->  | I305: of:=IF([.H304]<>[.H305];"INICIO";IF([.H306]<>[.H305];"FIN";"")) ->  | J305: of:=IF([.K304]<>[.K305];"INICIO";IF([.K306]<>[.K305];"FIN";"")) -> 
A306: of:=IF([.B306]<>"";TODAY()>[.B306];"") ->  | B306: of:=IFERROR(IF(([.B305]+1)<[Calendario.$F$5];[.B305]+1;"");"") ->  | C306: of:=IF(AND([.B306]>=[Calendario.$F$8];[.B306]<=[Calendario.$F$9];1);1;IF(AND([.B306]>=[Calendario.$F$12];[.B306]<=[Calendario.$F$13]);2;IF(AND([.B306]>=[Calendario.$F$16];[.B306]<=[Calendario.$F$17]);3;""))) ->  | D306: of:=IF(COUNTIF([Calendario.$H$4:.$H$48];[.B306])>0;"FIESTA";"") -> FIESTA | E306: of:=IF([.B306]<>"";VLOOKUP(WEEKDAY([.B306];3);[Calendario.$A$4:.$C$11];2);"") ->  | F306: of:=IF([.B306]<>"";IF([.D306]<>"FIESTA";VLOOKUP(WEEKDAY([.B306];3);[Calendario.$A$4:.$C$11];3);0);"") ->  | G306: of:=IF(ISNUMBER([.F306]);[.F306]+[.G305];"") ->  | H306: of:=IF(AND([.G306]<=[Unidades.$G$26];[.G306]<=[Unidades.$F$18];[Unidades.$F$18]>0);[Unidades.$D$18]+1-COUNTIFS([Unidades.$O$3:.$O$17];">="&[.G306]);"") ->  | I306: of:=IF([.H305]<>[.H306];"INICIO";IF([.H307]<>[.H306];"FIN";"")) ->  | J306: of:=IF([.K305]<>[.K306];"INICIO";IF([.K307]<>[.K306];"FIN";"")) -> 
A307: of:=IF([.B307]<>"";TODAY()>[.B307];"") ->  | B307: of:=IFERROR(IF(([.B306]+1)<[Calendario.$F$5];[.B306]+1;"");"") ->  | C307: of:=IF(AND([.B307]>=[Calendario.$F$8];[.B307]<=[Calendario.$F$9];1);1;IF(AND([.B307]>=[Calendario.$F$12];[.B307]<=[Calendario.$F$13]);2;IF(AND([.B307]>=[Calendario.$F$16];[.B307]<=[Calendario.$F$17]);3;""))) ->  | D307: of:=IF(COUNTIF([Calendario.$H$4:.$H$48];[.B307])>0;"FIESTA";"") -> FIESTA | E307: of:=IF([.B307]<>"";VLOOKUP(WEEKDAY([.B307];3);[Calendario.$A$4:.$C$11];2);"") ->  | F307: of:=IF([.B307]<>"";IF([.D307]<>"FIESTA";VLOOKUP(WEEKDAY([.B307];3);[Calendario.$A$4:.$C$11];3);0);"") ->  | G307: of:=IF(ISNUMBER([.F307]);[.F307]+[.G306];"") ->  | H307: of:=IF(AND([.G307]<=[Unidades.$G$26];[.G307]<=[Unidades.$F$18];[Unidades.$F$18]>0);[Unidades.$D$18]+1-COUNTIFS([Unidades.$O$3:.$O$17];">="&[.G307]);"") ->  | I307: of:=IF([.H306]<>[.H307];"INICIO";IF([.H308]<>[.H307];"FIN";"")) ->  | J307: of:=IF([.K306]<>[.K307];"INICIO";IF([.K308]<>[.K307];"FIN";"")) -> 
A308: of:=IF([.B308]<>"";TODAY()>[.B308];"") ->  | B308: of:=IFERROR(IF(([.B307]+1)<[Calendario.$F$5];[.B307]+1;"");"") ->  | C308: of:=IF(AND([.B308]>=[Calendario.$F$8];[.B308]<=[Calendario.$F$9];1);1;IF(AND([.B308]>=[Calendario.$F$12];[.B308]<=[Calendario.$F$13]);2;IF(AND([.B308]>=[Calendario.$F$16];[.B308]<=[Calendario.$F$17]);3;""))) ->  | D308: of:=IF(COUNTIF([Calendario.$H$4:.$H$48];[.B308])>0;"FIESTA";"") -> FIESTA | E308: of:=IF([.B308]<>"";VLOOKUP(WEEKDAY([.B308];3);[Calendario.$A$4:.$C$11];2);"") ->  | F308: of:=IF([.B308]<>"";IF([.D308]<>"FIESTA";VLOOKUP(WEEKDAY([.B308];3);[Calendario.$A$4:.$C$11];3);0);"") ->  | G308: of:=IF(ISNUMBER([.F308]);[.F308]+[.G307];"") ->  | H308: of:=IF(AND([.G308]<=[Unidades.$G$26];[.G308]<=[Unidades.$F$18];[Unidades.$F$18]>0);[Unidades.$D$18]+1-COUNTIFS([Unidades.$O$3:.$O$17];">="&[.G308]);"") ->  | I308: of:=IF([.H307]<>[.H308];"INICIO";IF([.H309]<>[.H308];"FIN";"")) ->  | J308: of:=IF([.K307]<>[.K308];"INICIO";IF([.K309]<>[.K308];"FIN";"")) -> 
A309: of:=IF([.B309]<>"";TODAY()>[.B309];"") ->  | B309: of:=IFERROR(IF(([.B308]+1)<[Calendario.$F$5];[.B308]+1;"");"") ->  | C309: of:=IF(AND([.B309]>=[Calendario.$F$8];[.B309]<=[Calendario.$F$9];1);1;IF(AND([.B309]>=[Calendario.$F$12];[.B309]<=[Calendario.$F$13]);2;IF(AND([.B309]>=[Calendario.$F$16];[.B309]<=[Calendario.$F$17]);3;""))) ->  | D309: of:=IF(COUNTIF([Calendario.$H$4:.$H$48];[.B309])>0;"FIESTA";"") -> FIESTA | E309: of:=IF([.B309]<>"";VLOOKUP(WEEKDAY([.B309];3);[Calendario.$A$4:.$C$11];2);"") ->  | F309: of:=IF([.B309]<>"";IF([.D309]<>"FIESTA";VLOOKUP(WEEKDAY([.B309];3);[Calendario.$A$4:.$C$11];3);0);"") ->  | G309: of:=IF(ISNUMBER([.F309]);[.F309]+[.G308];"") ->  | H309: of:=IF(AND([.G309]<=[Unidades.$G$26];[.G309]<=[Unidades.$F$18];[Unidades.$F$18]>0);[Unidades.$D$18]+1-COUNTIFS([Unidades.$O$3:.$O$17];">="&[.G309]);"") ->  | I309: of:=IF([.H308]<>[.H309];"INICIO";IF([.H310]<>[.H309];"FIN";"")) ->  | J309: of:=IF([.K308]<>[.K309];"INICIO";IF([.K310]<>[.K309];"FIN";"")) -> 
A310: of:=IF([.B310]<>"";TODAY()>[.B310];"") ->  | B310: of:=IFERROR(IF(([.B309]+1)<[Calendario.$F$5];[.B309]+1;"");"") ->  | C310: of:=IF(AND([.B310]>=[Calendario.$F$8];[.B310]<=[Calendario.$F$9];1);1;IF(AND([.B310]>=[Calendario.$F$12];[.B310]<=[Calendario.$F$13]);2;IF(AND([.B310]>=[Calendario.$F$16];[.B310]<=[Calendario.$F$17]);3;""))) ->  | D310: of:=IF(COUNTIF([Calendario.$H$4:.$H$48];[.B310])>0;"FIESTA";"") -> FIESTA | E310: of:=IF([.B310]<>"";VLOOKUP(WEEKDAY([.B310];3);[Calendario.$A$4:.$C$11];2);"") ->  | F310: of:=IF([.B310]<>"";IF([.D310]<>"FIESTA";VLOOKUP(WEEKDAY([.B310];3);[Calendario.$A$4:.$C$11];3);0);"") ->  | G310: of:=IF(ISNUMBER([.F310]);[.F310]+[.G309];"") ->  | H310: of:=IF(AND([.G310]<=[Unidades.$G$26];[.G310]<=[Unidades.$F$18];[Unidades.$F$18]>0);[Unidades.$D$18]+1-COUNTIFS([Unidades.$O$3:.$O$17];">="&[.G310]);"") ->  | I310: of:=IF([.H309]<>[.H310];"INICIO";IF([.H311]<>[.H310];"FIN";"")) ->  | J310: of:=IF([.K309]<>[.K310];"INICIO";IF([.K311]<>[.K310];"FIN";"")) -> 
A311: of:=IF([.B311]<>"";TODAY()>[.B311];"") ->  | B311: of:=IFERROR(IF(([.B310]+1)<[Calendario.$F$5];[.B310]+1;"");"") ->  | C311: of:=IF(AND([.B311]>=[Calendario.$F$8];[.B311]<=[Calendario.$F$9];1);1;IF(AND([.B311]>=[Calendario.$F$12];[.B311]<=[Calendario.$F$13]);2;IF(AND([.B311]>=[Calendario.$F$16];[.B311]<=[Calendario.$F$17]);3;""))) ->  | D311: of:=IF(COUNTIF([Calendario.$H$4:.$H$48];[.B311])>0;"FIESTA";"") -> FIESTA | E311: of:=IF([.B311]<>"";VLOOKUP(WEEKDAY([.B311];3);[Calendario.$A$4:.$C$11];2);"") ->  | F311: of:=IF([.B311]<>"";IF([.D311]<>"FIESTA";VLOOKUP(WEEKDAY([.B311];3);[Calendario.$A$4:.$C$11];3);0);"") ->  | G311: of:=IF(ISNUMBER([.F311]);[.F311]+[.G310];"") ->  | H311: of:=IF(AND([.G311]<=[Unidades.$G$26];[.G311]<=[Unidades.$F$18];[Unidades.$F$18]>0);[Unidades.$D$18]+1-COUNTIFS([Unidades.$O$3:.$O$17];">="&[.G311]);"") ->  | I311: of:=IF([.H310]<>[.H311];"INICIO";IF([.H312]<>[.H311];"FIN";"")) ->  | J311: of:=IF([.K310]<>[.K311];"INICIO";IF([.K312]<>[.K311];"FIN";"")) -> 
A312: of:=IF([.B312]<>"";TODAY()>[.B312];"") ->  | B312: of:=IFERROR(IF(([.B311]+1)<[Calendario.$F$5];[.B311]+1;"");"") ->  | C312: of:=IF(AND([.B312]>=[Calendario.$F$8];[.B312]<=[Calendario.$F$9];1);1;IF(AND([.B312]>=[Calendario.$F$12];[.B312]<=[Calendario.$F$13]);2;IF(AND([.B312]>=[Calendario.$F$16];[.B312]<=[Calendario.$F$17]);3;""))) ->  | D312: of:=IF(COUNTIF([Calendario.$H$4:.$H$48];[.B312])>0;"FIESTA";"") -> FIESTA | E312: of:=IF([.B312]<>"";VLOOKUP(WEEKDAY([.B312];3);[Calendario.$A$4:.$C$11];2);"") ->  | F312: of:=IF([.B312]<>"";IF([.D312]<>"FIESTA";VLOOKUP(WEEKDAY([.B312];3);[Calendario.$A$4:.$C$11];3);0);"") ->  | G312: of:=IF(ISNUMBER([.F312]);[.F312]+[.G311];"") ->  | H312: of:=IF(AND([.G312]<=[Unidades.$G$26];[.G312]<=[Unidades.$F$18];[Unidades.$F$18]>0);[Unidades.$D$18]+1-COUNTIFS([Unidades.$O$3:.$O$17];">="&[.G312]);"") ->  | I312: of:=IF([.H311]<>[.H312];"INICIO";IF([.H313]<>[.H312];"FIN";"")) ->  | J312: of:=IF([.K311]<>[.K312];"INICIO";IF([.K313]<>[.K312];"FIN";"")) -> 
A313: of:=IF([.B313]<>"";TODAY()>[.B313];"") ->  | B313: of:=IFERROR(IF(([.B312]+1)<[Calendario.$F$5];[.B312]+1;"");"") ->  | C313: of:=IF(AND([.B313]>=[Calendario.$F$8];[.B313]<=[Calendario.$F$9];1);1;IF(AND([.B313]>=[Calendario.$F$12];[.B313]<=[Calendario.$F$13]);2;IF(AND([.B313]>=[Calendario.$F$16];[.B313]<=[Calendario.$F$17]);3;""))) ->  | D313: of:=IF(COUNTIF([Calendario.$H$4:.$H$48];[.B313])>0;"FIESTA";"") -> FIESTA | E313: of:=IF([.B313]<>"";VLOOKUP(WEEKDAY([.B313];3);[Calendario.$A$4:.$C$11];2);"") ->  | F313: of:=IF([.B313]<>"";IF([.D313]<>"FIESTA";VLOOKUP(WEEKDAY([.B313];3);[Calendario.$A$4:.$C$11];3);0);"") ->  | G313: of:=IF(ISNUMBER([.F313]);[.F313]+[.G312];"") ->  | H313: of:=IF(AND([.G313]<=[Unidades.$G$26];[.G313]<=[Unidades.$F$18];[Unidades.$F$18]>0);[Unidades.$D$18]+1-COUNTIFS([Unidades.$O$3:.$O$17];">="&[.G313]);"") ->  | I313: of:=IF([.H312]<>[.H313];"INICIO";IF([.H314]<>[.H313];"FIN";"")) ->  | J313: of:=IF([.K312]<>[.K313];"INICIO";IF([.K314]<>[.K313];"FIN";"")) -> 
A314: of:=IF([.B314]<>"";TODAY()>[.B314];"") ->  | B314: of:=IFERROR(IF(([.B313]+1)<[Calendario.$F$5];[.B313]+1;"");"") ->  | C314: of:=IF(AND([.B314]>=[Calendario.$F$8];[.B314]<=[Calendario.$F$9];1);1;IF(AND([.B314]>=[Calendario.$F$12];[.B314]<=[Calendario.$F$13]);2;IF(AND([.B314]>=[Calendario.$F$16];[.B314]<=[Calendario.$F$17]);3;""))) ->  | D314: of:=IF(COUNTIF([Calendario.$H$4:.$H$48];[.B314])>0;"FIESTA";"") -> FIESTA | E314: of:=IF([.B314]<>"";VLOOKUP(WEEKDAY([.B314];3);[Calendario.$A$4:.$C$11];2);"") ->  | F314: of:=IF([.B314]<>"";IF([.D314]<>"FIESTA";VLOOKUP(WEEKDAY([.B314];3);[Calendario.$A$4:.$C$11];3);0);"") ->  | G314: of:=IF(ISNUMBER([.F314]);[.F314]+[.G313];"") ->  | H314: of:=IF(AND([.G314]<=[Unidades.$G$26];[.G314]<=[Unidades.$F$18];[Unidades.$F$18]>0);[Unidades.$D$18]+1-COUNTIFS([Unidades.$O$3:.$O$17];">="&[.G314]);"") ->  | I314: of:=IF([.H313]<>[.H314];"INICIO";IF([.H315]<>[.H314];"FIN";"")) ->  | J314: of:=IF([.K313]<>[.K314];"INICIO";IF([.K315]<>[.K314];"FIN";"")) -> 
A315: of:=IF([.B315]<>"";TODAY()>[.B315];"") ->  | B315: of:=IFERROR(IF(([.B314]+1)<[Calendario.$F$5];[.B314]+1;"");"") ->  | C315: of:=IF(AND([.B315]>=[Calendario.$F$8];[.B315]<=[Calendario.$F$9];1);1;IF(AND([.B315]>=[Calendario.$F$12];[.B315]<=[Calendario.$F$13]);2;IF(AND([.B315]>=[Calendario.$F$16];[.B315]<=[Calendario.$F$17]);3;""))) ->  | D315: of:=IF(COUNTIF([Calendario.$H$4:.$H$48];[.B315])>0;"FIESTA";"") -> FIESTA | E315: of:=IF([.B315]<>"";VLOOKUP(WEEKDAY([.B315];3);[Calendario.$A$4:.$C$11];2);"") ->  | F315: of:=IF([.B315]<>"";IF([.D315]<>"FIESTA";VLOOKUP(WEEKDAY([.B315];3);[Calendario.$A$4:.$C$11];3);0);"") ->  | G315: of:=IF(ISNUMBER([.F315]);[.F315]+[.G314];"") ->  | H315: of:=IF(AND([.G315]<=[Unidades.$G$26];[.G315]<=[Unidades.$F$18];[Unidades.$F$18]>0);[Unidades.$D$18]+1-COUNTIFS([Unidades.$O$3:.$O$17];">="&[.G315]);"") ->  | I315: of:=IF([.H314]<>[.H315];"INICIO";IF([.H316]<>[.H315];"FIN";"")) ->  | J315: of:=IF([.K314]<>[.K315];"INICIO";IF([.K316]<>[.K315];"FIN";"")) -> 
A316: of:=IF([.B316]<>"";TODAY()>[.B316];"") ->  | B316: of:=IFERROR(IF(([.B315]+1)<[Calendario.$F$5];[.B315]+1;"");"") ->  | C316: of:=IF(AND([.B316]>=[Calendario.$F$8];[.B316]<=[Calendario.$F$9];1);1;IF(AND([.B316]>=[Calendario.$F$12];[.B316]<=[Calendario.$F$13]);2;IF(AND([.B316]>=[Calendario.$F$16];[.B316]<=[Calendario.$F$17]);3;""))) ->  | D316: of:=IF(COUNTIF([Calendario.$H$4:.$H$48];[.B316])>0;"FIESTA";"") -> FIESTA | E316: of:=IF([.B316]<>"";VLOOKUP(WEEKDAY([.B316];3);[Calendario.$A$4:.$C$11];2);"") ->  | F316: of:=IF([.B316]<>"";IF([.D316]<>"FIESTA";VLOOKUP(WEEKDAY([.B316];3);[Calendario.$A$4:.$C$11];3);0);"") ->  | G316: of:=IF(ISNUMBER([.F316]);[.F316]+[.G315];"") ->  | H316: of:=IF(AND([.G316]<=[Unidades.$G$26];[.G316]<=[Unidades.$F$18];[Unidades.$F$18]>0);[Unidades.$D$18]+1-COUNTIFS([Unidades.$O$3:.$O$17];">="&[.G316]);"") ->  | I316: of:=IF([.H315]<>[.H316];"INICIO";IF([.H317]<>[.H316];"FIN";"")) ->  | J316: of:=IF([.K315]<>[.K316];"INICIO";IF([.K317]<>[.K316];"FIN";"")) -> 
A317: of:=IF([.B317]<>"";TODAY()>[.B317];"") ->  | B317: of:=IFERROR(IF(([.B316]+1)<[Calendario.$F$5];[.B316]+1;"");"") ->  | C317: of:=IF(AND([.B317]>=[Calendario.$F$8];[.B317]<=[Calendario.$F$9];1);1;IF(AND([.B317]>=[Calendario.$F$12];[.B317]<=[Calendario.$F$13]);2;IF(AND([.B317]>=[Calendario.$F$16];[.B317]<=[Calendario.$F$17]);3;""))) ->  | D317: of:=IF(COUNTIF([Calendario.$H$4:.$H$48];[.B317])>0;"FIESTA";"") -> FIESTA | E317: of:=IF([.B317]<>"";VLOOKUP(WEEKDAY([.B317];3);[Calendario.$A$4:.$C$11];2);"") ->  | F317: of:=IF([.B317]<>"";IF([.D317]<>"FIESTA";VLOOKUP(WEEKDAY([.B317];3);[Calendario.$A$4:.$C$11];3);0);"") ->  | G317: of:=IF(ISNUMBER([.F317]);[.F317]+[.G316];"") ->  | H317: of:=IF(AND([.G317]<=[Unidades.$G$26];[.G317]<=[Unidades.$F$18];[Unidades.$F$18]>0);[Unidades.$D$18]+1-COUNTIFS([Unidades.$O$3:.$O$17];">="&[.G317]);"") ->  | I317: of:=IF([.H316]<>[.H317];"INICIO";IF([.H318]<>[.H317];"FIN";"")) ->  | J317: of:=IF([.K316]<>[.K317];"INICIO";IF([.K318]<>[.K317];"FIN";"")) -> 
A318: of:=IF([.B318]<>"";TODAY()>[.B318];"") ->  | B318: of:=IFERROR(IF(([.B317]+1)<[Calendario.$F$5];[.B317]+1;"");"") ->  | C318: of:=IF(AND([.B318]>=[Calendario.$F$8];[.B318]<=[Calendario.$F$9];1);1;IF(AND([.B318]>=[Calendario.$F$12];[.B318]<=[Calendario.$F$13]);2;IF(AND([.B318]>=[Calendario.$F$16];[.B318]<=[Calendario.$F$17]);3;""))) ->  | D318: of:=IF(COUNTIF([Calendario.$H$4:.$H$48];[.B318])>0;"FIESTA";"") -> FIESTA | E318: of:=IF([.B318]<>"";VLOOKUP(WEEKDAY([.B318];3);[Calendario.$A$4:.$C$11];2);"") ->  | F318: of:=IF([.B318]<>"";IF([.D318]<>"FIESTA";VLOOKUP(WEEKDAY([.B318];3);[Calendario.$A$4:.$C$11];3);0);"") ->  | G318: of:=IF(ISNUMBER([.F318]);[.F318]+[.G317];"") ->  | H318: of:=IF(AND([.G318]<=[Unidades.$G$26];[.G318]<=[Unidades.$F$18];[Unidades.$F$18]>0);[Unidades.$D$18]+1-COUNTIFS([Unidades.$O$3:.$O$17];">="&[.G318]);"") ->  | I318: of:=IF([.H317]<>[.H318];"INICIO";IF([.H319]<>[.H318];"FIN";"")) ->  | J318: of:=IF([.K317]<>[.K318];"INICIO";IF([.K319]<>[.K318];"FIN";"")) -> 
A319: of:=IF([.B319]<>"";TODAY()>[.B319];"") ->  | B319: of:=IFERROR(IF(([.B318]+1)<[Calendario.$F$5];[.B318]+1;"");"") ->  | C319: of:=IF(AND([.B319]>=[Calendario.$F$8];[.B319]<=[Calendario.$F$9];1);1;IF(AND([.B319]>=[Calendario.$F$12];[.B319]<=[Calendario.$F$13]);2;IF(AND([.B319]>=[Calendario.$F$16];[.B319]<=[Calendario.$F$17]);3;""))) ->  | D319: of:=IF(COUNTIF([Calendario.$H$4:.$H$48];[.B319])>0;"FIESTA";"") -> FIESTA | E319: of:=IF([.B319]<>"";VLOOKUP(WEEKDAY([.B319];3);[Calendario.$A$4:.$C$11];2);"") ->  | F319: of:=IF([.B319]<>"";IF([.D319]<>"FIESTA";VLOOKUP(WEEKDAY([.B319];3);[Calendario.$A$4:.$C$11];3);0);"") ->  | G319: of:=IF(ISNUMBER([.F319]);[.F319]+[.G318];"") ->  | H319: of:=IF(AND([.G319]<=[Unidades.$G$26];[.G319]<=[Unidades.$F$18];[Unidades.$F$18]>0);[Unidades.$D$18]+1-COUNTIFS([Unidades.$O$3:.$O$17];">="&[.G319]);"") ->  | I319: of:=IF([.H318]<>[.H319];"INICIO";IF([.H320]<>[.H319];"FIN";"")) ->  | J319: of:=IF([.K318]<>[.K319];"INICIO";IF([.K320]<>[.K319];"FIN";"")) -> 
A320: of:=IF([.B320]<>"";TODAY()>[.B320];"") ->  | B320: of:=IFERROR(IF(([.B319]+1)<[Calendario.$F$5];[.B319]+1;"");"") ->  | C320: of:=IF(AND([.B320]>=[Calendario.$F$8];[.B320]<=[Calendario.$F$9];1);1;IF(AND([.B320]>=[Calendario.$F$12];[.B320]<=[Calendario.$F$13]);2;IF(AND([.B320]>=[Calendario.$F$16];[.B320]<=[Calendario.$F$17]);3;""))) ->  | D320: of:=IF(COUNTIF([Calendario.$H$4:.$H$48];[.B320])>0;"FIESTA";"") -> FIESTA | E320: of:=IF([.B320]<>"";VLOOKUP(WEEKDAY([.B320];3);[Calendario.$A$4:.$C$11];2);"") ->  | F320: of:=IF([.B320]<>"";IF([.D320]<>"FIESTA";VLOOKUP(WEEKDAY([.B320];3);[Calendario.$A$4:.$C$11];3);0);"") ->  | G320: of:=IF(ISNUMBER([.F320]);[.F320]+[.G319];"") ->  | H320: of:=IF(AND([.G320]<=[Unidades.$G$26];[.G320]<=[Unidades.$F$18];[Unidades.$F$18]>0);[Unidades.$D$18]+1-COUNTIFS([Unidades.$O$3:.$O$17];">="&[.G320]);"") ->  | I320: of:=IF([.H319]<>[.H320];"INICIO";IF([.H321]<>[.H320];"FIN";"")) ->  | J320: of:=IF([.K319]<>[.K320];"INICIO";IF([.K321]<>[.K320];"FIN";"")) -> 
A321: of:=IF([.B321]<>"";TODAY()>[.B321];"") ->  | B321: of:=IFERROR(IF(([.B320]+1)<[Calendario.$F$5];[.B320]+1;"");"") ->  | C321: of:=IF(AND([.B321]>=[Calendario.$F$8];[.B321]<=[Calendario.$F$9];1);1;IF(AND([.B321]>=[Calendario.$F$12];[.B321]<=[Calendario.$F$13]);2;IF(AND([.B321]>=[Calendario.$F$16];[.B321]<=[Calendario.$F$17]);3;""))) ->  | D321: of:=IF(COUNTIF([Calendario.$H$4:.$H$48];[.B321])>0;"FIESTA";"") -> FIESTA | E321: of:=IF([.B321]<>"";VLOOKUP(WEEKDAY([.B321];3);[Calendario.$A$4:.$C$11];2);"") ->  | F321: of:=IF([.B321]<>"";IF([.D321]<>"FIESTA";VLOOKUP(WEEKDAY([.B321];3);[Calendario.$A$4:.$C$11];3);0);"") ->  | G321: of:=IF(ISNUMBER([.F321]);[.F321]+[.G320];"") ->  | H321: of:=IF(AND([.G321]<=[Unidades.$G$26];[.G321]<=[Unidades.$F$18];[Unidades.$F$18]>0);[Unidades.$D$18]+1-COUNTIFS([Unidades.$O$3:.$O$17];">="&[.G321]);"") ->  | I321: of:=IF([.H320]<>[.H321];"INICIO";IF([.H322]<>[.H321];"FIN";"")) ->  | J321: of:=IF([.K320]<>[.K321];"INICIO";IF([.K322]<>[.K321];"FIN";"")) -> 
A322: of:=IF([.B322]<>"";TODAY()>[.B322];"") ->  | B322: of:=IFERROR(IF(([.B321]+1)<[Calendario.$F$5];[.B321]+1;"");"") ->  | C322: of:=IF(AND([.B322]>=[Calendario.$F$8];[.B322]<=[Calendario.$F$9];1);1;IF(AND([.B322]>=[Calendario.$F$12];[.B322]<=[Calendario.$F$13]);2;IF(AND([.B322]>=[Calendario.$F$16];[.B322]<=[Calendario.$F$17]);3;""))) ->  | D322: of:=IF(COUNTIF([Calendario.$H$4:.$H$48];[.B322])>0;"FIESTA";"") -> FIESTA | E322: of:=IF([.B322]<>"";VLOOKUP(WEEKDAY([.B322];3);[Calendario.$A$4:.$C$11];2);"") ->  | F322: of:=IF([.B322]<>"";IF([.D322]<>"FIESTA";VLOOKUP(WEEKDAY([.B322];3);[Calendario.$A$4:.$C$11];3);0);"") ->  | G322: of:=IF(ISNUMBER([.F322]);[.F322]+[.G321];"") ->  | H322: of:=IF(AND([.G322]<=[Unidades.$G$26];[.G322]<=[Unidades.$F$18];[Unidades.$F$18]>0);[Unidades.$D$18]+1-COUNTIFS([Unidades.$O$3:.$O$17];">="&[.G322]);"") ->  | I322: of:=IF([.H321]<>[.H322];"INICIO";IF([.H323]<>[.H322];"FIN";"")) ->  | J322: of:=IF([.K321]<>[.K322];"INICIO";IF([.K323]<>[.K322];"FIN";"")) -> 
A323: of:=IF([.B323]<>"";TODAY()>[.B323];"") ->  | B323: of:=IFERROR(IF(([.B322]+1)<[Calendario.$F$5];[.B322]+1;"");"") ->  | C323: of:=IF(AND([.B323]>=[Calendario.$F$8];[.B323]<=[Calendario.$F$9];1);1;IF(AND([.B323]>=[Calendario.$F$12];[.B323]<=[Calendario.$F$13]);2;IF(AND([.B323]>=[Calendario.$F$16];[.B323]<=[Calendario.$F$17]);3;""))) ->  | D323: of:=IF(COUNTIF([Calendario.$H$4:.$H$48];[.B323])>0;"FIESTA";"") -> FIESTA | E323: of:=IF([.B323]<>"";VLOOKUP(WEEKDAY([.B323];3);[Calendario.$A$4:.$C$11];2);"") ->  | F323: of:=IF([.B323]<>"";IF([.D323]<>"FIESTA";VLOOKUP(WEEKDAY([.B323];3);[Calendario.$A$4:.$C$11];3);0);"") ->  | G323: of:=IF(ISNUMBER([.F323]);[.F323]+[.G322];"") ->  | H323: of:=IF(AND([.G323]<=[Unidades.$G$26];[.G323]<=[Unidades.$F$18];[Unidades.$F$18]>0);[Unidades.$D$18]+1-COUNTIFS([Unidades.$O$3:.$O$17];">="&[.G323]);"") ->  | I323: of:=IF([.H322]<>[.H323];"INICIO";IF([.H324]<>[.H323];"FIN";"")) ->  | J323: of:=IF([.K322]<>[.K323];"INICIO";IF([.K324]<>[.K323];"FIN";"")) -> 
A324: of:=IF([.B324]<>"";TODAY()>[.B324];"") ->  | B324: of:=IFERROR(IF(([.B323]+1)<[Calendario.$F$5];[.B323]+1;"");"") ->  | C324: of:=IF(AND([.B324]>=[Calendario.$F$8];[.B324]<=[Calendario.$F$9];1);1;IF(AND([.B324]>=[Calendario.$F$12];[.B324]<=[Calendario.$F$13]);2;IF(AND([.B324]>=[Calendario.$F$16];[.B324]<=[Calendario.$F$17]);3;""))) ->  | D324: of:=IF(COUNTIF([Calendario.$H$4:.$H$48];[.B324])>0;"FIESTA";"") -> FIESTA | E324: of:=IF([.B324]<>"";VLOOKUP(WEEKDAY([.B324];3);[Calendario.$A$4:.$C$11];2);"") ->  | F324: of:=IF([.B324]<>"";IF([.D324]<>"FIESTA";VLOOKUP(WEEKDAY([.B324];3);[Calendario.$A$4:.$C$11];3);0);"") ->  | G324: of:=IF(ISNUMBER([.F324]);[.F324]+[.G323];"") ->  | H324: of:=IF(AND([.G324]<=[Unidades.$G$26];[.G324]<=[Unidades.$F$18];[Unidades.$F$18]>0);[Unidades.$D$18]+1-COUNTIFS([Unidades.$O$3:.$O$17];">="&[.G324]);"") ->  | I324: of:=IF([.H323]<>[.H324];"INICIO";IF([.H325]<>[.H324];"FIN";"")) ->  | J324: of:=IF([.K323]<>[.K324];"INICIO";IF([.K325]<>[.K324];"FIN";"")) -> 
A325: of:=IF([.B325]<>"";TODAY()>[.B325];"") ->  | B325: of:=IFERROR(IF(([.B324]+1)<[Calendario.$F$5];[.B324]+1;"");"") ->  | C325: of:=IF(AND([.B325]>=[Calendario.$F$8];[.B325]<=[Calendario.$F$9];1);1;IF(AND([.B325]>=[Calendario.$F$12];[.B325]<=[Calendario.$F$13]);2;IF(AND([.B325]>=[Calendario.$F$16];[.B325]<=[Calendario.$F$17]);3;""))) ->  | D325: of:=IF(COUNTIF([Calendario.$H$4:.$H$48];[.B325])>0;"FIESTA";"") -> FIESTA | E325: of:=IF([.B325]<>"";VLOOKUP(WEEKDAY([.B325];3);[Calendario.$A$4:.$C$11];2);"") ->  | F325: of:=IF([.B325]<>"";IF([.D325]<>"FIESTA";VLOOKUP(WEEKDAY([.B325];3);[Calendario.$A$4:.$C$11];3);0);"") ->  | G325: of:=IF(ISNUMBER([.F325]);[.F325]+[.G324];"") ->  | H325: of:=IF(AND([.G325]<=[Unidades.$G$26];[.G325]<=[Unidades.$F$18];[Unidades.$F$18]>0);[Unidades.$D$18]+1-COUNTIFS([Unidades.$O$3:.$O$17];">="&[.G325]);"") ->  | I325: of:=IF([.H324]<>[.H325];"INICIO";IF([.H326]<>[.H325];"FIN";"")) ->  | J325: of:=IF([.K324]<>[.K325];"INICIO";IF([.K326]<>[.K325];"FIN";"")) -> 
A326: of:=IF([.B326]<>"";TODAY()>[.B326];"") ->  | B326: of:=IFERROR(IF(([.B325]+1)<[Calendario.$F$5];[.B325]+1;"");"") ->  | C326: of:=IF(AND([.B326]>=[Calendario.$F$8];[.B326]<=[Calendario.$F$9];1);1;IF(AND([.B326]>=[Calendario.$F$12];[.B326]<=[Calendario.$F$13]);2;IF(AND([.B326]>=[Calendario.$F$16];[.B326]<=[Calendario.$F$17]);3;""))) ->  | D326: of:=IF(COUNTIF([Calendario.$H$4:.$H$48];[.B326])>0;"FIESTA";"") -> FIESTA | E326: of:=IF([.B326]<>"";VLOOKUP(WEEKDAY([.B326];3);[Calendario.$A$4:.$C$11];2);"") ->  | F326: of:=IF([.B326]<>"";IF([.D326]<>"FIESTA";VLOOKUP(WEEKDAY([.B326];3);[Calendario.$A$4:.$C$11];3);0);"") ->  | G326: of:=IF(ISNUMBER([.F326]);[.F326]+[.G325];"") ->  | H326: of:=IF(AND([.G326]<=[Unidades.$G$26];[.G326]<=[Unidades.$F$18];[Unidades.$F$18]>0);[Unidades.$D$18]+1-COUNTIFS([Unidades.$O$3:.$O$17];">="&[.G326]);"") ->  | I326: of:=IF([.H325]<>[.H326];"INICIO";IF([.H327]<>[.H326];"FIN";"")) ->  | J326: of:=IF([.K325]<>[.K326];"INICIO";IF([.K327]<>[.K326];"FIN";"")) -> 
A327: of:=IF([.B327]<>"";TODAY()>[.B327];"") ->  | B327: of:=IFERROR(IF(([.B326]+1)<[Calendario.$F$5];[.B326]+1;"");"") ->  | C327: of:=IF(AND([.B327]>=[Calendario.$F$8];[.B327]<=[Calendario.$F$9];1);1;IF(AND([.B327]>=[Calendario.$F$12];[.B327]<=[Calendario.$F$13]);2;IF(AND([.B327]>=[Calendario.$F$16];[.B327]<=[Calendario.$F$17]);3;""))) ->  | D327: of:=IF(COUNTIF([Calendario.$H$4:.$H$48];[.B327])>0;"FIESTA";"") -> FIESTA | E327: of:=IF([.B327]<>"";VLOOKUP(WEEKDAY([.B327];3);[Calendario.$A$4:.$C$11];2);"") ->  | F327: of:=IF([.B327]<>"";IF([.D327]<>"FIESTA";VLOOKUP(WEEKDAY([.B327];3);[Calendario.$A$4:.$C$11];3);0);"") ->  | G327: of:=IF(ISNUMBER([.F327]);[.F327]+[.G326];"") ->  | H327: of:=IF(AND([.G327]<=[Unidades.$G$26];[.G327]<=[Unidades.$F$18];[Unidades.$F$18]>0);[Unidades.$D$18]+1-COUNTIFS([Unidades.$O$3:.$O$17];">="&[.G327]);"") ->  | I327: of:=IF([.H326]<>[.H327];"INICIO";IF([.H328]<>[.H327];"FIN";"")) ->  | J327: of:=IF([.K326]<>[.K327];"INICIO";IF([.K328]<>[.K327];"FIN";"")) -> 
A328: of:=IF([.B328]<>"";TODAY()>[.B328];"") ->  | B328: of:=IFERROR(IF(([.B327]+1)<[Calendario.$F$5];[.B327]+1;"");"") ->  | C328: of:=IF(AND([.B328]>=[Calendario.$F$8];[.B328]<=[Calendario.$F$9];1);1;IF(AND([.B328]>=[Calendario.$F$12];[.B328]<=[Calendario.$F$13]);2;IF(AND([.B328]>=[Calendario.$F$16];[.B328]<=[Calendario.$F$17]);3;""))) ->  | D328: of:=IF(COUNTIF([Calendario.$H$4:.$H$48];[.B328])>0;"FIESTA";"") -> FIESTA | E328: of:=IF([.B328]<>"";VLOOKUP(WEEKDAY([.B328];3);[Calendario.$A$4:.$C$11];2);"") ->  | F328: of:=IF([.B328]<>"";IF([.D328]<>"FIESTA";VLOOKUP(WEEKDAY([.B328];3);[Calendario.$A$4:.$C$11];3);0);"") ->  | G328: of:=IF(ISNUMBER([.F328]);[.F328]+[.G327];"") ->  | H328: of:=IF(AND([.G328]<=[Unidades.$G$26];[.G328]<=[Unidades.$F$18];[Unidades.$F$18]>0);[Unidades.$D$18]+1-COUNTIFS([Unidades.$O$3:.$O$17];">="&[.G328]);"") ->  | I328: of:=IF([.H327]<>[.H328];"INICIO";IF([.H329]<>[.H328];"FIN";"")) ->  | J328: of:=IF([.K327]<>[.K328];"INICIO";IF([.K329]<>[.K328];"FIN";"")) -> 
A329: of:=IF([.B329]<>"";TODAY()>[.B329];"") ->  | B329: of:=IFERROR(IF(([.B328]+1)<[Calendario.$F$5];[.B328]+1;"");"") ->  | C329: of:=IF(AND([.B329]>=[Calendario.$F$8];[.B329]<=[Calendario.$F$9];1);1;IF(AND([.B329]>=[Calendario.$F$12];[.B329]<=[Calendario.$F$13]);2;IF(AND([.B329]>=[Calendario.$F$16];[.B329]<=[Calendario.$F$17]);3;""))) ->  | D329: of:=IF(COUNTIF([Calendario.$H$4:.$H$48];[.B329])>0;"FIESTA";"") -> FIESTA | E329: of:=IF([.B329]<>"";VLOOKUP(WEEKDAY([.B329];3);[Calendario.$A$4:.$C$11];2);"") ->  | F329: of:=IF([.B329]<>"";IF([.D329]<>"FIESTA";VLOOKUP(WEEKDAY([.B329];3);[Calendario.$A$4:.$C$11];3);0);"") ->  | G329: of:=IF(ISNUMBER([.F329]);[.F329]+[.G328];"") ->  | H329: of:=IF(AND([.G329]<=[Unidades.$G$26];[.G329]<=[Unidades.$F$18];[Unidades.$F$18]>0);[Unidades.$D$18]+1-COUNTIFS([Unidades.$O$3:.$O$17];">="&[.G329]);"") ->  | I329: of:=IF([.H328]<>[.H329];"INICIO";IF([.H330]<>[.H329];"FIN";"")) ->  | J329: of:=IF([.K328]<>[.K329];"INICIO";IF([.K330]<>[.K329];"FIN";"")) -> 
A330: of:=IF([.B330]<>"";TODAY()>[.B330];"") ->  | B330: of:=IFERROR(IF(([.B329]+1)<[Calendario.$F$5];[.B329]+1;"");"") ->  | C330: of:=IF(AND([.B330]>=[Calendario.$F$8];[.B330]<=[Calendario.$F$9];1);1;IF(AND([.B330]>=[Calendario.$F$12];[.B330]<=[Calendario.$F$13]);2;IF(AND([.B330]>=[Calendario.$F$16];[.B330]<=[Calendario.$F$17]);3;""))) ->  | D330: of:=IF(COUNTIF([Calendario.$H$4:.$H$48];[.B330])>0;"FIESTA";"") -> FIESTA | E330: of:=IF([.B330]<>"";VLOOKUP(WEEKDAY([.B330];3);[Calendario.$A$4:.$C$11];2);"") ->  | F330: of:=IF([.B330]<>"";IF([.D330]<>"FIESTA";VLOOKUP(WEEKDAY([.B330];3);[Calendario.$A$4:.$C$11];3);0);"") ->  | G330: of:=IF(ISNUMBER([.F330]);[.F330]+[.G329];"") ->  | H330: of:=IF(AND([.G330]<=[Unidades.$G$26];[.G330]<=[Unidades.$F$18];[Unidades.$F$18]>0);[Unidades.$D$18]+1-COUNTIFS([Unidades.$O$3:.$O$17];">="&[.G330]);"") ->  | I330: of:=IF([.H329]<>[.H330];"INICIO";IF([.H331]<>[.H330];"FIN";"")) ->  | J330: of:=IF([.K329]<>[.K330];"INICIO";IF([.K331]<>[.K330];"FIN";"")) -> 
A331: of:=IF([.B331]<>"";TODAY()>[.B331];"") ->  | B331: of:=IFERROR(IF(([.B330]+1)<[Calendario.$F$5];[.B330]+1;"");"") ->  | C331: of:=IF(AND([.B331]>=[Calendario.$F$8];[.B331]<=[Calendario.$F$9];1);1;IF(AND([.B331]>=[Calendario.$F$12];[.B331]<=[Calendario.$F$13]);2;IF(AND([.B331]>=[Calendario.$F$16];[.B331]<=[Calendario.$F$17]);3;""))) ->  | D331: of:=IF(COUNTIF([Calendario.$H$4:.$H$48];[.B331])>0;"FIESTA";"") -> FIESTA | E331: of:=IF([.B331]<>"";VLOOKUP(WEEKDAY([.B331];3);[Calendario.$A$4:.$C$11];2);"") ->  | F331: of:=IF([.B331]<>"";IF([.D331]<>"FIESTA";VLOOKUP(WEEKDAY([.B331];3);[Calendario.$A$4:.$C$11];3);0);"") ->  | G331: of:=IF(ISNUMBER([.F331]);[.F331]+[.G330];"") ->  | H331: of:=IF(AND([.G331]<=[Unidades.$G$26];[.G331]<=[Unidades.$F$18];[Unidades.$F$18]>0);[Unidades.$D$18]+1-COUNTIFS([Unidades.$O$3:.$O$17];">="&[.G331]);"") ->  | I331: of:=IF([.H330]<>[.H331];"INICIO";IF([.H332]<>[.H331];"FIN";"")) ->  | J331: of:=IF([.K330]<>[.K331];"INICIO";IF([.K332]<>[.K331];"FIN";"")) -> 
A332: of:=IF([.B332]<>"";TODAY()>[.B332];"") ->  | B332: of:=IFERROR(IF(([.B331]+1)<[Calendario.$F$5];[.B331]+1;"");"") ->  | C332: of:=IF(AND([.B332]>=[Calendario.$F$8];[.B332]<=[Calendario.$F$9];1);1;IF(AND([.B332]>=[Calendario.$F$12];[.B332]<=[Calendario.$F$13]);2;IF(AND([.B332]>=[Calendario.$F$16];[.B332]<=[Calendario.$F$17]);3;""))) ->  | D332: of:=IF(COUNTIF([Calendario.$H$4:.$H$48];[.B332])>0;"FIESTA";"") -> FIESTA | E332: of:=IF([.B332]<>"";VLOOKUP(WEEKDAY([.B332];3);[Calendario.$A$4:.$C$11];2);"") ->  | F332: of:=IF([.B332]<>"";IF([.D332]<>"FIESTA";VLOOKUP(WEEKDAY([.B332];3);[Calendario.$A$4:.$C$11];3);0);"") ->  | G332: of:=IF(ISNUMBER([.F332]);[.F332]+[.G331];"") ->  | H332: of:=IF(AND([.G332]<=[Unidades.$G$26];[.G332]<=[Unidades.$F$18];[Unidades.$F$18]>0);[Unidades.$D$18]+1-COUNTIFS([Unidades.$O$3:.$O$17];">="&[.G332]);"") ->  | I332: of:=IF([.H331]<>[.H332];"INICIO";IF([.H333]<>[.H332];"FIN";"")) ->  | J332: of:=IF([.K331]<>[.K332];"INICIO";IF([.K333]<>[.K332];"FIN";"")) -> 
A333: of:=IF([.B333]<>"";TODAY()>[.B333];"") ->  | B333: of:=IFERROR(IF(([.B332]+1)<[Calendario.$F$5];[.B332]+1;"");"") ->  | C333: of:=IF(AND([.B333]>=[Calendario.$F$8];[.B333]<=[Calendario.$F$9];1);1;IF(AND([.B333]>=[Calendario.$F$12];[.B333]<=[Calendario.$F$13]);2;IF(AND([.B333]>=[Calendario.$F$16];[.B333]<=[Calendario.$F$17]);3;""))) ->  | D333: of:=IF(COUNTIF([Calendario.$H$4:.$H$48];[.B333])>0;"FIESTA";"") -> FIESTA | E333: of:=IF([.B333]<>"";VLOOKUP(WEEKDAY([.B333];3);[Calendario.$A$4:.$C$11];2);"") ->  | F333: of:=IF([.B333]<>"";IF([.D333]<>"FIESTA";VLOOKUP(WEEKDAY([.B333];3);[Calendario.$A$4:.$C$11];3);0);"") ->  | G333: of:=IF(ISNUMBER([.F333]);[.F333]+[.G332];"") ->  | H333: of:=IF(AND([.G333]<=[Unidades.$G$26];[.G333]<=[Unidades.$F$18];[Unidades.$F$18]>0);[Unidades.$D$18]+1-COUNTIFS([Unidades.$O$3:.$O$17];">="&[.G333]);"") ->  | I333: of:=IF([.H332]<>[.H333];"INICIO";IF([.H334]<>[.H333];"FIN";"")) ->  | J333: of:=IF([.K332]<>[.K333];"INICIO";IF([.K334]<>[.K333];"FIN";"")) -> 
A334: of:=IF([.B334]<>"";TODAY()>[.B334];"") ->  | B334: of:=IFERROR(IF(([.B333]+1)<[Calendario.$F$5];[.B333]+1;"");"") ->  | C334: of:=IF(AND([.B334]>=[Calendario.$F$8];[.B334]<=[Calendario.$F$9];1);1;IF(AND([.B334]>=[Calendario.$F$12];[.B334]<=[Calendario.$F$13]);2;IF(AND([.B334]>=[Calendario.$F$16];[.B334]<=[Calendario.$F$17]);3;""))) ->  | D334: of:=IF(COUNTIF([Calendario.$H$4:.$H$48];[.B334])>0;"FIESTA";"") -> FIESTA | E334: of:=IF([.B334]<>"";VLOOKUP(WEEKDAY([.B334];3);[Calendario.$A$4:.$C$11];2);"") ->  | F334: of:=IF([.B334]<>"";IF([.D334]<>"FIESTA";VLOOKUP(WEEKDAY([.B334];3);[Calendario.$A$4:.$C$11];3);0);"") ->  | G334: of:=IF(ISNUMBER([.F334]);[.F334]+[.G333];"") ->  | H334: of:=IF(AND([.G334]<=[Unidades.$G$26];[.G334]<=[Unidades.$F$18];[Unidades.$F$18]>0);[Unidades.$D$18]+1-COUNTIFS([Unidades.$O$3:.$O$17];">="&[.G334]);"") ->  | I334: of:=IF([.H333]<>[.H334];"INICIO";IF([.H335]<>[.H334];"FIN";"")) ->  | J334: of:=IF([.K333]<>[.K334];"INICIO";IF([.K335]<>[.K334];"FIN";"")) -> 
A335: of:=IF([.B335]<>"";TODAY()>[.B335];"") ->  | B335: of:=IFERROR(IF(([.B334]+1)<[Calendario.$F$5];[.B334]+1;"");"") ->  | C335: of:=IF(AND([.B335]>=[Calendario.$F$8];[.B335]<=[Calendario.$F$9];1);1;IF(AND([.B335]>=[Calendario.$F$12];[.B335]<=[Calendario.$F$13]);2;IF(AND([.B335]>=[Calendario.$F$16];[.B335]<=[Calendario.$F$17]);3;""))) ->  | D335: of:=IF(COUNTIF([Calendario.$H$4:.$H$48];[.B335])>0;"FIESTA";"") -> FIESTA | E335: of:=IF([.B335]<>"";VLOOKUP(WEEKDAY([.B335];3);[Calendario.$A$4:.$C$11];2);"") ->  | F335: of:=IF([.B335]<>"";IF([.D335]<>"FIESTA";VLOOKUP(WEEKDAY([.B335];3);[Calendario.$A$4:.$C$11];3);0);"") ->  | G335: of:=IF(ISNUMBER([.F335]);[.F335]+[.G334];"") ->  | H335: of:=IF(AND([.G335]<=[Unidades.$G$26];[.G335]<=[Unidades.$F$18];[Unidades.$F$18]>0);[Unidades.$D$18]+1-COUNTIFS([Unidades.$O$3:.$O$17];">="&[.G335]);"") ->  | I335: of:=IF([.H334]<>[.H335];"INICIO";IF([.H336]<>[.H335];"FIN";"")) ->  | J335: of:=IF([.K334]<>[.K335];"INICIO";IF([.K336]<>[.K335];"FIN";"")) -> 
A336: of:=IF([.B336]<>"";TODAY()>[.B336];"") ->  | B336: of:=IFERROR(IF(([.B335]+1)<[Calendario.$F$5];[.B335]+1;"");"") ->  | C336: of:=IF(AND([.B336]>=[Calendario.$F$8];[.B336]<=[Calendario.$F$9];1);1;IF(AND([.B336]>=[Calendario.$F$12];[.B336]<=[Calendario.$F$13]);2;IF(AND([.B336]>=[Calendario.$F$16];[.B336]<=[Calendario.$F$17]);3;""))) ->  | D336: of:=IF(COUNTIF([Calendario.$H$4:.$H$48];[.B336])>0;"FIESTA";"") -> FIESTA | E336: of:=IF([.B336]<>"";VLOOKUP(WEEKDAY([.B336];3);[Calendario.$A$4:.$C$11];2);"") ->  | F336: of:=IF([.B336]<>"";IF([.D336]<>"FIESTA";VLOOKUP(WEEKDAY([.B336];3);[Calendario.$A$4:.$C$11];3);0);"") ->  | G336: of:=IF(ISNUMBER([.F336]);[.F336]+[.G335];"") ->  | H336: of:=IF(AND([.G336]<=[Unidades.$G$26];[.G336]<=[Unidades.$F$18];[Unidades.$F$18]>0);[Unidades.$D$18]+1-COUNTIFS([Unidades.$O$3:.$O$17];">="&[.G336]);"") ->  | I336: of:=IF([.H335]<>[.H336];"INICIO";IF([.H337]<>[.H336];"FIN";"")) ->  | J336: of:=IF([.K335]<>[.K336];"INICIO";IF([.K337]<>[.K336];"FIN";"")) -> 
A337: of:=IF([.B337]<>"";TODAY()>[.B337];"") ->  | B337: of:=IFERROR(IF(([.B336]+1)<[Calendario.$F$5];[.B336]+1;"");"") ->  | C337: of:=IF(AND([.B337]>=[Calendario.$F$8];[.B337]<=[Calendario.$F$9];1);1;IF(AND([.B337]>=[Calendario.$F$12];[.B337]<=[Calendario.$F$13]);2;IF(AND([.B337]>=[Calendario.$F$16];[.B337]<=[Calendario.$F$17]);3;""))) ->  | D337: of:=IF(COUNTIF([Calendario.$H$4:.$H$48];[.B337])>0;"FIESTA";"") -> FIESTA | E337: of:=IF([.B337]<>"";VLOOKUP(WEEKDAY([.B337];3);[Calendario.$A$4:.$C$11];2);"") ->  | F337: of:=IF([.B337]<>"";IF([.D337]<>"FIESTA";VLOOKUP(WEEKDAY([.B337];3);[Calendario.$A$4:.$C$11];3);0);"") ->  | G337: of:=IF(ISNUMBER([.F337]);[.F337]+[.G336];"") ->  | H337: of:=IF(AND([.G337]<=[Unidades.$G$26];[.G337]<=[Unidades.$F$18];[Unidades.$F$18]>0);[Unidades.$D$18]+1-COUNTIFS([Unidades.$O$3:.$O$17];">="&[.G337]);"") ->  | I337: of:=IF([.H336]<>[.H337];"INICIO";IF([.H338]<>[.H337];"FIN";"")) ->  | J337: of:=IF([.K336]<>[.K337];"INICIO";IF([.K338]<>[.K337];"FIN";"")) -> 
A338: of:=IF([.B338]<>"";TODAY()>[.B338];"") ->  | B338: of:=IFERROR(IF(([.B337]+1)<[Calendario.$F$5];[.B337]+1;"");"") ->  | C338: of:=IF(AND([.B338]>=[Calendario.$F$8];[.B338]<=[Calendario.$F$9];1);1;IF(AND([.B338]>=[Calendario.$F$12];[.B338]<=[Calendario.$F$13]);2;IF(AND([.B338]>=[Calendario.$F$16];[.B338]<=[Calendario.$F$17]);3;""))) ->  | D338: of:=IF(COUNTIF([Calendario.$H$4:.$H$48];[.B338])>0;"FIESTA";"") -> FIESTA | E338: of:=IF([.B338]<>"";VLOOKUP(WEEKDAY([.B338];3);[Calendario.$A$4:.$C$11];2);"") ->  | F338: of:=IF([.B338]<>"";IF([.D338]<>"FIESTA";VLOOKUP(WEEKDAY([.B338];3);[Calendario.$A$4:.$C$11];3);0);"") ->  | G338: of:=IF(ISNUMBER([.F338]);[.F338]+[.G337];"") ->  | H338: of:=IF(AND([.G338]<=[Unidades.$G$26];[.G338]<=[Unidades.$F$18];[Unidades.$F$18]>0);[Unidades.$D$18]+1-COUNTIFS([Unidades.$O$3:.$O$17];">="&[.G338]);"") ->  | I338: of:=IF([.H337]<>[.H338];"INICIO";IF([.H339]<>[.H338];"FIN";"")) ->  | J338: of:=IF([.K337]<>[.K338];"INICIO";IF([.K339]<>[.K338];"FIN";"")) -> 
A339: of:=IF([.B339]<>"";TODAY()>[.B339];"") ->  | B339: of:=IFERROR(IF(([.B338]+1)<[Calendario.$F$5];[.B338]+1;"");"") ->  | C339: of:=IF(AND([.B339]>=[Calendario.$F$8];[.B339]<=[Calendario.$F$9];1);1;IF(AND([.B339]>=[Calendario.$F$12];[.B339]<=[Calendario.$F$13]);2;IF(AND([.B339]>=[Calendario.$F$16];[.B339]<=[Calendario.$F$17]);3;""))) ->  | D339: of:=IF(COUNTIF([Calendario.$H$4:.$H$48];[.B339])>0;"FIESTA";"") -> FIESTA | E339: of:=IF([.B339]<>"";VLOOKUP(WEEKDAY([.B339];3);[Calendario.$A$4:.$C$11];2);"") ->  | F339: of:=IF([.B339]<>"";IF([.D339]<>"FIESTA";VLOOKUP(WEEKDAY([.B339];3);[Calendario.$A$4:.$C$11];3);0);"") ->  | G339: of:=IF(ISNUMBER([.F339]);[.F339]+[.G338];"") ->  | H339: of:=IF(AND([.G339]<=[Unidades.$G$26];[.G339]<=[Unidades.$F$18];[Unidades.$F$18]>0);[Unidades.$D$18]+1-COUNTIFS([Unidades.$O$3:.$O$17];">="&[.G339]);"") ->  | I339: of:=IF([.H338]<>[.H339];"INICIO";IF([.H340]<>[.H339];"FIN";"")) ->  | J339: of:=IF([.K338]<>[.K339];"INICIO";IF([.K340]<>[.K339];"FIN";"")) -> 
A340: of:=IF([.B340]<>"";TODAY()>[.B340];"") ->  | B340: of:=IFERROR(IF(([.B339]+1)<[Calendario.$F$5];[.B339]+1;"");"") ->  | C340: of:=IF(AND([.B340]>=[Calendario.$F$8];[.B340]<=[Calendario.$F$9];1);1;IF(AND([.B340]>=[Calendario.$F$12];[.B340]<=[Calendario.$F$13]);2;IF(AND([.B340]>=[Calendario.$F$16];[.B340]<=[Calendario.$F$17]);3;""))) ->  | D340: of:=IF(COUNTIF([Calendario.$H$4:.$H$48];[.B340])>0;"FIESTA";"") -> FIESTA | E340: of:=IF([.B340]<>"";VLOOKUP(WEEKDAY([.B340];3);[Calendario.$A$4:.$C$11];2);"") ->  | F340: of:=IF([.B340]<>"";IF([.D340]<>"FIESTA";VLOOKUP(WEEKDAY([.B340];3);[Calendario.$A$4:.$C$11];3);0);"") ->  | G340: of:=IF(ISNUMBER([.F340]);[.F340]+[.G339];"") ->  | H340: of:=IF(AND([.G340]<=[Unidades.$G$26];[.G340]<=[Unidades.$F$18];[Unidades.$F$18]>0);[Unidades.$D$18]+1-COUNTIFS([Unidades.$O$3:.$O$17];">="&[.G340]);"") ->  | I340: of:=IF([.H339]<>[.H340];"INICIO";IF([.H341]<>[.H340];"FIN";"")) ->  | J340: of:=IF([.K339]<>[.K340];"INICIO";IF([.K341]<>[.K340];"FIN";"")) -> 
A341: of:=IF([.B341]<>"";TODAY()>[.B341];"") ->  | B341: of:=IFERROR(IF(([.B340]+1)<[Calendario.$F$5];[.B340]+1;"");"") ->  | C341: of:=IF(AND([.B341]>=[Calendario.$F$8];[.B341]<=[Calendario.$F$9];1);1;IF(AND([.B341]>=[Calendario.$F$12];[.B341]<=[Calendario.$F$13]);2;IF(AND([.B341]>=[Calendario.$F$16];[.B341]<=[Calendario.$F$17]);3;""))) ->  | D341: of:=IF(COUNTIF([Calendario.$H$4:.$H$48];[.B341])>0;"FIESTA";"") -> FIESTA | E341: of:=IF([.B341]<>"";VLOOKUP(WEEKDAY([.B341];3);[Calendario.$A$4:.$C$11];2);"") ->  | F341: of:=IF([.B341]<>"";IF([.D341]<>"FIESTA";VLOOKUP(WEEKDAY([.B341];3);[Calendario.$A$4:.$C$11];3);0);"") ->  | G341: of:=IF(ISNUMBER([.F341]);[.F341]+[.G340];"") ->  | H341: of:=IF(AND([.G341]<=[Unidades.$G$26];[.G341]<=[Unidades.$F$18];[Unidades.$F$18]>0);[Unidades.$D$18]+1-COUNTIFS([Unidades.$O$3:.$O$17];">="&[.G341]);"") ->  | I341: of:=IF([.H340]<>[.H341];"INICIO";IF([.H342]<>[.H341];"FIN";"")) ->  | J341: of:=IF([.K340]<>[.K341];"INICIO";IF([.K342]<>[.K341];"FIN";"")) -> 
A342: of:=IF([.B342]<>"";TODAY()>[.B342];"") ->  | B342: of:=IFERROR(IF(([.B341]+1)<[Calendario.$F$5];[.B341]+1;"");"") ->  | C342: of:=IF(AND([.B342]>=[Calendario.$F$8];[.B342]<=[Calendario.$F$9];1);1;IF(AND([.B342]>=[Calendario.$F$12];[.B342]<=[Calendario.$F$13]);2;IF(AND([.B342]>=[Calendario.$F$16];[.B342]<=[Calendario.$F$17]);3;""))) ->  | D342: of:=IF(COUNTIF([Calendario.$H$4:.$H$48];[.B342])>0;"FIESTA";"") -> FIESTA | E342: of:=IF([.B342]<>"";VLOOKUP(WEEKDAY([.B342];3);[Calendario.$A$4:.$C$11];2);"") ->  | F342: of:=IF([.B342]<>"";IF([.D342]<>"FIESTA";VLOOKUP(WEEKDAY([.B342];3);[Calendario.$A$4:.$C$11];3);0);"") ->  | G342: of:=IF(ISNUMBER([.F342]);[.F342]+[.G341];"") ->  | H342: of:=IF(AND([.G342]<=[Unidades.$G$26];[.G342]<=[Unidades.$F$18];[Unidades.$F$18]>0);[Unidades.$D$18]+1-COUNTIFS([Unidades.$O$3:.$O$17];">="&[.G342]);"") ->  | I342: of:=IF([.H341]<>[.H342];"INICIO";IF([.H343]<>[.H342];"FIN";"")) ->  | J342: of:=IF([.K341]<>[.K342];"INICIO";IF([.K343]<>[.K342];"FIN";"")) -> 
A343: of:=IF([.B343]<>"";TODAY()>[.B343];"") ->  | B343: of:=IFERROR(IF(([.B342]+1)<[Calendario.$F$5];[.B342]+1;"");"") ->  | C343: of:=IF(AND([.B343]>=[Calendario.$F$8];[.B343]<=[Calendario.$F$9];1);1;IF(AND([.B343]>=[Calendario.$F$12];[.B343]<=[Calendario.$F$13]);2;IF(AND([.B343]>=[Calendario.$F$16];[.B343]<=[Calendario.$F$17]);3;""))) ->  | D343: of:=IF(COUNTIF([Calendario.$H$4:.$H$48];[.B343])>0;"FIESTA";"") -> FIESTA | E343: of:=IF([.B343]<>"";VLOOKUP(WEEKDAY([.B343];3);[Calendario.$A$4:.$C$11];2);"") ->  | F343: of:=IF([.B343]<>"";IF([.D343]<>"FIESTA";VLOOKUP(WEEKDAY([.B343];3);[Calendario.$A$4:.$C$11];3);0);"") ->  | G343: of:=IF(ISNUMBER([.F343]);[.F343]+[.G342];"") ->  | H343: of:=IF(AND([.G343]<=[Unidades.$G$26];[.G343]<=[Unidades.$F$18];[Unidades.$F$18]>0);[Unidades.$D$18]+1-COUNTIFS([Unidades.$O$3:.$O$17];">="&[.G343]);"") ->  | I343: of:=IF([.H342]<>[.H343];"INICIO";IF([.H344]<>[.H343];"FIN";"")) ->  | J343: of:=IF([.K342]<>[.K343];"INICIO";IF([.K344]<>[.K343];"FIN";"")) -> 
A344: of:=IF([.B344]<>"";TODAY()>[.B344];"") ->  | B344: of:=IFERROR(IF(([.B343]+1)<[Calendario.$F$5];[.B343]+1;"");"") ->  | C344: of:=IF(AND([.B344]>=[Calendario.$F$8];[.B344]<=[Calendario.$F$9];1);1;IF(AND([.B344]>=[Calendario.$F$12];[.B344]<=[Calendario.$F$13]);2;IF(AND([.B344]>=[Calendario.$F$16];[.B344]<=[Calendario.$F$17]);3;""))) ->  | D344: of:=IF(COUNTIF([Calendario.$H$4:.$H$48];[.B344])>0;"FIESTA";"") -> FIESTA | E344: of:=IF([.B344]<>"";VLOOKUP(WEEKDAY([.B344];3);[Calendario.$A$4:.$C$11];2);"") ->  | F344: of:=IF([.B344]<>"";IF([.D344]<>"FIESTA";VLOOKUP(WEEKDAY([.B344];3);[Calendario.$A$4:.$C$11];3);0);"") ->  | G344: of:=IF(ISNUMBER([.F344]);[.F344]+[.G343];"") ->  | H344: of:=IF(AND([.G344]<=[Unidades.$G$26];[.G344]<=[Unidades.$F$18];[Unidades.$F$18]>0);[Unidades.$D$18]+1-COUNTIFS([Unidades.$O$3:.$O$17];">="&[.G344]);"") ->  | I344: of:=IF([.H343]<>[.H344];"INICIO";IF([.H345]<>[.H344];"FIN";"")) ->  | J344: of:=IF([.K343]<>[.K344];"INICIO";IF([.K345]<>[.K344];"FIN";"")) -> 
A345: of:=IF([.B345]<>"";TODAY()>[.B345];"") ->  | B345: of:=IFERROR(IF(([.B344]+1)<[Calendario.$F$5];[.B344]+1;"");"") ->  | C345: of:=IF(AND([.B345]>=[Calendario.$F$8];[.B345]<=[Calendario.$F$9];1);1;IF(AND([.B345]>=[Calendario.$F$12];[.B345]<=[Calendario.$F$13]);2;IF(AND([.B345]>=[Calendario.$F$16];[.B345]<=[Calendario.$F$17]);3;""))) ->  | D345: of:=IF(COUNTIF([Calendario.$H$4:.$H$48];[.B345])>0;"FIESTA";"") -> FIESTA | E345: of:=IF([.B345]<>"";VLOOKUP(WEEKDAY([.B345];3);[Calendario.$A$4:.$C$11];2);"") ->  | F345: of:=IF([.B345]<>"";IF([.D345]<>"FIESTA";VLOOKUP(WEEKDAY([.B345];3);[Calendario.$A$4:.$C$11];3);0);"") ->  | G345: of:=IF(ISNUMBER([.F345]);[.F345]+[.G344];"") ->  | H345: of:=IF(AND([.G345]<=[Unidades.$G$26];[.G345]<=[Unidades.$F$18];[Unidades.$F$18]>0);[Unidades.$D$18]+1-COUNTIFS([Unidades.$O$3:.$O$17];">="&[.G345]);"") ->  | I345: of:=IF([.H344]<>[.H345];"INICIO";IF([.H346]<>[.H345];"FIN";"")) ->  | J345: of:=IF([.K344]<>[.K345];"INICIO";IF([.K346]<>[.K345];"FIN";"")) -> 
A346: of:=IF([.B346]<>"";TODAY()>[.B346];"") ->  | B346: of:=IFERROR(IF(([.B345]+1)<[Calendario.$F$5];[.B345]+1;"");"") ->  | C346: of:=IF(AND([.B346]>=[Calendario.$F$8];[.B346]<=[Calendario.$F$9];1);1;IF(AND([.B346]>=[Calendario.$F$12];[.B346]<=[Calendario.$F$13]);2;IF(AND([.B346]>=[Calendario.$F$16];[.B346]<=[Calendario.$F$17]);3;""))) ->  | D346: of:=IF(COUNTIF([Calendario.$H$4:.$H$48];[.B346])>0;"FIESTA";"") -> FIESTA | E346: of:=IF([.B346]<>"";VLOOKUP(WEEKDAY([.B346];3);[Calendario.$A$4:.$C$11];2);"") ->  | F346: of:=IF([.B346]<>"";IF([.D346]<>"FIESTA";VLOOKUP(WEEKDAY([.B346];3);[Calendario.$A$4:.$C$11];3);0);"") ->  | G346: of:=IF(ISNUMBER([.F346]);[.F346]+[.G345];"") ->  | H346: of:=IF(AND([.G346]<=[Unidades.$G$26];[.G346]<=[Unidades.$F$18];[Unidades.$F$18]>0);[Unidades.$D$18]+1-COUNTIFS([Unidades.$O$3:.$O$17];">="&[.G346]);"") ->  | I346: of:=IF([.H345]<>[.H346];"INICIO";IF([.H347]<>[.H346];"FIN";"")) ->  | J346: of:=IF([.K345]<>[.K346];"INICIO";IF([.K347]<>[.K346];"FIN";"")) -> 
A347: of:=IF([.B347]<>"";TODAY()>[.B347];"") ->  | B347: of:=IFERROR(IF(([.B346]+1)<[Calendario.$F$5];[.B346]+1;"");"") ->  | C347: of:=IF(AND([.B347]>=[Calendario.$F$8];[.B347]<=[Calendario.$F$9];1);1;IF(AND([.B347]>=[Calendario.$F$12];[.B347]<=[Calendario.$F$13]);2;IF(AND([.B347]>=[Calendario.$F$16];[.B347]<=[Calendario.$F$17]);3;""))) ->  | D347: of:=IF(COUNTIF([Calendario.$H$4:.$H$48];[.B347])>0;"FIESTA";"") -> FIESTA | E347: of:=IF([.B347]<>"";VLOOKUP(WEEKDAY([.B347];3);[Calendario.$A$4:.$C$11];2);"") ->  | F347: of:=IF([.B347]<>"";IF([.D347]<>"FIESTA";VLOOKUP(WEEKDAY([.B347];3);[Calendario.$A$4:.$C$11];3);0);"") ->  | G347: of:=IF(ISNUMBER([.F347]);[.F347]+[.G346];"") ->  | H347: of:=IF(AND([.G347]<=[Unidades.$G$26];[.G347]<=[Unidades.$F$18];[Unidades.$F$18]>0);[Unidades.$D$18]+1-COUNTIFS([Unidades.$O$3:.$O$17];">="&[.G347]);"") ->  | I347: of:=IF([.H346]<>[.H347];"INICIO";IF([.H348]<>[.H347];"FIN";"")) ->  | J347: of:=IF([.K346]<>[.K347];"INICIO";IF([.K348]<>[.K347];"FIN";"")) -> 
A348: of:=IF([.B348]<>"";TODAY()>[.B348];"") ->  | B348: of:=IFERROR(IF(([.B347]+1)<[Calendario.$F$5];[.B347]+1;"");"") ->  | C348: of:=IF(AND([.B348]>=[Calendario.$F$8];[.B348]<=[Calendario.$F$9];1);1;IF(AND([.B348]>=[Calendario.$F$12];[.B348]<=[Calendario.$F$13]);2;IF(AND([.B348]>=[Calendario.$F$16];[.B348]<=[Calendario.$F$17]);3;""))) ->  | D348: of:=IF(COUNTIF([Calendario.$H$4:.$H$48];[.B348])>0;"FIESTA";"") -> FIESTA | E348: of:=IF([.B348]<>"";VLOOKUP(WEEKDAY([.B348];3);[Calendario.$A$4:.$C$11];2);"") ->  | F348: of:=IF([.B348]<>"";IF([.D348]<>"FIESTA";VLOOKUP(WEEKDAY([.B348];3);[Calendario.$A$4:.$C$11];3);0);"") ->  | G348: of:=IF(ISNUMBER([.F348]);[.F348]+[.G347];"") ->  | H348: of:=IF(AND([.G348]<=[Unidades.$G$26];[.G348]<=[Unidades.$F$18];[Unidades.$F$18]>0);[Unidades.$D$18]+1-COUNTIFS([Unidades.$O$3:.$O$17];">="&[.G348]);"") ->  | I348: of:=IF([.H347]<>[.H348];"INICIO";IF([.H349]<>[.H348];"FIN";"")) ->  | J348: of:=IF([.K347]<>[.K348];"INICIO";IF([.K349]<>[.K348];"FIN";"")) -> 
A349: of:=IF([.B349]<>"";TODAY()>[.B349];"") ->  | B349: of:=IFERROR(IF(([.B348]+1)<[Calendario.$F$5];[.B348]+1;"");"") ->  | C349: of:=IF(AND([.B349]>=[Calendario.$F$8];[.B349]<=[Calendario.$F$9];1);1;IF(AND([.B349]>=[Calendario.$F$12];[.B349]<=[Calendario.$F$13]);2;IF(AND([.B349]>=[Calendario.$F$16];[.B349]<=[Calendario.$F$17]);3;""))) ->  | D349: of:=IF(COUNTIF([Calendario.$H$4:.$H$48];[.B349])>0;"FIESTA";"") -> FIESTA | E349: of:=IF([.B349]<>"";VLOOKUP(WEEKDAY([.B349];3);[Calendario.$A$4:.$C$11];2);"") ->  | F349: of:=IF([.B349]<>"";IF([.D349]<>"FIESTA";VLOOKUP(WEEKDAY([.B349];3);[Calendario.$A$4:.$C$11];3);0);"") ->  | G349: of:=IF(ISNUMBER([.F349]);[.F349]+[.G348];"") ->  | H349: of:=IF(AND([.G349]<=[Unidades.$G$26];[.G349]<=[Unidades.$F$18];[Unidades.$F$18]>0);[Unidades.$D$18]+1-COUNTIFS([Unidades.$O$3:.$O$17];">="&[.G349]);"") ->  | I349: of:=IF([.H348]<>[.H349];"INICIO";IF([.H350]<>[.H349];"FIN";"")) ->  | J349: of:=IF([.K348]<>[.K349];"INICIO";IF([.K350]<>[.K349];"FIN";"")) -> 
A350: of:=IF([.B350]<>"";TODAY()>[.B350];"") ->  | B350: of:=IFERROR(IF(([.B349]+1)<[Calendario.$F$5];[.B349]+1;"");"") ->  | C350: of:=IF(AND([.B350]>=[Calendario.$F$8];[.B350]<=[Calendario.$F$9];1);1;IF(AND([.B350]>=[Calendario.$F$12];[.B350]<=[Calendario.$F$13]);2;IF(AND([.B350]>=[Calendario.$F$16];[.B350]<=[Calendario.$F$17]);3;""))) ->  | D350: of:=IF(COUNTIF([Calendario.$H$4:.$H$48];[.B350])>0;"FIESTA";"") -> FIESTA | E350: of:=IF([.B350]<>"";VLOOKUP(WEEKDAY([.B350];3);[Calendario.$A$4:.$C$11];2);"") ->  | F350: of:=IF([.B350]<>"";IF([.D350]<>"FIESTA";VLOOKUP(WEEKDAY([.B350];3);[Calendario.$A$4:.$C$11];3);0);"") ->  | G350: of:=IF(ISNUMBER([.F350]);[.F350]+[.G349];"") ->  | H350: of:=IF(AND([.G350]<=[Unidades.$G$26];[.G350]<=[Unidades.$F$18];[Unidades.$F$18]>0);[Unidades.$D$18]+1-COUNTIFS([Unidades.$O$3:.$O$17];">="&[.G350]);"") ->  | I350: of:=IF([.H349]<>[.H350];"INICIO";IF([.H351]<>[.H350];"FIN";"")) ->  | J350: of:=IF([.K349]<>[.K350];"INICIO";IF([.K351]<>[.K350];"FIN";"")) -> 
A351: of:=IF([.B351]<>"";TODAY()>[.B351];"") ->  | B351: of:=IFERROR(IF(([.B350]+1)<[Calendario.$F$5];[.B350]+1;"");"") ->  | C351: of:=IF(AND([.B351]>=[Calendario.$F$8];[.B351]<=[Calendario.$F$9];1);1;IF(AND([.B351]>=[Calendario.$F$12];[.B351]<=[Calendario.$F$13]);2;IF(AND([.B351]>=[Calendario.$F$16];[.B351]<=[Calendario.$F$17]);3;""))) ->  | D351: of:=IF(COUNTIF([Calendario.$H$4:.$H$48];[.B351])>0;"FIESTA";"") -> FIESTA | E351: of:=IF([.B351]<>"";VLOOKUP(WEEKDAY([.B351];3);[Calendario.$A$4:.$C$11];2);"") ->  | F351: of:=IF([.B351]<>"";IF([.D351]<>"FIESTA";VLOOKUP(WEEKDAY([.B351];3);[Calendario.$A$4:.$C$11];3);0);"") ->  | G351: of:=IF(ISNUMBER([.F351]);[.F351]+[.G350];"") ->  | H351: of:=IF(AND([.G351]<=[Unidades.$G$26];[.G351]<=[Unidades.$F$18];[Unidades.$F$18]>0);[Unidades.$D$18]+1-COUNTIFS([Unidades.$O$3:.$O$17];">="&[.G351]);"") ->  | I351: of:=IF([.H350]<>[.H351];"INICIO";IF([.H352]<>[.H351];"FIN";"")) ->  | J351: of:=IF([.K350]<>[.K351];"INICIO";IF([.K352]<>[.K351];"FIN";"")) -> 
A352: of:=IF([.B352]<>"";TODAY()>[.B352];"") ->  | B352: of:=IFERROR(IF(([.B351]+1)<[Calendario.$F$5];[.B351]+1;"");"") ->  | C352: of:=IF(AND([.B352]>=[Calendario.$F$8];[.B352]<=[Calendario.$F$9];1);1;IF(AND([.B352]>=[Calendario.$F$12];[.B352]<=[Calendario.$F$13]);2;IF(AND([.B352]>=[Calendario.$F$16];[.B352]<=[Calendario.$F$17]);3;""))) ->  | D352: of:=IF(COUNTIF([Calendario.$H$4:.$H$48];[.B352])>0;"FIESTA";"") -> FIESTA | E352: of:=IF([.B352]<>"";VLOOKUP(WEEKDAY([.B352];3);[Calendario.$A$4:.$C$11];2);"") ->  | F352: of:=IF([.B352]<>"";IF([.D352]<>"FIESTA";VLOOKUP(WEEKDAY([.B352];3);[Calendario.$A$4:.$C$11];3);0);"") ->  | G352: of:=IF(ISNUMBER([.F352]);[.F352]+[.G351];"") ->  | H352: of:=IF(AND([.G352]<=[Unidades.$G$26];[.G352]<=[Unidades.$F$18];[Unidades.$F$18]>0);[Unidades.$D$18]+1-COUNTIFS([Unidades.$O$3:.$O$17];">="&[.G352]);"") ->  | I352: of:=IF([.H351]<>[.H352];"INICIO";IF([.H353]<>[.H352];"FIN";"")) ->  | J352: of:=IF([.K351]<>[.K352];"INICIO";IF([.K353]<>[.K352];"FIN";"")) -> 
A353: of:=IF([.B353]<>"";TODAY()>[.B353];"") ->  | B353: of:=IFERROR(IF(([.B352]+1)<[Calendario.$F$5];[.B352]+1;"");"") ->  | C353: of:=IF(AND([.B353]>=[Calendario.$F$8];[.B353]<=[Calendario.$F$9];1);1;IF(AND([.B353]>=[Calendario.$F$12];[.B353]<=[Calendario.$F$13]);2;IF(AND([.B353]>=[Calendario.$F$16];[.B353]<=[Calendario.$F$17]);3;""))) ->  | D353: of:=IF(COUNTIF([Calendario.$H$4:.$H$48];[.B353])>0;"FIESTA";"") -> FIESTA | E353: of:=IF([.B353]<>"";VLOOKUP(WEEKDAY([.B353];3);[Calendario.$A$4:.$C$11];2);"") ->  | F353: of:=IF([.B353]<>"";IF([.D353]<>"FIESTA";VLOOKUP(WEEKDAY([.B353];3);[Calendario.$A$4:.$C$11];3);0);"") ->  | G353: of:=IF(ISNUMBER([.F353]);[.F353]+[.G352];"") ->  | H353: of:=IF(AND([.G353]<=[Unidades.$G$26];[.G353]<=[Unidades.$F$18];[Unidades.$F$18]>0);[Unidades.$D$18]+1-COUNTIFS([Unidades.$O$3:.$O$17];">="&[.G353]);"") ->  | I353: of:=IF([.H352]<>[.H353];"INICIO";IF([.H354]<>[.H353];"FIN";"")) ->  | J353: of:=IF([.K352]<>[.K353];"INICIO";IF([.K354]<>[.K353];"FIN";"")) -> 
A354: of:=IF([.B354]<>"";TODAY()>[.B354];"") ->  | B354: of:=IFERROR(IF(([.B353]+1)<[Calendario.$F$5];[.B353]+1;"");"") ->  | C354: of:=IF(AND([.B354]>=[Calendario.$F$8];[.B354]<=[Calendario.$F$9];1);1;IF(AND([.B354]>=[Calendario.$F$12];[.B354]<=[Calendario.$F$13]);2;IF(AND([.B354]>=[Calendario.$F$16];[.B354]<=[Calendario.$F$17]);3;""))) ->  | D354: of:=IF(COUNTIF([Calendario.$H$4:.$H$48];[.B354])>0;"FIESTA";"") -> FIESTA | E354: of:=IF([.B354]<>"";VLOOKUP(WEEKDAY([.B354];3);[Calendario.$A$4:.$C$11];2);"") ->  | F354: of:=IF([.B354]<>"";IF([.D354]<>"FIESTA";VLOOKUP(WEEKDAY([.B354];3);[Calendario.$A$4:.$C$11];3);0);"") ->  | G354: of:=IF(ISNUMBER([.F354]);[.F354]+[.G353];"") ->  | H354: of:=IF(AND([.G354]<=[Unidades.$G$26];[.G354]<=[Unidades.$F$18];[Unidades.$F$18]>0);[Unidades.$D$18]+1-COUNTIFS([Unidades.$O$3:.$O$17];">="&[.G354]);"") ->  | I354: of:=IF([.H353]<>[.H354];"INICIO";IF([.H355]<>[.H354];"FIN";"")) ->  | J354: of:=IF([.K353]<>[.K354];"INICIO";IF([.K355]<>[.K354];"FIN";"")) -> 
A355: of:=IF([.B355]<>"";TODAY()>[.B355];"") ->  | B355: of:=IFERROR(IF(([.B354]+1)<[Calendario.$F$5];[.B354]+1;"");"") ->  | C355: of:=IF(AND([.B355]>=[Calendario.$F$8];[.B355]<=[Calendario.$F$9];1);1;IF(AND([.B355]>=[Calendario.$F$12];[.B355]<=[Calendario.$F$13]);2;IF(AND([.B355]>=[Calendario.$F$16];[.B355]<=[Calendario.$F$17]);3;""))) ->  | D355: of:=IF(COUNTIF([Calendario.$H$4:.$H$48];[.B355])>0;"FIESTA";"") -> FIESTA | E355: of:=IF([.B355]<>"";VLOOKUP(WEEKDAY([.B355];3);[Calendario.$A$4:.$C$11];2);"") ->  | F355: of:=IF([.B355]<>"";IF([.D355]<>"FIESTA";VLOOKUP(WEEKDAY([.B355];3);[Calendario.$A$4:.$C$11];3);0);"") ->  | G355: of:=IF(ISNUMBER([.F355]);[.F355]+[.G354];"") ->  | H355: of:=IF(AND([.G355]<=[Unidades.$G$26];[.G355]<=[Unidades.$F$18];[Unidades.$F$18]>0);[Unidades.$D$18]+1-COUNTIFS([Unidades.$O$3:.$O$17];">="&[.G355]);"") ->  | I355: of:=IF([.H354]<>[.H355];"INICIO";IF([.H356]<>[.H355];"FIN";"")) ->  | J355: of:=IF([.K354]<>[.K355];"INICIO";IF([.K356]<>[.K355];"FIN";"")) -> 
A356: of:=IF([.B356]<>"";TODAY()>[.B356];"") ->  | B356: of:=IFERROR(IF(([.B355]+1)<[Calendario.$F$5];[.B355]+1;"");"") ->  | C356: of:=IF(AND([.B356]>=[Calendario.$F$8];[.B356]<=[Calendario.$F$9];1);1;IF(AND([.B356]>=[Calendario.$F$12];[.B356]<=[Calendario.$F$13]);2;IF(AND([.B356]>=[Calendario.$F$16];[.B356]<=[Calendario.$F$17]);3;""))) ->  | D356: of:=IF(COUNTIF([Calendario.$H$4:.$H$48];[.B356])>0;"FIESTA";"") -> FIESTA | E356: of:=IF([.B356]<>"";VLOOKUP(WEEKDAY([.B356];3);[Calendario.$A$4:.$C$11];2);"") ->  | F356: of:=IF([.B356]<>"";IF([.D356]<>"FIESTA";VLOOKUP(WEEKDAY([.B356];3);[Calendario.$A$4:.$C$11];3);0);"") ->  | G356: of:=IF(ISNUMBER([.F356]);[.F356]+[.G355];"") ->  | H356: of:=IF(AND([.G356]<=[Unidades.$G$26];[.G356]<=[Unidades.$F$18];[Unidades.$F$18]>0);[Unidades.$D$18]+1-COUNTIFS([Unidades.$O$3:.$O$17];">="&[.G356]);"") ->  | I356: of:=IF([.H355]<>[.H356];"INICIO";IF([.H357]<>[.H356];"FIN";"")) ->  | J356: of:=IF([.K355]<>[.K356];"INICIO";IF([.K357]<>[.K356];"FIN";"")) -> 
A357: of:=IF([.B357]<>"";TODAY()>[.B357];"") ->  | B357: of:=IFERROR(IF(([.B356]+1)<[Calendario.$F$5];[.B356]+1;"");"") ->  | C357: of:=IF(AND([.B357]>=[Calendario.$F$8];[.B357]<=[Calendario.$F$9];1);1;IF(AND([.B357]>=[Calendario.$F$12];[.B357]<=[Calendario.$F$13]);2;IF(AND([.B357]>=[Calendario.$F$16];[.B357]<=[Calendario.$F$17]);3;""))) ->  | D357: of:=IF(COUNTIF([Calendario.$H$4:.$H$48];[.B357])>0;"FIESTA";"") -> FIESTA | E357: of:=IF([.B357]<>"";VLOOKUP(WEEKDAY([.B357];3);[Calendario.$A$4:.$C$11];2);"") ->  | F357: of:=IF([.B357]<>"";IF([.D357]<>"FIESTA";VLOOKUP(WEEKDAY([.B357];3);[Calendario.$A$4:.$C$11];3);0);"") ->  | G357: of:=IF(ISNUMBER([.F357]);[.F357]+[.G356];"") ->  | H357: of:=IF(AND([.G357]<=[Unidades.$G$26];[.G357]<=[Unidades.$F$18];[Unidades.$F$18]>0);[Unidades.$D$18]+1-COUNTIFS([Unidades.$O$3:.$O$17];">="&[.G357]);"") ->  | I357: of:=IF([.H356]<>[.H357];"INICIO";IF([.H358]<>[.H357];"FIN";"")) ->  | J357: of:=IF([.K356]<>[.K357];"INICIO";IF([.K358]<>[.K357];"FIN";"")) -> 
A358: of:=IF([.B358]<>"";TODAY()>[.B358];"") ->  | B358: of:=IFERROR(IF(([.B357]+1)<[Calendario.$F$5];[.B357]+1;"");"") ->  | C358: of:=IF(AND([.B358]>=[Calendario.$F$8];[.B358]<=[Calendario.$F$9];1);1;IF(AND([.B358]>=[Calendario.$F$12];[.B358]<=[Calendario.$F$13]);2;IF(AND([.B358]>=[Calendario.$F$16];[.B358]<=[Calendario.$F$17]);3;""))) ->  | D358: of:=IF(COUNTIF([Calendario.$H$4:.$H$48];[.B358])>0;"FIESTA";"") -> FIESTA | E358: of:=IF([.B358]<>"";VLOOKUP(WEEKDAY([.B358];3);[Calendario.$A$4:.$C$11];2);"") ->  | F358: of:=IF([.B358]<>"";IF([.D358]<>"FIESTA";VLOOKUP(WEEKDAY([.B358];3);[Calendario.$A$4:.$C$11];3);0);"") ->  | G358: of:=IF(ISNUMBER([.F358]);[.F358]+[.G357];"") ->  | H358: of:=IF(AND([.G358]<=[Unidades.$G$26];[.G358]<=[Unidades.$F$18];[Unidades.$F$18]>0);[Unidades.$D$18]+1-COUNTIFS([Unidades.$O$3:.$O$17];">="&[.G358]);"") ->  | I358: of:=IF([.H357]<>[.H358];"INICIO";IF([.H359]<>[.H358];"FIN";"")) ->  | J358: of:=IF([.K357]<>[.K358];"INICIO";IF([.K359]<>[.K358];"FIN";"")) -> 
A359: of:=IF([.B359]<>"";TODAY()>[.B359];"") ->  | B359: of:=IFERROR(IF(([.B358]+1)<[Calendario.$F$5];[.B358]+1;"");"") ->  | C359: of:=IF(AND([.B359]>=[Calendario.$F$8];[.B359]<=[Calendario.$F$9];1);1;IF(AND([.B359]>=[Calendario.$F$12];[.B359]<=[Calendario.$F$13]);2;IF(AND([.B359]>=[Calendario.$F$16];[.B359]<=[Calendario.$F$17]);3;""))) ->  | D359: of:=IF(COUNTIF([Calendario.$H$4:.$H$48];[.B359])>0;"FIESTA";"") -> FIESTA | E359: of:=IF([.B359]<>"";VLOOKUP(WEEKDAY([.B359];3);[Calendario.$A$4:.$C$11];2);"") ->  | F359: of:=IF([.B359]<>"";IF([.D359]<>"FIESTA";VLOOKUP(WEEKDAY([.B359];3);[Calendario.$A$4:.$C$11];3);0);"") ->  | G359: of:=IF(ISNUMBER([.F359]);[.F359]+[.G358];"") ->  | H359: of:=IF(AND([.G359]<=[Unidades.$G$26];[.G359]<=[Unidades.$F$18];[Unidades.$F$18]>0);[Unidades.$D$18]+1-COUNTIFS([Unidades.$O$3:.$O$17];">="&[.G359]);"") ->  | I359: of:=IF([.H358]<>[.H359];"INICIO";IF([.H360]<>[.H359];"FIN";"")) ->  | J359: of:=IF([.K358]<>[.K359];"INICIO";IF([.K360]<>[.K359];"FIN";"")) -> 
A360: of:=IF([.B360]<>"";TODAY()>[.B360];"") ->  | B360: of:=IFERROR(IF(([.B359]+1)<[Calendario.$F$5];[.B359]+1;"");"") ->  | C360: of:=IF(AND([.B360]>=[Calendario.$F$8];[.B360]<=[Calendario.$F$9];1);1;IF(AND([.B360]>=[Calendario.$F$12];[.B360]<=[Calendario.$F$13]);2;IF(AND([.B360]>=[Calendario.$F$16];[.B360]<=[Calendario.$F$17]);3;""))) ->  | D360: of:=IF(COUNTIF([Calendario.$H$4:.$H$48];[.B360])>0;"FIESTA";"") -> FIESTA | E360: of:=IF([.B360]<>"";VLOOKUP(WEEKDAY([.B360];3);[Calendario.$A$4:.$C$11];2);"") ->  | F360: of:=IF([.B360]<>"";IF([.D360]<>"FIESTA";VLOOKUP(WEEKDAY([.B360];3);[Calendario.$A$4:.$C$11];3);0);"") ->  | G360: of:=IF(ISNUMBER([.F360]);[.F360]+[.G359];"") ->  | H360: of:=IF(AND([.G360]<=[Unidades.$G$26];[.G360]<=[Unidades.$F$18];[Unidades.$F$18]>0);[Unidades.$D$18]+1-COUNTIFS([Unidades.$O$3:.$O$17];">="&[.G360]);"") ->  | I360: of:=IF([.H359]<>[.H360];"INICIO";IF([.H361]<>[.H360];"FIN";"")) ->  | J360: of:=IF([.K359]<>[.K360];"INICIO";IF([.K361]<>[.K360];"FIN";"")) -> 
A361: of:=IF([.B361]<>"";TODAY()>[.B361];"") ->  | B361: of:=IFERROR(IF(([.B360]+1)<[Calendario.$F$5];[.B360]+1;"");"") ->  | C361: of:=IF(AND([.B361]>=[Calendario.$F$8];[.B361]<=[Calendario.$F$9];1);1;IF(AND([.B361]>=[Calendario.$F$12];[.B361]<=[Calendario.$F$13]);2;IF(AND([.B361]>=[Calendario.$F$16];[.B361]<=[Calendario.$F$17]);3;""))) ->  | D361: of:=IF(COUNTIF([Calendario.$H$4:.$H$48];[.B361])>0;"FIESTA";"") -> FIESTA | E361: of:=IF([.B361]<>"";VLOOKUP(WEEKDAY([.B361];3);[Calendario.$A$4:.$C$11];2);"") ->  | F361: of:=IF([.B361]<>"";IF([.D361]<>"FIESTA";VLOOKUP(WEEKDAY([.B361];3);[Calendario.$A$4:.$C$11];3);0);"") ->  | G361: of:=IF(ISNUMBER([.F361]);[.F361]+[.G360];"") ->  | H361: of:=IF(AND([.G361]<=[Unidades.$G$26];[.G361]<=[Unidades.$F$18];[Unidades.$F$18]>0);[Unidades.$D$18]+1-COUNTIFS([Unidades.$O$3:.$O$17];">="&[.G361]);"") ->  | I361: of:=IF([.H360]<>[.H361];"INICIO";IF([.H362]<>[.H361];"FIN";"")) ->  | J361: of:=IF([.K360]<>[.K361];"INICIO";IF([.K362]<>[.K361];"FIN";"")) -> 
A362: of:=IF([.B362]<>"";TODAY()>[.B362];"") ->  | B362: of:=IFERROR(IF(([.B361]+1)<[Calendario.$F$5];[.B361]+1;"");"") ->  | C362: of:=IF(AND([.B362]>=[Calendario.$F$8];[.B362]<=[Calendario.$F$9];1);1;IF(AND([.B362]>=[Calendario.$F$12];[.B362]<=[Calendario.$F$13]);2;IF(AND([.B362]>=[Calendario.$F$16];[.B362]<=[Calendario.$F$17]);3;""))) ->  | D362: of:=IF(COUNTIF([Calendario.$H$4:.$H$48];[.B362])>0;"FIESTA";"") -> FIESTA | E362: of:=IF([.B362]<>"";VLOOKUP(WEEKDAY([.B362];3);[Calendario.$A$4:.$C$11];2);"") ->  | F362: of:=IF([.B362]<>"";IF([.D362]<>"FIESTA";VLOOKUP(WEEKDAY([.B362];3);[Calendario.$A$4:.$C$11];3);0);"") ->  | G362: of:=IF(ISNUMBER([.F362]);[.F362]+[.G361];"") ->  | H362: of:=IF(AND([.G362]<=[Unidades.$G$26];[.G362]<=[Unidades.$F$18];[Unidades.$F$18]>0);[Unidades.$D$18]+1-COUNTIFS([Unidades.$O$3:.$O$17];">="&[.G362]);"") ->  | I362: of:=IF([.H361]<>[.H362];"INICIO";IF([.H363]<>[.H362];"FIN";"")) ->  | J362: of:=IF([.K361]<>[.K362];"INICIO";IF([.K363]<>[.K362];"FIN";"")) -> 
A363: of:=IF([.B363]<>"";TODAY()>[.B363];"") ->  | B363: of:=IFERROR(IF(([.B362]+1)<[Calendario.$F$5];[.B362]+1;"");"") ->  | C363: of:=IF(AND([.B363]>=[Calendario.$F$8];[.B363]<=[Calendario.$F$9];1);1;IF(AND([.B363]>=[Calendario.$F$12];[.B363]<=[Calendario.$F$13]);2;IF(AND([.B363]>=[Calendario.$F$16];[.B363]<=[Calendario.$F$17]);3;""))) ->  | D363: of:=IF(COUNTIF([Calendario.$H$4:.$H$48];[.B363])>0;"FIESTA";"") -> FIESTA | E363: of:=IF([.B363]<>"";VLOOKUP(WEEKDAY([.B363];3);[Calendario.$A$4:.$C$11];2);"") ->  | F363: of:=IF([.B363]<>"";IF([.D363]<>"FIESTA";VLOOKUP(WEEKDAY([.B363];3);[Calendario.$A$4:.$C$11];3);0);"") ->  | G363: of:=IF(ISNUMBER([.F363]);[.F363]+[.G362];"") ->  | H363: of:=IF(AND([.G363]<=[Unidades.$G$26];[.G363]<=[Unidades.$F$18];[Unidades.$F$18]>0);[Unidades.$D$18]+1-COUNTIFS([Unidades.$O$3:.$O$17];">="&[.G363]);"") ->  | I363: of:=IF([.H362]<>[.H363];"INICIO";IF([.H364]<>[.H363];"FIN";"")) ->  | J363: of:=IF([.K362]<>[.K363];"INICIO";IF([.K364]<>[.K363];"FIN";"")) -> 
A364: of:=IF([.B364]<>"";TODAY()>[.B364];"") ->  | B364: of:=IFERROR(IF(([.B363]+1)<[Calendario.$F$5];[.B363]+1;"");"") ->  | C364: of:=IF(AND([.B364]>=[Calendario.$F$8];[.B364]<=[Calendario.$F$9];1);1;IF(AND([.B364]>=[Calendario.$F$12];[.B364]<=[Calendario.$F$13]);2;IF(AND([.B364]>=[Calendario.$F$16];[.B364]<=[Calendario.$F$17]);3;""))) ->  | D364: of:=IF(COUNTIF([Calendario.$H$4:.$H$48];[.B364])>0;"FIESTA";"") -> FIESTA | E364: of:=IF([.B364]<>"";VLOOKUP(WEEKDAY([.B364];3);[Calendario.$A$4:.$C$11];2);"") ->  | F364: of:=IF([.B364]<>"";IF([.D364]<>"FIESTA";VLOOKUP(WEEKDAY([.B364];3);[Calendario.$A$4:.$C$11];3);0);"") ->  | G364: of:=IF(ISNUMBER([.F364]);[.F364]+[.G363];"") ->  | H364: of:=IF(AND([.G364]<=[Unidades.$G$26];[.G364]<=[Unidades.$F$18];[Unidades.$F$18]>0);[Unidades.$D$18]+1-COUNTIFS([Unidades.$O$3:.$O$17];">="&[.G364]);"") ->  | I364: of:=IF([.H363]<>[.H364];"INICIO";IF([.H365]<>[.H364];"FIN";"")) ->  | J364: of:=IF([.K363]<>[.K364];"INICIO";IF([.K365]<>[.K364];"FIN";"")) -> 
A365: of:=IF([.B365]<>"";TODAY()>[.B365];"") ->  | B365: of:=IFERROR(IF(([.B364]+1)<[Calendario.$F$5];[.B364]+1;"");"") ->  | C365: of:=IF(AND([.B365]>=[Calendario.$F$8];[.B365]<=[Calendario.$F$9];1);1;IF(AND([.B365]>=[Calendario.$F$12];[.B365]<=[Calendario.$F$13]);2;IF(AND([.B365]>=[Calendario.$F$16];[.B365]<=[Calendario.$F$17]);3;""))) ->  | D365: of:=IF(COUNTIF([Calendario.$H$4:.$H$48];[.B365])>0;"FIESTA";"") -> FIESTA | E365: of:=IF([.B365]<>"";VLOOKUP(WEEKDAY([.B365];3);[Calendario.$A$4:.$C$11];2);"") ->  | F365: of:=IF([.B365]<>"";IF([.D365]<>"FIESTA";VLOOKUP(WEEKDAY([.B365];3);[Calendario.$A$4:.$C$11];3);0);"") ->  | G365: of:=IF(ISNUMBER([.F365]);[.F365]+[.G364];"") ->  | H365: of:=IF(AND([.G365]<=[Unidades.$G$26];[.G365]<=[Unidades.$F$18];[Unidades.$F$18]>0);[Unidades.$D$18]+1-COUNTIFS([Unidades.$O$3:.$O$17];">="&[.G365]);"") ->  | I365: of:=IF([.H364]<>[.H365];"INICIO";IF([.H366]<>[.H365];"FIN";"")) ->  | J365: of:=IF([.K364]<>[.K365];"INICIO";IF([.K366]<>[.K365];"FIN";"")) -> 
A366: of:=IF([.B366]<>"";TODAY()>[.B366];"") ->  | B366: of:=IFERROR(IF(([.B365]+1)<[Calendario.$F$5];[.B365]+1;"");"") ->  | C366: of:=IF(AND([.B366]>=[Calendario.$F$8];[.B366]<=[Calendario.$F$9];1);1;IF(AND([.B366]>=[Calendario.$F$12];[.B366]<=[Calendario.$F$13]);2;IF(AND([.B366]>=[Calendario.$F$16];[.B366]<=[Calendario.$F$17]);3;""))) ->  | D366: of:=IF(COUNTIF([Calendario.$H$4:.$H$48];[.B366])>0;"FIESTA";"") -> FIESTA | E366: of:=IF([.B366]<>"";VLOOKUP(WEEKDAY([.B366];3);[Calendario.$A$4:.$C$11];2);"") ->  | F366: of:=IF([.B366]<>"";IF([.D366]<>"FIESTA";VLOOKUP(WEEKDAY([.B366];3);[Calendario.$A$4:.$C$11];3);0);"") ->  | G366: of:=IF(ISNUMBER([.F366]);[.F366]+[.G365];"") ->  | H366: of:=IF(AND([.G366]<=[Unidades.$G$26];[.G366]<=[Unidades.$F$18];[Unidades.$F$18]>0);[Unidades.$D$18]+1-COUNTIFS([Unidades.$O$3:.$O$17];">="&[.G366]);"") ->  | I366: of:=IF([.H365]<>[.H366];"INICIO";IF([.H367]<>[.H366];"FIN";"")) ->  | J366: of:=IF([.K365]<>[.K366];"INICIO";IF([.K367]<>[.K366];"FIN";"")) -> 
A367: of:=IF([.B367]<>"";TODAY()>[.B367];"") ->  | B367: of:=IFERROR(IF(([.B366]+1)<[Calendario.$F$5];[.B366]+1;"");"") ->  | C367: of:=IF(AND([.B367]>=[Calendario.$F$8];[.B367]<=[Calendario.$F$9];1);1;IF(AND([.B367]>=[Calendario.$F$12];[.B367]<=[Calendario.$F$13]);2;IF(AND([.B367]>=[Calendario.$F$16];[.B367]<=[Calendario.$F$17]);3;""))) ->  | D367: of:=IF(COUNTIF([Calendario.$H$4:.$H$48];[.B367])>0;"FIESTA";"") -> FIESTA | E367: of:=IF([.B367]<>"";VLOOKUP(WEEKDAY([.B367];3);[Calendario.$A$4:.$C$11];2);"") ->  | F367: of:=IF([.B367]<>"";IF([.D367]<>"FIESTA";VLOOKUP(WEEKDAY([.B367];3);[Calendario.$A$4:.$C$11];3);0);"") ->  | G367: of:=IF(ISNUMBER([.F367]);[.F367]+[.G366];"") ->  | H367: of:=IF(AND([.G367]<=[Unidades.$G$26];[.G367]<=[Unidades.$F$18];[Unidades.$F$18]>0);[Unidades.$D$18]+1-COUNTIFS([Unidades.$O$3:.$O$17];">="&[.G367]);"") ->  | I367: of:=IF([.H366]<>[.H367];"INICIO";IF([.H368]<>[.H367];"FIN";"")) ->  | J367: of:=IF([.K366]<>[.K367];"INICIO";IF([.K368]<>[.K367];"FIN";"")) -> 
A368: of:=IF([.B368]<>"";TODAY()>[.B368];"") ->  | B368: of:=IFERROR(IF(([.B367]+1)<[Calendario.$F$5];[.B367]+1;"");"") ->  | C368: of:=IF(AND([.B368]>=[Calendario.$F$8];[.B368]<=[Calendario.$F$9];1);1;IF(AND([.B368]>=[Calendario.$F$12];[.B368]<=[Calendario.$F$13]);2;IF(AND([.B368]>=[Calendario.$F$16];[.B368]<=[Calendario.$F$17]);3;""))) ->  | D368: of:=IF(COUNTIF([Calendario.$H$4:.$H$48];[.B368])>0;"FIESTA";"") -> FIESTA | E368: of:=IF([.B368]<>"";VLOOKUP(WEEKDAY([.B368];3);[Calendario.$A$4:.$C$11];2);"") ->  | F368: of:=IF([.B368]<>"";IF([.D368]<>"FIESTA";VLOOKUP(WEEKDAY([.B368];3);[Calendario.$A$4:.$C$11];3);0);"") ->  | G368: of:=IF(ISNUMBER([.F368]);[.F368]+[.G367];"") ->  | H368: of:=IF(AND([.G368]<=[Unidades.$G$26];[.G368]<=[Unidades.$F$18];[Unidades.$F$18]>0);[Unidades.$D$18]+1-COUNTIFS([Unidades.$O$3:.$O$17];">="&[.G368]);"") ->  | I368: of:=IF([.H367]<>[.H368];"INICIO";IF([.H369]<>[.H368];"FIN";"")) ->  | J368: of:=IF([.K367]<>[.K368];"INICIO";IF([.K369]<>[.K368];"FIN";"")) -> 
A369: of:=IF([.B369]<>"";TODAY()>[.B369];"") ->  | B369: of:=IFERROR(IF(([.B368]+1)<[Calendario.$F$5];[.B368]+1;"");"") ->  | C369: of:=IF(AND([.B369]>=[Calendario.$F$8];[.B369]<=[Calendario.$F$9];1);1;IF(AND([.B369]>=[Calendario.$F$12];[.B369]<=[Calendario.$F$13]);2;IF(AND([.B369]>=[Calendario.$F$16];[.B369]<=[Calendario.$F$17]);3;""))) ->  | D369: of:=IF(COUNTIF([Calendario.$H$4:.$H$48];[.B369])>0;"FIESTA";"") -> FIESTA | E369: of:=IF([.B369]<>"";VLOOKUP(WEEKDAY([.B369];3);[Calendario.$A$4:.$C$11];2);"") ->  | F369: of:=IF([.B369]<>"";IF([.D369]<>"FIESTA";VLOOKUP(WEEKDAY([.B369];3);[Calendario.$A$4:.$C$11];3);0);"") ->  | G369: of:=IF(ISNUMBER([.F369]);[.F369]+[.G368];"") ->  | H369: of:=IF(AND([.G369]<=[Unidades.$G$26];[.G369]<=[Unidades.$F$18];[Unidades.$F$18]>0);[Unidades.$D$18]+1-COUNTIFS([Unidades.$O$3:.$O$17];">="&[.G369]);"") ->  | I369: of:=IF([.H368]<>[.H369];"INICIO";IF([.H370]<>[.H369];"FIN";"")) ->  | J369: of:=IF([.K368]<>[.K369];"INICIO";IF([.K370]<>[.K369];"FIN";"")) -> 
A370: of:=IF([.B370]<>"";TODAY()>[.B370];"") ->  | B370: of:=IFERROR(IF(([.B369]+1)<[Calendario.$F$5];[.B369]+1;"");"") ->  | C370: of:=IF(AND([.B370]>=[Calendario.$F$8];[.B370]<=[Calendario.$F$9];1);1;IF(AND([.B370]>=[Calendario.$F$12];[.B370]<=[Calendario.$F$13]);2;IF(AND([.B370]>=[Calendario.$F$16];[.B370]<=[Calendario.$F$17]);3;""))) ->  | D370: of:=IF(COUNTIF([Calendario.$H$4:.$H$48];[.B370])>0;"FIESTA";"") -> FIESTA | E370: of:=IF([.B370]<>"";VLOOKUP(WEEKDAY([.B370];3);[Calendario.$A$4:.$C$11];2);"") ->  | F370: of:=IF([.B370]<>"";IF([.D370]<>"FIESTA";VLOOKUP(WEEKDAY([.B370];3);[Calendario.$A$4:.$C$11];3);0);"") ->  | G370: of:=IF(ISNUMBER([.F370]);[.F370]+[.G369];"") ->  | H370: of:=IF(AND([.G370]<=[Unidades.$G$26];[.G370]<=[Unidades.$F$18];[Unidades.$F$18]>0);[Unidades.$D$18]+1-COUNTIFS([Unidades.$O$3:.$O$17];">="&[.G370]);"") ->  | I370: of:=IF([.H369]<>[.H370];"INICIO";IF([.H371]<>[.H370];"FIN";"")) ->  | J370: of:=IF([.K369]<>[.K370];"INICIO";IF([.K371]<>[.K370];"FIN";"")) -> 
A371: of:=IF([.B371]<>"";TODAY()>[.B371];"") ->  | B371: of:=IFERROR(IF(([.B370]+1)<[Calendario.$F$5];[.B370]+1;"");"") ->  | C371: of:=IF(AND([.B371]>=[Calendario.$F$8];[.B371]<=[Calendario.$F$9];1);1;IF(AND([.B371]>=[Calendario.$F$12];[.B371]<=[Calendario.$F$13]);2;IF(AND([.B371]>=[Calendario.$F$16];[.B371]<=[Calendario.$F$17]);3;""))) ->  | D371: of:=IF(COUNTIF([Calendario.$H$4:.$H$48];[.B371])>0;"FIESTA";"") -> FIESTA | E371: of:=IF([.B371]<>"";VLOOKUP(WEEKDAY([.B371];3);[Calendario.$A$4:.$C$11];2);"") ->  | F371: of:=IF([.B371]<>"";IF([.D371]<>"FIESTA";VLOOKUP(WEEKDAY([.B371];3);[Calendario.$A$4:.$C$11];3);0);"") ->  | G371: of:=IF(ISNUMBER([.F371]);[.F371]+[.G370];"") ->  | H371: of:=IF(AND([.G371]<=[Unidades.$G$26];[.G371]<=[Unidades.$F$18];[Unidades.$F$18]>0);[Unidades.$D$18]+1-COUNTIFS([Unidades.$O$3:.$O$17];">="&[.G371]);"") ->  | I371: of:=IF([.H370]<>[.H371];"INICIO";IF([.H372]<>[.H371];"FIN";"")) ->  | J371: of:=IF([.K370]<>[.K371];"INICIO";IF([.K372]<>[.K371];"FIN";"")) -> 
A372: of:=IF([.B372]<>"";TODAY()>[.B372];"") ->  | B372: of:=IFERROR(IF(([.B371]+1)<[Calendario.$F$5];[.B371]+1;"");"") ->  | C372: of:=IF(AND([.B372]>=[Calendario.$F$8];[.B372]<=[Calendario.$F$9];1);1;IF(AND([.B372]>=[Calendario.$F$12];[.B372]<=[Calendario.$F$13]);2;IF(AND([.B372]>=[Calendario.$F$16];[.B372]<=[Calendario.$F$17]);3;""))) ->  | D372: of:=IF(COUNTIF([Calendario.$H$4:.$H$48];[.B372])>0;"FIESTA";"") -> FIESTA | E372: of:=IF([.B372]<>"";VLOOKUP(WEEKDAY([.B372];3);[Calendario.$A$4:.$C$11];2);"") ->  | F372: of:=IF([.B372]<>"";IF([.D372]<>"FIESTA";VLOOKUP(WEEKDAY([.B372];3);[Calendario.$A$4:.$C$11];3);0);"") ->  | G372: of:=IF(ISNUMBER([.F372]);[.F372]+[.G371];"") ->  | H372: of:=IF(AND([.G372]<=[Unidades.$G$26];[.G372]<=[Unidades.$F$18];[Unidades.$F$18]>0);[Unidades.$D$18]+1-COUNTIFS([Unidades.$O$3:.$O$17];">="&[.G372]);"") ->  | I372: of:=IF([.H371]<>[.H372];"INICIO";IF([.H373]<>[.H372];"FIN";"")) ->  | J372: of:=IF([.K371]<>[.K372];"INICIO";IF([.K373]<>[.K372];"FIN";"")) -> 
A373: of:=IF([.B373]<>"";TODAY()>[.B373];"") ->  | B373: of:=IFERROR(IF(([.B372]+1)<[Calendario.$F$5];[.B372]+1;"");"") ->  | C373: of:=IF(AND([.B373]>=[Calendario.$F$8];[.B373]<=[Calendario.$F$9];1);1;IF(AND([.B373]>=[Calendario.$F$12];[.B373]<=[Calendario.$F$13]);2;IF(AND([.B373]>=[Calendario.$F$16];[.B373]<=[Calendario.$F$17]);3;""))) ->  | D373: of:=IF(COUNTIF([Calendario.$H$4:.$H$48];[.B373])>0;"FIESTA";"") -> FIESTA | E373: of:=IF([.B373]<>"";VLOOKUP(WEEKDAY([.B373];3);[Calendario.$A$4:.$C$11];2);"") ->  | F373: of:=IF([.B373]<>"";IF([.D373]<>"FIESTA";VLOOKUP(WEEKDAY([.B373];3);[Calendario.$A$4:.$C$11];3);0);"") ->  | G373: of:=IF(ISNUMBER([.F373]);[.F373]+[.G372];"") ->  | H373: of:=IF(AND([.G373]<=[Unidades.$G$26];[.G373]<=[Unidades.$F$18];[Unidades.$F$18]>0);[Unidades.$D$18]+1-COUNTIFS([Unidades.$O$3:.$O$17];">="&[.G373]);"") ->  | I373: of:=IF([.H372]<>[.H373];"INICIO";IF([.H374]<>[.H373];"FIN";"")) ->  | J373: of:=IF([.K372]<>[.K373];"INICIO";IF([.K374]<>[.K373];"FIN";"")) -> 
A374: of:=IF([.B374]<>"";TODAY()>[.B374];"") ->  | B374: of:=IFERROR(IF(([.B373]+1)<[Calendario.$F$5];[.B373]+1;"");"") ->  | C374: of:=IF(AND([.B374]>=[Calendario.$F$8];[.B374]<=[Calendario.$F$9];1);1;IF(AND([.B374]>=[Calendario.$F$12];[.B374]<=[Calendario.$F$13]);2;IF(AND([.B374]>=[Calendario.$F$16];[.B374]<=[Calendario.$F$17]);3;""))) ->  | D374: of:=IF(COUNTIF([Calendario.$H$4:.$H$48];[.B374])>0;"FIESTA";"") -> FIESTA | E374: of:=IF([.B374]<>"";VLOOKUP(WEEKDAY([.B374];3);[Calendario.$A$4:.$C$11];2);"") ->  | F374: of:=IF([.B374]<>"";IF([.D374]<>"FIESTA";VLOOKUP(WEEKDAY([.B374];3);[Calendario.$A$4:.$C$11];3);0);"") ->  | G374: of:=IF(ISNUMBER([.F374]);[.F374]+[.G373];"") ->  | H374: of:=IF(AND([.G374]<=[Unidades.$G$26];[.G374]<=[Unidades.$F$18];[Unidades.$F$18]>0);[Unidades.$D$18]+1-COUNTIFS([Unidades.$O$3:.$O$17];">="&[.G374]);"") ->  | I374: of:=IF([.H373]<>[.H374];"INICIO";IF([.H375]<>[.H374];"FIN";"")) ->  | J374: of:=IF([.K373]<>[.K374];"INICIO";IF([.K375]<>[.K374];"FIN";"")) -> 
A375: of:=IF([.B375]<>"";TODAY()>[.B375];"") ->  | B375: of:=IFERROR(IF(([.B374]+1)<[Calendario.$F$5];[.B374]+1;"");"") ->  | C375: of:=IF(AND([.B375]>=[Calendario.$F$8];[.B375]<=[Calendario.$F$9];1);1;IF(AND([.B375]>=[Calendario.$F$12];[.B375]<=[Calendario.$F$13]);2;IF(AND([.B375]>=[Calendario.$F$16];[.B375]<=[Calendario.$F$17]);3;""))) ->  | D375: of:=IF(COUNTIF([Calendario.$H$4:.$H$48];[.B375])>0;"FIESTA";"") -> FIESTA | E375: of:=IF([.B375]<>"";VLOOKUP(WEEKDAY([.B375];3);[Calendario.$A$4:.$C$11];2);"") ->  | F375: of:=IF([.B375]<>"";IF([.D375]<>"FIESTA";VLOOKUP(WEEKDAY([.B375];3);[Calendario.$A$4:.$C$11];3);0);"") ->  | G375: of:=IF(ISNUMBER([.F375]);[.F375]+[.G374];"") ->  | H375: of:=IF(AND([.G375]<=[Unidades.$G$26];[.G375]<=[Unidades.$F$18];[Unidades.$F$18]>0);[Unidades.$D$18]+1-COUNTIFS([Unidades.$O$3:.$O$17];">="&[.G375]);"") ->  | I375: of:=IF([.H374]<>[.H375];"INICIO";IF([.H376]<>[.H375];"FIN";"")) ->  | J375: of:=IF([.K374]<>[.K375];"INICIO";IF([.K376]<>[.K375];"FIN";"")) -> 
A376: of:=IF([.B376]<>"";TODAY()>[.B376];"") ->  | B376: of:=IFERROR(IF(([.B375]+1)<[Calendario.$F$5];[.B375]+1;"");"") ->  | C376: of:=IF(AND([.B376]>=[Calendario.$F$8];[.B376]<=[Calendario.$F$9];1);1;IF(AND([.B376]>=[Calendario.$F$12];[.B376]<=[Calendario.$F$13]);2;IF(AND([.B376]>=[Calendario.$F$16];[.B376]<=[Calendario.$F$17]);3;""))) ->  | D376: of:=IF(COUNTIF([Calendario.$H$4:.$H$48];[.B376])>0;"FIESTA";"") -> FIESTA | E376: of:=IF([.B376]<>"";VLOOKUP(WEEKDAY([.B376];3);[Calendario.$A$4:.$C$11];2);"") ->  | F376: of:=IF([.B376]<>"";IF([.D376]<>"FIESTA";VLOOKUP(WEEKDAY([.B376];3);[Calendario.$A$4:.$C$11];3);0);"") ->  | G376: of:=IF(ISNUMBER([.F376]);[.F376]+[.G375];"") ->  | H376: of:=IF(AND([.G376]<=[Unidades.$G$26];[.G376]<=[Unidades.$F$18];[Unidades.$F$18]>0);[Unidades.$D$18]+1-COUNTIFS([Unidades.$O$3:.$O$17];">="&[.G376]);"") ->  | I376: of:=IF([.H375]<>[.H376];"INICIO";IF([.H377]<>[.H376];"FIN";"")) ->  | J376: of:=IF([.K375]<>[.K376];"INICIO";IF([.K377]<>[.K376];"FIN";"")) -> 
A377: of:=IF([.B377]<>"";TODAY()>[.B377];"") ->  | B377: of:=IFERROR(IF(([.B376]+1)<[Calendario.$F$5];[.B376]+1;"");"") ->  | C377: of:=IF(AND([.B377]>=[Calendario.$F$8];[.B377]<=[Calendario.$F$9];1);1;IF(AND([.B377]>=[Calendario.$F$12];[.B377]<=[Calendario.$F$13]);2;IF(AND([.B377]>=[Calendario.$F$16];[.B377]<=[Calendario.$F$17]);3;""))) ->  | D377: of:=IF(COUNTIF([Calendario.$H$4:.$H$48];[.B377])>0;"FIESTA";"") -> FIESTA | E377: of:=IF([.B377]<>"";VLOOKUP(WEEKDAY([.B377];3);[Calendario.$A$4:.$C$11];2);"") ->  | F377: of:=IF([.B377]<>"";IF([.D377]<>"FIESTA";VLOOKUP(WEEKDAY([.B377];3);[Calendario.$A$4:.$C$11];3);0);"") ->  | G377: of:=IF(ISNUMBER([.F377]);[.F377]+[.G376];"") ->  | H377: of:=IF(AND([.G377]<=[Unidades.$G$26];[.G377]<=[Unidades.$F$18];[Unidades.$F$18]>0);[Unidades.$D$18]+1-COUNTIFS([Unidades.$O$3:.$O$17];">="&[.G377]);"") ->  | I377: of:=IF([.H376]<>[.H377];"INICIO";IF([.H378]<>[.H377];"FIN";"")) ->  | J377: of:=IF([.K376]<>[.K377];"INICIO";IF([.K378]<>[.K377];"FIN";"")) -> 
A378: of:=IF([.B378]<>"";TODAY()>[.B378];"") ->  | B378: of:=IFERROR(IF(([.B377]+1)<[Calendario.$F$5];[.B377]+1;"");"") ->  | C378: of:=IF(AND([.B378]>=[Calendario.$F$8];[.B378]<=[Calendario.$F$9];1);1;IF(AND([.B378]>=[Calendario.$F$12];[.B378]<=[Calendario.$F$13]);2;IF(AND([.B378]>=[Calendario.$F$16];[.B378]<=[Calendario.$F$17]);3;""))) ->  | D378: of:=IF(COUNTIF([Calendario.$H$4:.$H$48];[.B378])>0;"FIESTA";"") -> FIESTA | E378: of:=IF([.B378]<>"";VLOOKUP(WEEKDAY([.B378];3);[Calendario.$A$4:.$C$11];2);"") ->  | F378: of:=IF([.B378]<>"";IF([.D378]<>"FIESTA";VLOOKUP(WEEKDAY([.B378];3);[Calendario.$A$4:.$C$11];3);0);"") ->  | G378: of:=IF(ISNUMBER([.F378]);[.F378]+[.G377];"") ->  | H378: of:=IF(AND([.G378]<=[Unidades.$G$26];[.G378]<=[Unidades.$F$18];[Unidades.$F$18]>0);[Unidades.$D$18]+1-COUNTIFS([Unidades.$O$3:.$O$17];">="&[.G378]);"") ->  | I378: of:=IF([.H377]<>[.H378];"INICIO";IF([.H379]<>[.H378];"FIN";"")) ->  | J378: of:=IF([.K377]<>[.K378];"INICIO";IF([.K379]<>[.K378];"FIN";"")) -> 
A379: of:=IF([.B379]<>"";TODAY()>[.B379];"") ->  | B379: of:=IFERROR(IF(([.B378]+1)<[Calendario.$F$5];[.B378]+1;"");"") ->  | C379: of:=IF(AND([.B379]>=[Calendario.$F$8];[.B379]<=[Calendario.$F$9];1);1;IF(AND([.B379]>=[Calendario.$F$12];[.B379]<=[Calendario.$F$13]);2;IF(AND([.B379]>=[Calendario.$F$16];[.B379]<=[Calendario.$F$17]);3;""))) ->  | D379: of:=IF(COUNTIF([Calendario.$H$4:.$H$48];[.B379])>0;"FIESTA";"") -> FIESTA | E379: of:=IF([.B379]<>"";VLOOKUP(WEEKDAY([.B379];3);[Calendario.$A$4:.$C$11];2);"") ->  | F379: of:=IF([.B379]<>"";IF([.D379]<>"FIESTA";VLOOKUP(WEEKDAY([.B379];3);[Calendario.$A$4:.$C$11];3);0);"") ->  | G379: of:=IF(ISNUMBER([.F379]);[.F379]+[.G378];"") ->  | H379: of:=IF(AND([.G379]<=[Unidades.$G$26];[.G379]<=[Unidades.$F$18];[Unidades.$F$18]>0);[Unidades.$D$18]+1-COUNTIFS([Unidades.$O$3:.$O$17];">="&[.G379]);"") ->  | I379: of:=IF([.H378]<>[.H379];"INICIO";IF([.H380]<>[.H379];"FIN";"")) ->  | J379: of:=IF([.K378]<>[.K379];"INICIO";IF([.K380]<>[.K379];"FIN";"")) -> 
A380: of:=IF([.B380]<>"";TODAY()>[.B380];"") ->  | B380: of:=IFERROR(IF(([.B379]+1)<[Calendario.$F$5];[.B379]+1;"");"") ->  | C380: of:=IF(AND([.B380]>=[Calendario.$F$8];[.B380]<=[Calendario.$F$9];1);1;IF(AND([.B380]>=[Calendario.$F$12];[.B380]<=[Calendario.$F$13]);2;IF(AND([.B380]>=[Calendario.$F$16];[.B380]<=[Calendario.$F$17]);3;""))) ->  | D380: of:=IF(COUNTIF([Calendario.$H$4:.$H$48];[.B380])>0;"FIESTA";"") -> FIESTA | E380: of:=IF([.B380]<>"";VLOOKUP(WEEKDAY([.B380];3);[Calendario.$A$4:.$C$11];2);"") ->  | F380: of:=IF([.B380]<>"";IF([.D380]<>"FIESTA";VLOOKUP(WEEKDAY([.B380];3);[Calendario.$A$4:.$C$11];3);0);"") ->  | G380: of:=IF(ISNUMBER([.F380]);[.F380]+[.G379];"") ->  | H380: of:=IF(AND([.G380]<=[Unidades.$G$26];[.G380]<=[Unidades.$F$18];[Unidades.$F$18]>0);[Unidades.$D$18]+1-COUNTIFS([Unidades.$O$3:.$O$17];">="&[.G380]);"") ->  | I380: of:=IF([.H379]<>[.H380];"INICIO";IF([.H381]<>[.H380];"FIN";"")) ->  | J380: of:=IF([.K379]<>[.K380];"INICIO";IF([.K381]<>[.K380];"FIN";"")) -> 
A381: of:=IF([.B381]<>"";TODAY()>[.B381];"") ->  | B381: of:=IFERROR(IF(([.B380]+1)<[Calendario.$F$5];[.B380]+1;"");"") ->  | C381: of:=IF(AND([.B381]>=[Calendario.$F$8];[.B381]<=[Calendario.$F$9];1);1;IF(AND([.B381]>=[Calendario.$F$12];[.B381]<=[Calendario.$F$13]);2;IF(AND([.B381]>=[Calendario.$F$16];[.B381]<=[Calendario.$F$17]);3;""))) ->  | D381: of:=IF(COUNTIF([Calendario.$H$4:.$H$48];[.B381])>0;"FIESTA";"") -> FIESTA | E381: of:=IF([.B381]<>"";VLOOKUP(WEEKDAY([.B381];3);[Calendario.$A$4:.$C$11];2);"") ->  | F381: of:=IF([.B381]<>"";IF([.D381]<>"FIESTA";VLOOKUP(WEEKDAY([.B381];3);[Calendario.$A$4:.$C$11];3);0);"") ->  | G381: of:=IF(ISNUMBER([.F381]);[.F381]+[.G380];"") ->  | H381: of:=IF(AND([.G381]<=[Unidades.$G$26];[.G381]<=[Unidades.$F$18];[Unidades.$F$18]>0);[Unidades.$D$18]+1-COUNTIFS([Unidades.$O$3:.$O$17];">="&[.G381]);"") ->  | I381: of:=IF([.H380]<>[.H381];"INICIO";IF([.H382]<>[.H381];"FIN";"")) ->  | J381: of:=IF([.K380]<>[.K381];"INICIO";IF([.K382]<>[.K381];"FIN";"")) -> 
A382: of:=IF([.B382]<>"";TODAY()>[.B382];"") ->  | B382: of:=IFERROR(IF(([.B381]+1)<[Calendario.$F$5];[.B381]+1;"");"") ->  | C382: of:=IF(AND([.B382]>=[Calendario.$F$8];[.B382]<=[Calendario.$F$9];1);1;IF(AND([.B382]>=[Calendario.$F$12];[.B382]<=[Calendario.$F$13]);2;IF(AND([.B382]>=[Calendario.$F$16];[.B382]<=[Calendario.$F$17]);3;""))) ->  | D382: of:=IF(COUNTIF([Calendario.$H$4:.$H$48];[.B382])>0;"FIESTA";"") -> FIESTA | E382: of:=IF([.B382]<>"";VLOOKUP(WEEKDAY([.B382];3);[Calendario.$A$4:.$C$11];2);"") ->  | F382: of:=IF([.B382]<>"";IF([.D382]<>"FIESTA";VLOOKUP(WEEKDAY([.B382];3);[Calendario.$A$4:.$C$11];3);0);"") ->  | G382: of:=IF(ISNUMBER([.F382]);[.F382]+[.G381];"") ->  | H382: of:=IF(AND([.G382]<=[Unidades.$G$26];[.G382]<=[Unidades.$F$18];[Unidades.$F$18]>0);[Unidades.$D$18]+1-COUNTIFS([Unidades.$O$3:.$O$17];">="&[.G382]);"") ->  | I382: of:=IF([.H381]<>[.H382];"INICIO";IF([.H383]<>[.H382];"FIN";"")) ->  | J382: of:=IF([.K381]<>[.K382];"INICIO";IF([.K383]<>[.K382];"FIN";"")) -> 
A383: of:=IF([.B383]<>"";TODAY()>[.B383];"") ->  | B383: of:=IFERROR(IF(([.B382]+1)<[Calendario.$F$5];[.B382]+1;"");"") ->  | C383: of:=IF(AND([.B383]>=[Calendario.$F$8];[.B383]<=[Calendario.$F$9];1);1;IF(AND([.B383]>=[Calendario.$F$12];[.B383]<=[Calendario.$F$13]);2;IF(AND([.B383]>=[Calendario.$F$16];[.B383]<=[Calendario.$F$17]);3;""))) ->  | D383: of:=IF(COUNTIF([Calendario.$H$4:.$H$48];[.B383])>0;"FIESTA";"") -> FIESTA | E383: of:=IF([.B383]<>"";VLOOKUP(WEEKDAY([.B383];3);[Calendario.$A$4:.$C$11];2);"") ->  | F383: of:=IF([.B383]<>"";IF([.D383]<>"FIESTA";VLOOKUP(WEEKDAY([.B383];3);[Calendario.$A$4:.$C$11];3);0);"") ->  | G383: of:=IF(ISNUMBER([.F383]);[.F383]+[.G382];"") ->  | H383: of:=IF(AND([.G383]<=[Unidades.$G$26];[.G383]<=[Unidades.$F$18];[Unidades.$F$18]>0);[Unidades.$D$18]+1-COUNTIFS([Unidades.$O$3:.$O$17];">="&[.G383]);"") ->  | I383: of:=IF([.H382]<>[.H383];"INICIO";IF([.H384]<>[.H383];"FIN";"")) ->  | J383: of:=IF([.K382]<>[.K383];"INICIO";IF([.K384]<>[.K383];"FIN";"")) -> 
A384: of:=IF([.B384]<>"";TODAY()>[.B384];"") ->  | B384: of:=IFERROR(IF(([.B383]+1)<[Calendario.$F$5];[.B383]+1;"");"") ->  | C384: of:=IF(AND([.B384]>=[Calendario.$F$8];[.B384]<=[Calendario.$F$9];1);1;IF(AND([.B384]>=[Calendario.$F$12];[.B384]<=[Calendario.$F$13]);2;IF(AND([.B384]>=[Calendario.$F$16];[.B384]<=[Calendario.$F$17]);3;""))) ->  | D384: of:=IF(COUNTIF([Calendario.$H$4:.$H$48];[.B384])>0;"FIESTA";"") -> FIESTA | E384: of:=IF([.B384]<>"";VLOOKUP(WEEKDAY([.B384];3);[Calendario.$A$4:.$C$11];2);"") ->  | F384: of:=IF([.B384]<>"";IF([.D384]<>"FIESTA";VLOOKUP(WEEKDAY([.B384];3);[Calendario.$A$4:.$C$11];3);0);"") ->  | G384: of:=IF(ISNUMBER([.F384]);[.F384]+[.G383];"") ->  | H384: of:=IF(AND([.G384]<=[Unidades.$G$26];[.G384]<=[Unidades.$F$18];[Unidades.$F$18]>0);[Unidades.$D$18]+1-COUNTIFS([Unidades.$O$3:.$O$17];">="&[.G384]);"") ->  | I384: of:=IF([.H383]<>[.H384];"INICIO";IF([.H385]<>[.H384];"FIN";"")) ->  | J384: of:=IF([.K383]<>[.K384];"INICIO";IF([.K385]<>[.K384];"FIN";"")) -> 
A385: of:=IF([.B385]<>"";TODAY()>[.B385];"") ->  | B385: of:=IFERROR(IF(([.B384]+1)<[Calendario.$F$5];[.B384]+1;"");"") ->  | C385: of:=IF(AND([.B385]>=[Calendario.$F$8];[.B385]<=[Calendario.$F$9];1);1;IF(AND([.B385]>=[Calendario.$F$12];[.B385]<=[Calendario.$F$13]);2;IF(AND([.B385]>=[Calendario.$F$16];[.B385]<=[Calendario.$F$17]);3;""))) ->  | D385: of:=IF(COUNTIF([Calendario.$H$4:.$H$48];[.B385])>0;"FIESTA";"") -> FIESTA | E385: of:=IF([.B385]<>"";VLOOKUP(WEEKDAY([.B385];3);[Calendario.$A$4:.$C$11];2);"") ->  | F385: of:=IF([.B385]<>"";IF([.D385]<>"FIESTA";VLOOKUP(WEEKDAY([.B385];3);[Calendario.$A$4:.$C$11];3);0);"") ->  | G385: of:=IF(ISNUMBER([.F385]);[.F385]+[.G384];"") ->  | H385: of:=IF(AND([.G385]<=[Unidades.$G$26];[.G385]<=[Unidades.$F$18];[Unidades.$F$18]>0);[Unidades.$D$18]+1-COUNTIFS([Unidades.$O$3:.$O$17];">="&[.G385]);"") ->  | I385: of:=IF([.H384]<>[.H385];"INICIO";IF([.H386]<>[.H385];"FIN";"")) ->  | J385: of:=IF([.K384]<>[.K385];"INICIO";IF([.K386]<>[.K385];"FIN";"")) -> 
A386: of:=IF([.B386]<>"";TODAY()>[.B386];"") ->  | B386: of:=IFERROR(IF(([.B385]+1)<[Calendario.$F$5];[.B385]+1;"");"") ->  | C386: of:=IF(AND([.B386]>=[Calendario.$F$8];[.B386]<=[Calendario.$F$9];1);1;IF(AND([.B386]>=[Calendario.$F$12];[.B386]<=[Calendario.$F$13]);2;IF(AND([.B386]>=[Calendario.$F$16];[.B386]<=[Calendario.$F$17]);3;""))) ->  | D386: of:=IF(COUNTIF([Calendario.$H$4:.$H$48];[.B386])>0;"FIESTA";"") -> FIESTA | E386: of:=IF([.B386]<>"";VLOOKUP(WEEKDAY([.B386];3);[Calendario.$A$4:.$C$11];2);"") ->  | F386: of:=IF([.B386]<>"";IF([.D386]<>"FIESTA";VLOOKUP(WEEKDAY([.B386];3);[Calendario.$A$4:.$C$11];3);0);"") ->  | G386: of:=IF(ISNUMBER([.F386]);[.F386]+[.G385];"") ->  | H386: of:=IF(AND([.G386]<=[Unidades.$G$26];[.G386]<=[Unidades.$F$18];[Unidades.$F$18]>0);[Unidades.$D$18]+1-COUNTIFS([Unidades.$O$3:.$O$17];">="&[.G386]);"") ->  | I386: of:=IF([.H385]<>[.H386];"INICIO";IF([.H387]<>[.H386];"FIN";"")) ->  | J386: of:=IF([.K385]<>[.K386];"INICIO";IF([.K387]<>[.K386];"FIN";"")) -> 
A387: of:=IF([.B387]<>"";TODAY()>[.B387];"") ->  | B387: of:=IFERROR(IF(([.B386]+1)<[Calendario.$F$5];[.B386]+1;"");"") ->  | C387: of:=IF(AND([.B387]>=[Calendario.$F$8];[.B387]<=[Calendario.$F$9];1);1;IF(AND([.B387]>=[Calendario.$F$12];[.B387]<=[Calendario.$F$13]);2;IF(AND([.B387]>=[Calendario.$F$16];[.B387]<=[Calendario.$F$17]);3;""))) ->  | D387: of:=IF(COUNTIF([Calendario.$H$4:.$H$48];[.B387])>0;"FIESTA";"") -> FIESTA | E387: of:=IF([.B387]<>"";VLOOKUP(WEEKDAY([.B387];3);[Calendario.$A$4:.$C$11];2);"") ->  | F387: of:=IF([.B387]<>"";IF([.D387]<>"FIESTA";VLOOKUP(WEEKDAY([.B387];3);[Calendario.$A$4:.$C$11];3);0);"") ->  | G387: of:=IF(ISNUMBER([.F387]);[.F387]+[.G386];"") ->  | H387: of:=IF(AND([.G387]<=[Unidades.$G$26];[.G387]<=[Unidades.$F$18];[Unidades.$F$18]>0);[Unidades.$D$18]+1-COUNTIFS([Unidades.$O$3:.$O$17];">="&[.G387]);"") ->  | I387: of:=IF([.H386]<>[.H387];"INICIO";IF([.H388]<>[.H387];"FIN";"")) ->  | J387: of:=IF([.K386]<>[.K387];"INICIO";IF([.K388]<>[.K387];"FIN";"")) -> 
A388: of:=IF([.B388]<>"";TODAY()>[.B388];"") ->  | B388: of:=IFERROR(IF(([.B387]+1)<[Calendario.$F$5];[.B387]+1;"");"") ->  | C388: of:=IF(AND([.B388]>=[Calendario.$F$8];[.B388]<=[Calendario.$F$9];1);1;IF(AND([.B388]>=[Calendario.$F$12];[.B388]<=[Calendario.$F$13]);2;IF(AND([.B388]>=[Calendario.$F$16];[.B388]<=[Calendario.$F$17]);3;""))) ->  | D388: of:=IF(COUNTIF([Calendario.$H$4:.$H$48];[.B388])>0;"FIESTA";"") -> FIESTA | E388: of:=IF([.B388]<>"";VLOOKUP(WEEKDAY([.B388];3);[Calendario.$A$4:.$C$11];2);"") ->  | F388: of:=IF([.B388]<>"";IF([.D388]<>"FIESTA";VLOOKUP(WEEKDAY([.B388];3);[Calendario.$A$4:.$C$11];3);0);"") ->  | G388: of:=IF(ISNUMBER([.F388]);[.F388]+[.G387];"") ->  | H388: of:=IF(AND([.G388]<=[Unidades.$G$26];[.G388]<=[Unidades.$F$18];[Unidades.$F$18]>0);[Unidades.$D$18]+1-COUNTIFS([Unidades.$O$3:.$O$17];">="&[.G388]);"") ->  | I388: of:=IF([.H387]<>[.H388];"INICIO";IF([.H389]<>[.H388];"FIN";"")) ->  | J388: of:=IF([.K387]<>[.K388];"INICIO";IF([.K389]<>[.K388];"FIN";"")) -> 
A389: of:=IF([.B389]<>"";TODAY()>[.B389];"") ->  | B389: of:=IFERROR(IF(([.B388]+1)<[Calendario.$F$5];[.B388]+1;"");"") ->  | C389: of:=IF(AND([.B389]>=[Calendario.$F$8];[.B389]<=[Calendario.$F$9];1);1;IF(AND([.B389]>=[Calendario.$F$12];[.B389]<=[Calendario.$F$13]);2;IF(AND([.B389]>=[Calendario.$F$16];[.B389]<=[Calendario.$F$17]);3;""))) ->  | D389: of:=IF(COUNTIF([Calendario.$H$4:.$H$48];[.B389])>0;"FIESTA";"") -> FIESTA | E389: of:=IF([.B389]<>"";VLOOKUP(WEEKDAY([.B389];3);[Calendario.$A$4:.$C$11];2);"") ->  | F389: of:=IF([.B389]<>"";IF([.D389]<>"FIESTA";VLOOKUP(WEEKDAY([.B389];3);[Calendario.$A$4:.$C$11];3);0);"") ->  | G389: of:=IF(ISNUMBER([.F389]);[.F389]+[.G388];"") ->  | H389: of:=IF(AND([.G389]<=[Unidades.$G$26];[.G389]<=[Unidades.$F$18];[Unidades.$F$18]>0);[Unidades.$D$18]+1-COUNTIFS([Unidades.$O$3:.$O$17];">="&[.G389]);"") ->  | I389: of:=IF([.H388]<>[.H389];"INICIO";IF([.H390]<>[.H389];"FIN";"")) ->  | J389: of:=IF([.K388]<>[.K389];"INICIO";IF([.K390]<>[.K389];"FIN";"")) -> 
A390: of:=IF([.B390]<>"";TODAY()>[.B390];"") ->  | B390: of:=IFERROR(IF(([.B389]+1)<[Calendario.$F$5];[.B389]+1;"");"") ->  | C390: of:=IF(AND([.B390]>=[Calendario.$F$8];[.B390]<=[Calendario.$F$9];1);1;IF(AND([.B390]>=[Calendario.$F$12];[.B390]<=[Calendario.$F$13]);2;IF(AND([.B390]>=[Calendario.$F$16];[.B390]<=[Calendario.$F$17]);3;""))) ->  | D390: of:=IF(COUNTIF([Calendario.$H$4:.$H$48];[.B390])>0;"FIESTA";"") -> FIESTA | E390: of:=IF([.B390]<>"";VLOOKUP(WEEKDAY([.B390];3);[Calendario.$A$4:.$C$11];2);"") ->  | F390: of:=IF([.B390]<>"";IF([.D390]<>"FIESTA";VLOOKUP(WEEKDAY([.B390];3);[Calendario.$A$4:.$C$11];3);0);"") ->  | G390: of:=IF(ISNUMBER([.F390]);[.F390]+[.G389];"") ->  | H390: of:=IF(AND([.G390]<=[Unidades.$G$26];[.G390]<=[Unidades.$F$18];[Unidades.$F$18]>0);[Unidades.$D$18]+1-COUNTIFS([Unidades.$O$3:.$O$17];">="&[.G390]);"") ->  | I390: of:=IF([.H389]<>[.H390];"INICIO";IF([.H391]<>[.H390];"FIN";"")) ->  | J390: of:=IF([.K389]<>[.K390];"INICIO";IF([.K391]<>[.K390];"FIN";"")) -> 
A391: of:=IF([.B391]<>"";TODAY()>[.B391];"") ->  | B391: of:=IFERROR(IF(([.B390]+1)<[Calendario.$F$5];[.B390]+1;"");"") ->  | C391: of:=IF(AND([.B391]>=[Calendario.$F$8];[.B391]<=[Calendario.$F$9];1);1;IF(AND([.B391]>=[Calendario.$F$12];[.B391]<=[Calendario.$F$13]);2;IF(AND([.B391]>=[Calendario.$F$16];[.B391]<=[Calendario.$F$17]);3;""))) ->  | D391: of:=IF(COUNTIF([Calendario.$H$4:.$H$48];[.B391])>0;"FIESTA";"") -> FIESTA | E391: of:=IF([.B391]<>"";VLOOKUP(WEEKDAY([.B391];3);[Calendario.$A$4:.$C$11];2);"") ->  | F391: of:=IF([.B391]<>"";IF([.D391]<>"FIESTA";VLOOKUP(WEEKDAY([.B391];3);[Calendario.$A$4:.$C$11];3);0);"") ->  | G391: of:=IF(ISNUMBER([.F391]);[.F391]+[.G390];"") ->  | H391: of:=IF(AND([.G391]<=[Unidades.$G$26];[.G391]<=[Unidades.$F$18];[Unidades.$F$18]>0);[Unidades.$D$18]+1-COUNTIFS([Unidades.$O$3:.$O$17];">="&[.G391]);"") ->  | I391: of:=IF([.H390]<>[.H391];"INICIO";IF([.H392]<>[.H391];"FIN";"")) ->  | J391: of:=IF([.K390]<>[.K391];"INICIO";IF([.K392]<>[.K391];"FIN";"")) -> 
A392: of:=IF([.B392]<>"";TODAY()>[.B392];"") ->  | B392: of:=IFERROR(IF(([.B391]+1)<[Calendario.$F$5];[.B391]+1;"");"") ->  | C392: of:=IF(AND([.B392]>=[Calendario.$F$8];[.B392]<=[Calendario.$F$9];1);1;IF(AND([.B392]>=[Calendario.$F$12];[.B392]<=[Calendario.$F$13]);2;IF(AND([.B392]>=[Calendario.$F$16];[.B392]<=[Calendario.$F$17]);3;""))) ->  | D392: of:=IF(COUNTIF([Calendario.$H$4:.$H$48];[.B392])>0;"FIESTA";"") -> FIESTA | E392: of:=IF([.B392]<>"";VLOOKUP(WEEKDAY([.B392];3);[Calendario.$A$4:.$C$11];2);"") ->  | F392: of:=IF([.B392]<>"";IF([.D392]<>"FIESTA";VLOOKUP(WEEKDAY([.B392];3);[Calendario.$A$4:.$C$11];3);0);"") ->  | G392: of:=IF(ISNUMBER([.F392]);[.F392]+[.G391];"") ->  | H392: of:=IF(AND([.G392]<=[Unidades.$G$26];[.G392]<=[Unidades.$F$18];[Unidades.$F$18]>0);[Unidades.$D$18]+1-COUNTIFS([Unidades.$O$3:.$O$17];">="&[.G392]);"") ->  | I392: of:=IF([.H391]<>[.H392];"INICIO";IF([.H393]<>[.H392];"FIN";"")) ->  | J392: of:=IF([.K391]<>[.K392];"INICIO";IF([.K393]<>[.K392];"FIN";"")) -> 
A393: of:=IF([.B393]<>"";TODAY()>[.B393];"") ->  | B393: of:=IFERROR(IF(([.B392]+1)<[Calendario.$F$5];[.B392]+1;"");"") ->  | C393: of:=IF(AND([.B393]>=[Calendario.$F$8];[.B393]<=[Calendario.$F$9];1);1;IF(AND([.B393]>=[Calendario.$F$12];[.B393]<=[Calendario.$F$13]);2;IF(AND([.B393]>=[Calendario.$F$16];[.B393]<=[Calendario.$F$17]);3;""))) ->  | D393: of:=IF(COUNTIF([Calendario.$H$4:.$H$48];[.B393])>0;"FIESTA";"") -> FIESTA | E393: of:=IF([.B393]<>"";VLOOKUP(WEEKDAY([.B393];3);[Calendario.$A$4:.$C$11];2);"") ->  | F393: of:=IF([.B393]<>"";IF([.D393]<>"FIESTA";VLOOKUP(WEEKDAY([.B393];3);[Calendario.$A$4:.$C$11];3);0);"") ->  | G393: of:=IF(ISNUMBER([.F393]);[.F393]+[.G392];"") ->  | H393: of:=IF(AND([.G393]<=[Unidades.$G$26];[.G393]<=[Unidades.$F$18];[Unidades.$F$18]>0);[Unidades.$D$18]+1-COUNTIFS([Unidades.$O$3:.$O$17];">="&[.G393]);"") ->  | I393: of:=IF([.H392]<>[.H393];"INICIO";IF([.H394]<>[.H393];"FIN";"")) ->  | J393: of:=IF([.K392]<>[.K393];"INICIO";IF([.K394]<>[.K393];"FIN";"")) -> 
A394: of:=IF([.B394]<>"";TODAY()>[.B394];"") ->  | B394: of:=IFERROR(IF(([.B393]+1)<[Calendario.$F$5];[.B393]+1;"");"") ->  | C394: of:=IF(AND([.B394]>=[Calendario.$F$8];[.B394]<=[Calendario.$F$9];1);1;IF(AND([.B394]>=[Calendario.$F$12];[.B394]<=[Calendario.$F$13]);2;IF(AND([.B394]>=[Calendario.$F$16];[.B394]<=[Calendario.$F$17]);3;""))) ->  | D394: of:=IF(COUNTIF([Calendario.$H$4:.$H$48];[.B394])>0;"FIESTA";"") -> FIESTA | E394: of:=IF([.B394]<>"";VLOOKUP(WEEKDAY([.B394];3);[Calendario.$A$4:.$C$11];2);"") ->  | F394: of:=IF([.B394]<>"";IF([.D394]<>"FIESTA";VLOOKUP(WEEKDAY([.B394];3);[Calendario.$A$4:.$C$11];3);0);"") ->  | G394: of:=IF(ISNUMBER([.F394]);[.F394]+[.G393];"") ->  | H394: of:=IF(AND([.G394]<=[Unidades.$G$26];[.G394]<=[Unidades.$F$18];[Unidades.$F$18]>0);[Unidades.$D$18]+1-COUNTIFS([Unidades.$O$3:.$O$17];">="&[.G394]);"") ->  | I394: of:=IF([.H393]<>[.H394];"INICIO";IF([.H395]<>[.H394];"FIN";"")) ->  | J394: of:=IF([.K393]<>[.K394];"INICIO";IF([.K395]<>[.K394];"FIN";"")) -> 
A395: of:=IF([.B395]<>"";TODAY()>[.B395];"") ->  | B395: of:=IFERROR(IF(([.B394]+1)<[Calendario.$F$5];[.B394]+1;"");"") ->  | C395: of:=IF(AND([.B395]>=[Calendario.$F$8];[.B395]<=[Calendario.$F$9];1);1;IF(AND([.B395]>=[Calendario.$F$12];[.B395]<=[Calendario.$F$13]);2;IF(AND([.B395]>=[Calendario.$F$16];[.B395]<=[Calendario.$F$17]);3;""))) ->  | D395: of:=IF(COUNTIF([Calendario.$H$4:.$H$48];[.B395])>0;"FIESTA";"") -> FIESTA | E395: of:=IF([.B395]<>"";VLOOKUP(WEEKDAY([.B395];3);[Calendario.$A$4:.$C$11];2);"") ->  | F395: of:=IF([.B395]<>"";IF([.D395]<>"FIESTA";VLOOKUP(WEEKDAY([.B395];3);[Calendario.$A$4:.$C$11];3);0);"") ->  | G395: of:=IF(ISNUMBER([.F395]);[.F395]+[.G394];"") ->  | H395: of:=IF(AND([.G395]<=[Unidades.$G$26];[.G395]<=[Unidades.$F$18];[Unidades.$F$18]>0);[Unidades.$D$18]+1-COUNTIFS([Unidades.$O$3:.$O$17];">="&[.G395]);"") ->  | I395: of:=IF([.H394]<>[.H395];"INICIO";IF([.H396]<>[.H395];"FIN";"")) ->  | J395: of:=IF([.K394]<>[.K395];"INICIO";IF([.K396]<>[.K395];"FIN";"")) -> 
A396: of:=IF([.B396]<>"";TODAY()>[.B396];"") ->  | B396: of:=IFERROR(IF(([.B395]+1)<[Calendario.$F$5];[.B395]+1;"");"") ->  | C396: of:=IF(AND([.B396]>=[Calendario.$F$8];[.B396]<=[Calendario.$F$9];1);1;IF(AND([.B396]>=[Calendario.$F$12];[.B396]<=[Calendario.$F$13]);2;IF(AND([.B396]>=[Calendario.$F$16];[.B396]<=[Calendario.$F$17]);3;""))) ->  | D396: of:=IF(COUNTIF([Calendario.$H$4:.$H$48];[.B396])>0;"FIESTA";"") -> FIESTA | E396: of:=IF([.B396]<>"";VLOOKUP(WEEKDAY([.B396];3);[Calendario.$A$4:.$C$11];2);"") ->  | F396: of:=IF([.B396]<>"";IF([.D396]<>"FIESTA";VLOOKUP(WEEKDAY([.B396];3);[Calendario.$A$4:.$C$11];3);0);"") ->  | G396: of:=IF(ISNUMBER([.F396]);[.F396]+[.G395];"") ->  | H396: of:=IF(AND([.G396]<=[Unidades.$G$26];[.G396]<=[Unidades.$F$18];[Unidades.$F$18]>0);[Unidades.$D$18]+1-COUNTIFS([Unidades.$O$3:.$O$17];">="&[.G396]);"") ->  | I396: of:=IF([.H395]<>[.H396];"INICIO";IF([.H397]<>[.H396];"FIN";"")) ->  | J396: of:=IF([.K395]<>[.K396];"INICIO";IF([.K397]<>[.K396];"FIN";"")) -> 
A397: of:=IF([.B397]<>"";TODAY()>[.B397];"") ->  | B397: of:=IFERROR(IF(([.B396]+1)<[Calendario.$F$5];[.B396]+1;"");"") ->  | C397: of:=IF(AND([.B397]>=[Calendario.$F$8];[.B397]<=[Calendario.$F$9];1);1;IF(AND([.B397]>=[Calendario.$F$12];[.B397]<=[Calendario.$F$13]);2;IF(AND([.B397]>=[Calendario.$F$16];[.B397]<=[Calendario.$F$17]);3;""))) ->  | D397: of:=IF(COUNTIF([Calendario.$H$4:.$H$48];[.B397])>0;"FIESTA";"") -> FIESTA | E397: of:=IF([.B397]<>"";VLOOKUP(WEEKDAY([.B397];3);[Calendario.$A$4:.$C$11];2);"") ->  | F397: of:=IF([.B397]<>"";IF([.D397]<>"FIESTA";VLOOKUP(WEEKDAY([.B397];3);[Calendario.$A$4:.$C$11];3);0);"") ->  | G397: of:=IF(ISNUMBER([.F397]);[.F397]+[.G396];"") ->  | H397: of:=IF(AND([.G397]<=[Unidades.$G$26];[.G397]<=[Unidades.$F$18];[Unidades.$F$18]>0);[Unidades.$D$18]+1-COUNTIFS([Unidades.$O$3:.$O$17];">="&[.G397]);"") ->  | I397: of:=IF([.H396]<>[.H397];"INICIO";IF([.H398]<>[.H397];"FIN";"")) ->  | J397: of:=IF([.K396]<>[.K397];"INICIO";IF([.K398]<>[.K397];"FIN";"")) -> 
A398: of:=IF([.B398]<>"";TODAY()>[.B398];"") ->  | B398: of:=IFERROR(IF(([.B397]+1)<[Calendario.$F$5];[.B397]+1;"");"") ->  | C398: of:=IF(AND([.B398]>=[Calendario.$F$8];[.B398]<=[Calendario.$F$9];1);1;IF(AND([.B398]>=[Calendario.$F$12];[.B398]<=[Calendario.$F$13]);2;IF(AND([.B398]>=[Calendario.$F$16];[.B398]<=[Calendario.$F$17]);3;""))) ->  | D398: of:=IF(COUNTIF([Calendario.$H$4:.$H$48];[.B398])>0;"FIESTA";"") -> FIESTA | E398: of:=IF([.B398]<>"";VLOOKUP(WEEKDAY([.B398];3);[Calendario.$A$4:.$C$11];2);"") ->  | F398: of:=IF([.B398]<>"";IF([.D398]<>"FIESTA";VLOOKUP(WEEKDAY([.B398];3);[Calendario.$A$4:.$C$11];3);0);"") ->  | G398: of:=IF(ISNUMBER([.F398]);[.F398]+[.G397];"") ->  | H398: of:=IF(AND([.G398]<=[Unidades.$G$26];[.G398]<=[Unidades.$F$18];[Unidades.$F$18]>0);[Unidades.$D$18]+1-COUNTIFS([Unidades.$O$3:.$O$17];">="&[.G398]);"") ->  | I398: of:=IF([.H397]<>[.H398];"INICIO";IF([.H399]<>[.H398];"FIN";"")) ->  | J398: of:=IF([.K397]<>[.K398];"INICIO";IF([.K399]<>[.K398];"FIN";"")) -> 
A399: of:=IF([.B399]<>"";TODAY()>[.B399];"") ->  | B399: of:=IFERROR(IF(([.B398]+1)<[Calendario.$F$5];[.B398]+1;"");"") ->  | C399: of:=IF(AND([.B399]>=[Calendario.$F$8];[.B399]<=[Calendario.$F$9];1);1;IF(AND([.B399]>=[Calendario.$F$12];[.B399]<=[Calendario.$F$13]);2;IF(AND([.B399]>=[Calendario.$F$16];[.B399]<=[Calendario.$F$17]);3;""))) ->  | D399: of:=IF(COUNTIF([Calendario.$H$4:.$H$48];[.B399])>0;"FIESTA";"") -> FIESTA | E399: of:=IF([.B399]<>"";VLOOKUP(WEEKDAY([.B399];3);[Calendario.$A$4:.$C$11];2);"") ->  | F399: of:=IF([.B399]<>"";IF([.D399]<>"FIESTA";VLOOKUP(WEEKDAY([.B399];3);[Calendario.$A$4:.$C$11];3);0);"") ->  | G399: of:=IF(ISNUMBER([.F399]);[.F399]+[.G398];"") ->  | H399: of:=IF(AND([.G399]<=[Unidades.$G$26];[.G399]<=[Unidades.$F$18];[Unidades.$F$18]>0);[Unidades.$D$18]+1-COUNTIFS([Unidades.$O$3:.$O$17];">="&[.G399]);"") ->  | I399: of:=IF([.H398]<>[.H399];"INICIO";IF([.H400]<>[.H399];"FIN";"")) ->  | J399: of:=IF([.K398]<>[.K399];"INICIO";IF([.K400]<>[.K399];"FIN";"")) -> 
A400: of:=IF([.B400]<>"";TODAY()>[.B400];"") ->  | B400: of:=IFERROR(IF(([.B399]+1)<[Calendario.$F$5];[.B399]+1;"");"") ->  | C400: of:=IF(AND([.B400]>=[Calendario.$F$8];[.B400]<=[Calendario.$F$9];1);1;IF(AND([.B400]>=[Calendario.$F$12];[.B400]<=[Calendario.$F$13]);2;IF(AND([.B400]>=[Calendario.$F$16];[.B400]<=[Calendario.$F$17]);3;""))) ->  | D400: of:=IF(COUNTIF([Calendario.$H$4:.$H$48];[.B400])>0;"FIESTA";"") -> FIESTA | E400: of:=IF([.B400]<>"";VLOOKUP(WEEKDAY([.B400];3);[Calendario.$A$4:.$C$11];2);"") ->  | F400: of:=IF([.B400]<>"";IF([.D400]<>"FIESTA";VLOOKUP(WEEKDAY([.B400];3);[Calendario.$A$4:.$C$11];3);0);"") ->  | G400: of:=IF(ISNUMBER([.F400]);[.F400]+[.G399];"") ->  | H400: of:=IF(AND([.G400]<=[Unidades.$G$26];[.G400]<=[Unidades.$F$18];[Unidades.$F$18]>0);[Unidades.$D$18]+1-COUNTIFS([Unidades.$O$3:.$O$17];">="&[.G400]);"") ->  | I400: of:=IF([.H399]<>[.H400];"INICIO";IF([.H401]<>[.H400];"FIN";"")) ->  | J400: of:=IF([.K399]<>[.K400];"INICIO";IF([.K401]<>[.K400];"FIN";"")) -> 
A401: of:=IF([.B401]<>"";TODAY()>[.B401];"") ->  | B401: of:=IFERROR(IF(([.B400]+1)<[Calendario.$F$5];[.B400]+1;"");"") ->  | C401: of:=IF(AND([.B401]>=[Calendario.$F$8];[.B401]<=[Calendario.$F$9];1);1;IF(AND([.B401]>=[Calendario.$F$12];[.B401]<=[Calendario.$F$13]);2;IF(AND([.B401]>=[Calendario.$F$16];[.B401]<=[Calendario.$F$17]);3;""))) ->  | D401: of:=IF(COUNTIF([Calendario.$H$4:.$H$48];[.B401])>0;"FIESTA";"") -> FIESTA | E401: of:=IF([.B401]<>"";VLOOKUP(WEEKDAY([.B401];3);[Calendario.$A$4:.$C$11];2);"") ->  | F401: of:=IF([.B401]<>"";IF([.D401]<>"FIESTA";VLOOKUP(WEEKDAY([.B401];3);[Calendario.$A$4:.$C$11];3);0);"") ->  | G401: of:=IF(ISNUMBER([.F401]);[.F401]+[.G400];"") ->  | H401: of:=IF(AND([.G401]<=[Unidades.$G$26];[.G401]<=[Unidades.$F$18];[Unidades.$F$18]>0);[Unidades.$D$18]+1-COUNTIFS([Unidades.$O$3:.$O$17];">="&[.G401]);"") ->  | I401: of:=IF([.H400]<>[.H401];"INICIO";IF([.H402]<>[.H401];"FIN";"")) ->  | J401: of:=IF([.K400]<>[.K401];"INICIO";IF([.K402]<>[.K401];"FIN";"")) -> 
A402: of:=IF([.B402]<>"";TODAY()>[.B402];"") ->  | B402: of:=IFERROR(IF(([.B401]+1)<[Calendario.$F$5];[.B401]+1;"");"") ->  | C402: of:=IF(AND([.B402]>=[Calendario.$F$8];[.B402]<=[Calendario.$F$9];1);1;IF(AND([.B402]>=[Calendario.$F$12];[.B402]<=[Calendario.$F$13]);2;IF(AND([.B402]>=[Calendario.$F$16];[.B402]<=[Calendario.$F$17]);3;""))) ->  | D402: of:=IF(COUNTIF([Calendario.$H$4:.$H$48];[.B402])>0;"FIESTA";"") -> FIESTA | E402: of:=IF([.B402]<>"";VLOOKUP(WEEKDAY([.B402];3);[Calendario.$A$4:.$C$11];2);"") ->  | F402: of:=IF([.B402]<>"";IF([.D402]<>"FIESTA";VLOOKUP(WEEKDAY([.B402];3);[Calendario.$A$4:.$C$11];3);0);"") ->  | G402: of:=IF(ISNUMBER([.F402]);[.F402]+[.G401];"") ->  | H402: of:=IF(AND([.G402]<=[Unidades.$G$26];[.G402]<=[Unidades.$F$18];[Unidades.$F$18]>0);[Unidades.$D$18]+1-COUNTIFS([Unidades.$O$3:.$O$17];">="&[.G402]);"") ->  | I402: of:=IF([.H401]<>[.H402];"INICIO";IF([.H403]<>[.H402];"FIN";"")) ->  | J402: of:=IF([.K401]<>[.K402];"INICIO";IF([.K403]<>[.K402];"FIN";"")) -> 
A403: of:=IF([.B403]<>"";TODAY()>[.B403];"") ->  | B403: of:=IFERROR(IF(([.B402]+1)<[Calendario.$F$5];[.B402]+1;"");"") ->  | C403: of:=IF(AND([.B403]>=[Calendario.$F$8];[.B403]<=[Calendario.$F$9];1);1;IF(AND([.B403]>=[Calendario.$F$12];[.B403]<=[Calendario.$F$13]);2;IF(AND([.B403]>=[Calendario.$F$16];[.B403]<=[Calendario.$F$17]);3;""))) ->  | D403: of:=IF(COUNTIF([Calendario.$H$4:.$H$48];[.B403])>0;"FIESTA";"") -> FIESTA | E403: of:=IF([.B403]<>"";VLOOKUP(WEEKDAY([.B403];3);[Calendario.$A$4:.$C$11];2);"") ->  | F403: of:=IF([.B403]<>"";IF([.D403]<>"FIESTA";VLOOKUP(WEEKDAY([.B403];3);[Calendario.$A$4:.$C$11];3);0);"") ->  | G403: of:=IF(ISNUMBER([.F403]);[.F403]+[.G402];"") ->  | H403: of:=IF(AND([.G403]<=[Unidades.$G$26];[.G403]<=[Unidades.$F$18];[Unidades.$F$18]>0);[Unidades.$D$18]+1-COUNTIFS([Unidades.$O$3:.$O$17];">="&[.G403]);"") ->  | I403: of:=IF([.H402]<>[.H403];"INICIO";IF([.H404]<>[.H403];"FIN";"")) ->  | J403: of:=IF([.K402]<>[.K403];"INICIO";IF([.K404]<>[.K403];"FIN";"")) -> 
A404: of:=IF([.B404]<>"";TODAY()>[.B404];"") ->  | B404: of:=IFERROR(IF(([.B403]+1)<[Calendario.$F$5];[.B403]+1;"");"") ->  | C404: of:=IF(AND([.B404]>=[Calendario.$F$8];[.B404]<=[Calendario.$F$9];1);1;IF(AND([.B404]>=[Calendario.$F$12];[.B404]<=[Calendario.$F$13]);2;IF(AND([.B404]>=[Calendario.$F$16];[.B404]<=[Calendario.$F$17]);3;""))) ->  | D404: of:=IF(COUNTIF([Calendario.$H$4:.$H$48];[.B404])>0;"FIESTA";"") -> FIESTA | E404: of:=IF([.B404]<>"";VLOOKUP(WEEKDAY([.B404];3);[Calendario.$A$4:.$C$11];2);"") ->  | F404: of:=IF([.B404]<>"";IF([.D404]<>"FIESTA";VLOOKUP(WEEKDAY([.B404];3);[Calendario.$A$4:.$C$11];3);0);"") ->  | G404: of:=IF(ISNUMBER([.F404]);[.F404]+[.G403];"") ->  | H404: of:=IF(AND([.G404]<=[Unidades.$G$26];[.G404]<=[Unidades.$F$18];[Unidades.$F$18]>0);[Unidades.$D$18]+1-COUNTIFS([Unidades.$O$3:.$O$17];">="&[.G404]);"") ->  | I404: of:=IF([.H403]<>[.H404];"INICIO";IF([.H405]<>[.H404];"FIN";"")) ->  | J404: of:=IF([.K403]<>[.K404];"INICIO";IF([.K405]<>[.K404];"FIN";"")) -> 
A405: of:=IF([.B405]<>"";TODAY()>[.B405];"") ->  | B405: of:=IFERROR(IF(([.B404]+1)<[Calendario.$F$5];[.B404]+1;"");"") ->  | C405: of:=IF(AND([.B405]>=[Calendario.$F$8];[.B405]<=[Calendario.$F$9];1);1;IF(AND([.B405]>=[Calendario.$F$12];[.B405]<=[Calendario.$F$13]);2;IF(AND([.B405]>=[Calendario.$F$16];[.B405]<=[Calendario.$F$17]);3;""))) ->  | D405: of:=IF(COUNTIF([Calendario.$H$4:.$H$48];[.B405])>0;"FIESTA";"") -> FIESTA | E405: of:=IF([.B405]<>"";VLOOKUP(WEEKDAY([.B405];3);[Calendario.$A$4:.$C$11];2);"") ->  | F405: of:=IF([.B405]<>"";IF([.D405]<>"FIESTA";VLOOKUP(WEEKDAY([.B405];3);[Calendario.$A$4:.$C$11];3);0);"") ->  | G405: of:=IF(ISNUMBER([.F405]);[.F405]+[.G404];"") ->  | H405: of:=IF(AND([.G405]<=[Unidades.$G$26];[.G405]<=[Unidades.$F$18];[Unidades.$F$18]>0);[Unidades.$D$18]+1-COUNTIFS([Unidades.$O$3:.$O$17];">="&[.G405]);"") ->  | I405: of:=IF([.H404]<>[.H405];"INICIO";IF([.H406]<>[.H405];"FIN";"")) ->  | J405: of:=IF([.K404]<>[.K405];"INICIO";IF([.K406]<>[.K405];"FIN";"")) -> 
A406: of:=IF([.B406]<>"";TODAY()>[.B406];"") ->  | B406: of:=IFERROR(IF(([.B405]+1)<[Calendario.$F$5];[.B405]+1;"");"") ->  | C406: of:=IF(AND([.B406]>=[Calendario.$F$8];[.B406]<=[Calendario.$F$9];1);1;IF(AND([.B406]>=[Calendario.$F$12];[.B406]<=[Calendario.$F$13]);2;IF(AND([.B406]>=[Calendario.$F$16];[.B406]<=[Calendario.$F$17]);3;""))) ->  | D406: of:=IF(COUNTIF([Calendario.$H$4:.$H$48];[.B406])>0;"FIESTA";"") -> FIESTA | E406: of:=IF([.B406]<>"";VLOOKUP(WEEKDAY([.B406];3);[Calendario.$A$4:.$C$11];2);"") ->  | F406: of:=IF([.B406]<>"";IF([.D406]<>"FIESTA";VLOOKUP(WEEKDAY([.B406];3);[Calendario.$A$4:.$C$11];3);0);"") ->  | G406: of:=IF(ISNUMBER([.F406]);[.F406]+[.G405];"") ->  | H406: of:=IF(AND([.G406]<=[Unidades.$G$26];[.G406]<=[Unidades.$F$18];[Unidades.$F$18]>0);[Unidades.$D$18]+1-COUNTIFS([Unidades.$O$3:.$O$17];">="&[.G406]);"") ->  | I406: of:=IF([.H405]<>[.H406];"INICIO";IF([.H407]<>[.H406];"FIN";"")) ->  | J406: of:=IF([.K405]<>[.K406];"INICIO";IF([.K407]<>[.K406];"FIN";"")) -> 
A407: of:=IF([.B407]<>"";TODAY()>[.B407];"") ->  | B407: of:=IFERROR(IF(([.B406]+1)<[Calendario.$F$5];[.B406]+1;"");"") ->  | C407: of:=IF(AND([.B407]>=[Calendario.$F$8];[.B407]<=[Calendario.$F$9];1);1;IF(AND([.B407]>=[Calendario.$F$12];[.B407]<=[Calendario.$F$13]);2;IF(AND([.B407]>=[Calendario.$F$16];[.B407]<=[Calendario.$F$17]);3;""))) ->  | D407: of:=IF(COUNTIF([Calendario.$H$4:.$H$48];[.B407])>0;"FIESTA";"") -> FIESTA | E407: of:=IF([.B407]<>"";VLOOKUP(WEEKDAY([.B407];3);[Calendario.$A$4:.$C$11];2);"") ->  | F407: of:=IF([.B407]<>"";IF([.D407]<>"FIESTA";VLOOKUP(WEEKDAY([.B407];3);[Calendario.$A$4:.$C$11];3);0);"") ->  | G407: of:=IF(ISNUMBER([.F407]);[.F407]+[.G406];"") ->  | H407: of:=IF(AND([.G407]<=[Unidades.$G$26];[.G407]<=[Unidades.$F$18];[Unidades.$F$18]>0);[Unidades.$D$18]+1-COUNTIFS([Unidades.$O$3:.$O$17];">="&[.G407]);"") ->  | I407: of:=IF([.H406]<>[.H407];"INICIO";IF([.H408]<>[.H407];"FIN";"")) ->  | J407: of:=IF([.K406]<>[.K407];"INICIO";IF([.K408]<>[.K407];"FIN";"")) -> 
A408: of:=IF([.B408]<>"";TODAY()>[.B408];"") ->  | B408: of:=IFERROR(IF(([.B407]+1)<[Calendario.$F$5];[.B407]+1;"");"") ->  | C408: of:=IF(AND([.B408]>=[Calendario.$F$8];[.B408]<=[Calendario.$F$9];1);1;IF(AND([.B408]>=[Calendario.$F$12];[.B408]<=[Calendario.$F$13]);2;IF(AND([.B408]>=[Calendario.$F$16];[.B408]<=[Calendario.$F$17]);3;""))) ->  | D408: of:=IF(COUNTIF([Calendario.$H$4:.$H$48];[.B408])>0;"FIESTA";"") -> FIESTA | E408: of:=IF([.B408]<>"";VLOOKUP(WEEKDAY([.B408];3);[Calendario.$A$4:.$C$11];2);"") ->  | F408: of:=IF([.B408]<>"";IF([.D408]<>"FIESTA";VLOOKUP(WEEKDAY([.B408];3);[Calendario.$A$4:.$C$11];3);0);"") ->  | G408: of:=IF(ISNUMBER([.F408]);[.F408]+[.G407];"") ->  | H408: of:=IF(AND([.G408]<=[Unidades.$G$26];[.G408]<=[Unidades.$F$18];[Unidades.$F$18]>0);[Unidades.$D$18]+1-COUNTIFS([Unidades.$O$3:.$O$17];">="&[.G408]);"") ->  | I408: of:=IF([.H407]<>[.H408];"INICIO";IF([.H409]<>[.H408];"FIN";"")) ->  | J408: of:=IF([.K407]<>[.K408];"INICIO";IF([.K409]<>[.K408];"FIN";"")) -> 
A409: of:=IF([.B409]<>"";TODAY()>[.B409];"") ->  | B409: of:=IFERROR(IF(([.B408]+1)<[Calendario.$F$5];[.B408]+1;"");"") ->  | C409: of:=IF(AND([.B409]>=[Calendario.$F$8];[.B409]<=[Calendario.$F$9];1);1;IF(AND([.B409]>=[Calendario.$F$12];[.B409]<=[Calendario.$F$13]);2;IF(AND([.B409]>=[Calendario.$F$16];[.B409]<=[Calendario.$F$17]);3;""))) ->  | D409: of:=IF(COUNTIF([Calendario.$H$4:.$H$48];[.B409])>0;"FIESTA";"") -> FIESTA | E409: of:=IF([.B409]<>"";VLOOKUP(WEEKDAY([.B409];3);[Calendario.$A$4:.$C$11];2);"") ->  | F409: of:=IF([.B409]<>"";IF([.D409]<>"FIESTA";VLOOKUP(WEEKDAY([.B409];3);[Calendario.$A$4:.$C$11];3);0);"") ->  | G409: of:=IF(ISNUMBER([.F409]);[.F409]+[.G408];"") ->  | H409: of:=IF(AND([.G409]<=[Unidades.$G$26];[.G409]<=[Unidades.$F$18];[Unidades.$F$18]>0);[Unidades.$D$18]+1-COUNTIFS([Unidades.$O$3:.$O$17];">="&[.G409]);"") ->  | I409: of:=IF([.H408]<>[.H409];"INICIO";IF([.H410]<>[.H409];"FIN";"")) ->  | J409: of:=IF([.K408]<>[.K409];"INICIO";IF([.K410]<>[.K409];"FIN";"")) -> 
A410: of:=IF([.B410]<>"";TODAY()>[.B410];"") ->  | B410: of:=IFERROR(IF(([.B409]+1)<[Calendario.$F$5];[.B409]+1;"");"") ->  | C410: of:=IF(AND([.B410]>=[Calendario.$F$8];[.B410]<=[Calendario.$F$9];1);1;IF(AND([.B410]>=[Calendario.$F$12];[.B410]<=[Calendario.$F$13]);2;IF(AND([.B410]>=[Calendario.$F$16];[.B410]<=[Calendario.$F$17]);3;""))) ->  | D410: of:=IF(COUNTIF([Calendario.$H$4:.$H$48];[.B410])>0;"FIESTA";"") -> FIESTA | E410: of:=IF([.B410]<>"";VLOOKUP(WEEKDAY([.B410];3);[Calendario.$A$4:.$C$11];2);"") ->  | F410: of:=IF([.B410]<>"";IF([.D410]<>"FIESTA";VLOOKUP(WEEKDAY([.B410];3);[Calendario.$A$4:.$C$11];3);0);"") ->  | G410: of:=IF(ISNUMBER([.F410]);[.F410]+[.G409];"") ->  | H410: of:=IF(AND([.G410]<=[Unidades.$G$26];[.G410]<=[Unidades.$F$18];[Unidades.$F$18]>0);[Unidades.$D$18]+1-COUNTIFS([Unidades.$O$3:.$O$17];">="&[.G410]);"") ->  | I410: of:=IF([.H409]<>[.H410];"INICIO";IF([.H411]<>[.H410];"FIN";"")) ->  | J410: of:=IF([.K409]<>[.K410];"INICIO";IF([.K411]<>[.K410];"FIN";"")) -> 
A411: of:=IF([.B411]<>"";TODAY()>[.B411];"") ->  | B411: of:=IFERROR(IF(([.B410]+1)<[Calendario.$F$5];[.B410]+1;"");"") ->  | C411: of:=IF(AND([.B411]>=[Calendario.$F$8];[.B411]<=[Calendario.$F$9];1);1;IF(AND([.B411]>=[Calendario.$F$12];[.B411]<=[Calendario.$F$13]);2;IF(AND([.B411]>=[Calendario.$F$16];[.B411]<=[Calendario.$F$17]);3;""))) ->  | D411: of:=IF(COUNTIF([Calendario.$H$4:.$H$48];[.B411])>0;"FIESTA";"") -> FIESTA | E411: of:=IF([.B411]<>"";VLOOKUP(WEEKDAY([.B411];3);[Calendario.$A$4:.$C$11];2);"") ->  | F411: of:=IF([.B411]<>"";IF([.D411]<>"FIESTA";VLOOKUP(WEEKDAY([.B411];3);[Calendario.$A$4:.$C$11];3);0);"") ->  | G411: of:=IF(ISNUMBER([.F411]);[.F411]+[.G410];"") ->  | H411: of:=IF(AND([.G411]<=[Unidades.$G$26];[.G411]<=[Unidades.$F$18];[Unidades.$F$18]>0);[Unidades.$D$18]+1-COUNTIFS([Unidades.$O$3:.$O$17];">="&[.G411]);"") ->  | I411: of:=IF([.H410]<>[.H411];"INICIO";IF([.H412]<>[.H411];"FIN";"")) ->  | J411: of:=IF([.K410]<>[.K411];"INICIO";IF([.K412]<>[.K411];"FIN";"")) -> 
A412: of:=IF([.B412]<>"";TODAY()>[.B412];"") ->  | B412: of:=IFERROR(IF(([.B411]+1)<[Calendario.$F$5];[.B411]+1;"");"") ->  | C412: of:=IF(AND([.B412]>=[Calendario.$F$8];[.B412]<=[Calendario.$F$9];1);1;IF(AND([.B412]>=[Calendario.$F$12];[.B412]<=[Calendario.$F$13]);2;IF(AND([.B412]>=[Calendario.$F$16];[.B412]<=[Calendario.$F$17]);3;""))) ->  | D412: of:=IF(COUNTIF([Calendario.$H$4:.$H$48];[.B412])>0;"FIESTA";"") -> FIESTA | E412: of:=IF([.B412]<>"";VLOOKUP(WEEKDAY([.B412];3);[Calendario.$A$4:.$C$11];2);"") ->  | F412: of:=IF([.B412]<>"";IF([.D412]<>"FIESTA";VLOOKUP(WEEKDAY([.B412];3);[Calendario.$A$4:.$C$11];3);0);"") ->  | G412: of:=IF(ISNUMBER([.F412]);[.F412]+[.G411];"") ->  | H412: of:=IF(AND([.G412]<=[Unidades.$G$26];[.G412]<=[Unidades.$F$18];[Unidades.$F$18]>0);[Unidades.$D$18]+1-COUNTIFS([Unidades.$O$3:.$O$17];">="&[.G412]);"") ->  | I412: of:=IF([.H411]<>[.H412];"INICIO";IF([.H413]<>[.H412];"FIN";"")) ->  | J412: of:=IF([.K411]<>[.K412];"INICIO";IF([.K413]<>[.K412];"FIN";"")) -> 
A413: of:=IF([.B413]<>"";TODAY()>[.B413];"") ->  | B413: of:=IFERROR(IF(([.B412]+1)<[Calendario.$F$5];[.B412]+1;"");"") ->  | C413: of:=IF(AND([.B413]>=[Calendario.$F$8];[.B413]<=[Calendario.$F$9];1);1;IF(AND([.B413]>=[Calendario.$F$12];[.B413]<=[Calendario.$F$13]);2;IF(AND([.B413]>=[Calendario.$F$16];[.B413]<=[Calendario.$F$17]);3;""))) ->  | D413: of:=IF(COUNTIF([Calendario.$H$4:.$H$48];[.B413])>0;"FIESTA";"") -> FIESTA | E413: of:=IF([.B413]<>"";VLOOKUP(WEEKDAY([.B413];3);[Calendario.$A$4:.$C$11];2);"") ->  | F413: of:=IF([.B413]<>"";IF([.D413]<>"FIESTA";VLOOKUP(WEEKDAY([.B413];3);[Calendario.$A$4:.$C$11];3);0);"") ->  | G413: of:=IF(ISNUMBER([.F413]);[.F413]+[.G412];"") ->  | H413: of:=IF(AND([.G413]<=[Unidades.$G$26];[.G413]<=[Unidades.$F$18];[Unidades.$F$18]>0);[Unidades.$D$18]+1-COUNTIFS([Unidades.$O$3:.$O$17];">="&[.G413]);"") ->  | I413: of:=IF([.H412]<>[.H413];"INICIO";IF([.H414]<>[.H413];"FIN";"")) ->  | J413: of:=IF([.K412]<>[.K413];"INICIO";IF([.K414]<>[.K413];"FIN";"")) -> 
A414: of:=IF([.B414]<>"";TODAY()>[.B414];"") ->  | B414: of:=IFERROR(IF(([.B413]+1)<[Calendario.$F$5];[.B413]+1;"");"") ->  | C414: of:=IF(AND([.B414]>=[Calendario.$F$8];[.B414]<=[Calendario.$F$9];1);1;IF(AND([.B414]>=[Calendario.$F$12];[.B414]<=[Calendario.$F$13]);2;IF(AND([.B414]>=[Calendario.$F$16];[.B414]<=[Calendario.$F$17]);3;""))) ->  | D414: of:=IF(COUNTIF([Calendario.$H$4:.$H$48];[.B414])>0;"FIESTA";"") -> FIESTA | E414: of:=IF([.B414]<>"";VLOOKUP(WEEKDAY([.B414];3);[Calendario.$A$4:.$C$11];2);"") ->  | F414: of:=IF([.B414]<>"";IF([.D414]<>"FIESTA";VLOOKUP(WEEKDAY([.B414];3);[Calendario.$A$4:.$C$11];3);0);"") ->  | G414: of:=IF(ISNUMBER([.F414]);[.F414]+[.G413];"") ->  | H414: of:=IF(AND([.G414]<=[Unidades.$G$26];[.G414]<=[Unidades.$F$18];[Unidades.$F$18]>0);[Unidades.$D$18]+1-COUNTIFS([Unidades.$O$3:.$O$17];">="&[.G414]);"") ->  | I414: of:=IF([.H413]<>[.H414];"INICIO";IF([.H415]<>[.H414];"FIN";"")) ->  | J414: of:=IF([.K413]<>[.K414];"INICIO";IF([.K415]<>[.K414];"FIN";"")) -> 
A415: of:=IF([.B415]<>"";TODAY()>[.B415];"") ->  | B415: of:=IFERROR(IF(([.B414]+1)<[Calendario.$F$5];[.B414]+1;"");"") ->  | C415: of:=IF(AND([.B415]>=[Calendario.$F$8];[.B415]<=[Calendario.$F$9];1);1;IF(AND([.B415]>=[Calendario.$F$12];[.B415]<=[Calendario.$F$13]);2;IF(AND([.B415]>=[Calendario.$F$16];[.B415]<=[Calendario.$F$17]);3;""))) ->  | D415: of:=IF(COUNTIF([Calendario.$H$4:.$H$48];[.B415])>0;"FIESTA";"") -> FIESTA | E415: of:=IF([.B415]<>"";VLOOKUP(WEEKDAY([.B415];3);[Calendario.$A$4:.$C$11];2);"") ->  | F415: of:=IF([.B415]<>"";IF([.D415]<>"FIESTA";VLOOKUP(WEEKDAY([.B415];3);[Calendario.$A$4:.$C$11];3);0);"") ->  | G415: of:=IF(ISNUMBER([.F415]);[.F415]+[.G414];"") ->  | H415: of:=IF(AND([.G415]<=[Unidades.$G$26];[.G415]<=[Unidades.$F$18];[Unidades.$F$18]>0);[Unidades.$D$18]+1-COUNTIFS([Unidades.$O$3:.$O$17];">="&[.G415]);"") ->  | I415: of:=IF([.H414]<>[.H415];"INICIO";IF([.H416]<>[.H415];"FIN";"")) ->  | J415: of:=IF([.K414]<>[.K415];"INICIO";IF([.K416]<>[.K415];"FIN";"")) -> 
A416: of:=IF([.B416]<>"";TODAY()>[.B416];"") ->  | B416: of:=IFERROR(IF(([.B415]+1)<[Calendario.$F$5];[.B415]+1;"");"") ->  | C416: of:=IF(AND([.B416]>=[Calendario.$F$8];[.B416]<=[Calendario.$F$9];1);1;IF(AND([.B416]>=[Calendario.$F$12];[.B416]<=[Calendario.$F$13]);2;IF(AND([.B416]>=[Calendario.$F$16];[.B416]<=[Calendario.$F$17]);3;""))) ->  | D416: of:=IF(COUNTIF([Calendario.$H$4:.$H$48];[.B416])>0;"FIESTA";"") -> FIESTA | E416: of:=IF([.B416]<>"";VLOOKUP(WEEKDAY([.B416];3);[Calendario.$A$4:.$C$11];2);"") ->  | F416: of:=IF([.B416]<>"";IF([.D416]<>"FIESTA";VLOOKUP(WEEKDAY([.B416];3);[Calendario.$A$4:.$C$11];3);0);"") ->  | G416: of:=IF(ISNUMBER([.F416]);[.F416]+[.G415];"") ->  | H416: of:=IF(AND([.G416]<=[Unidades.$G$26];[.G416]<=[Unidades.$F$18];[Unidades.$F$18]>0);[Unidades.$D$18]+1-COUNTIFS([Unidades.$O$3:.$O$17];">="&[.G416]);"") ->  | I416: of:=IF([.H415]<>[.H416];"INICIO";IF([.H417]<>[.H416];"FIN";"")) ->  | J416: of:=IF([.K415]<>[.K416];"INICIO";IF([.K417]<>[.K416];"FIN";"")) -> 
A417: of:=IF([.B417]<>"";TODAY()>[.B417];"") ->  | B417: of:=IFERROR(IF(([.B416]+1)<[Calendario.$F$5];[.B416]+1;"");"") ->  | C417: of:=IF(AND([.B417]>=[Calendario.$F$8];[.B417]<=[Calendario.$F$9];1);1;IF(AND([.B417]>=[Calendario.$F$12];[.B417]<=[Calendario.$F$13]);2;IF(AND([.B417]>=[Calendario.$F$16];[.B417]<=[Calendario.$F$17]);3;""))) ->  | D417: of:=IF(COUNTIF([Calendario.$H$4:.$H$48];[.B417])>0;"FIESTA";"") -> FIESTA | E417: of:=IF([.B417]<>"";VLOOKUP(WEEKDAY([.B417];3);[Calendario.$A$4:.$C$11];2);"") ->  | F417: of:=IF([.B417]<>"";IF([.D417]<>"FIESTA";VLOOKUP(WEEKDAY([.B417];3);[Calendario.$A$4:.$C$11];3);0);"") ->  | G417: of:=IF(ISNUMBER([.F417]);[.F417]+[.G416];"") ->  | H417: of:=IF(AND([.G417]<=[Unidades.$G$26];[.G417]<=[Unidades.$F$18];[Unidades.$F$18]>0);[Unidades.$D$18]+1-COUNTIFS([Unidades.$O$3:.$O$17];">="&[.G417]);"") ->  | I417: of:=IF([.H416]<>[.H417];"INICIO";IF([.H418]<>[.H417];"FIN";"")) ->  | J417: of:=IF([.K416]<>[.K417];"INICIO";IF([.K418]<>[.K417];"FIN";"")) -> 
A418: of:=IF([.B418]<>"";TODAY()>[.B418];"") ->  | B418: of:=IFERROR(IF(([.B417]+1)<[Calendario.$F$5];[.B417]+1;"");"") ->  | C418: of:=IF(AND([.B418]>=[Calendario.$F$8];[.B418]<=[Calendario.$F$9];1);1;IF(AND([.B418]>=[Calendario.$F$12];[.B418]<=[Calendario.$F$13]);2;IF(AND([.B418]>=[Calendario.$F$16];[.B418]<=[Calendario.$F$17]);3;""))) ->  | D418: of:=IF(COUNTIF([Calendario.$H$4:.$H$48];[.B418])>0;"FIESTA";"") -> FIESTA | E418: of:=IF([.B418]<>"";VLOOKUP(WEEKDAY([.B418];3);[Calendario.$A$4:.$C$11];2);"") ->  | F418: of:=IF([.B418]<>"";IF([.D418]<>"FIESTA";VLOOKUP(WEEKDAY([.B418];3);[Calendario.$A$4:.$C$11];3);0);"") ->  | G418: of:=IF(ISNUMBER([.F418]);[.F418]+[.G417];"") ->  | H418: of:=IF(AND([.G418]<=[Unidades.$G$26];[.G418]<=[Unidades.$F$18];[Unidades.$F$18]>0);[Unidades.$D$18]+1-COUNTIFS([Unidades.$O$3:.$O$17];">="&[.G418]);"") ->  | I418: of:=IF([.H417]<>[.H418];"INICIO";IF([.H419]<>[.H418];"FIN";"")) ->  | J418: of:=IF([.K417]<>[.K418];"INICIO";IF([.K419]<>[.K418];"FIN";"")) -> 
A419: of:=IF([.B419]<>"";TODAY()>[.B419];"") ->  | B419: of:=IFERROR(IF(([.B418]+1)<[Calendario.$F$5];[.B418]+1;"");"") ->  | C419: of:=IF(AND([.B419]>=[Calendario.$F$8];[.B419]<=[Calendario.$F$9];1);1;IF(AND([.B419]>=[Calendario.$F$12];[.B419]<=[Calendario.$F$13]);2;IF(AND([.B419]>=[Calendario.$F$16];[.B419]<=[Calendario.$F$17]);3;""))) ->  | D419: of:=IF(COUNTIF([Calendario.$H$4:.$H$48];[.B419])>0;"FIESTA";"") -> FIESTA | E419: of:=IF([.B419]<>"";VLOOKUP(WEEKDAY([.B419];3);[Calendario.$A$4:.$C$11];2);"") ->  | F419: of:=IF([.B419]<>"";IF([.D419]<>"FIESTA";VLOOKUP(WEEKDAY([.B419];3);[Calendario.$A$4:.$C$11];3);0);"") ->  | G419: of:=IF(ISNUMBER([.F419]);[.F419]+[.G418];"") ->  | H419: of:=IF(AND([.G419]<=[Unidades.$G$26];[.G419]<=[Unidades.$F$18];[Unidades.$F$18]>0);[Unidades.$D$18]+1-COUNTIFS([Unidades.$O$3:.$O$17];">="&[.G419]);"") ->  | I419: of:=IF([.H418]<>[.H419];"INICIO";IF([.H420]<>[.H419];"FIN";"")) ->  | J419: of:=IF([.K418]<>[.K419];"INICIO";IF([.K420]<>[.K419];"FIN";"")) -> 
A420: of:=IF([.B420]<>"";TODAY()>[.B420];"") ->  | B420: of:=IFERROR(IF(([.B419]+1)<[Calendario.$F$5];[.B419]+1;"");"") ->  | C420: of:=IF(AND([.B420]>=[Calendario.$F$8];[.B420]<=[Calendario.$F$9];1);1;IF(AND([.B420]>=[Calendario.$F$12];[.B420]<=[Calendario.$F$13]);2;IF(AND([.B420]>=[Calendario.$F$16];[.B420]<=[Calendario.$F$17]);3;""))) ->  | D420: of:=IF(COUNTIF([Calendario.$H$4:.$H$48];[.B420])>0;"FIESTA";"") -> FIESTA | E420: of:=IF([.B420]<>"";VLOOKUP(WEEKDAY([.B420];3);[Calendario.$A$4:.$C$11];2);"") ->  | F420: of:=IF([.B420]<>"";IF([.D420]<>"FIESTA";VLOOKUP(WEEKDAY([.B420];3);[Calendario.$A$4:.$C$11];3);0);"") ->  | G420: of:=IF(ISNUMBER([.F420]);[.F420]+[.G419];"") ->  | H420: of:=IF(AND([.G420]<=[Unidades.$G$26];[.G420]<=[Unidades.$F$18];[Unidades.$F$18]>0);[Unidades.$D$18]+1-COUNTIFS([Unidades.$O$3:.$O$17];">="&[.G420]);"") ->  | I420: of:=IF([.H419]<>[.H420];"INICIO";IF([.H421]<>[.H420];"FIN";"")) ->  | J420: of:=IF([.K419]<>[.K420];"INICIO";IF([.K421]<>[.K420];"FIN";"")) -> 
A421: of:=IF([.B421]<>"";TODAY()>[.B421];"") ->  | B421: of:=IFERROR(IF(([.B420]+1)<[Calendario.$F$5];[.B420]+1;"");"") ->  | C421: of:=IF(AND([.B421]>=[Calendario.$F$8];[.B421]<=[Calendario.$F$9];1);1;IF(AND([.B421]>=[Calendario.$F$12];[.B421]<=[Calendario.$F$13]);2;IF(AND([.B421]>=[Calendario.$F$16];[.B421]<=[Calendario.$F$17]);3;""))) ->  | D421: of:=IF(COUNTIF([Calendario.$H$4:.$H$48];[.B421])>0;"FIESTA";"") -> FIESTA | E421: of:=IF([.B421]<>"";VLOOKUP(WEEKDAY([.B421];3);[Calendario.$A$4:.$C$11];2);"") ->  | F421: of:=IF([.B421]<>"";IF([.D421]<>"FIESTA";VLOOKUP(WEEKDAY([.B421];3);[Calendario.$A$4:.$C$11];3);0);"") ->  | G421: of:=IF(ISNUMBER([.F421]);[.F421]+[.G420];"") ->  | H421: of:=IF(AND([.G421]<=[Unidades.$G$26];[.G421]<=[Unidades.$F$18];[Unidades.$F$18]>0);[Unidades.$D$18]+1-COUNTIFS([Unidades.$O$3:.$O$17];">="&[.G421]);"") ->  | I421: of:=IF([.H420]<>[.H421];"INICIO";IF([.H422]<>[.H421];"FIN";"")) ->  | J421: of:=IF([.K420]<>[.K421];"INICIO";IF([.K422]<>[.K421];"FIN";"")) -> 
A422: of:=IF([.B422]<>"";TODAY()>[.B422];"") ->  | B422: of:=IFERROR(IF(([.B421]+1)<[Calendario.$F$5];[.B421]+1;"");"") ->  | C422: of:=IF(AND([.B422]>=[Calendario.$F$8];[.B422]<=[Calendario.$F$9];1);1;IF(AND([.B422]>=[Calendario.$F$12];[.B422]<=[Calendario.$F$13]);2;IF(AND([.B422]>=[Calendario.$F$16];[.B422]<=[Calendario.$F$17]);3;""))) ->  | D422: of:=IF(COUNTIF([Calendario.$H$4:.$H$48];[.B422])>0;"FIESTA";"") -> FIESTA | E422: of:=IF([.B422]<>"";VLOOKUP(WEEKDAY([.B422];3);[Calendario.$A$4:.$C$11];2);"") ->  | F422: of:=IF([.B422]<>"";IF([.D422]<>"FIESTA";VLOOKUP(WEEKDAY([.B422];3);[Calendario.$A$4:.$C$11];3);0);"") ->  | G422: of:=IF(ISNUMBER([.F422]);[.F422]+[.G421];"") ->  | H422: of:=IF(AND([.G422]<=[Unidades.$G$26];[.G422]<=[Unidades.$F$18];[Unidades.$F$18]>0);[Unidades.$D$18]+1-COUNTIFS([Unidades.$O$3:.$O$17];">="&[.G422]);"") ->  | I422: of:=IF([.H421]<>[.H422];"INICIO";IF([.H423]<>[.H422];"FIN";"")) ->  | J422: of:=IF([.K421]<>[.K422];"INICIO";IF([.K423]<>[.K422];"FIN";"")) -> 
A423: of:=IF([.B423]<>"";TODAY()>[.B423];"") ->  | B423: of:=IFERROR(IF(([.B422]+1)<[Calendario.$F$5];[.B422]+1;"");"") ->  | C423: of:=IF(AND([.B423]>=[Calendario.$F$8];[.B423]<=[Calendario.$F$9];1);1;IF(AND([.B423]>=[Calendario.$F$12];[.B423]<=[Calendario.$F$13]);2;IF(AND([.B423]>=[Calendario.$F$16];[.B423]<=[Calendario.$F$17]);3;""))) ->  | D423: of:=IF(COUNTIF([Calendario.$H$4:.$H$48];[.B423])>0;"FIESTA";"") -> FIESTA | E423: of:=IF([.B423]<>"";VLOOKUP(WEEKDAY([.B423];3);[Calendario.$A$4:.$C$11];2);"") ->  | F423: of:=IF([.B423]<>"";IF([.D423]<>"FIESTA";VLOOKUP(WEEKDAY([.B423];3);[Calendario.$A$4:.$C$11];3);0);"") ->  | G423: of:=IF(ISNUMBER([.F423]);[.F423]+[.G422];"") ->  | H423: of:=IF(AND([.G423]<=[Unidades.$G$26];[.G423]<=[Unidades.$F$18];[Unidades.$F$18]>0);[Unidades.$D$18]+1-COUNTIFS([Unidades.$O$3:.$O$17];">="&[.G423]);"") ->  | I423: of:=IF([.H422]<>[.H423];"INICIO";IF([.H424]<>[.H423];"FIN";"")) ->  | J423: of:=IF([.K422]<>[.K423];"INICIO";IF([.K424]<>[.K423];"FIN";"")) -> 
A424: of:=IF([.B424]<>"";TODAY()>[.B424];"") ->  | B424: of:=IFERROR(IF(([.B423]+1)<[Calendario.$F$5];[.B423]+1;"");"") ->  | C424: of:=IF(AND([.B424]>=[Calendario.$F$8];[.B424]<=[Calendario.$F$9];1);1;IF(AND([.B424]>=[Calendario.$F$12];[.B424]<=[Calendario.$F$13]);2;IF(AND([.B424]>=[Calendario.$F$16];[.B424]<=[Calendario.$F$17]);3;""))) ->  | D424: of:=IF(COUNTIF([Calendario.$H$4:.$H$48];[.B424])>0;"FIESTA";"") -> FIESTA | E424: of:=IF([.B424]<>"";VLOOKUP(WEEKDAY([.B424];3);[Calendario.$A$4:.$C$11];2);"") ->  | F424: of:=IF([.B424]<>"";IF([.D424]<>"FIESTA";VLOOKUP(WEEKDAY([.B424];3);[Calendario.$A$4:.$C$11];3);0);"") ->  | G424: of:=IF(ISNUMBER([.F424]);[.F424]+[.G423];"") ->  | H424: of:=IF(AND([.G424]<=[Unidades.$G$26];[.G424]<=[Unidades.$F$18];[Unidades.$F$18]>0);[Unidades.$D$18]+1-COUNTIFS([Unidades.$O$3:.$O$17];">="&[.G424]);"") ->  | I424: of:=IF([.H423]<>[.H424];"INICIO";IF([.H425]<>[.H424];"FIN";"")) ->  | J424: of:=IF([.K423]<>[.K424];"INICIO";IF([.K425]<>[.K424];"FIN";"")) -> 
A425: of:=IF([.B425]<>"";TODAY()>[.B425];"") ->  | B425: of:=IFERROR(IF(([.B424]+1)<[Calendario.$F$5];[.B424]+1;"");"") ->  | C425: of:=IF(AND([.B425]>=[Calendario.$F$8];[.B425]<=[Calendario.$F$9];1);1;IF(AND([.B425]>=[Calendario.$F$12];[.B425]<=[Calendario.$F$13]);2;IF(AND([.B425]>=[Calendario.$F$16];[.B425]<=[Calendario.$F$17]);3;""))) ->  | D425: of:=IF(COUNTIF([Calendario.$H$4:.$H$48];[.B425])>0;"FIESTA";"") -> FIESTA | E425: of:=IF([.B425]<>"";VLOOKUP(WEEKDAY([.B425];3);[Calendario.$A$4:.$C$11];2);"") ->  | F425: of:=IF([.B425]<>"";IF([.D425]<>"FIESTA";VLOOKUP(WEEKDAY([.B425];3);[Calendario.$A$4:.$C$11];3);0);"") ->  | G425: of:=IF(ISNUMBER([.F425]);[.F425]+[.G424];"") ->  | H425: of:=IF(AND([.G425]<=[Unidades.$G$26];[.G425]<=[Unidades.$F$18];[Unidades.$F$18]>0);[Unidades.$D$18]+1-COUNTIFS([Unidades.$O$3:.$O$17];">="&[.G425]);"") ->  | I425: of:=IF([.H424]<>[.H425];"INICIO";IF([.H426]<>[.H425];"FIN";"")) ->  | J425: of:=IF([.K424]<>[.K425];"INICIO";IF([.K426]<>[.K425];"FIN";"")) -> 
A426: of:=IF([.B426]<>"";TODAY()>[.B426];"") ->  | B426: of:=IFERROR(IF(([.B425]+1)<[Calendario.$F$5];[.B425]+1;"");"") ->  | C426: of:=IF(AND([.B426]>=[Calendario.$F$8];[.B426]<=[Calendario.$F$9];1);1;IF(AND([.B426]>=[Calendario.$F$12];[.B426]<=[Calendario.$F$13]);2;IF(AND([.B426]>=[Calendario.$F$16];[.B426]<=[Calendario.$F$17]);3;""))) ->  | D426: of:=IF(COUNTIF([Calendario.$H$4:.$H$48];[.B426])>0;"FIESTA";"") -> FIESTA | E426: of:=IF([.B426]<>"";VLOOKUP(WEEKDAY([.B426];3);[Calendario.$A$4:.$C$11];2);"") ->  | F426: of:=IF([.B426]<>"";IF([.D426]<>"FIESTA";VLOOKUP(WEEKDAY([.B426];3);[Calendario.$A$4:.$C$11];3);0);"") ->  | G426: of:=IF(ISNUMBER([.F426]);[.F426]+[.G425];"") ->  | H426: of:=IF(AND([.G426]<=[Unidades.$G$26];[.G426]<=[Unidades.$F$18];[Unidades.$F$18]>0);[Unidades.$D$18]+1-COUNTIFS([Unidades.$O$3:.$O$17];">="&[.G426]);"") ->  | I426: of:=IF([.H425]<>[.H426];"INICIO";IF([.H427]<>[.H426];"FIN";"")) ->  | J426: of:=IF([.K425]<>[.K426];"INICIO";IF([.K427]<>[.K426];"FIN";"")) -> 
A427: of:=IF([.B427]<>"";TODAY()>[.B427];"") ->  | B427: of:=IFERROR(IF(([.B426]+1)<[Calendario.$F$5];[.B426]+1;"");"") ->  | C427: of:=IF(AND([.B427]>=[Calendario.$F$8];[.B427]<=[Calendario.$F$9];1);1;IF(AND([.B427]>=[Calendario.$F$12];[.B427]<=[Calendario.$F$13]);2;IF(AND([.B427]>=[Calendario.$F$16];[.B427]<=[Calendario.$F$17]);3;""))) ->  | D427: of:=IF(COUNTIF([Calendario.$H$4:.$H$48];[.B427])>0;"FIESTA";"") -> FIESTA | E427: of:=IF([.B427]<>"";VLOOKUP(WEEKDAY([.B427];3);[Calendario.$A$4:.$C$11];2);"") ->  | F427: of:=IF([.B427]<>"";IF([.D427]<>"FIESTA";VLOOKUP(WEEKDAY([.B427];3);[Calendario.$A$4:.$C$11];3);0);"") ->  | G427: of:=IF(ISNUMBER([.F427]);[.F427]+[.G426];"") ->  | H427: of:=IF(AND([.G427]<=[Unidades.$G$26];[.G427]<=[Unidades.$F$18];[Unidades.$F$18]>0);[Unidades.$D$18]+1-COUNTIFS([Unidades.$O$3:.$O$17];">="&[.G427]);"") ->  | I427: of:=IF([.H426]<>[.H427];"INICIO";IF([.H428]<>[.H427];"FIN";"")) ->  | J427: of:=IF([.K426]<>[.K427];"INICIO";IF([.K428]<>[.K427];"FIN";"")) -> 
A428: of:=IF([.B428]<>"";TODAY()>[.B428];"") ->  | B428: of:=IFERROR(IF(([.B427]+1)<[Calendario.$F$5];[.B427]+1;"");"") ->  | C428: of:=IF(AND([.B428]>=[Calendario.$F$8];[.B428]<=[Calendario.$F$9];1);1;IF(AND([.B428]>=[Calendario.$F$12];[.B428]<=[Calendario.$F$13]);2;IF(AND([.B428]>=[Calendario.$F$16];[.B428]<=[Calendario.$F$17]);3;""))) ->  | D428: of:=IF(COUNTIF([Calendario.$H$4:.$H$48];[.B428])>0;"FIESTA";"") -> FIESTA | E428: of:=IF([.B428]<>"";VLOOKUP(WEEKDAY([.B428];3);[Calendario.$A$4:.$C$11];2);"") ->  | F428: of:=IF([.B428]<>"";IF([.D428]<>"FIESTA";VLOOKUP(WEEKDAY([.B428];3);[Calendario.$A$4:.$C$11];3);0);"") ->  | G428: of:=IF(ISNUMBER([.F428]);[.F428]+[.G427];"") ->  | H428: of:=IF(AND([.G428]<=[Unidades.$G$26];[.G428]<=[Unidades.$F$18];[Unidades.$F$18]>0);[Unidades.$D$18]+1-COUNTIFS([Unidades.$O$3:.$O$17];">="&[.G428]);"") ->  | I428: of:=IF([.H427]<>[.H428];"INICIO";IF([.H429]<>[.H428];"FIN";"")) ->  | J428: of:=IF([.K427]<>[.K428];"INICIO";IF([.K429]<>[.K428];"FIN";"")) -> 
A429: of:=IF([.B429]<>"";TODAY()>[.B429];"") ->  | B429: of:=IFERROR(IF(([.B428]+1)<[Calendario.$F$5];[.B428]+1;"");"") ->  | C429: of:=IF(AND([.B429]>=[Calendario.$F$8];[.B429]<=[Calendario.$F$9];1);1;IF(AND([.B429]>=[Calendario.$F$12];[.B429]<=[Calendario.$F$13]);2;IF(AND([.B429]>=[Calendario.$F$16];[.B429]<=[Calendario.$F$17]);3;""))) ->  | D429: of:=IF(COUNTIF([Calendario.$H$4:.$H$48];[.B429])>0;"FIESTA";"") -> FIESTA | E429: of:=IF([.B429]<>"";VLOOKUP(WEEKDAY([.B429];3);[Calendario.$A$4:.$C$11];2);"") ->  | F429: of:=IF([.B429]<>"";IF([.D429]<>"FIESTA";VLOOKUP(WEEKDAY([.B429];3);[Calendario.$A$4:.$C$11];3);0);"") ->  | G429: of:=IF(ISNUMBER([.F429]);[.F429]+[.G428];"") ->  | H429: of:=IF(AND([.G429]<=[Unidades.$G$26];[.G429]<=[Unidades.$F$18];[Unidades.$F$18]>0);[Unidades.$D$18]+1-COUNTIFS([Unidades.$O$3:.$O$17];">="&[.G429]);"") ->  | I429: of:=IF([.H428]<>[.H429];"INICIO";IF([.H430]<>[.H429];"FIN";"")) ->  | J429: of:=IF([.K428]<>[.K429];"INICIO";IF([.K430]<>[.K429];"FIN";"")) -> 
A430: of:=IF([.B430]<>"";TODAY()>[.B430];"") ->  | B430: of:=IFERROR(IF(([.B429]+1)<[Calendario.$F$5];[.B429]+1;"");"") ->  | C430: of:=IF(AND([.B430]>=[Calendario.$F$8];[.B430]<=[Calendario.$F$9];1);1;IF(AND([.B430]>=[Calendario.$F$12];[.B430]<=[Calendario.$F$13]);2;IF(AND([.B430]>=[Calendario.$F$16];[.B430]<=[Calendario.$F$17]);3;""))) ->  | D430: of:=IF(COUNTIF([Calendario.$H$4:.$H$48];[.B430])>0;"FIESTA";"") -> FIESTA | E430: of:=IF([.B430]<>"";VLOOKUP(WEEKDAY([.B430];3);[Calendario.$A$4:.$C$11];2);"") ->  | F430: of:=IF([.B430]<>"";IF([.D430]<>"FIESTA";VLOOKUP(WEEKDAY([.B430];3);[Calendario.$A$4:.$C$11];3);0);"") ->  | G430: of:=IF(ISNUMBER([.F430]);[.F430]+[.G429];"") ->  | H430: of:=IF(AND([.G430]<=[Unidades.$G$26];[.G430]<=[Unidades.$F$18];[Unidades.$F$18]>0);[Unidades.$D$18]+1-COUNTIFS([Unidades.$O$3:.$O$17];">="&[.G430]);"") ->  | I430: of:=IF([.H429]<>[.H430];"INICIO";IF([.H431]<>[.H430];"FIN";"")) ->  | J430: of:=IF([.K429]<>[.K430];"INICIO";IF([.K431]<>[.K430];"FIN";"")) -> 
A431: of:=IF([.B431]<>"";TODAY()>[.B431];"") ->  | B431: of:=IFERROR(IF(([.B430]+1)<[Calendario.$F$5];[.B430]+1;"");"") ->  | C431: of:=IF(AND([.B431]>=[Calendario.$F$8];[.B431]<=[Calendario.$F$9];1);1;IF(AND([.B431]>=[Calendario.$F$12];[.B431]<=[Calendario.$F$13]);2;IF(AND([.B431]>=[Calendario.$F$16];[.B431]<=[Calendario.$F$17]);3;""))) ->  | D431: of:=IF(COUNTIF([Calendario.$H$4:.$H$48];[.B431])>0;"FIESTA";"") -> FIESTA | E431: of:=IF([.B431]<>"";VLOOKUP(WEEKDAY([.B431];3);[Calendario.$A$4:.$C$11];2);"") ->  | F431: of:=IF([.B431]<>"";IF([.D431]<>"FIESTA";VLOOKUP(WEEKDAY([.B431];3);[Calendario.$A$4:.$C$11];3);0);"") ->  | G431: of:=IF(ISNUMBER([.F431]);[.F431]+[.G430];"") ->  | H431: of:=IF(AND([.G431]<=[Unidades.$G$26];[.G431]<=[Unidades.$F$18];[Unidades.$F$18]>0);[Unidades.$D$18]+1-COUNTIFS([Unidades.$O$3:.$O$17];">="&[.G431]);"") ->  | I431: of:=IF([.H430]<>[.H431];"INICIO";IF([.H432]<>[.H431];"FIN";"")) ->  | J431: of:=IF([.K430]<>[.K431];"INICIO";IF([.K432]<>[.K431];"FIN";"")) -> 
A432: of:=IF([.B432]<>"";TODAY()>[.B432];"") ->  | B432: of:=IFERROR(IF(([.B431]+1)<[Calendario.$F$5];[.B431]+1;"");"") ->  | C432: of:=IF(AND([.B432]>=[Calendario.$F$8];[.B432]<=[Calendario.$F$9];1);1;IF(AND([.B432]>=[Calendario.$F$12];[.B432]<=[Calendario.$F$13]);2;IF(AND([.B432]>=[Calendario.$F$16];[.B432]<=[Calendario.$F$17]);3;""))) ->  | D432: of:=IF(COUNTIF([Calendario.$H$4:.$H$48];[.B432])>0;"FIESTA";"") -> FIESTA | E432: of:=IF([.B432]<>"";VLOOKUP(WEEKDAY([.B432];3);[Calendario.$A$4:.$C$11];2);"") ->  | F432: of:=IF([.B432]<>"";IF([.D432]<>"FIESTA";VLOOKUP(WEEKDAY([.B432];3);[Calendario.$A$4:.$C$11];3);0);"") ->  | G432: of:=IF(ISNUMBER([.F432]);[.F432]+[.G431];"") ->  | H432: of:=IF(AND([.G432]<=[Unidades.$G$26];[.G432]<=[Unidades.$F$18];[Unidades.$F$18]>0);[Unidades.$D$18]+1-COUNTIFS([Unidades.$O$3:.$O$17];">="&[.G432]);"") ->  | I432: of:=IF([.H431]<>[.H432];"INICIO";IF([.H433]<>[.H432];"FIN";"")) ->  | J432: of:=IF([.K431]<>[.K432];"INICIO";IF([.K433]<>[.K432];"FIN";"")) -> 
A433: of:=IF([.B433]<>"";TODAY()>[.B433];"") ->  | B433: of:=IFERROR(IF(([.B432]+1)<[Calendario.$F$5];[.B432]+1;"");"") ->  | C433: of:=IF(AND([.B433]>=[Calendario.$F$8];[.B433]<=[Calendario.$F$9];1);1;IF(AND([.B433]>=[Calendario.$F$12];[.B433]<=[Calendario.$F$13]);2;IF(AND([.B433]>=[Calendario.$F$16];[.B433]<=[Calendario.$F$17]);3;""))) ->  | D433: of:=IF(COUNTIF([Calendario.$H$4:.$H$48];[.B433])>0;"FIESTA";"") -> FIESTA | E433: of:=IF([.B433]<>"";VLOOKUP(WEEKDAY([.B433];3);[Calendario.$A$4:.$C$11];2);"") ->  | F433: of:=IF([.B433]<>"";IF([.D433]<>"FIESTA";VLOOKUP(WEEKDAY([.B433];3);[Calendario.$A$4:.$C$11];3);0);"") ->  | G433: of:=IF(ISNUMBER([.F433]);[.F433]+[.G432];"") ->  | H433: of:=IF(AND([.G433]<=[Unidades.$G$26];[.G433]<=[Unidades.$F$18];[Unidades.$F$18]>0);[Unidades.$D$18]+1-COUNTIFS([Unidades.$O$3:.$O$17];">="&[.G433]);"") ->  | I433: of:=IF([.H432]<>[.H433];"INICIO";IF([.H434]<>[.H433];"FIN";"")) ->  | J433: of:=IF([.K432]<>[.K433];"INICIO";IF([.K434]<>[.K433];"FIN";"")) -> 
A434: of:=IF([.B434]<>"";TODAY()>[.B434];"") ->  | B434: of:=IFERROR(IF(([.B433]+1)<[Calendario.$F$5];[.B433]+1;"");"") ->  | C434: of:=IF(AND([.B434]>=[Calendario.$F$8];[.B434]<=[Calendario.$F$9];1);1;IF(AND([.B434]>=[Calendario.$F$12];[.B434]<=[Calendario.$F$13]);2;IF(AND([.B434]>=[Calendario.$F$16];[.B434]<=[Calendario.$F$17]);3;""))) ->  | D434: of:=IF(COUNTIF([Calendario.$H$4:.$H$48];[.B434])>0;"FIESTA";"") -> FIESTA | E434: of:=IF([.B434]<>"";VLOOKUP(WEEKDAY([.B434];3);[Calendario.$A$4:.$C$11];2);"") ->  | F434: of:=IF([.B434]<>"";IF([.D434]<>"FIESTA";VLOOKUP(WEEKDAY([.B434];3);[Calendario.$A$4:.$C$11];3);0);"") ->  | G434: of:=IF(ISNUMBER([.F434]);[.F434]+[.G433];"") ->  | H434: of:=IF(AND([.G434]<=[Unidades.$G$26];[.G434]<=[Unidades.$F$18];[Unidades.$F$18]>0);[Unidades.$D$18]+1-COUNTIFS([Unidades.$O$3:.$O$17];">="&[.G434]);"") ->  | I434: of:=IF([.H433]<>[.H434];"INICIO";IF([.H435]<>[.H434];"FIN";"")) ->  | J434: of:=IF([.K433]<>[.K434];"INICIO";IF([.K435]<>[.K434];"FIN";"")) -> 
A435: of:=IF([.B435]<>"";TODAY()>[.B435];"") ->  | B435: of:=IFERROR(IF(([.B434]+1)<[Calendario.$F$5];[.B434]+1;"");"") ->  | C435: of:=IF(AND([.B435]>=[Calendario.$F$8];[.B435]<=[Calendario.$F$9];1);1;IF(AND([.B435]>=[Calendario.$F$12];[.B435]<=[Calendario.$F$13]);2;IF(AND([.B435]>=[Calendario.$F$16];[.B435]<=[Calendario.$F$17]);3;""))) ->  | D435: of:=IF(COUNTIF([Calendario.$H$4:.$H$48];[.B435])>0;"FIESTA";"") -> FIESTA | E435: of:=IF([.B435]<>"";VLOOKUP(WEEKDAY([.B435];3);[Calendario.$A$4:.$C$11];2);"") ->  | F435: of:=IF([.B435]<>"";IF([.D435]<>"FIESTA";VLOOKUP(WEEKDAY([.B435];3);[Calendario.$A$4:.$C$11];3);0);"") ->  | G435: of:=IF(ISNUMBER([.F435]);[.F435]+[.G434];"") ->  | H435: of:=IF(AND([.G435]<=[Unidades.$G$26];[.G435]<=[Unidades.$F$18];[Unidades.$F$18]>0);[Unidades.$D$18]+1-COUNTIFS([Unidades.$O$3:.$O$17];">="&[.G435]);"") ->  | I435: of:=IF([.H434]<>[.H435];"INICIO";IF([.H436]<>[.H435];"FIN";"")) ->  | J435: of:=IF([.K434]<>[.K435];"INICIO";IF([.K436]<>[.K435];"FIN";"")) -> 
A436: of:=IF([.B436]<>"";TODAY()>[.B436];"") ->  | B436: of:=IFERROR(IF(([.B435]+1)<[Calendario.$F$5];[.B435]+1;"");"") ->  | C436: of:=IF(AND([.B436]>=[Calendario.$F$8];[.B436]<=[Calendario.$F$9];1);1;IF(AND([.B436]>=[Calendario.$F$12];[.B436]<=[Calendario.$F$13]);2;IF(AND([.B436]>=[Calendario.$F$16];[.B436]<=[Calendario.$F$17]);3;""))) ->  | D436: of:=IF(COUNTIF([Calendario.$H$4:.$H$48];[.B436])>0;"FIESTA";"") -> FIESTA | E436: of:=IF([.B436]<>"";VLOOKUP(WEEKDAY([.B436];3);[Calendario.$A$4:.$C$11];2);"") ->  | F436: of:=IF([.B436]<>"";IF([.D436]<>"FIESTA";VLOOKUP(WEEKDAY([.B436];3);[Calendario.$A$4:.$C$11];3);0);"") ->  | G436: of:=IF(ISNUMBER([.F436]);[.F436]+[.G435];"") ->  | H436: of:=IF(AND([.G436]<=[Unidades.$G$26];[.G436]<=[Unidades.$F$18];[Unidades.$F$18]>0);[Unidades.$D$18]+1-COUNTIFS([Unidades.$O$3:.$O$17];">="&[.G436]);"") ->  | I436: of:=IF([.H435]<>[.H436];"INICIO";IF([.H437]<>[.H436];"FIN";"")) ->  | J436: of:=IF([.K435]<>[.K436];"INICIO";IF([.K437]<>[.K436];"FIN";"")) -> 
A437: of:=IF([.B437]<>"";TODAY()>[.B437];"") ->  | B437: of:=IFERROR(IF(([.B436]+1)<[Calendario.$F$5];[.B436]+1;"");"") ->  | C437: of:=IF(AND([.B437]>=[Calendario.$F$8];[.B437]<=[Calendario.$F$9];1);1;IF(AND([.B437]>=[Calendario.$F$12];[.B437]<=[Calendario.$F$13]);2;IF(AND([.B437]>=[Calendario.$F$16];[.B437]<=[Calendario.$F$17]);3;""))) ->  | D437: of:=IF(COUNTIF([Calendario.$H$4:.$H$48];[.B437])>0;"FIESTA";"") -> FIESTA | E437: of:=IF([.B437]<>"";VLOOKUP(WEEKDAY([.B437];3);[Calendario.$A$4:.$C$11];2);"") ->  | F437: of:=IF([.B437]<>"";IF([.D437]<>"FIESTA";VLOOKUP(WEEKDAY([.B437];3);[Calendario.$A$4:.$C$11];3);0);"") ->  | G437: of:=IF(ISNUMBER([.F437]);[.F437]+[.G436];"") ->  | H437: of:=IF(AND([.G437]<=[Unidades.$G$26];[.G437]<=[Unidades.$F$18];[Unidades.$F$18]>0);[Unidades.$D$18]+1-COUNTIFS([Unidades.$O$3:.$O$17];">="&[.G437]);"") ->  | I437: of:=IF([.H436]<>[.H437];"INICIO";IF([.H438]<>[.H437];"FIN";"")) ->  | J437: of:=IF([.K436]<>[.K437];"INICIO";IF([.K438]<>[.K437];"FIN";"")) -> 
A438: of:=IF([.B438]<>"";TODAY()>[.B438];"") ->  | B438: of:=IFERROR(IF(([.B437]+1)<[Calendario.$F$5];[.B437]+1;"");"") ->  | C438: of:=IF(AND([.B438]>=[Calendario.$F$8];[.B438]<=[Calendario.$F$9];1);1;IF(AND([.B438]>=[Calendario.$F$12];[.B438]<=[Calendario.$F$13]);2;IF(AND([.B438]>=[Calendario.$F$16];[.B438]<=[Calendario.$F$17]);3;""))) ->  | D438: of:=IF(COUNTIF([Calendario.$H$4:.$H$48];[.B438])>0;"FIESTA";"") -> FIESTA | E438: of:=IF([.B438]<>"";VLOOKUP(WEEKDAY([.B438];3);[Calendario.$A$4:.$C$11];2);"") ->  | F438: of:=IF([.B438]<>"";IF([.D438]<>"FIESTA";VLOOKUP(WEEKDAY([.B438];3);[Calendario.$A$4:.$C$11];3);0);"") ->  | G438: of:=IF(ISNUMBER([.F438]);[.F438]+[.G437];"") ->  | H438: of:=IF(AND([.G438]<=[Unidades.$G$26];[.G438]<=[Unidades.$F$18];[Unidades.$F$18]>0);[Unidades.$D$18]+1-COUNTIFS([Unidades.$O$3:.$O$17];">="&[.G438]);"") ->  | I438: of:=IF([.H437]<>[.H438];"INICIO";IF([.H439]<>[.H438];"FIN";"")) ->  | J438: of:=IF([.K437]<>[.K438];"INICIO";IF([.K439]<>[.K438];"FIN";"")) -> 
A439: of:=IF([.B439]<>"";TODAY()>[.B439];"") ->  | B439: of:=IFERROR(IF(([.B438]+1)<[Calendario.$F$5];[.B438]+1;"");"") ->  | C439: of:=IF(AND([.B439]>=[Calendario.$F$8];[.B439]<=[Calendario.$F$9];1);1;IF(AND([.B439]>=[Calendario.$F$12];[.B439]<=[Calendario.$F$13]);2;IF(AND([.B439]>=[Calendario.$F$16];[.B439]<=[Calendario.$F$17]);3;""))) ->  | D439: of:=IF(COUNTIF([Calendario.$H$4:.$H$48];[.B439])>0;"FIESTA";"") -> FIESTA | E439: of:=IF([.B439]<>"";VLOOKUP(WEEKDAY([.B439];3);[Calendario.$A$4:.$C$11];2);"") ->  | F439: of:=IF([.B439]<>"";IF([.D439]<>"FIESTA";VLOOKUP(WEEKDAY([.B439];3);[Calendario.$A$4:.$C$11];3);0);"") ->  | G439: of:=IF(ISNUMBER([.F439]);[.F439]+[.G438];"") ->  | H439: of:=IF(AND([.G439]<=[Unidades.$G$26];[.G439]<=[Unidades.$F$18];[Unidades.$F$18]>0);[Unidades.$D$18]+1-COUNTIFS([Unidades.$O$3:.$O$17];">="&[.G439]);"") ->  | I439: of:=IF([.H438]<>[.H439];"INICIO";IF([.H440]<>[.H439];"FIN";"")) ->  | J439: of:=IF([.K438]<>[.K439];"INICIO";IF([.K440]<>[.K439];"FIN";"")) -> 
A440: of:=IF([.B440]<>"";TODAY()>[.B440];"") ->  | B440: of:=IFERROR(IF(([.B439]+1)<[Calendario.$F$5];[.B439]+1;"");"") ->  | C440: of:=IF(AND([.B440]>=[Calendario.$F$8];[.B440]<=[Calendario.$F$9];1);1;IF(AND([.B440]>=[Calendario.$F$12];[.B440]<=[Calendario.$F$13]);2;IF(AND([.B440]>=[Calendario.$F$16];[.B440]<=[Calendario.$F$17]);3;""))) ->  | D440: of:=IF(COUNTIF([Calendario.$H$4:.$H$48];[.B440])>0;"FIESTA";"") -> FIESTA | E440: of:=IF([.B440]<>"";VLOOKUP(WEEKDAY([.B440];3);[Calendario.$A$4:.$C$11];2);"") ->  | F440: of:=IF([.B440]<>"";IF([.D440]<>"FIESTA";VLOOKUP(WEEKDAY([.B440];3);[Calendario.$A$4:.$C$11];3);0);"") ->  | G440: of:=IF(ISNUMBER([.F440]);[.F440]+[.G439];"") ->  | H440: of:=IF(AND([.G440]<=[Unidades.$G$26];[.G440]<=[Unidades.$F$18];[Unidades.$F$18]>0);[Unidades.$D$18]+1-COUNTIFS([Unidades.$O$3:.$O$17];">="&[.G440]);"") ->  | I440: of:=IF([.H439]<>[.H440];"INICIO";IF([.H441]<>[.H440];"FIN";"")) ->  | J440: of:=IF([.K439]<>[.K440];"INICIO";IF([.K441]<>[.K440];"FIN";"")) -> 
A441: of:=IF([.B441]<>"";TODAY()>[.B441];"") ->  | B441: of:=IFERROR(IF(([.B440]+1)<[Calendario.$F$5];[.B440]+1;"");"") ->  | C441: of:=IF(AND([.B441]>=[Calendario.$F$8];[.B441]<=[Calendario.$F$9];1);1;IF(AND([.B441]>=[Calendario.$F$12];[.B441]<=[Calendario.$F$13]);2;IF(AND([.B441]>=[Calendario.$F$16];[.B441]<=[Calendario.$F$17]);3;""))) ->  | D441: of:=IF(COUNTIF([Calendario.$H$4:.$H$48];[.B441])>0;"FIESTA";"") -> FIESTA | E441: of:=IF([.B441]<>"";VLOOKUP(WEEKDAY([.B441];3);[Calendario.$A$4:.$C$11];2);"") ->  | F441: of:=IF([.B441]<>"";IF([.D441]<>"FIESTA";VLOOKUP(WEEKDAY([.B441];3);[Calendario.$A$4:.$C$11];3);0);"") ->  | G441: of:=IF(ISNUMBER([.F441]);[.F441]+[.G440];"") ->  | H441: of:=IF(AND([.G441]<=[Unidades.$G$26];[.G441]<=[Unidades.$F$18];[Unidades.$F$18]>0);[Unidades.$D$18]+1-COUNTIFS([Unidades.$O$3:.$O$17];">="&[.G441]);"") ->  | I441: of:=IF([.H440]<>[.H441];"INICIO";IF([.H442]<>[.H441];"FIN";"")) ->  | J441: of:=IF([.K440]<>[.K441];"INICIO";IF([.K442]<>[.K441];"FIN";"")) -> 
A442: of:=IF([.B442]<>"";TODAY()>[.B442];"") ->  | B442: of:=IFERROR(IF(([.B441]+1)<[Calendario.$F$5];[.B441]+1;"");"") ->  | C442: of:=IF(AND([.B442]>=[Calendario.$F$8];[.B442]<=[Calendario.$F$9];1);1;IF(AND([.B442]>=[Calendario.$F$12];[.B442]<=[Calendario.$F$13]);2;IF(AND([.B442]>=[Calendario.$F$16];[.B442]<=[Calendario.$F$17]);3;""))) ->  | D442: of:=IF(COUNTIF([Calendario.$H$4:.$H$48];[.B442])>0;"FIESTA";"") -> FIESTA | E442: of:=IF([.B442]<>"";VLOOKUP(WEEKDAY([.B442];3);[Calendario.$A$4:.$C$11];2);"") ->  | F442: of:=IF([.B442]<>"";IF([.D442]<>"FIESTA";VLOOKUP(WEEKDAY([.B442];3);[Calendario.$A$4:.$C$11];3);0);"") ->  | G442: of:=IF(ISNUMBER([.F442]);[.F442]+[.G441];"") ->  | H442: of:=IF(AND([.G442]<=[Unidades.$G$26];[.G442]<=[Unidades.$F$18];[Unidades.$F$18]>0);[Unidades.$D$18]+1-COUNTIFS([Unidades.$O$3:.$O$17];">="&[.G442]);"") ->  | I442: of:=IF([.H441]<>[.H442];"INICIO";IF([.H443]<>[.H442];"FIN";"")) ->  | J442: of:=IF([.K441]<>[.K442];"INICIO";IF([.K443]<>[.K442];"FIN";"")) -> 
A443: of:=IF([.B443]<>"";TODAY()>[.B443];"") ->  | B443: of:=IFERROR(IF(([.B442]+1)<[Calendario.$F$5];[.B442]+1;"");"") ->  | C443: of:=IF(AND([.B443]>=[Calendario.$F$8];[.B443]<=[Calendario.$F$9];1);1;IF(AND([.B443]>=[Calendario.$F$12];[.B443]<=[Calendario.$F$13]);2;IF(AND([.B443]>=[Calendario.$F$16];[.B443]<=[Calendario.$F$17]);3;""))) ->  | D443: of:=IF(COUNTIF([Calendario.$H$4:.$H$48];[.B443])>0;"FIESTA";"") -> FIESTA | E443: of:=IF([.B443]<>"";VLOOKUP(WEEKDAY([.B443];3);[Calendario.$A$4:.$C$11];2);"") ->  | F443: of:=IF([.B443]<>"";IF([.D443]<>"FIESTA";VLOOKUP(WEEKDAY([.B443];3);[Calendario.$A$4:.$C$11];3);0);"") ->  | G443: of:=IF(ISNUMBER([.F443]);[.F443]+[.G442];"") ->  | H443: of:=IF(AND([.G443]<=[Unidades.$G$26];[.G443]<=[Unidades.$F$18];[Unidades.$F$18]>0);[Unidades.$D$18]+1-COUNTIFS([Unidades.$O$3:.$O$17];">="&[.G443]);"") ->  | I443: of:=IF([.H442]<>[.H443];"INICIO";IF([.H444]<>[.H443];"FIN";"")) ->  | J443: of:=IF([.K442]<>[.K443];"INICIO";IF([.K444]<>[.K443];"FIN";"")) -> 
A444: of:=IF([.B444]<>"";TODAY()>[.B444];"") ->  | B444: of:=IFERROR(IF(([.B443]+1)<[Calendario.$F$5];[.B443]+1;"");"") ->  | C444: of:=IF(AND([.B444]>=[Calendario.$F$8];[.B444]<=[Calendario.$F$9];1);1;IF(AND([.B444]>=[Calendario.$F$12];[.B444]<=[Calendario.$F$13]);2;IF(AND([.B444]>=[Calendario.$F$16];[.B444]<=[Calendario.$F$17]);3;""))) ->  | D444: of:=IF(COUNTIF([Calendario.$H$4:.$H$48];[.B444])>0;"FIESTA";"") -> FIESTA | E444: of:=IF([.B444]<>"";VLOOKUP(WEEKDAY([.B444];3);[Calendario.$A$4:.$C$11];2);"") ->  | F444: of:=IF([.B444]<>"";IF([.D444]<>"FIESTA";VLOOKUP(WEEKDAY([.B444];3);[Calendario.$A$4:.$C$11];3);0);"") ->  | G444: of:=IF(ISNUMBER([.F444]);[.F444]+[.G443];"") ->  | H444: of:=IF(AND([.G444]<=[Unidades.$G$26];[.G444]<=[Unidades.$F$18];[Unidades.$F$18]>0);[Unidades.$D$18]+1-COUNTIFS([Unidades.$O$3:.$O$17];">="&[.G444]);"") ->  | I444: of:=IF([.H443]<>[.H444];"INICIO";IF([.H445]<>[.H444];"FIN";"")) ->  | J444: of:=IF([.K443]<>[.K444];"INICIO";IF([.K445]<>[.K444];"FIN";"")) -> 
A445: of:=IF([.B445]<>"";TODAY()>[.B445];"") ->  | B445: of:=IFERROR(IF(([.B444]+1)<[Calendario.$F$5];[.B444]+1;"");"") ->  | C445: of:=IF(AND([.B445]>=[Calendario.$F$8];[.B445]<=[Calendario.$F$9];1);1;IF(AND([.B445]>=[Calendario.$F$12];[.B445]<=[Calendario.$F$13]);2;IF(AND([.B445]>=[Calendario.$F$16];[.B445]<=[Calendario.$F$17]);3;""))) ->  | D445: of:=IF(COUNTIF([Calendario.$H$4:.$H$48];[.B445])>0;"FIESTA";"") -> FIESTA | E445: of:=IF([.B445]<>"";VLOOKUP(WEEKDAY([.B445];3);[Calendario.$A$4:.$C$11];2);"") ->  | F445: of:=IF([.B445]<>"";IF([.D445]<>"FIESTA";VLOOKUP(WEEKDAY([.B445];3);[Calendario.$A$4:.$C$11];3);0);"") ->  | G445: of:=IF(ISNUMBER([.F445]);[.F445]+[.G444];"") ->  | H445: of:=IF(AND([.G445]<=[Unidades.$G$26];[.G445]<=[Unidades.$F$18];[Unidades.$F$18]>0);[Unidades.$D$18]+1-COUNTIFS([Unidades.$O$3:.$O$17];">="&[.G445]);"") ->  | I445: of:=IF([.H444]<>[.H445];"INICIO";IF([.H446]<>[.H445];"FIN";"")) ->  | J445: of:=IF([.K444]<>[.K445];"INICIO";IF([.K446]<>[.K445];"FIN";"")) -> 
A446: of:=IF([.B446]<>"";TODAY()>[.B446];"") ->  | B446: of:=IFERROR(IF(([.B445]+1)<[Calendario.$F$5];[.B445]+1;"");"") ->  | C446: of:=IF(AND([.B446]>=[Calendario.$F$8];[.B446]<=[Calendario.$F$9];1);1;IF(AND([.B446]>=[Calendario.$F$12];[.B446]<=[Calendario.$F$13]);2;IF(AND([.B446]>=[Calendario.$F$16];[.B446]<=[Calendario.$F$17]);3;""))) ->  | D446: of:=IF(COUNTIF([Calendario.$H$4:.$H$48];[.B446])>0;"FIESTA";"") -> FIESTA | E446: of:=IF([.B446]<>"";VLOOKUP(WEEKDAY([.B446];3);[Calendario.$A$4:.$C$11];2);"") ->  | F446: of:=IF([.B446]<>"";IF([.D446]<>"FIESTA";VLOOKUP(WEEKDAY([.B446];3);[Calendario.$A$4:.$C$11];3);0);"") ->  | G446: of:=IF(ISNUMBER([.F446]);[.F446]+[.G445];"") ->  | H446: of:=IF(AND([.G446]<=[Unidades.$G$26];[.G446]<=[Unidades.$F$18];[Unidades.$F$18]>0);[Unidades.$D$18]+1-COUNTIFS([Unidades.$O$3:.$O$17];">="&[.G446]);"") ->  | I446: of:=IF([.H445]<>[.H446];"INICIO";IF([.H447]<>[.H446];"FIN";"")) ->  | J446: of:=IF([.K445]<>[.K446];"INICIO";IF([.K447]<>[.K446];"FIN";"")) -> 
A447: of:=IF([.B447]<>"";TODAY()>[.B447];"") ->  | B447: of:=IFERROR(IF(([.B446]+1)<[Calendario.$F$5];[.B446]+1;"");"") ->  | C447: of:=IF(AND([.B447]>=[Calendario.$F$8];[.B447]<=[Calendario.$F$9];1);1;IF(AND([.B447]>=[Calendario.$F$12];[.B447]<=[Calendario.$F$13]);2;IF(AND([.B447]>=[Calendario.$F$16];[.B447]<=[Calendario.$F$17]);3;""))) ->  | D447: of:=IF(COUNTIF([Calendario.$H$4:.$H$48];[.B447])>0;"FIESTA";"") -> FIESTA | E447: of:=IF([.B447]<>"";VLOOKUP(WEEKDAY([.B447];3);[Calendario.$A$4:.$C$11];2);"") ->  | F447: of:=IF([.B447]<>"";IF([.D447]<>"FIESTA";VLOOKUP(WEEKDAY([.B447];3);[Calendario.$A$4:.$C$11];3);0);"") ->  | G447: of:=IF(ISNUMBER([.F447]);[.F447]+[.G446];"") ->  | H447: of:=IF(AND([.G447]<=[Unidades.$G$26];[.G447]<=[Unidades.$F$18];[Unidades.$F$18]>0);[Unidades.$D$18]+1-COUNTIFS([Unidades.$O$3:.$O$17];">="&[.G447]);"") ->  | I447: of:=IF([.H446]<>[.H447];"INICIO";IF([.H448]<>[.H447];"FIN";"")) ->  | J447: of:=IF([.K446]<>[.K447];"INICIO";IF([.K448]<>[.K447];"FIN";"")) -> 
A448: of:=IF([.B448]<>"";TODAY()>[.B448];"") ->  | B448: of:=IFERROR(IF(([.B447]+1)<[Calendario.$F$5];[.B447]+1;"");"") ->  | C448: of:=IF(AND([.B448]>=[Calendario.$F$8];[.B448]<=[Calendario.$F$9];1);1;IF(AND([.B448]>=[Calendario.$F$12];[.B448]<=[Calendario.$F$13]);2;IF(AND([.B448]>=[Calendario.$F$16];[.B448]<=[Calendario.$F$17]);3;""))) ->  | D448: of:=IF(COUNTIF([Calendario.$H$4:.$H$48];[.B448])>0;"FIESTA";"") -> FIESTA | E448: of:=IF([.B448]<>"";VLOOKUP(WEEKDAY([.B448];3);[Calendario.$A$4:.$C$11];2);"") ->  | F448: of:=IF([.B448]<>"";IF([.D448]<>"FIESTA";VLOOKUP(WEEKDAY([.B448];3);[Calendario.$A$4:.$C$11];3);0);"") ->  | G448: of:=IF(ISNUMBER([.F448]);[.F448]+[.G447];"") ->  | H448: of:=IF(AND([.G448]<=[Unidades.$G$26];[.G448]<=[Unidades.$F$18];[Unidades.$F$18]>0);[Unidades.$D$18]+1-COUNTIFS([Unidades.$O$3:.$O$17];">="&[.G448]);"") ->  | I448: of:=IF([.H447]<>[.H448];"INICIO";IF([.H449]<>[.H448];"FIN";"")) ->  | J448: of:=IF([.K447]<>[.K448];"INICIO";IF([.K449]<>[.K448];"FIN";"")) -> 
A449: of:=IF([.B449]<>"";TODAY()>[.B449];"") ->  | B449: of:=IFERROR(IF(([.B448]+1)<[Calendario.$F$5];[.B448]+1;"");"") ->  | C449: of:=IF(AND([.B449]>=[Calendario.$F$8];[.B449]<=[Calendario.$F$9];1);1;IF(AND([.B449]>=[Calendario.$F$12];[.B449]<=[Calendario.$F$13]);2;IF(AND([.B449]>=[Calendario.$F$16];[.B449]<=[Calendario.$F$17]);3;""))) ->  | D449: of:=IF(COUNTIF([Calendario.$H$4:.$H$48];[.B449])>0;"FIESTA";"") -> FIESTA | E449: of:=IF([.B449]<>"";VLOOKUP(WEEKDAY([.B449];3);[Calendario.$A$4:.$C$11];2);"") ->  | F449: of:=IF([.B449]<>"";IF([.D449]<>"FIESTA";VLOOKUP(WEEKDAY([.B449];3);[Calendario.$A$4:.$C$11];3);0);"") ->  | G449: of:=IF(ISNUMBER([.F449]);[.F449]+[.G448];"") ->  | H449: of:=IF(AND([.G449]<=[Unidades.$G$26];[.G449]<=[Unidades.$F$18];[Unidades.$F$18]>0);[Unidades.$D$18]+1-COUNTIFS([Unidades.$O$3:.$O$17];">="&[.G449]);"") ->  | I449: of:=IF([.H448]<>[.H449];"INICIO";IF([.H450]<>[.H449];"FIN";"")) ->  | J449: of:=IF([.K448]<>[.K449];"INICIO";IF([.K450]<>[.K449];"FIN";"")) -> 
A450: of:=IF([.B450]<>"";TODAY()>[.B450];"") ->  | B450: of:=IFERROR(IF(([.B449]+1)<[Calendario.$F$5];[.B449]+1;"");"") ->  | C450: of:=IF(AND([.B450]>=[Calendario.$F$8];[.B450]<=[Calendario.$F$9];1);1;IF(AND([.B450]>=[Calendario.$F$12];[.B450]<=[Calendario.$F$13]);2;IF(AND([.B450]>=[Calendario.$F$16];[.B450]<=[Calendario.$F$17]);3;""))) ->  | D450: of:=IF(COUNTIF([Calendario.$H$4:.$H$48];[.B450])>0;"FIESTA";"") -> FIESTA | E450: of:=IF([.B450]<>"";VLOOKUP(WEEKDAY([.B450];3);[Calendario.$A$4:.$C$11];2);"") ->  | F450: of:=IF([.B450]<>"";IF([.D450]<>"FIESTA";VLOOKUP(WEEKDAY([.B450];3);[Calendario.$A$4:.$C$11];3);0);"") ->  | G450: of:=IF(ISNUMBER([.F450]);[.F450]+[.G449];"") ->  | H450: of:=IF(AND([.G450]<=[Unidades.$G$26];[.G450]<=[Unidades.$F$18];[Unidades.$F$18]>0);[Unidades.$D$18]+1-COUNTIFS([Unidades.$O$3:.$O$17];">="&[.G450]);"") ->  | I450: of:=IF([.H449]<>[.H450];"INICIO";IF([.H451]<>[.H450];"FIN";"")) ->  | J450: of:=IF([.K449]<>[.K450];"INICIO";IF([.K451]<>[.K450];"FIN";"")) -> 
A451: of:=IF([.B451]<>"";TODAY()>[.B451];"") ->  | B451: of:=IFERROR(IF(([.B450]+1)<[Calendario.$F$5];[.B450]+1;"");"") ->  | C451: of:=IF(AND([.B451]>=[Calendario.$F$8];[.B451]<=[Calendario.$F$9];1);1;IF(AND([.B451]>=[Calendario.$F$12];[.B451]<=[Calendario.$F$13]);2;IF(AND([.B451]>=[Calendario.$F$16];[.B451]<=[Calendario.$F$17]);3;""))) ->  | D451: of:=IF(COUNTIF([Calendario.$H$4:.$H$48];[.B451])>0;"FIESTA";"") -> FIESTA | E451: of:=IF([.B451]<>"";VLOOKUP(WEEKDAY([.B451];3);[Calendario.$A$4:.$C$11];2);"") ->  | F451: of:=IF([.B451]<>"";IF([.D451]<>"FIESTA";VLOOKUP(WEEKDAY([.B451];3);[Calendario.$A$4:.$C$11];3);0);"") ->  | G451: of:=IF(ISNUMBER([.F451]);[.F451]+[.G450];"") ->  | H451: of:=IF(AND([.G451]<=[Unidades.$G$26];[.G451]<=[Unidades.$F$18];[Unidades.$F$18]>0);[Unidades.$D$18]+1-COUNTIFS([Unidades.$O$3:.$O$17];">="&[.G451]);"") ->  | I451: of:=IF([.H450]<>[.H451];"INICIO";IF([.H452]<>[.H451];"FIN";"")) ->  | J451: of:=IF([.K450]<>[.K451];"INICIO";IF([.K452]<>[.K451];"FIN";"")) -> 
A452: of:=IF([.B452]<>"";TODAY()>[.B452];"") ->  | B452: of:=IFERROR(IF(([.B451]+1)<[Calendario.$F$5];[.B451]+1;"");"") ->  | C452: of:=IF(AND([.B452]>=[Calendario.$F$8];[.B452]<=[Calendario.$F$9];1);1;IF(AND([.B452]>=[Calendario.$F$12];[.B452]<=[Calendario.$F$13]);2;IF(AND([.B452]>=[Calendario.$F$16];[.B452]<=[Calendario.$F$17]);3;""))) ->  | D452: of:=IF(COUNTIF([Calendario.$H$4:.$H$48];[.B452])>0;"FIESTA";"") -> FIESTA | E452: of:=IF([.B452]<>"";VLOOKUP(WEEKDAY([.B452];3);[Calendario.$A$4:.$C$11];2);"") ->  | F452: of:=IF([.B452]<>"";IF([.D452]<>"FIESTA";VLOOKUP(WEEKDAY([.B452];3);[Calendario.$A$4:.$C$11];3);0);"") ->  | G452: of:=IF(ISNUMBER([.F452]);[.F452]+[.G451];"") ->  | H452: of:=IF(AND([.G452]<=[Unidades.$G$26];[.G452]<=[Unidades.$F$18];[Unidades.$F$18]>0);[Unidades.$D$18]+1-COUNTIFS([Unidades.$O$3:.$O$17];">="&[.G452]);"") ->  | I452: of:=IF([.H451]<>[.H452];"INICIO";IF([.H453]<>[.H452];"FIN";"")) ->  | J452: of:=IF([.K451]<>[.K452];"INICIO";IF([.K453]<>[.K452];"FIN";"")) -> 
A453: of:=IF([.B453]<>"";TODAY()>[.B453];"") ->  | B453: of:=IFERROR(IF(([.B452]+1)<[Calendario.$F$5];[.B452]+1;"");"") ->  | C453: of:=IF(AND([.B453]>=[Calendario.$F$8];[.B453]<=[Calendario.$F$9];1);1;IF(AND([.B453]>=[Calendario.$F$12];[.B453]<=[Calendario.$F$13]);2;IF(AND([.B453]>=[Calendario.$F$16];[.B453]<=[Calendario.$F$17]);3;""))) ->  | D453: of:=IF(COUNTIF([Calendario.$H$4:.$H$48];[.B453])>0;"FIESTA";"") -> FIESTA | E453: of:=IF([.B453]<>"";VLOOKUP(WEEKDAY([.B453];3);[Calendario.$A$4:.$C$11];2);"") ->  | F453: of:=IF([.B453]<>"";IF([.D453]<>"FIESTA";VLOOKUP(WEEKDAY([.B453];3);[Calendario.$A$4:.$C$11];3);0);"") ->  | G453: of:=IF(ISNUMBER([.F453]);[.F453]+[.G452];"") ->  | H453: of:=IF(AND([.G453]<=[Unidades.$G$26];[.G453]<=[Unidades.$F$18];[Unidades.$F$18]>0);[Unidades.$D$18]+1-COUNTIFS([Unidades.$O$3:.$O$17];">="&[.G453]);"") ->  | I453: of:=IF([.H452]<>[.H453];"INICIO";IF([.H454]<>[.H453];"FIN";"")) ->  | J453: of:=IF([.K452]<>[.K453];"INICIO";IF([.K454]<>[.K453];"FIN";"")) -> 
A454: of:=IF([.B454]<>"";TODAY()>[.B454];"") ->  | B454: of:=IFERROR(IF(([.B453]+1)<[Calendario.$F$5];[.B453]+1;"");"") ->  | C454: of:=IF(AND([.B454]>=[Calendario.$F$8];[.B454]<=[Calendario.$F$9];1);1;IF(AND([.B454]>=[Calendario.$F$12];[.B454]<=[Calendario.$F$13]);2;IF(AND([.B454]>=[Calendario.$F$16];[.B454]<=[Calendario.$F$17]);3;""))) ->  | D454: of:=IF(COUNTIF([Calendario.$H$4:.$H$48];[.B454])>0;"FIESTA";"") -> FIESTA | E454: of:=IF([.B454]<>"";VLOOKUP(WEEKDAY([.B454];3);[Calendario.$A$4:.$C$11];2);"") ->  | F454: of:=IF([.B454]<>"";IF([.D454]<>"FIESTA";VLOOKUP(WEEKDAY([.B454];3);[Calendario.$A$4:.$C$11];3);0);"") ->  | G454: of:=IF(ISNUMBER([.F454]);[.F454]+[.G453];"") ->  | H454: of:=IF(AND([.G454]<=[Unidades.$G$26];[.G454]<=[Unidades.$F$18];[Unidades.$F$18]>0);[Unidades.$D$18]+1-COUNTIFS([Unidades.$O$3:.$O$17];">="&[.G454]);"") ->  | I454: of:=IF([.H453]<>[.H454];"INICIO";IF([.H455]<>[.H454];"FIN";"")) ->  | J454: of:=IF([.K453]<>[.K454];"INICIO";IF([.K455]<>[.K454];"FIN";"")) -> 
A455: of:=IF([.B455]<>"";TODAY()>[.B455];"") ->  | B455: of:=IFERROR(IF(([.B454]+1)<[Calendario.$F$5];[.B454]+1;"");"") ->  | C455: of:=IF(AND([.B455]>=[Calendario.$F$8];[.B455]<=[Calendario.$F$9];1);1;IF(AND([.B455]>=[Calendario.$F$12];[.B455]<=[Calendario.$F$13]);2;IF(AND([.B455]>=[Calendario.$F$16];[.B455]<=[Calendario.$F$17]);3;""))) ->  | D455: of:=IF(COUNTIF([Calendario.$H$4:.$H$48];[.B455])>0;"FIESTA";"") -> FIESTA | E455: of:=IF([.B455]<>"";VLOOKUP(WEEKDAY([.B455];3);[Calendario.$A$4:.$C$11];2);"") ->  | F455: of:=IF([.B455]<>"";IF([.D455]<>"FIESTA";VLOOKUP(WEEKDAY([.B455];3);[Calendario.$A$4:.$C$11];3);0);"") ->  | G455: of:=IF(ISNUMBER([.F455]);[.F455]+[.G454];"") ->  | H455: of:=IF(AND([.G455]<=[Unidades.$G$26];[.G455]<=[Unidades.$F$18];[Unidades.$F$18]>0);[Unidades.$D$18]+1-COUNTIFS([Unidades.$O$3:.$O$17];">="&[.G455]);"") ->  | I455: of:=IF([.H454]<>[.H455];"INICIO";IF([.H456]<>[.H455];"FIN";"")) ->  | J455: of:=IF([.K454]<>[.K455];"INICIO";IF([.K456]<>[.K455];"FIN";"")) -> 
A456: of:=IF([.B456]<>"";TODAY()>[.B456];"") ->  | B456: of:=IFERROR(IF(([.B455]+1)<[Calendario.$F$5];[.B455]+1;"");"") ->  | C456: of:=IF(AND([.B456]>=[Calendario.$F$8];[.B456]<=[Calendario.$F$9];1);1;IF(AND([.B456]>=[Calendario.$F$12];[.B456]<=[Calendario.$F$13]);2;IF(AND([.B456]>=[Calendario.$F$16];[.B456]<=[Calendario.$F$17]);3;""))) ->  | D456: of:=IF(COUNTIF([Calendario.$H$4:.$H$48];[.B456])>0;"FIESTA";"") -> FIESTA | E456: of:=IF([.B456]<>"";VLOOKUP(WEEKDAY([.B456];3);[Calendario.$A$4:.$C$11];2);"") ->  | F456: of:=IF([.B456]<>"";IF([.D456]<>"FIESTA";VLOOKUP(WEEKDAY([.B456];3);[Calendario.$A$4:.$C$11];3);0);"") ->  | G456: of:=IF(ISNUMBER([.F456]);[.F456]+[.G455];"") ->  | H456: of:=IF(AND([.G456]<=[Unidades.$G$26];[.G456]<=[Unidades.$F$18];[Unidades.$F$18]>0);[Unidades.$D$18]+1-COUNTIFS([Unidades.$O$3:.$O$17];">="&[.G456]);"") ->  | I456: of:=IF([.H455]<>[.H456];"INICIO";IF([.H457]<>[.H456];"FIN";"")) ->  | J456: of:=IF([.K455]<>[.K456];"INICIO";IF([.K457]<>[.K456];"FIN";"")) -> 
A457: of:=IF([.B457]<>"";TODAY()>[.B457];"") ->  | B457: of:=IFERROR(IF(([.B456]+1)<[Calendario.$F$5];[.B456]+1;"");"") ->  | C457: of:=IF(AND([.B457]>=[Calendario.$F$8];[.B457]<=[Calendario.$F$9];1);1;IF(AND([.B457]>=[Calendario.$F$12];[.B457]<=[Calendario.$F$13]);2;IF(AND([.B457]>=[Calendario.$F$16];[.B457]<=[Calendario.$F$17]);3;""))) ->  | D457: of:=IF(COUNTIF([Calendario.$H$4:.$H$48];[.B457])>0;"FIESTA";"") -> FIESTA | E457: of:=IF([.B457]<>"";VLOOKUP(WEEKDAY([.B457];3);[Calendario.$A$4:.$C$11];2);"") ->  | F457: of:=IF([.B457]<>"";IF([.D457]<>"FIESTA";VLOOKUP(WEEKDAY([.B457];3);[Calendario.$A$4:.$C$11];3);0);"") ->  | G457: of:=IF(ISNUMBER([.F457]);[.F457]+[.G456];"") ->  | H457: of:=IF(AND([.G457]<=[Unidades.$G$26];[.G457]<=[Unidades.$F$18];[Unidades.$F$18]>0);[Unidades.$D$18]+1-COUNTIFS([Unidades.$O$3:.$O$17];">="&[.G457]);"") ->  | I457: of:=IF([.H456]<>[.H457];"INICIO";IF([.H458]<>[.H457];"FIN";"")) ->  | J457: of:=IF([.K456]<>[.K457];"INICIO";IF([.K458]<>[.K457];"FIN";"")) -> 
A458: of:=IF([.B458]<>"";TODAY()>[.B458];"") ->  | B458: of:=IFERROR(IF(([.B457]+1)<[Calendario.$F$5];[.B457]+1;"");"") ->  | C458: of:=IF(AND([.B458]>=[Calendario.$F$8];[.B458]<=[Calendario.$F$9];1);1;IF(AND([.B458]>=[Calendario.$F$12];[.B458]<=[Calendario.$F$13]);2;IF(AND([.B458]>=[Calendario.$F$16];[.B458]<=[Calendario.$F$17]);3;""))) ->  | D458: of:=IF(COUNTIF([Calendario.$H$4:.$H$48];[.B458])>0;"FIESTA";"") -> FIESTA | E458: of:=IF([.B458]<>"";VLOOKUP(WEEKDAY([.B458];3);[Calendario.$A$4:.$C$11];2);"") ->  | F458: of:=IF([.B458]<>"";IF([.D458]<>"FIESTA";VLOOKUP(WEEKDAY([.B458];3);[Calendario.$A$4:.$C$11];3);0);"") ->  | G458: of:=IF(ISNUMBER([.F458]);[.F458]+[.G457];"") ->  | H458: of:=IF(AND([.G458]<=[Unidades.$G$26];[.G458]<=[Unidades.$F$18];[Unidades.$F$18]>0);[Unidades.$D$18]+1-COUNTIFS([Unidades.$O$3:.$O$17];">="&[.G458]);"") ->  | I458: of:=IF([.H457]<>[.H458];"INICIO";IF([.H459]<>[.H458];"FIN";"")) ->  | J458: of:=IF([.K457]<>[.K458];"INICIO";IF([.K459]<>[.K458];"FIN";"")) -> 
A459: of:=IF([.B459]<>"";TODAY()>[.B459];"") ->  | B459: of:=IFERROR(IF(([.B458]+1)<[Calendario.$F$5];[.B458]+1;"");"") ->  | C459: of:=IF(AND([.B459]>=[Calendario.$F$8];[.B459]<=[Calendario.$F$9];1);1;IF(AND([.B459]>=[Calendario.$F$12];[.B459]<=[Calendario.$F$13]);2;IF(AND([.B459]>=[Calendario.$F$16];[.B459]<=[Calendario.$F$17]);3;""))) ->  | D459: of:=IF(COUNTIF([Calendario.$H$4:.$H$48];[.B459])>0;"FIESTA";"") -> FIESTA | E459: of:=IF([.B459]<>"";VLOOKUP(WEEKDAY([.B459];3);[Calendario.$A$4:.$C$11];2);"") ->  | F459: of:=IF([.B459]<>"";IF([.D459]<>"FIESTA";VLOOKUP(WEEKDAY([.B459];3);[Calendario.$A$4:.$C$11];3);0);"") ->  | G459: of:=IF(ISNUMBER([.F459]);[.F459]+[.G458];"") ->  | H459: of:=IF(AND([.G459]<=[Unidades.$G$26];[.G459]<=[Unidades.$F$18];[Unidades.$F$18]>0);[Unidades.$D$18]+1-COUNTIFS([Unidades.$O$3:.$O$17];">="&[.G459]);"") ->  | I459: of:=IF([.H458]<>[.H459];"INICIO";IF([.H460]<>[.H459];"FIN";"")) ->  | J459: of:=IF([.K458]<>[.K459];"INICIO";IF([.K460]<>[.K459];"FIN";"")) -> 
A460: of:=IF([.B460]<>"";TODAY()>[.B460];"") ->  | B460: of:=IFERROR(IF(([.B459]+1)<[Calendario.$F$5];[.B459]+1;"");"") ->  | C460: of:=IF(AND([.B460]>=[Calendario.$F$8];[.B460]<=[Calendario.$F$9];1);1;IF(AND([.B460]>=[Calendario.$F$12];[.B460]<=[Calendario.$F$13]);2;IF(AND([.B460]>=[Calendario.$F$16];[.B460]<=[Calendario.$F$17]);3;""))) ->  | D460: of:=IF(COUNTIF([Calendario.$H$4:.$H$48];[.B460])>0;"FIESTA";"") -> FIESTA | E460: of:=IF([.B460]<>"";VLOOKUP(WEEKDAY([.B460];3);[Calendario.$A$4:.$C$11];2);"") ->  | F460: of:=IF([.B460]<>"";IF([.D460]<>"FIESTA";VLOOKUP(WEEKDAY([.B460];3);[Calendario.$A$4:.$C$11];3);0);"") ->  | G460: of:=IF(ISNUMBER([.F460]);[.F460]+[.G459];"") ->  | H460: of:=IF(AND([.G460]<=[Unidades.$G$26];[.G460]<=[Unidades.$F$18];[Unidades.$F$18]>0);[Unidades.$D$18]+1-COUNTIFS([Unidades.$O$3:.$O$17];">="&[.G460]);"") ->  | I460: of:=IF([.H459]<>[.H460];"INICIO";IF([.H461]<>[.H460];"FIN";"")) ->  | J460: of:=IF([.K459]<>[.K460];"INICIO";IF([.K461]<>[.K460];"FIN";"")) -> 
A461: of:=IF([.B461]<>"";TODAY()>[.B461];"") ->  | B461: of:=IFERROR(IF(([.B460]+1)<[Calendario.$F$5];[.B460]+1;"");"") ->  | C461: of:=IF(AND([.B461]>=[Calendario.$F$8];[.B461]<=[Calendario.$F$9];1);1;IF(AND([.B461]>=[Calendario.$F$12];[.B461]<=[Calendario.$F$13]);2;IF(AND([.B461]>=[Calendario.$F$16];[.B461]<=[Calendario.$F$17]);3;""))) ->  | D461: of:=IF(COUNTIF([Calendario.$H$4:.$H$48];[.B461])>0;"FIESTA";"") -> FIESTA | E461: of:=IF([.B461]<>"";VLOOKUP(WEEKDAY([.B461];3);[Calendario.$A$4:.$C$11];2);"") ->  | F461: of:=IF([.B461]<>"";IF([.D461]<>"FIESTA";VLOOKUP(WEEKDAY([.B461];3);[Calendario.$A$4:.$C$11];3);0);"") ->  | G461: of:=IF(ISNUMBER([.F461]);[.F461]+[.G460];"") ->  | H461: of:=IF(AND([.G461]<=[Unidades.$G$26];[.G461]<=[Unidades.$F$18];[Unidades.$F$18]>0);[Unidades.$D$18]+1-COUNTIFS([Unidades.$O$3:.$O$17];">="&[.G461]);"") ->  | I461: of:=IF([.H460]<>[.H461];"INICIO";IF([.H462]<>[.H461];"FIN";"")) ->  | J461: of:=IF([.K460]<>[.K461];"INICIO";IF([.K462]<>[.K461];"FIN";"")) -> 
A462: of:=IF([.B462]<>"";TODAY()>[.B462];"") ->  | B462: of:=IFERROR(IF(([.B461]+1)<[Calendario.$F$5];[.B461]+1;"");"") ->  | C462: of:=IF(AND([.B462]>=[Calendario.$F$8];[.B462]<=[Calendario.$F$9];1);1;IF(AND([.B462]>=[Calendario.$F$12];[.B462]<=[Calendario.$F$13]);2;IF(AND([.B462]>=[Calendario.$F$16];[.B462]<=[Calendario.$F$17]);3;""))) ->  | D462: of:=IF(COUNTIF([Calendario.$H$4:.$H$48];[.B462])>0;"FIESTA";"") -> FIESTA | E462: of:=IF([.B462]<>"";VLOOKUP(WEEKDAY([.B462];3);[Calendario.$A$4:.$C$11];2);"") ->  | F462: of:=IF([.B462]<>"";IF([.D462]<>"FIESTA";VLOOKUP(WEEKDAY([.B462];3);[Calendario.$A$4:.$C$11];3);0);"") ->  | G462: of:=IF(ISNUMBER([.F462]);[.F462]+[.G461];"") ->  | H462: of:=IF(AND([.G462]<=[Unidades.$G$26];[.G462]<=[Unidades.$F$18];[Unidades.$F$18]>0);[Unidades.$D$18]+1-COUNTIFS([Unidades.$O$3:.$O$17];">="&[.G462]);"") ->  | I462: of:=IF([.H461]<>[.H462];"INICIO";IF([.H463]<>[.H462];"FIN";"")) ->  | J462: of:=IF([.K461]<>[.K462];"INICIO";IF([.K463]<>[.K462];"FIN";"")) -> 
A463: of:=IF([.B463]<>"";TODAY()>[.B463];"") ->  | B463: of:=IFERROR(IF(([.B462]+1)<[Calendario.$F$5];[.B462]+1;"");"") ->  | C463: of:=IF(AND([.B463]>=[Calendario.$F$8];[.B463]<=[Calendario.$F$9];1);1;IF(AND([.B463]>=[Calendario.$F$12];[.B463]<=[Calendario.$F$13]);2;IF(AND([.B463]>=[Calendario.$F$16];[.B463]<=[Calendario.$F$17]);3;""))) ->  | D463: of:=IF(COUNTIF([Calendario.$H$4:.$H$48];[.B463])>0;"FIESTA";"") -> FIESTA | E463: of:=IF([.B463]<>"";VLOOKUP(WEEKDAY([.B463];3);[Calendario.$A$4:.$C$11];2);"") ->  | F463: of:=IF([.B463]<>"";IF([.D463]<>"FIESTA";VLOOKUP(WEEKDAY([.B463];3);[Calendario.$A$4:.$C$11];3);0);"") ->  | G463: of:=IF(ISNUMBER([.F463]);[.F463]+[.G462];"") ->  | H463: of:=IF(AND([.G463]<=[Unidades.$G$26];[.G463]<=[Unidades.$F$18];[Unidades.$F$18]>0);[Unidades.$D$18]+1-COUNTIFS([Unidades.$O$3:.$O$17];">="&[.G463]);"") ->  | I463: of:=IF([.H462]<>[.H463];"INICIO";IF([.H464]<>[.H463];"FIN";"")) ->  | J463: of:=IF([.K462]<>[.K463];"INICIO";IF([.K464]<>[.K463];"FIN";"")) -> 
A464: of:=IF([.B464]<>"";TODAY()>[.B464];"") ->  | B464: of:=IFERROR(IF(([.B463]+1)<[Calendario.$F$5];[.B463]+1;"");"") ->  | C464: of:=IF(AND([.B464]>=[Calendario.$F$8];[.B464]<=[Calendario.$F$9];1);1;IF(AND([.B464]>=[Calendario.$F$12];[.B464]<=[Calendario.$F$13]);2;IF(AND([.B464]>=[Calendario.$F$16];[.B464]<=[Calendario.$F$17]);3;""))) ->  | D464: of:=IF(COUNTIF([Calendario.$H$4:.$H$48];[.B464])>0;"FIESTA";"") -> FIESTA | E464: of:=IF([.B464]<>"";VLOOKUP(WEEKDAY([.B464];3);[Calendario.$A$4:.$C$11];2);"") ->  | F464: of:=IF([.B464]<>"";IF([.D464]<>"FIESTA";VLOOKUP(WEEKDAY([.B464];3);[Calendario.$A$4:.$C$11];3);0);"") ->  | G464: of:=IF(ISNUMBER([.F464]);[.F464]+[.G463];"") ->  | H464: of:=IF(AND([.G464]<=[Unidades.$G$26];[.G464]<=[Unidades.$F$18];[Unidades.$F$18]>0);[Unidades.$D$18]+1-COUNTIFS([Unidades.$O$3:.$O$17];">="&[.G464]);"") ->  | I464: of:=IF([.H463]<>[.H464];"INICIO";IF([.H465]<>[.H464];"FIN";"")) ->  | J464: of:=IF([.K463]<>[.K464];"INICIO";IF([.K465]<>[.K464];"FIN";"")) -> 
A465: of:=IF([.B465]<>"";TODAY()>[.B465];"") ->  | B465: of:=IFERROR(IF(([.B464]+1)<[Calendario.$F$5];[.B464]+1;"");"") ->  | C465: of:=IF(AND([.B465]>=[Calendario.$F$8];[.B465]<=[Calendario.$F$9];1);1;IF(AND([.B465]>=[Calendario.$F$12];[.B465]<=[Calendario.$F$13]);2;IF(AND([.B465]>=[Calendario.$F$16];[.B465]<=[Calendario.$F$17]);3;""))) ->  | D465: of:=IF(COUNTIF([Calendario.$H$4:.$H$48];[.B465])>0;"FIESTA";"") -> FIESTA | E465: of:=IF([.B465]<>"";VLOOKUP(WEEKDAY([.B465];3);[Calendario.$A$4:.$C$11];2);"") ->  | F465: of:=IF([.B465]<>"";IF([.D465]<>"FIESTA";VLOOKUP(WEEKDAY([.B465];3);[Calendario.$A$4:.$C$11];3);0);"") ->  | G465: of:=IF(ISNUMBER([.F465]);[.F465]+[.G464];"") ->  | H465: of:=IF(AND([.G465]<=[Unidades.$G$26];[.G465]<=[Unidades.$F$18];[Unidades.$F$18]>0);[Unidades.$D$18]+1-COUNTIFS([Unidades.$O$3:.$O$17];">="&[.G465]);"") ->  | I465: of:=IF([.H464]<>[.H465];"INICIO";IF([.H466]<>[.H465];"FIN";"")) ->  | J465: of:=IF([.K464]<>[.K465];"INICIO";IF([.K466]<>[.K465];"FIN";"")) -> 
A466: of:=IF([.B466]<>"";TODAY()>[.B466];"") ->  | B466: of:=IFERROR(IF(([.B465]+1)<[Calendario.$F$5];[.B465]+1;"");"") ->  | C466: of:=IF(AND([.B466]>=[Calendario.$F$8];[.B466]<=[Calendario.$F$9];1);1;IF(AND([.B466]>=[Calendario.$F$12];[.B466]<=[Calendario.$F$13]);2;IF(AND([.B466]>=[Calendario.$F$16];[.B466]<=[Calendario.$F$17]);3;""))) ->  | D466: of:=IF(COUNTIF([Calendario.$H$4:.$H$48];[.B466])>0;"FIESTA";"") -> FIESTA | E466: of:=IF([.B466]<>"";VLOOKUP(WEEKDAY([.B466];3);[Calendario.$A$4:.$C$11];2);"") ->  | F466: of:=IF([.B466]<>"";IF([.D466]<>"FIESTA";VLOOKUP(WEEKDAY([.B466];3);[Calendario.$A$4:.$C$11];3);0);"") ->  | G466: of:=IF(ISNUMBER([.F466]);[.F466]+[.G465];"") ->  | H466: of:=IF(AND([.G466]<=[Unidades.$G$26];[.G466]<=[Unidades.$F$18];[Unidades.$F$18]>0);[Unidades.$D$18]+1-COUNTIFS([Unidades.$O$3:.$O$17];">="&[.G466]);"") ->  | I466: of:=IF([.H465]<>[.H466];"INICIO";IF([.H467]<>[.H466];"FIN";"")) ->  | J466: of:=IF([.K465]<>[.K466];"INICIO";IF([.K467]<>[.K466];"FIN";"")) -> 
A467: of:=IF([.B467]<>"";TODAY()>[.B467];"") ->  | B467: of:=IFERROR(IF(([.B466]+1)<[Calendario.$F$5];[.B466]+1;"");"") ->  | C467: of:=IF(AND([.B467]>=[Calendario.$F$8];[.B467]<=[Calendario.$F$9];1);1;IF(AND([.B467]>=[Calendario.$F$12];[.B467]<=[Calendario.$F$13]);2;IF(AND([.B467]>=[Calendario.$F$16];[.B467]<=[Calendario.$F$17]);3;""))) ->  | D467: of:=IF(COUNTIF([Calendario.$H$4:.$H$48];[.B467])>0;"FIESTA";"") -> FIESTA | E467: of:=IF([.B467]<>"";VLOOKUP(WEEKDAY([.B467];3);[Calendario.$A$4:.$C$11];2);"") ->  | F467: of:=IF([.B467]<>"";IF([.D467]<>"FIESTA";VLOOKUP(WEEKDAY([.B467];3);[Calendario.$A$4:.$C$11];3);0);"") ->  | G467: of:=IF(ISNUMBER([.F467]);[.F467]+[.G466];"") ->  | H467: of:=IF(AND([.G467]<=[Unidades.$G$26];[.G467]<=[Unidades.$F$18];[Unidades.$F$18]>0);[Unidades.$D$18]+1-COUNTIFS([Unidades.$O$3:.$O$17];">="&[.G467]);"") ->  | I467: of:=IF([.H466]<>[.H467];"INICIO";IF([.H468]<>[.H467];"FIN";"")) ->  | J467: of:=IF([.K466]<>[.K467];"INICIO";IF([.K468]<>[.K467];"FIN";"")) -> 
A468: of:=IF([.B468]<>"";TODAY()>[.B468];"") ->  | B468: of:=IFERROR(IF(([.B467]+1)<[Calendario.$F$5];[.B467]+1;"");"") ->  | C468: of:=IF(AND([.B468]>=[Calendario.$F$8];[.B468]<=[Calendario.$F$9];1);1;IF(AND([.B468]>=[Calendario.$F$12];[.B468]<=[Calendario.$F$13]);2;IF(AND([.B468]>=[Calendario.$F$16];[.B468]<=[Calendario.$F$17]);3;""))) ->  | D468: of:=IF(COUNTIF([Calendario.$H$4:.$H$48];[.B468])>0;"FIESTA";"") -> FIESTA | E468: of:=IF([.B468]<>"";VLOOKUP(WEEKDAY([.B468];3);[Calendario.$A$4:.$C$11];2);"") ->  | F468: of:=IF([.B468]<>"";IF([.D468]<>"FIESTA";VLOOKUP(WEEKDAY([.B468];3);[Calendario.$A$4:.$C$11];3);0);"") ->  | G468: of:=IF(ISNUMBER([.F468]);[.F468]+[.G467];"") ->  | H468: of:=IF(AND([.G468]<=[Unidades.$G$26];[.G468]<=[Unidades.$F$18];[Unidades.$F$18]>0);[Unidades.$D$18]+1-COUNTIFS([Unidades.$O$3:.$O$17];">="&[.G468]);"") ->  | I468: of:=IF([.H467]<>[.H468];"INICIO";IF([.H469]<>[.H468];"FIN";"")) ->  | J468: of:=IF([.K467]<>[.K468];"INICIO";IF([.K469]<>[.K468];"FIN";"")) -> 
A469: of:=IF([.B469]<>"";TODAY()>[.B469];"") ->  | B469: of:=IFERROR(IF(([.B468]+1)<[Calendario.$F$5];[.B468]+1;"");"") ->  | C469: of:=IF(AND([.B469]>=[Calendario.$F$8];[.B469]<=[Calendario.$F$9];1);1;IF(AND([.B469]>=[Calendario.$F$12];[.B469]<=[Calendario.$F$13]);2;IF(AND([.B469]>=[Calendario.$F$16];[.B469]<=[Calendario.$F$17]);3;""))) ->  | D469: of:=IF(COUNTIF([Calendario.$H$4:.$H$48];[.B469])>0;"FIESTA";"") -> FIESTA | E469: of:=IF([.B469]<>"";VLOOKUP(WEEKDAY([.B469];3);[Calendario.$A$4:.$C$11];2);"") ->  | F469: of:=IF([.B469]<>"";IF([.D469]<>"FIESTA";VLOOKUP(WEEKDAY([.B469];3);[Calendario.$A$4:.$C$11];3);0);"") ->  | G469: of:=IF(ISNUMBER([.F469]);[.F469]+[.G468];"") ->  | H469: of:=IF(AND([.G469]<=[Unidades.$G$26];[.G469]<=[Unidades.$F$18];[Unidades.$F$18]>0);[Unidades.$D$18]+1-COUNTIFS([Unidades.$O$3:.$O$17];">="&[.G469]);"") ->  | I469: of:=IF([.H468]<>[.H469];"INICIO";IF([.H470]<>[.H469];"FIN";"")) ->  | J469: of:=IF([.K468]<>[.K469];"INICIO";IF([.K470]<>[.K469];"FIN";"")) -> 
A470: of:=IF([.B470]<>"";TODAY()>[.B470];"") ->  | B470: of:=IFERROR(IF(([.B469]+1)<[Calendario.$F$5];[.B469]+1;"");"") ->  | C470: of:=IF(AND([.B470]>=[Calendario.$F$8];[.B470]<=[Calendario.$F$9];1);1;IF(AND([.B470]>=[Calendario.$F$12];[.B470]<=[Calendario.$F$13]);2;IF(AND([.B470]>=[Calendario.$F$16];[.B470]<=[Calendario.$F$17]);3;""))) ->  | D470: of:=IF(COUNTIF([Calendario.$H$4:.$H$48];[.B470])>0;"FIESTA";"") -> FIESTA | E470: of:=IF([.B470]<>"";VLOOKUP(WEEKDAY([.B470];3);[Calendario.$A$4:.$C$11];2);"") ->  | F470: of:=IF([.B470]<>"";IF([.D470]<>"FIESTA";VLOOKUP(WEEKDAY([.B470];3);[Calendario.$A$4:.$C$11];3);0);"") ->  | G470: of:=IF(ISNUMBER([.F470]);[.F470]+[.G469];"") ->  | H470: of:=IF(AND([.G470]<=[Unidades.$G$26];[.G470]<=[Unidades.$F$18];[Unidades.$F$18]>0);[Unidades.$D$18]+1-COUNTIFS([Unidades.$O$3:.$O$17];">="&[.G470]);"") ->  | I470: of:=IF([.H469]<>[.H470];"INICIO";IF([.H471]<>[.H470];"FIN";"")) ->  | J470: of:=IF([.K469]<>[.K470];"INICIO";IF([.K471]<>[.K470];"FIN";"")) -> 
A471: of:=IF([.B471]<>"";TODAY()>[.B471];"") ->  | B471: of:=IFERROR(IF(([.B470]+1)<[Calendario.$F$5];[.B470]+1;"");"") ->  | C471: of:=IF(AND([.B471]>=[Calendario.$F$8];[.B471]<=[Calendario.$F$9];1);1;IF(AND([.B471]>=[Calendario.$F$12];[.B471]<=[Calendario.$F$13]);2;IF(AND([.B471]>=[Calendario.$F$16];[.B471]<=[Calendario.$F$17]);3;""))) ->  | D471: of:=IF(COUNTIF([Calendario.$H$4:.$H$48];[.B471])>0;"FIESTA";"") -> FIESTA | E471: of:=IF([.B471]<>"";VLOOKUP(WEEKDAY([.B471];3);[Calendario.$A$4:.$C$11];2);"") ->  | F471: of:=IF([.B471]<>"";IF([.D471]<>"FIESTA";VLOOKUP(WEEKDAY([.B471];3);[Calendario.$A$4:.$C$11];3);0);"") ->  | G471: of:=IF(ISNUMBER([.F471]);[.F471]+[.G470];"") ->  | H471: of:=IF(AND([.G471]<=[Unidades.$G$26];[.G471]<=[Unidades.$F$18];[Unidades.$F$18]>0);[Unidades.$D$18]+1-COUNTIFS([Unidades.$O$3:.$O$17];">="&[.G471]);"") ->  | I471: of:=IF([.H470]<>[.H471];"INICIO";IF([.H472]<>[.H471];"FIN";"")) ->  | J471: of:=IF([.K470]<>[.K471];"INICIO";IF([.K472]<>[.K471];"FIN";"")) -> 
A472: of:=IF([.B472]<>"";TODAY()>[.B472];"") ->  | B472: of:=IFERROR(IF(([.B471]+1)<[Calendario.$F$5];[.B471]+1;"");"") ->  | C472: of:=IF(AND([.B472]>=[Calendario.$F$8];[.B472]<=[Calendario.$F$9];1);1;IF(AND([.B472]>=[Calendario.$F$12];[.B472]<=[Calendario.$F$13]);2;IF(AND([.B472]>=[Calendario.$F$16];[.B472]<=[Calendario.$F$17]);3;""))) ->  | D472: of:=IF(COUNTIF([Calendario.$H$4:.$H$48];[.B472])>0;"FIESTA";"") -> FIESTA | E472: of:=IF([.B472]<>"";VLOOKUP(WEEKDAY([.B472];3);[Calendario.$A$4:.$C$11];2);"") ->  | F472: of:=IF([.B472]<>"";IF([.D472]<>"FIESTA";VLOOKUP(WEEKDAY([.B472];3);[Calendario.$A$4:.$C$11];3);0);"") ->  | G472: of:=IF(ISNUMBER([.F472]);[.F472]+[.G471];"") ->  | H472: of:=IF(AND([.G472]<=[Unidades.$G$26];[.G472]<=[Unidades.$F$18];[Unidades.$F$18]>0);[Unidades.$D$18]+1-COUNTIFS([Unidades.$O$3:.$O$17];">="&[.G472]);"") ->  | I472: of:=IF([.H471]<>[.H472];"INICIO";IF([.H473]<>[.H472];"FIN";"")) ->  | J472: of:=IF([.K471]<>[.K472];"INICIO";IF([.K473]<>[.K472];"FIN";"")) -> 
A473: of:=IF([.B473]<>"";TODAY()>[.B473];"") ->  | B473: of:=IFERROR(IF(([.B472]+1)<[Calendario.$F$5];[.B472]+1;"");"") ->  | C473: of:=IF(AND([.B473]>=[Calendario.$F$8];[.B473]<=[Calendario.$F$9];1);1;IF(AND([.B473]>=[Calendario.$F$12];[.B473]<=[Calendario.$F$13]);2;IF(AND([.B473]>=[Calendario.$F$16];[.B473]<=[Calendario.$F$17]);3;""))) ->  | D473: of:=IF(COUNTIF([Calendario.$H$4:.$H$48];[.B473])>0;"FIESTA";"") -> FIESTA | E473: of:=IF([.B473]<>"";VLOOKUP(WEEKDAY([.B473];3);[Calendario.$A$4:.$C$11];2);"") ->  | F473: of:=IF([.B473]<>"";IF([.D473]<>"FIESTA";VLOOKUP(WEEKDAY([.B473];3);[Calendario.$A$4:.$C$11];3);0);"") ->  | G473: of:=IF(ISNUMBER([.F473]);[.F473]+[.G472];"") ->  | H473: of:=IF(AND([.G473]<=[Unidades.$G$26];[.G473]<=[Unidades.$F$18];[Unidades.$F$18]>0);[Unidades.$D$18]+1-COUNTIFS([Unidades.$O$3:.$O$17];">="&[.G473]);"") ->  | I473: of:=IF([.H472]<>[.H473];"INICIO";IF([.H474]<>[.H473];"FIN";"")) ->  | J473: of:=IF([.K472]<>[.K473];"INICIO";IF([.K474]<>[.K473];"FIN";"")) -> 
A474: of:=IF([.B474]<>"";TODAY()>[.B474];"") ->  | B474: of:=IFERROR(IF(([.B473]+1)<[Calendario.$F$5];[.B473]+1;"");"") ->  | C474: of:=IF(AND([.B474]>=[Calendario.$F$8];[.B474]<=[Calendario.$F$9];1);1;IF(AND([.B474]>=[Calendario.$F$12];[.B474]<=[Calendario.$F$13]);2;IF(AND([.B474]>=[Calendario.$F$16];[.B474]<=[Calendario.$F$17]);3;""))) ->  | D474: of:=IF(COUNTIF([Calendario.$H$4:.$H$48];[.B474])>0;"FIESTA";"") -> FIESTA | E474: of:=IF([.B474]<>"";VLOOKUP(WEEKDAY([.B474];3);[Calendario.$A$4:.$C$11];2);"") ->  | F474: of:=IF([.B474]<>"";IF([.D474]<>"FIESTA";VLOOKUP(WEEKDAY([.B474];3);[Calendario.$A$4:.$C$11];3);0);"") ->  | G474: of:=IF(ISNUMBER([.F474]);[.F474]+[.G473];"") ->  | H474: of:=IF(AND([.G474]<=[Unidades.$G$26];[.G474]<=[Unidades.$F$18];[Unidades.$F$18]>0);[Unidades.$D$18]+1-COUNTIFS([Unidades.$O$3:.$O$17];">="&[.G474]);"") ->  | I474: of:=IF([.H473]<>[.H474];"INICIO";IF([.H475]<>[.H474];"FIN";"")) ->  | J474: of:=IF([.K473]<>[.K474];"INICIO";IF([.K475]<>[.K474];"FIN";"")) -> 
A475: of:=IF([.B475]<>"";TODAY()>[.B475];"") ->  | B475: of:=IFERROR(IF(([.B474]+1)<[Calendario.$F$5];[.B474]+1;"");"") ->  | C475: of:=IF(AND([.B475]>=[Calendario.$F$8];[.B475]<=[Calendario.$F$9];1);1;IF(AND([.B475]>=[Calendario.$F$12];[.B475]<=[Calendario.$F$13]);2;IF(AND([.B475]>=[Calendario.$F$16];[.B475]<=[Calendario.$F$17]);3;""))) ->  | D475: of:=IF(COUNTIF([Calendario.$H$4:.$H$48];[.B475])>0;"FIESTA";"") -> FIESTA | E475: of:=IF([.B475]<>"";VLOOKUP(WEEKDAY([.B475];3);[Calendario.$A$4:.$C$11];2);"") ->  | F475: of:=IF([.B475]<>"";IF([.D475]<>"FIESTA";VLOOKUP(WEEKDAY([.B475];3);[Calendario.$A$4:.$C$11];3);0);"") ->  | G475: of:=IF(ISNUMBER([.F475]);[.F475]+[.G474];"") ->  | H475: of:=IF(AND([.G475]<=[Unidades.$G$26];[.G475]<=[Unidades.$F$18];[Unidades.$F$18]>0);[Unidades.$D$18]+1-COUNTIFS([Unidades.$O$3:.$O$17];">="&[.G475]);"") ->  | I475: of:=IF([.H474]<>[.H475];"INICIO";IF([.H476]<>[.H475];"FIN";"")) ->  | J475: of:=IF([.K474]<>[.K475];"INICIO";IF([.K476]<>[.K475];"FIN";"")) -> 
A476: of:=IF([.B476]<>"";TODAY()>[.B476];"") ->  | B476: of:=IFERROR(IF(([.B475]+1)<[Calendario.$F$5];[.B475]+1;"");"") ->  | C476: of:=IF(AND([.B476]>=[Calendario.$F$8];[.B476]<=[Calendario.$F$9];1);1;IF(AND([.B476]>=[Calendario.$F$12];[.B476]<=[Calendario.$F$13]);2;IF(AND([.B476]>=[Calendario.$F$16];[.B476]<=[Calendario.$F$17]);3;""))) ->  | D476: of:=IF(COUNTIF([Calendario.$H$4:.$H$48];[.B476])>0;"FIESTA";"") -> FIESTA | E476: of:=IF([.B476]<>"";VLOOKUP(WEEKDAY([.B476];3);[Calendario.$A$4:.$C$11];2);"") ->  | F476: of:=IF([.B476]<>"";IF([.D476]<>"FIESTA";VLOOKUP(WEEKDAY([.B476];3);[Calendario.$A$4:.$C$11];3);0);"") ->  | G476: of:=IF(ISNUMBER([.F476]);[.F476]+[.G475];"") ->  | H476: of:=IF(AND([.G476]<=[Unidades.$G$26];[.G476]<=[Unidades.$F$18];[Unidades.$F$18]>0);[Unidades.$D$18]+1-COUNTIFS([Unidades.$O$3:.$O$17];">="&[.G476]);"") ->  | I476: of:=IF([.H475]<>[.H476];"INICIO";IF([.H477]<>[.H476];"FIN";"")) ->  | J476: of:=IF([.K475]<>[.K476];"INICIO";IF([.K477]<>[.K476];"FIN";"")) -> 
A477: of:=IF([.B477]<>"";TODAY()>[.B477];"") ->  | B477: of:=IFERROR(IF(([.B476]+1)<[Calendario.$F$5];[.B476]+1;"");"") ->  | C477: of:=IF(AND([.B477]>=[Calendario.$F$8];[.B477]<=[Calendario.$F$9];1);1;IF(AND([.B477]>=[Calendario.$F$12];[.B477]<=[Calendario.$F$13]);2;IF(AND([.B477]>=[Calendario.$F$16];[.B477]<=[Calendario.$F$17]);3;""))) ->  | D477: of:=IF(COUNTIF([Calendario.$H$4:.$H$48];[.B477])>0;"FIESTA";"") -> FIESTA | E477: of:=IF([.B477]<>"";VLOOKUP(WEEKDAY([.B477];3);[Calendario.$A$4:.$C$11];2);"") ->  | F477: of:=IF([.B477]<>"";IF([.D477]<>"FIESTA";VLOOKUP(WEEKDAY([.B477];3);[Calendario.$A$4:.$C$11];3);0);"") ->  | G477: of:=IF(ISNUMBER([.F477]);[.F477]+[.G476];"") ->  | H477: of:=IF(AND([.G477]<=[Unidades.$G$26];[.G477]<=[Unidades.$F$18];[Unidades.$F$18]>0);[Unidades.$D$18]+1-COUNTIFS([Unidades.$O$3:.$O$17];">="&[.G477]);"") ->  | I477: of:=IF([.H476]<>[.H477];"INICIO";IF([.H478]<>[.H477];"FIN";"")) ->  | J477: of:=IF([.K476]<>[.K477];"INICIO";IF([.K478]<>[.K477];"FIN";"")) -> 
A478: of:=IF([.B478]<>"";TODAY()>[.B478];"") ->  | B478: of:=IFERROR(IF(([.B477]+1)<[Calendario.$F$5];[.B477]+1;"");"") ->  | C478: of:=IF(AND([.B478]>=[Calendario.$F$8];[.B478]<=[Calendario.$F$9];1);1;IF(AND([.B478]>=[Calendario.$F$12];[.B478]<=[Calendario.$F$13]);2;IF(AND([.B478]>=[Calendario.$F$16];[.B478]<=[Calendario.$F$17]);3;""))) ->  | D478: of:=IF(COUNTIF([Calendario.$H$4:.$H$48];[.B478])>0;"FIESTA";"") -> FIESTA | E478: of:=IF([.B478]<>"";VLOOKUP(WEEKDAY([.B478];3);[Calendario.$A$4:.$C$11];2);"") ->  | F478: of:=IF([.B478]<>"";IF([.D478]<>"FIESTA";VLOOKUP(WEEKDAY([.B478];3);[Calendario.$A$4:.$C$11];3);0);"") ->  | G478: of:=IF(ISNUMBER([.F478]);[.F478]+[.G477];"") ->  | H478: of:=IF(AND([.G478]<=[Unidades.$G$26];[.G478]<=[Unidades.$F$18];[Unidades.$F$18]>0);[Unidades.$D$18]+1-COUNTIFS([Unidades.$O$3:.$O$17];">="&[.G478]);"") ->  | I478: of:=IF([.H477]<>[.H478];"INICIO";IF([.H479]<>[.H478];"FIN";"")) ->  | J478: of:=IF([.K477]<>[.K478];"INICIO";IF([.K479]<>[.K478];"FIN";"")) -> 
A479: of:=IF([.B479]<>"";TODAY()>[.B479];"") ->  | B479: of:=IFERROR(IF(([.B478]+1)<[Calendario.$F$5];[.B478]+1;"");"") ->  | C479: of:=IF(AND([.B479]>=[Calendario.$F$8];[.B479]<=[Calendario.$F$9];1);1;IF(AND([.B479]>=[Calendario.$F$12];[.B479]<=[Calendario.$F$13]);2;IF(AND([.B479]>=[Calendario.$F$16];[.B479]<=[Calendario.$F$17]);3;""))) ->  | D479: of:=IF(COUNTIF([Calendario.$H$4:.$H$48];[.B479])>0;"FIESTA";"") -> FIESTA | E479: of:=IF([.B479]<>"";VLOOKUP(WEEKDAY([.B479];3);[Calendario.$A$4:.$C$11];2);"") ->  | F479: of:=IF([.B479]<>"";IF([.D479]<>"FIESTA";VLOOKUP(WEEKDAY([.B479];3);[Calendario.$A$4:.$C$11];3);0);"") ->  | G479: of:=IF(ISNUMBER([.F479]);[.F479]+[.G478];"") ->  | H479: of:=IF(AND([.G479]<=[Unidades.$G$26];[.G479]<=[Unidades.$F$18];[Unidades.$F$18]>0);[Unidades.$D$18]+1-COUNTIFS([Unidades.$O$3:.$O$17];">="&[.G479]);"") ->  | I479: of:=IF([.H478]<>[.H479];"INICIO";IF([.H480]<>[.H479];"FIN";"")) ->  | J479: of:=IF([.K478]<>[.K479];"INICIO";IF([.K480]<>[.K479];"FIN";"")) -> 
A480: of:=IF([.B480]<>"";TODAY()>[.B480];"") ->  | B480: of:=IFERROR(IF(([.B479]+1)<[Calendario.$F$5];[.B479]+1;"");"") ->  | C480: of:=IF(AND([.B480]>=[Calendario.$F$8];[.B480]<=[Calendario.$F$9];1);1;IF(AND([.B480]>=[Calendario.$F$12];[.B480]<=[Calendario.$F$13]);2;IF(AND([.B480]>=[Calendario.$F$16];[.B480]<=[Calendario.$F$17]);3;""))) ->  | D480: of:=IF(COUNTIF([Calendario.$H$4:.$H$48];[.B480])>0;"FIESTA";"") -> FIESTA | E480: of:=IF([.B480]<>"";VLOOKUP(WEEKDAY([.B480];3);[Calendario.$A$4:.$C$11];2);"") ->  | F480: of:=IF([.B480]<>"";IF([.D480]<>"FIESTA";VLOOKUP(WEEKDAY([.B480];3);[Calendario.$A$4:.$C$11];3);0);"") ->  | G480: of:=IF(ISNUMBER([.F480]);[.F480]+[.G479];"") ->  | H480: of:=IF(AND([.G480]<=[Unidades.$G$26];[.G480]<=[Unidades.$F$18];[Unidades.$F$18]>0);[Unidades.$D$18]+1-COUNTIFS([Unidades.$O$3:.$O$17];">="&[.G480]);"") ->  | I480: of:=IF([.H479]<>[.H480];"INICIO";IF([.H481]<>[.H480];"FIN";"")) ->  | J480: of:=IF([.K479]<>[.K480];"INICIO";IF([.K481]<>[.K480];"FIN";"")) -> 
A481: of:=IF([.B481]<>"";TODAY()>[.B481];"") ->  | B481: of:=IFERROR(IF(([.B480]+1)<[Calendario.$F$5];[.B480]+1;"");"") ->  | C481: of:=IF(AND([.B481]>=[Calendario.$F$8];[.B481]<=[Calendario.$F$9];1);1;IF(AND([.B481]>=[Calendario.$F$12];[.B481]<=[Calendario.$F$13]);2;IF(AND([.B481]>=[Calendario.$F$16];[.B481]<=[Calendario.$F$17]);3;""))) ->  | D481: of:=IF(COUNTIF([Calendario.$H$4:.$H$48];[.B481])>0;"FIESTA";"") -> FIESTA | E481: of:=IF([.B481]<>"";VLOOKUP(WEEKDAY([.B481];3);[Calendario.$A$4:.$C$11];2);"") ->  | F481: of:=IF([.B481]<>"";IF([.D481]<>"FIESTA";VLOOKUP(WEEKDAY([.B481];3);[Calendario.$A$4:.$C$11];3);0);"") ->  | G481: of:=IF(ISNUMBER([.F481]);[.F481]+[.G480];"") ->  | H481: of:=IF(AND([.G481]<=[Unidades.$G$26];[.G481]<=[Unidades.$F$18];[Unidades.$F$18]>0);[Unidades.$D$18]+1-COUNTIFS([Unidades.$O$3:.$O$17];">="&[.G481]);"") ->  | I481: of:=IF([.H480]<>[.H481];"INICIO";IF([.H482]<>[.H481];"FIN";"")) ->  | J481: of:=IF([.K480]<>[.K481];"INICIO";IF([.K482]<>[.K481];"FIN";"")) -> 
A482: of:=IF([.B482]<>"";TODAY()>[.B482];"") ->  | B482: of:=IFERROR(IF(([.B481]+1)<[Calendario.$F$5];[.B481]+1;"");"") ->  | C482: of:=IF(AND([.B482]>=[Calendario.$F$8];[.B482]<=[Calendario.$F$9];1);1;IF(AND([.B482]>=[Calendario.$F$12];[.B482]<=[Calendario.$F$13]);2;IF(AND([.B482]>=[Calendario.$F$16];[.B482]<=[Calendario.$F$17]);3;""))) ->  | D482: of:=IF(COUNTIF([Calendario.$H$4:.$H$48];[.B482])>0;"FIESTA";"") -> FIESTA | E482: of:=IF([.B482]<>"";VLOOKUP(WEEKDAY([.B482];3);[Calendario.$A$4:.$C$11];2);"") ->  | F482: of:=IF([.B482]<>"";IF([.D482]<>"FIESTA";VLOOKUP(WEEKDAY([.B482];3);[Calendario.$A$4:.$C$11];3);0);"") ->  | G482: of:=IF(ISNUMBER([.F482]);[.F482]+[.G481];"") ->  | H482: of:=IF(AND([.G482]<=[Unidades.$G$26];[.G482]<=[Unidades.$F$18];[Unidades.$F$18]>0);[Unidades.$D$18]+1-COUNTIFS([Unidades.$O$3:.$O$17];">="&[.G482]);"") ->  | I482: of:=IF([.H481]<>[.H482];"INICIO";IF([.H483]<>[.H482];"FIN";"")) ->  | J482: of:=IF([.K481]<>[.K482];"INICIO";IF([.K483]<>[.K482];"FIN";"")) -> 
A483: of:=IF([.B483]<>"";TODAY()>[.B483];"") ->  | B483: of:=IFERROR(IF(([.B482]+1)<[Calendario.$F$5];[.B482]+1;"");"") ->  | C483: of:=IF(AND([.B483]>=[Calendario.$F$8];[.B483]<=[Calendario.$F$9];1);1;IF(AND([.B483]>=[Calendario.$F$12];[.B483]<=[Calendario.$F$13]);2;IF(AND([.B483]>=[Calendario.$F$16];[.B483]<=[Calendario.$F$17]);3;""))) ->  | D483: of:=IF(COUNTIF([Calendario.$H$4:.$H$48];[.B483])>0;"FIESTA";"") -> FIESTA | E483: of:=IF([.B483]<>"";VLOOKUP(WEEKDAY([.B483];3);[Calendario.$A$4:.$C$11];2);"") ->  | F483: of:=IF([.B483]<>"";IF([.D483]<>"FIESTA";VLOOKUP(WEEKDAY([.B483];3);[Calendario.$A$4:.$C$11];3);0);"") ->  | G483: of:=IF(ISNUMBER([.F483]);[.F483]+[.G482];"") ->  | H483: of:=IF(AND([.G483]<=[Unidades.$G$26];[.G483]<=[Unidades.$F$18];[Unidades.$F$18]>0);[Unidades.$D$18]+1-COUNTIFS([Unidades.$O$3:.$O$17];">="&[.G483]);"") ->  | I483: of:=IF([.H482]<>[.H483];"INICIO";IF([.H484]<>[.H483];"FIN";"")) ->  | J483: of:=IF([.K482]<>[.K483];"INICIO";IF([.K484]<>[.K483];"FIN";"")) -> 
A484: of:=IF([.B484]<>"";TODAY()>[.B484];"") ->  | B484: of:=IFERROR(IF(([.B483]+1)<[Calendario.$F$5];[.B483]+1;"");"") ->  | C484: of:=IF(AND([.B484]>=[Calendario.$F$8];[.B484]<=[Calendario.$F$9];1);1;IF(AND([.B484]>=[Calendario.$F$12];[.B484]<=[Calendario.$F$13]);2;IF(AND([.B484]>=[Calendario.$F$16];[.B484]<=[Calendario.$F$17]);3;""))) ->  | D484: of:=IF(COUNTIF([Calendario.$H$4:.$H$48];[.B484])>0;"FIESTA";"") -> FIESTA | E484: of:=IF([.B484]<>"";VLOOKUP(WEEKDAY([.B484];3);[Calendario.$A$4:.$C$11];2);"") ->  | F484: of:=IF([.B484]<>"";IF([.D484]<>"FIESTA";VLOOKUP(WEEKDAY([.B484];3);[Calendario.$A$4:.$C$11];3);0);"") ->  | G484: of:=IF(ISNUMBER([.F484]);[.F484]+[.G483];"") ->  | H484: of:=IF(AND([.G484]<=[Unidades.$G$26];[.G484]<=[Unidades.$F$18];[Unidades.$F$18]>0);[Unidades.$D$18]+1-COUNTIFS([Unidades.$O$3:.$O$17];">="&[.G484]);"") ->  | I484: of:=IF([.H483]<>[.H484];"INICIO";IF([.H485]<>[.H484];"FIN";"")) ->  | J484: of:=IF([.K483]<>[.K484];"INICIO";IF([.K485]<>[.K484];"FIN";"")) -> 
A485: of:=IF([.B485]<>"";TODAY()>[.B485];"") ->  | B485: of:=IFERROR(IF(([.B484]+1)<[Calendario.$F$5];[.B484]+1;"");"") ->  | C485: of:=IF(AND([.B485]>=[Calendario.$F$8];[.B485]<=[Calendario.$F$9];1);1;IF(AND([.B485]>=[Calendario.$F$12];[.B485]<=[Calendario.$F$13]);2;IF(AND([.B485]>=[Calendario.$F$16];[.B485]<=[Calendario.$F$17]);3;""))) ->  | D485: of:=IF(COUNTIF([Calendario.$H$4:.$H$48];[.B485])>0;"FIESTA";"") -> FIESTA | E485: of:=IF([.B485]<>"";VLOOKUP(WEEKDAY([.B485];3);[Calendario.$A$4:.$C$11];2);"") ->  | F485: of:=IF([.B485]<>"";IF([.D485]<>"FIESTA";VLOOKUP(WEEKDAY([.B485];3);[Calendario.$A$4:.$C$11];3);0);"") ->  | G485: of:=IF(ISNUMBER([.F485]);[.F485]+[.G484];"") ->  | H485: of:=IF(AND([.G485]<=[Unidades.$G$26];[.G485]<=[Unidades.$F$18];[Unidades.$F$18]>0);[Unidades.$D$18]+1-COUNTIFS([Unidades.$O$3:.$O$17];">="&[.G485]);"") ->  | I485: of:=IF([.H484]<>[.H485];"INICIO";IF([.H486]<>[.H485];"FIN";"")) ->  | J485: of:=IF([.K484]<>[.K485];"INICIO";IF([.K486]<>[.K485];"FIN";"")) -> 
A486: of:=IF([.B486]<>"";TODAY()>[.B486];"") ->  | B486: of:=IFERROR(IF(([.B485]+1)<[Calendario.$F$5];[.B485]+1;"");"") ->  | C486: of:=IF(AND([.B486]>=[Calendario.$F$8];[.B486]<=[Calendario.$F$9];1);1;IF(AND([.B486]>=[Calendario.$F$12];[.B486]<=[Calendario.$F$13]);2;IF(AND([.B486]>=[Calendario.$F$16];[.B486]<=[Calendario.$F$17]);3;""))) ->  | D486: of:=IF(COUNTIF([Calendario.$H$4:.$H$48];[.B486])>0;"FIESTA";"") -> FIESTA | E486: of:=IF([.B486]<>"";VLOOKUP(WEEKDAY([.B486];3);[Calendario.$A$4:.$C$11];2);"") ->  | F486: of:=IF([.B486]<>"";IF([.D486]<>"FIESTA";VLOOKUP(WEEKDAY([.B486];3);[Calendario.$A$4:.$C$11];3);0);"") ->  | G486: of:=IF(ISNUMBER([.F486]);[.F486]+[.G485];"") ->  | H486: of:=IF(AND([.G486]<=[Unidades.$G$26];[.G486]<=[Unidades.$F$18];[Unidades.$F$18]>0);[Unidades.$D$18]+1-COUNTIFS([Unidades.$O$3:.$O$17];">="&[.G486]);"") ->  | I486: of:=IF([.H485]<>[.H486];"INICIO";IF([.H487]<>[.H486];"FIN";"")) ->  | J486: of:=IF([.K485]<>[.K486];"INICIO";IF([.K487]<>[.K486];"FIN";"")) -> 
A487: of:=IF([.B487]<>"";TODAY()>[.B487];"") ->  | B487: of:=IFERROR(IF(([.B486]+1)<[Calendario.$F$5];[.B486]+1;"");"") ->  | C487: of:=IF(AND([.B487]>=[Calendario.$F$8];[.B487]<=[Calendario.$F$9];1);1;IF(AND([.B487]>=[Calendario.$F$12];[.B487]<=[Calendario.$F$13]);2;IF(AND([.B487]>=[Calendario.$F$16];[.B487]<=[Calendario.$F$17]);3;""))) ->  | D487: of:=IF(COUNTIF([Calendario.$H$4:.$H$48];[.B487])>0;"FIESTA";"") -> FIESTA | E487: of:=IF([.B487]<>"";VLOOKUP(WEEKDAY([.B487];3);[Calendario.$A$4:.$C$11];2);"") ->  | F487: of:=IF([.B487]<>"";IF([.D487]<>"FIESTA";VLOOKUP(WEEKDAY([.B487];3);[Calendario.$A$4:.$C$11];3);0);"") ->  | G487: of:=IF(ISNUMBER([.F487]);[.F487]+[.G486];"") ->  | H487: of:=IF(AND([.G487]<=[Unidades.$G$26];[.G487]<=[Unidades.$F$18];[Unidades.$F$18]>0);[Unidades.$D$18]+1-COUNTIFS([Unidades.$O$3:.$O$17];">="&[.G487]);"") ->  | I487: of:=IF([.H486]<>[.H487];"INICIO";IF([.H488]<>[.H487];"FIN";"")) ->  | J487: of:=IF([.K486]<>[.K487];"INICIO";IF([.K488]<>[.K487];"FIN";"")) -> 
A488: of:=IF([.B488]<>"";TODAY()>[.B488];"") ->  | B488: of:=IFERROR(IF(([.B487]+1)<[Calendario.$F$5];[.B487]+1;"");"") ->  | C488: of:=IF(AND([.B488]>=[Calendario.$F$8];[.B488]<=[Calendario.$F$9];1);1;IF(AND([.B488]>=[Calendario.$F$12];[.B488]<=[Calendario.$F$13]);2;IF(AND([.B488]>=[Calendario.$F$16];[.B488]<=[Calendario.$F$17]);3;""))) ->  | D488: of:=IF(COUNTIF([Calendario.$H$4:.$H$48];[.B488])>0;"FIESTA";"") -> FIESTA | E488: of:=IF([.B488]<>"";VLOOKUP(WEEKDAY([.B488];3);[Calendario.$A$4:.$C$11];2);"") ->  | F488: of:=IF([.B488]<>"";IF([.D488]<>"FIESTA";VLOOKUP(WEEKDAY([.B488];3);[Calendario.$A$4:.$C$11];3);0);"") ->  | G488: of:=IF(ISNUMBER([.F488]);[.F488]+[.G487];"") ->  | H488: of:=IF(AND([.G488]<=[Unidades.$G$26];[.G488]<=[Unidades.$F$18];[Unidades.$F$18]>0);[Unidades.$D$18]+1-COUNTIFS([Unidades.$O$3:.$O$17];">="&[.G488]);"") ->  | I488: of:=IF([.H487]<>[.H488];"INICIO";IF([.H489]<>[.H488];"FIN";"")) ->  | J488: of:=IF([.K487]<>[.K488];"INICIO";IF([.K489]<>[.K488];"FIN";"")) -> 
A489: of:=IF([.B489]<>"";TODAY()>[.B489];"") ->  | B489: of:=IFERROR(IF(([.B488]+1)<[Calendario.$F$5];[.B488]+1;"");"") ->  | C489: of:=IF(AND([.B489]>=[Calendario.$F$8];[.B489]<=[Calendario.$F$9];1);1;IF(AND([.B489]>=[Calendario.$F$12];[.B489]<=[Calendario.$F$13]);2;IF(AND([.B489]>=[Calendario.$F$16];[.B489]<=[Calendario.$F$17]);3;""))) ->  | D489: of:=IF(COUNTIF([Calendario.$H$4:.$H$48];[.B489])>0;"FIESTA";"") -> FIESTA | E489: of:=IF([.B489]<>"";VLOOKUP(WEEKDAY([.B489];3);[Calendario.$A$4:.$C$11];2);"") ->  | F489: of:=IF([.B489]<>"";IF([.D489]<>"FIESTA";VLOOKUP(WEEKDAY([.B489];3);[Calendario.$A$4:.$C$11];3);0);"") ->  | G489: of:=IF(ISNUMBER([.F489]);[.F489]+[.G488];"") ->  | H489: of:=IF(AND([.G489]<=[Unidades.$G$26];[.G489]<=[Unidades.$F$18];[Unidades.$F$18]>0);[Unidades.$D$18]+1-COUNTIFS([Unidades.$O$3:.$O$17];">="&[.G489]);"") ->  | I489: of:=IF([.H488]<>[.H489];"INICIO";IF([.H490]<>[.H489];"FIN";"")) ->  | J489: of:=IF([.K488]<>[.K489];"INICIO";IF([.K490]<>[.K489];"FIN";"")) -> 
A490: of:=IF([.B490]<>"";TODAY()>[.B490];"") ->  | B490: of:=IFERROR(IF(([.B489]+1)<[Calendario.$F$5];[.B489]+1;"");"") ->  | C490: of:=IF(AND([.B490]>=[Calendario.$F$8];[.B490]<=[Calendario.$F$9];1);1;IF(AND([.B490]>=[Calendario.$F$12];[.B490]<=[Calendario.$F$13]);2;IF(AND([.B490]>=[Calendario.$F$16];[.B490]<=[Calendario.$F$17]);3;""))) ->  | D490: of:=IF(COUNTIF([Calendario.$H$4:.$H$48];[.B490])>0;"FIESTA";"") -> FIESTA | E490: of:=IF([.B490]<>"";VLOOKUP(WEEKDAY([.B490];3);[Calendario.$A$4:.$C$11];2);"") ->  | F490: of:=IF([.B490]<>"";IF([.D490]<>"FIESTA";VLOOKUP(WEEKDAY([.B490];3);[Calendario.$A$4:.$C$11];3);0);"") ->  | G490: of:=IF(ISNUMBER([.F490]);[.F490]+[.G489];"") ->  | H490: of:=IF(AND([.G490]<=[Unidades.$G$26];[.G490]<=[Unidades.$F$18];[Unidades.$F$18]>0);[Unidades.$D$18]+1-COUNTIFS([Unidades.$O$3:.$O$17];">="&[.G490]);"") ->  | I490: of:=IF([.H489]<>[.H490];"INICIO";IF([.H491]<>[.H490];"FIN";"")) ->  | J490: of:=IF([.K489]<>[.K490];"INICIO";IF([.K491]<>[.K490];"FIN";"")) -> 
A491: of:=IF([.B491]<>"";TODAY()>[.B491];"") ->  | B491: of:=IFERROR(IF(([.B490]+1)<[Calendario.$F$5];[.B490]+1;"");"") ->  | C491: of:=IF(AND([.B491]>=[Calendario.$F$8];[.B491]<=[Calendario.$F$9];1);1;IF(AND([.B491]>=[Calendario.$F$12];[.B491]<=[Calendario.$F$13]);2;IF(AND([.B491]>=[Calendario.$F$16];[.B491]<=[Calendario.$F$17]);3;""))) ->  | D491: of:=IF(COUNTIF([Calendario.$H$4:.$H$48];[.B491])>0;"FIESTA";"") -> FIESTA | E491: of:=IF([.B491]<>"";VLOOKUP(WEEKDAY([.B491];3);[Calendario.$A$4:.$C$11];2);"") ->  | F491: of:=IF([.B491]<>"";IF([.D491]<>"FIESTA";VLOOKUP(WEEKDAY([.B491];3);[Calendario.$A$4:.$C$11];3);0);"") ->  | G491: of:=IF(ISNUMBER([.F491]);[.F491]+[.G490];"") ->  | H491: of:=IF(AND([.G491]<=[Unidades.$G$26];[.G491]<=[Unidades.$F$18];[Unidades.$F$18]>0);[Unidades.$D$18]+1-COUNTIFS([Unidades.$O$3:.$O$17];">="&[.G491]);"") ->  | I491: of:=IF([.H490]<>[.H491];"INICIO";IF([.H492]<>[.H491];"FIN";"")) ->  | J491: of:=IF([.K490]<>[.K491];"INICIO";IF([.K492]<>[.K491];"FIN";"")) -> 
A492: of:=IF([.B492]<>"";TODAY()>[.B492];"") ->  | B492: of:=IFERROR(IF(([.B491]+1)<[Calendario.$F$5];[.B491]+1;"");"") ->  | C492: of:=IF(AND([.B492]>=[Calendario.$F$8];[.B492]<=[Calendario.$F$9];1);1;IF(AND([.B492]>=[Calendario.$F$12];[.B492]<=[Calendario.$F$13]);2;IF(AND([.B492]>=[Calendario.$F$16];[.B492]<=[Calendario.$F$17]);3;""))) ->  | D492: of:=IF(COUNTIF([Calendario.$H$4:.$H$48];[.B492])>0;"FIESTA";"") -> FIESTA | E492: of:=IF([.B492]<>"";VLOOKUP(WEEKDAY([.B492];3);[Calendario.$A$4:.$C$11];2);"") ->  | F492: of:=IF([.B492]<>"";IF([.D492]<>"FIESTA";VLOOKUP(WEEKDAY([.B492];3);[Calendario.$A$4:.$C$11];3);0);"") ->  | G492: of:=IF(ISNUMBER([.F492]);[.F492]+[.G491];"") ->  | H492: of:=IF(AND([.G492]<=[Unidades.$G$26];[.G492]<=[Unidades.$F$18];[Unidades.$F$18]>0);[Unidades.$D$18]+1-COUNTIFS([Unidades.$O$3:.$O$17];">="&[.G492]);"") ->  | I492: of:=IF([.H491]<>[.H492];"INICIO";IF([.H493]<>[.H492];"FIN";"")) ->  | J492: of:=IF([.K491]<>[.K492];"INICIO";IF([.K493]<>[.K492];"FIN";"")) -> 
A493: of:=IF([.B493]<>"";TODAY()>[.B493];"") ->  | B493: of:=IFERROR(IF(([.B492]+1)<[Calendario.$F$5];[.B492]+1;"");"") ->  | C493: of:=IF(AND([.B493]>=[Calendario.$F$8];[.B493]<=[Calendario.$F$9];1);1;IF(AND([.B493]>=[Calendario.$F$12];[.B493]<=[Calendario.$F$13]);2;IF(AND([.B493]>=[Calendario.$F$16];[.B493]<=[Calendario.$F$17]);3;""))) ->  | D493: of:=IF(COUNTIF([Calendario.$H$4:.$H$48];[.B493])>0;"FIESTA";"") -> FIESTA | E493: of:=IF([.B493]<>"";VLOOKUP(WEEKDAY([.B493];3);[Calendario.$A$4:.$C$11];2);"") ->  | F493: of:=IF([.B493]<>"";IF([.D493]<>"FIESTA";VLOOKUP(WEEKDAY([.B493];3);[Calendario.$A$4:.$C$11];3);0);"") ->  | G493: of:=IF(ISNUMBER([.F493]);[.F493]+[.G492];"") ->  | H493: of:=IF(AND([.G493]<=[Unidades.$G$26];[.G493]<=[Unidades.$F$18];[Unidades.$F$18]>0);[Unidades.$D$18]+1-COUNTIFS([Unidades.$O$3:.$O$17];">="&[.G493]);"") ->  | I493: of:=IF([.H492]<>[.H493];"INICIO";IF([.H494]<>[.H493];"FIN";"")) ->  | J493: of:=IF([.K492]<>[.K493];"INICIO";IF([.K494]<>[.K493];"FIN";"")) -> 
A494: of:=IF([.B494]<>"";TODAY()>[.B494];"") ->  | B494: of:=IFERROR(IF(([.B493]+1)<[Calendario.$F$5];[.B493]+1;"");"") ->  | C494: of:=IF(AND([.B494]>=[Calendario.$F$8];[.B494]<=[Calendario.$F$9];1);1;IF(AND([.B494]>=[Calendario.$F$12];[.B494]<=[Calendario.$F$13]);2;IF(AND([.B494]>=[Calendario.$F$16];[.B494]<=[Calendario.$F$17]);3;""))) ->  | D494: of:=IF(COUNTIF([Calendario.$H$4:.$H$48];[.B494])>0;"FIESTA";"") -> FIESTA | E494: of:=IF([.B494]<>"";VLOOKUP(WEEKDAY([.B494];3);[Calendario.$A$4:.$C$11];2);"") ->  | F494: of:=IF([.B494]<>"";IF([.D494]<>"FIESTA";VLOOKUP(WEEKDAY([.B494];3);[Calendario.$A$4:.$C$11];3);0);"") ->  | G494: of:=IF(ISNUMBER([.F494]);[.F494]+[.G493];"") ->  | H494: of:=IF(AND([.G494]<=[Unidades.$G$26];[.G494]<=[Unidades.$F$18];[Unidades.$F$18]>0);[Unidades.$D$18]+1-COUNTIFS([Unidades.$O$3:.$O$17];">="&[.G494]);"") ->  | I494: of:=IF([.H493]<>[.H494];"INICIO";IF([.H495]<>[.H494];"FIN";"")) ->  | J494: of:=IF([.K493]<>[.K494];"INICIO";IF([.K495]<>[.K494];"FIN";"")) -> 
A495: of:=IF([.B495]<>"";TODAY()>[.B495];"") ->  | B495: of:=IFERROR(IF(([.B494]+1)<[Calendario.$F$5];[.B494]+1;"");"") ->  | C495: of:=IF(AND([.B495]>=[Calendario.$F$8];[.B495]<=[Calendario.$F$9];1);1;IF(AND([.B495]>=[Calendario.$F$12];[.B495]<=[Calendario.$F$13]);2;IF(AND([.B495]>=[Calendario.$F$16];[.B495]<=[Calendario.$F$17]);3;""))) ->  | D495: of:=IF(COUNTIF([Calendario.$H$4:.$H$48];[.B495])>0;"FIESTA";"") -> FIESTA | E495: of:=IF([.B495]<>"";VLOOKUP(WEEKDAY([.B495];3);[Calendario.$A$4:.$C$11];2);"") ->  | F495: of:=IF([.B495]<>"";IF([.D495]<>"FIESTA";VLOOKUP(WEEKDAY([.B495];3);[Calendario.$A$4:.$C$11];3);0);"") ->  | G495: of:=IF(ISNUMBER([.F495]);[.F495]+[.G494];"") ->  | H495: of:=IF(AND([.G495]<=[Unidades.$G$26];[.G495]<=[Unidades.$F$18];[Unidades.$F$18]>0);[Unidades.$D$18]+1-COUNTIFS([Unidades.$O$3:.$O$17];">="&[.G495]);"") ->  | I495: of:=IF([.H494]<>[.H495];"INICIO";IF([.H496]<>[.H495];"FIN";"")) ->  | J495: of:=IF([.K494]<>[.K495];"INICIO";IF([.K496]<>[.K495];"FIN";"")) -> 
A496: of:=IF([.B496]<>"";TODAY()>[.B496];"") ->  | B496: of:=IFERROR(IF(([.B495]+1)<[Calendario.$F$5];[.B495]+1;"");"") ->  | C496: of:=IF(AND([.B496]>=[Calendario.$F$8];[.B496]<=[Calendario.$F$9];1);1;IF(AND([.B496]>=[Calendario.$F$12];[.B496]<=[Calendario.$F$13]);2;IF(AND([.B496]>=[Calendario.$F$16];[.B496]<=[Calendario.$F$17]);3;""))) ->  | D496: of:=IF(COUNTIF([Calendario.$H$4:.$H$48];[.B496])>0;"FIESTA";"") -> FIESTA | E496: of:=IF([.B496]<>"";VLOOKUP(WEEKDAY([.B496];3);[Calendario.$A$4:.$C$11];2);"") ->  | F496: of:=IF([.B496]<>"";IF([.D496]<>"FIESTA";VLOOKUP(WEEKDAY([.B496];3);[Calendario.$A$4:.$C$11];3);0);"") ->  | G496: of:=IF(ISNUMBER([.F496]);[.F496]+[.G495];"") ->  | H496: of:=IF(AND([.G496]<=[Unidades.$G$26];[.G496]<=[Unidades.$F$18];[Unidades.$F$18]>0);[Unidades.$D$18]+1-COUNTIFS([Unidades.$O$3:.$O$17];">="&[.G496]);"") ->  | I496: of:=IF([.H495]<>[.H496];"INICIO";IF([.H497]<>[.H496];"FIN";"")) ->  | J496: of:=IF([.K495]<>[.K496];"INICIO";IF([.K497]<>[.K496];"FIN";"")) -> 
A497: of:=IF([.B497]<>"";TODAY()>[.B497];"") ->  | B497: of:=IFERROR(IF(([.B496]+1)<[Calendario.$F$5];[.B496]+1;"");"") ->  | C497: of:=IF(AND([.B497]>=[Calendario.$F$8];[.B497]<=[Calendario.$F$9];1);1;IF(AND([.B497]>=[Calendario.$F$12];[.B497]<=[Calendario.$F$13]);2;IF(AND([.B497]>=[Calendario.$F$16];[.B497]<=[Calendario.$F$17]);3;""))) ->  | D497: of:=IF(COUNTIF([Calendario.$H$4:.$H$48];[.B497])>0;"FIESTA";"") -> FIESTA | E497: of:=IF([.B497]<>"";VLOOKUP(WEEKDAY([.B497];3);[Calendario.$A$4:.$C$11];2);"") ->  | F497: of:=IF([.B497]<>"";IF([.D497]<>"FIESTA";VLOOKUP(WEEKDAY([.B497];3);[Calendario.$A$4:.$C$11];3);0);"") ->  | G497: of:=IF(ISNUMBER([.F497]);[.F497]+[.G496];"") ->  | H497: of:=IF(AND([.G497]<=[Unidades.$G$26];[.G497]<=[Unidades.$F$18];[Unidades.$F$18]>0);[Unidades.$D$18]+1-COUNTIFS([Unidades.$O$3:.$O$17];">="&[.G497]);"") ->  | I497: of:=IF([.H496]<>[.H497];"INICIO";IF([.H498]<>[.H497];"FIN";"")) ->  | J497: of:=IF([.K496]<>[.K497];"INICIO";IF([.K498]<>[.K497];"FIN";"")) -> 
A498: of:=IF([.B498]<>"";TODAY()>[.B498];"") ->  | B498: of:=IFERROR(IF(([.B497]+1)<[Calendario.$F$5];[.B497]+1;"");"") ->  | C498: of:=IF(AND([.B498]>=[Calendario.$F$8];[.B498]<=[Calendario.$F$9];1);1;IF(AND([.B498]>=[Calendario.$F$12];[.B498]<=[Calendario.$F$13]);2;IF(AND([.B498]>=[Calendario.$F$16];[.B498]<=[Calendario.$F$17]);3;""))) ->  | D498: of:=IF(COUNTIF([Calendario.$H$4:.$H$48];[.B498])>0;"FIESTA";"") -> FIESTA | E498: of:=IF([.B498]<>"";VLOOKUP(WEEKDAY([.B498];3);[Calendario.$A$4:.$C$11];2);"") ->  | F498: of:=IF([.B498]<>"";IF([.D498]<>"FIESTA";VLOOKUP(WEEKDAY([.B498];3);[Calendario.$A$4:.$C$11];3);0);"") ->  | G498: of:=IF(ISNUMBER([.F498]);[.F498]+[.G497];"") ->  | H498: of:=IF(AND([.G498]<=[Unidades.$G$26];[.G498]<=[Unidades.$F$18];[Unidades.$F$18]>0);[Unidades.$D$18]+1-COUNTIFS([Unidades.$O$3:.$O$17];">="&[.G498]);"") ->  | I498: of:=IF([.H497]<>[.H498];"INICIO";IF([.H499]<>[.H498];"FIN";"")) ->  | J498: of:=IF([.K497]<>[.K498];"INICIO";IF([.K499]<>[.K498];"FIN";"")) -> 
A499: of:=IF([.B499]<>"";TODAY()>[.B499];"") ->  | B499: of:=IFERROR(IF(([.B498]+1)<[Calendario.$F$5];[.B498]+1;"");"") ->  | C499: of:=IF(AND([.B499]>=[Calendario.$F$8];[.B499]<=[Calendario.$F$9];1);1;IF(AND([.B499]>=[Calendario.$F$12];[.B499]<=[Calendario.$F$13]);2;IF(AND([.B499]>=[Calendario.$F$16];[.B499]<=[Calendario.$F$17]);3;""))) ->  | D499: of:=IF(COUNTIF([Calendario.$H$4:.$H$48];[.B499])>0;"FIESTA";"") -> FIESTA | E499: of:=IF([.B499]<>"";VLOOKUP(WEEKDAY([.B499];3);[Calendario.$A$4:.$C$11];2);"") ->  | F499: of:=IF([.B499]<>"";IF([.D499]<>"FIESTA";VLOOKUP(WEEKDAY([.B499];3);[Calendario.$A$4:.$C$11];3);0);"") ->  | G499: of:=IF(ISNUMBER([.F499]);[.F499]+[.G498];"") ->  | H499: of:=IF(AND([.G499]<=[Unidades.$G$26];[.G499]<=[Unidades.$F$18];[Unidades.$F$18]>0);[Unidades.$D$18]+1-COUNTIFS([Unidades.$O$3:.$O$17];">="&[.G499]);"") ->  | I499: of:=IF([.H498]<>[.H499];"INICIO";IF([.H500]<>[.H499];"FIN";"")) ->  | J499: of:=IF([.K498]<>[.K499];"INICIO";IF([.K500]<>[.K499];"FIN";"")) -> 
A500: of:=IF([.B500]<>"";TODAY()>[.B500];"") ->  | B500: of:=IFERROR(IF(([.B499]+1)<[Calendario.$F$5];[.B499]+1;"");"") ->  | C500: of:=IF(AND([.B500]>=[Calendario.$F$8];[.B500]<=[Calendario.$F$9];1);1;IF(AND([.B500]>=[Calendario.$F$12];[.B500]<=[Calendario.$F$13]);2;IF(AND([.B500]>=[Calendario.$F$16];[.B500]<=[Calendario.$F$17]);3;""))) ->  | D500: of:=IF(COUNTIF([Calendario.$H$4:.$H$48];[.B500])>0;"FIESTA";"") -> FIESTA | E500: of:=IF([.B500]<>"";VLOOKUP(WEEKDAY([.B500];3);[Calendario.$A$4:.$C$11];2);"") ->  | F500: of:=IF([.B500]<>"";IF([.D500]<>"FIESTA";VLOOKUP(WEEKDAY([.B500];3);[Calendario.$A$4:.$C$11];3);0);"") ->  | G500: of:=IF(ISNUMBER([.F500]);[.F500]+[.G499];"") ->  | H500: of:=IF(AND([.G500]<=[Unidades.$G$26];[.G500]<=[Unidades.$F$18];[Unidades.$F$18]>0);[Unidades.$D$18]+1-COUNTIFS([Unidades.$O$3:.$O$17];">="&[.G500]);"") ->  | I500: of:=IF([.H499]<>[.H500];"INICIO";IF([.H501]<>[.H500];"FIN";"")) ->  | J500: of:=IF([.K499]<>[.K500];"INICIO";IF([.K501]<>[.K500];"FIN";"")) -> 
A501: of:=IF([.B501]<>"";TODAY()>[.B501];"") ->  | B501: of:=IFERROR(IF(([.B500]+1)<[Calendario.$F$5];[.B500]+1;"");"") ->  | C501: of:=IF(AND([.B501]>=[Calendario.$F$8];[.B501]<=[Calendario.$F$9];1);1;IF(AND([.B501]>=[Calendario.$F$12];[.B501]<=[Calendario.$F$13]);2;IF(AND([.B501]>=[Calendario.$F$16];[.B501]<=[Calendario.$F$17]);3;""))) ->  | D501: of:=IF(COUNTIF([Calendario.$H$4:.$H$48];[.B501])>0;"FIESTA";"") -> FIESTA | E501: of:=IF([.B501]<>"";VLOOKUP(WEEKDAY([.B501];3);[Calendario.$A$4:.$C$11];2);"") ->  | F501: of:=IF([.B501]<>"";IF([.D501]<>"FIESTA";VLOOKUP(WEEKDAY([.B501];3);[Calendario.$A$4:.$C$11];3);0);"") ->  | G501: of:=IF(ISNUMBER([.F501]);[.F501]+[.G500];"") ->  | H501: of:=IF(AND([.G501]<=[Unidades.$G$26];[.G501]<=[Unidades.$F$18];[Unidades.$F$18]>0);[Unidades.$D$18]+1-COUNTIFS([Unidades.$O$3:.$O$17];">="&[.G501]);"") ->  | I501: of:=IF([.H500]<>[.H501];"INICIO";IF([.H502]<>[.H501];"FIN";"")) ->  | J501: of:=IF([.K500]<>[.K501];"INICIO";IF([.K502]<>[.K501];"FIN";"")) -> 
A502: of:=IF([.B502]<>"";TODAY()>[.B502];"") ->  | B502: of:=IFERROR(IF(([.B501]+1)<[Calendario.$F$5];[.B501]+1;"");"") ->  | C502: of:=IF(AND([.B502]>=[Calendario.$F$8];[.B502]<=[Calendario.$F$9];1);1;IF(AND([.B502]>=[Calendario.$F$12];[.B502]<=[Calendario.$F$13]);2;IF(AND([.B502]>=[Calendario.$F$16];[.B502]<=[Calendario.$F$17]);3;""))) ->  | D502: of:=IF(COUNTIF([Calendario.$H$4:.$H$48];[.B502])>0;"FIESTA";"") -> FIESTA | E502: of:=IF([.B502]<>"";VLOOKUP(WEEKDAY([.B502];3);[Calendario.$A$4:.$C$11];2);"") ->  | F502: of:=IF([.B502]<>"";IF([.D502]<>"FIESTA";VLOOKUP(WEEKDAY([.B502];3);[Calendario.$A$4:.$C$11];3);0);"") ->  | G502: of:=IF(ISNUMBER([.F502]);[.F502]+[.G501];"") ->  | H502: of:=IF(AND([.G502]<=[Unidades.$G$26];[.G502]<=[Unidades.$F$18];[Unidades.$F$18]>0);[Unidades.$D$18]+1-COUNTIFS([Unidades.$O$3:.$O$17];">="&[.G502]);"") ->  | I502: of:=IF([.H501]<>[.H502];"INICIO";IF([.H503]<>[.H502];"FIN";"")) ->  | J502: of:=IF([.K501]<>[.K502];"INICIO";IF([.K503]<>[.K502];"FIN";"")) -> 
A503: of:=IF([.B503]<>"";TODAY()>[.B503];"") ->  | B503: of:=IFERROR(IF(([.B502]+1)<[Calendario.$F$5];[.B502]+1;"");"") ->  | C503: of:=IF(AND([.B503]>=[Calendario.$F$8];[.B503]<=[Calendario.$F$9];1);1;IF(AND([.B503]>=[Calendario.$F$12];[.B503]<=[Calendario.$F$13]);2;IF(AND([.B503]>=[Calendario.$F$16];[.B503]<=[Calendario.$F$17]);3;""))) ->  | D503: of:=IF(COUNTIF([Calendario.$H$4:.$H$48];[.B503])>0;"FIESTA";"") -> FIESTA | E503: of:=IF([.B503]<>"";VLOOKUP(WEEKDAY([.B503];3);[Calendario.$A$4:.$C$11];2);"") ->  | F503: of:=IF([.B503]<>"";IF([.D503]<>"FIESTA";VLOOKUP(WEEKDAY([.B503];3);[Calendario.$A$4:.$C$11];3);0);"") ->  | G503: of:=IF(ISNUMBER([.F503]);[.F503]+[.G502];"") ->  | H503: of:=IF(AND([.G503]<=[Unidades.$G$26];[.G503]<=[Unidades.$F$18];[Unidades.$F$18]>0);[Unidades.$D$18]+1-COUNTIFS([Unidades.$O$3:.$O$17];">="&[.G503]);"") ->  | I503: of:=IF([.H502]<>[.H503];"INICIO";IF([.H504]<>[.H503];"FIN";"")) ->  | J503: of:=IF([.K502]<>[.K503];"INICIO";IF([.K504]<>[.K503];"FIN";"")) -> 
A504: of:=IF([.B504]<>"";TODAY()>[.B504];"") ->  | B504: of:=IFERROR(IF(([.B503]+1)<[Calendario.$F$5];[.B503]+1;"");"") ->  | C504: of:=IF(AND([.B504]>=[Calendario.$F$8];[.B504]<=[Calendario.$F$9];1);1;IF(AND([.B504]>=[Calendario.$F$12];[.B504]<=[Calendario.$F$13]);2;IF(AND([.B504]>=[Calendario.$F$16];[.B504]<=[Calendario.$F$17]);3;""))) ->  | D504: of:=IF(COUNTIF([Calendario.$H$4:.$H$48];[.B504])>0;"FIESTA";"") -> FIESTA | E504: of:=IF([.B504]<>"";VLOOKUP(WEEKDAY([.B504];3);[Calendario.$A$4:.$C$11];2);"") ->  | F504: of:=IF([.B504]<>"";IF([.D504]<>"FIESTA";VLOOKUP(WEEKDAY([.B504];3);[Calendario.$A$4:.$C$11];3);0);"") ->  | G504: of:=IF(ISNUMBER([.F504]);[.F504]+[.G503];"") ->  | H504: of:=IF(AND([.G504]<=[Unidades.$G$26];[.G504]<=[Unidades.$F$18];[Unidades.$F$18]>0);[Unidades.$D$18]+1-COUNTIFS([Unidades.$O$3:.$O$17];">="&[.G504]);"") ->  | I504: of:=IF([.H503]<>[.H504];"INICIO";IF([.H505]<>[.H504];"FIN";"")) ->  | J504: of:=IF([.K503]<>[.K504];"INICIO";IF([.K505]<>[.K504];"FIN";"")) -> 
A505: of:=IF([.B505]<>"";TODAY()>[.B505];"") ->  | B505: of:=IFERROR(IF(([.B504]+1)<[Calendario.$F$5];[.B504]+1;"");"") ->  | C505: of:=IF(AND([.B505]>=[Calendario.$F$8];[.B505]<=[Calendario.$F$9];1);1;IF(AND([.B505]>=[Calendario.$F$12];[.B505]<=[Calendario.$F$13]);2;IF(AND([.B505]>=[Calendario.$F$16];[.B505]<=[Calendario.$F$17]);3;""))) ->  | D505: of:=IF(COUNTIF([Calendario.$H$4:.$H$48];[.B505])>0;"FIESTA";"") -> FIESTA | E505: of:=IF([.B505]<>"";VLOOKUP(WEEKDAY([.B505];3);[Calendario.$A$4:.$C$11];2);"") ->  | F505: of:=IF([.B505]<>"";IF([.D505]<>"FIESTA";VLOOKUP(WEEKDAY([.B505];3);[Calendario.$A$4:.$C$11];3);0);"") ->  | G505: of:=IF(ISNUMBER([.F505]);[.F505]+[.G504];"") ->  | H505: of:=IF(AND([.G505]<=[Unidades.$G$26];[.G505]<=[Unidades.$F$18];[Unidades.$F$18]>0);[Unidades.$D$18]+1-COUNTIFS([Unidades.$O$3:.$O$17];">="&[.G505]);"") ->  | I505: of:=IF([.H504]<>[.H505];"INICIO";IF([.H506]<>[.H505];"FIN";"")) ->  | J505: of:=IF([.K504]<>[.K505];"INICIO";IF([.K506]<>[.K505];"FIN";"")) -> 
A506: of:=IF([.B506]<>"";TODAY()>[.B506];"") ->  | B506: of:=IFERROR(IF(([.B505]+1)<[Calendario.$F$5];[.B505]+1;"");"") ->  | C506: of:=IF(AND([.B506]>=[Calendario.$F$8];[.B506]<=[Calendario.$F$9];1);1;IF(AND([.B506]>=[Calendario.$F$12];[.B506]<=[Calendario.$F$13]);2;IF(AND([.B506]>=[Calendario.$F$16];[.B506]<=[Calendario.$F$17]);3;""))) ->  | D506: of:=IF(COUNTIF([Calendario.$H$4:.$H$48];[.B506])>0;"FIESTA";"") -> FIESTA | E506: of:=IF([.B506]<>"";VLOOKUP(WEEKDAY([.B506];3);[Calendario.$A$4:.$C$11];2);"") ->  | F506: of:=IF([.B506]<>"";IF([.D506]<>"FIESTA";VLOOKUP(WEEKDAY([.B506];3);[Calendario.$A$4:.$C$11];3);0);"") ->  | G506: of:=IF(ISNUMBER([.F506]);[.F506]+[.G505];"") ->  | H506: of:=IF(AND([.G506]<=[Unidades.$G$26];[.G506]<=[Unidades.$F$18];[Unidades.$F$18]>0);[Unidades.$D$18]+1-COUNTIFS([Unidades.$O$3:.$O$17];">="&[.G506]);"") ->  | I506: of:=IF([.H505]<>[.H506];"INICIO";IF([.H507]<>[.H506];"FIN";"")) ->  | J506: of:=IF([.K505]<>[.K506];"INICIO";IF([.K507]<>[.K506];"FIN";"")) -> 
A507: of:=IF([.B507]<>"";TODAY()>[.B507];"") ->  | B507: of:=IFERROR(IF(([.B506]+1)<[Calendario.$F$5];[.B506]+1;"");"") ->  | C507: of:=IF(AND([.B507]>=[Calendario.$F$8];[.B507]<=[Calendario.$F$9];1);1;IF(AND([.B507]>=[Calendario.$F$12];[.B507]<=[Calendario.$F$13]);2;IF(AND([.B507]>=[Calendario.$F$16];[.B507]<=[Calendario.$F$17]);3;""))) ->  | D507: of:=IF(COUNTIF([Calendario.$H$4:.$H$48];[.B507])>0;"FIESTA";"") -> FIESTA | E507: of:=IF([.B507]<>"";VLOOKUP(WEEKDAY([.B507];3);[Calendario.$A$4:.$C$11];2);"") ->  | F507: of:=IF([.B507]<>"";IF([.D507]<>"FIESTA";VLOOKUP(WEEKDAY([.B507];3);[Calendario.$A$4:.$C$11];3);0);"") ->  | G507: of:=IF(ISNUMBER([.F507]);[.F507]+[.G506];"") ->  | H507: of:=IF(AND([.G507]<=[Unidades.$G$26];[.G507]<=[Unidades.$F$18];[Unidades.$F$18]>0);[Unidades.$D$18]+1-COUNTIFS([Unidades.$O$3:.$O$17];">="&[.G507]);"") ->  | I507: of:=IF([.H506]<>[.H507];"INICIO";IF([.H508]<>[.H507];"FIN";"")) ->  | J507: of:=IF([.K506]<>[.K507];"INICIO";IF([.K508]<>[.K507];"FIN";"")) -> 
A508: of:=IF([.B508]<>"";TODAY()>[.B508];"") ->  | B508: of:=IFERROR(IF(([.B507]+1)<[Calendario.$F$5];[.B507]+1;"");"") ->  | C508: of:=IF(AND([.B508]>=[Calendario.$F$8];[.B508]<=[Calendario.$F$9];1);1;IF(AND([.B508]>=[Calendario.$F$12];[.B508]<=[Calendario.$F$13]);2;IF(AND([.B508]>=[Calendario.$F$16];[.B508]<=[Calendario.$F$17]);3;""))) ->  | D508: of:=IF(COUNTIF([Calendario.$H$4:.$H$48];[.B508])>0;"FIESTA";"") -> FIESTA | E508: of:=IF([.B508]<>"";VLOOKUP(WEEKDAY([.B508];3);[Calendario.$A$4:.$C$11];2);"") ->  | F508: of:=IF([.B508]<>"";IF([.D508]<>"FIESTA";VLOOKUP(WEEKDAY([.B508];3);[Calendario.$A$4:.$C$11];3);0);"") ->  | G508: of:=IF(ISNUMBER([.F508]);[.F508]+[.G507];"") ->  | H508: of:=IF(AND([.G508]<=[Unidades.$G$26];[.G508]<=[Unidades.$F$18];[Unidades.$F$18]>0);[Unidades.$D$18]+1-COUNTIFS([Unidades.$O$3:.$O$17];">="&[.G508]);"") ->  | I508: of:=IF([.H507]<>[.H508];"INICIO";IF([.H509]<>[.H508];"FIN";"")) ->  | J508: of:=IF([.K507]<>[.K508];"INICIO";IF([.K509]<>[.K508];"FIN";"")) -> 
A509: of:=IF([.B509]<>"";TODAY()>[.B509];"") ->  | B509: of:=IFERROR(IF(([.B508]+1)<[Calendario.$F$5];[.B508]+1;"");"") ->  | C509: of:=IF(AND([.B509]>=[Calendario.$F$8];[.B509]<=[Calendario.$F$9];1);1;IF(AND([.B509]>=[Calendario.$F$12];[.B509]<=[Calendario.$F$13]);2;IF(AND([.B509]>=[Calendario.$F$16];[.B509]<=[Calendario.$F$17]);3;""))) ->  | D509: of:=IF(COUNTIF([Calendario.$H$4:.$H$48];[.B509])>0;"FIESTA";"") -> FIESTA | E509: of:=IF([.B509]<>"";VLOOKUP(WEEKDAY([.B509];3);[Calendario.$A$4:.$C$11];2);"") ->  | F509: of:=IF([.B509]<>"";IF([.D509]<>"FIESTA";VLOOKUP(WEEKDAY([.B509];3);[Calendario.$A$4:.$C$11];3);0);"") ->  | G509: of:=IF(ISNUMBER([.F509]);[.F509]+[.G508];"") ->  | H509: of:=IF(AND([.G509]<=[Unidades.$G$26];[.G509]<=[Unidades.$F$18];[Unidades.$F$18]>0);[Unidades.$D$18]+1-COUNTIFS([Unidades.$O$3:.$O$17];">="&[.G509]);"") ->  | I509: of:=IF([.H508]<>[.H509];"INICIO";IF([.H510]<>[.H509];"FIN";"")) ->  | J509: of:=IF([.K508]<>[.K509];"INICIO";IF([.K510]<>[.K509];"FIN";"")) -> 
A510: of:=IF([.B510]<>"";TODAY()>[.B510];"") ->  | B510: of:=IFERROR(IF(([.B509]+1)<[Calendario.$F$5];[.B509]+1;"");"") ->  | C510: of:=IF(AND([.B510]>=[Calendario.$F$8];[.B510]<=[Calendario.$F$9];1);1;IF(AND([.B510]>=[Calendario.$F$12];[.B510]<=[Calendario.$F$13]);2;IF(AND([.B510]>=[Calendario.$F$16];[.B510]<=[Calendario.$F$17]);3;""))) ->  | D510: of:=IF(COUNTIF([Calendario.$H$4:.$H$48];[.B510])>0;"FIESTA";"") -> FIESTA | E510: of:=IF([.B510]<>"";VLOOKUP(WEEKDAY([.B510];3);[Calendario.$A$4:.$C$11];2);"") ->  | F510: of:=IF([.B510]<>"";IF([.D510]<>"FIESTA";VLOOKUP(WEEKDAY([.B510];3);[Calendario.$A$4:.$C$11];3);0);"") ->  | G510: of:=IF(ISNUMBER([.F510]);[.F510]+[.G509];"") ->  | H510: of:=IF(AND([.G510]<=[Unidades.$G$26];[.G510]<=[Unidades.$F$18];[Unidades.$F$18]>0);[Unidades.$D$18]+1-COUNTIFS([Unidades.$O$3:.$O$17];">="&[.G510]);"") ->  | I510: of:=IF([.H509]<>[.H510];"INICIO";IF([.H511]<>[.H510];"FIN";"")) ->  | J510: of:=IF([.K509]<>[.K510];"INICIO";IF([.K511]<>[.K510];"FIN";"")) -> 
A511: of:=IF([.B511]<>"";TODAY()>[.B511];"") ->  | B511: of:=IFERROR(IF(([.B510]+1)<[Calendario.$F$5];[.B510]+1;"");"") ->  | C511: of:=IF(AND([.B511]>=[Calendario.$F$8];[.B511]<=[Calendario.$F$9];1);1;IF(AND([.B511]>=[Calendario.$F$12];[.B511]<=[Calendario.$F$13]);2;IF(AND([.B511]>=[Calendario.$F$16];[.B511]<=[Calendario.$F$17]);3;""))) ->  | D511: of:=IF(COUNTIF([Calendario.$H$4:.$H$48];[.B511])>0;"FIESTA";"") -> FIESTA | E511: of:=IF([.B511]<>"";VLOOKUP(WEEKDAY([.B511];3);[Calendario.$A$4:.$C$11];2);"") ->  | F511: of:=IF([.B511]<>"";IF([.D511]<>"FIESTA";VLOOKUP(WEEKDAY([.B511];3);[Calendario.$A$4:.$C$11];3);0);"") ->  | G511: of:=IF(ISNUMBER([.F511]);[.F511]+[.G510];"") ->  | H511: of:=IF(AND([.G511]<=[Unidades.$G$26];[.G511]<=[Unidades.$F$18];[Unidades.$F$18]>0);[Unidades.$D$18]+1-COUNTIFS([Unidades.$O$3:.$O$17];">="&[.G511]);"") ->  | I511: of:=IF([.H510]<>[.H511];"INICIO";IF([.H512]<>[.H511];"FIN";"")) ->  | J511: of:=IF([.K510]<>[.K511];"INICIO";IF([.K512]<>[.K511];"FIN";"")) -> 
A512: of:=IF([.B512]<>"";TODAY()>[.B512];"") ->  | B512: of:=IFERROR(IF(([.B511]+1)<[Calendario.$F$5];[.B511]+1;"");"") ->  | C512: of:=IF(AND([.B512]>=[Calendario.$F$8];[.B512]<=[Calendario.$F$9];1);1;IF(AND([.B512]>=[Calendario.$F$12];[.B512]<=[Calendario.$F$13]);2;IF(AND([.B512]>=[Calendario.$F$16];[.B512]<=[Calendario.$F$17]);3;""))) ->  | D512: of:=IF(COUNTIF([Calendario.$H$4:.$H$48];[.B512])>0;"FIESTA";"") -> FIESTA | E512: of:=IF([.B512]<>"";VLOOKUP(WEEKDAY([.B512];3);[Calendario.$A$4:.$C$11];2);"") ->  | F512: of:=IF([.B512]<>"";IF([.D512]<>"FIESTA";VLOOKUP(WEEKDAY([.B512];3);[Calendario.$A$4:.$C$11];3);0);"") ->  | G512: of:=IF(ISNUMBER([.F512]);[.F512]+[.G511];"") ->  | H512: of:=IF(AND([.G512]<=[Unidades.$G$26];[.G512]<=[Unidades.$F$18];[Unidades.$F$18]>0);[Unidades.$D$18]+1-COUNTIFS([Unidades.$O$3:.$O$17];">="&[.G512]);"") ->  | I512: of:=IF([.H511]<>[.H512];"INICIO";IF([.H513]<>[.H512];"FIN";"")) ->  | J512: of:=IF([.K511]<>[.K512];"INICIO";IF([.K513]<>[.K512];"FIN";"")) -> 
A513: of:=IF([.B513]<>"";TODAY()>[.B513];"") ->  | B513: of:=IFERROR(IF(([.B512]+1)<[Calendario.$F$5];[.B512]+1;"");"") ->  | C513: of:=IF(AND([.B513]>=[Calendario.$F$8];[.B513]<=[Calendario.$F$9];1);1;IF(AND([.B513]>=[Calendario.$F$12];[.B513]<=[Calendario.$F$13]);2;IF(AND([.B513]>=[Calendario.$F$16];[.B513]<=[Calendario.$F$17]);3;""))) ->  | D513: of:=IF(COUNTIF([Calendario.$H$4:.$H$48];[.B513])>0;"FIESTA";"") -> FIESTA | E513: of:=IF([.B513]<>"";VLOOKUP(WEEKDAY([.B513];3);[Calendario.$A$4:.$C$11];2);"") ->  | F513: of:=IF([.B513]<>"";IF([.D513]<>"FIESTA";VLOOKUP(WEEKDAY([.B513];3);[Calendario.$A$4:.$C$11];3);0);"") ->  | G513: of:=IF(ISNUMBER([.F513]);[.F513]+[.G512];"") ->  | H513: of:=IF(AND([.G513]<=[Unidades.$G$26];[.G513]<=[Unidades.$F$18];[Unidades.$F$18]>0);[Unidades.$D$18]+1-COUNTIFS([Unidades.$O$3:.$O$17];">="&[.G513]);"") ->  | I513: of:=IF([.H512]<>[.H513];"INICIO";IF([.H514]<>[.H513];"FIN";"")) ->  | J513: of:=IF([.K512]<>[.K513];"INICIO";IF([.K514]<>[.K513];"FIN";"")) -> 
A514: of:=IF([.B514]<>"";TODAY()>[.B514];"") ->  | B514: of:=IFERROR(IF(([.B513]+1)<[Calendario.$F$5];[.B513]+1;"");"") ->  | C514: of:=IF(AND([.B514]>=[Calendario.$F$8];[.B514]<=[Calendario.$F$9];1);1;IF(AND([.B514]>=[Calendario.$F$12];[.B514]<=[Calendario.$F$13]);2;IF(AND([.B514]>=[Calendario.$F$16];[.B514]<=[Calendario.$F$17]);3;""))) ->  | D514: of:=IF(COUNTIF([Calendario.$H$4:.$H$48];[.B514])>0;"FIESTA";"") -> FIESTA | E514: of:=IF([.B514]<>"";VLOOKUP(WEEKDAY([.B514];3);[Calendario.$A$4:.$C$11];2);"") ->  | F514: of:=IF([.B514]<>"";IF([.D514]<>"FIESTA";VLOOKUP(WEEKDAY([.B514];3);[Calendario.$A$4:.$C$11];3);0);"") ->  | G514: of:=IF(ISNUMBER([.F514]);[.F514]+[.G513];"") ->  | H514: of:=IF(AND([.G514]<=[Unidades.$G$26];[.G514]<=[Unidades.$F$18];[Unidades.$F$18]>0);[Unidades.$D$18]+1-COUNTIFS([Unidades.$O$3:.$O$17];">="&[.G514]);"") ->  | I514: of:=IF([.H513]<>[.H514];"INICIO";IF([.H515]<>[.H514];"FIN";"")) ->  | J514: of:=IF([.K513]<>[.K514];"INICIO";IF([.K515]<>[.K514];"FIN";"")) -> 
A515: of:=IF([.B515]<>"";TODAY()>[.B515];"") ->  | B515: of:=IFERROR(IF(([.B514]+1)<[Calendario.$F$5];[.B514]+1;"");"") ->  | C515: of:=IF(AND([.B515]>=[Calendario.$F$8];[.B515]<=[Calendario.$F$9];1);1;IF(AND([.B515]>=[Calendario.$F$12];[.B515]<=[Calendario.$F$13]);2;IF(AND([.B515]>=[Calendario.$F$16];[.B515]<=[Calendario.$F$17]);3;""))) ->  | D515: of:=IF(COUNTIF([Calendario.$H$4:.$H$48];[.B515])>0;"FIESTA";"") -> FIESTA | E515: of:=IF([.B515]<>"";VLOOKUP(WEEKDAY([.B515];3);[Calendario.$A$4:.$C$11];2);"") ->  | F515: of:=IF([.B515]<>"";IF([.D515]<>"FIESTA";VLOOKUP(WEEKDAY([.B515];3);[Calendario.$A$4:.$C$11];3);0);"") ->  | G515: of:=IF(ISNUMBER([.F515]);[.F515]+[.G514];"") ->  | H515: of:=IF(AND([.G515]<=[Unidades.$G$26];[.G515]<=[Unidades.$F$18];[Unidades.$F$18]>0);[Unidades.$D$18]+1-COUNTIFS([Unidades.$O$3:.$O$17];">="&[.G515]);"") ->  | I515: of:=IF([.H514]<>[.H515];"INICIO";IF([.H516]<>[.H515];"FIN";"")) ->  | J515: of:=IF([.K514]<>[.K515];"INICIO";IF([.K516]<>[.K515];"FIN";"")) -> 
A516: of:=IF([.B516]<>"";TODAY()>[.B516];"") ->  | B516: of:=IFERROR(IF(([.B515]+1)<[Calendario.$F$5];[.B515]+1;"");"") ->  | C516: of:=IF(AND([.B516]>=[Calendario.$F$8];[.B516]<=[Calendario.$F$9];1);1;IF(AND([.B516]>=[Calendario.$F$12];[.B516]<=[Calendario.$F$13]);2;IF(AND([.B516]>=[Calendario.$F$16];[.B516]<=[Calendario.$F$17]);3;""))) ->  | D516: of:=IF(COUNTIF([Calendario.$H$4:.$H$48];[.B516])>0;"FIESTA";"") -> FIESTA | E516: of:=IF([.B516]<>"";VLOOKUP(WEEKDAY([.B516];3);[Calendario.$A$4:.$C$11];2);"") ->  | F516: of:=IF([.B516]<>"";IF([.D516]<>"FIESTA";VLOOKUP(WEEKDAY([.B516];3);[Calendario.$A$4:.$C$11];3);0);"") ->  | G516: of:=IF(ISNUMBER([.F516]);[.F516]+[.G515];"") ->  | H516: of:=IF(AND([.G516]<=[Unidades.$G$26];[.G516]<=[Unidades.$F$18];[Unidades.$F$18]>0);[Unidades.$D$18]+1-COUNTIFS([Unidades.$O$3:.$O$17];">="&[.G516]);"") ->  | I516: of:=IF([.H515]<>[.H516];"INICIO";IF([.H517]<>[.H516];"FIN";"")) ->  | J516: of:=IF([.K515]<>[.K516];"INICIO";IF([.K517]<>[.K516];"FIN";"")) -> 
A517: of:=IF([.B517]<>"";TODAY()>[.B517];"") ->  | B517: of:=IFERROR(IF(([.B516]+1)<[Calendario.$F$5];[.B516]+1;"");"") ->  | C517: of:=IF(AND([.B517]>=[Calendario.$F$8];[.B517]<=[Calendario.$F$9];1);1;IF(AND([.B517]>=[Calendario.$F$12];[.B517]<=[Calendario.$F$13]);2;IF(AND([.B517]>=[Calendario.$F$16];[.B517]<=[Calendario.$F$17]);3;""))) ->  | D517: of:=IF(COUNTIF([Calendario.$H$4:.$H$48];[.B517])>0;"FIESTA";"") -> FIESTA | E517: of:=IF([.B517]<>"";VLOOKUP(WEEKDAY([.B517];3);[Calendario.$A$4:.$C$11];2);"") ->  | F517: of:=IF([.B517]<>"";IF([.D517]<>"FIESTA";VLOOKUP(WEEKDAY([.B517];3);[Calendario.$A$4:.$C$11];3);0);"") ->  | G517: of:=IF(ISNUMBER([.F517]);[.F517]+[.G516];"") ->  | H517: of:=IF(AND([.G517]<=[Unidades.$G$26];[.G517]<=[Unidades.$F$18];[Unidades.$F$18]>0);[Unidades.$D$18]+1-COUNTIFS([Unidades.$O$3:.$O$17];">="&[.G517]);"") ->  | I517: of:=IF([.H516]<>[.H517];"INICIO";IF([.H518]<>[.H517];"FIN";"")) ->  | J517: of:=IF([.K516]<>[.K517];"INICIO";IF([.K518]<>[.K517];"FIN";"")) -> 
A518: of:=IF([.B518]<>"";TODAY()>[.B518];"") ->  | B518: of:=IFERROR(IF(([.B517]+1)<[Calendario.$F$5];[.B517]+1;"");"") ->  | C518: of:=IF(AND([.B518]>=[Calendario.$F$8];[.B518]<=[Calendario.$F$9];1);1;IF(AND([.B518]>=[Calendario.$F$12];[.B518]<=[Calendario.$F$13]);2;IF(AND([.B518]>=[Calendario.$F$16];[.B518]<=[Calendario.$F$17]);3;""))) ->  | D518: of:=IF(COUNTIF([Calendario.$H$4:.$H$48];[.B518])>0;"FIESTA";"") -> FIESTA | E518: of:=IF([.B518]<>"";VLOOKUP(WEEKDAY([.B518];3);[Calendario.$A$4:.$C$11];2);"") ->  | F518: of:=IF([.B518]<>"";IF([.D518]<>"FIESTA";VLOOKUP(WEEKDAY([.B518];3);[Calendario.$A$4:.$C$11];3);0);"") ->  | G518: of:=IF(ISNUMBER([.F518]);[.F518]+[.G517];"") ->  | H518: of:=IF(AND([.G518]<=[Unidades.$G$26];[.G518]<=[Unidades.$F$18];[Unidades.$F$18]>0);[Unidades.$D$18]+1-COUNTIFS([Unidades.$O$3:.$O$17];">="&[.G518]);"") ->  | I518: of:=IF([.H517]<>[.H518];"INICIO";IF([.H519]<>[.H518];"FIN";"")) ->  | J518: of:=IF([.K517]<>[.K518];"INICIO";IF([.K519]<>[.K518];"FIN";"")) -> 
A519: of:=IF([.B519]<>"";TODAY()>[.B519];"") ->  | B519: of:=IFERROR(IF(([.B518]+1)<[Calendario.$F$5];[.B518]+1;"");"") ->  | C519: of:=IF(AND([.B519]>=[Calendario.$F$8];[.B519]<=[Calendario.$F$9];1);1;IF(AND([.B519]>=[Calendario.$F$12];[.B519]<=[Calendario.$F$13]);2;IF(AND([.B519]>=[Calendario.$F$16];[.B519]<=[Calendario.$F$17]);3;""))) ->  | D519: of:=IF(COUNTIF([Calendario.$H$4:.$H$48];[.B519])>0;"FIESTA";"") -> FIESTA | E519: of:=IF([.B519]<>"";VLOOKUP(WEEKDAY([.B519];3);[Calendario.$A$4:.$C$11];2);"") ->  | F519: of:=IF([.B519]<>"";IF([.D519]<>"FIESTA";VLOOKUP(WEEKDAY([.B519];3);[Calendario.$A$4:.$C$11];3);0);"") ->  | G519: of:=IF(ISNUMBER([.F519]);[.F519]+[.G518];"") ->  | H519: of:=IF(AND([.G519]<=[Unidades.$G$26];[.G519]<=[Unidades.$F$18];[Unidades.$F$18]>0);[Unidades.$D$18]+1-COUNTIFS([Unidades.$O$3:.$O$17];">="&[.G519]);"") ->  | I519: of:=IF([.H518]<>[.H519];"INICIO";IF([.H520]<>[.H519];"FIN";"")) ->  | J519: of:=IF([.K518]<>[.K519];"INICIO";IF([.K520]<>[.K519];"FIN";"")) -> 
A520: of:=IF([.B520]<>"";TODAY()>[.B520];"") ->  | B520: of:=IFERROR(IF(([.B519]+1)<[Calendario.$F$5];[.B519]+1;"");"") ->  | C520: of:=IF(AND([.B520]>=[Calendario.$F$8];[.B520]<=[Calendario.$F$9];1);1;IF(AND([.B520]>=[Calendario.$F$12];[.B520]<=[Calendario.$F$13]);2;IF(AND([.B520]>=[Calendario.$F$16];[.B520]<=[Calendario.$F$17]);3;""))) ->  | D520: of:=IF(COUNTIF([Calendario.$H$4:.$H$48];[.B520])>0;"FIESTA";"") -> FIESTA | E520: of:=IF([.B520]<>"";VLOOKUP(WEEKDAY([.B520];3);[Calendario.$A$4:.$C$11];2);"") ->  | F520: of:=IF([.B520]<>"";IF([.D520]<>"FIESTA";VLOOKUP(WEEKDAY([.B520];3);[Calendario.$A$4:.$C$11];3);0);"") ->  | G520: of:=IF(ISNUMBER([.F520]);[.F520]+[.G519];"") ->  | H520: of:=IF(AND([.G520]<=[Unidades.$G$26];[.G520]<=[Unidades.$F$18];[Unidades.$F$18]>0);[Unidades.$D$18]+1-COUNTIFS([Unidades.$O$3:.$O$17];">="&[.G520]);"") ->  | I520: of:=IF([.H519]<>[.H520];"INICIO";IF([.H521]<>[.H520];"FIN";"")) ->  | J520: of:=IF([.K519]<>[.K520];"INICIO";IF([.K521]<>[.K520];"FIN";"")) -> 
A521: of:=IF([.B521]<>"";TODAY()>[.B521];"") ->  | B521: of:=IFERROR(IF(([.B520]+1)<[Calendario.$F$5];[.B520]+1;"");"") ->  | C521: of:=IF(AND([.B521]>=[Calendario.$F$8];[.B521]<=[Calendario.$F$9];1);1;IF(AND([.B521]>=[Calendario.$F$12];[.B521]<=[Calendario.$F$13]);2;IF(AND([.B521]>=[Calendario.$F$16];[.B521]<=[Calendario.$F$17]);3;""))) ->  | D521: of:=IF(COUNTIF([Calendario.$H$4:.$H$48];[.B521])>0;"FIESTA";"") -> FIESTA | E521: of:=IF([.B521]<>"";VLOOKUP(WEEKDAY([.B521];3);[Calendario.$A$4:.$C$11];2);"") ->  | F521: of:=IF([.B521]<>"";IF([.D521]<>"FIESTA";VLOOKUP(WEEKDAY([.B521];3);[Calendario.$A$4:.$C$11];3);0);"") ->  | G521: of:=IF(ISNUMBER([.F521]);[.F521]+[.G520];"") ->  | H521: of:=IF(AND([.G521]<=[Unidades.$G$26];[.G521]<=[Unidades.$F$18];[Unidades.$F$18]>0);[Unidades.$D$18]+1-COUNTIFS([Unidades.$O$3:.$O$17];">="&[.G521]);"") ->  | I521: of:=IF([.H520]<>[.H521];"INICIO";IF([.H522]<>[.H521];"FIN";"")) ->  | J521: of:=IF([.K520]<>[.K521];"INICIO";IF([.K522]<>[.K521];"FIN";"")) -> 
A522: of:=IF([.B522]<>"";TODAY()>[.B522];"") ->  | B522: of:=IFERROR(IF(([.B521]+1)<[Calendario.$F$5];[.B521]+1;"");"") ->  | C522: of:=IF(AND([.B522]>=[Calendario.$F$8];[.B522]<=[Calendario.$F$9];1);1;IF(AND([.B522]>=[Calendario.$F$12];[.B522]<=[Calendario.$F$13]);2;IF(AND([.B522]>=[Calendario.$F$16];[.B522]<=[Calendario.$F$17]);3;""))) ->  | D522: of:=IF(COUNTIF([Calendario.$H$4:.$H$48];[.B522])>0;"FIESTA";"") -> FIESTA | E522: of:=IF([.B522]<>"";VLOOKUP(WEEKDAY([.B522];3);[Calendario.$A$4:.$C$11];2);"") ->  | F522: of:=IF([.B522]<>"";IF([.D522]<>"FIESTA";VLOOKUP(WEEKDAY([.B522];3);[Calendario.$A$4:.$C$11];3);0);"") ->  | G522: of:=IF(ISNUMBER([.F522]);[.F522]+[.G521];"") ->  | H522: of:=IF(AND([.G522]<=[Unidades.$G$26];[.G522]<=[Unidades.$F$18];[Unidades.$F$18]>0);[Unidades.$D$18]+1-COUNTIFS([Unidades.$O$3:.$O$17];">="&[.G522]);"") ->  | I522: of:=IF([.H521]<>[.H522];"INICIO";IF([.H523]<>[.H522];"FIN";"")) ->  | J522: of:=IF([.K521]<>[.K522];"INICIO";IF([.K523]<>[.K522];"FIN";"")) -> 
A523: of:=IF([.B523]<>"";TODAY()>[.B523];"") ->  | B523: of:=IFERROR(IF(([.B522]+1)<[Calendario.$F$5];[.B522]+1;"");"") ->  | C523: of:=IF(AND([.B523]>=[Calendario.$F$8];[.B523]<=[Calendario.$F$9];1);1;IF(AND([.B523]>=[Calendario.$F$12];[.B523]<=[Calendario.$F$13]);2;IF(AND([.B523]>=[Calendario.$F$16];[.B523]<=[Calendario.$F$17]);3;""))) ->  | D523: of:=IF(COUNTIF([Calendario.$H$4:.$H$48];[.B523])>0;"FIESTA";"") -> FIESTA | E523: of:=IF([.B523]<>"";VLOOKUP(WEEKDAY([.B523];3);[Calendario.$A$4:.$C$11];2);"") ->  | F523: of:=IF([.B523]<>"";IF([.D523]<>"FIESTA";VLOOKUP(WEEKDAY([.B523];3);[Calendario.$A$4:.$C$11];3);0);"") ->  | G523: of:=IF(ISNUMBER([.F523]);[.F523]+[.G522];"") ->  | H523: of:=IF(AND([.G523]<=[Unidades.$G$26];[.G523]<=[Unidades.$F$18];[Unidades.$F$18]>0);[Unidades.$D$18]+1-COUNTIFS([Unidades.$O$3:.$O$17];">="&[.G523]);"") ->  | I523: of:=IF([.H522]<>[.H523];"INICIO";IF([.H524]<>[.H523];"FIN";"")) ->  | J523: of:=IF([.K522]<>[.K523];"INICIO";IF([.K524]<>[.K523];"FIN";"")) -> 
A524: of:=IF([.B524]<>"";TODAY()>[.B524];"") ->  | B524: of:=IFERROR(IF(([.B523]+1)<[Calendario.$F$5];[.B523]+1;"");"") ->  | C524: of:=IF(AND([.B524]>=[Calendario.$F$8];[.B524]<=[Calendario.$F$9];1);1;IF(AND([.B524]>=[Calendario.$F$12];[.B524]<=[Calendario.$F$13]);2;IF(AND([.B524]>=[Calendario.$F$16];[.B524]<=[Calendario.$F$17]);3;""))) ->  | D524: of:=IF(COUNTIF([Calendario.$H$4:.$H$48];[.B524])>0;"FIESTA";"") -> FIESTA | E524: of:=IF([.B524]<>"";VLOOKUP(WEEKDAY([.B524];3);[Calendario.$A$4:.$C$11];2);"") ->  | F524: of:=IF([.B524]<>"";IF([.D524]<>"FIESTA";VLOOKUP(WEEKDAY([.B524];3);[Calendario.$A$4:.$C$11];3);0);"") ->  | G524: of:=IF(ISNUMBER([.F524]);[.F524]+[.G523];"") ->  | H524: of:=IF(AND([.G524]<=[Unidades.$G$26];[.G524]<=[Unidades.$F$18];[Unidades.$F$18]>0);[Unidades.$D$18]+1-COUNTIFS([Unidades.$O$3:.$O$17];">="&[.G524]);"") ->  | I524: of:=IF([.H523]<>[.H524];"INICIO";IF([.H525]<>[.H524];"FIN";"")) ->  | J524: of:=IF([.K523]<>[.K524];"INICIO";IF([.K525]<>[.K524];"FIN";"")) -> 
A525: of:=IF([.B525]<>"";TODAY()>[.B525];"") ->  | B525: of:=IFERROR(IF(([.B524]+1)<[Calendario.$F$5];[.B524]+1;"");"") ->  | C525: of:=IF(AND([.B525]>=[Calendario.$F$8];[.B525]<=[Calendario.$F$9];1);1;IF(AND([.B525]>=[Calendario.$F$12];[.B525]<=[Calendario.$F$13]);2;IF(AND([.B525]>=[Calendario.$F$16];[.B525]<=[Calendario.$F$17]);3;""))) ->  | D525: of:=IF(COUNTIF([Calendario.$H$4:.$H$48];[.B525])>0;"FIESTA";"") -> FIESTA | E525: of:=IF([.B525]<>"";VLOOKUP(WEEKDAY([.B525];3);[Calendario.$A$4:.$C$11];2);"") ->  | F525: of:=IF([.B525]<>"";IF([.D525]<>"FIESTA";VLOOKUP(WEEKDAY([.B525];3);[Calendario.$A$4:.$C$11];3);0);"") ->  | G525: of:=IF(ISNUMBER([.F525]);[.F525]+[.G524];"") ->  | H525: of:=IF(AND([.G525]<=[Unidades.$G$26];[.G525]<=[Unidades.$F$18];[Unidades.$F$18]>0);[Unidades.$D$18]+1-COUNTIFS([Unidades.$O$3:.$O$17];">="&[.G525]);"") ->  | I525: of:=IF([.H524]<>[.H525];"INICIO";IF([.H526]<>[.H525];"FIN";"")) ->  | J525: of:=IF([.K524]<>[.K525];"INICIO";IF([.K526]<>[.K525];"FIN";"")) -> 
A526: of:=IF([.B526]<>"";TODAY()>[.B526];"") ->  | B526: of:=IFERROR(IF(([.B525]+1)<[Calendario.$F$5];[.B525]+1;"");"") ->  | C526: of:=IF(AND([.B526]>=[Calendario.$F$8];[.B526]<=[Calendario.$F$9];1);1;IF(AND([.B526]>=[Calendario.$F$12];[.B526]<=[Calendario.$F$13]);2;IF(AND([.B526]>=[Calendario.$F$16];[.B526]<=[Calendario.$F$17]);3;""))) ->  | D526: of:=IF(COUNTIF([Calendario.$H$4:.$H$48];[.B526])>0;"FIESTA";"") -> FIESTA | E526: of:=IF([.B526]<>"";VLOOKUP(WEEKDAY([.B526];3);[Calendario.$A$4:.$C$11];2);"") ->  | F526: of:=IF([.B526]<>"";IF([.D526]<>"FIESTA";VLOOKUP(WEEKDAY([.B526];3);[Calendario.$A$4:.$C$11];3);0);"") ->  | G526: of:=IF(ISNUMBER([.F526]);[.F526]+[.G525];"") ->  | H526: of:=IF(AND([.G526]<=[Unidades.$G$26];[.G526]<=[Unidades.$F$18];[Unidades.$F$18]>0);[Unidades.$D$18]+1-COUNTIFS([Unidades.$O$3:.$O$17];">="&[.G526]);"") ->  | I526: of:=IF([.H525]<>[.H526];"INICIO";IF([.H527]<>[.H526];"FIN";"")) ->  | J526: of:=IF([.K525]<>[.K526];"INICIO";IF([.K527]<>[.K526];"FIN";"")) -> 
A527: of:=IF([.B527]<>"";TODAY()>[.B527];"") ->  | B527: of:=IFERROR(IF(([.B526]+1)<[Calendario.$F$5];[.B526]+1;"");"") ->  | C527: of:=IF(AND([.B527]>=[Calendario.$F$8];[.B527]<=[Calendario.$F$9];1);1;IF(AND([.B527]>=[Calendario.$F$12];[.B527]<=[Calendario.$F$13]);2;IF(AND([.B527]>=[Calendario.$F$16];[.B527]<=[Calendario.$F$17]);3;""))) ->  | D527: of:=IF(COUNTIF([Calendario.$H$4:.$H$48];[.B527])>0;"FIESTA";"") -> FIESTA | E527: of:=IF([.B527]<>"";VLOOKUP(WEEKDAY([.B527];3);[Calendario.$A$4:.$C$11];2);"") ->  | F527: of:=IF([.B527]<>"";IF([.D527]<>"FIESTA";VLOOKUP(WEEKDAY([.B527];3);[Calendario.$A$4:.$C$11];3);0);"") ->  | G527: of:=IF(ISNUMBER([.F527]);[.F527]+[.G526];"") ->  | H527: of:=IF(AND([.G527]<=[Unidades.$G$26];[.G527]<=[Unidades.$F$18];[Unidades.$F$18]>0);[Unidades.$D$18]+1-COUNTIFS([Unidades.$O$3:.$O$17];">="&[.G527]);"") ->  | I527: of:=IF([.H526]<>[.H527];"INICIO";IF([.H528]<>[.H527];"FIN";"")) ->  | J527: of:=IF([.K526]<>[.K527];"INICIO";IF([.K528]<>[.K527];"FIN";"")) -> 
A528: of:=IF([.B528]<>"";TODAY()>[.B528];"") ->  | B528: of:=IFERROR(IF(([.B527]+1)<[Calendario.$F$5];[.B527]+1;"");"") ->  | C528: of:=IF(AND([.B528]>=[Calendario.$F$8];[.B528]<=[Calendario.$F$9];1);1;IF(AND([.B528]>=[Calendario.$F$12];[.B528]<=[Calendario.$F$13]);2;IF(AND([.B528]>=[Calendario.$F$16];[.B528]<=[Calendario.$F$17]);3;""))) ->  | D528: of:=IF(COUNTIF([Calendario.$H$4:.$H$48];[.B528])>0;"FIESTA";"") -> FIESTA | E528: of:=IF([.B528]<>"";VLOOKUP(WEEKDAY([.B528];3);[Calendario.$A$4:.$C$11];2);"") ->  | F528: of:=IF([.B528]<>"";IF([.D528]<>"FIESTA";VLOOKUP(WEEKDAY([.B528];3);[Calendario.$A$4:.$C$11];3);0);"") ->  | G528: of:=IF(ISNUMBER([.F528]);[.F528]+[.G527];"") ->  | H528: of:=IF(AND([.G528]<=[Unidades.$G$26];[.G528]<=[Unidades.$F$18];[Unidades.$F$18]>0);[Unidades.$D$18]+1-COUNTIFS([Unidades.$O$3:.$O$17];">="&[.G528]);"") ->  | I528: of:=IF([.H527]<>[.H528];"INICIO";IF([.H529]<>[.H528];"FIN";"")) ->  | J528: of:=IF([.K527]<>[.K528];"INICIO";IF([.K529]<>[.K528];"FIN";"")) -> 
A529: of:=IF([.B529]<>"";TODAY()>[.B529];"") ->  | B529: of:=IFERROR(IF(([.B528]+1)<[Calendario.$F$5];[.B528]+1;"");"") ->  | C529: of:=IF(AND([.B529]>=[Calendario.$F$8];[.B529]<=[Calendario.$F$9];1);1;IF(AND([.B529]>=[Calendario.$F$12];[.B529]<=[Calendario.$F$13]);2;IF(AND([.B529]>=[Calendario.$F$16];[.B529]<=[Calendario.$F$17]);3;""))) ->  | D529: of:=IF(COUNTIF([Calendario.$H$4:.$H$48];[.B529])>0;"FIESTA";"") -> FIESTA | E529: of:=IF([.B529]<>"";VLOOKUP(WEEKDAY([.B529];3);[Calendario.$A$4:.$C$11];2);"") ->  | F529: of:=IF([.B529]<>"";IF([.D529]<>"FIESTA";VLOOKUP(WEEKDAY([.B529];3);[Calendario.$A$4:.$C$11];3);0);"") ->  | G529: of:=IF(ISNUMBER([.F529]);[.F529]+[.G528];"") ->  | H529: of:=IF(AND([.G529]<=[Unidades.$G$26];[.G529]<=[Unidades.$F$18];[Unidades.$F$18]>0);[Unidades.$D$18]+1-COUNTIFS([Unidades.$O$3:.$O$17];">="&[.G529]);"") ->  | I529: of:=IF([.H528]<>[.H529];"INICIO";IF([.H530]<>[.H529];"FIN";"")) ->  | J529: of:=IF([.K528]<>[.K529];"INICIO";IF([.K530]<>[.K529];"FIN";"")) -> 
A530: of:=IF([.B530]<>"";TODAY()>[.B530];"") ->  | B530: of:=IFERROR(IF(([.B529]+1)<[Calendario.$F$5];[.B529]+1;"");"") ->  | C530: of:=IF(AND([.B530]>=[Calendario.$F$8];[.B530]<=[Calendario.$F$9];1);1;IF(AND([.B530]>=[Calendario.$F$12];[.B530]<=[Calendario.$F$13]);2;IF(AND([.B530]>=[Calendario.$F$16];[.B530]<=[Calendario.$F$17]);3;""))) ->  | D530: of:=IF(COUNTIF([Calendario.$H$4:.$H$48];[.B530])>0;"FIESTA";"") -> FIESTA | E530: of:=IF([.B530]<>"";VLOOKUP(WEEKDAY([.B530];3);[Calendario.$A$4:.$C$11];2);"") ->  | F530: of:=IF([.B530]<>"";IF([.D530]<>"FIESTA";VLOOKUP(WEEKDAY([.B530];3);[Calendario.$A$4:.$C$11];3);0);"") ->  | G530: of:=IF(ISNUMBER([.F530]);[.F530]+[.G529];"") ->  | H530: of:=IF(AND([.G530]<=[Unidades.$G$26];[.G530]<=[Unidades.$F$18];[Unidades.$F$18]>0);[Unidades.$D$18]+1-COUNTIFS([Unidades.$O$3:.$O$17];">="&[.G530]);"") ->  | I530: of:=IF([.H529]<>[.H530];"INICIO";IF([.H531]<>[.H530];"FIN";"")) ->  | J530: of:=IF([.K529]<>[.K530];"INICIO";IF([.K531]<>[.K530];"FIN";"")) -> 
A531: of:=IF([.B531]<>"";TODAY()>[.B531];"") ->  | B531: of:=IFERROR(IF(([.B530]+1)<[Calendario.$F$5];[.B530]+1;"");"") ->  | C531: of:=IF(AND([.B531]>=[Calendario.$F$8];[.B531]<=[Calendario.$F$9];1);1;IF(AND([.B531]>=[Calendario.$F$12];[.B531]<=[Calendario.$F$13]);2;IF(AND([.B531]>=[Calendario.$F$16];[.B531]<=[Calendario.$F$17]);3;""))) ->  | D531: of:=IF(COUNTIF([Calendario.$H$4:.$H$48];[.B531])>0;"FIESTA";"") -> FIESTA | E531: of:=IF([.B531]<>"";VLOOKUP(WEEKDAY([.B531];3);[Calendario.$A$4:.$C$11];2);"") ->  | F531: of:=IF([.B531]<>"";IF([.D531]<>"FIESTA";VLOOKUP(WEEKDAY([.B531];3);[Calendario.$A$4:.$C$11];3);0);"") ->  | G531: of:=IF(ISNUMBER([.F531]);[.F531]+[.G530];"") ->  | H531: of:=IF(AND([.G531]<=[Unidades.$G$26];[.G531]<=[Unidades.$F$18];[Unidades.$F$18]>0);[Unidades.$D$18]+1-COUNTIFS([Unidades.$O$3:.$O$17];">="&[.G531]);"") ->  | I531: of:=IF([.H530]<>[.H531];"INICIO";IF([.H532]<>[.H531];"FIN";"")) ->  | J531: of:=IF([.K530]<>[.K531];"INICIO";IF([.K532]<>[.K531];"FIN";"")) -> 
A532: of:=IF([.B532]<>"";TODAY()>[.B532];"") ->  | B532: of:=IFERROR(IF(([.B531]+1)<[Calendario.$F$5];[.B531]+1;"");"") ->  | C532: of:=IF(AND([.B532]>=[Calendario.$F$8];[.B532]<=[Calendario.$F$9];1);1;IF(AND([.B532]>=[Calendario.$F$12];[.B532]<=[Calendario.$F$13]);2;IF(AND([.B532]>=[Calendario.$F$16];[.B532]<=[Calendario.$F$17]);3;""))) ->  | D532: of:=IF(COUNTIF([Calendario.$H$4:.$H$48];[.B532])>0;"FIESTA";"") -> FIESTA | E532: of:=IF([.B532]<>"";VLOOKUP(WEEKDAY([.B532];3);[Calendario.$A$4:.$C$11];2);"") ->  | F532: of:=IF([.B532]<>"";IF([.D532]<>"FIESTA";VLOOKUP(WEEKDAY([.B532];3);[Calendario.$A$4:.$C$11];3);0);"") ->  | G532: of:=IF(ISNUMBER([.F532]);[.F532]+[.G531];"") ->  | H532: of:=IF(AND([.G532]<=[Unidades.$G$26];[.G532]<=[Unidades.$F$18];[Unidades.$F$18]>0);[Unidades.$D$18]+1-COUNTIFS([Unidades.$O$3:.$O$17];">="&[.G532]);"") ->  | I532: of:=IF([.H531]<>[.H532];"INICIO";IF([.H533]<>[.H532];"FIN";"")) ->  | J532: of:=IF([.K531]<>[.K532];"INICIO";IF([.K533]<>[.K532];"FIN";"")) -> 
A533: of:=IF([.B533]<>"";TODAY()>[.B533];"") ->  | B533: of:=IFERROR(IF(([.B532]+1)<[Calendario.$F$5];[.B532]+1;"");"") ->  | C533: of:=IF(AND([.B533]>=[Calendario.$F$8];[.B533]<=[Calendario.$F$9];1);1;IF(AND([.B533]>=[Calendario.$F$12];[.B533]<=[Calendario.$F$13]);2;IF(AND([.B533]>=[Calendario.$F$16];[.B533]<=[Calendario.$F$17]);3;""))) ->  | D533: of:=IF(COUNTIF([Calendario.$H$4:.$H$48];[.B533])>0;"FIESTA";"") -> FIESTA | E533: of:=IF([.B533]<>"";VLOOKUP(WEEKDAY([.B533];3);[Calendario.$A$4:.$C$11];2);"") ->  | F533: of:=IF([.B533]<>"";IF([.D533]<>"FIESTA";VLOOKUP(WEEKDAY([.B533];3);[Calendario.$A$4:.$C$11];3);0);"") ->  | G533: of:=IF(ISNUMBER([.F533]);[.F533]+[.G532];"") ->  | H533: of:=IF(AND([.G533]<=[Unidades.$G$26];[.G533]<=[Unidades.$F$18];[Unidades.$F$18]>0);[Unidades.$D$18]+1-COUNTIFS([Unidades.$O$3:.$O$17];">="&[.G533]);"") ->  | I533: of:=IF([.H532]<>[.H533];"INICIO";IF([.H534]<>[.H533];"FIN";"")) ->  | J533: of:=IF([.K532]<>[.K533];"INICIO";IF([.K534]<>[.K533];"FIN";"")) -> 
A534: of:=IF([.B534]<>"";TODAY()>[.B534];"") ->  | B534: of:=IFERROR(IF(([.B533]+1)<[Calendario.$F$5];[.B533]+1;"");"") ->  | C534: of:=IF(AND([.B534]>=[Calendario.$F$8];[.B534]<=[Calendario.$F$9];1);1;IF(AND([.B534]>=[Calendario.$F$12];[.B534]<=[Calendario.$F$13]);2;IF(AND([.B534]>=[Calendario.$F$16];[.B534]<=[Calendario.$F$17]);3;""))) ->  | D534: of:=IF(COUNTIF([Calendario.$H$4:.$H$48];[.B534])>0;"FIESTA";"") -> FIESTA | E534: of:=IF([.B534]<>"";VLOOKUP(WEEKDAY([.B534];3);[Calendario.$A$4:.$C$11];2);"") ->  | F534: of:=IF([.B534]<>"";IF([.D534]<>"FIESTA";VLOOKUP(WEEKDAY([.B534];3);[Calendario.$A$4:.$C$11];3);0);"") ->  | G534: of:=IF(ISNUMBER([.F534]);[.F534]+[.G533];"") ->  | H534: of:=IF(AND([.G534]<=[Unidades.$G$26];[.G534]<=[Unidades.$F$18];[Unidades.$F$18]>0);[Unidades.$D$18]+1-COUNTIFS([Unidades.$O$3:.$O$17];">="&[.G534]);"") ->  | I534: of:=IF([.H533]<>[.H534];"INICIO";IF([.H535]<>[.H534];"FIN";"")) ->  | J534: of:=IF([.K533]<>[.K534];"INICIO";IF([.K535]<>[.K534];"FIN";"")) -> 
A535: of:=IF([.B535]<>"";TODAY()>[.B535];"") ->  | B535: of:=IFERROR(IF(([.B534]+1)<[Calendario.$F$5];[.B534]+1;"");"") ->  | C535: of:=IF(AND([.B535]>=[Calendario.$F$8];[.B535]<=[Calendario.$F$9];1);1;IF(AND([.B535]>=[Calendario.$F$12];[.B535]<=[Calendario.$F$13]);2;IF(AND([.B535]>=[Calendario.$F$16];[.B535]<=[Calendario.$F$17]);3;""))) ->  | D535: of:=IF(COUNTIF([Calendario.$H$4:.$H$48];[.B535])>0;"FIESTA";"") -> FIESTA | E535: of:=IF([.B535]<>"";VLOOKUP(WEEKDAY([.B535];3);[Calendario.$A$4:.$C$11];2);"") ->  | F535: of:=IF([.B535]<>"";IF([.D535]<>"FIESTA";VLOOKUP(WEEKDAY([.B535];3);[Calendario.$A$4:.$C$11];3);0);"") ->  | G535: of:=IF(ISNUMBER([.F535]);[.F535]+[.G534];"") ->  | H535: of:=IF(AND([.G535]<=[Unidades.$G$26];[.G535]<=[Unidades.$F$18];[Unidades.$F$18]>0);[Unidades.$D$18]+1-COUNTIFS([Unidades.$O$3:.$O$17];">="&[.G535]);"") ->  | I535: of:=IF([.H534]<>[.H535];"INICIO";IF([.H536]<>[.H535];"FIN";"")) ->  | J535: of:=IF([.K534]<>[.K535];"INICIO";IF([.K536]<>[.K535];"FIN";"")) -> 
A536: of:=IF([.B536]<>"";TODAY()>[.B536];"") ->  | B536: of:=IFERROR(IF(([.B535]+1)<[Calendario.$F$5];[.B535]+1;"");"") ->  | C536: of:=IF(AND([.B536]>=[Calendario.$F$8];[.B536]<=[Calendario.$F$9];1);1;IF(AND([.B536]>=[Calendario.$F$12];[.B536]<=[Calendario.$F$13]);2;IF(AND([.B536]>=[Calendario.$F$16];[.B536]<=[Calendario.$F$17]);3;""))) ->  | D536: of:=IF(COUNTIF([Calendario.$H$4:.$H$48];[.B536])>0;"FIESTA";"") -> FIESTA | E536: of:=IF([.B536]<>"";VLOOKUP(WEEKDAY([.B536];3);[Calendario.$A$4:.$C$11];2);"") ->  | F536: of:=IF([.B536]<>"";IF([.D536]<>"FIESTA";VLOOKUP(WEEKDAY([.B536];3);[Calendario.$A$4:.$C$11];3);0);"") ->  | G536: of:=IF(ISNUMBER([.F536]);[.F536]+[.G535];"") ->  | H536: of:=IF(AND([.G536]<=[Unidades.$G$26];[.G536]<=[Unidades.$F$18];[Unidades.$F$18]>0);[Unidades.$D$18]+1-COUNTIFS([Unidades.$O$3:.$O$17];">="&[.G536]);"") ->  | I536: of:=IF([.H535]<>[.H536];"INICIO";IF([.H537]<>[.H536];"FIN";"")) ->  | J536: of:=IF([.K535]<>[.K536];"INICIO";IF([.K537]<>[.K536];"FIN";"")) -> 
A537: of:=IF([.B537]<>"";TODAY()>[.B537];"") ->  | B537: of:=IFERROR(IF(([.B536]+1)<[Calendario.$F$5];[.B536]+1;"");"") ->  | C537: of:=IF(AND([.B537]>=[Calendario.$F$8];[.B537]<=[Calendario.$F$9];1);1;IF(AND([.B537]>=[Calendario.$F$12];[.B537]<=[Calendario.$F$13]);2;IF(AND([.B537]>=[Calendario.$F$16];[.B537]<=[Calendario.$F$17]);3;""))) ->  | D537: of:=IF(COUNTIF([Calendario.$H$4:.$H$48];[.B537])>0;"FIESTA";"") -> FIESTA | E537: of:=IF([.B537]<>"";VLOOKUP(WEEKDAY([.B537];3);[Calendario.$A$4:.$C$11];2);"") ->  | F537: of:=IF([.B537]<>"";IF([.D537]<>"FIESTA";VLOOKUP(WEEKDAY([.B537];3);[Calendario.$A$4:.$C$11];3);0);"") ->  | G537: of:=IF(ISNUMBER([.F537]);[.F537]+[.G536];"") ->  | H537: of:=IF(AND([.G537]<=[Unidades.$G$26];[.G537]<=[Unidades.$F$18];[Unidades.$F$18]>0);[Unidades.$D$18]+1-COUNTIFS([Unidades.$O$3:.$O$17];">="&[.G537]);"") ->  | I537: of:=IF([.H536]<>[.H537];"INICIO";IF([.H538]<>[.H537];"FIN";"")) ->  | J537: of:=IF([.K536]<>[.K537];"INICIO";IF([.K538]<>[.K537];"FIN";"")) -> 
A538: of:=IF([.B538]<>"";TODAY()>[.B538];"") ->  | B538: of:=IFERROR(IF(([.B537]+1)<[Calendario.$F$5];[.B537]+1;"");"") ->  | C538: of:=IF(AND([.B538]>=[Calendario.$F$8];[.B538]<=[Calendario.$F$9];1);1;IF(AND([.B538]>=[Calendario.$F$12];[.B538]<=[Calendario.$F$13]);2;IF(AND([.B538]>=[Calendario.$F$16];[.B538]<=[Calendario.$F$17]);3;""))) ->  | D538: of:=IF(COUNTIF([Calendario.$H$4:.$H$48];[.B538])>0;"FIESTA";"") -> FIESTA | E538: of:=IF([.B538]<>"";VLOOKUP(WEEKDAY([.B538];3);[Calendario.$A$4:.$C$11];2);"") ->  | F538: of:=IF([.B538]<>"";IF([.D538]<>"FIESTA";VLOOKUP(WEEKDAY([.B538];3);[Calendario.$A$4:.$C$11];3);0);"") ->  | G538: of:=IF(ISNUMBER([.F538]);[.F538]+[.G537];"") ->  | H538: of:=IF(AND([.G538]<=[Unidades.$G$26];[.G538]<=[Unidades.$F$18];[Unidades.$F$18]>0);[Unidades.$D$18]+1-COUNTIFS([Unidades.$O$3:.$O$17];">="&[.G538]);"") ->  | I538: of:=IF([.H537]<>[.H538];"INICIO";IF([.H539]<>[.H538];"FIN";"")) ->  | J538: of:=IF([.K537]<>[.K538];"INICIO";IF([.K539]<>[.K538];"FIN";"")) -> 
A539: of:=IF([.B539]<>"";TODAY()>[.B539];"") ->  | B539: of:=IFERROR(IF(([.B538]+1)<[Calendario.$F$5];[.B538]+1;"");"") ->  | C539: of:=IF(AND([.B539]>=[Calendario.$F$8];[.B539]<=[Calendario.$F$9];1);1;IF(AND([.B539]>=[Calendario.$F$12];[.B539]<=[Calendario.$F$13]);2;IF(AND([.B539]>=[Calendario.$F$16];[.B539]<=[Calendario.$F$17]);3;""))) ->  | D539: of:=IF(COUNTIF([Calendario.$H$4:.$H$48];[.B539])>0;"FIESTA";"") -> FIESTA | E539: of:=IF([.B539]<>"";VLOOKUP(WEEKDAY([.B539];3);[Calendario.$A$4:.$C$11];2);"") ->  | F539: of:=IF([.B539]<>"";IF([.D539]<>"FIESTA";VLOOKUP(WEEKDAY([.B539];3);[Calendario.$A$4:.$C$11];3);0);"") ->  | G539: of:=IF(ISNUMBER([.F539]);[.F539]+[.G538];"") ->  | H539: of:=IF(AND([.G539]<=[Unidades.$G$26];[.G539]<=[Unidades.$F$18];[Unidades.$F$18]>0);[Unidades.$D$18]+1-COUNTIFS([Unidades.$O$3:.$O$17];">="&[.G539]);"") ->  | I539: of:=IF([.H538]<>[.H539];"INICIO";IF([.H540]<>[.H539];"FIN";"")) ->  | J539: of:=IF([.K538]<>[.K539];"INICIO";IF([.K540]<>[.K539];"FIN";"")) -> 
A540: of:=IF([.B540]<>"";TODAY()>[.B540];"") ->  | B540: of:=IFERROR(IF(([.B539]+1)<[Calendario.$F$5];[.B539]+1;"");"") ->  | C540: of:=IF(AND([.B540]>=[Calendario.$F$8];[.B540]<=[Calendario.$F$9];1);1;IF(AND([.B540]>=[Calendario.$F$12];[.B540]<=[Calendario.$F$13]);2;IF(AND([.B540]>=[Calendario.$F$16];[.B540]<=[Calendario.$F$17]);3;""))) ->  | D540: of:=IF(COUNTIF([Calendario.$H$4:.$H$48];[.B540])>0;"FIESTA";"") -> FIESTA | E540: of:=IF([.B540]<>"";VLOOKUP(WEEKDAY([.B540];3);[Calendario.$A$4:.$C$11];2);"") ->  | F540: of:=IF([.B540]<>"";IF([.D540]<>"FIESTA";VLOOKUP(WEEKDAY([.B540];3);[Calendario.$A$4:.$C$11];3);0);"") ->  | G540: of:=IF(ISNUMBER([.F540]);[.F540]+[.G539];"") ->  | H540: of:=IF(AND([.G540]<=[Unidades.$G$26];[.G540]<=[Unidades.$F$18];[Unidades.$F$18]>0);[Unidades.$D$18]+1-COUNTIFS([Unidades.$O$3:.$O$17];">="&[.G540]);"") ->  | I540: of:=IF([.H539]<>[.H540];"INICIO";IF([.H541]<>[.H540];"FIN";"")) ->  | J540: of:=IF([.K539]<>[.K540];"INICIO";IF([.K541]<>[.K540];"FIN";"")) -> 
A541: of:=IF([.B541]<>"";TODAY()>[.B541];"") ->  | B541: of:=IFERROR(IF(([.B540]+1)<[Calendario.$F$5];[.B540]+1;"");"") ->  | C541: of:=IF(AND([.B541]>=[Calendario.$F$8];[.B541]<=[Calendario.$F$9];1);1;IF(AND([.B541]>=[Calendario.$F$12];[.B541]<=[Calendario.$F$13]);2;IF(AND([.B541]>=[Calendario.$F$16];[.B541]<=[Calendario.$F$17]);3;""))) ->  | D541: of:=IF(COUNTIF([Calendario.$H$4:.$H$48];[.B541])>0;"FIESTA";"") -> FIESTA | E541: of:=IF([.B541]<>"";VLOOKUP(WEEKDAY([.B541];3);[Calendario.$A$4:.$C$11];2);"") ->  | F541: of:=IF([.B541]<>"";IF([.D541]<>"FIESTA";VLOOKUP(WEEKDAY([.B541];3);[Calendario.$A$4:.$C$11];3);0);"") ->  | G541: of:=IF(ISNUMBER([.F541]);[.F541]+[.G540];"") ->  | H541: of:=IF(AND([.G541]<=[Unidades.$G$26];[.G541]<=[Unidades.$F$18];[Unidades.$F$18]>0);[Unidades.$D$18]+1-COUNTIFS([Unidades.$O$3:.$O$17];">="&[.G541]);"") ->  | I541: of:=IF([.H540]<>[.H541];"INICIO";IF([.H542]<>[.H541];"FIN";"")) ->  | J541: of:=IF([.K540]<>[.K541];"INICIO";IF([.K542]<>[.K541];"FIN";"")) -> 
A542: of:=IF([.B542]<>"";TODAY()>[.B542];"") ->  | B542: of:=IFERROR(IF(([.B541]+1)<[Calendario.$F$5];[.B541]+1;"");"") ->  | C542: of:=IF(AND([.B542]>=[Calendario.$F$8];[.B542]<=[Calendario.$F$9];1);1;IF(AND([.B542]>=[Calendario.$F$12];[.B542]<=[Calendario.$F$13]);2;IF(AND([.B542]>=[Calendario.$F$16];[.B542]<=[Calendario.$F$17]);3;""))) ->  | D542: of:=IF(COUNTIF([Calendario.$H$4:.$H$48];[.B542])>0;"FIESTA";"") -> FIESTA | E542: of:=IF([.B542]<>"";VLOOKUP(WEEKDAY([.B542];3);[Calendario.$A$4:.$C$11];2);"") ->  | F542: of:=IF([.B542]<>"";IF([.D542]<>"FIESTA";VLOOKUP(WEEKDAY([.B542];3);[Calendario.$A$4:.$C$11];3);0);"") ->  | G542: of:=IF(ISNUMBER([.F542]);[.F542]+[.G541];"") ->  | H542: of:=IF(AND([.G542]<=[Unidades.$G$26];[.G542]<=[Unidades.$F$18];[Unidades.$F$18]>0);[Unidades.$D$18]+1-COUNTIFS([Unidades.$O$3:.$O$17];">="&[.G542]);"") ->  | I542: of:=IF([.H541]<>[.H542];"INICIO";IF([.H543]<>[.H542];"FIN";"")) ->  | J542: of:=IF([.K541]<>[.K542];"INICIO";IF([.K543]<>[.K542];"FIN";"")) -> 
A543: of:=IF([.B543]<>"";TODAY()>[.B543];"") ->  | B543: of:=IFERROR(IF(([.B542]+1)<[Calendario.$F$5];[.B542]+1;"");"") ->  | C543: of:=IF(AND([.B543]>=[Calendario.$F$8];[.B543]<=[Calendario.$F$9];1);1;IF(AND([.B543]>=[Calendario.$F$12];[.B543]<=[Calendario.$F$13]);2;IF(AND([.B543]>=[Calendario.$F$16];[.B543]<=[Calendario.$F$17]);3;""))) ->  | D543: of:=IF(COUNTIF([Calendario.$H$4:.$H$48];[.B543])>0;"FIESTA";"") -> FIESTA | E543: of:=IF([.B543]<>"";VLOOKUP(WEEKDAY([.B543];3);[Calendario.$A$4:.$C$11];2);"") ->  | F543: of:=IF([.B543]<>"";IF([.D543]<>"FIESTA";VLOOKUP(WEEKDAY([.B543];3);[Calendario.$A$4:.$C$11];3);0);"") ->  | G543: of:=IF(ISNUMBER([.F543]);[.F543]+[.G542];"") ->  | H543: of:=IF(AND([.G543]<=[Unidades.$G$26];[.G543]<=[Unidades.$F$18];[Unidades.$F$18]>0);[Unidades.$D$18]+1-COUNTIFS([Unidades.$O$3:.$O$17];">="&[.G543]);"") ->  | I543: of:=IF([.H542]<>[.H543];"INICIO";IF([.H544]<>[.H543];"FIN";"")) ->  | J543: of:=IF([.K542]<>[.K543];"INICIO";IF([.K544]<>[.K543];"FIN";"")) -> 
A544: of:=IF([.B544]<>"";TODAY()>[.B544];"") ->  | B544: of:=IFERROR(IF(([.B543]+1)<[Calendario.$F$5];[.B543]+1;"");"") ->  | C544: of:=IF(AND([.B544]>=[Calendario.$F$8];[.B544]<=[Calendario.$F$9];1);1;IF(AND([.B544]>=[Calendario.$F$12];[.B544]<=[Calendario.$F$13]);2;IF(AND([.B544]>=[Calendario.$F$16];[.B544]<=[Calendario.$F$17]);3;""))) ->  | D544: of:=IF(COUNTIF([Calendario.$H$4:.$H$48];[.B544])>0;"FIESTA";"") -> FIESTA | E544: of:=IF([.B544]<>"";VLOOKUP(WEEKDAY([.B544];3);[Calendario.$A$4:.$C$11];2);"") ->  | F544: of:=IF([.B544]<>"";IF([.D544]<>"FIESTA";VLOOKUP(WEEKDAY([.B544];3);[Calendario.$A$4:.$C$11];3);0);"") ->  | G544: of:=IF(ISNUMBER([.F544]);[.F544]+[.G543];"") ->  | H544: of:=IF(AND([.G544]<=[Unidades.$G$26];[.G544]<=[Unidades.$F$18];[Unidades.$F$18]>0);[Unidades.$D$18]+1-COUNTIFS([Unidades.$O$3:.$O$17];">="&[.G544]);"") ->  | I544: of:=IF([.H543]<>[.H544];"INICIO";IF([.H545]<>[.H544];"FIN";"")) ->  | J544: of:=IF([.K543]<>[.K544];"INICIO";IF([.K545]<>[.K544];"FIN";"")) -> 
A545: of:=IF([.B545]<>"";TODAY()>[.B545];"") ->  | B545: of:=IFERROR(IF(([.B544]+1)<[Calendario.$F$5];[.B544]+1;"");"") ->  | C545: of:=IF(AND([.B545]>=[Calendario.$F$8];[.B545]<=[Calendario.$F$9];1);1;IF(AND([.B545]>=[Calendario.$F$12];[.B545]<=[Calendario.$F$13]);2;IF(AND([.B545]>=[Calendario.$F$16];[.B545]<=[Calendario.$F$17]);3;""))) ->  | D545: of:=IF(COUNTIF([Calendario.$H$4:.$H$48];[.B545])>0;"FIESTA";"") -> FIESTA | E545: of:=IF([.B545]<>"";VLOOKUP(WEEKDAY([.B545];3);[Calendario.$A$4:.$C$11];2);"") ->  | F545: of:=IF([.B545]<>"";IF([.D545]<>"FIESTA";VLOOKUP(WEEKDAY([.B545];3);[Calendario.$A$4:.$C$11];3);0);"") ->  | G545: of:=IF(ISNUMBER([.F545]);[.F545]+[.G544];"") ->  | H545: of:=IF(AND([.G545]<=[Unidades.$G$26];[.G545]<=[Unidades.$F$18];[Unidades.$F$18]>0);[Unidades.$D$18]+1-COUNTIFS([Unidades.$O$3:.$O$17];">="&[.G545]);"") ->  | I545: of:=IF([.H544]<>[.H545];"INICIO";IF([.H546]<>[.H545];"FIN";"")) ->  | J545: of:=IF([.K544]<>[.K545];"INICIO";IF([.K546]<>[.K545];"FIN";"")) -> 
A546: of:=IF([.B546]<>"";TODAY()>[.B546];"") ->  | B546: of:=IFERROR(IF(([.B545]+1)<[Calendario.$F$5];[.B545]+1;"");"") ->  | C546: of:=IF(AND([.B546]>=[Calendario.$F$8];[.B546]<=[Calendario.$F$9];1);1;IF(AND([.B546]>=[Calendario.$F$12];[.B546]<=[Calendario.$F$13]);2;IF(AND([.B546]>=[Calendario.$F$16];[.B546]<=[Calendario.$F$17]);3;""))) ->  | D546: of:=IF(COUNTIF([Calendario.$H$4:.$H$48];[.B546])>0;"FIESTA";"") -> FIESTA | E546: of:=IF([.B546]<>"";VLOOKUP(WEEKDAY([.B546];3);[Calendario.$A$4:.$C$11];2);"") ->  | F546: of:=IF([.B546]<>"";IF([.D546]<>"FIESTA";VLOOKUP(WEEKDAY([.B546];3);[Calendario.$A$4:.$C$11];3);0);"") ->  | G546: of:=IF(ISNUMBER([.F546]);[.F546]+[.G545];"") ->  | H546: of:=IF(AND([.G546]<=[Unidades.$G$26];[.G546]<=[Unidades.$F$18];[Unidades.$F$18]>0);[Unidades.$D$18]+1-COUNTIFS([Unidades.$O$3:.$O$17];">="&[.G546]);"") ->  | I546: of:=IF([.H545]<>[.H546];"INICIO";IF([.H547]<>[.H546];"FIN";"")) ->  | J546: of:=IF([.K545]<>[.K546];"INICIO";IF([.K547]<>[.K546];"FIN";"")) -> 
A547: of:=IF([.B547]<>"";TODAY()>[.B547];"") ->  | B547: of:=IFERROR(IF(([.B546]+1)<[Calendario.$F$5];[.B546]+1;"");"") ->  | C547: of:=IF(AND([.B547]>=[Calendario.$F$8];[.B547]<=[Calendario.$F$9];1);1;IF(AND([.B547]>=[Calendario.$F$12];[.B547]<=[Calendario.$F$13]);2;IF(AND([.B547]>=[Calendario.$F$16];[.B547]<=[Calendario.$F$17]);3;""))) ->  | D547: of:=IF(COUNTIF([Calendario.$H$4:.$H$48];[.B547])>0;"FIESTA";"") -> FIESTA | E547: of:=IF([.B547]<>"";VLOOKUP(WEEKDAY([.B547];3);[Calendario.$A$4:.$C$11];2);"") ->  | F547: of:=IF([.B547]<>"";IF([.D547]<>"FIESTA";VLOOKUP(WEEKDAY([.B547];3);[Calendario.$A$4:.$C$11];3);0);"") ->  | G547: of:=IF(ISNUMBER([.F547]);[.F547]+[.G546];"") ->  | H547: of:=IF(AND([.G547]<=[Unidades.$G$26];[.G547]<=[Unidades.$F$18];[Unidades.$F$18]>0);[Unidades.$D$18]+1-COUNTIFS([Unidades.$O$3:.$O$17];">="&[.G547]);"") ->  | I547: of:=IF([.H546]<>[.H547];"INICIO";IF([.H548]<>[.H547];"FIN";"")) ->  | J547: of:=IF([.K546]<>[.K547];"INICIO";IF([.K548]<>[.K547];"FIN";"")) -> 
A548: of:=IF([.B548]<>"";TODAY()>[.B548];"") ->  | B548: of:=IFERROR(IF(([.B547]+1)<[Calendario.$F$5];[.B547]+1;"");"") ->  | C548: of:=IF(AND([.B548]>=[Calendario.$F$8];[.B548]<=[Calendario.$F$9];1);1;IF(AND([.B548]>=[Calendario.$F$12];[.B548]<=[Calendario.$F$13]);2;IF(AND([.B548]>=[Calendario.$F$16];[.B548]<=[Calendario.$F$17]);3;""))) ->  | D548: of:=IF(COUNTIF([Calendario.$H$4:.$H$48];[.B548])>0;"FIESTA";"") -> FIESTA | E548: of:=IF([.B548]<>"";VLOOKUP(WEEKDAY([.B548];3);[Calendario.$A$4:.$C$11];2);"") ->  | F548: of:=IF([.B548]<>"";IF([.D548]<>"FIESTA";VLOOKUP(WEEKDAY([.B548];3);[Calendario.$A$4:.$C$11];3);0);"") ->  | G548: of:=IF(ISNUMBER([.F548]);[.F548]+[.G547];"") ->  | H548: of:=IF(AND([.G548]<=[Unidades.$G$26];[.G548]<=[Unidades.$F$18];[Unidades.$F$18]>0);[Unidades.$D$18]+1-COUNTIFS([Unidades.$O$3:.$O$17];">="&[.G548]);"") ->  | I548: of:=IF([.H547]<>[.H548];"INICIO";IF([.H549]<>[.H548];"FIN";"")) ->  | J548: of:=IF([.K547]<>[.K548];"INICIO";IF([.K549]<>[.K548];"FIN";"")) -> 
A549: of:=IF([.B549]<>"";TODAY()>[.B549];"") ->  | B549: of:=IFERROR(IF(([.B548]+1)<[Calendario.$F$5];[.B548]+1;"");"") ->  | C549: of:=IF(AND([.B549]>=[Calendario.$F$8];[.B549]<=[Calendario.$F$9];1);1;IF(AND([.B549]>=[Calendario.$F$12];[.B549]<=[Calendario.$F$13]);2;IF(AND([.B549]>=[Calendario.$F$16];[.B549]<=[Calendario.$F$17]);3;""))) ->  | D549: of:=IF(COUNTIF([Calendario.$H$4:.$H$48];[.B549])>0;"FIESTA";"") -> FIESTA | E549: of:=IF([.B549]<>"";VLOOKUP(WEEKDAY([.B549];3);[Calendario.$A$4:.$C$11];2);"") ->  | F549: of:=IF([.B549]<>"";IF([.D549]<>"FIESTA";VLOOKUP(WEEKDAY([.B549];3);[Calendario.$A$4:.$C$11];3);0);"") ->  | G549: of:=IF(ISNUMBER([.F549]);[.F549]+[.G548];"") ->  | H549: of:=IF(AND([.G549]<=[Unidades.$G$26];[.G549]<=[Unidades.$F$18];[Unidades.$F$18]>0);[Unidades.$D$18]+1-COUNTIFS([Unidades.$O$3:.$O$17];">="&[.G549]);"") ->  | I549: of:=IF([.H548]<>[.H549];"INICIO";IF([.H550]<>[.H549];"FIN";"")) ->  | J549: of:=IF([.K548]<>[.K549];"INICIO";IF([.K550]<>[.K549];"FIN";"")) -> 
A550: of:=IF([.B550]<>"";TODAY()>[.B550];"") ->  | B550: of:=IFERROR(IF(([.B549]+1)<[Calendario.$F$5];[.B549]+1;"");"") ->  | C550: of:=IF(AND([.B550]>=[Calendario.$F$8];[.B550]<=[Calendario.$F$9];1);1;IF(AND([.B550]>=[Calendario.$F$12];[.B550]<=[Calendario.$F$13]);2;IF(AND([.B550]>=[Calendario.$F$16];[.B550]<=[Calendario.$F$17]);3;""))) ->  | D550: of:=IF(COUNTIF([Calendario.$H$4:.$H$48];[.B550])>0;"FIESTA";"") -> FIESTA | E550: of:=IF([.B550]<>"";VLOOKUP(WEEKDAY([.B550];3);[Calendario.$A$4:.$C$11];2);"") ->  | F550: of:=IF([.B550]<>"";IF([.D550]<>"FIESTA";VLOOKUP(WEEKDAY([.B550];3);[Calendario.$A$4:.$C$11];3);0);"") ->  | G550: of:=IF(ISNUMBER([.F550]);[.F550]+[.G549];"") ->  | H550: of:=IF(AND([.G550]<=[Unidades.$G$26];[.G550]<=[Unidades.$F$18];[Unidades.$F$18]>0);[Unidades.$D$18]+1-COUNTIFS([Unidades.$O$3:.$O$17];">="&[.G550]);"") ->  | I550: of:=IF([.H549]<>[.H550];"INICIO";IF([.H551]<>[.H550];"FIN";"")) ->  | J550: of:=IF([.K549]<>[.K550];"INICIO";IF([.K551]<>[.K550];"FIN";"")) -> 
A551: of:=IF([.B551]<>"";TODAY()>[.B551];"") ->  | B551: of:=IFERROR(IF(([.B550]+1)<[Calendario.$F$5];[.B550]+1;"");"") ->  | C551: of:=IF(AND([.B551]>=[Calendario.$F$8];[.B551]<=[Calendario.$F$9];1);1;IF(AND([.B551]>=[Calendario.$F$12];[.B551]<=[Calendario.$F$13]);2;IF(AND([.B551]>=[Calendario.$F$16];[.B551]<=[Calendario.$F$17]);3;""))) ->  | D551: of:=IF(COUNTIF([Calendario.$H$4:.$H$48];[.B551])>0;"FIESTA";"") -> FIESTA | E551: of:=IF([.B551]<>"";VLOOKUP(WEEKDAY([.B551];3);[Calendario.$A$4:.$C$11];2);"") ->  | F551: of:=IF([.B551]<>"";IF([.D551]<>"FIESTA";VLOOKUP(WEEKDAY([.B551];3);[Calendario.$A$4:.$C$11];3);0);"") ->  | G551: of:=IF(ISNUMBER([.F551]);[.F551]+[.G550];"") ->  | H551: of:=IF(AND([.G551]<=[Unidades.$G$26];[.G551]<=[Unidades.$F$18];[Unidades.$F$18]>0);[Unidades.$D$18]+1-COUNTIFS([Unidades.$O$3:.$O$17];">="&[.G551]);"") ->  | I551: of:=IF([.H550]<>[.H551];"INICIO";IF([.H552]<>[.H551];"FIN";"")) ->  | J551: of:=IF([.K550]<>[.K551];"INICIO";IF([.K552]<>[.K551];"FIN";"")) -> 
A552: of:=IF([.B552]<>"";TODAY()>[.B552];"") ->  | B552: of:=IFERROR(IF(([.B551]+1)<[Calendario.$F$5];[.B551]+1;"");"") ->  | C552: of:=IF(AND([.B552]>=[Calendario.$F$8];[.B552]<=[Calendario.$F$9];1);1;IF(AND([.B552]>=[Calendario.$F$12];[.B552]<=[Calendario.$F$13]);2;IF(AND([.B552]>=[Calendario.$F$16];[.B552]<=[Calendario.$F$17]);3;""))) ->  | D552: of:=IF(COUNTIF([Calendario.$H$4:.$H$48];[.B552])>0;"FIESTA";"") -> FIESTA | E552: of:=IF([.B552]<>"";VLOOKUP(WEEKDAY([.B552];3);[Calendario.$A$4:.$C$11];2);"") ->  | F552: of:=IF([.B552]<>"";IF([.D552]<>"FIESTA";VLOOKUP(WEEKDAY([.B552];3);[Calendario.$A$4:.$C$11];3);0);"") ->  | G552: of:=IF(ISNUMBER([.F552]);[.F552]+[.G551];"") ->  | H552: of:=IF(AND([.G552]<=[Unidades.$G$26];[.G552]<=[Unidades.$F$18];[Unidades.$F$18]>0);[Unidades.$D$18]+1-COUNTIFS([Unidades.$O$3:.$O$17];">="&[.G552]);"") ->  | I552: of:=IF([.H551]<>[.H552];"INICIO";IF([.H553]<>[.H552];"FIN";"")) ->  | J552: of:=IF([.K551]<>[.K552];"INICIO";IF([.K553]<>[.K552];"FIN";"")) -> 
A553: of:=IF([.B553]<>"";TODAY()>[.B553];"") ->  | B553: of:=IFERROR(IF(([.B552]+1)<[Calendario.$F$5];[.B552]+1;"");"") ->  | C553: of:=IF(AND([.B553]>=[Calendario.$F$8];[.B553]<=[Calendario.$F$9];1);1;IF(AND([.B553]>=[Calendario.$F$12];[.B553]<=[Calendario.$F$13]);2;IF(AND([.B553]>=[Calendario.$F$16];[.B553]<=[Calendario.$F$17]);3;""))) ->  | D553: of:=IF(COUNTIF([Calendario.$H$4:.$H$48];[.B553])>0;"FIESTA";"") -> FIESTA | E553: of:=IF([.B553]<>"";VLOOKUP(WEEKDAY([.B553];3);[Calendario.$A$4:.$C$11];2);"") ->  | F553: of:=IF([.B553]<>"";IF([.D553]<>"FIESTA";VLOOKUP(WEEKDAY([.B553];3);[Calendario.$A$4:.$C$11];3);0);"") ->  | G553: of:=IF(ISNUMBER([.F553]);[.F553]+[.G552];"") ->  | H553: of:=IF(AND([.G553]<=[Unidades.$G$26];[.G553]<=[Unidades.$F$18];[Unidades.$F$18]>0);[Unidades.$D$18]+1-COUNTIFS([Unidades.$O$3:.$O$17];">="&[.G553]);"") ->  | I553: of:=IF([.H552]<>[.H553];"INICIO";IF([.H554]<>[.H553];"FIN";"")) ->  | J553: of:=IF([.K552]<>[.K553];"INICIO";IF([.K554]<>[.K553];"FIN";"")) -> 
A554: of:=IF([.B554]<>"";TODAY()>[.B554];"") ->  | B554: of:=IFERROR(IF(([.B553]+1)<[Calendario.$F$5];[.B553]+1;"");"") ->  | C554: of:=IF(AND([.B554]>=[Calendario.$F$8];[.B554]<=[Calendario.$F$9];1);1;IF(AND([.B554]>=[Calendario.$F$12];[.B554]<=[Calendario.$F$13]);2;IF(AND([.B554]>=[Calendario.$F$16];[.B554]<=[Calendario.$F$17]);3;""))) ->  | D554: of:=IF(COUNTIF([Calendario.$H$4:.$H$48];[.B554])>0;"FIESTA";"") -> FIESTA | E554: of:=IF([.B554]<>"";VLOOKUP(WEEKDAY([.B554];3);[Calendario.$A$4:.$C$11];2);"") ->  | F554: of:=IF([.B554]<>"";IF([.D554]<>"FIESTA";VLOOKUP(WEEKDAY([.B554];3);[Calendario.$A$4:.$C$11];3);0);"") ->  | G554: of:=IF(ISNUMBER([.F554]);[.F554]+[.G553];"") ->  | H554: of:=IF(AND([.G554]<=[Unidades.$G$26];[.G554]<=[Unidades.$F$18];[Unidades.$F$18]>0);[Unidades.$D$18]+1-COUNTIFS([Unidades.$O$3:.$O$17];">="&[.G554]);"") ->  | I554: of:=IF([.H553]<>[.H554];"INICIO";IF([.H555]<>[.H554];"FIN";"")) ->  | J554: of:=IF([.K553]<>[.K554];"INICIO";IF([.K555]<>[.K554];"FIN";"")) -> 
A555: of:=IF([.B555]<>"";TODAY()>[.B555];"") ->  | B555: of:=IFERROR(IF(([.B554]+1)<[Calendario.$F$5];[.B554]+1;"");"") ->  | C555: of:=IF(AND([.B555]>=[Calendario.$F$8];[.B555]<=[Calendario.$F$9];1);1;IF(AND([.B555]>=[Calendario.$F$12];[.B555]<=[Calendario.$F$13]);2;IF(AND([.B555]>=[Calendario.$F$16];[.B555]<=[Calendario.$F$17]);3;""))) ->  | D555: of:=IF(COUNTIF([Calendario.$H$4:.$H$48];[.B555])>0;"FIESTA";"") -> FIESTA | E555: of:=IF([.B555]<>"";VLOOKUP(WEEKDAY([.B555];3);[Calendario.$A$4:.$C$11];2);"") ->  | F555: of:=IF([.B555]<>"";IF([.D555]<>"FIESTA";VLOOKUP(WEEKDAY([.B555];3);[Calendario.$A$4:.$C$11];3);0);"") ->  | G555: of:=IF(ISNUMBER([.F555]);[.F555]+[.G554];"") ->  | H555: of:=IF(AND([.G555]<=[Unidades.$G$26];[.G555]<=[Unidades.$F$18];[Unidades.$F$18]>0);[Unidades.$D$18]+1-COUNTIFS([Unidades.$O$3:.$O$17];">="&[.G555]);"") ->  | I555: of:=IF([.H554]<>[.H555];"INICIO";IF([.H556]<>[.H555];"FIN";"")) ->  | J555: of:=IF([.K554]<>[.K555];"INICIO";IF([.K556]<>[.K555];"FIN";"")) -> 
A556: of:=IF([.B556]<>"";TODAY()>[.B556];"") ->  | B556: of:=IFERROR(IF(([.B555]+1)<[Calendario.$F$5];[.B555]+1;"");"") ->  | C556: of:=IF(AND([.B556]>=[Calendario.$F$8];[.B556]<=[Calendario.$F$9];1);1;IF(AND([.B556]>=[Calendario.$F$12];[.B556]<=[Calendario.$F$13]);2;IF(AND([.B556]>=[Calendario.$F$16];[.B556]<=[Calendario.$F$17]);3;""))) ->  | D556: of:=IF(COUNTIF([Calendario.$H$4:.$H$48];[.B556])>0;"FIESTA";"") -> FIESTA | E556: of:=IF([.B556]<>"";VLOOKUP(WEEKDAY([.B556];3);[Calendario.$A$4:.$C$11];2);"") ->  | F556: of:=IF([.B556]<>"";IF([.D556]<>"FIESTA";VLOOKUP(WEEKDAY([.B556];3);[Calendario.$A$4:.$C$11];3);0);"") ->  | G556: of:=IF(ISNUMBER([.F556]);[.F556]+[.G555];"") ->  | H556: of:=IF(AND([.G556]<=[Unidades.$G$26];[.G556]<=[Unidades.$F$18];[Unidades.$F$18]>0);[Unidades.$D$18]+1-COUNTIFS([Unidades.$O$3:.$O$17];">="&[.G556]);"") ->  | I556: of:=IF([.H555]<>[.H556];"INICIO";IF([.H557]<>[.H556];"FIN";"")) ->  | J556: of:=IF([.K555]<>[.K556];"INICIO";IF([.K557]<>[.K556];"FIN";"")) -> 
A557: of:=IF([.B557]<>"";TODAY()>[.B557];"") ->  | B557: of:=IFERROR(IF(([.B556]+1)<[Calendario.$F$5];[.B556]+1;"");"") ->  | C557: of:=IF(AND([.B557]>=[Calendario.$F$8];[.B557]<=[Calendario.$F$9];1);1;IF(AND([.B557]>=[Calendario.$F$12];[.B557]<=[Calendario.$F$13]);2;IF(AND([.B557]>=[Calendario.$F$16];[.B557]<=[Calendario.$F$17]);3;""))) ->  | D557: of:=IF(COUNTIF([Calendario.$H$4:.$H$48];[.B557])>0;"FIESTA";"") -> FIESTA | E557: of:=IF([.B557]<>"";VLOOKUP(WEEKDAY([.B557];3);[Calendario.$A$4:.$C$11];2);"") ->  | F557: of:=IF([.B557]<>"";IF([.D557]<>"FIESTA";VLOOKUP(WEEKDAY([.B557];3);[Calendario.$A$4:.$C$11];3);0);"") ->  | G557: of:=IF(ISNUMBER([.F557]);[.F557]+[.G556];"") ->  | H557: of:=IF(AND([.G557]<=[Unidades.$G$26];[.G557]<=[Unidades.$F$18];[Unidades.$F$18]>0);[Unidades.$D$18]+1-COUNTIFS([Unidades.$O$3:.$O$17];">="&[.G557]);"") ->  | I557: of:=IF([.H556]<>[.H557];"INICIO";IF([.H558]<>[.H557];"FIN";"")) ->  | J557: of:=IF([.K556]<>[.K557];"INICIO";IF([.K558]<>[.K557];"FIN";"")) -> 
A558: of:=IF([.B558]<>"";TODAY()>[.B558];"") ->  | B558: of:=IFERROR(IF(([.B557]+1)<[Calendario.$F$5];[.B557]+1;"");"") ->  | C558: of:=IF(AND([.B558]>=[Calendario.$F$8];[.B558]<=[Calendario.$F$9];1);1;IF(AND([.B558]>=[Calendario.$F$12];[.B558]<=[Calendario.$F$13]);2;IF(AND([.B558]>=[Calendario.$F$16];[.B558]<=[Calendario.$F$17]);3;""))) ->  | D558: of:=IF(COUNTIF([Calendario.$H$4:.$H$48];[.B558])>0;"FIESTA";"") -> FIESTA | E558: of:=IF([.B558]<>"";VLOOKUP(WEEKDAY([.B558];3);[Calendario.$A$4:.$C$11];2);"") ->  | F558: of:=IF([.B558]<>"";IF([.D558]<>"FIESTA";VLOOKUP(WEEKDAY([.B558];3);[Calendario.$A$4:.$C$11];3);0);"") ->  | G558: of:=IF(ISNUMBER([.F558]);[.F558]+[.G557];"") ->  | H558: of:=IF(AND([.G558]<=[Unidades.$G$26];[.G558]<=[Unidades.$F$18];[Unidades.$F$18]>0);[Unidades.$D$18]+1-COUNTIFS([Unidades.$O$3:.$O$17];">="&[.G558]);"") ->  | I558: of:=IF([.H557]<>[.H558];"INICIO";IF([.H559]<>[.H558];"FIN";"")) ->  | J558: of:=IF([.K557]<>[.K558];"INICIO";IF([.K559]<>[.K558];"FIN";"")) -> 
A559: of:=IF([.B559]<>"";TODAY()>[.B559];"") ->  | B559: of:=IFERROR(IF(([.B558]+1)<[Calendario.$F$5];[.B558]+1;"");"") ->  | C559: of:=IF(AND([.B559]>=[Calendario.$F$8];[.B559]<=[Calendario.$F$9];1);1;IF(AND([.B559]>=[Calendario.$F$12];[.B559]<=[Calendario.$F$13]);2;IF(AND([.B559]>=[Calendario.$F$16];[.B559]<=[Calendario.$F$17]);3;""))) ->  | D559: of:=IF(COUNTIF([Calendario.$H$4:.$H$48];[.B559])>0;"FIESTA";"") -> FIESTA | E559: of:=IF([.B559]<>"";VLOOKUP(WEEKDAY([.B559];3);[Calendario.$A$4:.$C$11];2);"") ->  | F559: of:=IF([.B559]<>"";IF([.D559]<>"FIESTA";VLOOKUP(WEEKDAY([.B559];3);[Calendario.$A$4:.$C$11];3);0);"") ->  | G559: of:=IF(ISNUMBER([.F559]);[.F559]+[.G558];"") ->  | H559: of:=IF(AND([.G559]<=[Unidades.$G$26];[.G559]<=[Unidades.$F$18];[Unidades.$F$18]>0);[Unidades.$D$18]+1-COUNTIFS([Unidades.$O$3:.$O$17];">="&[.G559]);"") ->  | I559: of:=IF([.H558]<>[.H559];"INICIO";IF([.H560]<>[.H559];"FIN";"")) ->  | J559: of:=IF([.K558]<>[.K559];"INICIO";IF([.K560]<>[.K559];"FIN";"")) -> 
A560: of:=IF([.B560]<>"";TODAY()>[.B560];"") ->  | B560: of:=IFERROR(IF(([.B559]+1)<[Calendario.$F$5];[.B559]+1;"");"") ->  | C560: of:=IF(AND([.B560]>=[Calendario.$F$8];[.B560]<=[Calendario.$F$9];1);1;IF(AND([.B560]>=[Calendario.$F$12];[.B560]<=[Calendario.$F$13]);2;IF(AND([.B560]>=[Calendario.$F$16];[.B560]<=[Calendario.$F$17]);3;""))) ->  | D560: of:=IF(COUNTIF([Calendario.$H$4:.$H$48];[.B560])>0;"FIESTA";"") -> FIESTA | E560: of:=IF([.B560]<>"";VLOOKUP(WEEKDAY([.B560];3);[Calendario.$A$4:.$C$11];2);"") ->  | F560: of:=IF([.B560]<>"";IF([.D560]<>"FIESTA";VLOOKUP(WEEKDAY([.B560];3);[Calendario.$A$4:.$C$11];3);0);"") ->  | G560: of:=IF(ISNUMBER([.F560]);[.F560]+[.G559];"") ->  | H560: of:=IF(AND([.G560]<=[Unidades.$G$26];[.G560]<=[Unidades.$F$18];[Unidades.$F$18]>0);[Unidades.$D$18]+1-COUNTIFS([Unidades.$O$3:.$O$17];">="&[.G560]);"") ->  | I560: of:=IF([.H559]<>[.H560];"INICIO";IF([.H561]<>[.H560];"FIN";"")) ->  | J560: of:=IF([.K559]<>[.K560];"INICIO";IF([.K561]<>[.K560];"FIN";"")) -> 
A561: of:=IF([.B561]<>"";TODAY()>[.B561];"") ->  | B561: of:=IFERROR(IF(([.B560]+1)<[Calendario.$F$5];[.B560]+1;"");"") ->  | C561: of:=IF(AND([.B561]>=[Calendario.$F$8];[.B561]<=[Calendario.$F$9];1);1;IF(AND([.B561]>=[Calendario.$F$12];[.B561]<=[Calendario.$F$13]);2;IF(AND([.B561]>=[Calendario.$F$16];[.B561]<=[Calendario.$F$17]);3;""))) ->  | D561: of:=IF(COUNTIF([Calendario.$H$4:.$H$48];[.B561])>0;"FIESTA";"") -> FIESTA | E561: of:=IF([.B561]<>"";VLOOKUP(WEEKDAY([.B561];3);[Calendario.$A$4:.$C$11];2);"") ->  | F561: of:=IF([.B561]<>"";IF([.D561]<>"FIESTA";VLOOKUP(WEEKDAY([.B561];3);[Calendario.$A$4:.$C$11];3);0);"") ->  | G561: of:=IF(ISNUMBER([.F561]);[.F561]+[.G560];"") ->  | H561: of:=IF(AND([.G561]<=[Unidades.$G$26];[.G561]<=[Unidades.$F$18];[Unidades.$F$18]>0);[Unidades.$D$18]+1-COUNTIFS([Unidades.$O$3:.$O$17];">="&[.G561]);"") ->  | I561: of:=IF([.H560]<>[.H561];"INICIO";IF([.H562]<>[.H561];"FIN";"")) ->  | J561: of:=IF([.K560]<>[.K561];"INICIO";IF([.K562]<>[.K561];"FIN";"")) -> 
A562: of:=IF([.B562]<>"";TODAY()>[.B562];"") ->  | B562: of:=IFERROR(IF(([.B561]+1)<[Calendario.$F$5];[.B561]+1;"");"") ->  | C562: of:=IF(AND([.B562]>=[Calendario.$F$8];[.B562]<=[Calendario.$F$9];1);1;IF(AND([.B562]>=[Calendario.$F$12];[.B562]<=[Calendario.$F$13]);2;IF(AND([.B562]>=[Calendario.$F$16];[.B562]<=[Calendario.$F$17]);3;""))) ->  | D562: of:=IF(COUNTIF([Calendario.$H$4:.$H$48];[.B562])>0;"FIESTA";"") -> FIESTA | E562: of:=IF([.B562]<>"";VLOOKUP(WEEKDAY([.B562];3);[Calendario.$A$4:.$C$11];2);"") ->  | F562: of:=IF([.B562]<>"";IF([.D562]<>"FIESTA";VLOOKUP(WEEKDAY([.B562];3);[Calendario.$A$4:.$C$11];3);0);"") ->  | G562: of:=IF(ISNUMBER([.F562]);[.F562]+[.G561];"") ->  | H562: of:=IF(AND([.G562]<=[Unidades.$G$26];[.G562]<=[Unidades.$F$18];[Unidades.$F$18]>0);[Unidades.$D$18]+1-COUNTIFS([Unidades.$O$3:.$O$17];">="&[.G562]);"") ->  | I562: of:=IF([.H561]<>[.H562];"INICIO";IF([.H563]<>[.H562];"FIN";"")) ->  | J562: of:=IF([.K561]<>[.K562];"INICIO";IF([.K563]<>[.K562];"FIN";"")) -> 
A563: of:=IF([.B563]<>"";TODAY()>[.B563];"") ->  | B563: of:=IFERROR(IF(([.B562]+1)<[Calendario.$F$5];[.B562]+1;"");"") ->  | C563: of:=IF(AND([.B563]>=[Calendario.$F$8];[.B563]<=[Calendario.$F$9];1);1;IF(AND([.B563]>=[Calendario.$F$12];[.B563]<=[Calendario.$F$13]);2;IF(AND([.B563]>=[Calendario.$F$16];[.B563]<=[Calendario.$F$17]);3;""))) ->  | D563: of:=IF(COUNTIF([Calendario.$H$4:.$H$48];[.B563])>0;"FIESTA";"") -> FIESTA | E563: of:=IF([.B563]<>"";VLOOKUP(WEEKDAY([.B563];3);[Calendario.$A$4:.$C$11];2);"") ->  | F563: of:=IF([.B563]<>"";IF([.D563]<>"FIESTA";VLOOKUP(WEEKDAY([.B563];3);[Calendario.$A$4:.$C$11];3);0);"") ->  | G563: of:=IF(ISNUMBER([.F563]);[.F563]+[.G562];"") ->  | H563: of:=IF(AND([.G563]<=[Unidades.$G$26];[.G563]<=[Unidades.$F$18];[Unidades.$F$18]>0);[Unidades.$D$18]+1-COUNTIFS([Unidades.$O$3:.$O$17];">="&[.G563]);"") ->  | I563: of:=IF([.H562]<>[.H563];"INICIO";IF([.H564]<>[.H563];"FIN";"")) ->  | J563: of:=IF([.K562]<>[.K563];"INICIO";IF([.K564]<>[.K563];"FIN";"")) -> 
A564: of:=IF([.B564]<>"";TODAY()>[.B564];"") ->  | B564: of:=IFERROR(IF(([.B563]+1)<[Calendario.$F$5];[.B563]+1;"");"") ->  | C564: of:=IF(AND([.B564]>=[Calendario.$F$8];[.B564]<=[Calendario.$F$9];1);1;IF(AND([.B564]>=[Calendario.$F$12];[.B564]<=[Calendario.$F$13]);2;IF(AND([.B564]>=[Calendario.$F$16];[.B564]<=[Calendario.$F$17]);3;""))) ->  | D564: of:=IF(COUNTIF([Calendario.$H$4:.$H$48];[.B564])>0;"FIESTA";"") -> FIESTA | E564: of:=IF([.B564]<>"";VLOOKUP(WEEKDAY([.B564];3);[Calendario.$A$4:.$C$11];2);"") ->  | F564: of:=IF([.B564]<>"";IF([.D564]<>"FIESTA";VLOOKUP(WEEKDAY([.B564];3);[Calendario.$A$4:.$C$11];3);0);"") ->  | G564: of:=IF(ISNUMBER([.F564]);[.F564]+[.G563];"") ->  | H564: of:=IF(AND([.G564]<=[Unidades.$G$26];[.G564]<=[Unidades.$F$18];[Unidades.$F$18]>0);[Unidades.$D$18]+1-COUNTIFS([Unidades.$O$3:.$O$17];">="&[.G564]);"") ->  | I564: of:=IF([.H563]<>[.H564];"INICIO";IF([.H565]<>[.H564];"FIN";"")) ->  | J564: of:=IF([.K563]<>[.K564];"INICIO";IF([.K565]<>[.K564];"FIN";"")) -> 
A565: of:=IF([.B565]<>"";TODAY()>[.B565];"") ->  | B565: of:=IFERROR(IF(([.B564]+1)<[Calendario.$F$5];[.B564]+1;"");"") ->  | C565: of:=IF(AND([.B565]>=[Calendario.$F$8];[.B565]<=[Calendario.$F$9];1);1;IF(AND([.B565]>=[Calendario.$F$12];[.B565]<=[Calendario.$F$13]);2;IF(AND([.B565]>=[Calendario.$F$16];[.B565]<=[Calendario.$F$17]);3;""))) ->  | D565: of:=IF(COUNTIF([Calendario.$H$4:.$H$48];[.B565])>0;"FIESTA";"") -> FIESTA | E565: of:=IF([.B565]<>"";VLOOKUP(WEEKDAY([.B565];3);[Calendario.$A$4:.$C$11];2);"") ->  | F565: of:=IF([.B565]<>"";IF([.D565]<>"FIESTA";VLOOKUP(WEEKDAY([.B565];3);[Calendario.$A$4:.$C$11];3);0);"") ->  | G565: of:=IF(ISNUMBER([.F565]);[.F565]+[.G564];"") ->  | H565: of:=IF(AND([.G565]<=[Unidades.$G$26];[.G565]<=[Unidades.$F$18];[Unidades.$F$18]>0);[Unidades.$D$18]+1-COUNTIFS([Unidades.$O$3:.$O$17];">="&[.G565]);"") ->  | I565: of:=IF([.H564]<>[.H565];"INICIO";IF([.H566]<>[.H565];"FIN";"")) ->  | J565: of:=IF([.K564]<>[.K565];"INICIO";IF([.K566]<>[.K565];"FIN";"")) -> 
A566: of:=IF([.B566]<>"";TODAY()>[.B566];"") ->  | B566: of:=IFERROR(IF(([.B565]+1)<[Calendario.$F$5];[.B565]+1;"");"") ->  | C566: of:=IF(AND([.B566]>=[Calendario.$F$8];[.B566]<=[Calendario.$F$9];1);1;IF(AND([.B566]>=[Calendario.$F$12];[.B566]<=[Calendario.$F$13]);2;IF(AND([.B566]>=[Calendario.$F$16];[.B566]<=[Calendario.$F$17]);3;""))) ->  | D566: of:=IF(COUNTIF([Calendario.$H$4:.$H$48];[.B566])>0;"FIESTA";"") -> FIESTA | E566: of:=IF([.B566]<>"";VLOOKUP(WEEKDAY([.B566];3);[Calendario.$A$4:.$C$11];2);"") ->  | F566: of:=IF([.B566]<>"";IF([.D566]<>"FIESTA";VLOOKUP(WEEKDAY([.B566];3);[Calendario.$A$4:.$C$11];3);0);"") ->  | G566: of:=IF(ISNUMBER([.F566]);[.F566]+[.G565];"") ->  | H566: of:=IF(AND([.G566]<=[Unidades.$G$26];[.G566]<=[Unidades.$F$18];[Unidades.$F$18]>0);[Unidades.$D$18]+1-COUNTIFS([Unidades.$O$3:.$O$17];">="&[.G566]);"") ->  | I566: of:=IF([.H565]<>[.H566];"INICIO";IF([.H567]<>[.H566];"FIN";"")) ->  | J566: of:=IF([.K565]<>[.K566];"INICIO";IF([.K567]<>[.K566];"FIN";"")) -> 
A567: of:=IF([.B567]<>"";TODAY()>[.B567];"") ->  | B567: of:=IFERROR(IF(([.B566]+1)<[Calendario.$F$5];[.B566]+1;"");"") ->  | C567: of:=IF(AND([.B567]>=[Calendario.$F$8];[.B567]<=[Calendario.$F$9];1);1;IF(AND([.B567]>=[Calendario.$F$12];[.B567]<=[Calendario.$F$13]);2;IF(AND([.B567]>=[Calendario.$F$16];[.B567]<=[Calendario.$F$17]);3;""))) ->  | D567: of:=IF(COUNTIF([Calendario.$H$4:.$H$48];[.B567])>0;"FIESTA";"") -> FIESTA | E567: of:=IF([.B567]<>"";VLOOKUP(WEEKDAY([.B567];3);[Calendario.$A$4:.$C$11];2);"") ->  | F567: of:=IF([.B567]<>"";IF([.D567]<>"FIESTA";VLOOKUP(WEEKDAY([.B567];3);[Calendario.$A$4:.$C$11];3);0);"") ->  | G567: of:=IF(ISNUMBER([.F567]);[.F567]+[.G566];"") ->  | H567: of:=IF(AND([.G567]<=[Unidades.$G$26];[.G567]<=[Unidades.$F$18];[Unidades.$F$18]>0);[Unidades.$D$18]+1-COUNTIFS([Unidades.$O$3:.$O$17];">="&[.G567]);"") ->  | I567: of:=IF([.H566]<>[.H567];"INICIO";IF([.H568]<>[.H567];"FIN";"")) ->  | J567: of:=IF([.K566]<>[.K567];"INICIO";IF([.K568]<>[.K567];"FIN";"")) -> 
A568: of:=IF([.B568]<>"";TODAY()>[.B568];"") ->  | B568: of:=IFERROR(IF(([.B567]+1)<[Calendario.$F$5];[.B567]+1;"");"") ->  | C568: of:=IF(AND([.B568]>=[Calendario.$F$8];[.B568]<=[Calendario.$F$9];1);1;IF(AND([.B568]>=[Calendario.$F$12];[.B568]<=[Calendario.$F$13]);2;IF(AND([.B568]>=[Calendario.$F$16];[.B568]<=[Calendario.$F$17]);3;""))) ->  | D568: of:=IF(COUNTIF([Calendario.$H$4:.$H$48];[.B568])>0;"FIESTA";"") -> FIESTA | E568: of:=IF([.B568]<>"";VLOOKUP(WEEKDAY([.B568];3);[Calendario.$A$4:.$C$11];2);"") ->  | F568: of:=IF([.B568]<>"";IF([.D568]<>"FIESTA";VLOOKUP(WEEKDAY([.B568];3);[Calendario.$A$4:.$C$11];3);0);"") ->  | G568: of:=IF(ISNUMBER([.F568]);[.F568]+[.G567];"") ->  | H568: of:=IF(AND([.G568]<=[Unidades.$G$26];[.G568]<=[Unidades.$F$18];[Unidades.$F$18]>0);[Unidades.$D$18]+1-COUNTIFS([Unidades.$O$3:.$O$17];">="&[.G568]);"") ->  | I568: of:=IF([.H567]<>[.H568];"INICIO";IF([.H569]<>[.H568];"FIN";"")) ->  | J568: of:=IF([.K567]<>[.K568];"INICIO";IF([.K569]<>[.K568];"FIN";"")) -> 
A569: of:=IF([.B569]<>"";TODAY()>[.B569];"") ->  | B569: of:=IFERROR(IF(([.B568]+1)<[Calendario.$F$5];[.B568]+1;"");"") ->  | C569: of:=IF(AND([.B569]>=[Calendario.$F$8];[.B569]<=[Calendario.$F$9];1);1;IF(AND([.B569]>=[Calendario.$F$12];[.B569]<=[Calendario.$F$13]);2;IF(AND([.B569]>=[Calendario.$F$16];[.B569]<=[Calendario.$F$17]);3;""))) ->  | D569: of:=IF(COUNTIF([Calendario.$H$4:.$H$48];[.B569])>0;"FIESTA";"") -> FIESTA | E569: of:=IF([.B569]<>"";VLOOKUP(WEEKDAY([.B569];3);[Calendario.$A$4:.$C$11];2);"") ->  | F569: of:=IF([.B569]<>"";IF([.D569]<>"FIESTA";VLOOKUP(WEEKDAY([.B569];3);[Calendario.$A$4:.$C$11];3);0);"") ->  | G569: of:=IF(ISNUMBER([.F569]);[.F569]+[.G568];"") ->  | H569: of:=IF(AND([.G569]<=[Unidades.$G$26];[.G569]<=[Unidades.$F$18];[Unidades.$F$18]>0);[Unidades.$D$18]+1-COUNTIFS([Unidades.$O$3:.$O$17];">="&[.G569]);"") ->  | I569: of:=IF([.H568]<>[.H569];"INICIO";IF([.H570]<>[.H569];"FIN";"")) ->  | J569: of:=IF([.K568]<>[.K569];"INICIO";IF([.K570]<>[.K569];"FIN";"")) -> 
A570: of:=IF([.B570]<>"";TODAY()>[.B570];"") ->  | B570: of:=IFERROR(IF(([.B569]+1)<[Calendario.$F$5];[.B569]+1;"");"") ->  | C570: of:=IF(AND([.B570]>=[Calendario.$F$8];[.B570]<=[Calendario.$F$9];1);1;IF(AND([.B570]>=[Calendario.$F$12];[.B570]<=[Calendario.$F$13]);2;IF(AND([.B570]>=[Calendario.$F$16];[.B570]<=[Calendario.$F$17]);3;""))) ->  | D570: of:=IF(COUNTIF([Calendario.$H$4:.$H$48];[.B570])>0;"FIESTA";"") -> FIESTA | E570: of:=IF([.B570]<>"";VLOOKUP(WEEKDAY([.B570];3);[Calendario.$A$4:.$C$11];2);"") ->  | F570: of:=IF([.B570]<>"";IF([.D570]<>"FIESTA";VLOOKUP(WEEKDAY([.B570];3);[Calendario.$A$4:.$C$11];3);0);"") ->  | G570: of:=IF(ISNUMBER([.F570]);[.F570]+[.G569];"") ->  | H570: of:=IF(AND([.G570]<=[Unidades.$G$26];[.G570]<=[Unidades.$F$18];[Unidades.$F$18]>0);[Unidades.$D$18]+1-COUNTIFS([Unidades.$O$3:.$O$17];">="&[.G570]);"") ->  | I570: of:=IF([.H569]<>[.H570];"INICIO";IF([.H571]<>[.H570];"FIN";"")) ->  | J570: of:=IF([.K569]<>[.K570];"INICIO";IF([.K571]<>[.K570];"FIN";"")) -> 
A571: of:=IF([.B571]<>"";TODAY()>[.B571];"") ->  | B571: of:=IFERROR(IF(([.B570]+1)<[Calendario.$F$5];[.B570]+1;"");"") ->  | C571: of:=IF(AND([.B571]>=[Calendario.$F$8];[.B571]<=[Calendario.$F$9];1);1;IF(AND([.B571]>=[Calendario.$F$12];[.B571]<=[Calendario.$F$13]);2;IF(AND([.B571]>=[Calendario.$F$16];[.B571]<=[Calendario.$F$17]);3;""))) ->  | D571: of:=IF(COUNTIF([Calendario.$H$4:.$H$48];[.B571])>0;"FIESTA";"") -> FIESTA | E571: of:=IF([.B571]<>"";VLOOKUP(WEEKDAY([.B571];3);[Calendario.$A$4:.$C$11];2);"") ->  | F571: of:=IF([.B571]<>"";IF([.D571]<>"FIESTA";VLOOKUP(WEEKDAY([.B571];3);[Calendario.$A$4:.$C$11];3);0);"") ->  | G571: of:=IF(ISNUMBER([.F571]);[.F571]+[.G570];"") ->  | H571: of:=IF(AND([.G571]<=[Unidades.$G$26];[.G571]<=[Unidades.$F$18];[Unidades.$F$18]>0);[Unidades.$D$18]+1-COUNTIFS([Unidades.$O$3:.$O$17];">="&[.G571]);"") ->  | I571: of:=IF([.H570]<>[.H571];"INICIO";IF([.H572]<>[.H571];"FIN";"")) ->  | J571: of:=IF([.K570]<>[.K571];"INICIO";IF([.K572]<>[.K571];"FIN";"")) -> 
A572: of:=IF([.B572]<>"";TODAY()>[.B572];"") ->  | B572: of:=IFERROR(IF(([.B571]+1)<[Calendario.$F$5];[.B571]+1;"");"") ->  | C572: of:=IF(AND([.B572]>=[Calendario.$F$8];[.B572]<=[Calendario.$F$9];1);1;IF(AND([.B572]>=[Calendario.$F$12];[.B572]<=[Calendario.$F$13]);2;IF(AND([.B572]>=[Calendario.$F$16];[.B572]<=[Calendario.$F$17]);3;""))) ->  | D572: of:=IF(COUNTIF([Calendario.$H$4:.$H$48];[.B572])>0;"FIESTA";"") -> FIESTA | E572: of:=IF([.B572]<>"";VLOOKUP(WEEKDAY([.B572];3);[Calendario.$A$4:.$C$11];2);"") ->  | F572: of:=IF([.B572]<>"";IF([.D572]<>"FIESTA";VLOOKUP(WEEKDAY([.B572];3);[Calendario.$A$4:.$C$11];3);0);"") ->  | G572: of:=IF(ISNUMBER([.F572]);[.F572]+[.G571];"") ->  | H572: of:=IF(AND([.G572]<=[Unidades.$G$26];[.G572]<=[Unidades.$F$18];[Unidades.$F$18]>0);[Unidades.$D$18]+1-COUNTIFS([Unidades.$O$3:.$O$17];">="&[.G572]);"") ->  | I572: of:=IF([.H571]<>[.H572];"INICIO";IF([.H573]<>[.H572];"FIN";"")) ->  | J572: of:=IF([.K571]<>[.K572];"INICIO";IF([.K573]<>[.K572];"FIN";"")) -> 
A573: of:=IF([.B573]<>"";TODAY()>[.B573];"") ->  | B573: of:=IFERROR(IF(([.B572]+1)<[Calendario.$F$5];[.B572]+1;"");"") ->  | C573: of:=IF(AND([.B573]>=[Calendario.$F$8];[.B573]<=[Calendario.$F$9];1);1;IF(AND([.B573]>=[Calendario.$F$12];[.B573]<=[Calendario.$F$13]);2;IF(AND([.B573]>=[Calendario.$F$16];[.B573]<=[Calendario.$F$17]);3;""))) ->  | D573: of:=IF(COUNTIF([Calendario.$H$4:.$H$48];[.B573])>0;"FIESTA";"") -> FIESTA | E573: of:=IF([.B573]<>"";VLOOKUP(WEEKDAY([.B573];3);[Calendario.$A$4:.$C$11];2);"") ->  | F573: of:=IF([.B573]<>"";IF([.D573]<>"FIESTA";VLOOKUP(WEEKDAY([.B573];3);[Calendario.$A$4:.$C$11];3);0);"") ->  | G573: of:=IF(ISNUMBER([.F573]);[.F573]+[.G572];"") ->  | H573: of:=IF(AND([.G573]<=[Unidades.$G$26];[.G573]<=[Unidades.$F$18];[Unidades.$F$18]>0);[Unidades.$D$18]+1-COUNTIFS([Unidades.$O$3:.$O$17];">="&[.G573]);"") ->  | I573: of:=IF([.H572]<>[.H573];"INICIO";IF([.H574]<>[.H573];"FIN";"")) ->  | J573: of:=IF([.K572]<>[.K573];"INICIO";IF([.K574]<>[.K573];"FIN";"")) -> 
A574: of:=IF([.B574]<>"";TODAY()>[.B574];"") ->  | B574: of:=IFERROR(IF(([.B573]+1)<[Calendario.$F$5];[.B573]+1;"");"") ->  | C574: of:=IF(AND([.B574]>=[Calendario.$F$8];[.B574]<=[Calendario.$F$9];1);1;IF(AND([.B574]>=[Calendario.$F$12];[.B574]<=[Calendario.$F$13]);2;IF(AND([.B574]>=[Calendario.$F$16];[.B574]<=[Calendario.$F$17]);3;""))) ->  | D574: of:=IF(COUNTIF([Calendario.$H$4:.$H$48];[.B574])>0;"FIESTA";"") -> FIESTA | E574: of:=IF([.B574]<>"";VLOOKUP(WEEKDAY([.B574];3);[Calendario.$A$4:.$C$11];2);"") ->  | F574: of:=IF([.B574]<>"";IF([.D574]<>"FIESTA";VLOOKUP(WEEKDAY([.B574];3);[Calendario.$A$4:.$C$11];3);0);"") ->  | G574: of:=IF(ISNUMBER([.F574]);[.F574]+[.G573];"") ->  | H574: of:=IF(AND([.G574]<=[Unidades.$G$26];[.G574]<=[Unidades.$F$18];[Unidades.$F$18]>0);[Unidades.$D$18]+1-COUNTIFS([Unidades.$O$3:.$O$17];">="&[.G574]);"") ->  | I574: of:=IF([.H573]<>[.H574];"INICIO";IF([.H575]<>[.H574];"FIN";"")) ->  | J574: of:=IF([.K573]<>[.K574];"INICIO";IF([.K575]<>[.K574];"FIN";"")) -> 
A575: of:=IF([.B575]<>"";TODAY()>[.B575];"") ->  | B575: of:=IFERROR(IF(([.B574]+1)<[Calendario.$F$5];[.B574]+1;"");"") ->  | C575: of:=IF(AND([.B575]>=[Calendario.$F$8];[.B575]<=[Calendario.$F$9];1);1;IF(AND([.B575]>=[Calendario.$F$12];[.B575]<=[Calendario.$F$13]);2;IF(AND([.B575]>=[Calendario.$F$16];[.B575]<=[Calendario.$F$17]);3;""))) ->  | D575: of:=IF(COUNTIF([Calendario.$H$4:.$H$48];[.B575])>0;"FIESTA";"") -> FIESTA | E575: of:=IF([.B575]<>"";VLOOKUP(WEEKDAY([.B575];3);[Calendario.$A$4:.$C$11];2);"") ->  | F575: of:=IF([.B575]<>"";IF([.D575]<>"FIESTA";VLOOKUP(WEEKDAY([.B575];3);[Calendario.$A$4:.$C$11];3);0);"") ->  | G575: of:=IF(ISNUMBER([.F575]);[.F575]+[.G574];"") ->  | H575: of:=IF(AND([.G575]<=[Unidades.$G$26];[.G575]<=[Unidades.$F$18];[Unidades.$F$18]>0);[Unidades.$D$18]+1-COUNTIFS([Unidades.$O$3:.$O$17];">="&[.G575]);"") ->  | I575: of:=IF([.H574]<>[.H575];"INICIO";IF([.H576]<>[.H575];"FIN";"")) ->  | J575: of:=IF([.K574]<>[.K575];"INICIO";IF([.K576]<>[.K575];"FIN";"")) -> 
A576: of:=IF([.B576]<>"";TODAY()>[.B576];"") ->  | B576: of:=IFERROR(IF(([.B575]+1)<[Calendario.$F$5];[.B575]+1;"");"") ->  | C576: of:=IF(AND([.B576]>=[Calendario.$F$8];[.B576]<=[Calendario.$F$9];1);1;IF(AND([.B576]>=[Calendario.$F$12];[.B576]<=[Calendario.$F$13]);2;IF(AND([.B576]>=[Calendario.$F$16];[.B576]<=[Calendario.$F$17]);3;""))) ->  | D576: of:=IF(COUNTIF([Calendario.$H$4:.$H$48];[.B576])>0;"FIESTA";"") -> FIESTA | E576: of:=IF([.B576]<>"";VLOOKUP(WEEKDAY([.B576];3);[Calendario.$A$4:.$C$11];2);"") ->  | F576: of:=IF([.B576]<>"";IF([.D576]<>"FIESTA";VLOOKUP(WEEKDAY([.B576];3);[Calendario.$A$4:.$C$11];3);0);"") ->  | G576: of:=IF(ISNUMBER([.F576]);[.F576]+[.G575];"") ->  | H576: of:=IF(AND([.G576]<=[Unidades.$G$26];[.G576]<=[Unidades.$F$18];[Unidades.$F$18]>0);[Unidades.$D$18]+1-COUNTIFS([Unidades.$O$3:.$O$17];">="&[.G576]);"") ->  | I576: of:=IF([.H575]<>[.H576];"INICIO";IF([.H577]<>[.H576];"FIN";"")) ->  | J576: of:=IF([.K575]<>[.K576];"INICIO";IF([.K577]<>[.K576];"FIN";"")) -> 
A577: of:=IF([.B577]<>"";TODAY()>[.B577];"") ->  | B577: of:=IFERROR(IF(([.B576]+1)<[Calendario.$F$5];[.B576]+1;"");"") ->  | C577: of:=IF(AND([.B577]>=[Calendario.$F$8];[.B577]<=[Calendario.$F$9];1);1;IF(AND([.B577]>=[Calendario.$F$12];[.B577]<=[Calendario.$F$13]);2;IF(AND([.B577]>=[Calendario.$F$16];[.B577]<=[Calendario.$F$17]);3;""))) ->  | D577: of:=IF(COUNTIF([Calendario.$H$4:.$H$48];[.B577])>0;"FIESTA";"") -> FIESTA | E577: of:=IF([.B577]<>"";VLOOKUP(WEEKDAY([.B577];3);[Calendario.$A$4:.$C$11];2);"") ->  | F577: of:=IF([.B577]<>"";IF([.D577]<>"FIESTA";VLOOKUP(WEEKDAY([.B577];3);[Calendario.$A$4:.$C$11];3);0);"") ->  | G577: of:=IF(ISNUMBER([.F577]);[.F577]+[.G576];"") ->  | H577: of:=IF(AND([.G577]<=[Unidades.$G$26];[.G577]<=[Unidades.$F$18];[Unidades.$F$18]>0);[Unidades.$D$18]+1-COUNTIFS([Unidades.$O$3:.$O$17];">="&[.G577]);"") ->  | I577: of:=IF([.H576]<>[.H577];"INICIO";IF([.H578]<>[.H577];"FIN";"")) ->  | J577: of:=IF([.K576]<>[.K577];"INICIO";IF([.K578]<>[.K577];"FIN";"")) -> 
A578: of:=IF([.B578]<>"";TODAY()>[.B578];"") ->  | B578: of:=IFERROR(IF(([.B577]+1)<[Calendario.$F$5];[.B577]+1;"");"") ->  | C578: of:=IF(AND([.B578]>=[Calendario.$F$8];[.B578]<=[Calendario.$F$9];1);1;IF(AND([.B578]>=[Calendario.$F$12];[.B578]<=[Calendario.$F$13]);2;IF(AND([.B578]>=[Calendario.$F$16];[.B578]<=[Calendario.$F$17]);3;""))) ->  | D578: of:=IF(COUNTIF([Calendario.$H$4:.$H$48];[.B578])>0;"FIESTA";"") -> FIESTA | E578: of:=IF([.B578]<>"";VLOOKUP(WEEKDAY([.B578];3);[Calendario.$A$4:.$C$11];2);"") ->  | F578: of:=IF([.B578]<>"";IF([.D578]<>"FIESTA";VLOOKUP(WEEKDAY([.B578];3);[Calendario.$A$4:.$C$11];3);0);"") ->  | G578: of:=IF(ISNUMBER([.F578]);[.F578]+[.G577];"") ->  | H578: of:=IF(AND([.G578]<=[Unidades.$G$26];[.G578]<=[Unidades.$F$18];[Unidades.$F$18]>0);[Unidades.$D$18]+1-COUNTIFS([Unidades.$O$3:.$O$17];">="&[.G578]);"") ->  | I578: of:=IF([.H577]<>[.H578];"INICIO";IF([.H579]<>[.H578];"FIN";"")) ->  | J578: of:=IF([.K577]<>[.K578];"INICIO";IF([.K579]<>[.K578];"FIN";"")) -> 
A579: of:=IF([.B579]<>"";TODAY()>[.B579];"") ->  | B579: of:=IFERROR(IF(([.B578]+1)<[Calendario.$F$5];[.B578]+1;"");"") ->  | C579: of:=IF(AND([.B579]>=[Calendario.$F$8];[.B579]<=[Calendario.$F$9];1);1;IF(AND([.B579]>=[Calendario.$F$12];[.B579]<=[Calendario.$F$13]);2;IF(AND([.B579]>=[Calendario.$F$16];[.B579]<=[Calendario.$F$17]);3;""))) ->  | D579: of:=IF(COUNTIF([Calendario.$H$4:.$H$48];[.B579])>0;"FIESTA";"") -> FIESTA | E579: of:=IF([.B579]<>"";VLOOKUP(WEEKDAY([.B579];3);[Calendario.$A$4:.$C$11];2);"") ->  | F579: of:=IF([.B579]<>"";IF([.D579]<>"FIESTA";VLOOKUP(WEEKDAY([.B579];3);[Calendario.$A$4:.$C$11];3);0);"") ->  | G579: of:=IF(ISNUMBER([.F579]);[.F579]+[.G578];"") ->  | H579: of:=IF(AND([.G579]<=[Unidades.$G$26];[.G579]<=[Unidades.$F$18];[Unidades.$F$18]>0);[Unidades.$D$18]+1-COUNTIFS([Unidades.$O$3:.$O$17];">="&[.G579]);"") ->  | I579: of:=IF([.H578]<>[.H579];"INICIO";IF([.H580]<>[.H579];"FIN";"")) ->  | J579: of:=IF([.K578]<>[.K579];"INICIO";IF([.K580]<>[.K579];"FIN";"")) -> 
A580: of:=IF([.B580]<>"";TODAY()>[.B580];"") ->  | B580: of:=IFERROR(IF(([.B579]+1)<[Calendario.$F$5];[.B579]+1;"");"") ->  | C580: of:=IF(AND([.B580]>=[Calendario.$F$8];[.B580]<=[Calendario.$F$9];1);1;IF(AND([.B580]>=[Calendario.$F$12];[.B580]<=[Calendario.$F$13]);2;IF(AND([.B580]>=[Calendario.$F$16];[.B580]<=[Calendario.$F$17]);3;""))) ->  | D580: of:=IF(COUNTIF([Calendario.$H$4:.$H$48];[.B580])>0;"FIESTA";"") -> FIESTA | E580: of:=IF([.B580]<>"";VLOOKUP(WEEKDAY([.B580];3);[Calendario.$A$4:.$C$11];2);"") ->  | F580: of:=IF([.B580]<>"";IF([.D580]<>"FIESTA";VLOOKUP(WEEKDAY([.B580];3);[Calendario.$A$4:.$C$11];3);0);"") ->  | G580: of:=IF(ISNUMBER([.F580]);[.F580]+[.G579];"") ->  | H580: of:=IF(AND([.G580]<=[Unidades.$G$26];[.G580]<=[Unidades.$F$18];[Unidades.$F$18]>0);[Unidades.$D$18]+1-COUNTIFS([Unidades.$O$3:.$O$17];">="&[.G580]);"") ->  | I580: of:=IF([.H579]<>[.H580];"INICIO";IF([.H581]<>[.H580];"FIN";"")) ->  | J580: of:=IF([.K579]<>[.K580];"INICIO";IF([.K581]<>[.K580];"FIN";"")) -> 
A581: of:=IF([.B581]<>"";TODAY()>[.B581];"") ->  | B581: of:=IFERROR(IF(([.B580]+1)<[Calendario.$F$5];[.B580]+1;"");"") ->  | C581: of:=IF(AND([.B581]>=[Calendario.$F$8];[.B581]<=[Calendario.$F$9];1);1;IF(AND([.B581]>=[Calendario.$F$12];[.B581]<=[Calendario.$F$13]);2;IF(AND([.B581]>=[Calendario.$F$16];[.B581]<=[Calendario.$F$17]);3;""))) ->  | D581: of:=IF(COUNTIF([Calendario.$H$4:.$H$48];[.B581])>0;"FIESTA";"") -> FIESTA | E581: of:=IF([.B581]<>"";VLOOKUP(WEEKDAY([.B581];3);[Calendario.$A$4:.$C$11];2);"") ->  | F581: of:=IF([.B581]<>"";IF([.D581]<>"FIESTA";VLOOKUP(WEEKDAY([.B581];3);[Calendario.$A$4:.$C$11];3);0);"") ->  | G581: of:=IF(ISNUMBER([.F581]);[.F581]+[.G580];"") ->  | H581: of:=IF(AND([.G581]<=[Unidades.$G$26];[.G581]<=[Unidades.$F$18];[Unidades.$F$18]>0);[Unidades.$D$18]+1-COUNTIFS([Unidades.$O$3:.$O$17];">="&[.G581]);"") ->  | I581: of:=IF([.H580]<>[.H581];"INICIO";IF([.H582]<>[.H581];"FIN";"")) ->  | J581: of:=IF([.K580]<>[.K581];"INICIO";IF([.K582]<>[.K581];"FIN";"")) -> 
A582: of:=IF([.B582]<>"";TODAY()>[.B582];"") ->  | B582: of:=IFERROR(IF(([.B581]+1)<[Calendario.$F$5];[.B581]+1;"");"") ->  | C582: of:=IF(AND([.B582]>=[Calendario.$F$8];[.B582]<=[Calendario.$F$9];1);1;IF(AND([.B582]>=[Calendario.$F$12];[.B582]<=[Calendario.$F$13]);2;IF(AND([.B582]>=[Calendario.$F$16];[.B582]<=[Calendario.$F$17]);3;""))) ->  | D582: of:=IF(COUNTIF([Calendario.$H$4:.$H$48];[.B582])>0;"FIESTA";"") -> FIESTA | E582: of:=IF([.B582]<>"";VLOOKUP(WEEKDAY([.B582];3);[Calendario.$A$4:.$C$11];2);"") ->  | F582: of:=IF([.B582]<>"";IF([.D582]<>"FIESTA";VLOOKUP(WEEKDAY([.B582];3);[Calendario.$A$4:.$C$11];3);0);"") ->  | G582: of:=IF(ISNUMBER([.F582]);[.F582]+[.G581];"") ->  | H582: of:=IF(AND([.G582]<=[Unidades.$G$26];[.G582]<=[Unidades.$F$18];[Unidades.$F$18]>0);[Unidades.$D$18]+1-COUNTIFS([Unidades.$O$3:.$O$17];">="&[.G582]);"") ->  | I582: of:=IF([.H581]<>[.H582];"INICIO";IF([.H583]<>[.H582];"FIN";"")) ->  | J582: of:=IF([.K581]<>[.K582];"INICIO";IF([.K583]<>[.K582];"FIN";"")) -> 
A583: of:=IF([.B583]<>"";TODAY()>[.B583];"") ->  | B583: of:=IFERROR(IF(([.B582]+1)<[Calendario.$F$5];[.B582]+1;"");"") ->  | C583: of:=IF(AND([.B583]>=[Calendario.$F$8];[.B583]<=[Calendario.$F$9];1);1;IF(AND([.B583]>=[Calendario.$F$12];[.B583]<=[Calendario.$F$13]);2;IF(AND([.B583]>=[Calendario.$F$16];[.B583]<=[Calendario.$F$17]);3;""))) ->  | D583: of:=IF(COUNTIF([Calendario.$H$4:.$H$48];[.B583])>0;"FIESTA";"") -> FIESTA | E583: of:=IF([.B583]<>"";VLOOKUP(WEEKDAY([.B583];3);[Calendario.$A$4:.$C$11];2);"") ->  | F583: of:=IF([.B583]<>"";IF([.D583]<>"FIESTA";VLOOKUP(WEEKDAY([.B583];3);[Calendario.$A$4:.$C$11];3);0);"") ->  | G583: of:=IF(ISNUMBER([.F583]);[.F583]+[.G582];"") ->  | H583: of:=IF(AND([.G583]<=[Unidades.$G$26];[.G583]<=[Unidades.$F$18];[Unidades.$F$18]>0);[Unidades.$D$18]+1-COUNTIFS([Unidades.$O$3:.$O$17];">="&[.G583]);"") ->  | I583: of:=IF([.H582]<>[.H583];"INICIO";IF([.H584]<>[.H583];"FIN";"")) ->  | J583: of:=IF([.K582]<>[.K583];"INICIO";IF([.K584]<>[.K583];"FIN";"")) -> 
A584: of:=IF([.B584]<>"";TODAY()>[.B584];"") ->  | B584: of:=IFERROR(IF(([.B583]+1)<[Calendario.$F$5];[.B583]+1;"");"") ->  | C584: of:=IF(AND([.B584]>=[Calendario.$F$8];[.B584]<=[Calendario.$F$9];1);1;IF(AND([.B584]>=[Calendario.$F$12];[.B584]<=[Calendario.$F$13]);2;IF(AND([.B584]>=[Calendario.$F$16];[.B584]<=[Calendario.$F$17]);3;""))) ->  | D584: of:=IF(COUNTIF([Calendario.$H$4:.$H$48];[.B584])>0;"FIESTA";"") -> FIESTA | E584: of:=IF([.B584]<>"";VLOOKUP(WEEKDAY([.B584];3);[Calendario.$A$4:.$C$11];2);"") ->  | F584: of:=IF([.B584]<>"";IF([.D584]<>"FIESTA";VLOOKUP(WEEKDAY([.B584];3);[Calendario.$A$4:.$C$11];3);0);"") ->  | G584: of:=IF(ISNUMBER([.F584]);[.F584]+[.G583];"") ->  | H584: of:=IF(AND([.G584]<=[Unidades.$G$26];[.G584]<=[Unidades.$F$18];[Unidades.$F$18]>0);[Unidades.$D$18]+1-COUNTIFS([Unidades.$O$3:.$O$17];">="&[.G584]);"") ->  | I584: of:=IF([.H583]<>[.H584];"INICIO";IF([.H585]<>[.H584];"FIN";"")) ->  | J584: of:=IF([.K583]<>[.K584];"INICIO";IF([.K585]<>[.K584];"FIN";"")) -> 
A585: of:=IF([.B585]<>"";TODAY()>[.B585];"") ->  | B585: of:=IFERROR(IF(([.B584]+1)<[Calendario.$F$5];[.B584]+1;"");"") ->  | C585: of:=IF(AND([.B585]>=[Calendario.$F$8];[.B585]<=[Calendario.$F$9];1);1;IF(AND([.B585]>=[Calendario.$F$12];[.B585]<=[Calendario.$F$13]);2;IF(AND([.B585]>=[Calendario.$F$16];[.B585]<=[Calendario.$F$17]);3;""))) ->  | D585: of:=IF(COUNTIF([Calendario.$H$4:.$H$48];[.B585])>0;"FIESTA";"") -> FIESTA | E585: of:=IF([.B585]<>"";VLOOKUP(WEEKDAY([.B585];3);[Calendario.$A$4:.$C$11];2);"") ->  | F585: of:=IF([.B585]<>"";IF([.D585]<>"FIESTA";VLOOKUP(WEEKDAY([.B585];3);[Calendario.$A$4:.$C$11];3);0);"") ->  | G585: of:=IF(ISNUMBER([.F585]);[.F585]+[.G584];"") ->  | H585: of:=IF(AND([.G585]<=[Unidades.$G$26];[.G585]<=[Unidades.$F$18];[Unidades.$F$18]>0);[Unidades.$D$18]+1-COUNTIFS([Unidades.$O$3:.$O$17];">="&[.G585]);"") ->  | I585: of:=IF([.H584]<>[.H585];"INICIO";IF([.H586]<>[.H585];"FIN";"")) ->  | J585: of:=IF([.K584]<>[.K585];"INICIO";IF([.K586]<>[.K585];"FIN";"")) -> 
A586: of:=IF([.B586]<>"";TODAY()>[.B586];"") ->  | B586: of:=IFERROR(IF(([.B585]+1)<[Calendario.$F$5];[.B585]+1;"");"") ->  | C586: of:=IF(AND([.B586]>=[Calendario.$F$8];[.B586]<=[Calendario.$F$9];1);1;IF(AND([.B586]>=[Calendario.$F$12];[.B586]<=[Calendario.$F$13]);2;IF(AND([.B586]>=[Calendario.$F$16];[.B586]<=[Calendario.$F$17]);3;""))) ->  | D586: of:=IF(COUNTIF([Calendario.$H$4:.$H$48];[.B586])>0;"FIESTA";"") -> FIESTA | E586: of:=IF([.B586]<>"";VLOOKUP(WEEKDAY([.B586];3);[Calendario.$A$4:.$C$11];2);"") ->  | F586: of:=IF([.B586]<>"";IF([.D586]<>"FIESTA";VLOOKUP(WEEKDAY([.B586];3);[Calendario.$A$4:.$C$11];3);0);"") ->  | G586: of:=IF(ISNUMBER([.F586]);[.F586]+[.G585];"") ->  | H586: of:=IF(AND([.G586]<=[Unidades.$G$26];[.G586]<=[Unidades.$F$18];[Unidades.$F$18]>0);[Unidades.$D$18]+1-COUNTIFS([Unidades.$O$3:.$O$17];">="&[.G586]);"") ->  | I586: of:=IF([.H585]<>[.H586];"INICIO";IF([.H587]<>[.H586];"FIN";"")) ->  | J586: of:=IF([.K585]<>[.K586];"INICIO";IF([.K587]<>[.K586];"FIN";"")) -> 
A587: of:=IF([.B587]<>"";TODAY()>[.B587];"") ->  | B587: of:=IFERROR(IF(([.B586]+1)<[Calendario.$F$5];[.B586]+1;"");"") ->  | C587: of:=IF(AND([.B587]>=[Calendario.$F$8];[.B587]<=[Calendario.$F$9];1);1;IF(AND([.B587]>=[Calendario.$F$12];[.B587]<=[Calendario.$F$13]);2;IF(AND([.B587]>=[Calendario.$F$16];[.B587]<=[Calendario.$F$17]);3;""))) ->  | D587: of:=IF(COUNTIF([Calendario.$H$4:.$H$48];[.B587])>0;"FIESTA";"") -> FIESTA | E587: of:=IF([.B587]<>"";VLOOKUP(WEEKDAY([.B587];3);[Calendario.$A$4:.$C$11];2);"") ->  | F587: of:=IF([.B587]<>"";IF([.D587]<>"FIESTA";VLOOKUP(WEEKDAY([.B587];3);[Calendario.$A$4:.$C$11];3);0);"") ->  | G587: of:=IF(ISNUMBER([.F587]);[.F587]+[.G586];"") ->  | H587: of:=IF(AND([.G587]<=[Unidades.$G$26];[.G587]<=[Unidades.$F$18];[Unidades.$F$18]>0);[Unidades.$D$18]+1-COUNTIFS([Unidades.$O$3:.$O$17];">="&[.G587]);"") ->  | I587: of:=IF([.H586]<>[.H587];"INICIO";IF([.H588]<>[.H587];"FIN";"")) ->  | J587: of:=IF([.K586]<>[.K587];"INICIO";IF([.K588]<>[.K587];"FIN";"")) -> 
A588: of:=IF([.B588]<>"";TODAY()>[.B588];"") ->  | B588: of:=IFERROR(IF(([.B587]+1)<[Calendario.$F$5];[.B587]+1;"");"") ->  | C588: of:=IF(AND([.B588]>=[Calendario.$F$8];[.B588]<=[Calendario.$F$9];1);1;IF(AND([.B588]>=[Calendario.$F$12];[.B588]<=[Calendario.$F$13]);2;IF(AND([.B588]>=[Calendario.$F$16];[.B588]<=[Calendario.$F$17]);3;""))) ->  | D588: of:=IF(COUNTIF([Calendario.$H$4:.$H$48];[.B588])>0;"FIESTA";"") -> FIESTA | E588: of:=IF([.B588]<>"";VLOOKUP(WEEKDAY([.B588];3);[Calendario.$A$4:.$C$11];2);"") ->  | F588: of:=IF([.B588]<>"";IF([.D588]<>"FIESTA";VLOOKUP(WEEKDAY([.B588];3);[Calendario.$A$4:.$C$11];3);0);"") ->  | G588: of:=IF(ISNUMBER([.F588]);[.F588]+[.G587];"") ->  | H588: of:=IF(AND([.G588]<=[Unidades.$G$26];[.G588]<=[Unidades.$F$18];[Unidades.$F$18]>0);[Unidades.$D$18]+1-COUNTIFS([Unidades.$O$3:.$O$17];">="&[.G588]);"") ->  | I588: of:=IF([.H587]<>[.H588];"INICIO";IF([.H589]<>[.H588];"FIN";"")) ->  | J588: of:=IF([.K587]<>[.K588];"INICIO";IF([.K589]<>[.K588];"FIN";"")) -> 
A589: of:=IF([.B589]<>"";TODAY()>[.B589];"") ->  | B589: of:=IFERROR(IF(([.B588]+1)<[Calendario.$F$5];[.B588]+1;"");"") ->  | C589: of:=IF(AND([.B589]>=[Calendario.$F$8];[.B589]<=[Calendario.$F$9];1);1;IF(AND([.B589]>=[Calendario.$F$12];[.B589]<=[Calendario.$F$13]);2;IF(AND([.B589]>=[Calendario.$F$16];[.B589]<=[Calendario.$F$17]);3;""))) ->  | D589: of:=IF(COUNTIF([Calendario.$H$4:.$H$48];[.B589])>0;"FIESTA";"") -> FIESTA | E589: of:=IF([.B589]<>"";VLOOKUP(WEEKDAY([.B589];3);[Calendario.$A$4:.$C$11];2);"") ->  | F589: of:=IF([.B589]<>"";IF([.D589]<>"FIESTA";VLOOKUP(WEEKDAY([.B589];3);[Calendario.$A$4:.$C$11];3);0);"") ->  | G589: of:=IF(ISNUMBER([.F589]);[.F589]+[.G588];"") ->  | H589: of:=IF(AND([.G589]<=[Unidades.$G$26];[.G589]<=[Unidades.$F$18];[Unidades.$F$18]>0);[Unidades.$D$18]+1-COUNTIFS([Unidades.$O$3:.$O$17];">="&[.G589]);"") ->  | I589: of:=IF([.H588]<>[.H589];"INICIO";IF([.H590]<>[.H589];"FIN";"")) ->  | J589: of:=IF([.K588]<>[.K589];"INICIO";IF([.K590]<>[.K589];"FIN";"")) -> 
A590: of:=IF([.B590]<>"";TODAY()>[.B590];"") ->  | B590: of:=IFERROR(IF(([.B589]+1)<[Calendario.$F$5];[.B589]+1;"");"") ->  | C590: of:=IF(AND([.B590]>=[Calendario.$F$8];[.B590]<=[Calendario.$F$9];1);1;IF(AND([.B590]>=[Calendario.$F$12];[.B590]<=[Calendario.$F$13]);2;IF(AND([.B590]>=[Calendario.$F$16];[.B590]<=[Calendario.$F$17]);3;""))) ->  | D590: of:=IF(COUNTIF([Calendario.$H$4:.$H$48];[.B590])>0;"FIESTA";"") -> FIESTA | E590: of:=IF([.B590]<>"";VLOOKUP(WEEKDAY([.B590];3);[Calendario.$A$4:.$C$11];2);"") ->  | F590: of:=IF([.B590]<>"";IF([.D590]<>"FIESTA";VLOOKUP(WEEKDAY([.B590];3);[Calendario.$A$4:.$C$11];3);0);"") ->  | G590: of:=IF(ISNUMBER([.F590]);[.F590]+[.G589];"") ->  | H590: of:=IF(AND([.G590]<=[Unidades.$G$26];[.G590]<=[Unidades.$F$18];[Unidades.$F$18]>0);[Unidades.$D$18]+1-COUNTIFS([Unidades.$O$3:.$O$17];">="&[.G590]);"") ->  | I590: of:=IF([.H589]<>[.H590];"INICIO";IF([.H591]<>[.H590];"FIN";"")) ->  | J590: of:=IF([.K589]<>[.K590];"INICIO";IF([.K591]<>[.K590];"FIN";"")) -> 
A591: of:=IF([.B591]<>"";TODAY()>[.B591];"") ->  | B591: of:=IFERROR(IF(([.B590]+1)<[Calendario.$F$5];[.B590]+1;"");"") ->  | C591: of:=IF(AND([.B591]>=[Calendario.$F$8];[.B591]<=[Calendario.$F$9];1);1;IF(AND([.B591]>=[Calendario.$F$12];[.B591]<=[Calendario.$F$13]);2;IF(AND([.B591]>=[Calendario.$F$16];[.B591]<=[Calendario.$F$17]);3;""))) ->  | D591: of:=IF(COUNTIF([Calendario.$H$4:.$H$48];[.B591])>0;"FIESTA";"") -> FIESTA | E591: of:=IF([.B591]<>"";VLOOKUP(WEEKDAY([.B591];3);[Calendario.$A$4:.$C$11];2);"") ->  | F591: of:=IF([.B591]<>"";IF([.D591]<>"FIESTA";VLOOKUP(WEEKDAY([.B591];3);[Calendario.$A$4:.$C$11];3);0);"") ->  | G591: of:=IF(ISNUMBER([.F591]);[.F591]+[.G590];"") ->  | H591: of:=IF(AND([.G591]<=[Unidades.$G$26];[.G591]<=[Unidades.$F$18];[Unidades.$F$18]>0);[Unidades.$D$18]+1-COUNTIFS([Unidades.$O$3:.$O$17];">="&[.G591]);"") ->  | I591: of:=IF([.H590]<>[.H591];"INICIO";IF([.H592]<>[.H591];"FIN";"")) ->  | J591: of:=IF([.K590]<>[.K591];"INICIO";IF([.K592]<>[.K591];"FIN";"")) -> 
A592: of:=IF([.B592]<>"";TODAY()>[.B592];"") ->  | B592: of:=IFERROR(IF(([.B591]+1)<[Calendario.$F$5];[.B591]+1;"");"") ->  | C592: of:=IF(AND([.B592]>=[Calendario.$F$8];[.B592]<=[Calendario.$F$9];1);1;IF(AND([.B592]>=[Calendario.$F$12];[.B592]<=[Calendario.$F$13]);2;IF(AND([.B592]>=[Calendario.$F$16];[.B592]<=[Calendario.$F$17]);3;""))) ->  | D592: of:=IF(COUNTIF([Calendario.$H$4:.$H$48];[.B592])>0;"FIESTA";"") -> FIESTA | E592: of:=IF([.B592]<>"";VLOOKUP(WEEKDAY([.B592];3);[Calendario.$A$4:.$C$11];2);"") ->  | F592: of:=IF([.B592]<>"";IF([.D592]<>"FIESTA";VLOOKUP(WEEKDAY([.B592];3);[Calendario.$A$4:.$C$11];3);0);"") ->  | G592: of:=IF(ISNUMBER([.F592]);[.F592]+[.G591];"") ->  | H592: of:=IF(AND([.G592]<=[Unidades.$G$26];[.G592]<=[Unidades.$F$18];[Unidades.$F$18]>0);[Unidades.$D$18]+1-COUNTIFS([Unidades.$O$3:.$O$17];">="&[.G592]);"") ->  | I592: of:=IF([.H591]<>[.H592];"INICIO";IF([.H593]<>[.H592];"FIN";"")) ->  | J592: of:=IF([.K591]<>[.K592];"INICIO";IF([.K593]<>[.K592];"FIN";"")) -> 
A593: of:=IF([.B593]<>"";TODAY()>[.B593];"") ->  | B593: of:=IFERROR(IF(([.B592]+1)<[Calendario.$F$5];[.B592]+1;"");"") ->  | C593: of:=IF(AND([.B593]>=[Calendario.$F$8];[.B593]<=[Calendario.$F$9];1);1;IF(AND([.B593]>=[Calendario.$F$12];[.B593]<=[Calendario.$F$13]);2;IF(AND([.B593]>=[Calendario.$F$16];[.B593]<=[Calendario.$F$17]);3;""))) ->  | D593: of:=IF(COUNTIF([Calendario.$H$4:.$H$48];[.B593])>0;"FIESTA";"") -> FIESTA | E593: of:=IF([.B593]<>"";VLOOKUP(WEEKDAY([.B593];3);[Calendario.$A$4:.$C$11];2);"") ->  | F593: of:=IF([.B593]<>"";IF([.D593]<>"FIESTA";VLOOKUP(WEEKDAY([.B593];3);[Calendario.$A$4:.$C$11];3);0);"") ->  | G593: of:=IF(ISNUMBER([.F593]);[.F593]+[.G592];"") ->  | H593: of:=IF(AND([.G593]<=[Unidades.$G$26];[.G593]<=[Unidades.$F$18];[Unidades.$F$18]>0);[Unidades.$D$18]+1-COUNTIFS([Unidades.$O$3:.$O$17];">="&[.G593]);"") ->  | I593: of:=IF([.H592]<>[.H593];"INICIO";IF([.H594]<>[.H593];"FIN";"")) ->  | J593: of:=IF([.K592]<>[.K593];"INICIO";IF([.K594]<>[.K593];"FIN";"")) -> 
A594: of:=IF([.B594]<>"";TODAY()>[.B594];"") ->  | B594: of:=IFERROR(IF(([.B593]+1)<[Calendario.$F$5];[.B593]+1;"");"") ->  | C594: of:=IF(AND([.B594]>=[Calendario.$F$8];[.B594]<=[Calendario.$F$9];1);1;IF(AND([.B594]>=[Calendario.$F$12];[.B594]<=[Calendario.$F$13]);2;IF(AND([.B594]>=[Calendario.$F$16];[.B594]<=[Calendario.$F$17]);3;""))) ->  | D594: of:=IF(COUNTIF([Calendario.$H$4:.$H$48];[.B594])>0;"FIESTA";"") -> FIESTA | E594: of:=IF([.B594]<>"";VLOOKUP(WEEKDAY([.B594];3);[Calendario.$A$4:.$C$11];2);"") ->  | F594: of:=IF([.B594]<>"";IF([.D594]<>"FIESTA";VLOOKUP(WEEKDAY([.B594];3);[Calendario.$A$4:.$C$11];3);0);"") ->  | G594: of:=IF(ISNUMBER([.F594]);[.F594]+[.G593];"") ->  | H594: of:=IF(AND([.G594]<=[Unidades.$G$26];[.G594]<=[Unidades.$F$18];[Unidades.$F$18]>0);[Unidades.$D$18]+1-COUNTIFS([Unidades.$O$3:.$O$17];">="&[.G594]);"") ->  | I594: of:=IF([.H593]<>[.H594];"INICIO";IF([.H595]<>[.H594];"FIN";"")) ->  | J594: of:=IF([.K593]<>[.K594];"INICIO";IF([.K595]<>[.K594];"FIN";"")) -> 
A595: of:=IF([.B595]<>"";TODAY()>[.B595];"") ->  | B595: of:=IFERROR(IF(([.B594]+1)<[Calendario.$F$5];[.B594]+1;"");"") ->  | C595: of:=IF(AND([.B595]>=[Calendario.$F$8];[.B595]<=[Calendario.$F$9];1);1;IF(AND([.B595]>=[Calendario.$F$12];[.B595]<=[Calendario.$F$13]);2;IF(AND([.B595]>=[Calendario.$F$16];[.B595]<=[Calendario.$F$17]);3;""))) ->  | D595: of:=IF(COUNTIF([Calendario.$H$4:.$H$48];[.B595])>0;"FIESTA";"") -> FIESTA | E595: of:=IF([.B595]<>"";VLOOKUP(WEEKDAY([.B595];3);[Calendario.$A$4:.$C$11];2);"") ->  | F595: of:=IF([.B595]<>"";IF([.D595]<>"FIESTA";VLOOKUP(WEEKDAY([.B595];3);[Calendario.$A$4:.$C$11];3);0);"") ->  | G595: of:=IF(ISNUMBER([.F595]);[.F595]+[.G594];"") ->  | H595: of:=IF(AND([.G595]<=[Unidades.$G$26];[.G595]<=[Unidades.$F$18];[Unidades.$F$18]>0);[Unidades.$D$18]+1-COUNTIFS([Unidades.$O$3:.$O$17];">="&[.G595]);"") ->  | I595: of:=IF([.H594]<>[.H595];"INICIO";IF([.H596]<>[.H595];"FIN";"")) ->  | J595: of:=IF([.K594]<>[.K595];"INICIO";IF([.K596]<>[.K595];"FIN";"")) -> 
A596: of:=IF([.B596]<>"";TODAY()>[.B596];"") ->  | B596: of:=IFERROR(IF(([.B595]+1)<[Calendario.$F$5];[.B595]+1;"");"") ->  | C596: of:=IF(AND([.B596]>=[Calendario.$F$8];[.B596]<=[Calendario.$F$9];1);1;IF(AND([.B596]>=[Calendario.$F$12];[.B596]<=[Calendario.$F$13]);2;IF(AND([.B596]>=[Calendario.$F$16];[.B596]<=[Calendario.$F$17]);3;""))) ->  | D596: of:=IF(COUNTIF([Calendario.$H$4:.$H$48];[.B596])>0;"FIESTA";"") -> FIESTA | E596: of:=IF([.B596]<>"";VLOOKUP(WEEKDAY([.B596];3);[Calendario.$A$4:.$C$11];2);"") ->  | F596: of:=IF([.B596]<>"";IF([.D596]<>"FIESTA";VLOOKUP(WEEKDAY([.B596];3);[Calendario.$A$4:.$C$11];3);0);"") ->  | G596: of:=IF(ISNUMBER([.F596]);[.F596]+[.G595];"") ->  | H596: of:=IF(AND([.G596]<=[Unidades.$G$26];[.G596]<=[Unidades.$F$18];[Unidades.$F$18]>0);[Unidades.$D$18]+1-COUNTIFS([Unidades.$O$3:.$O$17];">="&[.G596]);"") ->  | I596: of:=IF([.H595]<>[.H596];"INICIO";IF([.H597]<>[.H596];"FIN";"")) ->  | J596: of:=IF([.K595]<>[.K596];"INICIO";IF([.K597]<>[.K596];"FIN";"")) -> 
A597: of:=IF([.B597]<>"";TODAY()>[.B597];"") ->  | B597: of:=IFERROR(IF(([.B596]+1)<[Calendario.$F$5];[.B596]+1;"");"") ->  | C597: of:=IF(AND([.B597]>=[Calendario.$F$8];[.B597]<=[Calendario.$F$9];1);1;IF(AND([.B597]>=[Calendario.$F$12];[.B597]<=[Calendario.$F$13]);2;IF(AND([.B597]>=[Calendario.$F$16];[.B597]<=[Calendario.$F$17]);3;""))) ->  | D597: of:=IF(COUNTIF([Calendario.$H$4:.$H$48];[.B597])>0;"FIESTA";"") -> FIESTA | E597: of:=IF([.B597]<>"";VLOOKUP(WEEKDAY([.B597];3);[Calendario.$A$4:.$C$11];2);"") ->  | F597: of:=IF([.B597]<>"";IF([.D597]<>"FIESTA";VLOOKUP(WEEKDAY([.B597];3);[Calendario.$A$4:.$C$11];3);0);"") ->  | G597: of:=IF(ISNUMBER([.F597]);[.F597]+[.G596];"") ->  | H597: of:=IF(AND([.G597]<=[Unidades.$G$26];[.G597]<=[Unidades.$F$18];[Unidades.$F$18]>0);[Unidades.$D$18]+1-COUNTIFS([Unidades.$O$3:.$O$17];">="&[.G597]);"") ->  | I597: of:=IF([.H596]<>[.H597];"INICIO";IF([.H598]<>[.H597];"FIN";"")) ->  | J597: of:=IF([.K596]<>[.K597];"INICIO";IF([.K598]<>[.K597];"FIN";"")) -> 
A598: of:=IF([.B598]<>"";TODAY()>[.B598];"") ->  | B598: of:=IFERROR(IF(([.B597]+1)<[Calendario.$F$5];[.B597]+1;"");"") ->  | C598: of:=IF(AND([.B598]>=[Calendario.$F$8];[.B598]<=[Calendario.$F$9];1);1;IF(AND([.B598]>=[Calendario.$F$12];[.B598]<=[Calendario.$F$13]);2;IF(AND([.B598]>=[Calendario.$F$16];[.B598]<=[Calendario.$F$17]);3;""))) ->  | D598: of:=IF(COUNTIF([Calendario.$H$4:.$H$48];[.B598])>0;"FIESTA";"") -> FIESTA | E598: of:=IF([.B598]<>"";VLOOKUP(WEEKDAY([.B598];3);[Calendario.$A$4:.$C$11];2);"") ->  | F598: of:=IF([.B598]<>"";IF([.D598]<>"FIESTA";VLOOKUP(WEEKDAY([.B598];3);[Calendario.$A$4:.$C$11];3);0);"") ->  | G598: of:=IF(ISNUMBER([.F598]);[.F598]+[.G597];"") ->  | H598: of:=IF(AND([.G598]<=[Unidades.$G$26];[.G598]<=[Unidades.$F$18];[Unidades.$F$18]>0);[Unidades.$D$18]+1-COUNTIFS([Unidades.$O$3:.$O$17];">="&[.G598]);"") ->  | I598: of:=IF([.H597]<>[.H598];"INICIO";IF([.H599]<>[.H598];"FIN";"")) ->  | J598: of:=IF([.K597]<>[.K598];"INICIO";IF([.K599]<>[.K598];"FIN";"")) -> 
A599: of:=IF([.B599]<>"";TODAY()>[.B599];"") ->  | B599: of:=IFERROR(IF(([.B598]+1)<[Calendario.$F$5];[.B598]+1;"");"") ->  | C599: of:=IF(AND([.B599]>=[Calendario.$F$8];[.B599]<=[Calendario.$F$9];1);1;IF(AND([.B599]>=[Calendario.$F$12];[.B599]<=[Calendario.$F$13]);2;IF(AND([.B599]>=[Calendario.$F$16];[.B599]<=[Calendario.$F$17]);3;""))) ->  | D599: of:=IF(COUNTIF([Calendario.$H$4:.$H$48];[.B599])>0;"FIESTA";"") -> FIESTA | E599: of:=IF([.B599]<>"";VLOOKUP(WEEKDAY([.B599];3);[Calendario.$A$4:.$C$11];2);"") ->  | F599: of:=IF([.B599]<>"";IF([.D599]<>"FIESTA";VLOOKUP(WEEKDAY([.B599];3);[Calendario.$A$4:.$C$11];3);0);"") ->  | G599: of:=IF(ISNUMBER([.F599]);[.F599]+[.G598];"") ->  | H599: of:=IF(AND([.G599]<=[Unidades.$G$26];[.G599]<=[Unidades.$F$18];[Unidades.$F$18]>0);[Unidades.$D$18]+1-COUNTIFS([Unidades.$O$3:.$O$17];">="&[.G599]);"") ->  | I599: of:=IF([.H598]<>[.H599];"INICIO";IF([.H600]<>[.H599];"FIN";"")) ->  | J599: of:=IF([.K598]<>[.K599];"INICIO";IF([.K600]<>[.K599];"FIN";"")) -> 
A600: of:=IF([.B600]<>"";TODAY()>[.B600];"") ->  | B600: of:=IFERROR(IF(([.B599]+1)<[Calendario.$F$5];[.B599]+1;"");"") ->  | C600: of:=IF(AND([.B600]>=[Calendario.$F$8];[.B600]<=[Calendario.$F$9];1);1;IF(AND([.B600]>=[Calendario.$F$12];[.B600]<=[Calendario.$F$13]);2;IF(AND([.B600]>=[Calendario.$F$16];[.B600]<=[Calendario.$F$17]);3;""))) ->  | D600: of:=IF(COUNTIF([Calendario.$H$4:.$H$48];[.B600])>0;"FIESTA";"") -> FIESTA | E600: of:=IF([.B600]<>"";VLOOKUP(WEEKDAY([.B600];3);[Calendario.$A$4:.$C$11];2);"") ->  | F600: of:=IF([.B600]<>"";IF([.D600]<>"FIESTA";VLOOKUP(WEEKDAY([.B600];3);[Calendario.$A$4:.$C$11];3);0);"") ->  | G600: of:=IF(ISNUMBER([.F600]);[.F600]+[.G599];"") ->  | H600: of:=IF(AND([.G600]<=[Unidades.$G$26];[.G600]<=[Unidades.$F$18];[Unidades.$F$18]>0);[Unidades.$D$18]+1-COUNTIFS([Unidades.$O$3:.$O$17];">="&[.G600]);"") ->  | I600: of:=IF([.H599]<>[.H600];"INICIO";IF([.H601]<>[.H600];"FIN";"")) ->  | J600: of:=IF([.K599]<>[.K600];"INICIO";IF([.K601]<>[.K600];"FIN";"")) -> 
A601: of:=IF([.B601]<>"";TODAY()>[.B601];"") ->  | B601: of:=IFERROR(IF(([.B600]+1)<[Calendario.$F$5];[.B600]+1;"");"") ->  | C601: of:=IF(AND([.B601]>=[Calendario.$F$8];[.B601]<=[Calendario.$F$9];1);1;IF(AND([.B601]>=[Calendario.$F$12];[.B601]<=[Calendario.$F$13]);2;IF(AND([.B601]>=[Calendario.$F$16];[.B601]<=[Calendario.$F$17]);3;""))) ->  | D601: of:=IF(COUNTIF([Calendario.$H$4:.$H$48];[.B601])>0;"FIESTA";"") -> FIESTA | E601: of:=IF([.B601]<>"";VLOOKUP(WEEKDAY([.B601];3);[Calendario.$A$4:.$C$11];2);"") ->  | F601: of:=IF([.B601]<>"";IF([.D601]<>"FIESTA";VLOOKUP(WEEKDAY([.B601];3);[Calendario.$A$4:.$C$11];3);0);"") ->  | G601: of:=IF(ISNUMBER([.F601]);[.F601]+[.G600];"") ->  | H601: of:=IF(AND([.G601]<=[Unidades.$G$26];[.G601]<=[Unidades.$F$18];[Unidades.$F$18]>0);[Unidades.$D$18]+1-COUNTIFS([Unidades.$O$3:.$O$17];">="&[.G601]);"") ->  | I601: of:=IF([.H600]<>[.H601];"INICIO";IF([.H602]<>[.H601];"FIN";"")) ->  | J601: of:=IF([.K600]<>[.K601];"INICIO";IF([.K602]<>[.K601];"FIN";"")) -> 
A602: of:=IF([.B602]<>"";TODAY()>[.B602];"") ->  | B602: of:=IFERROR(IF(([.B601]+1)<[Calendario.$F$5];[.B601]+1;"");"") ->  | C602: of:=IF(AND([.B602]>=[Calendario.$F$8];[.B602]<=[Calendario.$F$9];1);1;IF(AND([.B602]>=[Calendario.$F$12];[.B602]<=[Calendario.$F$13]);2;IF(AND([.B602]>=[Calendario.$F$16];[.B602]<=[Calendario.$F$17]);3;""))) ->  | D602: of:=IF(COUNTIF([Calendario.$H$4:.$H$48];[.B602])>0;"FIESTA";"") -> FIESTA | E602: of:=IF([.B602]<>"";VLOOKUP(WEEKDAY([.B602];3);[Calendario.$A$4:.$C$11];2);"") ->  | F602: of:=IF([.B602]<>"";IF([.D602]<>"FIESTA";VLOOKUP(WEEKDAY([.B602];3);[Calendario.$A$4:.$C$11];3);0);"") ->  | G602: of:=IF(ISNUMBER([.F602]);[.F602]+[.G601];"") ->  | H602: of:=IF(AND([.G602]<=[Unidades.$G$26];[.G602]<=[Unidades.$F$18];[Unidades.$F$18]>0);[Unidades.$D$18]+1-COUNTIFS([Unidades.$O$3:.$O$17];">="&[.G602]);"") ->  | I602: of:=IF([.H601]<>[.H602];"INICIO";IF([.H603]<>[.H602];"FIN";"")) ->  | J602: of:=IF([.K601]<>[.K602];"INICIO";IF([.K603]<>[.K602];"FIN";"")) -> 
A603: of:=IF([.B603]<>"";TODAY()>[.B603];"") ->  | B603: of:=IFERROR(IF(([.B602]+1)<[Calendario.$F$5];[.B602]+1;"");"") ->  | C603: of:=IF(AND([.B603]>=[Calendario.$F$8];[.B603]<=[Calendario.$F$9];1);1;IF(AND([.B603]>=[Calendario.$F$12];[.B603]<=[Calendario.$F$13]);2;IF(AND([.B603]>=[Calendario.$F$16];[.B603]<=[Calendario.$F$17]);3;""))) ->  | D603: of:=IF(COUNTIF([Calendario.$H$4:.$H$48];[.B603])>0;"FIESTA";"") -> FIESTA | E603: of:=IF([.B603]<>"";VLOOKUP(WEEKDAY([.B603];3);[Calendario.$A$4:.$C$11];2);"") ->  | F603: of:=IF([.B603]<>"";IF([.D603]<>"FIESTA";VLOOKUP(WEEKDAY([.B603];3);[Calendario.$A$4:.$C$11];3);0);"") ->  | G603: of:=IF(ISNUMBER([.F603]);[.F603]+[.G602];"") ->  | H603: of:=IF(AND([.G603]<=[Unidades.$G$26];[.G603]<=[Unidades.$F$18];[Unidades.$F$18]>0);[Unidades.$D$18]+1-COUNTIFS([Unidades.$O$3:.$O$17];">="&[.G603]);"") ->  | I603: of:=IF([.H602]<>[.H603];"INICIO";IF([.H604]<>[.H603];"FIN";"")) ->  | J603: of:=IF([.K602]<>[.K603];"INICIO";IF([.K604]<>[.K603];"FIN";"")) -> 
A604: of:=IF([.B604]<>"";TODAY()>[.B604];"") ->  | B604: of:=IFERROR(IF(([.B603]+1)<[Calendario.$F$5];[.B603]+1;"");"") ->  | C604: of:=IF(AND([.B604]>=[Calendario.$F$8];[.B604]<=[Calendario.$F$9];1);1;IF(AND([.B604]>=[Calendario.$F$12];[.B604]<=[Calendario.$F$13]);2;IF(AND([.B604]>=[Calendario.$F$16];[.B604]<=[Calendario.$F$17]);3;""))) ->  | D604: of:=IF(COUNTIF([Calendario.$H$4:.$H$48];[.B604])>0;"FIESTA";"") -> FIESTA | E604: of:=IF([.B604]<>"";VLOOKUP(WEEKDAY([.B604];3);[Calendario.$A$4:.$C$11];2);"") ->  | F604: of:=IF([.B604]<>"";IF([.D604]<>"FIESTA";VLOOKUP(WEEKDAY([.B604];3);[Calendario.$A$4:.$C$11];3);0);"") ->  | G604: of:=IF(ISNUMBER([.F604]);[.F604]+[.G603];"") ->  | H604: of:=IF(AND([.G604]<=[Unidades.$G$26];[.G604]<=[Unidades.$F$18];[Unidades.$F$18]>0);[Unidades.$D$18]+1-COUNTIFS([Unidades.$O$3:.$O$17];">="&[.G604]);"") ->  | I604: of:=IF([.H603]<>[.H604];"INICIO";IF([.H605]<>[.H604];"FIN";"")) ->  | J604: of:=IF([.K603]<>[.K604];"INICIO";IF([.K605]<>[.K604];"FIN";"")) -> 
A605: of:=IF([.B605]<>"";TODAY()>[.B605];"") ->  | B605: of:=IFERROR(IF(([.B604]+1)<[Calendario.$F$5];[.B604]+1;"");"") ->  | C605: of:=IF(AND([.B605]>=[Calendario.$F$8];[.B605]<=[Calendario.$F$9];1);1;IF(AND([.B605]>=[Calendario.$F$12];[.B605]<=[Calendario.$F$13]);2;IF(AND([.B605]>=[Calendario.$F$16];[.B605]<=[Calendario.$F$17]);3;""))) ->  | D605: of:=IF(COUNTIF([Calendario.$H$4:.$H$48];[.B605])>0;"FIESTA";"") -> FIESTA | E605: of:=IF([.B605]<>"";VLOOKUP(WEEKDAY([.B605];3);[Calendario.$A$4:.$C$11];2);"") ->  | F605: of:=IF([.B605]<>"";IF([.D605]<>"FIESTA";VLOOKUP(WEEKDAY([.B605];3);[Calendario.$A$4:.$C$11];3);0);"") ->  | G605: of:=IF(ISNUMBER([.F605]);[.F605]+[.G604];"") ->  | H605: of:=IF(AND([.G605]<=[Unidades.$G$26];[.G605]<=[Unidades.$F$18];[Unidades.$F$18]>0);[Unidades.$D$18]+1-COUNTIFS([Unidades.$O$3:.$O$17];">="&[.G605]);"") ->  | I605: of:=IF([.H604]<>[.H605];"INICIO";IF([.H606]<>[.H605];"FIN";"")) ->  | J605: of:=IF([.K604]<>[.K605];"INICIO";IF([.K606]<>[.K605];"FIN";"")) -> 
A606: of:=IF([.B606]<>"";TODAY()>[.B606];"") ->  | B606: of:=IFERROR(IF(([.B605]+1)<[Calendario.$F$5];[.B605]+1;"");"") ->  | C606: of:=IF(AND([.B606]>=[Calendario.$F$8];[.B606]<=[Calendario.$F$9];1);1;IF(AND([.B606]>=[Calendario.$F$12];[.B606]<=[Calendario.$F$13]);2;IF(AND([.B606]>=[Calendario.$F$16];[.B606]<=[Calendario.$F$17]);3;""))) ->  | D606: of:=IF(COUNTIF([Calendario.$H$4:.$H$48];[.B606])>0;"FIESTA";"") -> FIESTA | E606: of:=IF([.B606]<>"";VLOOKUP(WEEKDAY([.B606];3);[Calendario.$A$4:.$C$11];2);"") ->  | F606: of:=IF([.B606]<>"";IF([.D606]<>"FIESTA";VLOOKUP(WEEKDAY([.B606];3);[Calendario.$A$4:.$C$11];3);0);"") ->  | G606: of:=IF(ISNUMBER([.F606]);[.F606]+[.G605];"") ->  | H606: of:=IF(AND([.G606]<=[Unidades.$G$26];[.G606]<=[Unidades.$F$18];[Unidades.$F$18]>0);[Unidades.$D$18]+1-COUNTIFS([Unidades.$O$3:.$O$17];">="&[.G606]);"") ->  | I606: of:=IF([.H605]<>[.H606];"INICIO";IF([.H607]<>[.H606];"FIN";"")) ->  | J606: of:=IF([.K605]<>[.K606];"INICIO";IF([.K607]<>[.K606];"FIN";"")) -> 
A607: of:=IF([.B607]<>"";TODAY()>[.B607];"") ->  | B607: of:=IFERROR(IF(([.B606]+1)<[Calendario.$F$5];[.B606]+1;"");"") ->  | C607: of:=IF(AND([.B607]>=[Calendario.$F$8];[.B607]<=[Calendario.$F$9];1);1;IF(AND([.B607]>=[Calendario.$F$12];[.B607]<=[Calendario.$F$13]);2;IF(AND([.B607]>=[Calendario.$F$16];[.B607]<=[Calendario.$F$17]);3;""))) ->  | D607: of:=IF(COUNTIF([Calendario.$H$4:.$H$48];[.B607])>0;"FIESTA";"") -> FIESTA | E607: of:=IF([.B607]<>"";VLOOKUP(WEEKDAY([.B607];3);[Calendario.$A$4:.$C$11];2);"") ->  | F607: of:=IF([.B607]<>"";IF([.D607]<>"FIESTA";VLOOKUP(WEEKDAY([.B607];3);[Calendario.$A$4:.$C$11];3);0);"") ->  | G607: of:=IF(ISNUMBER([.F607]);[.F607]+[.G606];"") ->  | H607: of:=IF(AND([.G607]<=[Unidades.$G$26];[.G607]<=[Unidades.$F$18];[Unidades.$F$18]>0);[Unidades.$D$18]+1-COUNTIFS([Unidades.$O$3:.$O$17];">="&[.G607]);"") ->  | I607: of:=IF([.H606]<>[.H607];"INICIO";IF([.H608]<>[.H607];"FIN";"")) ->  | J607: of:=IF([.K606]<>[.K607];"INICIO";IF([.K608]<>[.K607];"FIN";"")) -> 
A608: of:=IF([.B608]<>"";TODAY()>[.B608];"") ->  | B608: of:=IFERROR(IF(([.B607]+1)<[Calendario.$F$5];[.B607]+1;"");"") ->  | C608: of:=IF(AND([.B608]>=[Calendario.$F$8];[.B608]<=[Calendario.$F$9];1);1;IF(AND([.B608]>=[Calendario.$F$12];[.B608]<=[Calendario.$F$13]);2;IF(AND([.B608]>=[Calendario.$F$16];[.B608]<=[Calendario.$F$17]);3;""))) ->  | D608: of:=IF(COUNTIF([Calendario.$H$4:.$H$48];[.B608])>0;"FIESTA";"") -> FIESTA | E608: of:=IF([.B608]<>"";VLOOKUP(WEEKDAY([.B608];3);[Calendario.$A$4:.$C$11];2);"") ->  | F608: of:=IF([.B608]<>"";IF([.D608]<>"FIESTA";VLOOKUP(WEEKDAY([.B608];3);[Calendario.$A$4:.$C$11];3);0);"") ->  | G608: of:=IF(ISNUMBER([.F608]);[.F608]+[.G607];"") ->  | H608: of:=IF(AND([.G608]<=[Unidades.$G$26];[.G608]<=[Unidades.$F$18];[Unidades.$F$18]>0);[Unidades.$D$18]+1-COUNTIFS([Unidades.$O$3:.$O$17];">="&[.G608]);"") ->  | I608: of:=IF([.H607]<>[.H608];"INICIO";IF([.H609]<>[.H608];"FIN";"")) ->  | J608: of:=IF([.K607]<>[.K608];"INICIO";IF([.K609]<>[.K608];"FIN";"")) -> 
A609: of:=IF([.B609]<>"";TODAY()>[.B609];"") ->  | B609: of:=IFERROR(IF(([.B608]+1)<[Calendario.$F$5];[.B608]+1;"");"") ->  | C609: of:=IF(AND([.B609]>=[Calendario.$F$8];[.B609]<=[Calendario.$F$9];1);1;IF(AND([.B609]>=[Calendario.$F$12];[.B609]<=[Calendario.$F$13]);2;IF(AND([.B609]>=[Calendario.$F$16];[.B609]<=[Calendario.$F$17]);3;""))) ->  | D609: of:=IF(COUNTIF([Calendario.$H$4:.$H$48];[.B609])>0;"FIESTA";"") -> FIESTA | E609: of:=IF([.B609]<>"";VLOOKUP(WEEKDAY([.B609];3);[Calendario.$A$4:.$C$11];2);"") ->  | F609: of:=IF([.B609]<>"";IF([.D609]<>"FIESTA";VLOOKUP(WEEKDAY([.B609];3);[Calendario.$A$4:.$C$11];3);0);"") ->  | G609: of:=IF(ISNUMBER([.F609]);[.F609]+[.G608];"") ->  | H609: of:=IF(AND([.G609]<=[Unidades.$G$26];[.G609]<=[Unidades.$F$18];[Unidades.$F$18]>0);[Unidades.$D$18]+1-COUNTIFS([Unidades.$O$3:.$O$17];">="&[.G609]);"") ->  | I609: of:=IF([.H608]<>[.H609];"INICIO";IF([.H610]<>[.H609];"FIN";"")) ->  | J609: of:=IF([.K608]<>[.K609];"INICIO";IF([.K610]<>[.K609];"FIN";"")) -> 
A610: of:=IF([.B610]<>"";TODAY()>[.B610];"") ->  | B610: of:=IFERROR(IF(([.B609]+1)<[Calendario.$F$5];[.B609]+1;"");"") ->  | C610: of:=IF(AND([.B610]>=[Calendario.$F$8];[.B610]<=[Calendario.$F$9];1);1;IF(AND([.B610]>=[Calendario.$F$12];[.B610]<=[Calendario.$F$13]);2;IF(AND([.B610]>=[Calendario.$F$16];[.B610]<=[Calendario.$F$17]);3;""))) ->  | D610: of:=IF(COUNTIF([Calendario.$H$4:.$H$48];[.B610])>0;"FIESTA";"") -> FIESTA | E610: of:=IF([.B610]<>"";VLOOKUP(WEEKDAY([.B610];3);[Calendario.$A$4:.$C$11];2);"") ->  | F610: of:=IF([.B610]<>"";IF([.D610]<>"FIESTA";VLOOKUP(WEEKDAY([.B610];3);[Calendario.$A$4:.$C$11];3);0);"") ->  | G610: of:=IF(ISNUMBER([.F610]);[.F610]+[.G609];"") ->  | H610: of:=IF(AND([.G610]<=[Unidades.$G$26];[.G610]<=[Unidades.$F$18];[Unidades.$F$18]>0);[Unidades.$D$18]+1-COUNTIFS([Unidades.$O$3:.$O$17];">="&[.G610]);"") ->  | I610: of:=IF([.H609]<>[.H610];"INICIO";IF([.H611]<>[.H610];"FIN";"")) ->  | J610: of:=IF([.K609]<>[.K610];"INICIO";IF([.K611]<>[.K610];"FIN";"")) -> 
A611: of:=IF([.B611]<>"";TODAY()>[.B611];"") ->  | B611: of:=IFERROR(IF(([.B610]+1)<[Calendario.$F$5];[.B610]+1;"");"") ->  | C611: of:=IF(AND([.B611]>=[Calendario.$F$8];[.B611]<=[Calendario.$F$9];1);1;IF(AND([.B611]>=[Calendario.$F$12];[.B611]<=[Calendario.$F$13]);2;IF(AND([.B611]>=[Calendario.$F$16];[.B611]<=[Calendario.$F$17]);3;""))) ->  | D611: of:=IF(COUNTIF([Calendario.$H$4:.$H$48];[.B611])>0;"FIESTA";"") -> FIESTA | E611: of:=IF([.B611]<>"";VLOOKUP(WEEKDAY([.B611];3);[Calendario.$A$4:.$C$11];2);"") ->  | F611: of:=IF([.B611]<>"";IF([.D611]<>"FIESTA";VLOOKUP(WEEKDAY([.B611];3);[Calendario.$A$4:.$C$11];3);0);"") ->  | G611: of:=IF(ISNUMBER([.F611]);[.F611]+[.G610];"") ->  | H611: of:=IF(AND([.G611]<=[Unidades.$G$26];[.G611]<=[Unidades.$F$18];[Unidades.$F$18]>0);[Unidades.$D$18]+1-COUNTIFS([Unidades.$O$3:.$O$17];">="&[.G611]);"") ->  | I611: of:=IF([.H610]<>[.H611];"INICIO";IF([.H612]<>[.H611];"FIN";"")) ->  | J611: of:=IF([.K610]<>[.K611];"INICIO";IF([.K612]<>[.K611];"FIN";"")) -> 
A612: of:=IF([.B612]<>"";TODAY()>[.B612];"") ->  | B612: of:=IFERROR(IF(([.B611]+1)<[Calendario.$F$5];[.B611]+1;"");"") ->  | C612: of:=IF(AND([.B612]>=[Calendario.$F$8];[.B612]<=[Calendario.$F$9];1);1;IF(AND([.B612]>=[Calendario.$F$12];[.B612]<=[Calendario.$F$13]);2;IF(AND([.B612]>=[Calendario.$F$16];[.B612]<=[Calendario.$F$17]);3;""))) ->  | D612: of:=IF(COUNTIF([Calendario.$H$4:.$H$48];[.B612])>0;"FIESTA";"") -> FIESTA | E612: of:=IF([.B612]<>"";VLOOKUP(WEEKDAY([.B612];3);[Calendario.$A$4:.$C$11];2);"") ->  | F612: of:=IF([.B612]<>"";IF([.D612]<>"FIESTA";VLOOKUP(WEEKDAY([.B612];3);[Calendario.$A$4:.$C$11];3);0);"") ->  | G612: of:=IF(ISNUMBER([.F612]);[.F612]+[.G611];"") ->  | H612: of:=IF(AND([.G612]<=[Unidades.$G$26];[.G612]<=[Unidades.$F$18];[Unidades.$F$18]>0);[Unidades.$D$18]+1-COUNTIFS([Unidades.$O$3:.$O$17];">="&[.G612]);"") ->  | I612: of:=IF([.H611]<>[.H612];"INICIO";IF([.H613]<>[.H612];"FIN";"")) ->  | J612: of:=IF([.K611]<>[.K612];"INICIO";IF([.K613]<>[.K612];"FIN";"")) -> 
A613: of:=IF([.B613]<>"";TODAY()>[.B613];"") ->  | B613: of:=IFERROR(IF(([.B612]+1)<[Calendario.$F$5];[.B612]+1;"");"") ->  | C613: of:=IF(AND([.B613]>=[Calendario.$F$8];[.B613]<=[Calendario.$F$9];1);1;IF(AND([.B613]>=[Calendario.$F$12];[.B613]<=[Calendario.$F$13]);2;IF(AND([.B613]>=[Calendario.$F$16];[.B613]<=[Calendario.$F$17]);3;""))) ->  | D613: of:=IF(COUNTIF([Calendario.$H$4:.$H$48];[.B613])>0;"FIESTA";"") -> FIESTA | E613: of:=IF([.B613]<>"";VLOOKUP(WEEKDAY([.B613];3);[Calendario.$A$4:.$C$11];2);"") ->  | F613: of:=IF([.B613]<>"";IF([.D613]<>"FIESTA";VLOOKUP(WEEKDAY([.B613];3);[Calendario.$A$4:.$C$11];3);0);"") ->  | G613: of:=IF(ISNUMBER([.F613]);[.F613]+[.G612];"") ->  | H613: of:=IF(AND([.G613]<=[Unidades.$G$26];[.G613]<=[Unidades.$F$18];[Unidades.$F$18]>0);[Unidades.$D$18]+1-COUNTIFS([Unidades.$O$3:.$O$17];">="&[.G613]);"") ->  | I613: of:=IF([.H612]<>[.H613];"INICIO";IF([.H614]<>[.H613];"FIN";"")) ->  | J613: of:=IF([.K612]<>[.K613];"INICIO";IF([.K614]<>[.K613];"FIN";"")) -> 
A614: of:=IF([.B614]<>"";TODAY()>[.B614];"") ->  | B614: of:=IFERROR(IF(([.B613]+1)<[Calendario.$F$5];[.B613]+1;"");"") ->  | C614: of:=IF(AND([.B614]>=[Calendario.$F$8];[.B614]<=[Calendario.$F$9];1);1;IF(AND([.B614]>=[Calendario.$F$12];[.B614]<=[Calendario.$F$13]);2;IF(AND([.B614]>=[Calendario.$F$16];[.B614]<=[Calendario.$F$17]);3;""))) ->  | D614: of:=IF(COUNTIF([Calendario.$H$4:.$H$48];[.B614])>0;"FIESTA";"") -> FIESTA | E614: of:=IF([.B614]<>"";VLOOKUP(WEEKDAY([.B614];3);[Calendario.$A$4:.$C$11];2);"") ->  | F614: of:=IF([.B614]<>"";IF([.D614]<>"FIESTA";VLOOKUP(WEEKDAY([.B614];3);[Calendario.$A$4:.$C$11];3);0);"") ->  | G614: of:=IF(ISNUMBER([.F614]);[.F614]+[.G613];"") ->  | H614: of:=IF(AND([.G614]<=[Unidades.$G$26];[.G614]<=[Unidades.$F$18];[Unidades.$F$18]>0);[Unidades.$D$18]+1-COUNTIFS([Unidades.$O$3:.$O$17];">="&[.G614]);"") ->  | I614: of:=IF([.H613]<>[.H614];"INICIO";IF([.H615]<>[.H614];"FIN";"")) ->  | J614: of:=IF([.K613]<>[.K614];"INICIO";IF([.K615]<>[.K614];"FIN";"")) -> 
A615: of:=IF([.B615]<>"";TODAY()>[.B615];"") ->  | B615: of:=IFERROR(IF(([.B614]+1)<[Calendario.$F$5];[.B614]+1;"");"") ->  | C615: of:=IF(AND([.B615]>=[Calendario.$F$8];[.B615]<=[Calendario.$F$9];1);1;IF(AND([.B615]>=[Calendario.$F$12];[.B615]<=[Calendario.$F$13]);2;IF(AND([.B615]>=[Calendario.$F$16];[.B615]<=[Calendario.$F$17]);3;""))) ->  | D615: of:=IF(COUNTIF([Calendario.$H$4:.$H$48];[.B615])>0;"FIESTA";"") -> FIESTA | E615: of:=IF([.B615]<>"";VLOOKUP(WEEKDAY([.B615];3);[Calendario.$A$4:.$C$11];2);"") ->  | F615: of:=IF([.B615]<>"";IF([.D615]<>"FIESTA";VLOOKUP(WEEKDAY([.B615];3);[Calendario.$A$4:.$C$11];3);0);"") ->  | G615: of:=IF(ISNUMBER([.F615]);[.F615]+[.G614];"") ->  | H615: of:=IF(AND([.G615]<=[Unidades.$G$26];[.G615]<=[Unidades.$F$18];[Unidades.$F$18]>0);[Unidades.$D$18]+1-COUNTIFS([Unidades.$O$3:.$O$17];">="&[.G615]);"") ->  | I615: of:=IF([.H614]<>[.H615];"INICIO";IF([.H616]<>[.H615];"FIN";"")) ->  | J615: of:=IF([.K614]<>[.K615];"INICIO";IF([.K616]<>[.K615];"FIN";"")) -> 
A616: of:=IF([.B616]<>"";TODAY()>[.B616];"") ->  | B616: of:=IFERROR(IF(([.B615]+1)<[Calendario.$F$5];[.B615]+1;"");"") ->  | C616: of:=IF(AND([.B616]>=[Calendario.$F$8];[.B616]<=[Calendario.$F$9];1);1;IF(AND([.B616]>=[Calendario.$F$12];[.B616]<=[Calendario.$F$13]);2;IF(AND([.B616]>=[Calendario.$F$16];[.B616]<=[Calendario.$F$17]);3;""))) ->  | D616: of:=IF(COUNTIF([Calendario.$H$4:.$H$48];[.B616])>0;"FIESTA";"") -> FIESTA | E616: of:=IF([.B616]<>"";VLOOKUP(WEEKDAY([.B616];3);[Calendario.$A$4:.$C$11];2);"") ->  | F616: of:=IF([.B616]<>"";IF([.D616]<>"FIESTA";VLOOKUP(WEEKDAY([.B616];3);[Calendario.$A$4:.$C$11];3);0);"") ->  | G616: of:=IF(ISNUMBER([.F616]);[.F616]+[.G615];"") ->  | H616: of:=IF(AND([.G616]<=[Unidades.$G$26];[.G616]<=[Unidades.$F$18];[Unidades.$F$18]>0);[Unidades.$D$18]+1-COUNTIFS([Unidades.$O$3:.$O$17];">="&[.G616]);"") ->  | I616: of:=IF([.H615]<>[.H616];"INICIO";IF([.H617]<>[.H616];"FIN";"")) ->  | J616: of:=IF([.K615]<>[.K616];"INICIO";IF([.K617]<>[.K616];"FIN";"")) -> 
A617: of:=IF([.B617]<>"";TODAY()>[.B617];"") ->  | B617: of:=IFERROR(IF(([.B616]+1)<[Calendario.$F$5];[.B616]+1;"");"") ->  | C617: of:=IF(AND([.B617]>=[Calendario.$F$8];[.B617]<=[Calendario.$F$9];1);1;IF(AND([.B617]>=[Calendario.$F$12];[.B617]<=[Calendario.$F$13]);2;IF(AND([.B617]>=[Calendario.$F$16];[.B617]<=[Calendario.$F$17]);3;""))) ->  | D617: of:=IF(COUNTIF([Calendario.$H$4:.$H$48];[.B617])>0;"FIESTA";"") -> FIESTA | E617: of:=IF([.B617]<>"";VLOOKUP(WEEKDAY([.B617];3);[Calendario.$A$4:.$C$11];2);"") ->  | F617: of:=IF([.B617]<>"";IF([.D617]<>"FIESTA";VLOOKUP(WEEKDAY([.B617];3);[Calendario.$A$4:.$C$11];3);0);"") ->  | G617: of:=IF(ISNUMBER([.F617]);[.F617]+[.G616];"") ->  | H617: of:=IF(AND([.G617]<=[Unidades.$G$26];[.G617]<=[Unidades.$F$18];[Unidades.$F$18]>0);[Unidades.$D$18]+1-COUNTIFS([Unidades.$O$3:.$O$17];">="&[.G617]);"") ->  | I617: of:=IF([.H616]<>[.H617];"INICIO";IF([.H618]<>[.H617];"FIN";"")) ->  | J617: of:=IF([.K616]<>[.K617];"INICIO";IF([.K618]<>[.K617];"FIN";"")) -> 
A618: of:=IF([.B618]<>"";TODAY()>[.B618];"") ->  | B618: of:=IFERROR(IF(([.B617]+1)<[Calendario.$F$5];[.B617]+1;"");"") ->  | C618: of:=IF(AND([.B618]>=[Calendario.$F$8];[.B618]<=[Calendario.$F$9];1);1;IF(AND([.B618]>=[Calendario.$F$12];[.B618]<=[Calendario.$F$13]);2;IF(AND([.B618]>=[Calendario.$F$16];[.B618]<=[Calendario.$F$17]);3;""))) ->  | D618: of:=IF(COUNTIF([Calendario.$H$4:.$H$48];[.B618])>0;"FIESTA";"") -> FIESTA | E618: of:=IF([.B618]<>"";VLOOKUP(WEEKDAY([.B618];3);[Calendario.$A$4:.$C$11];2);"") ->  | F618: of:=IF([.B618]<>"";IF([.D618]<>"FIESTA";VLOOKUP(WEEKDAY([.B618];3);[Calendario.$A$4:.$C$11];3);0);"") ->  | G618: of:=IF(ISNUMBER([.F618]);[.F618]+[.G617];"") ->  | H618: of:=IF(AND([.G618]<=[Unidades.$G$26];[.G618]<=[Unidades.$F$18];[Unidades.$F$18]>0);[Unidades.$D$18]+1-COUNTIFS([Unidades.$O$3:.$O$17];">="&[.G618]);"") ->  | I618: of:=IF([.H617]<>[.H618];"INICIO";IF([.H619]<>[.H618];"FIN";"")) ->  | J618: of:=IF([.K617]<>[.K618];"INICIO";IF([.K619]<>[.K618];"FIN";"")) -> 
A619: of:=IF([.B619]<>"";TODAY()>[.B619];"") ->  | B619: of:=IFERROR(IF(([.B618]+1)<[Calendario.$F$5];[.B618]+1;"");"") ->  | C619: of:=IF(AND([.B619]>=[Calendario.$F$8];[.B619]<=[Calendario.$F$9];1);1;IF(AND([.B619]>=[Calendario.$F$12];[.B619]<=[Calendario.$F$13]);2;IF(AND([.B619]>=[Calendario.$F$16];[.B619]<=[Calendario.$F$17]);3;""))) ->  | D619: of:=IF(COUNTIF([Calendario.$H$4:.$H$48];[.B619])>0;"FIESTA";"") -> FIESTA | E619: of:=IF([.B619]<>"";VLOOKUP(WEEKDAY([.B619];3);[Calendario.$A$4:.$C$11];2);"") ->  | F619: of:=IF([.B619]<>"";IF([.D619]<>"FIESTA";VLOOKUP(WEEKDAY([.B619];3);[Calendario.$A$4:.$C$11];3);0);"") ->  | G619: of:=IF(ISNUMBER([.F619]);[.F619]+[.G618];"") ->  | H619: of:=IF(AND([.G619]<=[Unidades.$G$26];[.G619]<=[Unidades.$F$18];[Unidades.$F$18]>0);[Unidades.$D$18]+1-COUNTIFS([Unidades.$O$3:.$O$17];">="&[.G619]);"") ->  | I619: of:=IF([.H618]<>[.H619];"INICIO";IF([.H620]<>[.H619];"FIN";"")) ->  | J619: of:=IF([.K618]<>[.K619];"INICIO";IF([.K620]<>[.K619];"FIN";"")) -> 
A620: of:=IF([.B620]<>"";TODAY()>[.B620];"") ->  | B620: of:=IFERROR(IF(([.B619]+1)<[Calendario.$F$5];[.B619]+1;"");"") ->  | C620: of:=IF(AND([.B620]>=[Calendario.$F$8];[.B620]<=[Calendario.$F$9];1);1;IF(AND([.B620]>=[Calendario.$F$12];[.B620]<=[Calendario.$F$13]);2;IF(AND([.B620]>=[Calendario.$F$16];[.B620]<=[Calendario.$F$17]);3;""))) ->  | D620: of:=IF(COUNTIF([Calendario.$H$4:.$H$48];[.B620])>0;"FIESTA";"") -> FIESTA | E620: of:=IF([.B620]<>"";VLOOKUP(WEEKDAY([.B620];3);[Calendario.$A$4:.$C$11];2);"") ->  | F620: of:=IF([.B620]<>"";IF([.D620]<>"FIESTA";VLOOKUP(WEEKDAY([.B620];3);[Calendario.$A$4:.$C$11];3);0);"") ->  | G620: of:=IF(ISNUMBER([.F620]);[.F620]+[.G619];"") ->  | H620: of:=IF(AND([.G620]<=[Unidades.$G$26];[.G620]<=[Unidades.$F$18];[Unidades.$F$18]>0);[Unidades.$D$18]+1-COUNTIFS([Unidades.$O$3:.$O$17];">="&[.G620]);"") ->  | I620: of:=IF([.H619]<>[.H620];"INICIO";IF([.H621]<>[.H620];"FIN";"")) ->  | J620: of:=IF([.K619]<>[.K620];"INICIO";IF([.K621]<>[.K620];"FIN";"")) -> 
A621: of:=IF([.B621]<>"";TODAY()>[.B621];"") ->  | B621: of:=IFERROR(IF(([.B620]+1)<[Calendario.$F$5];[.B620]+1;"");"") ->  | C621: of:=IF(AND([.B621]>=[Calendario.$F$8];[.B621]<=[Calendario.$F$9];1);1;IF(AND([.B621]>=[Calendario.$F$12];[.B621]<=[Calendario.$F$13]);2;IF(AND([.B621]>=[Calendario.$F$16];[.B621]<=[Calendario.$F$17]);3;""))) ->  | D621: of:=IF(COUNTIF([Calendario.$H$4:.$H$48];[.B621])>0;"FIESTA";"") -> FIESTA | E621: of:=IF([.B621]<>"";VLOOKUP(WEEKDAY([.B621];3);[Calendario.$A$4:.$C$11];2);"") ->  | F621: of:=IF([.B621]<>"";IF([.D621]<>"FIESTA";VLOOKUP(WEEKDAY([.B621];3);[Calendario.$A$4:.$C$11];3);0);"") ->  | G621: of:=IF(ISNUMBER([.F621]);[.F621]+[.G620];"") ->  | H621: of:=IF(AND([.G621]<=[Unidades.$G$26];[.G621]<=[Unidades.$F$18];[Unidades.$F$18]>0);[Unidades.$D$18]+1-COUNTIFS([Unidades.$O$3:.$O$17];">="&[.G621]);"") ->  | I621: of:=IF([.H620]<>[.H621];"INICIO";IF([.H622]<>[.H621];"FIN";"")) ->  | J621: of:=IF([.K620]<>[.K621];"INICIO";IF([.K622]<>[.K621];"FIN";"")) -> 
A622: of:=IF([.B622]<>"";TODAY()>[.B622];"") ->  | B622: of:=IFERROR(IF(([.B621]+1)<[Calendario.$F$5];[.B621]+1;"");"") ->  | C622: of:=IF(AND([.B622]>=[Calendario.$F$8];[.B622]<=[Calendario.$F$9];1);1;IF(AND([.B622]>=[Calendario.$F$12];[.B622]<=[Calendario.$F$13]);2;IF(AND([.B622]>=[Calendario.$F$16];[.B622]<=[Calendario.$F$17]);3;""))) ->  | D622: of:=IF(COUNTIF([Calendario.$H$4:.$H$48];[.B622])>0;"FIESTA";"") -> FIESTA | E622: of:=IF([.B622]<>"";VLOOKUP(WEEKDAY([.B622];3);[Calendario.$A$4:.$C$11];2);"") ->  | F622: of:=IF([.B622]<>"";IF([.D622]<>"FIESTA";VLOOKUP(WEEKDAY([.B622];3);[Calendario.$A$4:.$C$11];3);0);"") ->  | G622: of:=IF(ISNUMBER([.F622]);[.F622]+[.G621];"") ->  | H622: of:=IF(AND([.G622]<=[Unidades.$G$26];[.G622]<=[Unidades.$F$18];[Unidades.$F$18]>0);[Unidades.$D$18]+1-COUNTIFS([Unidades.$O$3:.$O$17];">="&[.G622]);"") ->  | I622: of:=IF([.H621]<>[.H622];"INICIO";IF([.H623]<>[.H622];"FIN";"")) ->  | J622: of:=IF([.K621]<>[.K622];"INICIO";IF([.K623]<>[.K622];"FIN";"")) -> 
A623: of:=IF([.B623]<>"";TODAY()>[.B623];"") ->  | B623: of:=IFERROR(IF(([.B622]+1)<[Calendario.$F$5];[.B622]+1;"");"") ->  | C623: of:=IF(AND([.B623]>=[Calendario.$F$8];[.B623]<=[Calendario.$F$9];1);1;IF(AND([.B623]>=[Calendario.$F$12];[.B623]<=[Calendario.$F$13]);2;IF(AND([.B623]>=[Calendario.$F$16];[.B623]<=[Calendario.$F$17]);3;""))) ->  | D623: of:=IF(COUNTIF([Calendario.$H$4:.$H$48];[.B623])>0;"FIESTA";"") -> FIESTA | E623: of:=IF([.B623]<>"";VLOOKUP(WEEKDAY([.B623];3);[Calendario.$A$4:.$C$11];2);"") ->  | F623: of:=IF([.B623]<>"";IF([.D623]<>"FIESTA";VLOOKUP(WEEKDAY([.B623];3);[Calendario.$A$4:.$C$11];3);0);"") ->  | G623: of:=IF(ISNUMBER([.F623]);[.F623]+[.G622];"") ->  | H623: of:=IF(AND([.G623]<=[Unidades.$G$26];[.G623]<=[Unidades.$F$18];[Unidades.$F$18]>0);[Unidades.$D$18]+1-COUNTIFS([Unidades.$O$3:.$O$17];">="&[.G623]);"") ->  | I623: of:=IF([.H622]<>[.H623];"INICIO";IF([.H624]<>[.H623];"FIN";"")) ->  | J623: of:=IF([.K622]<>[.K623];"INICIO";IF([.K624]<>[.K623];"FIN";"")) -> 
A624: of:=IF([.B624]<>"";TODAY()>[.B624];"") ->  | B624: of:=IFERROR(IF(([.B623]+1)<[Calendario.$F$5];[.B623]+1;"");"") ->  | C624: of:=IF(AND([.B624]>=[Calendario.$F$8];[.B624]<=[Calendario.$F$9];1);1;IF(AND([.B624]>=[Calendario.$F$12];[.B624]<=[Calendario.$F$13]);2;IF(AND([.B624]>=[Calendario.$F$16];[.B624]<=[Calendario.$F$17]);3;""))) ->  | D624: of:=IF(COUNTIF([Calendario.$H$4:.$H$48];[.B624])>0;"FIESTA";"") -> FIESTA | E624: of:=IF([.B624]<>"";VLOOKUP(WEEKDAY([.B624];3);[Calendario.$A$4:.$C$11];2);"") ->  | F624: of:=IF([.B624]<>"";IF([.D624]<>"FIESTA";VLOOKUP(WEEKDAY([.B624];3);[Calendario.$A$4:.$C$11];3);0);"") ->  | G624: of:=IF(ISNUMBER([.F624]);[.F624]+[.G623];"") ->  | H624: of:=IF(AND([.G624]<=[Unidades.$G$26];[.G624]<=[Unidades.$F$18];[Unidades.$F$18]>0);[Unidades.$D$18]+1-COUNTIFS([Unidades.$O$3:.$O$17];">="&[.G624]);"") ->  | I624: of:=IF([.H623]<>[.H624];"INICIO";IF([.H625]<>[.H624];"FIN";"")) ->  | J624: of:=IF([.K623]<>[.K624];"INICIO";IF([.K625]<>[.K624];"FIN";"")) -> 
A625: of:=IF([.B625]<>"";TODAY()>[.B625];"") ->  | B625: of:=IFERROR(IF(([.B624]+1)<[Calendario.$F$5];[.B624]+1;"");"") ->  | C625: of:=IF(AND([.B625]>=[Calendario.$F$8];[.B625]<=[Calendario.$F$9];1);1;IF(AND([.B625]>=[Calendario.$F$12];[.B625]<=[Calendario.$F$13]);2;IF(AND([.B625]>=[Calendario.$F$16];[.B625]<=[Calendario.$F$17]);3;""))) ->  | D625: of:=IF(COUNTIF([Calendario.$H$4:.$H$48];[.B625])>0;"FIESTA";"") -> FIESTA | E625: of:=IF([.B625]<>"";VLOOKUP(WEEKDAY([.B625];3);[Calendario.$A$4:.$C$11];2);"") ->  | F625: of:=IF([.B625]<>"";IF([.D625]<>"FIESTA";VLOOKUP(WEEKDAY([.B625];3);[Calendario.$A$4:.$C$11];3);0);"") ->  | G625: of:=IF(ISNUMBER([.F625]);[.F625]+[.G624];"") ->  | H625: of:=IF(AND([.G625]<=[Unidades.$G$26];[.G625]<=[Unidades.$F$18];[Unidades.$F$18]>0);[Unidades.$D$18]+1-COUNTIFS([Unidades.$O$3:.$O$17];">="&[.G625]);"") ->  | I625: of:=IF([.H624]<>[.H625];"INICIO";IF([.H626]<>[.H625];"FIN";"")) ->  | J625: of:=IF([.K624]<>[.K625];"INICIO";IF([.K626]<>[.K625];"FIN";"")) -> 
A626: of:=IF([.B626]<>"";TODAY()>[.B626];"") ->  | B626: of:=IFERROR(IF(([.B625]+1)<[Calendario.$F$5];[.B625]+1;"");"") ->  | C626: of:=IF(AND([.B626]>=[Calendario.$F$8];[.B626]<=[Calendario.$F$9];1);1;IF(AND([.B626]>=[Calendario.$F$12];[.B626]<=[Calendario.$F$13]);2;IF(AND([.B626]>=[Calendario.$F$16];[.B626]<=[Calendario.$F$17]);3;""))) ->  | D626: of:=IF(COUNTIF([Calendario.$H$4:.$H$48];[.B626])>0;"FIESTA";"") -> FIESTA | E626: of:=IF([.B626]<>"";VLOOKUP(WEEKDAY([.B626];3);[Calendario.$A$4:.$C$11];2);"") ->  | F626: of:=IF([.B626]<>"";IF([.D626]<>"FIESTA";VLOOKUP(WEEKDAY([.B626];3);[Calendario.$A$4:.$C$11];3);0);"") ->  | G626: of:=IF(ISNUMBER([.F626]);[.F626]+[.G625];"") ->  | H626: of:=IF(AND([.G626]<=[Unidades.$G$26];[.G626]<=[Unidades.$F$18];[Unidades.$F$18]>0);[Unidades.$D$18]+1-COUNTIFS([Unidades.$O$3:.$O$17];">="&[.G626]);"") ->  | I626: of:=IF([.H625]<>[.H626];"INICIO";IF([.H627]<>[.H626];"FIN";"")) ->  | J626: of:=IF([.K625]<>[.K626];"INICIO";IF([.K627]<>[.K626];"FIN";"")) -> 
A627: of:=IF([.B627]<>"";TODAY()>[.B627];"") ->  | B627: of:=IFERROR(IF(([.B626]+1)<[Calendario.$F$5];[.B626]+1;"");"") ->  | C627: of:=IF(AND([.B627]>=[Calendario.$F$8];[.B627]<=[Calendario.$F$9];1);1;IF(AND([.B627]>=[Calendario.$F$12];[.B627]<=[Calendario.$F$13]);2;IF(AND([.B627]>=[Calendario.$F$16];[.B627]<=[Calendario.$F$17]);3;""))) ->  | D627: of:=IF(COUNTIF([Calendario.$H$4:.$H$48];[.B627])>0;"FIESTA";"") -> FIESTA | E627: of:=IF([.B627]<>"";VLOOKUP(WEEKDAY([.B627];3);[Calendario.$A$4:.$C$11];2);"") ->  | F627: of:=IF([.B627]<>"";IF([.D627]<>"FIESTA";VLOOKUP(WEEKDAY([.B627];3);[Calendario.$A$4:.$C$11];3);0);"") ->  | G627: of:=IF(ISNUMBER([.F627]);[.F627]+[.G626];"") ->  | H627: of:=IF(AND([.G627]<=[Unidades.$G$26];[.G627]<=[Unidades.$F$18];[Unidades.$F$18]>0);[Unidades.$D$18]+1-COUNTIFS([Unidades.$O$3:.$O$17];">="&[.G627]);"") ->  | I627: of:=IF([.H626]<>[.H627];"INICIO";IF([.H628]<>[.H627];"FIN";"")) ->  | J627: of:=IF([.K626]<>[.K627];"INICIO";IF([.K628]<>[.K627];"FIN";"")) -> 
A628: of:=IF([.B628]<>"";TODAY()>[.B628];"") ->  | B628: of:=IFERROR(IF(([.B627]+1)<[Calendario.$F$5];[.B627]+1;"");"") ->  | C628: of:=IF(AND([.B628]>=[Calendario.$F$8];[.B628]<=[Calendario.$F$9];1);1;IF(AND([.B628]>=[Calendario.$F$12];[.B628]<=[Calendario.$F$13]);2;IF(AND([.B628]>=[Calendario.$F$16];[.B628]<=[Calendario.$F$17]);3;""))) ->  | D628: of:=IF(COUNTIF([Calendario.$H$4:.$H$48];[.B628])>0;"FIESTA";"") -> FIESTA | E628: of:=IF([.B628]<>"";VLOOKUP(WEEKDAY([.B628];3);[Calendario.$A$4:.$C$11];2);"") ->  | F628: of:=IF([.B628]<>"";IF([.D628]<>"FIESTA";VLOOKUP(WEEKDAY([.B628];3);[Calendario.$A$4:.$C$11];3);0);"") ->  | G628: of:=IF(ISNUMBER([.F628]);[.F628]+[.G627];"") ->  | H628: of:=IF(AND([.G628]<=[Unidades.$G$26];[.G628]<=[Unidades.$F$18];[Unidades.$F$18]>0);[Unidades.$D$18]+1-COUNTIFS([Unidades.$O$3:.$O$17];">="&[.G628]);"") ->  | I628: of:=IF([.H627]<>[.H628];"INICIO";IF([.H629]<>[.H628];"FIN";"")) ->  | J628: of:=IF([.K627]<>[.K628];"INICIO";IF([.K629]<>[.K628];"FIN";"")) -> 
A629: of:=IF([.B629]<>"";TODAY()>[.B629];"") ->  | B629: of:=IFERROR(IF(([.B628]+1)<[Calendario.$F$5];[.B628]+1;"");"") ->  | C629: of:=IF(AND([.B629]>=[Calendario.$F$8];[.B629]<=[Calendario.$F$9];1);1;IF(AND([.B629]>=[Calendario.$F$12];[.B629]<=[Calendario.$F$13]);2;IF(AND([.B629]>=[Calendario.$F$16];[.B629]<=[Calendario.$F$17]);3;""))) ->  | D629: of:=IF(COUNTIF([Calendario.$H$4:.$H$48];[.B629])>0;"FIESTA";"") -> FIESTA | E629: of:=IF([.B629]<>"";VLOOKUP(WEEKDAY([.B629];3);[Calendario.$A$4:.$C$11];2);"") ->  | F629: of:=IF([.B629]<>"";IF([.D629]<>"FIESTA";VLOOKUP(WEEKDAY([.B629];3);[Calendario.$A$4:.$C$11];3);0);"") ->  | G629: of:=IF(ISNUMBER([.F629]);[.F629]+[.G628];"") ->  | H629: of:=IF(AND([.G629]<=[Unidades.$G$26];[.G629]<=[Unidades.$F$18];[Unidades.$F$18]>0);[Unidades.$D$18]+1-COUNTIFS([Unidades.$O$3:.$O$17];">="&[.G629]);"") ->  | I629: of:=IF([.H628]<>[.H629];"INICIO";IF([.H630]<>[.H629];"FIN";"")) ->  | J629: of:=IF([.K628]<>[.K629];"INICIO";IF([.K630]<>[.K629];"FIN";"")) -> 
A630: of:=IF([.B630]<>"";TODAY()>[.B630];"") ->  | B630: of:=IFERROR(IF(([.B629]+1)<[Calendario.$F$5];[.B629]+1;"");"") ->  | C630: of:=IF(AND([.B630]>=[Calendario.$F$8];[.B630]<=[Calendario.$F$9];1);1;IF(AND([.B630]>=[Calendario.$F$12];[.B630]<=[Calendario.$F$13]);2;IF(AND([.B630]>=[Calendario.$F$16];[.B630]<=[Calendario.$F$17]);3;""))) ->  | D630: of:=IF(COUNTIF([Calendario.$H$4:.$H$48];[.B630])>0;"FIESTA";"") -> FIESTA | E630: of:=IF([.B630]<>"";VLOOKUP(WEEKDAY([.B630];3);[Calendario.$A$4:.$C$11];2);"") ->  | F630: of:=IF([.B630]<>"";IF([.D630]<>"FIESTA";VLOOKUP(WEEKDAY([.B630];3);[Calendario.$A$4:.$C$11];3);0);"") ->  | G630: of:=IF(ISNUMBER([.F630]);[.F630]+[.G629];"") ->  | H630: of:=IF(AND([.G630]<=[Unidades.$G$26];[.G630]<=[Unidades.$F$18];[Unidades.$F$18]>0);[Unidades.$D$18]+1-COUNTIFS([Unidades.$O$3:.$O$17];">="&[.G630]);"") ->  | I630: of:=IF([.H629]<>[.H630];"INICIO";IF([.H631]<>[.H630];"FIN";"")) ->  | J630: of:=IF([.K629]<>[.K630];"INICIO";IF([.K631]<>[.K630];"FIN";"")) -> 
A631: of:=IF([.B631]<>"";TODAY()>[.B631];"") ->  | B631: of:=IFERROR(IF(([.B630]+1)<[Calendario.$F$5];[.B630]+1;"");"") ->  | C631: of:=IF(AND([.B631]>=[Calendario.$F$8];[.B631]<=[Calendario.$F$9];1);1;IF(AND([.B631]>=[Calendario.$F$12];[.B631]<=[Calendario.$F$13]);2;IF(AND([.B631]>=[Calendario.$F$16];[.B631]<=[Calendario.$F$17]);3;""))) ->  | D631: of:=IF(COUNTIF([Calendario.$H$4:.$H$48];[.B631])>0;"FIESTA";"") -> FIESTA | E631: of:=IF([.B631]<>"";VLOOKUP(WEEKDAY([.B631];3);[Calendario.$A$4:.$C$11];2);"") ->  | F631: of:=IF([.B631]<>"";IF([.D631]<>"FIESTA";VLOOKUP(WEEKDAY([.B631];3);[Calendario.$A$4:.$C$11];3);0);"") ->  | G631: of:=IF(ISNUMBER([.F631]);[.F631]+[.G630];"") ->  | H631: of:=IF(AND([.G631]<=[Unidades.$G$26];[.G631]<=[Unidades.$F$18];[Unidades.$F$18]>0);[Unidades.$D$18]+1-COUNTIFS([Unidades.$O$3:.$O$17];">="&[.G631]);"") ->  | I631: of:=IF([.H630]<>[.H631];"INICIO";IF([.H632]<>[.H631];"FIN";"")) ->  | J631: of:=IF([.K630]<>[.K631];"INICIO";IF([.K632]<>[.K631];"FIN";"")) -> 
A632: of:=IF([.B632]<>"";TODAY()>[.B632];"") ->  | B632: of:=IFERROR(IF(([.B631]+1)<[Calendario.$F$5];[.B631]+1;"");"") ->  | C632: of:=IF(AND([.B632]>=[Calendario.$F$8];[.B632]<=[Calendario.$F$9];1);1;IF(AND([.B632]>=[Calendario.$F$12];[.B632]<=[Calendario.$F$13]);2;IF(AND([.B632]>=[Calendario.$F$16];[.B632]<=[Calendario.$F$17]);3;""))) ->  | D632: of:=IF(COUNTIF([Calendario.$H$4:.$H$48];[.B632])>0;"FIESTA";"") -> FIESTA | E632: of:=IF([.B632]<>"";VLOOKUP(WEEKDAY([.B632];3);[Calendario.$A$4:.$C$11];2);"") ->  | F632: of:=IF([.B632]<>"";IF([.D632]<>"FIESTA";VLOOKUP(WEEKDAY([.B632];3);[Calendario.$A$4:.$C$11];3);0);"") ->  | G632: of:=IF(ISNUMBER([.F632]);[.F632]+[.G631];"") ->  | H632: of:=IF(AND([.G632]<=[Unidades.$G$26];[.G632]<=[Unidades.$F$18];[Unidades.$F$18]>0);[Unidades.$D$18]+1-COUNTIFS([Unidades.$O$3:.$O$17];">="&[.G632]);"") ->  | I632: of:=IF([.H631]<>[.H632];"INICIO";IF([.H633]<>[.H632];"FIN";"")) ->  | J632: of:=IF([.K631]<>[.K632];"INICIO";IF([.K633]<>[.K632];"FIN";"")) -> 
A633: of:=IF([.B633]<>"";TODAY()>[.B633];"") ->  | B633: of:=IFERROR(IF(([.B632]+1)<[Calendario.$F$5];[.B632]+1;"");"") ->  | C633: of:=IF(AND([.B633]>=[Calendario.$F$8];[.B633]<=[Calendario.$F$9];1);1;IF(AND([.B633]>=[Calendario.$F$12];[.B633]<=[Calendario.$F$13]);2;IF(AND([.B633]>=[Calendario.$F$16];[.B633]<=[Calendario.$F$17]);3;""))) ->  | D633: of:=IF(COUNTIF([Calendario.$H$4:.$H$48];[.B633])>0;"FIESTA";"") -> FIESTA | E633: of:=IF([.B633]<>"";VLOOKUP(WEEKDAY([.B633];3);[Calendario.$A$4:.$C$11];2);"") ->  | F633: of:=IF([.B633]<>"";IF([.D633]<>"FIESTA";VLOOKUP(WEEKDAY([.B633];3);[Calendario.$A$4:.$C$11];3);0);"") ->  | G633: of:=IF(ISNUMBER([.F633]);[.F633]+[.G632];"") ->  | H633: of:=IF(AND([.G633]<=[Unidades.$G$26];[.G633]<=[Unidades.$F$18];[Unidades.$F$18]>0);[Unidades.$D$18]+1-COUNTIFS([Unidades.$O$3:.$O$17];">="&[.G633]);"") ->  | I633: of:=IF([.H632]<>[.H633];"INICIO";IF([.H634]<>[.H633];"FIN";"")) ->  | J633: of:=IF([.K632]<>[.K633];"INICIO";IF([.K634]<>[.K633];"FIN";"")) -> 
A634: of:=IF([.B634]<>"";TODAY()>[.B634];"") ->  | B634: of:=IFERROR(IF(([.B633]+1)<[Calendario.$F$5];[.B633]+1;"");"") ->  | C634: of:=IF(AND([.B634]>=[Calendario.$F$8];[.B634]<=[Calendario.$F$9];1);1;IF(AND([.B634]>=[Calendario.$F$12];[.B634]<=[Calendario.$F$13]);2;IF(AND([.B634]>=[Calendario.$F$16];[.B634]<=[Calendario.$F$17]);3;""))) ->  | D634: of:=IF(COUNTIF([Calendario.$H$4:.$H$48];[.B634])>0;"FIESTA";"") -> FIESTA | E634: of:=IF([.B634]<>"";VLOOKUP(WEEKDAY([.B634];3);[Calendario.$A$4:.$C$11];2);"") ->  | F634: of:=IF([.B634]<>"";IF([.D634]<>"FIESTA";VLOOKUP(WEEKDAY([.B634];3);[Calendario.$A$4:.$C$11];3);0);"") ->  | G634: of:=IF(ISNUMBER([.F634]);[.F634]+[.G633];"") ->  | H634: of:=IF(AND([.G634]<=[Unidades.$G$26];[.G634]<=[Unidades.$F$18];[Unidades.$F$18]>0);[Unidades.$D$18]+1-COUNTIFS([Unidades.$O$3:.$O$17];">="&[.G634]);"") ->  | I634: of:=IF([.H633]<>[.H634];"INICIO";IF([.H635]<>[.H634];"FIN";"")) ->  | J634: of:=IF([.K633]<>[.K634];"INICIO";IF([.K635]<>[.K634];"FIN";"")) -> 
A635: of:=IF([.B635]<>"";TODAY()>[.B635];"") ->  | B635: of:=IFERROR(IF(([.B634]+1)<[Calendario.$F$5];[.B634]+1;"");"") ->  | C635: of:=IF(AND([.B635]>=[Calendario.$F$8];[.B635]<=[Calendario.$F$9];1);1;IF(AND([.B635]>=[Calendario.$F$12];[.B635]<=[Calendario.$F$13]);2;IF(AND([.B635]>=[Calendario.$F$16];[.B635]<=[Calendario.$F$17]);3;""))) ->  | D635: of:=IF(COUNTIF([Calendario.$H$4:.$H$48];[.B635])>0;"FIESTA";"") -> FIESTA | E635: of:=IF([.B635]<>"";VLOOKUP(WEEKDAY([.B635];3);[Calendario.$A$4:.$C$11];2);"") ->  | F635: of:=IF([.B635]<>"";IF([.D635]<>"FIESTA";VLOOKUP(WEEKDAY([.B635];3);[Calendario.$A$4:.$C$11];3);0);"") ->  | G635: of:=IF(ISNUMBER([.F635]);[.F635]+[.G634];"") ->  | H635: of:=IF(AND([.G635]<=[Unidades.$G$26];[.G635]<=[Unidades.$F$18];[Unidades.$F$18]>0);[Unidades.$D$18]+1-COUNTIFS([Unidades.$O$3:.$O$17];">="&[.G635]);"") ->  | I635: of:=IF([.H634]<>[.H635];"INICIO";IF([.H636]<>[.H635];"FIN";"")) ->  | J635: of:=IF([.K634]<>[.K635];"INICIO";IF([.K636]<>[.K635];"FIN";"")) -> 
A636: of:=IF([.B636]<>"";TODAY()>[.B636];"") ->  | B636: of:=IFERROR(IF(([.B635]+1)<[Calendario.$F$5];[.B635]+1;"");"") ->  | C636: of:=IF(AND([.B636]>=[Calendario.$F$8];[.B636]<=[Calendario.$F$9];1);1;IF(AND([.B636]>=[Calendario.$F$12];[.B636]<=[Calendario.$F$13]);2;IF(AND([.B636]>=[Calendario.$F$16];[.B636]<=[Calendario.$F$17]);3;""))) ->  | D636: of:=IF(COUNTIF([Calendario.$H$4:.$H$48];[.B636])>0;"FIESTA";"") -> FIESTA | E636: of:=IF([.B636]<>"";VLOOKUP(WEEKDAY([.B636];3);[Calendario.$A$4:.$C$11];2);"") ->  | F636: of:=IF([.B636]<>"";IF([.D636]<>"FIESTA";VLOOKUP(WEEKDAY([.B636];3);[Calendario.$A$4:.$C$11];3);0);"") ->  | G636: of:=IF(ISNUMBER([.F636]);[.F636]+[.G635];"") ->  | H636: of:=IF(AND([.G636]<=[Unidades.$G$26];[.G636]<=[Unidades.$F$18];[Unidades.$F$18]>0);[Unidades.$D$18]+1-COUNTIFS([Unidades.$O$3:.$O$17];">="&[.G636]);"") ->  | I636: of:=IF([.H635]<>[.H636];"INICIO";IF([.H637]<>[.H636];"FIN";"")) ->  | J636: of:=IF([.K635]<>[.K636];"INICIO";IF([.K637]<>[.K636];"FIN";"")) -> 
A637: of:=IF([.B637]<>"";TODAY()>[.B637];"") ->  | B637: of:=IFERROR(IF(([.B636]+1)<[Calendario.$F$5];[.B636]+1;"");"") ->  | C637: of:=IF(AND([.B637]>=[Calendario.$F$8];[.B637]<=[Calendario.$F$9];1);1;IF(AND([.B637]>=[Calendario.$F$12];[.B637]<=[Calendario.$F$13]);2;IF(AND([.B637]>=[Calendario.$F$16];[.B637]<=[Calendario.$F$17]);3;""))) ->  | D637: of:=IF(COUNTIF([Calendario.$H$4:.$H$48];[.B637])>0;"FIESTA";"") -> FIESTA | E637: of:=IF([.B637]<>"";VLOOKUP(WEEKDAY([.B637];3);[Calendario.$A$4:.$C$11];2);"") ->  | F637: of:=IF([.B637]<>"";IF([.D637]<>"FIESTA";VLOOKUP(WEEKDAY([.B637];3);[Calendario.$A$4:.$C$11];3);0);"") ->  | G637: of:=IF(ISNUMBER([.F637]);[.F637]+[.G636];"") ->  | H637: of:=IF(AND([.G637]<=[Unidades.$G$26];[.G637]<=[Unidades.$F$18];[Unidades.$F$18]>0);[Unidades.$D$18]+1-COUNTIFS([Unidades.$O$3:.$O$17];">="&[.G637]);"") ->  | I637: of:=IF([.H636]<>[.H637];"INICIO";IF([.H638]<>[.H637];"FIN";"")) ->  | J637: of:=IF([.K636]<>[.K637];"INICIO";IF([.K638]<>[.K637];"FIN";"")) -> 
A638: of:=IF([.B638]<>"";TODAY()>[.B638];"") ->  | B638: of:=IFERROR(IF(([.B637]+1)<[Calendario.$F$5];[.B637]+1;"");"") ->  | C638: of:=IF(AND([.B638]>=[Calendario.$F$8];[.B638]<=[Calendario.$F$9];1);1;IF(AND([.B638]>=[Calendario.$F$12];[.B638]<=[Calendario.$F$13]);2;IF(AND([.B638]>=[Calendario.$F$16];[.B638]<=[Calendario.$F$17]);3;""))) ->  | D638: of:=IF(COUNTIF([Calendario.$H$4:.$H$48];[.B638])>0;"FIESTA";"") -> FIESTA | E638: of:=IF([.B638]<>"";VLOOKUP(WEEKDAY([.B638];3);[Calendario.$A$4:.$C$11];2);"") ->  | F638: of:=IF([.B638]<>"";IF([.D638]<>"FIESTA";VLOOKUP(WEEKDAY([.B638];3);[Calendario.$A$4:.$C$11];3);0);"") ->  | G638: of:=IF(ISNUMBER([.F638]);[.F638]+[.G637];"") ->  | H638: of:=IF(AND([.G638]<=[Unidades.$G$26];[.G638]<=[Unidades.$F$18];[Unidades.$F$18]>0);[Unidades.$D$18]+1-COUNTIFS([Unidades.$O$3:.$O$17];">="&[.G638]);"") ->  | I638: of:=IF([.H637]<>[.H638];"INICIO";IF([.H639]<>[.H638];"FIN";"")) ->  | J638: of:=IF([.K637]<>[.K638];"INICIO";IF([.K639]<>[.K638];"FIN";"")) -> 
A639: of:=IF([.B639]<>"";TODAY()>[.B639];"") ->  | B639: of:=IFERROR(IF(([.B638]+1)<[Calendario.$F$5];[.B638]+1;"");"") ->  | C639: of:=IF(AND([.B639]>=[Calendario.$F$8];[.B639]<=[Calendario.$F$9];1);1;IF(AND([.B639]>=[Calendario.$F$12];[.B639]<=[Calendario.$F$13]);2;IF(AND([.B639]>=[Calendario.$F$16];[.B639]<=[Calendario.$F$17]);3;""))) ->  | D639: of:=IF(COUNTIF([Calendario.$H$4:.$H$48];[.B639])>0;"FIESTA";"") -> FIESTA | E639: of:=IF([.B639]<>"";VLOOKUP(WEEKDAY([.B639];3);[Calendario.$A$4:.$C$11];2);"") ->  | F639: of:=IF([.B639]<>"";IF([.D639]<>"FIESTA";VLOOKUP(WEEKDAY([.B639];3);[Calendario.$A$4:.$C$11];3);0);"") ->  | G639: of:=IF(ISNUMBER([.F639]);[.F639]+[.G638];"") ->  | H639: of:=IF(AND([.G639]<=[Unidades.$G$26];[.G639]<=[Unidades.$F$18];[Unidades.$F$18]>0);[Unidades.$D$18]+1-COUNTIFS([Unidades.$O$3:.$O$17];">="&[.G639]);"") ->  | I639: of:=IF([.H638]<>[.H639];"INICIO";IF([.H640]<>[.H639];"FIN";"")) ->  | J639: of:=IF([.K638]<>[.K639];"INICIO";IF([.K640]<>[.K639];"FIN";"")) -> 
A640: of:=IF([.B640]<>"";TODAY()>[.B640];"") ->  | B640: of:=IFERROR(IF(([.B639]+1)<[Calendario.$F$5];[.B639]+1;"");"") ->  | C640: of:=IF(AND([.B640]>=[Calendario.$F$8];[.B640]<=[Calendario.$F$9];1);1;IF(AND([.B640]>=[Calendario.$F$12];[.B640]<=[Calendario.$F$13]);2;IF(AND([.B640]>=[Calendario.$F$16];[.B640]<=[Calendario.$F$17]);3;""))) ->  | D640: of:=IF(COUNTIF([Calendario.$H$4:.$H$48];[.B640])>0;"FIESTA";"") -> FIESTA | E640: of:=IF([.B640]<>"";VLOOKUP(WEEKDAY([.B640];3);[Calendario.$A$4:.$C$11];2);"") ->  | F640: of:=IF([.B640]<>"";IF([.D640]<>"FIESTA";VLOOKUP(WEEKDAY([.B640];3);[Calendario.$A$4:.$C$11];3);0);"") ->  | G640: of:=IF(ISNUMBER([.F640]);[.F640]+[.G639];"") ->  | H640: of:=IF(AND([.G640]<=[Unidades.$G$26];[.G640]<=[Unidades.$F$18];[Unidades.$F$18]>0);[Unidades.$D$18]+1-COUNTIFS([Unidades.$O$3:.$O$17];">="&[.G640]);"") ->  | I640: of:=IF([.H639]<>[.H640];"INICIO";IF([.H641]<>[.H640];"FIN";"")) ->  | J640: of:=IF([.K639]<>[.K640];"INICIO";IF([.K641]<>[.K640];"FIN";"")) -> 
A641: of:=IF([.B641]<>"";TODAY()>[.B641];"") ->  | B641: of:=IFERROR(IF(([.B640]+1)<[Calendario.$F$5];[.B640]+1;"");"") ->  | C641: of:=IF(AND([.B641]>=[Calendario.$F$8];[.B641]<=[Calendario.$F$9];1);1;IF(AND([.B641]>=[Calendario.$F$12];[.B641]<=[Calendario.$F$13]);2;IF(AND([.B641]>=[Calendario.$F$16];[.B641]<=[Calendario.$F$17]);3;""))) ->  | D641: of:=IF(COUNTIF([Calendario.$H$4:.$H$48];[.B641])>0;"FIESTA";"") -> FIESTA | E641: of:=IF([.B641]<>"";VLOOKUP(WEEKDAY([.B641];3);[Calendario.$A$4:.$C$11];2);"") ->  | F641: of:=IF([.B641]<>"";IF([.D641]<>"FIESTA";VLOOKUP(WEEKDAY([.B641];3);[Calendario.$A$4:.$C$11];3);0);"") ->  | G641: of:=IF(ISNUMBER([.F641]);[.F641]+[.G640];"") ->  | H641: of:=IF(AND([.G641]<=[Unidades.$G$26];[.G641]<=[Unidades.$F$18];[Unidades.$F$18]>0);[Unidades.$D$18]+1-COUNTIFS([Unidades.$O$3:.$O$17];">="&[.G641]);"") ->  | I641: of:=IF([.H640]<>[.H641];"INICIO";IF([.H642]<>[.H641];"FIN";"")) ->  | J641: of:=IF([.K640]<>[.K641];"INICIO";IF([.K642]<>[.K641];"FIN";"")) -> 
A642: of:=IF([.B642]<>"";TODAY()>[.B642];"") ->  | B642: of:=IFERROR(IF(([.B641]+1)<[Calendario.$F$5];[.B641]+1;"");"") ->  | C642: of:=IF(AND([.B642]>=[Calendario.$F$8];[.B642]<=[Calendario.$F$9];1);1;IF(AND([.B642]>=[Calendario.$F$12];[.B642]<=[Calendario.$F$13]);2;IF(AND([.B642]>=[Calendario.$F$16];[.B642]<=[Calendario.$F$17]);3;""))) ->  | D642: of:=IF(COUNTIF([Calendario.$H$4:.$H$48];[.B642])>0;"FIESTA";"") -> FIESTA | E642: of:=IF([.B642]<>"";VLOOKUP(WEEKDAY([.B642];3);[Calendario.$A$4:.$C$11];2);"") ->  | F642: of:=IF([.B642]<>"";IF([.D642]<>"FIESTA";VLOOKUP(WEEKDAY([.B642];3);[Calendario.$A$4:.$C$11];3);0);"") ->  | G642: of:=IF(ISNUMBER([.F642]);[.F642]+[.G641];"") ->  | H642: of:=IF(AND([.G642]<=[Unidades.$G$26];[.G642]<=[Unidades.$F$18];[Unidades.$F$18]>0);[Unidades.$D$18]+1-COUNTIFS([Unidades.$O$3:.$O$17];">="&[.G642]);"") ->  | I642: of:=IF([.H641]<>[.H642];"INICIO";IF([.H643]<>[.H642];"FIN";"")) ->  | J642: of:=IF([.K641]<>[.K642];"INICIO";IF([.K643]<>[.K642];"FIN";"")) -> 
A643: of:=IF([.B643]<>"";TODAY()>[.B643];"") ->  | B643: of:=IFERROR(IF(([.B642]+1)<[Calendario.$F$5];[.B642]+1;"");"") ->  | C643: of:=IF(AND([.B643]>=[Calendario.$F$8];[.B643]<=[Calendario.$F$9];1);1;IF(AND([.B643]>=[Calendario.$F$12];[.B643]<=[Calendario.$F$13]);2;IF(AND([.B643]>=[Calendario.$F$16];[.B643]<=[Calendario.$F$17]);3;""))) ->  | D643: of:=IF(COUNTIF([Calendario.$H$4:.$H$48];[.B643])>0;"FIESTA";"") -> FIESTA | E643: of:=IF([.B643]<>"";VLOOKUP(WEEKDAY([.B643];3);[Calendario.$A$4:.$C$11];2);"") ->  | F643: of:=IF([.B643]<>"";IF([.D643]<>"FIESTA";VLOOKUP(WEEKDAY([.B643];3);[Calendario.$A$4:.$C$11];3);0);"") ->  | G643: of:=IF(ISNUMBER([.F643]);[.F643]+[.G642];"") ->  | H643: of:=IF(AND([.G643]<=[Unidades.$G$26];[.G643]<=[Unidades.$F$18];[Unidades.$F$18]>0);[Unidades.$D$18]+1-COUNTIFS([Unidades.$O$3:.$O$17];">="&[.G643]);"") ->  | I643: of:=IF([.H642]<>[.H643];"INICIO";IF([.H644]<>[.H643];"FIN";"")) ->  | J643: of:=IF([.K642]<>[.K643];"INICIO";IF([.K644]<>[.K643];"FIN";"")) -> 
A644: of:=IF([.B644]<>"";TODAY()>[.B644];"") ->  | B644: of:=IFERROR(IF(([.B643]+1)<[Calendario.$F$5];[.B643]+1;"");"") ->  | C644: of:=IF(AND([.B644]>=[Calendario.$F$8];[.B644]<=[Calendario.$F$9];1);1;IF(AND([.B644]>=[Calendario.$F$12];[.B644]<=[Calendario.$F$13]);2;IF(AND([.B644]>=[Calendario.$F$16];[.B644]<=[Calendario.$F$17]);3;""))) ->  | D644: of:=IF(COUNTIF([Calendario.$H$4:.$H$48];[.B644])>0;"FIESTA";"") -> FIESTA | E644: of:=IF([.B644]<>"";VLOOKUP(WEEKDAY([.B644];3);[Calendario.$A$4:.$C$11];2);"") ->  | F644: of:=IF([.B644]<>"";IF([.D644]<>"FIESTA";VLOOKUP(WEEKDAY([.B644];3);[Calendario.$A$4:.$C$11];3);0);"") ->  | G644: of:=IF(ISNUMBER([.F644]);[.F644]+[.G643];"") ->  | H644: of:=IF(AND([.G644]<=[Unidades.$G$26];[.G644]<=[Unidades.$F$18];[Unidades.$F$18]>0);[Unidades.$D$18]+1-COUNTIFS([Unidades.$O$3:.$O$17];">="&[.G644]);"") ->  | I644: of:=IF([.H643]<>[.H644];"INICIO";IF([.H645]<>[.H644];"FIN";"")) ->  | J644: of:=IF([.K643]<>[.K644];"INICIO";IF([.K645]<>[.K644];"FIN";"")) -> 
A645: of:=IF([.B645]<>"";TODAY()>[.B645];"") ->  | B645: of:=IFERROR(IF(([.B644]+1)<[Calendario.$F$5];[.B644]+1;"");"") ->  | C645: of:=IF(AND([.B645]>=[Calendario.$F$8];[.B645]<=[Calendario.$F$9];1);1;IF(AND([.B645]>=[Calendario.$F$12];[.B645]<=[Calendario.$F$13]);2;IF(AND([.B645]>=[Calendario.$F$16];[.B645]<=[Calendario.$F$17]);3;""))) ->  | D645: of:=IF(COUNTIF([Calendario.$H$4:.$H$48];[.B645])>0;"FIESTA";"") -> FIESTA | E645: of:=IF([.B645]<>"";VLOOKUP(WEEKDAY([.B645];3);[Calendario.$A$4:.$C$11];2);"") ->  | F645: of:=IF([.B645]<>"";IF([.D645]<>"FIESTA";VLOOKUP(WEEKDAY([.B645];3);[Calendario.$A$4:.$C$11];3);0);"") ->  | G645: of:=IF(ISNUMBER([.F645]);[.F645]+[.G644];"") ->  | H645: of:=IF(AND([.G645]<=[Unidades.$G$26];[.G645]<=[Unidades.$F$18];[Unidades.$F$18]>0);[Unidades.$D$18]+1-COUNTIFS([Unidades.$O$3:.$O$17];">="&[.G645]);"") ->  | I645: of:=IF([.H644]<>[.H645];"INICIO";IF([.H646]<>[.H645];"FIN";"")) ->  | J645: of:=IF([.K644]<>[.K645];"INICIO";IF([.K646]<>[.K645];"FIN";"")) -> 
A646: of:=IF([.B646]<>"";TODAY()>[.B646];"") ->  | B646: of:=IFERROR(IF(([.B645]+1)<[Calendario.$F$5];[.B645]+1;"");"") ->  | C646: of:=IF(AND([.B646]>=[Calendario.$F$8];[.B646]<=[Calendario.$F$9];1);1;IF(AND([.B646]>=[Calendario.$F$12];[.B646]<=[Calendario.$F$13]);2;IF(AND([.B646]>=[Calendario.$F$16];[.B646]<=[Calendario.$F$17]);3;""))) ->  | D646: of:=IF(COUNTIF([Calendario.$H$4:.$H$48];[.B646])>0;"FIESTA";"") -> FIESTA | E646: of:=IF([.B646]<>"";VLOOKUP(WEEKDAY([.B646];3);[Calendario.$A$4:.$C$11];2);"") ->  | F646: of:=IF([.B646]<>"";IF([.D646]<>"FIESTA";VLOOKUP(WEEKDAY([.B646];3);[Calendario.$A$4:.$C$11];3);0);"") ->  | G646: of:=IF(ISNUMBER([.F646]);[.F646]+[.G645];"") ->  | H646: of:=IF(AND([.G646]<=[Unidades.$G$26];[.G646]<=[Unidades.$F$18];[Unidades.$F$18]>0);[Unidades.$D$18]+1-COUNTIFS([Unidades.$O$3:.$O$17];">="&[.G646]);"") ->  | I646: of:=IF([.H645]<>[.H646];"INICIO";IF([.H647]<>[.H646];"FIN";"")) ->  | J646: of:=IF([.K645]<>[.K646];"INICIO";IF([.K647]<>[.K646];"FIN";"")) -> 
A647: of:=IF([.B647]<>"";TODAY()>[.B647];"") ->  | B647: of:=IFERROR(IF(([.B646]+1)<[Calendario.$F$5];[.B646]+1;"");"") ->  | C647: of:=IF(AND([.B647]>=[Calendario.$F$8];[.B647]<=[Calendario.$F$9];1);1;IF(AND([.B647]>=[Calendario.$F$12];[.B647]<=[Calendario.$F$13]);2;IF(AND([.B647]>=[Calendario.$F$16];[.B647]<=[Calendario.$F$17]);3;""))) ->  | D647: of:=IF(COUNTIF([Calendario.$H$4:.$H$48];[.B647])>0;"FIESTA";"") -> FIESTA | E647: of:=IF([.B647]<>"";VLOOKUP(WEEKDAY([.B647];3);[Calendario.$A$4:.$C$11];2);"") ->  | F647: of:=IF([.B647]<>"";IF([.D647]<>"FIESTA";VLOOKUP(WEEKDAY([.B647];3);[Calendario.$A$4:.$C$11];3);0);"") ->  | G647: of:=IF(ISNUMBER([.F647]);[.F647]+[.G646];"") ->  | H647: of:=IF(AND([.G647]<=[Unidades.$G$26];[.G647]<=[Unidades.$F$18];[Unidades.$F$18]>0);[Unidades.$D$18]+1-COUNTIFS([Unidades.$O$3:.$O$17];">="&[.G647]);"") ->  | I647: of:=IF([.H646]<>[.H647];"INICIO";IF([.H648]<>[.H647];"FIN";"")) ->  | J647: of:=IF([.K646]<>[.K647];"INICIO";IF([.K648]<>[.K647];"FIN";"")) -> 
A648: of:=IF([.B648]<>"";TODAY()>[.B648];"") ->  | B648: of:=IFERROR(IF(([.B647]+1)<[Calendario.$F$5];[.B647]+1;"");"") ->  | C648: of:=IF(AND([.B648]>=[Calendario.$F$8];[.B648]<=[Calendario.$F$9];1);1;IF(AND([.B648]>=[Calendario.$F$12];[.B648]<=[Calendario.$F$13]);2;IF(AND([.B648]>=[Calendario.$F$16];[.B648]<=[Calendario.$F$17]);3;""))) ->  | D648: of:=IF(COUNTIF([Calendario.$H$4:.$H$48];[.B648])>0;"FIESTA";"") -> FIESTA | E648: of:=IF([.B648]<>"";VLOOKUP(WEEKDAY([.B648];3);[Calendario.$A$4:.$C$11];2);"") ->  | F648: of:=IF([.B648]<>"";IF([.D648]<>"FIESTA";VLOOKUP(WEEKDAY([.B648];3);[Calendario.$A$4:.$C$11];3);0);"") ->  | G648: of:=IF(ISNUMBER([.F648]);[.F648]+[.G647];"") ->  | H648: of:=IF(AND([.G648]<=[Unidades.$G$26];[.G648]<=[Unidades.$F$18];[Unidades.$F$18]>0);[Unidades.$D$18]+1-COUNTIFS([Unidades.$O$3:.$O$17];">="&[.G648]);"") ->  | I648: of:=IF([.H647]<>[.H648];"INICIO";IF([.H649]<>[.H648];"FIN";"")) ->  | J648: of:=IF([.K647]<>[.K648];"INICIO";IF([.K649]<>[.K648];"FIN";"")) -> 
A649: of:=IF([.B649]<>"";TODAY()>[.B649];"") ->  | B649: of:=IFERROR(IF(([.B648]+1)<[Calendario.$F$5];[.B648]+1;"");"") ->  | C649: of:=IF(AND([.B649]>=[Calendario.$F$8];[.B649]<=[Calendario.$F$9];1);1;IF(AND([.B649]>=[Calendario.$F$12];[.B649]<=[Calendario.$F$13]);2;IF(AND([.B649]>=[Calendario.$F$16];[.B649]<=[Calendario.$F$17]);3;""))) ->  | D649: of:=IF(COUNTIF([Calendario.$H$4:.$H$48];[.B649])>0;"FIESTA";"") -> FIESTA | E649: of:=IF([.B649]<>"";VLOOKUP(WEEKDAY([.B649];3);[Calendario.$A$4:.$C$11];2);"") ->  | F649: of:=IF([.B649]<>"";IF([.D649]<>"FIESTA";VLOOKUP(WEEKDAY([.B649];3);[Calendario.$A$4:.$C$11];3);0);"") ->  | G649: of:=IF(ISNUMBER([.F649]);[.F649]+[.G648];"") ->  | H649: of:=IF(AND([.G649]<=[Unidades.$G$26];[.G649]<=[Unidades.$F$18];[Unidades.$F$18]>0);[Unidades.$D$18]+1-COUNTIFS([Unidades.$O$3:.$O$17];">="&[.G649]);"") ->  | I649: of:=IF([.H648]<>[.H649];"INICIO";IF([.H650]<>[.H649];"FIN";"")) ->  | J649: of:=IF([.K648]<>[.K649];"INICIO";IF([.K650]<>[.K649];"FIN";"")) -> 
A650: of:=IF([.B650]<>"";TODAY()>[.B650];"") ->  | B650: of:=IFERROR(IF(([.B649]+1)<[Calendario.$F$5];[.B649]+1;"");"") ->  | C650: of:=IF(AND([.B650]>=[Calendario.$F$8];[.B650]<=[Calendario.$F$9];1);1;IF(AND([.B650]>=[Calendario.$F$12];[.B650]<=[Calendario.$F$13]);2;IF(AND([.B650]>=[Calendario.$F$16];[.B650]<=[Calendario.$F$17]);3;""))) ->  | D650: of:=IF(COUNTIF([Calendario.$H$4:.$H$48];[.B650])>0;"FIESTA";"") -> FIESTA | E650: of:=IF([.B650]<>"";VLOOKUP(WEEKDAY([.B650];3);[Calendario.$A$4:.$C$11];2);"") ->  | F650: of:=IF([.B650]<>"";IF([.D650]<>"FIESTA";VLOOKUP(WEEKDAY([.B650];3);[Calendario.$A$4:.$C$11];3);0);"") ->  | G650: of:=IF(ISNUMBER([.F650]);[.F650]+[.G649];"") ->  | H650: of:=IF(AND([.G650]<=[Unidades.$G$26];[.G650]<=[Unidades.$F$18];[Unidades.$F$18]>0);[Unidades.$D$18]+1-COUNTIFS([Unidades.$O$3:.$O$17];">="&[.G650]);"") ->  | I650: of:=IF([.H649]<>[.H650];"INICIO";IF([.H651]<>[.H650];"FIN";"")) ->  | J650: of:=IF([.K649]<>[.K650];"INICIO";IF([.K651]<>[.K650];"FIN";"")) -> 
A651: of:=IF([.B651]<>"";TODAY()>[.B651];"") ->  | B651: of:=IFERROR(IF(([.B650]+1)<[Calendario.$F$5];[.B650]+1;"");"") ->  | C651: of:=IF(AND([.B651]>=[Calendario.$F$8];[.B651]<=[Calendario.$F$9];1);1;IF(AND([.B651]>=[Calendario.$F$12];[.B651]<=[Calendario.$F$13]);2;IF(AND([.B651]>=[Calendario.$F$16];[.B651]<=[Calendario.$F$17]);3;""))) ->  | D651: of:=IF(COUNTIF([Calendario.$H$4:.$H$48];[.B651])>0;"FIESTA";"") -> FIESTA | E651: of:=IF([.B651]<>"";VLOOKUP(WEEKDAY([.B651];3);[Calendario.$A$4:.$C$11];2);"") ->  | F651: of:=IF([.B651]<>"";IF([.D651]<>"FIESTA";VLOOKUP(WEEKDAY([.B651];3);[Calendario.$A$4:.$C$11];3);0);"") ->  | G651: of:=IF(ISNUMBER([.F651]);[.F651]+[.G650];"") ->  | H651: of:=IF(AND([.G651]<=[Unidades.$G$26];[.G651]<=[Unidades.$F$18];[Unidades.$F$18]>0);[Unidades.$D$18]+1-COUNTIFS([Unidades.$O$3:.$O$17];">="&[.G651]);"") ->  | I651: of:=IF([.H650]<>[.H651];"INICIO";IF([.H652]<>[.H651];"FIN";"")) ->  | J651: of:=IF([.K650]<>[.K651];"INICIO";IF([.K652]<>[.K651];"FIN";"")) -> 
A652: of:=IF([.B652]<>"";TODAY()>[.B652];"") ->  | B652: of:=IFERROR(IF(([.B651]+1)<[Calendario.$F$5];[.B651]+1;"");"") ->  | C652: of:=IF(AND([.B652]>=[Calendario.$F$8];[.B652]<=[Calendario.$F$9];1);1;IF(AND([.B652]>=[Calendario.$F$12];[.B652]<=[Calendario.$F$13]);2;IF(AND([.B652]>=[Calendario.$F$16];[.B652]<=[Calendario.$F$17]);3;""))) ->  | D652: of:=IF(COUNTIF([Calendario.$H$4:.$H$48];[.B652])>0;"FIESTA";"") -> FIESTA | E652: of:=IF([.B652]<>"";VLOOKUP(WEEKDAY([.B652];3);[Calendario.$A$4:.$C$11];2);"") ->  | F652: of:=IF([.B652]<>"";IF([.D652]<>"FIESTA";VLOOKUP(WEEKDAY([.B652];3);[Calendario.$A$4:.$C$11];3);0);"") ->  | G652: of:=IF(ISNUMBER([.F652]);[.F652]+[.G651];"") ->  | H652: of:=IF(AND([.G652]<=[Unidades.$G$26];[.G652]<=[Unidades.$F$18];[Unidades.$F$18]>0);[Unidades.$D$18]+1-COUNTIFS([Unidades.$O$3:.$O$17];">="&[.G652]);"") ->  | I652: of:=IF([.H651]<>[.H652];"INICIO";IF([.H653]<>[.H652];"FIN";"")) ->  | J652: of:=IF([.K651]<>[.K652];"INICIO";IF([.K653]<>[.K652];"FIN";"")) -> 
A653: of:=IF([.B653]<>"";TODAY()>[.B653];"") ->  | B653: of:=IFERROR(IF(([.B652]+1)<[Calendario.$F$5];[.B652]+1;"");"") ->  | C653: of:=IF(AND([.B653]>=[Calendario.$F$8];[.B653]<=[Calendario.$F$9];1);1;IF(AND([.B653]>=[Calendario.$F$12];[.B653]<=[Calendario.$F$13]);2;IF(AND([.B653]>=[Calendario.$F$16];[.B653]<=[Calendario.$F$17]);3;""))) ->  | D653: of:=IF(COUNTIF([Calendario.$H$4:.$H$48];[.B653])>0;"FIESTA";"") -> FIESTA | E653: of:=IF([.B653]<>"";VLOOKUP(WEEKDAY([.B653];3);[Calendario.$A$4:.$C$11];2);"") ->  | F653: of:=IF([.B653]<>"";IF([.D653]<>"FIESTA";VLOOKUP(WEEKDAY([.B653];3);[Calendario.$A$4:.$C$11];3);0);"") ->  | G653: of:=IF(ISNUMBER([.F653]);[.F653]+[.G652];"") ->  | H653: of:=IF(AND([.G653]<=[Unidades.$G$26];[.G653]<=[Unidades.$F$18];[Unidades.$F$18]>0);[Unidades.$D$18]+1-COUNTIFS([Unidades.$O$3:.$O$17];">="&[.G653]);"") ->  | I653: of:=IF([.H652]<>[.H653];"INICIO";IF([.H654]<>[.H653];"FIN";"")) ->  | J653: of:=IF([.K652]<>[.K653];"INICIO";IF([.K654]<>[.K653];"FIN";"")) -> 
A654: of:=IF([.B654]<>"";TODAY()>[.B654];"") ->  | B654: of:=IFERROR(IF(([.B653]+1)<[Calendario.$F$5];[.B653]+1;"");"") ->  | C654: of:=IF(AND([.B654]>=[Calendario.$F$8];[.B654]<=[Calendario.$F$9];1);1;IF(AND([.B654]>=[Calendario.$F$12];[.B654]<=[Calendario.$F$13]);2;IF(AND([.B654]>=[Calendario.$F$16];[.B654]<=[Calendario.$F$17]);3;""))) ->  | D654: of:=IF(COUNTIF([Calendario.$H$4:.$H$48];[.B654])>0;"FIESTA";"") -> FIESTA | E654: of:=IF([.B654]<>"";VLOOKUP(WEEKDAY([.B654];3);[Calendario.$A$4:.$C$11];2);"") ->  | F654: of:=IF([.B654]<>"";IF([.D654]<>"FIESTA";VLOOKUP(WEEKDAY([.B654];3);[Calendario.$A$4:.$C$11];3);0);"") ->  | G654: of:=IF(ISNUMBER([.F654]);[.F654]+[.G653];"") ->  | H654: of:=IF(AND([.G654]<=[Unidades.$G$26];[.G654]<=[Unidades.$F$18];[Unidades.$F$18]>0);[Unidades.$D$18]+1-COUNTIFS([Unidades.$O$3:.$O$17];">="&[.G654]);"") ->  | I654: of:=IF([.H653]<>[.H654];"INICIO";IF([.H655]<>[.H654];"FIN";"")) ->  | J654: of:=IF([.K653]<>[.K654];"INICIO";IF([.K655]<>[.K654];"FIN";"")) -> 
A655: of:=IF([.B655]<>"";TODAY()>[.B655];"") ->  | B655: of:=IFERROR(IF(([.B654]+1)<[Calendario.$F$5];[.B654]+1;"");"") ->  | C655: of:=IF(AND([.B655]>=[Calendario.$F$8];[.B655]<=[Calendario.$F$9];1);1;IF(AND([.B655]>=[Calendario.$F$12];[.B655]<=[Calendario.$F$13]);2;IF(AND([.B655]>=[Calendario.$F$16];[.B655]<=[Calendario.$F$17]);3;""))) ->  | D655: of:=IF(COUNTIF([Calendario.$H$4:.$H$48];[.B655])>0;"FIESTA";"") -> FIESTA | E655: of:=IF([.B655]<>"";VLOOKUP(WEEKDAY([.B655];3);[Calendario.$A$4:.$C$11];2);"") ->  | F655: of:=IF([.B655]<>"";IF([.D655]<>"FIESTA";VLOOKUP(WEEKDAY([.B655];3);[Calendario.$A$4:.$C$11];3);0);"") ->  | G655: of:=IF(ISNUMBER([.F655]);[.F655]+[.G654];"") ->  | H655: of:=IF(AND([.G655]<=[Unidades.$G$26];[.G655]<=[Unidades.$F$18];[Unidades.$F$18]>0);[Unidades.$D$18]+1-COUNTIFS([Unidades.$O$3:.$O$17];">="&[.G655]);"") ->  | I655: of:=IF([.H654]<>[.H655];"INICIO";IF([.H656]<>[.H655];"FIN";"")) ->  | J655: of:=IF([.K654]<>[.K655];"INICIO";IF([.K656]<>[.K655];"FIN";"")) -> 
A656: of:=IF([.B656]<>"";TODAY()>[.B656];"") ->  | B656: of:=IFERROR(IF(([.B655]+1)<[Calendario.$F$5];[.B655]+1;"");"") ->  | C656: of:=IF(AND([.B656]>=[Calendario.$F$8];[.B656]<=[Calendario.$F$9];1);1;IF(AND([.B656]>=[Calendario.$F$12];[.B656]<=[Calendario.$F$13]);2;IF(AND([.B656]>=[Calendario.$F$16];[.B656]<=[Calendario.$F$17]);3;""))) ->  | D656: of:=IF(COUNTIF([Calendario.$H$4:.$H$48];[.B656])>0;"FIESTA";"") -> FIESTA | E656: of:=IF([.B656]<>"";VLOOKUP(WEEKDAY([.B656];3);[Calendario.$A$4:.$C$11];2);"") ->  | F656: of:=IF([.B656]<>"";IF([.D656]<>"FIESTA";VLOOKUP(WEEKDAY([.B656];3);[Calendario.$A$4:.$C$11];3);0);"") ->  | G656: of:=IF(ISNUMBER([.F656]);[.F656]+[.G655];"") ->  | H656: of:=IF(AND([.G656]<=[Unidades.$G$26];[.G656]<=[Unidades.$F$18];[Unidades.$F$18]>0);[Unidades.$D$18]+1-COUNTIFS([Unidades.$O$3:.$O$17];">="&[.G656]);"") ->  | I656: of:=IF([.H655]<>[.H656];"INICIO";IF([.H657]<>[.H656];"FIN";"")) ->  | J656: of:=IF([.K655]<>[.K656];"INICIO";IF([.K657]<>[.K656];"FIN";"")) -> 
A657: of:=IF([.B657]<>"";TODAY()>[.B657];"") ->  | B657: of:=IFERROR(IF(([.B656]+1)<[Calendario.$F$5];[.B656]+1;"");"") ->  | C657: of:=IF(AND([.B657]>=[Calendario.$F$8];[.B657]<=[Calendario.$F$9];1);1;IF(AND([.B657]>=[Calendario.$F$12];[.B657]<=[Calendario.$F$13]);2;IF(AND([.B657]>=[Calendario.$F$16];[.B657]<=[Calendario.$F$17]);3;""))) ->  | D657: of:=IF(COUNTIF([Calendario.$H$4:.$H$48];[.B657])>0;"FIESTA";"") -> FIESTA | E657: of:=IF([.B657]<>"";VLOOKUP(WEEKDAY([.B657];3);[Calendario.$A$4:.$C$11];2);"") ->  | F657: of:=IF([.B657]<>"";IF([.D657]<>"FIESTA";VLOOKUP(WEEKDAY([.B657];3);[Calendario.$A$4:.$C$11];3);0);"") ->  | G657: of:=IF(ISNUMBER([.F657]);[.F657]+[.G656];"") ->  | H657: of:=IF(AND([.G657]<=[Unidades.$G$26];[.G657]<=[Unidades.$F$18];[Unidades.$F$18]>0);[Unidades.$D$18]+1-COUNTIFS([Unidades.$O$3:.$O$17];">="&[.G657]);"") ->  | I657: of:=IF([.H656]<>[.H657];"INICIO";IF([.H658]<>[.H657];"FIN";"")) ->  | J657: of:=IF([.K656]<>[.K657];"INICIO";IF([.K658]<>[.K657];"FIN";"")) -> 
A658: of:=IF([.B658]<>"";TODAY()>[.B658];"") ->  | B658: of:=IFERROR(IF(([.B657]+1)<[Calendario.$F$5];[.B657]+1;"");"") ->  | C658: of:=IF(AND([.B658]>=[Calendario.$F$8];[.B658]<=[Calendario.$F$9];1);1;IF(AND([.B658]>=[Calendario.$F$12];[.B658]<=[Calendario.$F$13]);2;IF(AND([.B658]>=[Calendario.$F$16];[.B658]<=[Calendario.$F$17]);3;""))) ->  | D658: of:=IF(COUNTIF([Calendario.$H$4:.$H$48];[.B658])>0;"FIESTA";"") -> FIESTA | E658: of:=IF([.B658]<>"";VLOOKUP(WEEKDAY([.B658];3);[Calendario.$A$4:.$C$11];2);"") ->  | F658: of:=IF([.B658]<>"";IF([.D658]<>"FIESTA";VLOOKUP(WEEKDAY([.B658];3);[Calendario.$A$4:.$C$11];3);0);"") ->  | G658: of:=IF(ISNUMBER([.F658]);[.F658]+[.G657];"") ->  | H658: of:=IF(AND([.G658]<=[Unidades.$G$26];[.G658]<=[Unidades.$F$18];[Unidades.$F$18]>0);[Unidades.$D$18]+1-COUNTIFS([Unidades.$O$3:.$O$17];">="&[.G658]);"") ->  | I658: of:=IF([.H657]<>[.H658];"INICIO";IF([.H659]<>[.H658];"FIN";"")) ->  | J658: of:=IF([.K657]<>[.K658];"INICIO";IF([.K659]<>[.K658];"FIN";"")) -> 
A659: of:=IF([.B659]<>"";TODAY()>[.B659];"") ->  | B659: of:=IFERROR(IF(([.B658]+1)<[Calendario.$F$5];[.B658]+1;"");"") ->  | C659: of:=IF(AND([.B659]>=[Calendario.$F$8];[.B659]<=[Calendario.$F$9];1);1;IF(AND([.B659]>=[Calendario.$F$12];[.B659]<=[Calendario.$F$13]);2;IF(AND([.B659]>=[Calendario.$F$16];[.B659]<=[Calendario.$F$17]);3;""))) ->  | D659: of:=IF(COUNTIF([Calendario.$H$4:.$H$48];[.B659])>0;"FIESTA";"") -> FIESTA | E659: of:=IF([.B659]<>"";VLOOKUP(WEEKDAY([.B659];3);[Calendario.$A$4:.$C$11];2);"") ->  | F659: of:=IF([.B659]<>"";IF([.D659]<>"FIESTA";VLOOKUP(WEEKDAY([.B659];3);[Calendario.$A$4:.$C$11];3);0);"") ->  | G659: of:=IF(ISNUMBER([.F659]);[.F659]+[.G658];"") ->  | H659: of:=IF(AND([.G659]<=[Unidades.$G$26];[.G659]<=[Unidades.$F$18];[Unidades.$F$18]>0);[Unidades.$D$18]+1-COUNTIFS([Unidades.$O$3:.$O$17];">="&[.G659]);"") ->  | I659: of:=IF([.H658]<>[.H659];"INICIO";IF([.H660]<>[.H659];"FIN";"")) ->  | J659: of:=IF([.K658]<>[.K659];"INICIO";IF([.K660]<>[.K659];"FIN";"")) -> 
A660: of:=IF([.B660]<>"";TODAY()>[.B660];"") ->  | B660: of:=IFERROR(IF(([.B659]+1)<[Calendario.$F$5];[.B659]+1;"");"") ->  | C660: of:=IF(AND([.B660]>=[Calendario.$F$8];[.B660]<=[Calendario.$F$9];1);1;IF(AND([.B660]>=[Calendario.$F$12];[.B660]<=[Calendario.$F$13]);2;IF(AND([.B660]>=[Calendario.$F$16];[.B660]<=[Calendario.$F$17]);3;""))) ->  | D660: of:=IF(COUNTIF([Calendario.$H$4:.$H$48];[.B660])>0;"FIESTA";"") -> FIESTA | E660: of:=IF([.B660]<>"";VLOOKUP(WEEKDAY([.B660];3);[Calendario.$A$4:.$C$11];2);"") ->  | F660: of:=IF([.B660]<>"";IF([.D660]<>"FIESTA";VLOOKUP(WEEKDAY([.B660];3);[Calendario.$A$4:.$C$11];3);0);"") ->  | G660: of:=IF(ISNUMBER([.F660]);[.F660]+[.G659];"") ->  | H660: of:=IF(AND([.G660]<=[Unidades.$G$26];[.G660]<=[Unidades.$F$18];[Unidades.$F$18]>0);[Unidades.$D$18]+1-COUNTIFS([Unidades.$O$3:.$O$17];">="&[.G660]);"") ->  | I660: of:=IF([.H659]<>[.H660];"INICIO";IF([.H661]<>[.H660];"FIN";"")) ->  | J660: of:=IF([.K659]<>[.K660];"INICIO";IF([.K661]<>[.K660];"FIN";"")) -> 
A661: of:=IF([.B661]<>"";TODAY()>[.B661];"") ->  | B661: of:=IFERROR(IF(([.B660]+1)<[Calendario.$F$5];[.B660]+1;"");"") ->  | C661: of:=IF(AND([.B661]>=[Calendario.$F$8];[.B661]<=[Calendario.$F$9];1);1;IF(AND([.B661]>=[Calendario.$F$12];[.B661]<=[Calendario.$F$13]);2;IF(AND([.B661]>=[Calendario.$F$16];[.B661]<=[Calendario.$F$17]);3;""))) ->  | D661: of:=IF(COUNTIF([Calendario.$H$4:.$H$48];[.B661])>0;"FIESTA";"") -> FIESTA | E661: of:=IF([.B661]<>"";VLOOKUP(WEEKDAY([.B661];3);[Calendario.$A$4:.$C$11];2);"") ->  | F661: of:=IF([.B661]<>"";IF([.D661]<>"FIESTA";VLOOKUP(WEEKDAY([.B661];3);[Calendario.$A$4:.$C$11];3);0);"") ->  | G661: of:=IF(ISNUMBER([.F661]);[.F661]+[.G660];"") ->  | H661: of:=IF(AND([.G661]<=[Unidades.$G$26];[.G661]<=[Unidades.$F$18];[Unidades.$F$18]>0);[Unidades.$D$18]+1-COUNTIFS([Unidades.$O$3:.$O$17];">="&[.G661]);"") ->  | I661: of:=IF([.H660]<>[.H661];"INICIO";IF([.H662]<>[.H661];"FIN";"")) ->  | J661: of:=IF([.K660]<>[.K661];"INICIO";IF([.K662]<>[.K661];"FIN";"")) -> 
A662: of:=IF([.B662]<>"";TODAY()>[.B662];"") ->  | B662: of:=IFERROR(IF(([.B661]+1)<[Calendario.$F$5];[.B661]+1;"");"") ->  | C662: of:=IF(AND([.B662]>=[Calendario.$F$8];[.B662]<=[Calendario.$F$9];1);1;IF(AND([.B662]>=[Calendario.$F$12];[.B662]<=[Calendario.$F$13]);2;IF(AND([.B662]>=[Calendario.$F$16];[.B662]<=[Calendario.$F$17]);3;""))) ->  | D662: of:=IF(COUNTIF([Calendario.$H$4:.$H$48];[.B662])>0;"FIESTA";"") -> FIESTA | E662: of:=IF([.B662]<>"";VLOOKUP(WEEKDAY([.B662];3);[Calendario.$A$4:.$C$11];2);"") ->  | F662: of:=IF([.B662]<>"";IF([.D662]<>"FIESTA";VLOOKUP(WEEKDAY([.B662];3);[Calendario.$A$4:.$C$11];3);0);"") ->  | G662: of:=IF(ISNUMBER([.F662]);[.F662]+[.G661];"") ->  | H662: of:=IF(AND([.G662]<=[Unidades.$G$26];[.G662]<=[Unidades.$F$18];[Unidades.$F$18]>0);[Unidades.$D$18]+1-COUNTIFS([Unidades.$O$3:.$O$17];">="&[.G662]);"") ->  | I662: of:=IF([.H661]<>[.H662];"INICIO";IF([.H663]<>[.H662];"FIN";"")) ->  | J662: of:=IF([.K661]<>[.K662];"INICIO";IF([.K663]<>[.K662];"FIN";"")) -> 
A663: of:=IF([.B663]<>"";TODAY()>[.B663];"") ->  | B663: of:=IFERROR(IF(([.B662]+1)<[Calendario.$F$5];[.B662]+1;"");"") ->  | C663: of:=IF(AND([.B663]>=[Calendario.$F$8];[.B663]<=[Calendario.$F$9];1);1;IF(AND([.B663]>=[Calendario.$F$12];[.B663]<=[Calendario.$F$13]);2;IF(AND([.B663]>=[Calendario.$F$16];[.B663]<=[Calendario.$F$17]);3;""))) ->  | D663: of:=IF(COUNTIF([Calendario.$H$4:.$H$48];[.B663])>0;"FIESTA";"") -> FIESTA | E663: of:=IF([.B663]<>"";VLOOKUP(WEEKDAY([.B663];3);[Calendario.$A$4:.$C$11];2);"") ->  | F663: of:=IF([.B663]<>"";IF([.D663]<>"FIESTA";VLOOKUP(WEEKDAY([.B663];3);[Calendario.$A$4:.$C$11];3);0);"") ->  | G663: of:=IF(ISNUMBER([.F663]);[.F663]+[.G662];"") ->  | H663: of:=IF(AND([.G663]<=[Unidades.$G$26];[.G663]<=[Unidades.$F$18];[Unidades.$F$18]>0);[Unidades.$D$18]+1-COUNTIFS([Unidades.$O$3:.$O$17];">="&[.G663]);"") ->  | I663: of:=IF([.H662]<>[.H663];"INICIO";IF([.H664]<>[.H663];"FIN";"")) ->  | J663: of:=IF([.K662]<>[.K663];"INICIO";IF([.K664]<>[.K663];"FIN";"")) -> 
A664: of:=IF([.B664]<>"";TODAY()>[.B664];"") ->  | B664: of:=IFERROR(IF(([.B663]+1)<[Calendario.$F$5];[.B663]+1;"");"") ->  | C664: of:=IF(AND([.B664]>=[Calendario.$F$8];[.B664]<=[Calendario.$F$9];1);1;IF(AND([.B664]>=[Calendario.$F$12];[.B664]<=[Calendario.$F$13]);2;IF(AND([.B664]>=[Calendario.$F$16];[.B664]<=[Calendario.$F$17]);3;""))) ->  | D664: of:=IF(COUNTIF([Calendario.$H$4:.$H$48];[.B664])>0;"FIESTA";"") -> FIESTA | E664: of:=IF([.B664]<>"";VLOOKUP(WEEKDAY([.B664];3);[Calendario.$A$4:.$C$11];2);"") ->  | F664: of:=IF([.B664]<>"";IF([.D664]<>"FIESTA";VLOOKUP(WEEKDAY([.B664];3);[Calendario.$A$4:.$C$11];3);0);"") ->  | G664: of:=IF(ISNUMBER([.F664]);[.F664]+[.G663];"") ->  | H664: of:=IF(AND([.G664]<=[Unidades.$G$26];[.G664]<=[Unidades.$F$18];[Unidades.$F$18]>0);[Unidades.$D$18]+1-COUNTIFS([Unidades.$O$3:.$O$17];">="&[.G664]);"") ->  | I664: of:=IF([.H663]<>[.H664];"INICIO";IF([.H665]<>[.H664];"FIN";"")) ->  | J664: of:=IF([.K663]<>[.K664];"INICIO";IF([.K665]<>[.K664];"FIN";"")) -> 
A665: of:=IF([.B665]<>"";TODAY()>[.B665];"") ->  | B665: of:=IFERROR(IF(([.B664]+1)<[Calendario.$F$5];[.B664]+1;"");"") ->  | C665: of:=IF(AND([.B665]>=[Calendario.$F$8];[.B665]<=[Calendario.$F$9];1);1;IF(AND([.B665]>=[Calendario.$F$12];[.B665]<=[Calendario.$F$13]);2;IF(AND([.B665]>=[Calendario.$F$16];[.B665]<=[Calendario.$F$17]);3;""))) ->  | D665: of:=IF(COUNTIF([Calendario.$H$4:.$H$48];[.B665])>0;"FIESTA";"") -> FIESTA | E665: of:=IF([.B665]<>"";VLOOKUP(WEEKDAY([.B665];3);[Calendario.$A$4:.$C$11];2);"") ->  | F665: of:=IF([.B665]<>"";IF([.D665]<>"FIESTA";VLOOKUP(WEEKDAY([.B665];3);[Calendario.$A$4:.$C$11];3);0);"") ->  | G665: of:=IF(ISNUMBER([.F665]);[.F665]+[.G664];"") ->  | H665: of:=IF(AND([.G665]<=[Unidades.$G$26];[.G665]<=[Unidades.$F$18];[Unidades.$F$18]>0);[Unidades.$D$18]+1-COUNTIFS([Unidades.$O$3:.$O$17];">="&[.G665]);"") ->  | I665: of:=IF([.H664]<>[.H665];"INICIO";IF([.H666]<>[.H665];"FIN";"")) ->  | J665: of:=IF([.K664]<>[.K665];"INICIO";IF([.K666]<>[.K665];"FIN";"")) -> 
A666: of:=IF([.B666]<>"";TODAY()>[.B666];"") ->  | B666: of:=IFERROR(IF(([.B665]+1)<[Calendario.$F$5];[.B665]+1;"");"") ->  | C666: of:=IF(AND([.B666]>=[Calendario.$F$8];[.B666]<=[Calendario.$F$9];1);1;IF(AND([.B666]>=[Calendario.$F$12];[.B666]<=[Calendario.$F$13]);2;IF(AND([.B666]>=[Calendario.$F$16];[.B666]<=[Calendario.$F$17]);3;""))) ->  | D666: of:=IF(COUNTIF([Calendario.$H$4:.$H$48];[.B666])>0;"FIESTA";"") -> FIESTA | E666: of:=IF([.B666]<>"";VLOOKUP(WEEKDAY([.B666];3);[Calendario.$A$4:.$C$11];2);"") ->  | F666: of:=IF([.B666]<>"";IF([.D666]<>"FIESTA";VLOOKUP(WEEKDAY([.B666];3);[Calendario.$A$4:.$C$11];3);0);"") ->  | G666: of:=IF(ISNUMBER([.F666]);[.F666]+[.G665];"") ->  | H666: of:=IF(AND([.G666]<=[Unidades.$G$26];[.G666]<=[Unidades.$F$18];[Unidades.$F$18]>0);[Unidades.$D$18]+1-COUNTIFS([Unidades.$O$3:.$O$17];">="&[.G666]);"") ->  | I666: of:=IF([.H665]<>[.H666];"INICIO";IF([.H667]<>[.H666];"FIN";"")) ->  | J666: of:=IF([.K665]<>[.K666];"INICIO";IF([.K667]<>[.K666];"FIN";"")) -> 
A667: of:=IF([.B667]<>"";TODAY()>[.B667];"") ->  | B667: of:=IFERROR(IF(([.B666]+1)<[Calendario.$F$5];[.B666]+1;"");"") ->  | C667: of:=IF(AND([.B667]>=[Calendario.$F$8];[.B667]<=[Calendario.$F$9];1);1;IF(AND([.B667]>=[Calendario.$F$12];[.B667]<=[Calendario.$F$13]);2;IF(AND([.B667]>=[Calendario.$F$16];[.B667]<=[Calendario.$F$17]);3;""))) ->  | D667: of:=IF(COUNTIF([Calendario.$H$4:.$H$48];[.B667])>0;"FIESTA";"") -> FIESTA | E667: of:=IF([.B667]<>"";VLOOKUP(WEEKDAY([.B667];3);[Calendario.$A$4:.$C$11];2);"") ->  | F667: of:=IF([.B667]<>"";IF([.D667]<>"FIESTA";VLOOKUP(WEEKDAY([.B667];3);[Calendario.$A$4:.$C$11];3);0);"") ->  | G667: of:=IF(ISNUMBER([.F667]);[.F667]+[.G666];"") ->  | H667: of:=IF(AND([.G667]<=[Unidades.$G$26];[.G667]<=[Unidades.$F$18];[Unidades.$F$18]>0);[Unidades.$D$18]+1-COUNTIFS([Unidades.$O$3:.$O$17];">="&[.G667]);"") ->  | I667: of:=IF([.H666]<>[.H667];"INICIO";IF([.H668]<>[.H667];"FIN";"")) ->  | J667: of:=IF([.K666]<>[.K667];"INICIO";IF([.K668]<>[.K667];"FIN";"")) -> 
A668: of:=IF([.B668]<>"";TODAY()>[.B668];"") ->  | B668: of:=IFERROR(IF(([.B667]+1)<[Calendario.$F$5];[.B667]+1;"");"") ->  | C668: of:=IF(AND([.B668]>=[Calendario.$F$8];[.B668]<=[Calendario.$F$9];1);1;IF(AND([.B668]>=[Calendario.$F$12];[.B668]<=[Calendario.$F$13]);2;IF(AND([.B668]>=[Calendario.$F$16];[.B668]<=[Calendario.$F$17]);3;""))) ->  | D668: of:=IF(COUNTIF([Calendario.$H$4:.$H$48];[.B668])>0;"FIESTA";"") -> FIESTA | E668: of:=IF([.B668]<>"";VLOOKUP(WEEKDAY([.B668];3);[Calendario.$A$4:.$C$11];2);"") ->  | F668: of:=IF([.B668]<>"";IF([.D668]<>"FIESTA";VLOOKUP(WEEKDAY([.B668];3);[Calendario.$A$4:.$C$11];3);0);"") ->  | G668: of:=IF(ISNUMBER([.F668]);[.F668]+[.G667];"") ->  | H668: of:=IF(AND([.G668]<=[Unidades.$G$26];[.G668]<=[Unidades.$F$18];[Unidades.$F$18]>0);[Unidades.$D$18]+1-COUNTIFS([Unidades.$O$3:.$O$17];">="&[.G668]);"") ->  | I668: of:=IF([.H667]<>[.H668];"INICIO";IF([.H669]<>[.H668];"FIN";"")) ->  | J668: of:=IF([.K667]<>[.K668];"INICIO";IF([.K669]<>[.K668];"FIN";"")) -> 
A669: of:=IF([.B669]<>"";TODAY()>[.B669];"") ->  | B669: of:=IFERROR(IF(([.B668]+1)<[Calendario.$F$5];[.B668]+1;"");"") ->  | C669: of:=IF(AND([.B669]>=[Calendario.$F$8];[.B669]<=[Calendario.$F$9];1);1;IF(AND([.B669]>=[Calendario.$F$12];[.B669]<=[Calendario.$F$13]);2;IF(AND([.B669]>=[Calendario.$F$16];[.B669]<=[Calendario.$F$17]);3;""))) ->  | D669: of:=IF(COUNTIF([Calendario.$H$4:.$H$48];[.B669])>0;"FIESTA";"") -> FIESTA | E669: of:=IF([.B669]<>"";VLOOKUP(WEEKDAY([.B669];3);[Calendario.$A$4:.$C$11];2);"") ->  | F669: of:=IF([.B669]<>"";IF([.D669]<>"FIESTA";VLOOKUP(WEEKDAY([.B669];3);[Calendario.$A$4:.$C$11];3);0);"") ->  | G669: of:=IF(ISNUMBER([.F669]);[.F669]+[.G668];"") ->  | H669: of:=IF(AND([.G669]<=[Unidades.$G$26];[.G669]<=[Unidades.$F$18];[Unidades.$F$18]>0);[Unidades.$D$18]+1-COUNTIFS([Unidades.$O$3:.$O$17];">="&[.G669]);"") ->  | I669: of:=IF([.H668]<>[.H669];"INICIO";IF([.H670]<>[.H669];"FIN";"")) ->  | J669: of:=IF([.K668]<>[.K669];"INICIO";IF([.K670]<>[.K669];"FIN";"")) -> 
A670: of:=IF([.B670]<>"";TODAY()>[.B670];"") ->  | B670: of:=IFERROR(IF(([.B669]+1)<[Calendario.$F$5];[.B669]+1;"");"") ->  | C670: of:=IF(AND([.B670]>=[Calendario.$F$8];[.B670]<=[Calendario.$F$9];1);1;IF(AND([.B670]>=[Calendario.$F$12];[.B670]<=[Calendario.$F$13]);2;IF(AND([.B670]>=[Calendario.$F$16];[.B670]<=[Calendario.$F$17]);3;""))) ->  | D670: of:=IF(COUNTIF([Calendario.$H$4:.$H$48];[.B670])>0;"FIESTA";"") -> FIESTA | E670: of:=IF([.B670]<>"";VLOOKUP(WEEKDAY([.B670];3);[Calendario.$A$4:.$C$11];2);"") ->  | F670: of:=IF([.B670]<>"";IF([.D670]<>"FIESTA";VLOOKUP(WEEKDAY([.B670];3);[Calendario.$A$4:.$C$11];3);0);"") ->  | G670: of:=IF(ISNUMBER([.F670]);[.F670]+[.G669];"") ->  | H670: of:=IF(AND([.G670]<=[Unidades.$G$26];[.G670]<=[Unidades.$F$18];[Unidades.$F$18]>0);[Unidades.$D$18]+1-COUNTIFS([Unidades.$O$3:.$O$17];">="&[.G670]);"") ->  | I670: of:=IF([.H669]<>[.H670];"INICIO";IF([.H671]<>[.H670];"FIN";"")) ->  | J670: of:=IF([.K669]<>[.K670];"INICIO";IF([.K671]<>[.K670];"FIN";"")) -> 
A671: of:=IF([.B671]<>"";TODAY()>[.B671];"") ->  | B671: of:=IFERROR(IF(([.B670]+1)<[Calendario.$F$5];[.B670]+1;"");"") ->  | C671: of:=IF(AND([.B671]>=[Calendario.$F$8];[.B671]<=[Calendario.$F$9];1);1;IF(AND([.B671]>=[Calendario.$F$12];[.B671]<=[Calendario.$F$13]);2;IF(AND([.B671]>=[Calendario.$F$16];[.B671]<=[Calendario.$F$17]);3;""))) ->  | D671: of:=IF(COUNTIF([Calendario.$H$4:.$H$48];[.B671])>0;"FIESTA";"") -> FIESTA | E671: of:=IF([.B671]<>"";VLOOKUP(WEEKDAY([.B671];3);[Calendario.$A$4:.$C$11];2);"") ->  | F671: of:=IF([.B671]<>"";IF([.D671]<>"FIESTA";VLOOKUP(WEEKDAY([.B671];3);[Calendario.$A$4:.$C$11];3);0);"") ->  | G671: of:=IF(ISNUMBER([.F671]);[.F671]+[.G670];"") ->  | H671: of:=IF(AND([.G671]<=[Unidades.$G$26];[.G671]<=[Unidades.$F$18];[Unidades.$F$18]>0);[Unidades.$D$18]+1-COUNTIFS([Unidades.$O$3:.$O$17];">="&[.G671]);"") ->  | I671: of:=IF([.H670]<>[.H671];"INICIO";IF([.H672]<>[.H671];"FIN";"")) ->  | J671: of:=IF([.K670]<>[.K671];"INICIO";IF([.K672]<>[.K671];"FIN";"")) -> 
A672: of:=IF([.B672]<>"";TODAY()>[.B672];"") ->  | B672: of:=IFERROR(IF(([.B671]+1)<[Calendario.$F$5];[.B671]+1;"");"") ->  | C672: of:=IF(AND([.B672]>=[Calendario.$F$8];[.B672]<=[Calendario.$F$9];1);1;IF(AND([.B672]>=[Calendario.$F$12];[.B672]<=[Calendario.$F$13]);2;IF(AND([.B672]>=[Calendario.$F$16];[.B672]<=[Calendario.$F$17]);3;""))) ->  | D672: of:=IF(COUNTIF([Calendario.$H$4:.$H$48];[.B672])>0;"FIESTA";"") -> FIESTA | E672: of:=IF([.B672]<>"";VLOOKUP(WEEKDAY([.B672];3);[Calendario.$A$4:.$C$11];2);"") ->  | F672: of:=IF([.B672]<>"";IF([.D672]<>"FIESTA";VLOOKUP(WEEKDAY([.B672];3);[Calendario.$A$4:.$C$11];3);0);"") ->  | G672: of:=IF(ISNUMBER([.F672]);[.F672]+[.G671];"") ->  | H672: of:=IF(AND([.G672]<=[Unidades.$G$26];[.G672]<=[Unidades.$F$18];[Unidades.$F$18]>0);[Unidades.$D$18]+1-COUNTIFS([Unidades.$O$3:.$O$17];">="&[.G672]);"") ->  | I672: of:=IF([.H671]<>[.H672];"INICIO";IF([.H673]<>[.H672];"FIN";"")) ->  | J672: of:=IF([.K671]<>[.K672];"INICIO";IF([.K673]<>[.K672];"FIN";"")) -> 
A673: of:=IF([.B673]<>"";TODAY()>[.B673];"") ->  | B673: of:=IFERROR(IF(([.B672]+1)<[Calendario.$F$5];[.B672]+1;"");"") ->  | C673: of:=IF(AND([.B673]>=[Calendario.$F$8];[.B673]<=[Calendario.$F$9];1);1;IF(AND([.B673]>=[Calendario.$F$12];[.B673]<=[Calendario.$F$13]);2;IF(AND([.B673]>=[Calendario.$F$16];[.B673]<=[Calendario.$F$17]);3;""))) ->  | D673: of:=IF(COUNTIF([Calendario.$H$4:.$H$48];[.B673])>0;"FIESTA";"") -> FIESTA | E673: of:=IF([.B673]<>"";VLOOKUP(WEEKDAY([.B673];3);[Calendario.$A$4:.$C$11];2);"") ->  | F673: of:=IF([.B673]<>"";IF([.D673]<>"FIESTA";VLOOKUP(WEEKDAY([.B673];3);[Calendario.$A$4:.$C$11];3);0);"") ->  | G673: of:=IF(ISNUMBER([.F673]);[.F673]+[.G672];"") ->  | H673: of:=IF(AND([.G673]<=[Unidades.$G$26];[.G673]<=[Unidades.$F$18];[Unidades.$F$18]>0);[Unidades.$D$18]+1-COUNTIFS([Unidades.$O$3:.$O$17];">="&[.G673]);"") ->  | I673: of:=IF([.H672]<>[.H673];"INICIO";IF([.H674]<>[.H673];"FIN";"")) ->  | J673: of:=IF([.K672]<>[.K673];"INICIO";IF([.K674]<>[.K673];"FIN";"")) -> 
A674: of:=IF([.B674]<>"";TODAY()>[.B674];"") ->  | B674: of:=IFERROR(IF(([.B673]+1)<[Calendario.$F$5];[.B673]+1;"");"") ->  | C674: of:=IF(AND([.B674]>=[Calendario.$F$8];[.B674]<=[Calendario.$F$9];1);1;IF(AND([.B674]>=[Calendario.$F$12];[.B674]<=[Calendario.$F$13]);2;IF(AND([.B674]>=[Calendario.$F$16];[.B674]<=[Calendario.$F$17]);3;""))) ->  | D674: of:=IF(COUNTIF([Calendario.$H$4:.$H$48];[.B674])>0;"FIESTA";"") -> FIESTA | E674: of:=IF([.B674]<>"";VLOOKUP(WEEKDAY([.B674];3);[Calendario.$A$4:.$C$11];2);"") ->  | F674: of:=IF([.B674]<>"";IF([.D674]<>"FIESTA";VLOOKUP(WEEKDAY([.B674];3);[Calendario.$A$4:.$C$11];3);0);"") ->  | G674: of:=IF(ISNUMBER([.F674]);[.F674]+[.G673];"") ->  | H674: of:=IF(AND([.G674]<=[Unidades.$G$26];[.G674]<=[Unidades.$F$18];[Unidades.$F$18]>0);[Unidades.$D$18]+1-COUNTIFS([Unidades.$O$3:.$O$17];">="&[.G674]);"") ->  | I674: of:=IF([.H673]<>[.H674];"INICIO";IF([.H675]<>[.H674];"FIN";"")) ->  | J674: of:=IF([.K673]<>[.K674];"INICIO";IF([.K675]<>[.K674];"FIN";"")) -> 
A675: of:=IF([.B675]<>"";TODAY()>[.B675];"") ->  | B675: of:=IFERROR(IF(([.B674]+1)<[Calendario.$F$5];[.B674]+1;"");"") ->  | C675: of:=IF(AND([.B675]>=[Calendario.$F$8];[.B675]<=[Calendario.$F$9];1);1;IF(AND([.B675]>=[Calendario.$F$12];[.B675]<=[Calendario.$F$13]);2;IF(AND([.B675]>=[Calendario.$F$16];[.B675]<=[Calendario.$F$17]);3;""))) ->  | D675: of:=IF(COUNTIF([Calendario.$H$4:.$H$48];[.B675])>0;"FIESTA";"") -> FIESTA | E675: of:=IF([.B675]<>"";VLOOKUP(WEEKDAY([.B675];3);[Calendario.$A$4:.$C$11];2);"") ->  | F675: of:=IF([.B675]<>"";IF([.D675]<>"FIESTA";VLOOKUP(WEEKDAY([.B675];3);[Calendario.$A$4:.$C$11];3);0);"") ->  | G675: of:=IF(ISNUMBER([.F675]);[.F675]+[.G674];"") ->  | H675: of:=IF(AND([.G675]<=[Unidades.$G$26];[.G675]<=[Unidades.$F$18];[Unidades.$F$18]>0);[Unidades.$D$18]+1-COUNTIFS([Unidades.$O$3:.$O$17];">="&[.G675]);"") ->  | I675: of:=IF([.H674]<>[.H675];"INICIO";IF([.H676]<>[.H675];"FIN";"")) ->  | J675: of:=IF([.K674]<>[.K675];"INICIO";IF([.K676]<>[.K675];"FIN";"")) -> 
A676: of:=IF([.B676]<>"";TODAY()>[.B676];"") ->  | B676: of:=IFERROR(IF(([.B675]+1)<[Calendario.$F$5];[.B675]+1;"");"") ->  | C676: of:=IF(AND([.B676]>=[Calendario.$F$8];[.B676]<=[Calendario.$F$9];1);1;IF(AND([.B676]>=[Calendario.$F$12];[.B676]<=[Calendario.$F$13]);2;IF(AND([.B676]>=[Calendario.$F$16];[.B676]<=[Calendario.$F$17]);3;""))) ->  | D676: of:=IF(COUNTIF([Calendario.$H$4:.$H$48];[.B676])>0;"FIESTA";"") -> FIESTA | E676: of:=IF([.B676]<>"";VLOOKUP(WEEKDAY([.B676];3);[Calendario.$A$4:.$C$11];2);"") ->  | F676: of:=IF([.B676]<>"";IF([.D676]<>"FIESTA";VLOOKUP(WEEKDAY([.B676];3);[Calendario.$A$4:.$C$11];3);0);"") ->  | G676: of:=IF(ISNUMBER([.F676]);[.F676]+[.G675];"") ->  | H676: of:=IF(AND([.G676]<=[Unidades.$G$26];[.G676]<=[Unidades.$F$18];[Unidades.$F$18]>0);[Unidades.$D$18]+1-COUNTIFS([Unidades.$O$3:.$O$17];">="&[.G676]);"") ->  | I676: of:=IF([.H675]<>[.H676];"INICIO";IF([.H677]<>[.H676];"FIN";"")) ->  | J676: of:=IF([.K675]<>[.K676];"INICIO";IF([.K677]<>[.K676];"FIN";"")) -> 
A677: of:=IF([.B677]<>"";TODAY()>[.B677];"") ->  | B677: of:=IFERROR(IF(([.B676]+1)<[Calendario.$F$5];[.B676]+1;"");"") ->  | C677: of:=IF(AND([.B677]>=[Calendario.$F$8];[.B677]<=[Calendario.$F$9];1);1;IF(AND([.B677]>=[Calendario.$F$12];[.B677]<=[Calendario.$F$13]);2;IF(AND([.B677]>=[Calendario.$F$16];[.B677]<=[Calendario.$F$17]);3;""))) ->  | D677: of:=IF(COUNTIF([Calendario.$H$4:.$H$48];[.B677])>0;"FIESTA";"") -> FIESTA | E677: of:=IF([.B677]<>"";VLOOKUP(WEEKDAY([.B677];3);[Calendario.$A$4:.$C$11];2);"") ->  | F677: of:=IF([.B677]<>"";IF([.D677]<>"FIESTA";VLOOKUP(WEEKDAY([.B677];3);[Calendario.$A$4:.$C$11];3);0);"") ->  | G677: of:=IF(ISNUMBER([.F677]);[.F677]+[.G676];"") ->  | H677: of:=IF(AND([.G677]<=[Unidades.$G$26];[.G677]<=[Unidades.$F$18];[Unidades.$F$18]>0);[Unidades.$D$18]+1-COUNTIFS([Unidades.$O$3:.$O$17];">="&[.G677]);"") ->  | I677: of:=IF([.H676]<>[.H677];"INICIO";IF([.H678]<>[.H677];"FIN";"")) ->  | J677: of:=IF([.K676]<>[.K677];"INICIO";IF([.K678]<>[.K677];"FIN";"")) -> 
A678: of:=IF([.B678]<>"";TODAY()>[.B678];"") ->  | B678: of:=IFERROR(IF(([.B677]+1)<[Calendario.$F$5];[.B677]+1;"");"") ->  | C678: of:=IF(AND([.B678]>=[Calendario.$F$8];[.B678]<=[Calendario.$F$9];1);1;IF(AND([.B678]>=[Calendario.$F$12];[.B678]<=[Calendario.$F$13]);2;IF(AND([.B678]>=[Calendario.$F$16];[.B678]<=[Calendario.$F$17]);3;""))) ->  | D678: of:=IF(COUNTIF([Calendario.$H$4:.$H$48];[.B678])>0;"FIESTA";"") -> FIESTA | E678: of:=IF([.B678]<>"";VLOOKUP(WEEKDAY([.B678];3);[Calendario.$A$4:.$C$11];2);"") ->  | F678: of:=IF([.B678]<>"";IF([.D678]<>"FIESTA";VLOOKUP(WEEKDAY([.B678];3);[Calendario.$A$4:.$C$11];3);0);"") ->  | G678: of:=IF(ISNUMBER([.F678]);[.F678]+[.G677];"") ->  | H678: of:=IF(AND([.G678]<=[Unidades.$G$26];[.G678]<=[Unidades.$F$18];[Unidades.$F$18]>0);[Unidades.$D$18]+1-COUNTIFS([Unidades.$O$3:.$O$17];">="&[.G678]);"") ->  | I678: of:=IF([.H677]<>[.H678];"INICIO";IF([.H679]<>[.H678];"FIN";"")) ->  | J678: of:=IF([.K677]<>[.K678];"INICIO";IF([.K679]<>[.K678];"FIN";"")) -> 
A679: of:=IF([.B679]<>"";TODAY()>[.B679];"") ->  | B679: of:=IFERROR(IF(([.B678]+1)<[Calendario.$F$5];[.B678]+1;"");"") ->  | C679: of:=IF(AND([.B679]>=[Calendario.$F$8];[.B679]<=[Calendario.$F$9];1);1;IF(AND([.B679]>=[Calendario.$F$12];[.B679]<=[Calendario.$F$13]);2;IF(AND([.B679]>=[Calendario.$F$16];[.B679]<=[Calendario.$F$17]);3;""))) ->  | D679: of:=IF(COUNTIF([Calendario.$H$4:.$H$48];[.B679])>0;"FIESTA";"") -> FIESTA | E679: of:=IF([.B679]<>"";VLOOKUP(WEEKDAY([.B679];3);[Calendario.$A$4:.$C$11];2);"") ->  | F679: of:=IF([.B679]<>"";IF([.D679]<>"FIESTA";VLOOKUP(WEEKDAY([.B679];3);[Calendario.$A$4:.$C$11];3);0);"") ->  | G679: of:=IF(ISNUMBER([.F679]);[.F679]+[.G678];"") ->  | H679: of:=IF(AND([.G679]<=[Unidades.$G$26];[.G679]<=[Unidades.$F$18];[Unidades.$F$18]>0);[Unidades.$D$18]+1-COUNTIFS([Unidades.$O$3:.$O$17];">="&[.G679]);"") ->  | I679: of:=IF([.H678]<>[.H679];"INICIO";IF([.H680]<>[.H679];"FIN";"")) ->  | J679: of:=IF([.K678]<>[.K679];"INICIO";IF([.K680]<>[.K679];"FIN";"")) -> 
A680: of:=IF([.B680]<>"";TODAY()>[.B680];"") ->  | B680: of:=IFERROR(IF(([.B679]+1)<[Calendario.$F$5];[.B679]+1;"");"") ->  | C680: of:=IF(AND([.B680]>=[Calendario.$F$8];[.B680]<=[Calendario.$F$9];1);1;IF(AND([.B680]>=[Calendario.$F$12];[.B680]<=[Calendario.$F$13]);2;IF(AND([.B680]>=[Calendario.$F$16];[.B680]<=[Calendario.$F$17]);3;""))) ->  | D680: of:=IF(COUNTIF([Calendario.$H$4:.$H$48];[.B680])>0;"FIESTA";"") -> FIESTA | E680: of:=IF([.B680]<>"";VLOOKUP(WEEKDAY([.B680];3);[Calendario.$A$4:.$C$11];2);"") ->  | F680: of:=IF([.B680]<>"";IF([.D680]<>"FIESTA";VLOOKUP(WEEKDAY([.B680];3);[Calendario.$A$4:.$C$11];3);0);"") ->  | G680: of:=IF(ISNUMBER([.F680]);[.F680]+[.G679];"") ->  | H680: of:=IF(AND([.G680]<=[Unidades.$G$26];[.G680]<=[Unidades.$F$18];[Unidades.$F$18]>0);[Unidades.$D$18]+1-COUNTIFS([Unidades.$O$3:.$O$17];">="&[.G680]);"") ->  | I680: of:=IF([.H679]<>[.H680];"INICIO";IF([.H681]<>[.H680];"FIN";"")) ->  | J680: of:=IF([.K679]<>[.K680];"INICIO";IF([.K681]<>[.K680];"FIN";"")) -> 
A681: of:=IF([.B681]<>"";TODAY()>[.B681];"") ->  | B681: of:=IFERROR(IF(([.B680]+1)<[Calendario.$F$5];[.B680]+1;"");"") ->  | C681: of:=IF(AND([.B681]>=[Calendario.$F$8];[.B681]<=[Calendario.$F$9];1);1;IF(AND([.B681]>=[Calendario.$F$12];[.B681]<=[Calendario.$F$13]);2;IF(AND([.B681]>=[Calendario.$F$16];[.B681]<=[Calendario.$F$17]);3;""))) ->  | D681: of:=IF(COUNTIF([Calendario.$H$4:.$H$48];[.B681])>0;"FIESTA";"") -> FIESTA | E681: of:=IF([.B681]<>"";VLOOKUP(WEEKDAY([.B681];3);[Calendario.$A$4:.$C$11];2);"") ->  | F681: of:=IF([.B681]<>"";IF([.D681]<>"FIESTA";VLOOKUP(WEEKDAY([.B681];3);[Calendario.$A$4:.$C$11];3);0);"") ->  | G681: of:=IF(ISNUMBER([.F681]);[.F681]+[.G680];"") ->  | H681: of:=IF(AND([.G681]<=[Unidades.$G$26];[.G681]<=[Unidades.$F$18];[Unidades.$F$18]>0);[Unidades.$D$18]+1-COUNTIFS([Unidades.$O$3:.$O$17];">="&[.G681]);"") ->  | I681: of:=IF([.H680]<>[.H681];"INICIO";IF([.H682]<>[.H681];"FIN";"")) ->  | J681: of:=IF([.K680]<>[.K681];"INICIO";IF([.K682]<>[.K681];"FIN";"")) -> 
A682: of:=IF([.B682]<>"";TODAY()>[.B682];"") ->  | B682: of:=IFERROR(IF(([.B681]+1)<[Calendario.$F$5];[.B681]+1;"");"") ->  | C682: of:=IF(AND([.B682]>=[Calendario.$F$8];[.B682]<=[Calendario.$F$9];1);1;IF(AND([.B682]>=[Calendario.$F$12];[.B682]<=[Calendario.$F$13]);2;IF(AND([.B682]>=[Calendario.$F$16];[.B682]<=[Calendario.$F$17]);3;""))) ->  | D682: of:=IF(COUNTIF([Calendario.$H$4:.$H$48];[.B682])>0;"FIESTA";"") -> FIESTA | E682: of:=IF([.B682]<>"";VLOOKUP(WEEKDAY([.B682];3);[Calendario.$A$4:.$C$11];2);"") ->  | F682: of:=IF([.B682]<>"";IF([.D682]<>"FIESTA";VLOOKUP(WEEKDAY([.B682];3);[Calendario.$A$4:.$C$11];3);0);"") ->  | G682: of:=IF(ISNUMBER([.F682]);[.F682]+[.G681];"") ->  | H682: of:=IF(AND([.G682]<=[Unidades.$G$26];[.G682]<=[Unidades.$F$18];[Unidades.$F$18]>0);[Unidades.$D$18]+1-COUNTIFS([Unidades.$O$3:.$O$17];">="&[.G682]);"") ->  | I682: of:=IF([.H681]<>[.H682];"INICIO";IF([.H683]<>[.H682];"FIN";"")) ->  | J682: of:=IF([.K681]<>[.K682];"INICIO";IF([.K683]<>[.K682];"FIN";"")) -> 
A683: of:=IF([.B683]<>"";TODAY()>[.B683];"") ->  | B683: of:=IFERROR(IF(([.B682]+1)<[Calendario.$F$5];[.B682]+1;"");"") ->  | C683: of:=IF(AND([.B683]>=[Calendario.$F$8];[.B683]<=[Calendario.$F$9];1);1;IF(AND([.B683]>=[Calendario.$F$12];[.B683]<=[Calendario.$F$13]);2;IF(AND([.B683]>=[Calendario.$F$16];[.B683]<=[Calendario.$F$17]);3;""))) ->  | D683: of:=IF(COUNTIF([Calendario.$H$4:.$H$48];[.B683])>0;"FIESTA";"") -> FIESTA | E683: of:=IF([.B683]<>"";VLOOKUP(WEEKDAY([.B683];3);[Calendario.$A$4:.$C$11];2);"") ->  | F683: of:=IF([.B683]<>"";IF([.D683]<>"FIESTA";VLOOKUP(WEEKDAY([.B683];3);[Calendario.$A$4:.$C$11];3);0);"") ->  | G683: of:=IF(ISNUMBER([.F683]);[.F683]+[.G682];"") ->  | H683: of:=IF(AND([.G683]<=[Unidades.$G$26];[.G683]<=[Unidades.$F$18];[Unidades.$F$18]>0);[Unidades.$D$18]+1-COUNTIFS([Unidades.$O$3:.$O$17];">="&[.G683]);"") ->  | I683: of:=IF([.H682]<>[.H683];"INICIO";IF([.H684]<>[.H683];"FIN";"")) ->  | J683: of:=IF([.K682]<>[.K683];"INICIO";IF([.K684]<>[.K683];"FIN";"")) -> 
A684: of:=IF([.B684]<>"";TODAY()>[.B684];"") ->  | B684: of:=IFERROR(IF(([.B683]+1)<[Calendario.$F$5];[.B683]+1;"");"") ->  | C684: of:=IF(AND([.B684]>=[Calendario.$F$8];[.B684]<=[Calendario.$F$9];1);1;IF(AND([.B684]>=[Calendario.$F$12];[.B684]<=[Calendario.$F$13]);2;IF(AND([.B684]>=[Calendario.$F$16];[.B684]<=[Calendario.$F$17]);3;""))) ->  | D684: of:=IF(COUNTIF([Calendario.$H$4:.$H$48];[.B684])>0;"FIESTA";"") -> FIESTA | E684: of:=IF([.B684]<>"";VLOOKUP(WEEKDAY([.B684];3);[Calendario.$A$4:.$C$11];2);"") ->  | F684: of:=IF([.B684]<>"";IF([.D684]<>"FIESTA";VLOOKUP(WEEKDAY([.B684];3);[Calendario.$A$4:.$C$11];3);0);"") ->  | G684: of:=IF(ISNUMBER([.F684]);[.F684]+[.G683];"") ->  | H684: of:=IF(AND([.G684]<=[Unidades.$G$26];[.G684]<=[Unidades.$F$18];[Unidades.$F$18]>0);[Unidades.$D$18]+1-COUNTIFS([Unidades.$O$3:.$O$17];">="&[.G684]);"") ->  | I684: of:=IF([.H683]<>[.H684];"INICIO";IF([.H685]<>[.H684];"FIN";"")) ->  | J684: of:=IF([.K683]<>[.K684];"INICIO";IF([.K685]<>[.K684];"FIN";"")) -> 
A685: of:=IF([.B685]<>"";TODAY()>[.B685];"") ->  | B685: of:=IFERROR(IF(([.B684]+1)<[Calendario.$F$5];[.B684]+1;"");"") ->  | C685: of:=IF(AND([.B685]>=[Calendario.$F$8];[.B685]<=[Calendario.$F$9];1);1;IF(AND([.B685]>=[Calendario.$F$12];[.B685]<=[Calendario.$F$13]);2;IF(AND([.B685]>=[Calendario.$F$16];[.B685]<=[Calendario.$F$17]);3;""))) ->  | D685: of:=IF(COUNTIF([Calendario.$H$4:.$H$48];[.B685])>0;"FIESTA";"") -> FIESTA | E685: of:=IF([.B685]<>"";VLOOKUP(WEEKDAY([.B685];3);[Calendario.$A$4:.$C$11];2);"") ->  | F685: of:=IF([.B685]<>"";IF([.D685]<>"FIESTA";VLOOKUP(WEEKDAY([.B685];3);[Calendario.$A$4:.$C$11];3);0);"") ->  | G685: of:=IF(ISNUMBER([.F685]);[.F685]+[.G684];"") ->  | H685: of:=IF(AND([.G685]<=[Unidades.$G$26];[.G685]<=[Unidades.$F$18];[Unidades.$F$18]>0);[Unidades.$D$18]+1-COUNTIFS([Unidades.$O$3:.$O$17];">="&[.G685]);"") ->  | I685: of:=IF([.H684]<>[.H685];"INICIO";IF([.H686]<>[.H685];"FIN";"")) ->  | J685: of:=IF([.K684]<>[.K685];"INICIO";IF([.K686]<>[.K685];"FIN";"")) -> 
A686: of:=IF([.B686]<>"";TODAY()>[.B686];"") ->  | B686: of:=IFERROR(IF(([.B685]+1)<[Calendario.$F$5];[.B685]+1;"");"") ->  | C686: of:=IF(AND([.B686]>=[Calendario.$F$8];[.B686]<=[Calendario.$F$9];1);1;IF(AND([.B686]>=[Calendario.$F$12];[.B686]<=[Calendario.$F$13]);2;IF(AND([.B686]>=[Calendario.$F$16];[.B686]<=[Calendario.$F$17]);3;""))) ->  | D686: of:=IF(COUNTIF([Calendario.$H$4:.$H$48];[.B686])>0;"FIESTA";"") -> FIESTA | E686: of:=IF([.B686]<>"";VLOOKUP(WEEKDAY([.B686];3);[Calendario.$A$4:.$C$11];2);"") ->  | F686: of:=IF([.B686]<>"";IF([.D686]<>"FIESTA";VLOOKUP(WEEKDAY([.B686];3);[Calendario.$A$4:.$C$11];3);0);"") ->  | G686: of:=IF(ISNUMBER([.F686]);[.F686]+[.G685];"") ->  | H686: of:=IF(AND([.G686]<=[Unidades.$G$26];[.G686]<=[Unidades.$F$18];[Unidades.$F$18]>0);[Unidades.$D$18]+1-COUNTIFS([Unidades.$O$3:.$O$17];">="&[.G686]);"") ->  | I686: of:=IF([.H685]<>[.H686];"INICIO";IF([.H687]<>[.H686];"FIN";"")) ->  | J686: of:=IF([.K685]<>[.K686];"INICIO";IF([.K687]<>[.K686];"FIN";"")) -> 
A687: of:=IF([.B687]<>"";TODAY()>[.B687];"") ->  | B687: of:=IFERROR(IF(([.B686]+1)<[Calendario.$F$5];[.B686]+1;"");"") ->  | C687: of:=IF(AND([.B687]>=[Calendario.$F$8];[.B687]<=[Calendario.$F$9];1);1;IF(AND([.B687]>=[Calendario.$F$12];[.B687]<=[Calendario.$F$13]);2;IF(AND([.B687]>=[Calendario.$F$16];[.B687]<=[Calendario.$F$17]);3;""))) ->  | D687: of:=IF(COUNTIF([Calendario.$H$4:.$H$48];[.B687])>0;"FIESTA";"") -> FIESTA | E687: of:=IF([.B687]<>"";VLOOKUP(WEEKDAY([.B687];3);[Calendario.$A$4:.$C$11];2);"") ->  | F687: of:=IF([.B687]<>"";IF([.D687]<>"FIESTA";VLOOKUP(WEEKDAY([.B687];3);[Calendario.$A$4:.$C$11];3);0);"") ->  | G687: of:=IF(ISNUMBER([.F687]);[.F687]+[.G686];"") ->  | H687: of:=IF(AND([.G687]<=[Unidades.$G$26];[.G687]<=[Unidades.$F$18];[Unidades.$F$18]>0);[Unidades.$D$18]+1-COUNTIFS([Unidades.$O$3:.$O$17];">="&[.G687]);"") ->  | I687: of:=IF([.H686]<>[.H687];"INICIO";IF([.H688]<>[.H687];"FIN";"")) ->  | J687: of:=IF([.K686]<>[.K687];"INICIO";IF([.K688]<>[.K687];"FIN";"")) -> 
A688: of:=IF([.B688]<>"";TODAY()>[.B688];"") ->  | B688: of:=IFERROR(IF(([.B687]+1)<[Calendario.$F$5];[.B687]+1;"");"") ->  | C688: of:=IF(AND([.B688]>=[Calendario.$F$8];[.B688]<=[Calendario.$F$9];1);1;IF(AND([.B688]>=[Calendario.$F$12];[.B688]<=[Calendario.$F$13]);2;IF(AND([.B688]>=[Calendario.$F$16];[.B688]<=[Calendario.$F$17]);3;""))) ->  | D688: of:=IF(COUNTIF([Calendario.$H$4:.$H$48];[.B688])>0;"FIESTA";"") -> FIESTA | E688: of:=IF([.B688]<>"";VLOOKUP(WEEKDAY([.B688];3);[Calendario.$A$4:.$C$11];2);"") ->  | F688: of:=IF([.B688]<>"";IF([.D688]<>"FIESTA";VLOOKUP(WEEKDAY([.B688];3);[Calendario.$A$4:.$C$11];3);0);"") ->  | G688: of:=IF(ISNUMBER([.F688]);[.F688]+[.G687];"") ->  | H688: of:=IF(AND([.G688]<=[Unidades.$G$26];[.G688]<=[Unidades.$F$18];[Unidades.$F$18]>0);[Unidades.$D$18]+1-COUNTIFS([Unidades.$O$3:.$O$17];">="&[.G688]);"") ->  | I688: of:=IF([.H687]<>[.H688];"INICIO";IF([.H689]<>[.H688];"FIN";"")) ->  | J688: of:=IF([.K687]<>[.K688];"INICIO";IF([.K689]<>[.K688];"FIN";"")) -> 
A689: of:=IF([.B689]<>"";TODAY()>[.B689];"") ->  | B689: of:=IFERROR(IF(([.B688]+1)<[Calendario.$F$5];[.B688]+1;"");"") ->  | C689: of:=IF(AND([.B689]>=[Calendario.$F$8];[.B689]<=[Calendario.$F$9];1);1;IF(AND([.B689]>=[Calendario.$F$12];[.B689]<=[Calendario.$F$13]);2;IF(AND([.B689]>=[Calendario.$F$16];[.B689]<=[Calendario.$F$17]);3;""))) ->  | D689: of:=IF(COUNTIF([Calendario.$H$4:.$H$48];[.B689])>0;"FIESTA";"") -> FIESTA | E689: of:=IF([.B689]<>"";VLOOKUP(WEEKDAY([.B689];3);[Calendario.$A$4:.$C$11];2);"") ->  | F689: of:=IF([.B689]<>"";IF([.D689]<>"FIESTA";VLOOKUP(WEEKDAY([.B689];3);[Calendario.$A$4:.$C$11];3);0);"") ->  | G689: of:=IF(ISNUMBER([.F689]);[.F689]+[.G688];"") ->  | H689: of:=IF(AND([.G689]<=[Unidades.$G$26];[.G689]<=[Unidades.$F$18];[Unidades.$F$18]>0);[Unidades.$D$18]+1-COUNTIFS([Unidades.$O$3:.$O$17];">="&[.G689]);"") ->  | I689: of:=IF([.H688]<>[.H689];"INICIO";IF([.H690]<>[.H689];"FIN";"")) ->  | J689: of:=IF([.K688]<>[.K689];"INICIO";IF([.K690]<>[.K689];"FIN";"")) -> 
A690: of:=IF([.B690]<>"";TODAY()>[.B690];"") ->  | B690: of:=IFERROR(IF(([.B689]+1)<[Calendario.$F$5];[.B689]+1;"");"") ->  | C690: of:=IF(AND([.B690]>=[Calendario.$F$8];[.B690]<=[Calendario.$F$9];1);1;IF(AND([.B690]>=[Calendario.$F$12];[.B690]<=[Calendario.$F$13]);2;IF(AND([.B690]>=[Calendario.$F$16];[.B690]<=[Calendario.$F$17]);3;""))) ->  | D690: of:=IF(COUNTIF([Calendario.$H$4:.$H$48];[.B690])>0;"FIESTA";"") -> FIESTA | E690: of:=IF([.B690]<>"";VLOOKUP(WEEKDAY([.B690];3);[Calendario.$A$4:.$C$11];2);"") ->  | F690: of:=IF([.B690]<>"";IF([.D690]<>"FIESTA";VLOOKUP(WEEKDAY([.B690];3);[Calendario.$A$4:.$C$11];3);0);"") ->  | G690: of:=IF(ISNUMBER([.F690]);[.F690]+[.G689];"") ->  | H690: of:=IF(AND([.G690]<=[Unidades.$G$26];[.G690]<=[Unidades.$F$18];[Unidades.$F$18]>0);[Unidades.$D$18]+1-COUNTIFS([Unidades.$O$3:.$O$17];">="&[.G690]);"") ->  | I690: of:=IF([.H689]<>[.H690];"INICIO";IF([.H691]<>[.H690];"FIN";"")) ->  | J690: of:=IF([.K689]<>[.K690];"INICIO";IF([.K691]<>[.K690];"FIN";"")) -> 
A691: of:=IF([.B691]<>"";TODAY()>[.B691];"") ->  | B691: of:=IFERROR(IF(([.B690]+1)<[Calendario.$F$5];[.B690]+1;"");"") ->  | C691: of:=IF(AND([.B691]>=[Calendario.$F$8];[.B691]<=[Calendario.$F$9];1);1;IF(AND([.B691]>=[Calendario.$F$12];[.B691]<=[Calendario.$F$13]);2;IF(AND([.B691]>=[Calendario.$F$16];[.B691]<=[Calendario.$F$17]);3;""))) ->  | D691: of:=IF(COUNTIF([Calendario.$H$4:.$H$48];[.B691])>0;"FIESTA";"") -> FIESTA | E691: of:=IF([.B691]<>"";VLOOKUP(WEEKDAY([.B691];3);[Calendario.$A$4:.$C$11];2);"") ->  | F691: of:=IF([.B691]<>"";IF([.D691]<>"FIESTA";VLOOKUP(WEEKDAY([.B691];3);[Calendario.$A$4:.$C$11];3);0);"") ->  | G691: of:=IF(ISNUMBER([.F691]);[.F691]+[.G690];"") ->  | H691: of:=IF(AND([.G691]<=[Unidades.$G$26];[.G691]<=[Unidades.$F$18];[Unidades.$F$18]>0);[Unidades.$D$18]+1-COUNTIFS([Unidades.$O$3:.$O$17];">="&[.G691]);"") ->  | I691: of:=IF([.H690]<>[.H691];"INICIO";IF([.H692]<>[.H691];"FIN";"")) ->  | J691: of:=IF([.K690]<>[.K691];"INICIO";IF([.K692]<>[.K691];"FIN";"")) -> 
A692: of:=IF([.B692]<>"";TODAY()>[.B692];"") ->  | B692: of:=IFERROR(IF(([.B691]+1)<[Calendario.$F$5];[.B691]+1;"");"") ->  | C692: of:=IF(AND([.B692]>=[Calendario.$F$8];[.B692]<=[Calendario.$F$9];1);1;IF(AND([.B692]>=[Calendario.$F$12];[.B692]<=[Calendario.$F$13]);2;IF(AND([.B692]>=[Calendario.$F$16];[.B692]<=[Calendario.$F$17]);3;""))) ->  | D692: of:=IF(COUNTIF([Calendario.$H$4:.$H$48];[.B692])>0;"FIESTA";"") -> FIESTA | E692: of:=IF([.B692]<>"";VLOOKUP(WEEKDAY([.B692];3);[Calendario.$A$4:.$C$11];2);"") ->  | F692: of:=IF([.B692]<>"";IF([.D692]<>"FIESTA";VLOOKUP(WEEKDAY([.B692];3);[Calendario.$A$4:.$C$11];3);0);"") ->  | G692: of:=IF(ISNUMBER([.F692]);[.F692]+[.G691];"") ->  | H692: of:=IF(AND([.G692]<=[Unidades.$G$26];[.G692]<=[Unidades.$F$18];[Unidades.$F$18]>0);[Unidades.$D$18]+1-COUNTIFS([Unidades.$O$3:.$O$17];">="&[.G692]);"") ->  | I692: of:=IF([.H691]<>[.H692];"INICIO";IF([.H693]<>[.H692];"FIN";"")) ->  | J692: of:=IF([.K691]<>[.K692];"INICIO";IF([.K693]<>[.K692];"FIN";"")) -> 
A693: of:=IF([.B693]<>"";TODAY()>[.B693];"") ->  | B693: of:=IFERROR(IF(([.B692]+1)<[Calendario.$F$5];[.B692]+1;"");"") ->  | C693: of:=IF(AND([.B693]>=[Calendario.$F$8];[.B693]<=[Calendario.$F$9];1);1;IF(AND([.B693]>=[Calendario.$F$12];[.B693]<=[Calendario.$F$13]);2;IF(AND([.B693]>=[Calendario.$F$16];[.B693]<=[Calendario.$F$17]);3;""))) ->  | D693: of:=IF(COUNTIF([Calendario.$H$4:.$H$48];[.B693])>0;"FIESTA";"") -> FIESTA | E693: of:=IF([.B693]<>"";VLOOKUP(WEEKDAY([.B693];3);[Calendario.$A$4:.$C$11];2);"") ->  | F693: of:=IF([.B693]<>"";IF([.D693]<>"FIESTA";VLOOKUP(WEEKDAY([.B693];3);[Calendario.$A$4:.$C$11];3);0);"") ->  | G693: of:=IF(ISNUMBER([.F693]);[.F693]+[.G692];"") ->  | H693: of:=IF(AND([.G693]<=[Unidades.$G$26];[.G693]<=[Unidades.$F$18];[Unidades.$F$18]>0);[Unidades.$D$18]+1-COUNTIFS([Unidades.$O$3:.$O$17];">="&[.G693]);"") ->  | I693: of:=IF([.H692]<>[.H693];"INICIO";IF([.H694]<>[.H693];"FIN";"")) ->  | J693: of:=IF([.K692]<>[.K693];"INICIO";IF([.K694]<>[.K693];"FIN";"")) -> 
A694: of:=IF([.B694]<>"";TODAY()>[.B694];"") ->  | B694: of:=IFERROR(IF(([.B693]+1)<[Calendario.$F$5];[.B693]+1;"");"") ->  | C694: of:=IF(AND([.B694]>=[Calendario.$F$8];[.B694]<=[Calendario.$F$9];1);1;IF(AND([.B694]>=[Calendario.$F$12];[.B694]<=[Calendario.$F$13]);2;IF(AND([.B694]>=[Calendario.$F$16];[.B694]<=[Calendario.$F$17]);3;""))) ->  | D694: of:=IF(COUNTIF([Calendario.$H$4:.$H$48];[.B694])>0;"FIESTA";"") -> FIESTA | E694: of:=IF([.B694]<>"";VLOOKUP(WEEKDAY([.B694];3);[Calendario.$A$4:.$C$11];2);"") ->  | F694: of:=IF([.B694]<>"";IF([.D694]<>"FIESTA";VLOOKUP(WEEKDAY([.B694];3);[Calendario.$A$4:.$C$11];3);0);"") ->  | G694: of:=IF(ISNUMBER([.F694]);[.F694]+[.G693];"") ->  | H694: of:=IF(AND([.G694]<=[Unidades.$G$26];[.G694]<=[Unidades.$F$18];[Unidades.$F$18]>0);[Unidades.$D$18]+1-COUNTIFS([Unidades.$O$3:.$O$17];">="&[.G694]);"") ->  | I694: of:=IF([.H693]<>[.H694];"INICIO";IF([.H695]<>[.H694];"FIN";"")) ->  | J694: of:=IF([.K693]<>[.K694];"INICIO";IF([.K695]<>[.K694];"FIN";"")) -> 
A695: of:=IF([.B695]<>"";TODAY()>[.B695];"") ->  | B695: of:=IFERROR(IF(([.B694]+1)<[Calendario.$F$5];[.B694]+1;"");"") ->  | C695: of:=IF(AND([.B695]>=[Calendario.$F$8];[.B695]<=[Calendario.$F$9];1);1;IF(AND([.B695]>=[Calendario.$F$12];[.B695]<=[Calendario.$F$13]);2;IF(AND([.B695]>=[Calendario.$F$16];[.B695]<=[Calendario.$F$17]);3;""))) ->  | D695: of:=IF(COUNTIF([Calendario.$H$4:.$H$48];[.B695])>0;"FIESTA";"") -> FIESTA | E695: of:=IF([.B695]<>"";VLOOKUP(WEEKDAY([.B695];3);[Calendario.$A$4:.$C$11];2);"") ->  | F695: of:=IF([.B695]<>"";IF([.D695]<>"FIESTA";VLOOKUP(WEEKDAY([.B695];3);[Calendario.$A$4:.$C$11];3);0);"") ->  | G695: of:=IF(ISNUMBER([.F695]);[.F695]+[.G694];"") ->  | H695: of:=IF(AND([.G695]<=[Unidades.$G$26];[.G695]<=[Unidades.$F$18];[Unidades.$F$18]>0);[Unidades.$D$18]+1-COUNTIFS([Unidades.$O$3:.$O$17];">="&[.G695]);"") ->  | I695: of:=IF([.H694]<>[.H695];"INICIO";IF([.H696]<>[.H695];"FIN";"")) ->  | J695: of:=IF([.K694]<>[.K695];"INICIO";IF([.K696]<>[.K695];"FIN";"")) -> 
A696: of:=IF([.B696]<>"";TODAY()>[.B696];"") ->  | B696: of:=IFERROR(IF(([.B695]+1)<[Calendario.$F$5];[.B695]+1;"");"") ->  | C696: of:=IF(AND([.B696]>=[Calendario.$F$8];[.B696]<=[Calendario.$F$9];1);1;IF(AND([.B696]>=[Calendario.$F$12];[.B696]<=[Calendario.$F$13]);2;IF(AND([.B696]>=[Calendario.$F$16];[.B696]<=[Calendario.$F$17]);3;""))) ->  | D696: of:=IF(COUNTIF([Calendario.$H$4:.$H$48];[.B696])>0;"FIESTA";"") -> FIESTA | E696: of:=IF([.B696]<>"";VLOOKUP(WEEKDAY([.B696];3);[Calendario.$A$4:.$C$11];2);"") ->  | F696: of:=IF([.B696]<>"";IF([.D696]<>"FIESTA";VLOOKUP(WEEKDAY([.B696];3);[Calendario.$A$4:.$C$11];3);0);"") ->  | G696: of:=IF(ISNUMBER([.F696]);[.F696]+[.G695];"") ->  | H696: of:=IF(AND([.G696]<=[Unidades.$G$26];[.G696]<=[Unidades.$F$18];[Unidades.$F$18]>0);[Unidades.$D$18]+1-COUNTIFS([Unidades.$O$3:.$O$17];">="&[.G696]);"") ->  | I696: of:=IF([.H695]<>[.H696];"INICIO";IF([.H697]<>[.H696];"FIN";"")) ->  | J696: of:=IF([.K695]<>[.K696];"INICIO";IF([.K697]<>[.K696];"FIN";"")) -> 
A697: of:=IF([.B697]<>"";TODAY()>[.B697];"") ->  | B697: of:=IFERROR(IF(([.B696]+1)<[Calendario.$F$5];[.B696]+1;"");"") ->  | C697: of:=IF(AND([.B697]>=[Calendario.$F$8];[.B697]<=[Calendario.$F$9];1);1;IF(AND([.B697]>=[Calendario.$F$12];[.B697]<=[Calendario.$F$13]);2;IF(AND([.B697]>=[Calendario.$F$16];[.B697]<=[Calendario.$F$17]);3;""))) ->  | D697: of:=IF(COUNTIF([Calendario.$H$4:.$H$48];[.B697])>0;"FIESTA";"") -> FIESTA | E697: of:=IF([.B697]<>"";VLOOKUP(WEEKDAY([.B697];3);[Calendario.$A$4:.$C$11];2);"") ->  | F697: of:=IF([.B697]<>"";IF([.D697]<>"FIESTA";VLOOKUP(WEEKDAY([.B697];3);[Calendario.$A$4:.$C$11];3);0);"") ->  | G697: of:=IF(ISNUMBER([.F697]);[.F697]+[.G696];"") ->  | H697: of:=IF(AND([.G697]<=[Unidades.$G$26];[.G697]<=[Unidades.$F$18];[Unidades.$F$18]>0);[Unidades.$D$18]+1-COUNTIFS([Unidades.$O$3:.$O$17];">="&[.G697]);"") ->  | I697: of:=IF([.H696]<>[.H697];"INICIO";IF([.H698]<>[.H697];"FIN";"")) ->  | J697: of:=IF([.K696]<>[.K697];"INICIO";IF([.K698]<>[.K697];"FIN";"")) -> 
A698: of:=IF([.B698]<>"";TODAY()>[.B698];"") ->  | B698: of:=IFERROR(IF(([.B697]+1)<[Calendario.$F$5];[.B697]+1;"");"") ->  | C698: of:=IF(AND([.B698]>=[Calendario.$F$8];[.B698]<=[Calendario.$F$9];1);1;IF(AND([.B698]>=[Calendario.$F$12];[.B698]<=[Calendario.$F$13]);2;IF(AND([.B698]>=[Calendario.$F$16];[.B698]<=[Calendario.$F$17]);3;""))) ->  | D698: of:=IF(COUNTIF([Calendario.$H$4:.$H$48];[.B698])>0;"FIESTA";"") -> FIESTA | E698: of:=IF([.B698]<>"";VLOOKUP(WEEKDAY([.B698];3);[Calendario.$A$4:.$C$11];2);"") ->  | F698: of:=IF([.B698]<>"";IF([.D698]<>"FIESTA";VLOOKUP(WEEKDAY([.B698];3);[Calendario.$A$4:.$C$11];3);0);"") ->  | G698: of:=IF(ISNUMBER([.F698]);[.F698]+[.G697];"") ->  | H698: of:=IF(AND([.G698]<=[Unidades.$G$26];[.G698]<=[Unidades.$F$18];[Unidades.$F$18]>0);[Unidades.$D$18]+1-COUNTIFS([Unidades.$O$3:.$O$17];">="&[.G698]);"") ->  | I698: of:=IF([.H697]<>[.H698];"INICIO";IF([.H699]<>[.H698];"FIN";"")) ->  | J698: of:=IF([.K697]<>[.K698];"INICIO";IF([.K699]<>[.K698];"FIN";"")) -> 
A699: of:=IF([.B699]<>"";TODAY()>[.B699];"") ->  | B699: of:=IFERROR(IF(([.B698]+1)<[Calendario.$F$5];[.B698]+1;"");"") ->  | C699: of:=IF(AND([.B699]>=[Calendario.$F$8];[.B699]<=[Calendario.$F$9];1);1;IF(AND([.B699]>=[Calendario.$F$12];[.B699]<=[Calendario.$F$13]);2;IF(AND([.B699]>=[Calendario.$F$16];[.B699]<=[Calendario.$F$17]);3;""))) ->  | D699: of:=IF(COUNTIF([Calendario.$H$4:.$H$48];[.B699])>0;"FIESTA";"") -> FIESTA | E699: of:=IF([.B699]<>"";VLOOKUP(WEEKDAY([.B699];3);[Calendario.$A$4:.$C$11];2);"") ->  | F699: of:=IF([.B699]<>"";IF([.D699]<>"FIESTA";VLOOKUP(WEEKDAY([.B699];3);[Calendario.$A$4:.$C$11];3);0);"") ->  | G699: of:=IF(ISNUMBER([.F699]);[.F699]+[.G698];"") ->  | H699: of:=IF(AND([.G699]<=[Unidades.$G$26];[.G699]<=[Unidades.$F$18];[Unidades.$F$18]>0);[Unidades.$D$18]+1-COUNTIFS([Unidades.$O$3:.$O$17];">="&[.G699]);"") ->  | I699: of:=IF([.H698]<>[.H699];"INICIO";IF([.H700]<>[.H699];"FIN";"")) ->  | J699: of:=IF([.K698]<>[.K699];"INICIO";IF([.K700]<>[.K699];"FIN";"")) -> 
A700: of:=IF([.B700]<>"";TODAY()>[.B700];"") ->  | B700: of:=IFERROR(IF(([.B699]+1)<[Calendario.$F$5];[.B699]+1;"");"") ->  | C700: of:=IF(AND([.B700]>=[Calendario.$F$8];[.B700]<=[Calendario.$F$9];1);1;IF(AND([.B700]>=[Calendario.$F$12];[.B700]<=[Calendario.$F$13]);2;IF(AND([.B700]>=[Calendario.$F$16];[.B700]<=[Calendario.$F$17]);3;""))) ->  | D700: of:=IF(COUNTIF([Calendario.$H$4:.$H$48];[.B700])>0;"FIESTA";"") -> FIESTA | E700: of:=IF([.B700]<>"";VLOOKUP(WEEKDAY([.B700];3);[Calendario.$A$4:.$C$11];2);"") ->  | F700: of:=IF([.B700]<>"";IF([.D700]<>"FIESTA";VLOOKUP(WEEKDAY([.B700];3);[Calendario.$A$4:.$C$11];3);0);"") ->  | G700: of:=IF(ISNUMBER([.F700]);[.F700]+[.G699];"") ->  | H700: of:=IF(AND([.G700]<=[Unidades.$G$26];[.G700]<=[Unidades.$F$18];[Unidades.$F$18]>0);[Unidades.$D$18]+1-COUNTIFS([Unidades.$O$3:.$O$17];">="&[.G700]);"") ->  | I700: of:=IF([.H699]<>[.H700];"INICIO";IF([.H701]<>[.H700];"FIN";"")) ->  | J700: of:=IF([.K699]<>[.K700];"INICIO";IF([.K701]<>[.K700];"FIN";"")) -> 
A701: of:=IF([.B701]<>"";TODAY()>[.B701];"") ->  | B701: of:=IFERROR(IF(([.B700]+1)<[Calendario.$F$5];[.B700]+1;"");"") ->  | C701: of:=IF(AND([.B701]>=[Calendario.$F$8];[.B701]<=[Calendario.$F$9];1);1;IF(AND([.B701]>=[Calendario.$F$12];[.B701]<=[Calendario.$F$13]);2;IF(AND([.B701]>=[Calendario.$F$16];[.B701]<=[Calendario.$F$17]);3;""))) ->  | D701: of:=IF(COUNTIF([Calendario.$H$4:.$H$48];[.B701])>0;"FIESTA";"") -> FIESTA | E701: of:=IF([.B701]<>"";VLOOKUP(WEEKDAY([.B701];3);[Calendario.$A$4:.$C$11];2);"") ->  | F701: of:=IF([.B701]<>"";IF([.D701]<>"FIESTA";VLOOKUP(WEEKDAY([.B701];3);[Calendario.$A$4:.$C$11];3);0);"") ->  | G701: of:=IF(ISNUMBER([.F701]);[.F701]+[.G700];"") ->  | H701: of:=IF(AND([.G701]<=[Unidades.$G$26];[.G701]<=[Unidades.$F$18];[Unidades.$F$18]>0);[Unidades.$D$18]+1-COUNTIFS([Unidades.$O$3:.$O$17];">="&[.G701]);"") ->  | I701: of:=IF([.H700]<>[.H701];"INICIO";IF([.H702]<>[.H701];"FIN";"")) ->  | J701: of:=IF([.K700]<>[.K701];"INICIO";IF([.K702]<>[.K701];"FIN";"")) -> 
A702: of:=IF([.B702]<>"";TODAY()>[.B702];"") ->  | B702: of:=IFERROR(IF(([.B701]+1)<[Calendario.$F$5];[.B701]+1;"");"") ->  | C702: of:=IF(AND([.B702]>=[Calendario.$F$8];[.B702]<=[Calendario.$F$9];1);1;IF(AND([.B702]>=[Calendario.$F$12];[.B702]<=[Calendario.$F$13]);2;IF(AND([.B702]>=[Calendario.$F$16];[.B702]<=[Calendario.$F$17]);3;""))) ->  | D702: of:=IF(COUNTIF([Calendario.$H$4:.$H$48];[.B702])>0;"FIESTA";"") -> FIESTA | E702: of:=IF([.B702]<>"";VLOOKUP(WEEKDAY([.B702];3);[Calendario.$A$4:.$C$11];2);"") ->  | F702: of:=IF([.B702]<>"";IF([.D702]<>"FIESTA";VLOOKUP(WEEKDAY([.B702];3);[Calendario.$A$4:.$C$11];3);0);"") ->  | G702: of:=IF(ISNUMBER([.F702]);[.F702]+[.G701];"") ->  | H702: of:=IF(AND([.G702]<=[Unidades.$G$26];[.G702]<=[Unidades.$F$18];[Unidades.$F$18]>0);[Unidades.$D$18]+1-COUNTIFS([Unidades.$O$3:.$O$17];">="&[.G702]);"") ->  | I702: of:=IF([.H701]<>[.H702];"INICIO";IF([.H703]<>[.H702];"FIN";"")) ->  | J702: of:=IF([.K701]<>[.K702];"INICIO";IF([.K703]<>[.K702];"FIN";"")) -> 
A703: of:=IF([.B703]<>"";TODAY()>[.B703];"") ->  | B703: of:=IFERROR(IF(([.B702]+1)<[Calendario.$F$5];[.B702]+1;"");"") ->  | C703: of:=IF(AND([.B703]>=[Calendario.$F$8];[.B703]<=[Calendario.$F$9];1);1;IF(AND([.B703]>=[Calendario.$F$12];[.B703]<=[Calendario.$F$13]);2;IF(AND([.B703]>=[Calendario.$F$16];[.B703]<=[Calendario.$F$17]);3;""))) ->  | D703: of:=IF(COUNTIF([Calendario.$H$4:.$H$48];[.B703])>0;"FIESTA";"") -> FIESTA | E703: of:=IF([.B703]<>"";VLOOKUP(WEEKDAY([.B703];3);[Calendario.$A$4:.$C$11];2);"") ->  | F703: of:=IF([.B703]<>"";IF([.D703]<>"FIESTA";VLOOKUP(WEEKDAY([.B703];3);[Calendario.$A$4:.$C$11];3);0);"") ->  | G703: of:=IF(ISNUMBER([.F703]);[.F703]+[.G702];"") ->  | H703: of:=IF(AND([.G703]<=[Unidades.$G$26];[.G703]<=[Unidades.$F$18];[Unidades.$F$18]>0);[Unidades.$D$18]+1-COUNTIFS([Unidades.$O$3:.$O$17];">="&[.G703]);"") ->  | I703: of:=IF([.H702]<>[.H703];"INICIO";IF([.H704]<>[.H703];"FIN";"")) ->  | J703: of:=IF([.K702]<>[.K703];"INICIO";IF([.K704]<>[.K703];"FIN";"")) -> 
A704: of:=IF([.B704]<>"";TODAY()>[.B704];"") ->  | B704: of:=IFERROR(IF(([.B703]+1)<[Calendario.$F$5];[.B703]+1;"");"") ->  | C704: of:=IF(AND([.B704]>=[Calendario.$F$8];[.B704]<=[Calendario.$F$9];1);1;IF(AND([.B704]>=[Calendario.$F$12];[.B704]<=[Calendario.$F$13]);2;IF(AND([.B704]>=[Calendario.$F$16];[.B704]<=[Calendario.$F$17]);3;""))) ->  | D704: of:=IF(COUNTIF([Calendario.$H$4:.$H$48];[.B704])>0;"FIESTA";"") -> FIESTA | E704: of:=IF([.B704]<>"";VLOOKUP(WEEKDAY([.B704];3);[Calendario.$A$4:.$C$11];2);"") ->  | F704: of:=IF([.B704]<>"";IF([.D704]<>"FIESTA";VLOOKUP(WEEKDAY([.B704];3);[Calendario.$A$4:.$C$11];3);0);"") ->  | G704: of:=IF(ISNUMBER([.F704]);[.F704]+[.G703];"") ->  | H704: of:=IF(AND([.G704]<=[Unidades.$G$26];[.G704]<=[Unidades.$F$18];[Unidades.$F$18]>0);[Unidades.$D$18]+1-COUNTIFS([Unidades.$O$3:.$O$17];">="&[.G704]);"") ->  | I704: of:=IF([.H703]<>[.H704];"INICIO";IF([.H705]<>[.H704];"FIN";"")) ->  | J704: of:=IF([.K703]<>[.K704];"INICIO";IF([.K705]<>[.K704];"FIN";"")) -> 
A705: of:=IF([.B705]<>"";TODAY()>[.B705];"") ->  | B705: of:=IFERROR(IF(([.B704]+1)<[Calendario.$F$5];[.B704]+1;"");"") ->  | C705: of:=IF(AND([.B705]>=[Calendario.$F$8];[.B705]<=[Calendario.$F$9];1);1;IF(AND([.B705]>=[Calendario.$F$12];[.B705]<=[Calendario.$F$13]);2;IF(AND([.B705]>=[Calendario.$F$16];[.B705]<=[Calendario.$F$17]);3;""))) ->  | D705: of:=IF(COUNTIF([Calendario.$H$4:.$H$48];[.B705])>0;"FIESTA";"") -> FIESTA | E705: of:=IF([.B705]<>"";VLOOKUP(WEEKDAY([.B705];3);[Calendario.$A$4:.$C$11];2);"") ->  | F705: of:=IF([.B705]<>"";IF([.D705]<>"FIESTA";VLOOKUP(WEEKDAY([.B705];3);[Calendario.$A$4:.$C$11];3);0);"") ->  | G705: of:=IF(ISNUMBER([.F705]);[.F705]+[.G704];"") ->  | H705: of:=IF(AND([.G705]<=[Unidades.$G$26];[.G705]<=[Unidades.$F$18];[Unidades.$F$18]>0);[Unidades.$D$18]+1-COUNTIFS([Unidades.$O$3:.$O$17];">="&[.G705]);"") ->  | I705: of:=IF([.H704]<>[.H705];"INICIO";IF([.H706]<>[.H705];"FIN";"")) ->  | J705: of:=IF([.K704]<>[.K705];"INICIO";IF([.K706]<>[.K705];"FIN";"")) -> 
A706: of:=IF([.B706]<>"";TODAY()>[.B706];"") ->  | B706: of:=IFERROR(IF(([.B705]+1)<[Calendario.$F$5];[.B705]+1;"");"") ->  | C706: of:=IF(AND([.B706]>=[Calendario.$F$8];[.B706]<=[Calendario.$F$9];1);1;IF(AND([.B706]>=[Calendario.$F$12];[.B706]<=[Calendario.$F$13]);2;IF(AND([.B706]>=[Calendario.$F$16];[.B706]<=[Calendario.$F$17]);3;""))) ->  | D706: of:=IF(COUNTIF([Calendario.$H$4:.$H$48];[.B706])>0;"FIESTA";"") -> FIESTA | E706: of:=IF([.B706]<>"";VLOOKUP(WEEKDAY([.B706];3);[Calendario.$A$4:.$C$11];2);"") ->  | F706: of:=IF([.B706]<>"";IF([.D706]<>"FIESTA";VLOOKUP(WEEKDAY([.B706];3);[Calendario.$A$4:.$C$11];3);0);"") ->  | G706: of:=IF(ISNUMBER([.F706]);[.F706]+[.G705];"") ->  | H706: of:=IF(AND([.G706]<=[Unidades.$G$26];[.G706]<=[Unidades.$F$18];[Unidades.$F$18]>0);[Unidades.$D$18]+1-COUNTIFS([Unidades.$O$3:.$O$17];">="&[.G706]);"") ->  | I706: of:=IF([.H705]<>[.H706];"INICIO";IF([.H707]<>[.H706];"FIN";"")) ->  | J706: of:=IF([.K705]<>[.K706];"INICIO";IF([.K707]<>[.K706];"FIN";"")) -> 
A707: of:=IF([.B707]<>"";TODAY()>[.B707];"") ->  | B707: of:=IFERROR(IF(([.B706]+1)<[Calendario.$F$5];[.B706]+1;"");"") ->  | C707: of:=IF(AND([.B707]>=[Calendario.$F$8];[.B707]<=[Calendario.$F$9];1);1;IF(AND([.B707]>=[Calendario.$F$12];[.B707]<=[Calendario.$F$13]);2;IF(AND([.B707]>=[Calendario.$F$16];[.B707]<=[Calendario.$F$17]);3;""))) ->  | D707: of:=IF(COUNTIF([Calendario.$H$4:.$H$48];[.B707])>0;"FIESTA";"") -> FIESTA | E707: of:=IF([.B707]<>"";VLOOKUP(WEEKDAY([.B707];3);[Calendario.$A$4:.$C$11];2);"") ->  | F707: of:=IF([.B707]<>"";IF([.D707]<>"FIESTA";VLOOKUP(WEEKDAY([.B707];3);[Calendario.$A$4:.$C$11];3);0);"") ->  | G707: of:=IF(ISNUMBER([.F707]);[.F707]+[.G706];"") ->  | H707: of:=IF(AND([.G707]<=[Unidades.$G$26];[.G707]<=[Unidades.$F$18];[Unidades.$F$18]>0);[Unidades.$D$18]+1-COUNTIFS([Unidades.$O$3:.$O$17];">="&[.G707]);"") ->  | I707: of:=IF([.H706]<>[.H707];"INICIO";IF([.H708]<>[.H707];"FIN";"")) ->  | J707: of:=IF([.K706]<>[.K707];"INICIO";IF([.K708]<>[.K707];"FIN";"")) -> 
A708: of:=IF([.B708]<>"";TODAY()>[.B708];"") ->  | B708: of:=IFERROR(IF(([.B707]+1)<[Calendario.$F$5];[.B707]+1;"");"") ->  | C708: of:=IF(AND([.B708]>=[Calendario.$F$8];[.B708]<=[Calendario.$F$9];1);1;IF(AND([.B708]>=[Calendario.$F$12];[.B708]<=[Calendario.$F$13]);2;IF(AND([.B708]>=[Calendario.$F$16];[.B708]<=[Calendario.$F$17]);3;""))) ->  | D708: of:=IF(COUNTIF([Calendario.$H$4:.$H$48];[.B708])>0;"FIESTA";"") -> FIESTA | E708: of:=IF([.B708]<>"";VLOOKUP(WEEKDAY([.B708];3);[Calendario.$A$4:.$C$11];2);"") ->  | F708: of:=IF([.B708]<>"";IF([.D708]<>"FIESTA";VLOOKUP(WEEKDAY([.B708];3);[Calendario.$A$4:.$C$11];3);0);"") ->  | G708: of:=IF(ISNUMBER([.F708]);[.F708]+[.G707];"") ->  | H708: of:=IF(AND([.G708]<=[Unidades.$G$26];[.G708]<=[Unidades.$F$18];[Unidades.$F$18]>0);[Unidades.$D$18]+1-COUNTIFS([Unidades.$O$3:.$O$17];">="&[.G708]);"") ->  | I708: of:=IF([.H707]<>[.H708];"INICIO";IF([.H709]<>[.H708];"FIN";"")) ->  | J708: of:=IF([.K707]<>[.K708];"INICIO";IF([.K709]<>[.K708];"FIN";"")) -> 
A709: of:=IF([.B709]<>"";TODAY()>[.B709];"") ->  | B709: of:=IFERROR(IF(([.B708]+1)<[Calendario.$F$5];[.B708]+1;"");"") ->  | C709: of:=IF(AND([.B709]>=[Calendario.$F$8];[.B709]<=[Calendario.$F$9];1);1;IF(AND([.B709]>=[Calendario.$F$12];[.B709]<=[Calendario.$F$13]);2;IF(AND([.B709]>=[Calendario.$F$16];[.B709]<=[Calendario.$F$17]);3;""))) ->  | D709: of:=IF(COUNTIF([Calendario.$H$4:.$H$48];[.B709])>0;"FIESTA";"") -> FIESTA | E709: of:=IF([.B709]<>"";VLOOKUP(WEEKDAY([.B709];3);[Calendario.$A$4:.$C$11];2);"") ->  | F709: of:=IF([.B709]<>"";IF([.D709]<>"FIESTA";VLOOKUP(WEEKDAY([.B709];3);[Calendario.$A$4:.$C$11];3);0);"") ->  | G709: of:=IF(ISNUMBER([.F709]);[.F709]+[.G708];"") ->  | H709: of:=IF(AND([.G709]<=[Unidades.$G$26];[.G709]<=[Unidades.$F$18];[Unidades.$F$18]>0);[Unidades.$D$18]+1-COUNTIFS([Unidades.$O$3:.$O$17];">="&[.G709]);"") ->  | I709: of:=IF([.H708]<>[.H709];"INICIO";IF([.H710]<>[.H709];"FIN";"")) ->  | J709: of:=IF([.K708]<>[.K709];"INICIO";IF([.K710]<>[.K709];"FIN";"")) -> 
A710: of:=IF([.B710]<>"";TODAY()>[.B710];"") ->  | B710: of:=IFERROR(IF(([.B709]+1)<[Calendario.$F$5];[.B709]+1;"");"") ->  | C710: of:=IF(AND([.B710]>=[Calendario.$F$8];[.B710]<=[Calendario.$F$9];1);1;IF(AND([.B710]>=[Calendario.$F$12];[.B710]<=[Calendario.$F$13]);2;IF(AND([.B710]>=[Calendario.$F$16];[.B710]<=[Calendario.$F$17]);3;""))) ->  | D710: of:=IF(COUNTIF([Calendario.$H$4:.$H$48];[.B710])>0;"FIESTA";"") -> FIESTA | E710: of:=IF([.B710]<>"";VLOOKUP(WEEKDAY([.B710];3);[Calendario.$A$4:.$C$11];2);"") ->  | F710: of:=IF([.B710]<>"";IF([.D710]<>"FIESTA";VLOOKUP(WEEKDAY([.B710];3);[Calendario.$A$4:.$C$11];3);0);"") ->  | G710: of:=IF(ISNUMBER([.F710]);[.F710]+[.G709];"") ->  | H710: of:=IF(AND([.G710]<=[Unidades.$G$26];[.G710]<=[Unidades.$F$18];[Unidades.$F$18]>0);[Unidades.$D$18]+1-COUNTIFS([Unidades.$O$3:.$O$17];">="&[.G710]);"") ->  | I710: of:=IF([.H709]<>[.H710];"INICIO";IF([.H711]<>[.H710];"FIN";"")) ->  | J710: of:=IF([.K709]<>[.K710];"INICIO";IF([.K711]<>[.K710];"FIN";"")) -> 
A711: of:=IF([.B711]<>"";TODAY()>[.B711];"") ->  | B711: of:=IFERROR(IF(([.B710]+1)<[Calendario.$F$5];[.B710]+1;"");"") ->  | C711: of:=IF(AND([.B711]>=[Calendario.$F$8];[.B711]<=[Calendario.$F$9];1);1;IF(AND([.B711]>=[Calendario.$F$12];[.B711]<=[Calendario.$F$13]);2;IF(AND([.B711]>=[Calendario.$F$16];[.B711]<=[Calendario.$F$17]);3;""))) ->  | D711: of:=IF(COUNTIF([Calendario.$H$4:.$H$48];[.B711])>0;"FIESTA";"") -> FIESTA | E711: of:=IF([.B711]<>"";VLOOKUP(WEEKDAY([.B711];3);[Calendario.$A$4:.$C$11];2);"") ->  | F711: of:=IF([.B711]<>"";IF([.D711]<>"FIESTA";VLOOKUP(WEEKDAY([.B711];3);[Calendario.$A$4:.$C$11];3);0);"") ->  | G711: of:=IF(ISNUMBER([.F711]);[.F711]+[.G710];"") ->  | H711: of:=IF(AND([.G711]<=[Unidades.$G$26];[.G711]<=[Unidades.$F$18];[Unidades.$F$18]>0);[Unidades.$D$18]+1-COUNTIFS([Unidades.$O$3:.$O$17];">="&[.G711]);"") ->  | I711: of:=IF([.H710]<>[.H711];"INICIO";IF([.H712]<>[.H711];"FIN";"")) ->  | J711: of:=IF([.K710]<>[.K711];"INICIO";IF([.K712]<>[.K711];"FIN";"")) -> 
A712: of:=IF([.B712]<>"";TODAY()>[.B712];"") ->  | B712: of:=IFERROR(IF(([.B711]+1)<[Calendario.$F$5];[.B711]+1;"");"") ->  | C712: of:=IF(AND([.B712]>=[Calendario.$F$8];[.B712]<=[Calendario.$F$9];1);1;IF(AND([.B712]>=[Calendario.$F$12];[.B712]<=[Calendario.$F$13]);2;IF(AND([.B712]>=[Calendario.$F$16];[.B712]<=[Calendario.$F$17]);3;""))) ->  | D712: of:=IF(COUNTIF([Calendario.$H$4:.$H$48];[.B712])>0;"FIESTA";"") -> FIESTA | E712: of:=IF([.B712]<>"";VLOOKUP(WEEKDAY([.B712];3);[Calendario.$A$4:.$C$11];2);"") ->  | F712: of:=IF([.B712]<>"";IF([.D712]<>"FIESTA";VLOOKUP(WEEKDAY([.B712];3);[Calendario.$A$4:.$C$11];3);0);"") ->  | G712: of:=IF(ISNUMBER([.F712]);[.F712]+[.G711];"") ->  | H712: of:=IF(AND([.G712]<=[Unidades.$G$26];[.G712]<=[Unidades.$F$18];[Unidades.$F$18]>0);[Unidades.$D$18]+1-COUNTIFS([Unidades.$O$3:.$O$17];">="&[.G712]);"") ->  | I712: of:=IF([.H711]<>[.H712];"INICIO";IF([.H713]<>[.H712];"FIN";"")) ->  | J712: of:=IF([.K711]<>[.K712];"INICIO";IF([.K713]<>[.K712];"FIN";"")) -> 
A713: of:=IF([.B713]<>"";TODAY()>[.B713];"") ->  | B713: of:=IFERROR(IF(([.B712]+1)<[Calendario.$F$5];[.B712]+1;"");"") ->  | C713: of:=IF(AND([.B713]>=[Calendario.$F$8];[.B713]<=[Calendario.$F$9];1);1;IF(AND([.B713]>=[Calendario.$F$12];[.B713]<=[Calendario.$F$13]);2;IF(AND([.B713]>=[Calendario.$F$16];[.B713]<=[Calendario.$F$17]);3;""))) ->  | D713: of:=IF(COUNTIF([Calendario.$H$4:.$H$48];[.B713])>0;"FIESTA";"") -> FIESTA | E713: of:=IF([.B713]<>"";VLOOKUP(WEEKDAY([.B713];3);[Calendario.$A$4:.$C$11];2);"") ->  | F713: of:=IF([.B713]<>"";IF([.D713]<>"FIESTA";VLOOKUP(WEEKDAY([.B713];3);[Calendario.$A$4:.$C$11];3);0);"") ->  | G713: of:=IF(ISNUMBER([.F713]);[.F713]+[.G712];"") ->  | H713: of:=IF(AND([.G713]<=[Unidades.$G$26];[.G713]<=[Unidades.$F$18];[Unidades.$F$18]>0);[Unidades.$D$18]+1-COUNTIFS([Unidades.$O$3:.$O$17];">="&[.G713]);"") ->  | I713: of:=IF([.H712]<>[.H713];"INICIO";IF([.H714]<>[.H713];"FIN";"")) ->  | J713: of:=IF([.K712]<>[.K713];"INICIO";IF([.K714]<>[.K713];"FIN";"")) -> 
A714: of:=IF([.B714]<>"";TODAY()>[.B714];"") ->  | B714: of:=IFERROR(IF(([.B713]+1)<[Calendario.$F$5];[.B713]+1;"");"") ->  | C714: of:=IF(AND([.B714]>=[Calendario.$F$8];[.B714]<=[Calendario.$F$9];1);1;IF(AND([.B714]>=[Calendario.$F$12];[.B714]<=[Calendario.$F$13]);2;IF(AND([.B714]>=[Calendario.$F$16];[.B714]<=[Calendario.$F$17]);3;""))) ->  | D714: of:=IF(COUNTIF([Calendario.$H$4:.$H$48];[.B714])>0;"FIESTA";"") -> FIESTA | E714: of:=IF([.B714]<>"";VLOOKUP(WEEKDAY([.B714];3);[Calendario.$A$4:.$C$11];2);"") ->  | F714: of:=IF([.B714]<>"";IF([.D714]<>"FIESTA";VLOOKUP(WEEKDAY([.B714];3);[Calendario.$A$4:.$C$11];3);0);"") ->  | G714: of:=IF(ISNUMBER([.F714]);[.F714]+[.G713];"") ->  | H714: of:=IF(AND([.G714]<=[Unidades.$G$26];[.G714]<=[Unidades.$F$18];[Unidades.$F$18]>0);[Unidades.$D$18]+1-COUNTIFS([Unidades.$O$3:.$O$17];">="&[.G714]);"") ->  | I714: of:=IF([.H713]<>[.H714];"INICIO";IF([.H715]<>[.H714];"FIN";"")) ->  | J714: of:=IF([.K713]<>[.K714];"INICIO";IF([.K715]<>[.K714];"FIN";"")) -> 
A715: of:=IF([.B715]<>"";TODAY()>[.B715];"") ->  | B715: of:=IFERROR(IF(([.B714]+1)<[Calendario.$F$5];[.B714]+1;"");"") ->  | C715: of:=IF(AND([.B715]>=[Calendario.$F$8];[.B715]<=[Calendario.$F$9];1);1;IF(AND([.B715]>=[Calendario.$F$12];[.B715]<=[Calendario.$F$13]);2;IF(AND([.B715]>=[Calendario.$F$16];[.B715]<=[Calendario.$F$17]);3;""))) ->  | D715: of:=IF(COUNTIF([Calendario.$H$4:.$H$48];[.B715])>0;"FIESTA";"") -> FIESTA | E715: of:=IF([.B715]<>"";VLOOKUP(WEEKDAY([.B715];3);[Calendario.$A$4:.$C$11];2);"") ->  | F715: of:=IF([.B715]<>"";IF([.D715]<>"FIESTA";VLOOKUP(WEEKDAY([.B715];3);[Calendario.$A$4:.$C$11];3);0);"") ->  | G715: of:=IF(ISNUMBER([.F715]);[.F715]+[.G714];"") ->  | H715: of:=IF(AND([.G715]<=[Unidades.$G$26];[.G715]<=[Unidades.$F$18];[Unidades.$F$18]>0);[Unidades.$D$18]+1-COUNTIFS([Unidades.$O$3:.$O$17];">="&[.G715]);"") ->  | I715: of:=IF([.H714]<>[.H715];"INICIO";IF([.H716]<>[.H715];"FIN";"")) ->  | J715: of:=IF([.K714]<>[.K715];"INICIO";IF([.K716]<>[.K715];"FIN";"")) -> 
A716: of:=IF([.B716]<>"";TODAY()>[.B716];"") ->  | B716: of:=IFERROR(IF(([.B715]+1)<[Calendario.$F$5];[.B715]+1;"");"") ->  | C716: of:=IF(AND([.B716]>=[Calendario.$F$8];[.B716]<=[Calendario.$F$9];1);1;IF(AND([.B716]>=[Calendario.$F$12];[.B716]<=[Calendario.$F$13]);2;IF(AND([.B716]>=[Calendario.$F$16];[.B716]<=[Calendario.$F$17]);3;""))) ->  | D716: of:=IF(COUNTIF([Calendario.$H$4:.$H$48];[.B716])>0;"FIESTA";"") -> FIESTA | E716: of:=IF([.B716]<>"";VLOOKUP(WEEKDAY([.B716];3);[Calendario.$A$4:.$C$11];2);"") ->  | F716: of:=IF([.B716]<>"";IF([.D716]<>"FIESTA";VLOOKUP(WEEKDAY([.B716];3);[Calendario.$A$4:.$C$11];3);0);"") ->  | G716: of:=IF(ISNUMBER([.F716]);[.F716]+[.G715];"") ->  | H716: of:=IF(AND([.G716]<=[Unidades.$G$26];[.G716]<=[Unidades.$F$18];[Unidades.$F$18]>0);[Unidades.$D$18]+1-COUNTIFS([Unidades.$O$3:.$O$17];">="&[.G716]);"") ->  | I716: of:=IF([.H715]<>[.H716];"INICIO";IF([.H717]<>[.H716];"FIN";"")) ->  | J716: of:=IF([.K715]<>[.K716];"INICIO";IF([.K717]<>[.K716];"FIN";"")) -> 
A717: of:=IF([.B717]<>"";TODAY()>[.B717];"") ->  | B717: of:=IFERROR(IF(([.B716]+1)<[Calendario.$F$5];[.B716]+1;"");"") ->  | C717: of:=IF(AND([.B717]>=[Calendario.$F$8];[.B717]<=[Calendario.$F$9];1);1;IF(AND([.B717]>=[Calendario.$F$12];[.B717]<=[Calendario.$F$13]);2;IF(AND([.B717]>=[Calendario.$F$16];[.B717]<=[Calendario.$F$17]);3;""))) ->  | D717: of:=IF(COUNTIF([Calendario.$H$4:.$H$48];[.B717])>0;"FIESTA";"") -> FIESTA | E717: of:=IF([.B717]<>"";VLOOKUP(WEEKDAY([.B717];3);[Calendario.$A$4:.$C$11];2);"") ->  | F717: of:=IF([.B717]<>"";IF([.D717]<>"FIESTA";VLOOKUP(WEEKDAY([.B717];3);[Calendario.$A$4:.$C$11];3);0);"") ->  | G717: of:=IF(ISNUMBER([.F717]);[.F717]+[.G716];"") ->  | H717: of:=IF(AND([.G717]<=[Unidades.$G$26];[.G717]<=[Unidades.$F$18];[Unidades.$F$18]>0);[Unidades.$D$18]+1-COUNTIFS([Unidades.$O$3:.$O$17];">="&[.G717]);"") ->  | I717: of:=IF([.H716]<>[.H717];"INICIO";IF([.H718]<>[.H717];"FIN";"")) ->  | J717: of:=IF([.K716]<>[.K717];"INICIO";IF([.K718]<>[.K717];"FIN";"")) -> 
A718: of:=IF([.B718]<>"";TODAY()>[.B718];"") ->  | B718: of:=IFERROR(IF(([.B717]+1)<[Calendario.$F$5];[.B717]+1;"");"") ->  | C718: of:=IF(AND([.B718]>=[Calendario.$F$8];[.B718]<=[Calendario.$F$9];1);1;IF(AND([.B718]>=[Calendario.$F$12];[.B718]<=[Calendario.$F$13]);2;IF(AND([.B718]>=[Calendario.$F$16];[.B718]<=[Calendario.$F$17]);3;""))) ->  | D718: of:=IF(COUNTIF([Calendario.$H$4:.$H$48];[.B718])>0;"FIESTA";"") -> FIESTA | E718: of:=IF([.B718]<>"";VLOOKUP(WEEKDAY([.B718];3);[Calendario.$A$4:.$C$11];2);"") ->  | F718: of:=IF([.B718]<>"";IF([.D718]<>"FIESTA";VLOOKUP(WEEKDAY([.B718];3);[Calendario.$A$4:.$C$11];3);0);"") ->  | G718: of:=IF(ISNUMBER([.F718]);[.F718]+[.G717];"") ->  | H718: of:=IF(AND([.G718]<=[Unidades.$G$26];[.G718]<=[Unidades.$F$18];[Unidades.$F$18]>0);[Unidades.$D$18]+1-COUNTIFS([Unidades.$O$3:.$O$17];">="&[.G718]);"") ->  | I718: of:=IF([.H717]<>[.H718];"INICIO";IF([.H719]<>[.H718];"FIN";"")) ->  | J718: of:=IF([.K717]<>[.K718];"INICIO";IF([.K719]<>[.K718];"FIN";"")) -> 
A719: of:=IF([.B719]<>"";TODAY()>[.B719];"") ->  | B719: of:=IFERROR(IF(([.B718]+1)<[Calendario.$F$5];[.B718]+1;"");"") ->  | C719: of:=IF(AND([.B719]>=[Calendario.$F$8];[.B719]<=[Calendario.$F$9];1);1;IF(AND([.B719]>=[Calendario.$F$12];[.B719]<=[Calendario.$F$13]);2;IF(AND([.B719]>=[Calendario.$F$16];[.B719]<=[Calendario.$F$17]);3;""))) ->  | D719: of:=IF(COUNTIF([Calendario.$H$4:.$H$48];[.B719])>0;"FIESTA";"") -> FIESTA | E719: of:=IF([.B719]<>"";VLOOKUP(WEEKDAY([.B719];3);[Calendario.$A$4:.$C$11];2);"") ->  | F719: of:=IF([.B719]<>"";IF([.D719]<>"FIESTA";VLOOKUP(WEEKDAY([.B719];3);[Calendario.$A$4:.$C$11];3);0);"") ->  | G719: of:=IF(ISNUMBER([.F719]);[.F719]+[.G718];"") ->  | H719: of:=IF(AND([.G719]<=[Unidades.$G$26];[.G719]<=[Unidades.$F$18];[Unidades.$F$18]>0);[Unidades.$D$18]+1-COUNTIFS([Unidades.$O$3:.$O$17];">="&[.G719]);"") ->  | I719: of:=IF([.H718]<>[.H719];"INICIO";IF([.H720]<>[.H719];"FIN";"")) ->  | J719: of:=IF([.K718]<>[.K719];"INICIO";IF([.K720]<>[.K719];"FIN";"")) -> 
A720: of:=IF([.B720]<>"";TODAY()>[.B720];"") ->  | B720: of:=IFERROR(IF(([.B719]+1)<[Calendario.$F$5];[.B719]+1;"");"") ->  | C720: of:=IF(AND([.B720]>=[Calendario.$F$8];[.B720]<=[Calendario.$F$9];1);1;IF(AND([.B720]>=[Calendario.$F$12];[.B720]<=[Calendario.$F$13]);2;IF(AND([.B720]>=[Calendario.$F$16];[.B720]<=[Calendario.$F$17]);3;""))) ->  | D720: of:=IF(COUNTIF([Calendario.$H$4:.$H$48];[.B720])>0;"FIESTA";"") -> FIESTA | E720: of:=IF([.B720]<>"";VLOOKUP(WEEKDAY([.B720];3);[Calendario.$A$4:.$C$11];2);"") ->  | F720: of:=IF([.B720]<>"";IF([.D720]<>"FIESTA";VLOOKUP(WEEKDAY([.B720];3);[Calendario.$A$4:.$C$11];3);0);"") ->  | G720: of:=IF(ISNUMBER([.F720]);[.F720]+[.G719];"") ->  | H720: of:=IF(AND([.G720]<=[Unidades.$G$26];[.G720]<=[Unidades.$F$18];[Unidades.$F$18]>0);[Unidades.$D$18]+1-COUNTIFS([Unidades.$O$3:.$O$17];">="&[.G720]);"") ->  | I720: of:=IF([.H719]<>[.H720];"INICIO";IF([.H721]<>[.H720];"FIN";"")) ->  | J720: of:=IF([.K719]<>[.K720];"INICIO";IF([.K721]<>[.K720];"FIN";"")) -> 
A721: of:=IF([.B721]<>"";TODAY()>[.B721];"") ->  | B721: of:=IFERROR(IF(([.B720]+1)<[Calendario.$F$5];[.B720]+1;"");"") ->  | C721: of:=IF(AND([.B721]>=[Calendario.$F$8];[.B721]<=[Calendario.$F$9];1);1;IF(AND([.B721]>=[Calendario.$F$12];[.B721]<=[Calendario.$F$13]);2;IF(AND([.B721]>=[Calendario.$F$16];[.B721]<=[Calendario.$F$17]);3;""))) ->  | D721: of:=IF(COUNTIF([Calendario.$H$4:.$H$48];[.B721])>0;"FIESTA";"") -> FIESTA | E721: of:=IF([.B721]<>"";VLOOKUP(WEEKDAY([.B721];3);[Calendario.$A$4:.$C$11];2);"") ->  | F721: of:=IF([.B721]<>"";IF([.D721]<>"FIESTA";VLOOKUP(WEEKDAY([.B721];3);[Calendario.$A$4:.$C$11];3);0);"") ->  | G721: of:=IF(ISNUMBER([.F721]);[.F721]+[.G720];"") ->  | H721: of:=IF(AND([.G721]<=[Unidades.$G$26];[.G721]<=[Unidades.$F$18];[Unidades.$F$18]>0);[Unidades.$D$18]+1-COUNTIFS([Unidades.$O$3:.$O$17];">="&[.G721]);"") ->  | I721: of:=IF([.H720]<>[.H721];"INICIO";IF([.H722]<>[.H721];"FIN";"")) ->  | J721: of:=IF([.K720]<>[.K721];"INICIO";IF([.K722]<>[.K721];"FIN";"")) -> 
A722: of:=IF([.B722]<>"";TODAY()>[.B722];"") ->  | B722: of:=IFERROR(IF(([.B721]+1)<[Calendario.$F$5];[.B721]+1;"");"") ->  | C722: of:=IF(AND([.B722]>=[Calendario.$F$8];[.B722]<=[Calendario.$F$9];1);1;IF(AND([.B722]>=[Calendario.$F$12];[.B722]<=[Calendario.$F$13]);2;IF(AND([.B722]>=[Calendario.$F$16];[.B722]<=[Calendario.$F$17]);3;""))) ->  | D722: of:=IF(COUNTIF([Calendario.$H$4:.$H$48];[.B722])>0;"FIESTA";"") -> FIESTA | E722: of:=IF([.B722]<>"";VLOOKUP(WEEKDAY([.B722];3);[Calendario.$A$4:.$C$11];2);"") ->  | F722: of:=IF([.B722]<>"";IF([.D722]<>"FIESTA";VLOOKUP(WEEKDAY([.B722];3);[Calendario.$A$4:.$C$11];3);0);"") ->  | G722: of:=IF(ISNUMBER([.F722]);[.F722]+[.G721];"") ->  | H722: of:=IF(AND([.G722]<=[Unidades.$G$26];[.G722]<=[Unidades.$F$18];[Unidades.$F$18]>0);[Unidades.$D$18]+1-COUNTIFS([Unidades.$O$3:.$O$17];">="&[.G722]);"") ->  | I722: of:=IF([.H721]<>[.H722];"INICIO";IF([.H723]<>[.H722];"FIN";"")) ->  | J722: of:=IF([.K721]<>[.K722];"INICIO";IF([.K723]<>[.K722];"FIN";"")) -> 
A723: of:=IF([.B723]<>"";TODAY()>[.B723];"") ->  | B723: of:=IFERROR(IF(([.B722]+1)<[Calendario.$F$5];[.B722]+1;"");"") ->  | C723: of:=IF(AND([.B723]>=[Calendario.$F$8];[.B723]<=[Calendario.$F$9];1);1;IF(AND([.B723]>=[Calendario.$F$12];[.B723]<=[Calendario.$F$13]);2;IF(AND([.B723]>=[Calendario.$F$16];[.B723]<=[Calendario.$F$17]);3;""))) ->  | D723: of:=IF(COUNTIF([Calendario.$H$4:.$H$48];[.B723])>0;"FIESTA";"") -> FIESTA | E723: of:=IF([.B723]<>"";VLOOKUP(WEEKDAY([.B723];3);[Calendario.$A$4:.$C$11];2);"") ->  | F723: of:=IF([.B723]<>"";IF([.D723]<>"FIESTA";VLOOKUP(WEEKDAY([.B723];3);[Calendario.$A$4:.$C$11];3);0);"") ->  | G723: of:=IF(ISNUMBER([.F723]);[.F723]+[.G722];"") ->  | H723: of:=IF(AND([.G723]<=[Unidades.$G$26];[.G723]<=[Unidades.$F$18];[Unidades.$F$18]>0);[Unidades.$D$18]+1-COUNTIFS([Unidades.$O$3:.$O$17];">="&[.G723]);"") ->  | I723: of:=IF([.H722]<>[.H723];"INICIO";IF([.H724]<>[.H723];"FIN";"")) ->  | J723: of:=IF([.K722]<>[.K723];"INICIO";IF([.K724]<>[.K723];"FIN";"")) -> 
A724: of:=IF([.B724]<>"";TODAY()>[.B724];"") ->  | B724: of:=IFERROR(IF(([.B723]+1)<[Calendario.$F$5];[.B723]+1;"");"") ->  | C724: of:=IF(AND([.B724]>=[Calendario.$F$8];[.B724]<=[Calendario.$F$9];1);1;IF(AND([.B724]>=[Calendario.$F$12];[.B724]<=[Calendario.$F$13]);2;IF(AND([.B724]>=[Calendario.$F$16];[.B724]<=[Calendario.$F$17]);3;""))) ->  | D724: of:=IF(COUNTIF([Calendario.$H$4:.$H$48];[.B724])>0;"FIESTA";"") -> FIESTA | E724: of:=IF([.B724]<>"";VLOOKUP(WEEKDAY([.B724];3);[Calendario.$A$4:.$C$11];2);"") ->  | F724: of:=IF([.B724]<>"";IF([.D724]<>"FIESTA";VLOOKUP(WEEKDAY([.B724];3);[Calendario.$A$4:.$C$11];3);0);"") ->  | G724: of:=IF(ISNUMBER([.F724]);[.F724]+[.G723];"") ->  | H724: of:=IF(AND([.G724]<=[Unidades.$G$26];[.G724]<=[Unidades.$F$18];[Unidades.$F$18]>0);[Unidades.$D$18]+1-COUNTIFS([Unidades.$O$3:.$O$17];">="&[.G724]);"") ->  | I724: of:=IF([.H723]<>[.H724];"INICIO";IF([.H725]<>[.H724];"FIN";"")) ->  | J724: of:=IF([.K723]<>[.K724];"INICIO";IF([.K725]<>[.K724];"FIN";"")) -> 
A725: of:=IF([.B725]<>"";TODAY()>[.B725];"") ->  | B725: of:=IFERROR(IF(([.B724]+1)<[Calendario.$F$5];[.B724]+1;"");"") ->  | C725: of:=IF(AND([.B725]>=[Calendario.$F$8];[.B725]<=[Calendario.$F$9];1);1;IF(AND([.B725]>=[Calendario.$F$12];[.B725]<=[Calendario.$F$13]);2;IF(AND([.B725]>=[Calendario.$F$16];[.B725]<=[Calendario.$F$17]);3;""))) ->  | D725: of:=IF(COUNTIF([Calendario.$H$4:.$H$48];[.B725])>0;"FIESTA";"") -> FIESTA | E725: of:=IF([.B725]<>"";VLOOKUP(WEEKDAY([.B725];3);[Calendario.$A$4:.$C$11];2);"") ->  | F725: of:=IF([.B725]<>"";IF([.D725]<>"FIESTA";VLOOKUP(WEEKDAY([.B725];3);[Calendario.$A$4:.$C$11];3);0);"") ->  | G725: of:=IF(ISNUMBER([.F725]);[.F725]+[.G724];"") ->  | H725: of:=IF(AND([.G725]<=[Unidades.$G$26];[.G725]<=[Unidades.$F$18];[Unidades.$F$18]>0);[Unidades.$D$18]+1-COUNTIFS([Unidades.$O$3:.$O$17];">="&[.G725]);"") ->  | I725: of:=IF([.H724]<>[.H725];"INICIO";IF([.H726]<>[.H725];"FIN";"")) ->  | J725: of:=IF([.K724]<>[.K725];"INICIO";IF([.K726]<>[.K725];"FIN";"")) -> 
A726: of:=IF([.B726]<>"";TODAY()>[.B726];"") ->  | B726: of:=IFERROR(IF(([.B725]+1)<[Calendario.$F$5];[.B725]+1;"");"") ->  | C726: of:=IF(AND([.B726]>=[Calendario.$F$8];[.B726]<=[Calendario.$F$9];1);1;IF(AND([.B726]>=[Calendario.$F$12];[.B726]<=[Calendario.$F$13]);2;IF(AND([.B726]>=[Calendario.$F$16];[.B726]<=[Calendario.$F$17]);3;""))) ->  | D726: of:=IF(COUNTIF([Calendario.$H$4:.$H$48];[.B726])>0;"FIESTA";"") -> FIESTA | E726: of:=IF([.B726]<>"";VLOOKUP(WEEKDAY([.B726];3);[Calendario.$A$4:.$C$11];2);"") ->  | F726: of:=IF([.B726]<>"";IF([.D726]<>"FIESTA";VLOOKUP(WEEKDAY([.B726];3);[Calendario.$A$4:.$C$11];3);0);"") ->  | G726: of:=IF(ISNUMBER([.F726]);[.F726]+[.G725];"") ->  | H726: of:=IF(AND([.G726]<=[Unidades.$G$26];[.G726]<=[Unidades.$F$18];[Unidades.$F$18]>0);[Unidades.$D$18]+1-COUNTIFS([Unidades.$O$3:.$O$17];">="&[.G726]);"") ->  | I726: of:=IF([.H725]<>[.H726];"INICIO";IF([.H727]<>[.H726];"FIN";"")) ->  | J726: of:=IF([.K725]<>[.K726];"INICIO";IF([.K727]<>[.K726];"FIN";"")) -> 
A727: of:=IF([.B727]<>"";TODAY()>[.B727];"") ->  | B727: of:=IFERROR(IF(([.B726]+1)<[Calendario.$F$5];[.B726]+1;"");"") ->  | C727: of:=IF(AND([.B727]>=[Calendario.$F$8];[.B727]<=[Calendario.$F$9];1);1;IF(AND([.B727]>=[Calendario.$F$12];[.B727]<=[Calendario.$F$13]);2;IF(AND([.B727]>=[Calendario.$F$16];[.B727]<=[Calendario.$F$17]);3;""))) ->  | D727: of:=IF(COUNTIF([Calendario.$H$4:.$H$48];[.B727])>0;"FIESTA";"") -> FIESTA | E727: of:=IF([.B727]<>"";VLOOKUP(WEEKDAY([.B727];3);[Calendario.$A$4:.$C$11];2);"") ->  | F727: of:=IF([.B727]<>"";IF([.D727]<>"FIESTA";VLOOKUP(WEEKDAY([.B727];3);[Calendario.$A$4:.$C$11];3);0);"") ->  | G727: of:=IF(ISNUMBER([.F727]);[.F727]+[.G726];"") ->  | H727: of:=IF(AND([.G727]<=[Unidades.$G$26];[.G727]<=[Unidades.$F$18];[Unidades.$F$18]>0);[Unidades.$D$18]+1-COUNTIFS([Unidades.$O$3:.$O$17];">="&[.G727]);"") ->  | I727: of:=IF([.H726]<>[.H727];"INICIO";IF([.H728]<>[.H727];"FIN";"")) ->  | J727: of:=IF([.K726]<>[.K727];"INICIO";IF([.K728]<>[.K727];"FIN";"")) -> 
A728: of:=IF([.B728]<>"";TODAY()>[.B728];"") ->  | B728: of:=IFERROR(IF(([.B727]+1)<[Calendario.$F$5];[.B727]+1;"");"") ->  | C728: of:=IF(AND([.B728]>=[Calendario.$F$8];[.B728]<=[Calendario.$F$9];1);1;IF(AND([.B728]>=[Calendario.$F$12];[.B728]<=[Calendario.$F$13]);2;IF(AND([.B728]>=[Calendario.$F$16];[.B728]<=[Calendario.$F$17]);3;""))) ->  | D728: of:=IF(COUNTIF([Calendario.$H$4:.$H$48];[.B728])>0;"FIESTA";"") -> FIESTA | E728: of:=IF([.B728]<>"";VLOOKUP(WEEKDAY([.B728];3);[Calendario.$A$4:.$C$11];2);"") ->  | F728: of:=IF([.B728]<>"";IF([.D728]<>"FIESTA";VLOOKUP(WEEKDAY([.B728];3);[Calendario.$A$4:.$C$11];3);0);"") ->  | G728: of:=IF(ISNUMBER([.F728]);[.F728]+[.G727];"") ->  | H728: of:=IF(AND([.G728]<=[Unidades.$G$26];[.G728]<=[Unidades.$F$18];[Unidades.$F$18]>0);[Unidades.$D$18]+1-COUNTIFS([Unidades.$O$3:.$O$17];">="&[.G728]);"") ->  | I728: of:=IF([.H727]<>[.H728];"INICIO";IF([.H729]<>[.H728];"FIN";"")) ->  | J728: of:=IF([.K727]<>[.K728];"INICIO";IF([.K729]<>[.K728];"FIN";"")) -> 
A729: of:=IF([.B729]<>"";TODAY()>[.B729];"") ->  | B729: of:=IFERROR(IF(([.B728]+1)<[Calendario.$F$5];[.B728]+1;"");"") ->  | C729: of:=IF(AND([.B729]>=[Calendario.$F$8];[.B729]<=[Calendario.$F$9];1);1;IF(AND([.B729]>=[Calendario.$F$12];[.B729]<=[Calendario.$F$13]);2;IF(AND([.B729]>=[Calendario.$F$16];[.B729]<=[Calendario.$F$17]);3;""))) ->  | D729: of:=IF(COUNTIF([Calendario.$H$4:.$H$48];[.B729])>0;"FIESTA";"") -> FIESTA | E729: of:=IF([.B729]<>"";VLOOKUP(WEEKDAY([.B729];3);[Calendario.$A$4:.$C$11];2);"") ->  | F729: of:=IF([.B729]<>"";IF([.D729]<>"FIESTA";VLOOKUP(WEEKDAY([.B729];3);[Calendario.$A$4:.$C$11];3);0);"") ->  | G729: of:=IF(ISNUMBER([.F729]);[.F729]+[.G728];"") ->  | H729: of:=IF(AND([.G729]<=[Unidades.$G$26];[.G729]<=[Unidades.$F$18];[Unidades.$F$18]>0);[Unidades.$D$18]+1-COUNTIFS([Unidades.$O$3:.$O$17];">="&[.G729]);"") ->  | I729: of:=IF([.H728]<>[.H729];"INICIO";IF([.H730]<>[.H729];"FIN";"")) ->  | J729: of:=IF([.K728]<>[.K729];"INICIO";IF([.K730]<>[.K729];"FIN";"")) -> 
A730: of:=IF([.B730]<>"";TODAY()>[.B730];"") ->  | B730: of:=IFERROR(IF(([.B729]+1)<[Calendario.$F$5];[.B729]+1;"");"") ->  | C730: of:=IF(AND([.B730]>=[Calendario.$F$8];[.B730]<=[Calendario.$F$9];1);1;IF(AND([.B730]>=[Calendario.$F$12];[.B730]<=[Calendario.$F$13]);2;IF(AND([.B730]>=[Calendario.$F$16];[.B730]<=[Calendario.$F$17]);3;""))) ->  | D730: of:=IF(COUNTIF([Calendario.$H$4:.$H$48];[.B730])>0;"FIESTA";"") -> FIESTA | E730: of:=IF([.B730]<>"";VLOOKUP(WEEKDAY([.B730];3);[Calendario.$A$4:.$C$11];2);"") ->  | F730: of:=IF([.B730]<>"";IF([.D730]<>"FIESTA";VLOOKUP(WEEKDAY([.B730];3);[Calendario.$A$4:.$C$11];3);0);"") ->  | G730: of:=IF(ISNUMBER([.F730]);[.F730]+[.G729];"") ->  | H730: of:=IF(AND([.G730]<=[Unidades.$G$26];[.G730]<=[Unidades.$F$18];[Unidades.$F$18]>0);[Unidades.$D$18]+1-COUNTIFS([Unidades.$O$3:.$O$17];">="&[.G730]);"") ->  | I730: of:=IF([.H729]<>[.H730];"INICIO";IF([.H731]<>[.H730];"FIN";"")) ->  | J730: of:=IF([.K729]<>[.K730];"INICIO";IF([.K731]<>[.K730];"FIN";"")) -> 
A731: of:=IF([.B731]<>"";TODAY()>[.B731];"") ->  | B731: of:=IFERROR(IF(([.B730]+1)<[Calendario.$F$5];[.B730]+1;"");"") ->  | C731: of:=IF(AND([.B731]>=[Calendario.$F$8];[.B731]<=[Calendario.$F$9];1);1;IF(AND([.B731]>=[Calendario.$F$12];[.B731]<=[Calendario.$F$13]);2;IF(AND([.B731]>=[Calendario.$F$16];[.B731]<=[Calendario.$F$17]);3;""))) ->  | D731: of:=IF(COUNTIF([Calendario.$H$4:.$H$48];[.B731])>0;"FIESTA";"") -> FIESTA | E731: of:=IF([.B731]<>"";VLOOKUP(WEEKDAY([.B731];3);[Calendario.$A$4:.$C$11];2);"") ->  | F731: of:=IF([.B731]<>"";IF([.D731]<>"FIESTA";VLOOKUP(WEEKDAY([.B731];3);[Calendario.$A$4:.$C$11];3);0);"") ->  | G731: of:=IF(ISNUMBER([.F731]);[.F731]+[.G730];"") ->  | H731: of:=IF(AND([.G731]<=[Unidades.$G$26];[.G731]<=[Unidades.$F$18];[Unidades.$F$18]>0);[Unidades.$D$18]+1-COUNTIFS([Unidades.$O$3:.$O$17];">="&[.G731]);"") ->  | I731: of:=IF([.H730]<>[.H731];"INICIO";IF([.H732]<>[.H731];"FIN";"")) ->  | J731: of:=IF([.K730]<>[.K731];"INICIO";IF([.K732]<>[.K731];"FIN";"")) -> 
A732: of:=IF([.B732]<>"";TODAY()>[.B732];"") ->  | B732: of:=IFERROR(IF(([.B731]+1)<[Calendario.$F$5];[.B731]+1;"");"") ->  | C732: of:=IF(AND([.B732]>=[Calendario.$F$8];[.B732]<=[Calendario.$F$9];1);1;IF(AND([.B732]>=[Calendario.$F$12];[.B732]<=[Calendario.$F$13]);2;IF(AND([.B732]>=[Calendario.$F$16];[.B732]<=[Calendario.$F$17]);3;""))) ->  | D732: of:=IF(COUNTIF([Calendario.$H$4:.$H$48];[.B732])>0;"FIESTA";"") -> FIESTA | E732: of:=IF([.B732]<>"";VLOOKUP(WEEKDAY([.B732];3);[Calendario.$A$4:.$C$11];2);"") ->  | F732: of:=IF([.B732]<>"";IF([.D732]<>"FIESTA";VLOOKUP(WEEKDAY([.B732];3);[Calendario.$A$4:.$C$11];3);0);"") ->  | G732: of:=IF(ISNUMBER([.F732]);[.F732]+[.G731];"") ->  | H732: of:=IF(AND([.G732]<=[Unidades.$G$26];[.G732]<=[Unidades.$F$18];[Unidades.$F$18]>0);[Unidades.$D$18]+1-COUNTIFS([Unidades.$O$3:.$O$17];">="&[.G732]);"") ->  | I732: of:=IF([.H731]<>[.H732];"INICIO";IF([.H733]<>[.H732];"FIN";"")) ->  | J732: of:=IF([.K731]<>[.K732];"INICIO";IF([.K733]<>[.K732];"FIN";"")) -> 
A733: of:=IF([.B733]<>"";TODAY()>[.B733];"") ->  | B733: of:=IFERROR(IF(([.B732]+1)<[Calendario.$F$5];[.B732]+1;"");"") ->  | C733: of:=IF(AND([.B733]>=[Calendario.$F$8];[.B733]<=[Calendario.$F$9];1);1;IF(AND([.B733]>=[Calendario.$F$12];[.B733]<=[Calendario.$F$13]);2;IF(AND([.B733]>=[Calendario.$F$16];[.B733]<=[Calendario.$F$17]);3;""))) ->  | D733: of:=IF(COUNTIF([Calendario.$H$4:.$H$48];[.B733])>0;"FIESTA";"") -> FIESTA | E733: of:=IF([.B733]<>"";VLOOKUP(WEEKDAY([.B733];3);[Calendario.$A$4:.$C$11];2);"") ->  | F733: of:=IF([.B733]<>"";IF([.D733]<>"FIESTA";VLOOKUP(WEEKDAY([.B733];3);[Calendario.$A$4:.$C$11];3);0);"") ->  | G733: of:=IF(ISNUMBER([.F733]);[.F733]+[.G732];"") ->  | H733: of:=IF(AND([.G733]<=[Unidades.$G$26];[.G733]<=[Unidades.$F$18];[Unidades.$F$18]>0);[Unidades.$D$18]+1-COUNTIFS([Unidades.$O$3:.$O$17];">="&[.G733]);"") ->  | I733: of:=IF([.H732]<>[.H733];"INICIO";IF([.H734]<>[.H733];"FIN";"")) ->  | J733: of:=IF([.K732]<>[.K733];"INICIO";IF([.K734]<>[.K733];"FIN";"")) -> 
A734: of:=IF([.B734]<>"";TODAY()>[.B734];"") ->  | B734: of:=IFERROR(IF(([.B733]+1)<[Calendario.$F$5];[.B733]+1;"");"") ->  | C734: of:=IF(AND([.B734]>=[Calendario.$F$8];[.B734]<=[Calendario.$F$9];1);1;IF(AND([.B734]>=[Calendario.$F$12];[.B734]<=[Calendario.$F$13]);2;IF(AND([.B734]>=[Calendario.$F$16];[.B734]<=[Calendario.$F$17]);3;""))) ->  | D734: of:=IF(COUNTIF([Calendario.$H$4:.$H$48];[.B734])>0;"FIESTA";"") -> FIESTA | E734: of:=IF([.B734]<>"";VLOOKUP(WEEKDAY([.B734];3);[Calendario.$A$4:.$C$11];2);"") ->  | F734: of:=IF([.B734]<>"";IF([.D734]<>"FIESTA";VLOOKUP(WEEKDAY([.B734];3);[Calendario.$A$4:.$C$11];3);0);"") ->  | G734: of:=IF(ISNUMBER([.F734]);[.F734]+[.G733];"") ->  | H734: of:=IF(AND([.G734]<=[Unidades.$G$26];[.G734]<=[Unidades.$F$18];[Unidades.$F$18]>0);[Unidades.$D$18]+1-COUNTIFS([Unidades.$O$3:.$O$17];">="&[.G734]);"") ->  | I734: of:=IF([.H733]<>[.H734];"INICIO";IF([.H735]<>[.H734];"FIN";"")) ->  | J734: of:=IF([.K733]<>[.K734];"INICIO";IF([.K735]<>[.K734];"FIN";"")) -> 
A735: of:=IF([.B735]<>"";TODAY()>[.B735];"") ->  | B735: of:=IFERROR(IF(([.B734]+1)<[Calendario.$F$5];[.B734]+1;"");"") ->  | C735: of:=IF(AND([.B735]>=[Calendario.$F$8];[.B735]<=[Calendario.$F$9];1);1;IF(AND([.B735]>=[Calendario.$F$12];[.B735]<=[Calendario.$F$13]);2;IF(AND([.B735]>=[Calendario.$F$16];[.B735]<=[Calendario.$F$17]);3;""))) ->  | D735: of:=IF(COUNTIF([Calendario.$H$4:.$H$48];[.B735])>0;"FIESTA";"") -> FIESTA | E735: of:=IF([.B735]<>"";VLOOKUP(WEEKDAY([.B735];3);[Calendario.$A$4:.$C$11];2);"") ->  | F735: of:=IF([.B735]<>"";IF([.D735]<>"FIESTA";VLOOKUP(WEEKDAY([.B735];3);[Calendario.$A$4:.$C$11];3);0);"") ->  | G735: of:=IF(ISNUMBER([.F735]);[.F735]+[.G734];"") ->  | H735: of:=IF(AND([.G735]<=[Unidades.$G$26];[.G735]<=[Unidades.$F$18];[Unidades.$F$18]>0);[Unidades.$D$18]+1-COUNTIFS([Unidades.$O$3:.$O$17];">="&[.G735]);"") ->  | I735: of:=IF([.H734]<>[.H735];"INICIO";IF([.H736]<>[.H735];"FIN";"")) ->  | J735: of:=IF([.K734]<>[.K735];"INICIO";IF([.K736]<>[.K735];"FIN";"")) -> 
A736: of:=IF([.B736]<>"";TODAY()>[.B736];"") ->  | B736: of:=IFERROR(IF(([.B735]+1)<[Calendario.$F$5];[.B735]+1;"");"") ->  | C736: of:=IF(AND([.B736]>=[Calendario.$F$8];[.B736]<=[Calendario.$F$9];1);1;IF(AND([.B736]>=[Calendario.$F$12];[.B736]<=[Calendario.$F$13]);2;IF(AND([.B736]>=[Calendario.$F$16];[.B736]<=[Calendario.$F$17]);3;""))) ->  | D736: of:=IF(COUNTIF([Calendario.$H$4:.$H$48];[.B736])>0;"FIESTA";"") -> FIESTA | E736: of:=IF([.B736]<>"";VLOOKUP(WEEKDAY([.B736];3);[Calendario.$A$4:.$C$11];2);"") ->  | F736: of:=IF([.B736]<>"";IF([.D736]<>"FIESTA";VLOOKUP(WEEKDAY([.B736];3);[Calendario.$A$4:.$C$11];3);0);"") ->  | G736: of:=IF(ISNUMBER([.F736]);[.F736]+[.G735];"") ->  | H736: of:=IF(AND([.G736]<=[Unidades.$G$26];[.G736]<=[Unidades.$F$18];[Unidades.$F$18]>0);[Unidades.$D$18]+1-COUNTIFS([Unidades.$O$3:.$O$17];">="&[.G736]);"") ->  | I736: of:=IF([.H735]<>[.H736];"INICIO";IF([.H737]<>[.H736];"FIN";"")) ->  | J736: of:=IF([.K735]<>[.K736];"INICIO";IF([.K737]<>[.K736];"FIN";"")) -> 
A737: of:=IF([.B737]<>"";TODAY()>[.B737];"") ->  | B737: of:=IFERROR(IF(([.B736]+1)<[Calendario.$F$5];[.B736]+1;"");"") ->  | C737: of:=IF(AND([.B737]>=[Calendario.$F$8];[.B737]<=[Calendario.$F$9];1);1;IF(AND([.B737]>=[Calendario.$F$12];[.B737]<=[Calendario.$F$13]);2;IF(AND([.B737]>=[Calendario.$F$16];[.B737]<=[Calendario.$F$17]);3;""))) ->  | D737: of:=IF(COUNTIF([Calendario.$H$4:.$H$48];[.B737])>0;"FIESTA";"") -> FIESTA | E737: of:=IF([.B737]<>"";VLOOKUP(WEEKDAY([.B737];3);[Calendario.$A$4:.$C$11];2);"") ->  | F737: of:=IF([.B737]<>"";IF([.D737]<>"FIESTA";VLOOKUP(WEEKDAY([.B737];3);[Calendario.$A$4:.$C$11];3);0);"") ->  | G737: of:=IF(ISNUMBER([.F737]);[.F737]+[.G736];"") ->  | H737: of:=IF(AND([.G737]<=[Unidades.$G$26];[.G737]<=[Unidades.$F$18];[Unidades.$F$18]>0);[Unidades.$D$18]+1-COUNTIFS([Unidades.$O$3:.$O$17];">="&[.G737]);"") ->  | I737: of:=IF([.H736]<>[.H737];"INICIO";IF([.H738]<>[.H737];"FIN";"")) ->  | J737: of:=IF([.K736]<>[.K737];"INICIO";IF([.K738]<>[.K737];"FIN";"")) -> 
A738: of:=IF([.B738]<>"";TODAY()>[.B738];"") ->  | B738: of:=IFERROR(IF(([.B737]+1)<[Calendario.$F$5];[.B737]+1;"");"") ->  | C738: of:=IF(AND([.B738]>=[Calendario.$F$8];[.B738]<=[Calendario.$F$9];1);1;IF(AND([.B738]>=[Calendario.$F$12];[.B738]<=[Calendario.$F$13]);2;IF(AND([.B738]>=[Calendario.$F$16];[.B738]<=[Calendario.$F$17]);3;""))) ->  | D738: of:=IF(COUNTIF([Calendario.$H$4:.$H$48];[.B738])>0;"FIESTA";"") -> FIESTA | E738: of:=IF([.B738]<>"";VLOOKUP(WEEKDAY([.B738];3);[Calendario.$A$4:.$C$11];2);"") ->  | F738: of:=IF([.B738]<>"";IF([.D738]<>"FIESTA";VLOOKUP(WEEKDAY([.B738];3);[Calendario.$A$4:.$C$11];3);0);"") ->  | G738: of:=IF(ISNUMBER([.F738]);[.F738]+[.G737];"") ->  | H738: of:=IF(AND([.G738]<=[Unidades.$G$26];[.G738]<=[Unidades.$F$18];[Unidades.$F$18]>0);[Unidades.$D$18]+1-COUNTIFS([Unidades.$O$3:.$O$17];">="&[.G738]);"") ->  | I738: of:=IF([.H737]<>[.H738];"INICIO";IF([.H739]<>[.H738];"FIN";"")) ->  | J738: of:=IF([.K737]<>[.K738];"INICIO";IF([.K739]<>[.K738];"FIN";"")) -> 
A739: of:=IF([.B739]<>"";TODAY()>[.B739];"") ->  | B739: of:=IFERROR(IF(([.B738]+1)<[Calendario.$F$5];[.B738]+1;"");"") ->  | C739: of:=IF(AND([.B739]>=[Calendario.$F$8];[.B739]<=[Calendario.$F$9];1);1;IF(AND([.B739]>=[Calendario.$F$12];[.B739]<=[Calendario.$F$13]);2;IF(AND([.B739]>=[Calendario.$F$16];[.B739]<=[Calendario.$F$17]);3;""))) ->  | D739: of:=IF(COUNTIF([Calendario.$H$4:.$H$48];[.B739])>0;"FIESTA";"") -> FIESTA | E739: of:=IF([.B739]<>"";VLOOKUP(WEEKDAY([.B739];3);[Calendario.$A$4:.$C$11];2);"") ->  | F739: of:=IF([.B739]<>"";IF([.D739]<>"FIESTA";VLOOKUP(WEEKDAY([.B739];3);[Calendario.$A$4:.$C$11];3);0);"") ->  | G739: of:=IF(ISNUMBER([.F739]);[.F739]+[.G738];"") ->  | H739: of:=IF(AND([.G739]<=[Unidades.$G$26];[.G739]<=[Unidades.$F$18];[Unidades.$F$18]>0);[Unidades.$D$18]+1-COUNTIFS([Unidades.$O$3:.$O$17];">="&[.G739]);"") ->  | I739: of:=IF([.H738]<>[.H739];"INICIO";IF([.H740]<>[.H739];"FIN";"")) ->  | J739: of:=IF([.K738]<>[.K739];"INICIO";IF([.K740]<>[.K739];"FIN";"")) -> 
A740: of:=IF([.B740]<>"";TODAY()>[.B740];"") ->  | B740: of:=IFERROR(IF(([.B739]+1)<[Calendario.$F$5];[.B739]+1;"");"") ->  | C740: of:=IF(AND([.B740]>=[Calendario.$F$8];[.B740]<=[Calendario.$F$9];1);1;IF(AND([.B740]>=[Calendario.$F$12];[.B740]<=[Calendario.$F$13]);2;IF(AND([.B740]>=[Calendario.$F$16];[.B740]<=[Calendario.$F$17]);3;""))) ->  | D740: of:=IF(COUNTIF([Calendario.$H$4:.$H$48];[.B740])>0;"FIESTA";"") -> FIESTA | E740: of:=IF([.B740]<>"";VLOOKUP(WEEKDAY([.B740];3);[Calendario.$A$4:.$C$11];2);"") ->  | F740: of:=IF([.B740]<>"";IF([.D740]<>"FIESTA";VLOOKUP(WEEKDAY([.B740];3);[Calendario.$A$4:.$C$11];3);0);"") ->  | G740: of:=IF(ISNUMBER([.F740]);[.F740]+[.G739];"") ->  | H740: of:=IF(AND([.G740]<=[Unidades.$G$26];[.G740]<=[Unidades.$F$18];[Unidades.$F$18]>0);[Unidades.$D$18]+1-COUNTIFS([Unidades.$O$3:.$O$17];">="&[.G740]);"") ->  | I740: of:=IF([.H739]<>[.H740];"INICIO";IF([.H741]<>[.H740];"FIN";"")) ->  | J740: of:=IF([.K739]<>[.K740];"INICIO";IF([.K741]<>[.K740];"FIN";"")) -> 
A741: of:=IF([.B741]<>"";TODAY()>[.B741];"") ->  | B741: of:=IFERROR(IF(([.B740]+1)<[Calendario.$F$5];[.B740]+1;"");"") ->  | C741: of:=IF(AND([.B741]>=[Calendario.$F$8];[.B741]<=[Calendario.$F$9];1);1;IF(AND([.B741]>=[Calendario.$F$12];[.B741]<=[Calendario.$F$13]);2;IF(AND([.B741]>=[Calendario.$F$16];[.B741]<=[Calendario.$F$17]);3;""))) ->  | D741: of:=IF(COUNTIF([Calendario.$H$4:.$H$48];[.B741])>0;"FIESTA";"") -> FIESTA | E741: of:=IF([.B741]<>"";VLOOKUP(WEEKDAY([.B741];3);[Calendario.$A$4:.$C$11];2);"") ->  | F741: of:=IF([.B741]<>"";IF([.D741]<>"FIESTA";VLOOKUP(WEEKDAY([.B741];3);[Calendario.$A$4:.$C$11];3);0);"") ->  | G741: of:=IF(ISNUMBER([.F741]);[.F741]+[.G740];"") ->  | H741: of:=IF(AND([.G741]<=[Unidades.$G$26];[.G741]<=[Unidades.$F$18];[Unidades.$F$18]>0);[Unidades.$D$18]+1-COUNTIFS([Unidades.$O$3:.$O$17];">="&[.G741]);"") ->  | I741: of:=IF([.H740]<>[.H741];"INICIO";IF([.H742]<>[.H741];"FIN";"")) ->  | J741: of:=IF([.K740]<>[.K741];"INICIO";IF([.K742]<>[.K741];"FIN";"")) -> 
A742: of:=IF([.B742]<>"";TODAY()>[.B742];"") ->  | B742: of:=IFERROR(IF(([.B741]+1)<[Calendario.$F$5];[.B741]+1;"");"") ->  | C742: of:=IF(AND([.B742]>=[Calendario.$F$8];[.B742]<=[Calendario.$F$9];1);1;IF(AND([.B742]>=[Calendario.$F$12];[.B742]<=[Calendario.$F$13]);2;IF(AND([.B742]>=[Calendario.$F$16];[.B742]<=[Calendario.$F$17]);3;""))) ->  | D742: of:=IF(COUNTIF([Calendario.$H$4:.$H$48];[.B742])>0;"FIESTA";"") -> FIESTA | E742: of:=IF([.B742]<>"";VLOOKUP(WEEKDAY([.B742];3);[Calendario.$A$4:.$C$11];2);"") ->  | F742: of:=IF([.B742]<>"";IF([.D742]<>"FIESTA";VLOOKUP(WEEKDAY([.B742];3);[Calendario.$A$4:.$C$11];3);0);"") ->  | G742: of:=IF(ISNUMBER([.F742]);[.F742]+[.G741];"") ->  | H742: of:=IF(AND([.G742]<=[Unidades.$G$26];[.G742]<=[Unidades.$F$18];[Unidades.$F$18]>0);[Unidades.$D$18]+1-COUNTIFS([Unidades.$O$3:.$O$17];">="&[.G742]);"") ->  | I742: of:=IF([.H741]<>[.H742];"INICIO";IF([.H743]<>[.H742];"FIN";"")) ->  | J742: of:=IF([.K741]<>[.K742];"INICIO";IF([.K743]<>[.K742];"FIN";"")) -> 
A743: of:=IF([.B743]<>"";TODAY()>[.B743];"") ->  | B743: of:=IFERROR(IF(([.B742]+1)<[Calendario.$F$5];[.B742]+1;"");"") ->  | C743: of:=IF(AND([.B743]>=[Calendario.$F$8];[.B743]<=[Calendario.$F$9];1);1;IF(AND([.B743]>=[Calendario.$F$12];[.B743]<=[Calendario.$F$13]);2;IF(AND([.B743]>=[Calendario.$F$16];[.B743]<=[Calendario.$F$17]);3;""))) ->  | D743: of:=IF(COUNTIF([Calendario.$H$4:.$H$48];[.B743])>0;"FIESTA";"") -> FIESTA | E743: of:=IF([.B743]<>"";VLOOKUP(WEEKDAY([.B743];3);[Calendario.$A$4:.$C$11];2);"") ->  | F743: of:=IF([.B743]<>"";IF([.D743]<>"FIESTA";VLOOKUP(WEEKDAY([.B743];3);[Calendario.$A$4:.$C$11];3);0);"") ->  | G743: of:=IF(ISNUMBER([.F743]);[.F743]+[.G742];"") ->  | H743: of:=IF(AND([.G743]<=[Unidades.$G$26];[.G743]<=[Unidades.$F$18];[Unidades.$F$18]>0);[Unidades.$D$18]+1-COUNTIFS([Unidades.$O$3:.$O$17];">="&[.G743]);"") ->  | I743: of:=IF([.H742]<>[.H743];"INICIO";IF([.H744]<>[.H743];"FIN";"")) ->  | J743: of:=IF([.K742]<>[.K743];"INICIO";IF([.K744]<>[.K743];"FIN";"")) -> 
A744: of:=IF([.B744]<>"";TODAY()>[.B744];"") ->  | B744: of:=IFERROR(IF(([.B743]+1)<[Calendario.$F$5];[.B743]+1;"");"") ->  | C744: of:=IF(AND([.B744]>=[Calendario.$F$8];[.B744]<=[Calendario.$F$9];1);1;IF(AND([.B744]>=[Calendario.$F$12];[.B744]<=[Calendario.$F$13]);2;IF(AND([.B744]>=[Calendario.$F$16];[.B744]<=[Calendario.$F$17]);3;""))) ->  | D744: of:=IF(COUNTIF([Calendario.$H$4:.$H$48];[.B744])>0;"FIESTA";"") -> FIESTA | E744: of:=IF([.B744]<>"";VLOOKUP(WEEKDAY([.B744];3);[Calendario.$A$4:.$C$11];2);"") ->  | F744: of:=IF([.B744]<>"";IF([.D744]<>"FIESTA";VLOOKUP(WEEKDAY([.B744];3);[Calendario.$A$4:.$C$11];3);0);"") ->  | G744: of:=IF(ISNUMBER([.F744]);[.F744]+[.G743];"") ->  | H744: of:=IF(AND([.G744]<=[Unidades.$G$26];[.G744]<=[Unidades.$F$18];[Unidades.$F$18]>0);[Unidades.$D$18]+1-COUNTIFS([Unidades.$O$3:.$O$17];">="&[.G744]);"") ->  | I744: of:=IF([.H743]<>[.H744];"INICIO";IF([.H745]<>[.H744];"FIN";"")) ->  | J744: of:=IF([.K743]<>[.K744];"INICIO";IF([.K745]<>[.K744];"FIN";"")) -> 
A745: of:=IF([.B745]<>"";TODAY()>[.B745];"") ->  | B745: of:=IFERROR(IF(([.B744]+1)<[Calendario.$F$5];[.B744]+1;"");"") ->  | C745: of:=IF(AND([.B745]>=[Calendario.$F$8];[.B745]<=[Calendario.$F$9];1);1;IF(AND([.B745]>=[Calendario.$F$12];[.B745]<=[Calendario.$F$13]);2;IF(AND([.B745]>=[Calendario.$F$16];[.B745]<=[Calendario.$F$17]);3;""))) ->  | D745: of:=IF(COUNTIF([Calendario.$H$4:.$H$48];[.B745])>0;"FIESTA";"") -> FIESTA | E745: of:=IF([.B745]<>"";VLOOKUP(WEEKDAY([.B745];3);[Calendario.$A$4:.$C$11];2);"") ->  | F745: of:=IF([.B745]<>"";IF([.D745]<>"FIESTA";VLOOKUP(WEEKDAY([.B745];3);[Calendario.$A$4:.$C$11];3);0);"") ->  | G745: of:=IF(ISNUMBER([.F745]);[.F745]+[.G744];"") ->  | H745: of:=IF(AND([.G745]<=[Unidades.$G$26];[.G745]<=[Unidades.$F$18];[Unidades.$F$18]>0);[Unidades.$D$18]+1-COUNTIFS([Unidades.$O$3:.$O$17];">="&[.G745]);"") ->  | I745: of:=IF([.H744]<>[.H745];"INICIO";IF([.H746]<>[.H745];"FIN";"")) ->  | J745: of:=IF([.K744]<>[.K745];"INICIO";IF([.K746]<>[.K745];"FIN";"")) -> 
A746: of:=IF([.B746]<>"";TODAY()>[.B746];"") ->  | B746: of:=IFERROR(IF(([.B745]+1)<[Calendario.$F$5];[.B745]+1;"");"") ->  | C746: of:=IF(AND([.B746]>=[Calendario.$F$8];[.B746]<=[Calendario.$F$9];1);1;IF(AND([.B746]>=[Calendario.$F$12];[.B746]<=[Calendario.$F$13]);2;IF(AND([.B746]>=[Calendario.$F$16];[.B746]<=[Calendario.$F$17]);3;""))) ->  | D746: of:=IF(COUNTIF([Calendario.$H$4:.$H$48];[.B746])>0;"FIESTA";"") -> FIESTA | E746: of:=IF([.B746]<>"";VLOOKUP(WEEKDAY([.B746];3);[Calendario.$A$4:.$C$11];2);"") ->  | F746: of:=IF([.B746]<>"";IF([.D746]<>"FIESTA";VLOOKUP(WEEKDAY([.B746];3);[Calendario.$A$4:.$C$11];3);0);"") ->  | G746: of:=IF(ISNUMBER([.F746]);[.F746]+[.G745];"") ->  | H746: of:=IF(AND([.G746]<=[Unidades.$G$26];[.G746]<=[Unidades.$F$18];[Unidades.$F$18]>0);[Unidades.$D$18]+1-COUNTIFS([Unidades.$O$3:.$O$17];">="&[.G746]);"") ->  | I746: of:=IF([.H745]<>[.H746];"INICIO";IF([.H747]<>[.H746];"FIN";"")) ->  | J746: of:=IF([.K745]<>[.K746];"INICIO";IF([.K747]<>[.K746];"FIN";"")) -> 
A747: of:=IF([.B747]<>"";TODAY()>[.B747];"") ->  | B747: of:=IFERROR(IF(([.B746]+1)<[Calendario.$F$5];[.B746]+1;"");"") ->  | C747: of:=IF(AND([.B747]>=[Calendario.$F$8];[.B747]<=[Calendario.$F$9];1);1;IF(AND([.B747]>=[Calendario.$F$12];[.B747]<=[Calendario.$F$13]);2;IF(AND([.B747]>=[Calendario.$F$16];[.B747]<=[Calendario.$F$17]);3;""))) ->  | D747: of:=IF(COUNTIF([Calendario.$H$4:.$H$48];[.B747])>0;"FIESTA";"") -> FIESTA | E747: of:=IF([.B747]<>"";VLOOKUP(WEEKDAY([.B747];3);[Calendario.$A$4:.$C$11];2);"") ->  | F747: of:=IF([.B747]<>"";IF([.D747]<>"FIESTA";VLOOKUP(WEEKDAY([.B747];3);[Calendario.$A$4:.$C$11];3);0);"") ->  | G747: of:=IF(ISNUMBER([.F747]);[.F747]+[.G746];"") ->  | H747: of:=IF(AND([.G747]<=[Unidades.$G$26];[.G747]<=[Unidades.$F$18];[Unidades.$F$18]>0);[Unidades.$D$18]+1-COUNTIFS([Unidades.$O$3:.$O$17];">="&[.G747]);"") ->  | I747: of:=IF([.H746]<>[.H747];"INICIO";IF([.H748]<>[.H747];"FIN";"")) ->  | J747: of:=IF([.K746]<>[.K747];"INICIO";IF([.K748]<>[.K747];"FIN";"")) -> 
A748: of:=IF([.B748]<>"";TODAY()>[.B748];"") ->  | B748: of:=IFERROR(IF(([.B747]+1)<[Calendario.$F$5];[.B747]+1;"");"") ->  | C748: of:=IF(AND([.B748]>=[Calendario.$F$8];[.B748]<=[Calendario.$F$9];1);1;IF(AND([.B748]>=[Calendario.$F$12];[.B748]<=[Calendario.$F$13]);2;IF(AND([.B748]>=[Calendario.$F$16];[.B748]<=[Calendario.$F$17]);3;""))) ->  | D748: of:=IF(COUNTIF([Calendario.$H$4:.$H$48];[.B748])>0;"FIESTA";"") -> FIESTA | E748: of:=IF([.B748]<>"";VLOOKUP(WEEKDAY([.B748];3);[Calendario.$A$4:.$C$11];2);"") ->  | F748: of:=IF([.B748]<>"";IF([.D748]<>"FIESTA";VLOOKUP(WEEKDAY([.B748];3);[Calendario.$A$4:.$C$11];3);0);"") ->  | G748: of:=IF(ISNUMBER([.F748]);[.F748]+[.G747];"") ->  | H748: of:=IF(AND([.G748]<=[Unidades.$G$26];[.G748]<=[Unidades.$F$18];[Unidades.$F$18]>0);[Unidades.$D$18]+1-COUNTIFS([Unidades.$O$3:.$O$17];">="&[.G748]);"") ->  | I748: of:=IF([.H747]<>[.H748];"INICIO";IF([.H749]<>[.H748];"FIN";"")) ->  | J748: of:=IF([.K747]<>[.K748];"INICIO";IF([.K749]<>[.K748];"FIN";"")) -> 
A749: of:=IF([.B749]<>"";TODAY()>[.B749];"") ->  | B749: of:=IFERROR(IF(([.B748]+1)<[Calendario.$F$5];[.B748]+1;"");"") ->  | C749: of:=IF(AND([.B749]>=[Calendario.$F$8];[.B749]<=[Calendario.$F$9];1);1;IF(AND([.B749]>=[Calendario.$F$12];[.B749]<=[Calendario.$F$13]);2;IF(AND([.B749]>=[Calendario.$F$16];[.B749]<=[Calendario.$F$17]);3;""))) ->  | D749: of:=IF(COUNTIF([Calendario.$H$4:.$H$48];[.B749])>0;"FIESTA";"") -> FIESTA | E749: of:=IF([.B749]<>"";VLOOKUP(WEEKDAY([.B749];3);[Calendario.$A$4:.$C$11];2);"") ->  | F749: of:=IF([.B749]<>"";IF([.D749]<>"FIESTA";VLOOKUP(WEEKDAY([.B749];3);[Calendario.$A$4:.$C$11];3);0);"") ->  | G749: of:=IF(ISNUMBER([.F749]);[.F749]+[.G748];"") ->  | H749: of:=IF(AND([.G749]<=[Unidades.$G$26];[.G749]<=[Unidades.$F$18];[Unidades.$F$18]>0);[Unidades.$D$18]+1-COUNTIFS([Unidades.$O$3:.$O$17];">="&[.G749]);"") ->  | I749: of:=IF([.H748]<>[.H749];"INICIO";IF([.H750]<>[.H749];"FIN";"")) ->  | J749: of:=IF([.K748]<>[.K749];"INICIO";IF([.K750]<>[.K749];"FIN";"")) -> 
A750: of:=IF([.B750]<>"";TODAY()>[.B750];"") ->  | B750: of:=IFERROR(IF(([.B749]+1)<[Calendario.$F$5];[.B749]+1;"");"") ->  | C750: of:=IF(AND([.B750]>=[Calendario.$F$8];[.B750]<=[Calendario.$F$9];1);1;IF(AND([.B750]>=[Calendario.$F$12];[.B750]<=[Calendario.$F$13]);2;IF(AND([.B750]>=[Calendario.$F$16];[.B750]<=[Calendario.$F$17]);3;""))) ->  | D750: of:=IF(COUNTIF([Calendario.$H$4:.$H$48];[.B750])>0;"FIESTA";"") -> FIESTA | E750: of:=IF([.B750]<>"";VLOOKUP(WEEKDAY([.B750];3);[Calendario.$A$4:.$C$11];2);"") ->  | F750: of:=IF([.B750]<>"";IF([.D750]<>"FIESTA";VLOOKUP(WEEKDAY([.B750];3);[Calendario.$A$4:.$C$11];3);0);"") ->  | G750: of:=IF(ISNUMBER([.F750]);[.F750]+[.G749];"") ->  | H750: of:=IF(AND([.G750]<=[Unidades.$G$26];[.G750]<=[Unidades.$F$18];[Unidades.$F$18]>0);[Unidades.$D$18]+1-COUNTIFS([Unidades.$O$3:.$O$17];">="&[.G750]);"") ->  | I750: of:=IF([.H749]<>[.H750];"INICIO";IF([.H751]<>[.H750];"FIN";"")) ->  | J750: of:=IF([.K749]<>[.K750];"INICIO";IF([.K751]<>[.K750];"FIN";"")) -> 
A751: of:=IF([.B751]<>"";TODAY()>[.B751];"") ->  | B751: of:=IFERROR(IF(([.B750]+1)<[Calendario.$F$5];[.B750]+1;"");"") ->  | C751: of:=IF(AND([.B751]>=[Calendario.$F$8];[.B751]<=[Calendario.$F$9];1);1;IF(AND([.B751]>=[Calendario.$F$12];[.B751]<=[Calendario.$F$13]);2;IF(AND([.B751]>=[Calendario.$F$16];[.B751]<=[Calendario.$F$17]);3;""))) ->  | D751: of:=IF(COUNTIF([Calendario.$H$4:.$H$48];[.B751])>0;"FIESTA";"") -> FIESTA | E751: of:=IF([.B751]<>"";VLOOKUP(WEEKDAY([.B751];3);[Calendario.$A$4:.$C$11];2);"") ->  | F751: of:=IF([.B751]<>"";IF([.D751]<>"FIESTA";VLOOKUP(WEEKDAY([.B751];3);[Calendario.$A$4:.$C$11];3);0);"") ->  | G751: of:=IF(ISNUMBER([.F751]);[.F751]+[.G750];"") ->  | H751: of:=IF(AND([.G751]<=[Unidades.$G$26];[.G751]<=[Unidades.$F$18];[Unidades.$F$18]>0);[Unidades.$D$18]+1-COUNTIFS([Unidades.$O$3:.$O$17];">="&[.G751]);"") ->  | I751: of:=IF([.H750]<>[.H751];"INICIO";IF([.H752]<>[.H751];"FIN";"")) ->  | J751: of:=IF([.K750]<>[.K751];"INICIO";IF([.K752]<>[.K751];"FIN";"")) -> 
A752: of:=IF([.B752]<>"";TODAY()>[.B752];"") ->  | B752: of:=IFERROR(IF(([.B751]+1)<[Calendario.$F$5];[.B751]+1;"");"") ->  | C752: of:=IF(AND([.B752]>=[Calendario.$F$8];[.B752]<=[Calendario.$F$9];1);1;IF(AND([.B752]>=[Calendario.$F$12];[.B752]<=[Calendario.$F$13]);2;IF(AND([.B752]>=[Calendario.$F$16];[.B752]<=[Calendario.$F$17]);3;""))) ->  | D752: of:=IF(COUNTIF([Calendario.$H$4:.$H$48];[.B752])>0;"FIESTA";"") -> FIESTA | E752: of:=IF([.B752]<>"";VLOOKUP(WEEKDAY([.B752];3);[Calendario.$A$4:.$C$11];2);"") ->  | F752: of:=IF([.B752]<>"";IF([.D752]<>"FIESTA";VLOOKUP(WEEKDAY([.B752];3);[Calendario.$A$4:.$C$11];3);0);"") ->  | G752: of:=IF(ISNUMBER([.F752]);[.F752]+[.G751];"") ->  | H752: of:=IF(AND([.G752]<=[Unidades.$G$26];[.G752]<=[Unidades.$F$18];[Unidades.$F$18]>0);[Unidades.$D$18]+1-COUNTIFS([Unidades.$O$3:.$O$17];">="&[.G752]);"") ->  | I752: of:=IF([.H751]<>[.H752];"INICIO";IF([.H753]<>[.H752];"FIN";"")) ->  | J752: of:=IF([.K751]<>[.K752];"INICIO";IF([.K753]<>[.K752];"FIN";"")) -> 
A753: of:=IF([.B753]<>"";TODAY()>[.B753];"") ->  | B753: of:=IFERROR(IF(([.B752]+1)<[Calendario.$F$5];[.B752]+1;"");"") ->  | C753: of:=IF(AND([.B753]>=[Calendario.$F$8];[.B753]<=[Calendario.$F$9];1);1;IF(AND([.B753]>=[Calendario.$F$12];[.B753]<=[Calendario.$F$13]);2;IF(AND([.B753]>=[Calendario.$F$16];[.B753]<=[Calendario.$F$17]);3;""))) ->  | D753: of:=IF(COUNTIF([Calendario.$H$4:.$H$48];[.B753])>0;"FIESTA";"") -> FIESTA | E753: of:=IF([.B753]<>"";VLOOKUP(WEEKDAY([.B753];3);[Calendario.$A$4:.$C$11];2);"") ->  | F753: of:=IF([.B753]<>"";IF([.D753]<>"FIESTA";VLOOKUP(WEEKDAY([.B753];3);[Calendario.$A$4:.$C$11];3);0);"") ->  | G753: of:=IF(ISNUMBER([.F753]);[.F753]+[.G752];"") ->  | H753: of:=IF(AND([.G753]<=[Unidades.$G$26];[.G753]<=[Unidades.$F$18];[Unidades.$F$18]>0);[Unidades.$D$18]+1-COUNTIFS([Unidades.$O$3:.$O$17];">="&[.G753]);"") ->  | I753: of:=IF([.H752]<>[.H753];"INICIO";IF([.H754]<>[.H753];"FIN";"")) ->  | J753: of:=IF([.K752]<>[.K753];"INICIO";IF([.K754]<>[.K753];"FIN";"")) -> 
A754: of:=IF([.B754]<>"";TODAY()>[.B754];"") ->  | B754: of:=IFERROR(IF(([.B753]+1)<[Calendario.$F$5];[.B753]+1;"");"") ->  | C754: of:=IF(AND([.B754]>=[Calendario.$F$8];[.B754]<=[Calendario.$F$9];1);1;IF(AND([.B754]>=[Calendario.$F$12];[.B754]<=[Calendario.$F$13]);2;IF(AND([.B754]>=[Calendario.$F$16];[.B754]<=[Calendario.$F$17]);3;""))) ->  | D754: of:=IF(COUNTIF([Calendario.$H$4:.$H$48];[.B754])>0;"FIESTA";"") -> FIESTA | E754: of:=IF([.B754]<>"";VLOOKUP(WEEKDAY([.B754];3);[Calendario.$A$4:.$C$11];2);"") ->  | F754: of:=IF([.B754]<>"";IF([.D754]<>"FIESTA";VLOOKUP(WEEKDAY([.B754];3);[Calendario.$A$4:.$C$11];3);0);"") ->  | G754: of:=IF(ISNUMBER([.F754]);[.F754]+[.G753];"") ->  | H754: of:=IF(AND([.G754]<=[Unidades.$G$26];[.G754]<=[Unidades.$F$18];[Unidades.$F$18]>0);[Unidades.$D$18]+1-COUNTIFS([Unidades.$O$3:.$O$17];">="&[.G754]);"") ->  | I754: of:=IF([.H753]<>[.H754];"INICIO";IF([.H755]<>[.H754];"FIN";"")) ->  | J754: of:=IF([.K753]<>[.K754];"INICIO";IF([.K755]<>[.K754];"FIN";"")) -> 
A755: of:=IF([.B755]<>"";TODAY()>[.B755];"") ->  | B755: of:=IFERROR(IF(([.B754]+1)<[Calendario.$F$5];[.B754]+1;"");"") ->  | C755: of:=IF(AND([.B755]>=[Calendario.$F$8];[.B755]<=[Calendario.$F$9];1);1;IF(AND([.B755]>=[Calendario.$F$12];[.B755]<=[Calendario.$F$13]);2;IF(AND([.B755]>=[Calendario.$F$16];[.B755]<=[Calendario.$F$17]);3;""))) ->  | D755: of:=IF(COUNTIF([Calendario.$H$4:.$H$48];[.B755])>0;"FIESTA";"") -> FIESTA | E755: of:=IF([.B755]<>"";VLOOKUP(WEEKDAY([.B755];3);[Calendario.$A$4:.$C$11];2);"") ->  | F755: of:=IF([.B755]<>"";IF([.D755]<>"FIESTA";VLOOKUP(WEEKDAY([.B755];3);[Calendario.$A$4:.$C$11];3);0);"") ->  | G755: of:=IF(ISNUMBER([.F755]);[.F755]+[.G754];"") ->  | H755: of:=IF(AND([.G755]<=[Unidades.$G$26];[.G755]<=[Unidades.$F$18];[Unidades.$F$18]>0);[Unidades.$D$18]+1-COUNTIFS([Unidades.$O$3:.$O$17];">="&[.G755]);"") ->  | I755: of:=IF([.H754]<>[.H755];"INICIO";IF([.H756]<>[.H755];"FIN";"")) ->  | J755: of:=IF([.K754]<>[.K755];"INICIO";IF([.K756]<>[.K755];"FIN";"")) -> 
A756: of:=IF([.B756]<>"";TODAY()>[.B756];"") ->  | B756: of:=IFERROR(IF(([.B755]+1)<[Calendario.$F$5];[.B755]+1;"");"") ->  | C756: of:=IF(AND([.B756]>=[Calendario.$F$8];[.B756]<=[Calendario.$F$9];1);1;IF(AND([.B756]>=[Calendario.$F$12];[.B756]<=[Calendario.$F$13]);2;IF(AND([.B756]>=[Calendario.$F$16];[.B756]<=[Calendario.$F$17]);3;""))) ->  | D756: of:=IF(COUNTIF([Calendario.$H$4:.$H$48];[.B756])>0;"FIESTA";"") -> FIESTA | E756: of:=IF([.B756]<>"";VLOOKUP(WEEKDAY([.B756];3);[Calendario.$A$4:.$C$11];2);"") ->  | F756: of:=IF([.B756]<>"";IF([.D756]<>"FIESTA";VLOOKUP(WEEKDAY([.B756];3);[Calendario.$A$4:.$C$11];3);0);"") ->  | G756: of:=IF(ISNUMBER([.F756]);[.F756]+[.G755];"") ->  | H756: of:=IF(AND([.G756]<=[Unidades.$G$26];[.G756]<=[Unidades.$F$18];[Unidades.$F$18]>0);[Unidades.$D$18]+1-COUNTIFS([Unidades.$O$3:.$O$17];">="&[.G756]);"") ->  | I756: of:=IF([.H755]<>[.H756];"INICIO";IF([.H757]<>[.H756];"FIN";"")) ->  | J756: of:=IF([.K755]<>[.K756];"INICIO";IF([.K757]<>[.K756];"FIN";"")) -> 
A757: of:=IF([.B757]<>"";TODAY()>[.B757];"") ->  | B757: of:=IFERROR(IF(([.B756]+1)<[Calendario.$F$5];[.B756]+1;"");"") ->  | C757: of:=IF(AND([.B757]>=[Calendario.$F$8];[.B757]<=[Calendario.$F$9];1);1;IF(AND([.B757]>=[Calendario.$F$12];[.B757]<=[Calendario.$F$13]);2;IF(AND([.B757]>=[Calendario.$F$16];[.B757]<=[Calendario.$F$17]);3;""))) ->  | D757: of:=IF(COUNTIF([Calendario.$H$4:.$H$48];[.B757])>0;"FIESTA";"") -> FIESTA | E757: of:=IF([.B757]<>"";VLOOKUP(WEEKDAY([.B757];3);[Calendario.$A$4:.$C$11];2);"") ->  | F757: of:=IF([.B757]<>"";IF([.D757]<>"FIESTA";VLOOKUP(WEEKDAY([.B757];3);[Calendario.$A$4:.$C$11];3);0);"") ->  | G757: of:=IF(ISNUMBER([.F757]);[.F757]+[.G756];"") ->  | H757: of:=IF(AND([.G757]<=[Unidades.$G$26];[.G757]<=[Unidades.$F$18];[Unidades.$F$18]>0);[Unidades.$D$18]+1-COUNTIFS([Unidades.$O$3:.$O$17];">="&[.G757]);"") ->  | I757: of:=IF([.H756]<>[.H757];"INICIO";IF([.H758]<>[.H757];"FIN";"")) ->  | J757: of:=IF([.K756]<>[.K757];"INICIO";IF([.K758]<>[.K757];"FIN";"")) -> 
A758: of:=IF([.B758]<>"";TODAY()>[.B758];"") ->  | B758: of:=IFERROR(IF(([.B757]+1)<[Calendario.$F$5];[.B757]+1;"");"") ->  | C758: of:=IF(AND([.B758]>=[Calendario.$F$8];[.B758]<=[Calendario.$F$9];1);1;IF(AND([.B758]>=[Calendario.$F$12];[.B758]<=[Calendario.$F$13]);2;IF(AND([.B758]>=[Calendario.$F$16];[.B758]<=[Calendario.$F$17]);3;""))) ->  | D758: of:=IF(COUNTIF([Calendario.$H$4:.$H$48];[.B758])>0;"FIESTA";"") -> FIESTA | E758: of:=IF([.B758]<>"";VLOOKUP(WEEKDAY([.B758];3);[Calendario.$A$4:.$C$11];2);"") ->  | F758: of:=IF([.B758]<>"";IF([.D758]<>"FIESTA";VLOOKUP(WEEKDAY([.B758];3);[Calendario.$A$4:.$C$11];3);0);"") ->  | G758: of:=IF(ISNUMBER([.F758]);[.F758]+[.G757];"") ->  | H758: of:=IF(AND([.G758]<=[Unidades.$G$26];[.G758]<=[Unidades.$F$18];[Unidades.$F$18]>0);[Unidades.$D$18]+1-COUNTIFS([Unidades.$O$3:.$O$17];">="&[.G758]);"") ->  | I758: of:=IF([.H757]<>[.H758];"INICIO";IF([.H759]<>[.H758];"FIN";"")) ->  | J758: of:=IF([.K757]<>[.K758];"INICIO";IF([.K759]<>[.K758];"FIN";"")) -> 
A759: of:=IF([.B759]<>"";TODAY()>[.B759];"") ->  | B759: of:=IFERROR(IF(([.B758]+1)<[Calendario.$F$5];[.B758]+1;"");"") ->  | C759: of:=IF(AND([.B759]>=[Calendario.$F$8];[.B759]<=[Calendario.$F$9];1);1;IF(AND([.B759]>=[Calendario.$F$12];[.B759]<=[Calendario.$F$13]);2;IF(AND([.B759]>=[Calendario.$F$16];[.B759]<=[Calendario.$F$17]);3;""))) ->  | D759: of:=IF(COUNTIF([Calendario.$H$4:.$H$48];[.B759])>0;"FIESTA";"") -> FIESTA | E759: of:=IF([.B759]<>"";VLOOKUP(WEEKDAY([.B759];3);[Calendario.$A$4:.$C$11];2);"") ->  | F759: of:=IF([.B759]<>"";IF([.D759]<>"FIESTA";VLOOKUP(WEEKDAY([.B759];3);[Calendario.$A$4:.$C$11];3);0);"") ->  | G759: of:=IF(ISNUMBER([.F759]);[.F759]+[.G758];"") ->  | H759: of:=IF(AND([.G759]<=[Unidades.$G$26];[.G759]<=[Unidades.$F$18];[Unidades.$F$18]>0);[Unidades.$D$18]+1-COUNTIFS([Unidades.$O$3:.$O$17];">="&[.G759]);"") ->  | I759: of:=IF([.H758]<>[.H759];"INICIO";IF([.H760]<>[.H759];"FIN";"")) ->  | J759: of:=IF([.K758]<>[.K759];"INICIO";IF([.K760]<>[.K759];"FIN";"")) -> 
A760: of:=IF([.B760]<>"";TODAY()>[.B760];"") ->  | B760: of:=IFERROR(IF(([.B759]+1)<[Calendario.$F$5];[.B759]+1;"");"") ->  | C760: of:=IF(AND([.B760]>=[Calendario.$F$8];[.B760]<=[Calendario.$F$9];1);1;IF(AND([.B760]>=[Calendario.$F$12];[.B760]<=[Calendario.$F$13]);2;IF(AND([.B760]>=[Calendario.$F$16];[.B760]<=[Calendario.$F$17]);3;""))) ->  | D760: of:=IF(COUNTIF([Calendario.$H$4:.$H$48];[.B760])>0;"FIESTA";"") -> FIESTA | E760: of:=IF([.B760]<>"";VLOOKUP(WEEKDAY([.B760];3);[Calendario.$A$4:.$C$11];2);"") ->  | F760: of:=IF([.B760]<>"";IF([.D760]<>"FIESTA";VLOOKUP(WEEKDAY([.B760];3);[Calendario.$A$4:.$C$11];3);0);"") ->  | G760: of:=IF(ISNUMBER([.F760]);[.F760]+[.G759];"") ->  | H760: of:=IF(AND([.G760]<=[Unidades.$G$26];[.G760]<=[Unidades.$F$18];[Unidades.$F$18]>0);[Unidades.$D$18]+1-COUNTIFS([Unidades.$O$3:.$O$17];">="&[.G760]);"") ->  | I760: of:=IF([.H759]<>[.H760];"INICIO";IF([.H761]<>[.H760];"FIN";"")) ->  | J760: of:=IF([.K759]<>[.K760];"INICIO";IF([.K761]<>[.K760];"FIN";"")) -> 
A761: of:=IF([.B761]<>"";TODAY()>[.B761];"") ->  | B761: of:=IFERROR(IF(([.B760]+1)<[Calendario.$F$5];[.B760]+1;"");"") ->  | C761: of:=IF(AND([.B761]>=[Calendario.$F$8];[.B761]<=[Calendario.$F$9];1);1;IF(AND([.B761]>=[Calendario.$F$12];[.B761]<=[Calendario.$F$13]);2;IF(AND([.B761]>=[Calendario.$F$16];[.B761]<=[Calendario.$F$17]);3;""))) ->  | D761: of:=IF(COUNTIF([Calendario.$H$4:.$H$48];[.B761])>0;"FIESTA";"") -> FIESTA | E761: of:=IF([.B761]<>"";VLOOKUP(WEEKDAY([.B761];3);[Calendario.$A$4:.$C$11];2);"") ->  | F761: of:=IF([.B761]<>"";IF([.D761]<>"FIESTA";VLOOKUP(WEEKDAY([.B761];3);[Calendario.$A$4:.$C$11];3);0);"") ->  | G761: of:=IF(ISNUMBER([.F761]);[.F761]+[.G760];"") ->  | H761: of:=IF(AND([.G761]<=[Unidades.$G$26];[.G761]<=[Unidades.$F$18];[Unidades.$F$18]>0);[Unidades.$D$18]+1-COUNTIFS([Unidades.$O$3:.$O$17];">="&[.G761]);"") ->  | I761: of:=IF([.H760]<>[.H761];"INICIO";IF([.H762]<>[.H761];"FIN";"")) ->  | J761: of:=IF([.K760]<>[.K761];"INICIO";IF([.K762]<>[.K761];"FIN";"")) -> 
A762: of:=IF([.B762]<>"";TODAY()>[.B762];"") ->  | B762: of:=IFERROR(IF(([.B761]+1)<[Calendario.$F$5];[.B761]+1;"");"") ->  | C762: of:=IF(AND([.B762]>=[Calendario.$F$8];[.B762]<=[Calendario.$F$9];1);1;IF(AND([.B762]>=[Calendario.$F$12];[.B762]<=[Calendario.$F$13]);2;IF(AND([.B762]>=[Calendario.$F$16];[.B762]<=[Calendario.$F$17]);3;""))) ->  | D762: of:=IF(COUNTIF([Calendario.$H$4:.$H$48];[.B762])>0;"FIESTA";"") -> FIESTA | E762: of:=IF([.B762]<>"";VLOOKUP(WEEKDAY([.B762];3);[Calendario.$A$4:.$C$11];2);"") ->  | F762: of:=IF([.B762]<>"";IF([.D762]<>"FIESTA";VLOOKUP(WEEKDAY([.B762];3);[Calendario.$A$4:.$C$11];3);0);"") ->  | G762: of:=IF(ISNUMBER([.F762]);[.F762]+[.G761];"") ->  | H762: of:=IF(AND([.G762]<=[Unidades.$G$26];[.G762]<=[Unidades.$F$18];[Unidades.$F$18]>0);[Unidades.$D$18]+1-COUNTIFS([Unidades.$O$3:.$O$17];">="&[.G762]);"") ->  | I762: of:=IF([.H761]<>[.H762];"INICIO";IF([.H763]<>[.H762];"FIN";"")) ->  | J762: of:=IF([.K761]<>[.K762];"INICIO";IF([.K763]<>[.K762];"FIN";"")) -> 
A763: of:=IF([.B763]<>"";TODAY()>[.B763];"") ->  | B763: of:=IFERROR(IF(([.B762]+1)<[Calendario.$F$5];[.B762]+1;"");"") ->  | C763: of:=IF(AND([.B763]>=[Calendario.$F$8];[.B763]<=[Calendario.$F$9];1);1;IF(AND([.B763]>=[Calendario.$F$12];[.B763]<=[Calendario.$F$13]);2;IF(AND([.B763]>=[Calendario.$F$16];[.B763]<=[Calendario.$F$17]);3;""))) ->  | D763: of:=IF(COUNTIF([Calendario.$H$4:.$H$48];[.B763])>0;"FIESTA";"") -> FIESTA | E763: of:=IF([.B763]<>"";VLOOKUP(WEEKDAY([.B763];3);[Calendario.$A$4:.$C$11];2);"") ->  | F763: of:=IF([.B763]<>"";IF([.D763]<>"FIESTA";VLOOKUP(WEEKDAY([.B763];3);[Calendario.$A$4:.$C$11];3);0);"") ->  | G763: of:=IF(ISNUMBER([.F763]);[.F763]+[.G762];"") ->  | H763: of:=IF(AND([.G763]<=[Unidades.$G$26];[.G763]<=[Unidades.$F$18];[Unidades.$F$18]>0);[Unidades.$D$18]+1-COUNTIFS([Unidades.$O$3:.$O$17];">="&[.G763]);"") ->  | I763: of:=IF([.H762]<>[.H763];"INICIO";IF([.H764]<>[.H763];"FIN";"")) ->  | J763: of:=IF([.K762]<>[.K763];"INICIO";IF([.K764]<>[.K763];"FIN";"")) -> 
A764: of:=IF([.B764]<>"";TODAY()>[.B764];"") ->  | B764: of:=IFERROR(IF(([.B763]+1)<[Calendario.$F$5];[.B763]+1;"");"") ->  | C764: of:=IF(AND([.B764]>=[Calendario.$F$8];[.B764]<=[Calendario.$F$9];1);1;IF(AND([.B764]>=[Calendario.$F$12];[.B764]<=[Calendario.$F$13]);2;IF(AND([.B764]>=[Calendario.$F$16];[.B764]<=[Calendario.$F$17]);3;""))) ->  | D764: of:=IF(COUNTIF([Calendario.$H$4:.$H$48];[.B764])>0;"FIESTA";"") -> FIESTA | E764: of:=IF([.B764]<>"";VLOOKUP(WEEKDAY([.B764];3);[Calendario.$A$4:.$C$11];2);"") ->  | F764: of:=IF([.B764]<>"";IF([.D764]<>"FIESTA";VLOOKUP(WEEKDAY([.B764];3);[Calendario.$A$4:.$C$11];3);0);"") ->  | G764: of:=IF(ISNUMBER([.F764]);[.F764]+[.G763];"") ->  | H764: of:=IF(AND([.G764]<=[Unidades.$G$26];[.G764]<=[Unidades.$F$18];[Unidades.$F$18]>0);[Unidades.$D$18]+1-COUNTIFS([Unidades.$O$3:.$O$17];">="&[.G764]);"") ->  | I764: of:=IF([.H763]<>[.H764];"INICIO";IF([.H765]<>[.H764];"FIN";"")) ->  | J764: of:=IF([.K763]<>[.K764];"INICIO";IF([.K765]<>[.K764];"FIN";"")) -> 
A765: of:=IF([.B765]<>"";TODAY()>[.B765];"") ->  | B765: of:=IFERROR(IF(([.B764]+1)<[Calendario.$F$5];[.B764]+1;"");"") ->  | C765: of:=IF(AND([.B765]>=[Calendario.$F$8];[.B765]<=[Calendario.$F$9];1);1;IF(AND([.B765]>=[Calendario.$F$12];[.B765]<=[Calendario.$F$13]);2;IF(AND([.B765]>=[Calendario.$F$16];[.B765]<=[Calendario.$F$17]);3;""))) ->  | D765: of:=IF(COUNTIF([Calendario.$H$4:.$H$48];[.B765])>0;"FIESTA";"") -> FIESTA | E765: of:=IF([.B765]<>"";VLOOKUP(WEEKDAY([.B765];3);[Calendario.$A$4:.$C$11];2);"") ->  | F765: of:=IF([.B765]<>"";IF([.D765]<>"FIESTA";VLOOKUP(WEEKDAY([.B765];3);[Calendario.$A$4:.$C$11];3);0);"") ->  | G765: of:=IF(ISNUMBER([.F765]);[.F765]+[.G764];"") ->  | H765: of:=IF(AND([.G765]<=[Unidades.$G$26];[.G765]<=[Unidades.$F$18];[Unidades.$F$18]>0);[Unidades.$D$18]+1-COUNTIFS([Unidades.$O$3:.$O$17];">="&[.G765]);"") ->  | I765: of:=IF([.H764]<>[.H765];"INICIO";IF([.H766]<>[.H765];"FIN";"")) ->  | J765: of:=IF([.K764]<>[.K765];"INICIO";IF([.K766]<>[.K765];"FIN";"")) -> 
A766: of:=IF([.B766]<>"";TODAY()>[.B766];"") ->  | B766: of:=IFERROR(IF(([.B765]+1)<[Calendario.$F$5];[.B765]+1;"");"") ->  | C766: of:=IF(AND([.B766]>=[Calendario.$F$8];[.B766]<=[Calendario.$F$9];1);1;IF(AND([.B766]>=[Calendario.$F$12];[.B766]<=[Calendario.$F$13]);2;IF(AND([.B766]>=[Calendario.$F$16];[.B766]<=[Calendario.$F$17]);3;""))) ->  | D766: of:=IF(COUNTIF([Calendario.$H$4:.$H$48];[.B766])>0;"FIESTA";"") -> FIESTA | E766: of:=IF([.B766]<>"";VLOOKUP(WEEKDAY([.B766];3);[Calendario.$A$4:.$C$11];2);"") ->  | F766: of:=IF([.B766]<>"";IF([.D766]<>"FIESTA";VLOOKUP(WEEKDAY([.B766];3);[Calendario.$A$4:.$C$11];3);0);"") ->  | G766: of:=IF(ISNUMBER([.F766]);[.F766]+[.G765];"") ->  | H766: of:=IF(AND([.G766]<=[Unidades.$G$26];[.G766]<=[Unidades.$F$18];[Unidades.$F$18]>0);[Unidades.$D$18]+1-COUNTIFS([Unidades.$O$3:.$O$17];">="&[.G766]);"") ->  | I766: of:=IF([.H765]<>[.H766];"INICIO";IF([.H767]<>[.H766];"FIN";"")) ->  | J766: of:=IF([.K765]<>[.K766];"INICIO";IF([.K767]<>[.K766];"FIN";"")) -> 
A767: of:=IF([.B767]<>"";TODAY()>[.B767];"") ->  | B767: of:=IFERROR(IF(([.B766]+1)<[Calendario.$F$5];[.B766]+1;"");"") ->  | C767: of:=IF(AND([.B767]>=[Calendario.$F$8];[.B767]<=[Calendario.$F$9];1);1;IF(AND([.B767]>=[Calendario.$F$12];[.B767]<=[Calendario.$F$13]);2;IF(AND([.B767]>=[Calendario.$F$16];[.B767]<=[Calendario.$F$17]);3;""))) ->  | D767: of:=IF(COUNTIF([Calendario.$H$4:.$H$48];[.B767])>0;"FIESTA";"") -> FIESTA | E767: of:=IF([.B767]<>"";VLOOKUP(WEEKDAY([.B767];3);[Calendario.$A$4:.$C$11];2);"") ->  | F767: of:=IF([.B767]<>"";IF([.D767]<>"FIESTA";VLOOKUP(WEEKDAY([.B767];3);[Calendario.$A$4:.$C$11];3);0);"") ->  | G767: of:=IF(ISNUMBER([.F767]);[.F767]+[.G766];"") ->  | H767: of:=IF(AND([.G767]<=[Unidades.$G$26];[.G767]<=[Unidades.$F$18];[Unidades.$F$18]>0);[Unidades.$D$18]+1-COUNTIFS([Unidades.$O$3:.$O$17];">="&[.G767]);"") ->  | I767: of:=IF([.H766]<>[.H767];"INICIO";IF([.H768]<>[.H767];"FIN";"")) ->  | J767: of:=IF([.K766]<>[.K767];"INICIO";IF([.K768]<>[.K767];"FIN";"")) -> 
A768: of:=IF([.B768]<>"";TODAY()>[.B768];"") ->  | B768: of:=IFERROR(IF(([.B767]+1)<[Calendario.$F$5];[.B767]+1;"");"") ->  | C768: of:=IF(AND([.B768]>=[Calendario.$F$8];[.B768]<=[Calendario.$F$9];1);1;IF(AND([.B768]>=[Calendario.$F$12];[.B768]<=[Calendario.$F$13]);2;IF(AND([.B768]>=[Calendario.$F$16];[.B768]<=[Calendario.$F$17]);3;""))) ->  | D768: of:=IF(COUNTIF([Calendario.$H$4:.$H$48];[.B768])>0;"FIESTA";"") -> FIESTA | E768: of:=IF([.B768]<>"";VLOOKUP(WEEKDAY([.B768];3);[Calendario.$A$4:.$C$11];2);"") ->  | F768: of:=IF([.B768]<>"";IF([.D768]<>"FIESTA";VLOOKUP(WEEKDAY([.B768];3);[Calendario.$A$4:.$C$11];3);0);"") ->  | G768: of:=IF(ISNUMBER([.F768]);[.F768]+[.G767];"") ->  | H768: of:=IF(AND([.G768]<=[Unidades.$G$26];[.G768]<=[Unidades.$F$18];[Unidades.$F$18]>0);[Unidades.$D$18]+1-COUNTIFS([Unidades.$O$3:.$O$17];">="&[.G768]);"") ->  | I768: of:=IF([.H767]<>[.H768];"INICIO";IF([.H769]<>[.H768];"FIN";"")) ->  | J768: of:=IF([.K767]<>[.K768];"INICIO";IF([.K769]<>[.K768];"FIN";"")) -> 
A769: of:=IF([.B769]<>"";TODAY()>[.B769];"") ->  | B769: of:=IFERROR(IF(([.B768]+1)<[Calendario.$F$5];[.B768]+1;"");"") ->  | C769: of:=IF(AND([.B769]>=[Calendario.$F$8];[.B769]<=[Calendario.$F$9];1);1;IF(AND([.B769]>=[Calendario.$F$12];[.B769]<=[Calendario.$F$13]);2;IF(AND([.B769]>=[Calendario.$F$16];[.B769]<=[Calendario.$F$17]);3;""))) ->  | D769: of:=IF(COUNTIF([Calendario.$H$4:.$H$48];[.B769])>0;"FIESTA";"") -> FIESTA | E769: of:=IF([.B769]<>"";VLOOKUP(WEEKDAY([.B769];3);[Calendario.$A$4:.$C$11];2);"") ->  | F769: of:=IF([.B769]<>"";IF([.D769]<>"FIESTA";VLOOKUP(WEEKDAY([.B769];3);[Calendario.$A$4:.$C$11];3);0);"") ->  | G769: of:=IF(ISNUMBER([.F769]);[.F769]+[.G768];"") ->  | H769: of:=IF(AND([.G769]<=[Unidades.$G$26];[.G769]<=[Unidades.$F$18];[Unidades.$F$18]>0);[Unidades.$D$18]+1-COUNTIFS([Unidades.$O$3:.$O$17];">="&[.G769]);"") ->  | I769: of:=IF([.H768]<>[.H769];"INICIO";IF([.H770]<>[.H769];"FIN";"")) ->  | J769: of:=IF([.K768]<>[.K769];"INICIO";IF([.K770]<>[.K769];"FIN";"")) -> 
A770: of:=IF([.B770]<>"";TODAY()>[.B770];"") ->  | B770: of:=IFERROR(IF(([.B769]+1)<[Calendario.$F$5];[.B769]+1;"");"") ->  | C770: of:=IF(AND([.B770]>=[Calendario.$F$8];[.B770]<=[Calendario.$F$9];1);1;IF(AND([.B770]>=[Calendario.$F$12];[.B770]<=[Calendario.$F$13]);2;IF(AND([.B770]>=[Calendario.$F$16];[.B770]<=[Calendario.$F$17]);3;""))) ->  | D770: of:=IF(COUNTIF([Calendario.$H$4:.$H$48];[.B770])>0;"FIESTA";"") -> FIESTA | E770: of:=IF([.B770]<>"";VLOOKUP(WEEKDAY([.B770];3);[Calendario.$A$4:.$C$11];2);"") ->  | F770: of:=IF([.B770]<>"";IF([.D770]<>"FIESTA";VLOOKUP(WEEKDAY([.B770];3);[Calendario.$A$4:.$C$11];3);0);"") ->  | G770: of:=IF(ISNUMBER([.F770]);[.F770]+[.G769];"") ->  | H770: of:=IF(AND([.G770]<=[Unidades.$G$26];[.G770]<=[Unidades.$F$18];[Unidades.$F$18]>0);[Unidades.$D$18]+1-COUNTIFS([Unidades.$O$3:.$O$17];">="&[.G770]);"") ->  | I770: of:=IF([.H769]<>[.H770];"INICIO";IF([.H771]<>[.H770];"FIN";"")) ->  | J770: of:=IF([.K769]<>[.K770];"INICIO";IF([.K771]<>[.K770];"FIN";"")) -> 
A771: of:=IF([.B771]<>"";TODAY()>[.B771];"") ->  | B771: of:=IFERROR(IF(([.B770]+1)<[Calendario.$F$5];[.B770]+1;"");"") ->  | C771: of:=IF(AND([.B771]>=[Calendario.$F$8];[.B771]<=[Calendario.$F$9];1);1;IF(AND([.B771]>=[Calendario.$F$12];[.B771]<=[Calendario.$F$13]);2;IF(AND([.B771]>=[Calendario.$F$16];[.B771]<=[Calendario.$F$17]);3;""))) ->  | D771: of:=IF(COUNTIF([Calendario.$H$4:.$H$48];[.B771])>0;"FIESTA";"") -> FIESTA | E771: of:=IF([.B771]<>"";VLOOKUP(WEEKDAY([.B771];3);[Calendario.$A$4:.$C$11];2);"") ->  | F771: of:=IF([.B771]<>"";IF([.D771]<>"FIESTA";VLOOKUP(WEEKDAY([.B771];3);[Calendario.$A$4:.$C$11];3);0);"") ->  | G771: of:=IF(ISNUMBER([.F771]);[.F771]+[.G770];"") ->  | H771: of:=IF(AND([.G771]<=[Unidades.$G$26];[.G771]<=[Unidades.$F$18];[Unidades.$F$18]>0);[Unidades.$D$18]+1-COUNTIFS([Unidades.$O$3:.$O$17];">="&[.G771]);"") ->  | I771: of:=IF([.H770]<>[.H771];"INICIO";IF([.H772]<>[.H771];"FIN";"")) ->  | J771: of:=IF([.K770]<>[.K771];"INICIO";IF([.K772]<>[.K771];"FIN";"")) -> 
A772: of:=IF([.B772]<>"";TODAY()>[.B772];"") ->  | B772: of:=IFERROR(IF(([.B771]+1)<[Calendario.$F$5];[.B771]+1;"");"") ->  | C772: of:=IF(AND([.B772]>=[Calendario.$F$8];[.B772]<=[Calendario.$F$9];1);1;IF(AND([.B772]>=[Calendario.$F$12];[.B772]<=[Calendario.$F$13]);2;IF(AND([.B772]>=[Calendario.$F$16];[.B772]<=[Calendario.$F$17]);3;""))) ->  | D772: of:=IF(COUNTIF([Calendario.$H$4:.$H$48];[.B772])>0;"FIESTA";"") -> FIESTA | E772: of:=IF([.B772]<>"";VLOOKUP(WEEKDAY([.B772];3);[Calendario.$A$4:.$C$11];2);"") ->  | F772: of:=IF([.B772]<>"";IF([.D772]<>"FIESTA";VLOOKUP(WEEKDAY([.B772];3);[Calendario.$A$4:.$C$11];3);0);"") ->  | G772: of:=IF(ISNUMBER([.F772]);[.F772]+[.G771];"") ->  | H772: of:=IF(AND([.G772]<=[Unidades.$G$26];[.G772]<=[Unidades.$F$18];[Unidades.$F$18]>0);[Unidades.$D$18]+1-COUNTIFS([Unidades.$O$3:.$O$17];">="&[.G772]);"") ->  | I772: of:=IF([.H771]<>[.H772];"INICIO";IF([.H773]<>[.H772];"FIN";"")) ->  | J772: of:=IF([.K771]<>[.K772];"INICIO";IF([.K773]<>[.K772];"FIN";"")) -> 
A773: of:=IF([.B773]<>"";TODAY()>[.B773];"") ->  | B773: of:=IFERROR(IF(([.B772]+1)<[Calendario.$F$5];[.B772]+1;"");"") ->  | C773: of:=IF(AND([.B773]>=[Calendario.$F$8];[.B773]<=[Calendario.$F$9];1);1;IF(AND([.B773]>=[Calendario.$F$12];[.B773]<=[Calendario.$F$13]);2;IF(AND([.B773]>=[Calendario.$F$16];[.B773]<=[Calendario.$F$17]);3;""))) ->  | D773: of:=IF(COUNTIF([Calendario.$H$4:.$H$48];[.B773])>0;"FIESTA";"") -> FIESTA | E773: of:=IF([.B773]<>"";VLOOKUP(WEEKDAY([.B773];3);[Calendario.$A$4:.$C$11];2);"") ->  | F773: of:=IF([.B773]<>"";IF([.D773]<>"FIESTA";VLOOKUP(WEEKDAY([.B773];3);[Calendario.$A$4:.$C$11];3);0);"") ->  | G773: of:=IF(ISNUMBER([.F773]);[.F773]+[.G772];"") ->  | H773: of:=IF(AND([.G773]<=[Unidades.$G$26];[.G773]<=[Unidades.$F$18];[Unidades.$F$18]>0);[Unidades.$D$18]+1-COUNTIFS([Unidades.$O$3:.$O$17];">="&[.G773]);"") ->  | I773: of:=IF([.H772]<>[.H773];"INICIO";IF([.H774]<>[.H773];"FIN";"")) ->  | J773: of:=IF([.K772]<>[.K773];"INICIO";IF([.K774]<>[.K773];"FIN";"")) -> 
A774: of:=IF([.B774]<>"";TODAY()>[.B774];"") ->  | B774: of:=IFERROR(IF(([.B773]+1)<[Calendario.$F$5];[.B773]+1;"");"") ->  | C774: of:=IF(AND([.B774]>=[Calendario.$F$8];[.B774]<=[Calendario.$F$9];1);1;IF(AND([.B774]>=[Calendario.$F$12];[.B774]<=[Calendario.$F$13]);2;IF(AND([.B774]>=[Calendario.$F$16];[.B774]<=[Calendario.$F$17]);3;""))) ->  | D774: of:=IF(COUNTIF([Calendario.$H$4:.$H$48];[.B774])>0;"FIESTA";"") -> FIESTA | E774: of:=IF([.B774]<>"";VLOOKUP(WEEKDAY([.B774];3);[Calendario.$A$4:.$C$11];2);"") ->  | F774: of:=IF([.B774]<>"";IF([.D774]<>"FIESTA";VLOOKUP(WEEKDAY([.B774];3);[Calendario.$A$4:.$C$11];3);0);"") ->  | G774: of:=IF(ISNUMBER([.F774]);[.F774]+[.G773];"") ->  | H774: of:=IF(AND([.G774]<=[Unidades.$G$26];[.G774]<=[Unidades.$F$18];[Unidades.$F$18]>0);[Unidades.$D$18]+1-COUNTIFS([Unidades.$O$3:.$O$17];">="&[.G774]);"") ->  | I774: of:=IF([.H773]<>[.H774];"INICIO";IF([.H775]<>[.H774];"FIN";"")) ->  | J774: of:=IF([.K773]<>[.K774];"INICIO";IF([.K775]<>[.K774];"FIN";"")) -> 
A775: of:=IF([.B775]<>"";TODAY()>[.B775];"") ->  | B775: of:=IFERROR(IF(([.B774]+1)<[Calendario.$F$5];[.B774]+1;"");"") ->  | C775: of:=IF(AND([.B775]>=[Calendario.$F$8];[.B775]<=[Calendario.$F$9];1);1;IF(AND([.B775]>=[Calendario.$F$12];[.B775]<=[Calendario.$F$13]);2;IF(AND([.B775]>=[Calendario.$F$16];[.B775]<=[Calendario.$F$17]);3;""))) ->  | D775: of:=IF(COUNTIF([Calendario.$H$4:.$H$48];[.B775])>0;"FIESTA";"") -> FIESTA | E775: of:=IF([.B775]<>"";VLOOKUP(WEEKDAY([.B775];3);[Calendario.$A$4:.$C$11];2);"") ->  | F775: of:=IF([.B775]<>"";IF([.D775]<>"FIESTA";VLOOKUP(WEEKDAY([.B775];3);[Calendario.$A$4:.$C$11];3);0);"") ->  | G775: of:=IF(ISNUMBER([.F775]);[.F775]+[.G774];"") ->  | H775: of:=IF(AND([.G775]<=[Unidades.$G$26];[.G775]<=[Unidades.$F$18];[Unidades.$F$18]>0);[Unidades.$D$18]+1-COUNTIFS([Unidades.$O$3:.$O$17];">="&[.G775]);"") ->  | I775: of:=IF([.H774]<>[.H775];"INICIO";IF([.H776]<>[.H775];"FIN";"")) ->  | J775: of:=IF([.K774]<>[.K775];"INICIO";IF([.K776]<>[.K775];"FIN";"")) -> 
A776: of:=IF([.B776]<>"";TODAY()>[.B776];"") ->  | B776: of:=IFERROR(IF(([.B775]+1)<[Calendario.$F$5];[.B775]+1;"");"") ->  | C776: of:=IF(AND([.B776]>=[Calendario.$F$8];[.B776]<=[Calendario.$F$9];1);1;IF(AND([.B776]>=[Calendario.$F$12];[.B776]<=[Calendario.$F$13]);2;IF(AND([.B776]>=[Calendario.$F$16];[.B776]<=[Calendario.$F$17]);3;""))) ->  | D776: of:=IF(COUNTIF([Calendario.$H$4:.$H$48];[.B776])>0;"FIESTA";"") -> FIESTA | E776: of:=IF([.B776]<>"";VLOOKUP(WEEKDAY([.B776];3);[Calendario.$A$4:.$C$11];2);"") ->  | F776: of:=IF([.B776]<>"";IF([.D776]<>"FIESTA";VLOOKUP(WEEKDAY([.B776];3);[Calendario.$A$4:.$C$11];3);0);"") ->  | G776: of:=IF(ISNUMBER([.F776]);[.F776]+[.G775];"") ->  | H776: of:=IF(AND([.G776]<=[Unidades.$G$26];[.G776]<=[Unidades.$F$18];[Unidades.$F$18]>0);[Unidades.$D$18]+1-COUNTIFS([Unidades.$O$3:.$O$17];">="&[.G776]);"") ->  | I776: of:=IF([.H775]<>[.H776];"INICIO";IF([.H777]<>[.H776];"FIN";"")) ->  | J776: of:=IF([.K775]<>[.K776];"INICIO";IF([.K777]<>[.K776];"FIN";"")) -> 
A777: of:=IF([.B777]<>"";TODAY()>[.B777];"") ->  | B777: of:=IFERROR(IF(([.B776]+1)<[Calendario.$F$5];[.B776]+1;"");"") ->  | C777: of:=IF(AND([.B777]>=[Calendario.$F$8];[.B777]<=[Calendario.$F$9];1);1;IF(AND([.B777]>=[Calendario.$F$12];[.B777]<=[Calendario.$F$13]);2;IF(AND([.B777]>=[Calendario.$F$16];[.B777]<=[Calendario.$F$17]);3;""))) ->  | D777: of:=IF(COUNTIF([Calendario.$H$4:.$H$48];[.B777])>0;"FIESTA";"") -> FIESTA | E777: of:=IF([.B777]<>"";VLOOKUP(WEEKDAY([.B777];3);[Calendario.$A$4:.$C$11];2);"") ->  | F777: of:=IF([.B777]<>"";IF([.D777]<>"FIESTA";VLOOKUP(WEEKDAY([.B777];3);[Calendario.$A$4:.$C$11];3);0);"") ->  | G777: of:=IF(ISNUMBER([.F777]);[.F777]+[.G776];"") ->  | H777: of:=IF(AND([.G777]<=[Unidades.$G$26];[.G777]<=[Unidades.$F$18];[Unidades.$F$18]>0);[Unidades.$D$18]+1-COUNTIFS([Unidades.$O$3:.$O$17];">="&[.G777]);"") ->  | I777: of:=IF([.H776]<>[.H777];"INICIO";IF([.H778]<>[.H777];"FIN";"")) ->  | J777: of:=IF([.K776]<>[.K777];"INICIO";IF([.K778]<>[.K777];"FIN";"")) -> 
A778: of:=IF([.B778]<>"";TODAY()>[.B778];"") ->  | B778: of:=IFERROR(IF(([.B777]+1)<[Calendario.$F$5];[.B777]+1;"");"") ->  | C778: of:=IF(AND([.B778]>=[Calendario.$F$8];[.B778]<=[Calendario.$F$9];1);1;IF(AND([.B778]>=[Calendario.$F$12];[.B778]<=[Calendario.$F$13]);2;IF(AND([.B778]>=[Calendario.$F$16];[.B778]<=[Calendario.$F$17]);3;""))) ->  | D778: of:=IF(COUNTIF([Calendario.$H$4:.$H$48];[.B778])>0;"FIESTA";"") -> FIESTA | E778: of:=IF([.B778]<>"";VLOOKUP(WEEKDAY([.B778];3);[Calendario.$A$4:.$C$11];2);"") ->  | F778: of:=IF([.B778]<>"";IF([.D778]<>"FIESTA";VLOOKUP(WEEKDAY([.B778];3);[Calendario.$A$4:.$C$11];3);0);"") ->  | G778: of:=IF(ISNUMBER([.F778]);[.F778]+[.G777];"") ->  | H778: of:=IF(AND([.G778]<=[Unidades.$G$26];[.G778]<=[Unidades.$F$18];[Unidades.$F$18]>0);[Unidades.$D$18]+1-COUNTIFS([Unidades.$O$3:.$O$17];">="&[.G778]);"") ->  | I778: of:=IF([.H777]<>[.H778];"INICIO";IF([.H779]<>[.H778];"FIN";"")) ->  | J778: of:=IF([.K777]<>[.K778];"INICIO";IF([.K779]<>[.K778];"FIN";"")) -> 
A779: of:=IF([.B779]<>"";TODAY()>[.B779];"") ->  | B779: of:=IFERROR(IF(([.B778]+1)<[Calendario.$F$5];[.B778]+1;"");"") ->  | C779: of:=IF(AND([.B779]>=[Calendario.$F$8];[.B779]<=[Calendario.$F$9];1);1;IF(AND([.B779]>=[Calendario.$F$12];[.B779]<=[Calendario.$F$13]);2;IF(AND([.B779]>=[Calendario.$F$16];[.B779]<=[Calendario.$F$17]);3;""))) ->  | D779: of:=IF(COUNTIF([Calendario.$H$4:.$H$48];[.B779])>0;"FIESTA";"") -> FIESTA | E779: of:=IF([.B779]<>"";VLOOKUP(WEEKDAY([.B779];3);[Calendario.$A$4:.$C$11];2);"") ->  | F779: of:=IF([.B779]<>"";IF([.D779]<>"FIESTA";VLOOKUP(WEEKDAY([.B779];3);[Calendario.$A$4:.$C$11];3);0);"") ->  | G779: of:=IF(ISNUMBER([.F779]);[.F779]+[.G778];"") ->  | H779: of:=IF(AND([.G779]<=[Unidades.$G$26];[.G779]<=[Unidades.$F$18];[Unidades.$F$18]>0);[Unidades.$D$18]+1-COUNTIFS([Unidades.$O$3:.$O$17];">="&[.G779]);"") ->  | I779: of:=IF([.H778]<>[.H779];"INICIO";IF([.H780]<>[.H779];"FIN";"")) ->  | J779: of:=IF([.K778]<>[.K779];"INICIO";IF([.K780]<>[.K779];"FIN";"")) -> 
A780: of:=IF([.B780]<>"";TODAY()>[.B780];"") ->  | B780: of:=IFERROR(IF(([.B779]+1)<[Calendario.$F$5];[.B779]+1;"");"") ->  | C780: of:=IF(AND([.B780]>=[Calendario.$F$8];[.B780]<=[Calendario.$F$9];1);1;IF(AND([.B780]>=[Calendario.$F$12];[.B780]<=[Calendario.$F$13]);2;IF(AND([.B780]>=[Calendario.$F$16];[.B780]<=[Calendario.$F$17]);3;""))) ->  | D780: of:=IF(COUNTIF([Calendario.$H$4:.$H$48];[.B780])>0;"FIESTA";"") -> FIESTA | E780: of:=IF([.B780]<>"";VLOOKUP(WEEKDAY([.B780];3);[Calendario.$A$4:.$C$11];2);"") ->  | F780: of:=IF([.B780]<>"";IF([.D780]<>"FIESTA";VLOOKUP(WEEKDAY([.B780];3);[Calendario.$A$4:.$C$11];3);0);"") ->  | G780: of:=IF(ISNUMBER([.F780]);[.F780]+[.G779];"") ->  | H780: of:=IF(AND([.G780]<=[Unidades.$G$26];[.G780]<=[Unidades.$F$18];[Unidades.$F$18]>0);[Unidades.$D$18]+1-COUNTIFS([Unidades.$O$3:.$O$17];">="&[.G780]);"") ->  | I780: of:=IF([.H779]<>[.H780];"INICIO";IF([.H781]<>[.H780];"FIN";"")) ->  | J780: of:=IF([.K779]<>[.K780];"INICIO";IF([.K781]<>[.K780];"FIN";"")) -> 
A781: of:=IF([.B781]<>"";TODAY()>[.B781];"") ->  | B781: of:=IFERROR(IF(([.B780]+1)<[Calendario.$F$5];[.B780]+1;"");"") ->  | C781: of:=IF(AND([.B781]>=[Calendario.$F$8];[.B781]<=[Calendario.$F$9];1);1;IF(AND([.B781]>=[Calendario.$F$12];[.B781]<=[Calendario.$F$13]);2;IF(AND([.B781]>=[Calendario.$F$16];[.B781]<=[Calendario.$F$17]);3;""))) ->  | D781: of:=IF(COUNTIF([Calendario.$H$4:.$H$48];[.B781])>0;"FIESTA";"") -> FIESTA | E781: of:=IF([.B781]<>"";VLOOKUP(WEEKDAY([.B781];3);[Calendario.$A$4:.$C$11];2);"") ->  | F781: of:=IF([.B781]<>"";IF([.D781]<>"FIESTA";VLOOKUP(WEEKDAY([.B781];3);[Calendario.$A$4:.$C$11];3);0);"") ->  | G781: of:=IF(ISNUMBER([.F781]);[.F781]+[.G780];"") ->  | H781: of:=IF(AND([.G781]<=[Unidades.$G$26];[.G781]<=[Unidades.$F$18];[Unidades.$F$18]>0);[Unidades.$D$18]+1-COUNTIFS([Unidades.$O$3:.$O$17];">="&[.G781]);"") ->  | I781: of:=IF([.H780]<>[.H781];"INICIO";IF([.H782]<>[.H781];"FIN";"")) ->  | J781: of:=IF([.K780]<>[.K781];"INICIO";IF([.K782]<>[.K781];"FIN";"")) -> 
A782: of:=IF([.B782]<>"";TODAY()>[.B782];"") ->  | B782: of:=IFERROR(IF(([.B781]+1)<[Calendario.$F$5];[.B781]+1;"");"") ->  | C782: of:=IF(AND([.B782]>=[Calendario.$F$8];[.B782]<=[Calendario.$F$9];1);1;IF(AND([.B782]>=[Calendario.$F$12];[.B782]<=[Calendario.$F$13]);2;IF(AND([.B782]>=[Calendario.$F$16];[.B782]<=[Calendario.$F$17]);3;""))) ->  | D782: of:=IF(COUNTIF([Calendario.$H$4:.$H$48];[.B782])>0;"FIESTA";"") -> FIESTA | E782: of:=IF([.B782]<>"";VLOOKUP(WEEKDAY([.B782];3);[Calendario.$A$4:.$C$11];2);"") ->  | F782: of:=IF([.B782]<>"";IF([.D782]<>"FIESTA";VLOOKUP(WEEKDAY([.B782];3);[Calendario.$A$4:.$C$11];3);0);"") ->  | G782: of:=IF(ISNUMBER([.F782]);[.F782]+[.G781];"") ->  | H782: of:=IF(AND([.G782]<=[Unidades.$G$26];[.G782]<=[Unidades.$F$18];[Unidades.$F$18]>0);[Unidades.$D$18]+1-COUNTIFS([Unidades.$O$3:.$O$17];">="&[.G782]);"") ->  | I782: of:=IF([.H781]<>[.H782];"INICIO";IF([.H783]<>[.H782];"FIN";"")) ->  | J782: of:=IF([.K781]<>[.K782];"INICIO";IF([.K783]<>[.K782];"FIN";"")) -> 
A783: of:=IF([.B783]<>"";TODAY()>[.B783];"") ->  | B783: of:=IFERROR(IF(([.B782]+1)<[Calendario.$F$5];[.B782]+1;"");"") ->  | C783: of:=IF(AND([.B783]>=[Calendario.$F$8];[.B783]<=[Calendario.$F$9];1);1;IF(AND([.B783]>=[Calendario.$F$12];[.B783]<=[Calendario.$F$13]);2;IF(AND([.B783]>=[Calendario.$F$16];[.B783]<=[Calendario.$F$17]);3;""))) ->  | D783: of:=IF(COUNTIF([Calendario.$H$4:.$H$48];[.B783])>0;"FIESTA";"") -> FIESTA | E783: of:=IF([.B783]<>"";VLOOKUP(WEEKDAY([.B783];3);[Calendario.$A$4:.$C$11];2);"") ->  | F783: of:=IF([.B783]<>"";IF([.D783]<>"FIESTA";VLOOKUP(WEEKDAY([.B783];3);[Calendario.$A$4:.$C$11];3);0);"") ->  | G783: of:=IF(ISNUMBER([.F783]);[.F783]+[.G782];"") ->  | H783: of:=IF(AND([.G783]<=[Unidades.$G$26];[.G783]<=[Unidades.$F$18];[Unidades.$F$18]>0);[Unidades.$D$18]+1-COUNTIFS([Unidades.$O$3:.$O$17];">="&[.G783]);"") ->  | I783: of:=IF([.H782]<>[.H783];"INICIO";IF([.H784]<>[.H783];"FIN";"")) ->  | J783: of:=IF([.K782]<>[.K783];"INICIO";IF([.K784]<>[.K783];"FIN";"")) -> 
A784: of:=IF([.B784]<>"";TODAY()>[.B784];"") ->  | B784: of:=IFERROR(IF(([.B783]+1)<[Calendario.$F$5];[.B783]+1;"");"") ->  | C784: of:=IF(AND([.B784]>=[Calendario.$F$8];[.B784]<=[Calendario.$F$9];1);1;IF(AND([.B784]>=[Calendario.$F$12];[.B784]<=[Calendario.$F$13]);2;IF(AND([.B784]>=[Calendario.$F$16];[.B784]<=[Calendario.$F$17]);3;""))) ->  | D784: of:=IF(COUNTIF([Calendario.$H$4:.$H$48];[.B784])>0;"FIESTA";"") -> FIESTA | E784: of:=IF([.B784]<>"";VLOOKUP(WEEKDAY([.B784];3);[Calendario.$A$4:.$C$11];2);"") ->  | F784: of:=IF([.B784]<>"";IF([.D784]<>"FIESTA";VLOOKUP(WEEKDAY([.B784];3);[Calendario.$A$4:.$C$11];3);0);"") ->  | G784: of:=IF(ISNUMBER([.F784]);[.F784]+[.G783];"") ->  | H784: of:=IF(AND([.G784]<=[Unidades.$G$26];[.G784]<=[Unidades.$F$18];[Unidades.$F$18]>0);[Unidades.$D$18]+1-COUNTIFS([Unidades.$O$3:.$O$17];">="&[.G784]);"") ->  | I784: of:=IF([.H783]<>[.H784];"INICIO";IF([.H785]<>[.H784];"FIN";"")) ->  | J784: of:=IF([.K783]<>[.K784];"INICIO";IF([.K785]<>[.K784];"FIN";"")) -> 
A785: of:=IF([.B785]<>"";TODAY()>[.B785];"") ->  | B785: of:=IFERROR(IF(([.B784]+1)<[Calendario.$F$5];[.B784]+1;"");"") ->  | C785: of:=IF(AND([.B785]>=[Calendario.$F$8];[.B785]<=[Calendario.$F$9];1);1;IF(AND([.B785]>=[Calendario.$F$12];[.B785]<=[Calendario.$F$13]);2;IF(AND([.B785]>=[Calendario.$F$16];[.B785]<=[Calendario.$F$17]);3;""))) ->  | D785: of:=IF(COUNTIF([Calendario.$H$4:.$H$48];[.B785])>0;"FIESTA";"") -> FIESTA | E785: of:=IF([.B785]<>"";VLOOKUP(WEEKDAY([.B785];3);[Calendario.$A$4:.$C$11];2);"") ->  | F785: of:=IF([.B785]<>"";IF([.D785]<>"FIESTA";VLOOKUP(WEEKDAY([.B785];3);[Calendario.$A$4:.$C$11];3);0);"") ->  | G785: of:=IF(ISNUMBER([.F785]);[.F785]+[.G784];"") ->  | H785: of:=IF(AND([.G785]<=[Unidades.$G$26];[.G785]<=[Unidades.$F$18];[Unidades.$F$18]>0);[Unidades.$D$18]+1-COUNTIFS([Unidades.$O$3:.$O$17];">="&[.G785]);"") ->  | I785: of:=IF([.H784]<>[.H785];"INICIO";IF([.H786]<>[.H785];"FIN";"")) ->  | J785: of:=IF([.K784]<>[.K785];"INICIO";IF([.K786]<>[.K785];"FIN";"")) -> 
A786: of:=IF([.B786]<>"";TODAY()>[.B786];"") ->  | B786: of:=IFERROR(IF(([.B785]+1)<[Calendario.$F$5];[.B785]+1;"");"") ->  | C786: of:=IF(AND([.B786]>=[Calendario.$F$8];[.B786]<=[Calendario.$F$9];1);1;IF(AND([.B786]>=[Calendario.$F$12];[.B786]<=[Calendario.$F$13]);2;IF(AND([.B786]>=[Calendario.$F$16];[.B786]<=[Calendario.$F$17]);3;""))) ->  | D786: of:=IF(COUNTIF([Calendario.$H$4:.$H$48];[.B786])>0;"FIESTA";"") -> FIESTA | E786: of:=IF([.B786]<>"";VLOOKUP(WEEKDAY([.B786];3);[Calendario.$A$4:.$C$11];2);"") ->  | F786: of:=IF([.B786]<>"";IF([.D786]<>"FIESTA";VLOOKUP(WEEKDAY([.B786];3);[Calendario.$A$4:.$C$11];3);0);"") ->  | G786: of:=IF(ISNUMBER([.F786]);[.F786]+[.G785];"") ->  | H786: of:=IF(AND([.G786]<=[Unidades.$G$26];[.G786]<=[Unidades.$F$18];[Unidades.$F$18]>0);[Unidades.$D$18]+1-COUNTIFS([Unidades.$O$3:.$O$17];">="&[.G786]);"") ->  | I786: of:=IF([.H785]<>[.H786];"INICIO";IF([.H787]<>[.H786];"FIN";"")) ->  | J786: of:=IF([.K785]<>[.K786];"INICIO";IF([.K787]<>[.K786];"FIN";"")) -> 
A787: of:=IF([.B787]<>"";TODAY()>[.B787];"") ->  | B787: of:=IFERROR(IF(([.B786]+1)<[Calendario.$F$5];[.B786]+1;"");"") ->  | C787: of:=IF(AND([.B787]>=[Calendario.$F$8];[.B787]<=[Calendario.$F$9];1);1;IF(AND([.B787]>=[Calendario.$F$12];[.B787]<=[Calendario.$F$13]);2;IF(AND([.B787]>=[Calendario.$F$16];[.B787]<=[Calendario.$F$17]);3;""))) ->  | D787: of:=IF(COUNTIF([Calendario.$H$4:.$H$48];[.B787])>0;"FIESTA";"") -> FIESTA | E787: of:=IF([.B787]<>"";VLOOKUP(WEEKDAY([.B787];3);[Calendario.$A$4:.$C$11];2);"") ->  | F787: of:=IF([.B787]<>"";IF([.D787]<>"FIESTA";VLOOKUP(WEEKDAY([.B787];3);[Calendario.$A$4:.$C$11];3);0);"") ->  | G787: of:=IF(ISNUMBER([.F787]);[.F787]+[.G786];"") ->  | H787: of:=IF(AND([.G787]<=[Unidades.$G$26];[.G787]<=[Unidades.$F$18];[Unidades.$F$18]>0);[Unidades.$D$18]+1-COUNTIFS([Unidades.$O$3:.$O$17];">="&[.G787]);"") ->  | I787: of:=IF([.H786]<>[.H787];"INICIO";IF([.H788]<>[.H787];"FIN";"")) ->  | J787: of:=IF([.K786]<>[.K787];"INICIO";IF([.K788]<>[.K787];"FIN";"")) -> 
A788: of:=IF([.B788]<>"";TODAY()>[.B788];"") ->  | B788: of:=IFERROR(IF(([.B787]+1)<[Calendario.$F$5];[.B787]+1;"");"") ->  | C788: of:=IF(AND([.B788]>=[Calendario.$F$8];[.B788]<=[Calendario.$F$9];1);1;IF(AND([.B788]>=[Calendario.$F$12];[.B788]<=[Calendario.$F$13]);2;IF(AND([.B788]>=[Calendario.$F$16];[.B788]<=[Calendario.$F$17]);3;""))) ->  | D788: of:=IF(COUNTIF([Calendario.$H$4:.$H$48];[.B788])>0;"FIESTA";"") -> FIESTA | E788: of:=IF([.B788]<>"";VLOOKUP(WEEKDAY([.B788];3);[Calendario.$A$4:.$C$11];2);"") ->  | F788: of:=IF([.B788]<>"";IF([.D788]<>"FIESTA";VLOOKUP(WEEKDAY([.B788];3);[Calendario.$A$4:.$C$11];3);0);"") ->  | G788: of:=IF(ISNUMBER([.F788]);[.F788]+[.G787];"") ->  | H788: of:=IF(AND([.G788]<=[Unidades.$G$26];[.G788]<=[Unidades.$F$18];[Unidades.$F$18]>0);[Unidades.$D$18]+1-COUNTIFS([Unidades.$O$3:.$O$17];">="&[.G788]);"") ->  | I788: of:=IF([.H787]<>[.H788];"INICIO";IF([.H789]<>[.H788];"FIN";"")) ->  | J788: of:=IF([.K787]<>[.K788];"INICIO";IF([.K789]<>[.K788];"FIN";"")) -> 
A789: of:=IF([.B789]<>"";TODAY()>[.B789];"") ->  | B789: of:=IFERROR(IF(([.B788]+1)<[Calendario.$F$5];[.B788]+1;"");"") ->  | C789: of:=IF(AND([.B789]>=[Calendario.$F$8];[.B789]<=[Calendario.$F$9];1);1;IF(AND([.B789]>=[Calendario.$F$12];[.B789]<=[Calendario.$F$13]);2;IF(AND([.B789]>=[Calendario.$F$16];[.B789]<=[Calendario.$F$17]);3;""))) ->  | D789: of:=IF(COUNTIF([Calendario.$H$4:.$H$48];[.B789])>0;"FIESTA";"") -> FIESTA | E789: of:=IF([.B789]<>"";VLOOKUP(WEEKDAY([.B789];3);[Calendario.$A$4:.$C$11];2);"") ->  | F789: of:=IF([.B789]<>"";IF([.D789]<>"FIESTA";VLOOKUP(WEEKDAY([.B789];3);[Calendario.$A$4:.$C$11];3);0);"") ->  | G789: of:=IF(ISNUMBER([.F789]);[.F789]+[.G788];"") ->  | H789: of:=IF(AND([.G789]<=[Unidades.$G$26];[.G789]<=[Unidades.$F$18];[Unidades.$F$18]>0);[Unidades.$D$18]+1-COUNTIFS([Unidades.$O$3:.$O$17];">="&[.G789]);"") ->  | I789: of:=IF([.H788]<>[.H789];"INICIO";IF([.H790]<>[.H789];"FIN";"")) ->  | J789: of:=IF([.K788]<>[.K789];"INICIO";IF([.K790]<>[.K789];"FIN";"")) -> 
A790: of:=IF([.B790]<>"";TODAY()>[.B790];"") ->  | B790: of:=IFERROR(IF(([.B789]+1)<[Calendario.$F$5];[.B789]+1;"");"") ->  | C790: of:=IF(AND([.B790]>=[Calendario.$F$8];[.B790]<=[Calendario.$F$9];1);1;IF(AND([.B790]>=[Calendario.$F$12];[.B790]<=[Calendario.$F$13]);2;IF(AND([.B790]>=[Calendario.$F$16];[.B790]<=[Calendario.$F$17]);3;""))) ->  | D790: of:=IF(COUNTIF([Calendario.$H$4:.$H$48];[.B790])>0;"FIESTA";"") -> FIESTA | E790: of:=IF([.B790]<>"";VLOOKUP(WEEKDAY([.B790];3);[Calendario.$A$4:.$C$11];2);"") ->  | F790: of:=IF([.B790]<>"";IF([.D790]<>"FIESTA";VLOOKUP(WEEKDAY([.B790];3);[Calendario.$A$4:.$C$11];3);0);"") ->  | G790: of:=IF(ISNUMBER([.F790]);[.F790]+[.G789];"") ->  | H790: of:=IF(AND([.G790]<=[Unidades.$G$26];[.G790]<=[Unidades.$F$18];[Unidades.$F$18]>0);[Unidades.$D$18]+1-COUNTIFS([Unidades.$O$3:.$O$17];">="&[.G790]);"") ->  | I790: of:=IF([.H789]<>[.H790];"INICIO";IF([.H791]<>[.H790];"FIN";"")) ->  | J790: of:=IF([.K789]<>[.K790];"INICIO";IF([.K791]<>[.K790];"FIN";"")) -> 
A791: of:=IF([.B791]<>"";TODAY()>[.B791];"") ->  | B791: of:=IFERROR(IF(([.B790]+1)<[Calendario.$F$5];[.B790]+1;"");"") ->  | C791: of:=IF(AND([.B791]>=[Calendario.$F$8];[.B791]<=[Calendario.$F$9];1);1;IF(AND([.B791]>=[Calendario.$F$12];[.B791]<=[Calendario.$F$13]);2;IF(AND([.B791]>=[Calendario.$F$16];[.B791]<=[Calendario.$F$17]);3;""))) ->  | D791: of:=IF(COUNTIF([Calendario.$H$4:.$H$48];[.B791])>0;"FIESTA";"") -> FIESTA | E791: of:=IF([.B791]<>"";VLOOKUP(WEEKDAY([.B791];3);[Calendario.$A$4:.$C$11];2);"") ->  | F791: of:=IF([.B791]<>"";IF([.D791]<>"FIESTA";VLOOKUP(WEEKDAY([.B791];3);[Calendario.$A$4:.$C$11];3);0);"") ->  | G791: of:=IF(ISNUMBER([.F791]);[.F791]+[.G790];"") ->  | H791: of:=IF(AND([.G791]<=[Unidades.$G$26];[.G791]<=[Unidades.$F$18];[Unidades.$F$18]>0);[Unidades.$D$18]+1-COUNTIFS([Unidades.$O$3:.$O$17];">="&[.G791]);"") ->  | I791: of:=IF([.H790]<>[.H791];"INICIO";IF([.H792]<>[.H791];"FIN";"")) ->  | J791: of:=IF([.K790]<>[.K791];"INICIO";IF([.K792]<>[.K791];"FIN";"")) -> 
A792: of:=IF([.B792]<>"";TODAY()>[.B792];"") ->  | B792: of:=IFERROR(IF(([.B791]+1)<[Calendario.$F$5];[.B791]+1;"");"") ->  | C792: of:=IF(AND([.B792]>=[Calendario.$F$8];[.B792]<=[Calendario.$F$9];1);1;IF(AND([.B792]>=[Calendario.$F$12];[.B792]<=[Calendario.$F$13]);2;IF(AND([.B792]>=[Calendario.$F$16];[.B792]<=[Calendario.$F$17]);3;""))) ->  | D792: of:=IF(COUNTIF([Calendario.$H$4:.$H$48];[.B792])>0;"FIESTA";"") -> FIESTA | E792: of:=IF([.B792]<>"";VLOOKUP(WEEKDAY([.B792];3);[Calendario.$A$4:.$C$11];2);"") ->  | F792: of:=IF([.B792]<>"";IF([.D792]<>"FIESTA";VLOOKUP(WEEKDAY([.B792];3);[Calendario.$A$4:.$C$11];3);0);"") ->  | G792: of:=IF(ISNUMBER([.F792]);[.F792]+[.G791];"") ->  | H792: of:=IF(AND([.G792]<=[Unidades.$G$26];[.G792]<=[Unidades.$F$18];[Unidades.$F$18]>0);[Unidades.$D$18]+1-COUNTIFS([Unidades.$O$3:.$O$17];">="&[.G792]);"") ->  | I792: of:=IF([.H791]<>[.H792];"INICIO";IF([.H793]<>[.H792];"FIN";"")) ->  | J792: of:=IF([.K791]<>[.K792];"INICIO";IF([.K793]<>[.K792];"FIN";"")) -> 
A793: of:=IF([.B793]<>"";TODAY()>[.B793];"") ->  | B793: of:=IFERROR(IF(([.B792]+1)<[Calendario.$F$5];[.B792]+1;"");"") ->  | C793: of:=IF(AND([.B793]>=[Calendario.$F$8];[.B793]<=[Calendario.$F$9];1);1;IF(AND([.B793]>=[Calendario.$F$12];[.B793]<=[Calendario.$F$13]);2;IF(AND([.B793]>=[Calendario.$F$16];[.B793]<=[Calendario.$F$17]);3;""))) ->  | D793: of:=IF(COUNTIF([Calendario.$H$4:.$H$48];[.B793])>0;"FIESTA";"") -> FIESTA | E793: of:=IF([.B793]<>"";VLOOKUP(WEEKDAY([.B793];3);[Calendario.$A$4:.$C$11];2);"") ->  | F793: of:=IF([.B793]<>"";IF([.D793]<>"FIESTA";VLOOKUP(WEEKDAY([.B793];3);[Calendario.$A$4:.$C$11];3);0);"") ->  | G793: of:=IF(ISNUMBER([.F793]);[.F793]+[.G792];"") ->  | H793: of:=IF(AND([.G793]<=[Unidades.$G$26];[.G793]<=[Unidades.$F$18];[Unidades.$F$18]>0);[Unidades.$D$18]+1-COUNTIFS([Unidades.$O$3:.$O$17];">="&[.G793]);"") ->  | I793: of:=IF([.H792]<>[.H793];"INICIO";IF([.H794]<>[.H793];"FIN";"")) ->  | J793: of:=IF([.K792]<>[.K793];"INICIO";IF([.K794]<>[.K793];"FIN";"")) -> 
A794: of:=IF([.B794]<>"";TODAY()>[.B794];"") ->  | B794: of:=IFERROR(IF(([.B793]+1)<[Calendario.$F$5];[.B793]+1;"");"") ->  | C794: of:=IF(AND([.B794]>=[Calendario.$F$8];[.B794]<=[Calendario.$F$9];1);1;IF(AND([.B794]>=[Calendario.$F$12];[.B794]<=[Calendario.$F$13]);2;IF(AND([.B794]>=[Calendario.$F$16];[.B794]<=[Calendario.$F$17]);3;""))) ->  | D794: of:=IF(COUNTIF([Calendario.$H$4:.$H$48];[.B794])>0;"FIESTA";"") -> FIESTA | E794: of:=IF([.B794]<>"";VLOOKUP(WEEKDAY([.B794];3);[Calendario.$A$4:.$C$11];2);"") ->  | F794: of:=IF([.B794]<>"";IF([.D794]<>"FIESTA";VLOOKUP(WEEKDAY([.B794];3);[Calendario.$A$4:.$C$11];3);0);"") ->  | G794: of:=IF(ISNUMBER([.F794]);[.F794]+[.G793];"") ->  | H794: of:=IF(AND([.G794]<=[Unidades.$G$26];[.G794]<=[Unidades.$F$18];[Unidades.$F$18]>0);[Unidades.$D$18]+1-COUNTIFS([Unidades.$O$3:.$O$17];">="&[.G794]);"") ->  | I794: of:=IF([.H793]<>[.H794];"INICIO";IF([.H795]<>[.H794];"FIN";"")) ->  | J794: of:=IF([.K793]<>[.K794];"INICIO";IF([.K795]<>[.K794];"FIN";"")) -> 
A795: of:=IF([.B795]<>"";TODAY()>[.B795];"") ->  | B795: of:=IFERROR(IF(([.B794]+1)<[Calendario.$F$5];[.B794]+1;"");"") ->  | C795: of:=IF(AND([.B795]>=[Calendario.$F$8];[.B795]<=[Calendario.$F$9];1);1;IF(AND([.B795]>=[Calendario.$F$12];[.B795]<=[Calendario.$F$13]);2;IF(AND([.B795]>=[Calendario.$F$16];[.B795]<=[Calendario.$F$17]);3;""))) ->  | D795: of:=IF(COUNTIF([Calendario.$H$4:.$H$48];[.B795])>0;"FIESTA";"") -> FIESTA | E795: of:=IF([.B795]<>"";VLOOKUP(WEEKDAY([.B795];3);[Calendario.$A$4:.$C$11];2);"") ->  | F795: of:=IF([.B795]<>"";IF([.D795]<>"FIESTA";VLOOKUP(WEEKDAY([.B795];3);[Calendario.$A$4:.$C$11];3);0);"") ->  | G795: of:=IF(ISNUMBER([.F795]);[.F795]+[.G794];"") ->  | H795: of:=IF(AND([.G795]<=[Unidades.$G$26];[.G795]<=[Unidades.$F$18];[Unidades.$F$18]>0);[Unidades.$D$18]+1-COUNTIFS([Unidades.$O$3:.$O$17];">="&[.G795]);"") ->  | I795: of:=IF([.H794]<>[.H795];"INICIO";IF([.H796]<>[.H795];"FIN";"")) ->  | J795: of:=IF([.K794]<>[.K795];"INICIO";IF([.K796]<>[.K795];"FIN";"")) -> 
A796: of:=IF([.B796]<>"";TODAY()>[.B796];"") ->  | B796: of:=IFERROR(IF(([.B795]+1)<[Calendario.$F$5];[.B795]+1;"");"") ->  | C796: of:=IF(AND([.B796]>=[Calendario.$F$8];[.B796]<=[Calendario.$F$9];1);1;IF(AND([.B796]>=[Calendario.$F$12];[.B796]<=[Calendario.$F$13]);2;IF(AND([.B796]>=[Calendario.$F$16];[.B796]<=[Calendario.$F$17]);3;""))) ->  | D796: of:=IF(COUNTIF([Calendario.$H$4:.$H$48];[.B796])>0;"FIESTA";"") -> FIESTA | E796: of:=IF([.B796]<>"";VLOOKUP(WEEKDAY([.B796];3);[Calendario.$A$4:.$C$11];2);"") ->  | F796: of:=IF([.B796]<>"";IF([.D796]<>"FIESTA";VLOOKUP(WEEKDAY([.B796];3);[Calendario.$A$4:.$C$11];3);0);"") ->  | G796: of:=IF(ISNUMBER([.F796]);[.F796]+[.G795];"") ->  | H796: of:=IF(AND([.G796]<=[Unidades.$G$26];[.G796]<=[Unidades.$F$18];[Unidades.$F$18]>0);[Unidades.$D$18]+1-COUNTIFS([Unidades.$O$3:.$O$17];">="&[.G796]);"") ->  | I796: of:=IF([.H795]<>[.H796];"INICIO";IF([.H797]<>[.H796];"FIN";"")) ->  | J796: of:=IF([.K795]<>[.K796];"INICIO";IF([.K797]<>[.K796];"FIN";"")) -> 
A797: of:=IF([.B797]<>"";TODAY()>[.B797];"") ->  | B797: of:=IFERROR(IF(([.B796]+1)<[Calendario.$F$5];[.B796]+1;"");"") ->  | C797: of:=IF(AND([.B797]>=[Calendario.$F$8];[.B797]<=[Calendario.$F$9];1);1;IF(AND([.B797]>=[Calendario.$F$12];[.B797]<=[Calendario.$F$13]);2;IF(AND([.B797]>=[Calendario.$F$16];[.B797]<=[Calendario.$F$17]);3;""))) ->  | D797: of:=IF(COUNTIF([Calendario.$H$4:.$H$48];[.B797])>0;"FIESTA";"") -> FIESTA | E797: of:=IF([.B797]<>"";VLOOKUP(WEEKDAY([.B797];3);[Calendario.$A$4:.$C$11];2);"") ->  | F797: of:=IF([.B797]<>"";IF([.D797]<>"FIESTA";VLOOKUP(WEEKDAY([.B797];3);[Calendario.$A$4:.$C$11];3);0);"") ->  | G797: of:=IF(ISNUMBER([.F797]);[.F797]+[.G796];"") ->  | H797: of:=IF(AND([.G797]<=[Unidades.$G$26];[.G797]<=[Unidades.$F$18];[Unidades.$F$18]>0);[Unidades.$D$18]+1-COUNTIFS([Unidades.$O$3:.$O$17];">="&[.G797]);"") ->  | I797: of:=IF([.H796]<>[.H797];"INICIO";IF([.H798]<>[.H797];"FIN";"")) ->  | J797: of:=IF([.K796]<>[.K797];"INICIO";IF([.K798]<>[.K797];"FIN";"")) -> 
A798: of:=IF([.B798]<>"";TODAY()>[.B798];"") ->  | B798: of:=IFERROR(IF(([.B797]+1)<[Calendario.$F$5];[.B797]+1;"");"") ->  | C798: of:=IF(AND([.B798]>=[Calendario.$F$8];[.B798]<=[Calendario.$F$9];1);1;IF(AND([.B798]>=[Calendario.$F$12];[.B798]<=[Calendario.$F$13]);2;IF(AND([.B798]>=[Calendario.$F$16];[.B798]<=[Calendario.$F$17]);3;""))) ->  | D798: of:=IF(COUNTIF([Calendario.$H$4:.$H$48];[.B798])>0;"FIESTA";"") -> FIESTA | E798: of:=IF([.B798]<>"";VLOOKUP(WEEKDAY([.B798];3);[Calendario.$A$4:.$C$11];2);"") ->  | F798: of:=IF([.B798]<>"";IF([.D798]<>"FIESTA";VLOOKUP(WEEKDAY([.B798];3);[Calendario.$A$4:.$C$11];3);0);"") ->  | G798: of:=IF(ISNUMBER([.F798]);[.F798]+[.G797];"") ->  | H798: of:=IF(AND([.G798]<=[Unidades.$G$26];[.G798]<=[Unidades.$F$18];[Unidades.$F$18]>0);[Unidades.$D$18]+1-COUNTIFS([Unidades.$O$3:.$O$17];">="&[.G798]);"") ->  | I798: of:=IF([.H797]<>[.H798];"INICIO";IF([.H799]<>[.H798];"FIN";"")) ->  | J798: of:=IF([.K797]<>[.K798];"INICIO";IF([.K799]<>[.K798];"FIN";"")) -> 
A799: of:=IF([.B799]<>"";TODAY()>[.B799];"") ->  | B799: of:=IFERROR(IF(([.B798]+1)<[Calendario.$F$5];[.B798]+1;"");"") ->  | C799: of:=IF(AND([.B799]>=[Calendario.$F$8];[.B799]<=[Calendario.$F$9];1);1;IF(AND([.B799]>=[Calendario.$F$12];[.B799]<=[Calendario.$F$13]);2;IF(AND([.B799]>=[Calendario.$F$16];[.B799]<=[Calendario.$F$17]);3;""))) ->  | D799: of:=IF(COUNTIF([Calendario.$H$4:.$H$48];[.B799])>0;"FIESTA";"") -> FIESTA | E799: of:=IF([.B799]<>"";VLOOKUP(WEEKDAY([.B799];3);[Calendario.$A$4:.$C$11];2);"") ->  | F799: of:=IF([.B799]<>"";IF([.D799]<>"FIESTA";VLOOKUP(WEEKDAY([.B799];3);[Calendario.$A$4:.$C$11];3);0);"") ->  | G799: of:=IF(ISNUMBER([.F799]);[.F799]+[.G798];"") ->  | H799: of:=IF(AND([.G799]<=[Unidades.$G$26];[.G799]<=[Unidades.$F$18];[Unidades.$F$18]>0);[Unidades.$D$18]+1-COUNTIFS([Unidades.$O$3:.$O$17];">="&[.G799]);"") ->  | I799: of:=IF([.H798]<>[.H799];"INICIO";IF([.H800]<>[.H799];"FIN";"")) ->  | J799: of:=IF([.K798]<>[.K799];"INICIO";IF([.K800]<>[.K799];"FIN";"")) -> 
A800: of:=IF([.B800]<>"";TODAY()>[.B800];"") ->  | B800: of:=IFERROR(IF(([.B799]+1)<[Calendario.$F$5];[.B799]+1;"");"") ->  | C800: of:=IF(AND([.B800]>=[Calendario.$F$8];[.B800]<=[Calendario.$F$9];1);1;IF(AND([.B800]>=[Calendario.$F$12];[.B800]<=[Calendario.$F$13]);2;IF(AND([.B800]>=[Calendario.$F$16];[.B800]<=[Calendario.$F$17]);3;""))) ->  | D800: of:=IF(COUNTIF([Calendario.$H$4:.$H$48];[.B800])>0;"FIESTA";"") -> FIESTA | E800: of:=IF([.B800]<>"";VLOOKUP(WEEKDAY([.B800];3);[Calendario.$A$4:.$C$11];2);"") ->  | F800: of:=IF([.B800]<>"";IF([.D800]<>"FIESTA";VLOOKUP(WEEKDAY([.B800];3);[Calendario.$A$4:.$C$11];3);0);"") ->  | G800: of:=IF(ISNUMBER([.F800]);[.F800]+[.G799];"") ->  | H800: of:=IF(AND([.G800]<=[Unidades.$G$26];[.G800]<=[Unidades.$F$18];[Unidades.$F$18]>0);[Unidades.$D$18]+1-COUNTIFS([Unidades.$O$3:.$O$17];">="&[.G800]);"") ->  | I800: of:=IF([.H799]<>[.H800];"INICIO";IF([.H801]<>[.H800];"FIN";"")) ->  | J800: of:=IF([.K799]<>[.K800];"INICIO";IF([.K801]<>[.K800];"FIN";"")) -> 
A801: of:=IF([.B801]<>"";TODAY()>[.B801];"") ->  | B801: of:=IFERROR(IF(([.B800]+1)<[Calendario.$F$5];[.B800]+1;"");"") ->  | C801: of:=IF(AND([.B801]>=[Calendario.$F$8];[.B801]<=[Calendario.$F$9];1);1;IF(AND([.B801]>=[Calendario.$F$12];[.B801]<=[Calendario.$F$13]);2;IF(AND([.B801]>=[Calendario.$F$16];[.B801]<=[Calendario.$F$17]);3;""))) ->  | D801: of:=IF(COUNTIF([Calendario.$H$4:.$H$48];[.B801])>0;"FIESTA";"") -> FIESTA | E801: of:=IF([.B801]<>"";VLOOKUP(WEEKDAY([.B801];3);[Calendario.$A$4:.$C$11];2);"") ->  | F801: of:=IF([.B801]<>"";IF([.D801]<>"FIESTA";VLOOKUP(WEEKDAY([.B801];3);[Calendario.$A$4:.$C$11];3);0);"") ->  | G801: of:=IF(ISNUMBER([.F801]);[.F801]+[.G800];"") ->  | H801: of:=IF(AND([.G801]<=[Unidades.$G$26];[.G801]<=[Unidades.$F$18];[Unidades.$F$18]>0);[Unidades.$D$18]+1-COUNTIFS([Unidades.$O$3:.$O$17];">="&[.G801]);"") ->  | I801: of:=IF([.H800]<>[.H801];"INICIO";IF([.H802]<>[.H801];"FIN";"")) ->  | J801: of:=IF([.K800]<>[.K801];"INICIO";IF([.K802]<>[.K801];"FIN";"")) -> 
A802: of:=IF([.B802]<>"";TODAY()>[.B802];"") ->  | B802: of:=IFERROR(IF(([.B801]+1)<[Calendario.$F$5];[.B801]+1;"");"") ->  | C802: of:=IF(AND([.B802]>=[Calendario.$F$8];[.B802]<=[Calendario.$F$9];1);1;IF(AND([.B802]>=[Calendario.$F$12];[.B802]<=[Calendario.$F$13]);2;IF(AND([.B802]>=[Calendario.$F$16];[.B802]<=[Calendario.$F$17]);3;""))) ->  | D802: of:=IF(COUNTIF([Calendario.$H$4:.$H$48];[.B802])>0;"FIESTA";"") -> FIESTA | E802: of:=IF([.B802]<>"";VLOOKUP(WEEKDAY([.B802];3);[Calendario.$A$4:.$C$11];2);"") ->  | F802: of:=IF([.B802]<>"";IF([.D802]<>"FIESTA";VLOOKUP(WEEKDAY([.B802];3);[Calendario.$A$4:.$C$11];3);0);"") ->  | G802: of:=IF(ISNUMBER([.F802]);[.F802]+[.G801];"") ->  | H802: of:=IF(AND([.G802]<=[Unidades.$G$26];[.G802]<=[Unidades.$F$18];[Unidades.$F$18]>0);[Unidades.$D$18]+1-COUNTIFS([Unidades.$O$3:.$O$17];">="&[.G802]);"") ->  | I802: of:=IF([.H801]<>[.H802];"INICIO";IF([.H803]<>[.H802];"FIN";"")) ->  | J802: of:=IF([.K801]<>[.K802];"INICIO";IF([.K803]<>[.K802];"FIN";"")) -> 
A803: of:=IF([.B803]<>"";TODAY()>[.B803];"") ->  | B803: of:=IFERROR(IF(([.B802]+1)<[Calendario.$F$5];[.B802]+1;"");"") ->  | C803: of:=IF(AND([.B803]>=[Calendario.$F$8];[.B803]<=[Calendario.$F$9];1);1;IF(AND([.B803]>=[Calendario.$F$12];[.B803]<=[Calendario.$F$13]);2;IF(AND([.B803]>=[Calendario.$F$16];[.B803]<=[Calendario.$F$17]);3;""))) ->  | D803: of:=IF(COUNTIF([Calendario.$H$4:.$H$48];[.B803])>0;"FIESTA";"") -> FIESTA | E803: of:=IF([.B803]<>"";VLOOKUP(WEEKDAY([.B803];3);[Calendario.$A$4:.$C$11];2);"") ->  | F803: of:=IF([.B803]<>"";IF([.D803]<>"FIESTA";VLOOKUP(WEEKDAY([.B803];3);[Calendario.$A$4:.$C$11];3);0);"") ->  | G803: of:=IF(ISNUMBER([.F803]);[.F803]+[.G802];"") ->  | H803: of:=IF(AND([.G803]<=[Unidades.$G$26];[.G803]<=[Unidades.$F$18];[Unidades.$F$18]>0);[Unidades.$D$18]+1-COUNTIFS([Unidades.$O$3:.$O$17];">="&[.G803]);"") ->  | I803: of:=IF([.H802]<>[.H803];"INICIO";IF([.H804]<>[.H803];"FIN";"")) ->  | J803: of:=IF([.K802]<>[.K803];"INICIO";IF([.K804]<>[.K803];"FIN";"")) -> 
A804: of:=IF([.B804]<>"";TODAY()>[.B804];"") ->  | B804: of:=IFERROR(IF(([.B803]+1)<[Calendario.$F$5];[.B803]+1;"");"") ->  | C804: of:=IF(AND([.B804]>=[Calendario.$F$8];[.B804]<=[Calendario.$F$9];1);1;IF(AND([.B804]>=[Calendario.$F$12];[.B804]<=[Calendario.$F$13]);2;IF(AND([.B804]>=[Calendario.$F$16];[.B804]<=[Calendario.$F$17]);3;""))) ->  | D804: of:=IF(COUNTIF([Calendario.$H$4:.$H$48];[.B804])>0;"FIESTA";"") -> FIESTA | E804: of:=IF([.B804]<>"";VLOOKUP(WEEKDAY([.B804];3);[Calendario.$A$4:.$C$11];2);"") ->  | F804: of:=IF([.B804]<>"";IF([.D804]<>"FIESTA";VLOOKUP(WEEKDAY([.B804];3);[Calendario.$A$4:.$C$11];3);0);"") ->  | G804: of:=IF(ISNUMBER([.F804]);[.F804]+[.G803];"") ->  | H804: of:=IF(AND([.G804]<=[Unidades.$G$26];[.G804]<=[Unidades.$F$18];[Unidades.$F$18]>0);[Unidades.$D$18]+1-COUNTIFS([Unidades.$O$3:.$O$17];">="&[.G804]);"") ->  | I804: of:=IF([.H803]<>[.H804];"INICIO";IF([.H805]<>[.H804];"FIN";"")) ->  | J804: of:=IF([.K803]<>[.K804];"INICIO";IF([.K805]<>[.K804];"FIN";"")) -> 
A805: of:=IF([.B805]<>"";TODAY()>[.B805];"") ->  | B805: of:=IFERROR(IF(([.B804]+1)<[Calendario.$F$5];[.B804]+1;"");"") ->  | C805: of:=IF(AND([.B805]>=[Calendario.$F$8];[.B805]<=[Calendario.$F$9];1);1;IF(AND([.B805]>=[Calendario.$F$12];[.B805]<=[Calendario.$F$13]);2;IF(AND([.B805]>=[Calendario.$F$16];[.B805]<=[Calendario.$F$17]);3;""))) ->  | D805: of:=IF(COUNTIF([Calendario.$H$4:.$H$48];[.B805])>0;"FIESTA";"") -> FIESTA | E805: of:=IF([.B805]<>"";VLOOKUP(WEEKDAY([.B805];3);[Calendario.$A$4:.$C$11];2);"") ->  | F805: of:=IF([.B805]<>"";IF([.D805]<>"FIESTA";VLOOKUP(WEEKDAY([.B805];3);[Calendario.$A$4:.$C$11];3);0);"") ->  | G805: of:=IF(ISNUMBER([.F805]);[.F805]+[.G804];"") ->  | H805: of:=IF(AND([.G805]<=[Unidades.$G$26];[.G805]<=[Unidades.$F$18];[Unidades.$F$18]>0);[Unidades.$D$18]+1-COUNTIFS([Unidades.$O$3:.$O$17];">="&[.G805]);"") ->  | I805: of:=IF([.H804]<>[.H805];"INICIO";IF([.H806]<>[.H805];"FIN";"")) ->  | J805: of:=IF([.K804]<>[.K805];"INICIO";IF([.K806]<>[.K805];"FIN";"")) -> 
A806: of:=IF([.B806]<>"";TODAY()>[.B806];"") ->  | B806: of:=IFERROR(IF(([.B805]+1)<[Calendario.$F$5];[.B805]+1;"");"") ->  | C806: of:=IF(AND([.B806]>=[Calendario.$F$8];[.B806]<=[Calendario.$F$9];1);1;IF(AND([.B806]>=[Calendario.$F$12];[.B806]<=[Calendario.$F$13]);2;IF(AND([.B806]>=[Calendario.$F$16];[.B806]<=[Calendario.$F$17]);3;""))) ->  | D806: of:=IF(COUNTIF([Calendario.$H$4:.$H$48];[.B806])>0;"FIESTA";"") -> FIESTA | E806: of:=IF([.B806]<>"";VLOOKUP(WEEKDAY([.B806];3);[Calendario.$A$4:.$C$11];2);"") ->  | F806: of:=IF([.B806]<>"";IF([.D806]<>"FIESTA";VLOOKUP(WEEKDAY([.B806];3);[Calendario.$A$4:.$C$11];3);0);"") ->  | G806: of:=IF(ISNUMBER([.F806]);[.F806]+[.G805];"") ->  | H806: of:=IF(AND([.G806]<=[Unidades.$G$26];[.G806]<=[Unidades.$F$18];[Unidades.$F$18]>0);[Unidades.$D$18]+1-COUNTIFS([Unidades.$O$3:.$O$17];">="&[.G806]);"") ->  | I806: of:=IF([.H805]<>[.H806];"INICIO";IF([.H807]<>[.H806];"FIN";"")) ->  | J806: of:=IF([.K805]<>[.K806];"INICIO";IF([.K807]<>[.K806];"FIN";"")) -> 
A807: of:=IF([.B807]<>"";TODAY()>[.B807];"") ->  | B807: of:=IFERROR(IF(([.B806]+1)<[Calendario.$F$5];[.B806]+1;"");"") ->  | C807: of:=IF(AND([.B807]>=[Calendario.$F$8];[.B807]<=[Calendario.$F$9];1);1;IF(AND([.B807]>=[Calendario.$F$12];[.B807]<=[Calendario.$F$13]);2;IF(AND([.B807]>=[Calendario.$F$16];[.B807]<=[Calendario.$F$17]);3;""))) ->  | D807: of:=IF(COUNTIF([Calendario.$H$4:.$H$48];[.B807])>0;"FIESTA";"") -> FIESTA | E807: of:=IF([.B807]<>"";VLOOKUP(WEEKDAY([.B807];3);[Calendario.$A$4:.$C$11];2);"") ->  | F807: of:=IF([.B807]<>"";IF([.D807]<>"FIESTA";VLOOKUP(WEEKDAY([.B807];3);[Calendario.$A$4:.$C$11];3);0);"") ->  | G807: of:=IF(ISNUMBER([.F807]);[.F807]+[.G806];"") ->  | H807: of:=IF(AND([.G807]<=[Unidades.$G$26];[.G807]<=[Unidades.$F$18];[Unidades.$F$18]>0);[Unidades.$D$18]+1-COUNTIFS([Unidades.$O$3:.$O$17];">="&[.G807]);"") ->  | I807: of:=IF([.H806]<>[.H807];"INICIO";IF([.H808]<>[.H807];"FIN";"")) ->  | J807: of:=IF([.K806]<>[.K807];"INICIO";IF([.K808]<>[.K807];"FIN";"")) -> 
A808: of:=IF([.B808]<>"";TODAY()>[.B808];"") ->  | B808: of:=IFERROR(IF(([.B807]+1)<[Calendario.$F$5];[.B807]+1;"");"") ->  | C808: of:=IF(AND([.B808]>=[Calendario.$F$8];[.B808]<=[Calendario.$F$9];1);1;IF(AND([.B808]>=[Calendario.$F$12];[.B808]<=[Calendario.$F$13]);2;IF(AND([.B808]>=[Calendario.$F$16];[.B808]<=[Calendario.$F$17]);3;""))) ->  | D808: of:=IF(COUNTIF([Calendario.$H$4:.$H$48];[.B808])>0;"FIESTA";"") -> FIESTA | E808: of:=IF([.B808]<>"";VLOOKUP(WEEKDAY([.B808];3);[Calendario.$A$4:.$C$11];2);"") ->  | F808: of:=IF([.B808]<>"";IF([.D808]<>"FIESTA";VLOOKUP(WEEKDAY([.B808];3);[Calendario.$A$4:.$C$11];3);0);"") ->  | G808: of:=IF(ISNUMBER([.F808]);[.F808]+[.G807];"") ->  | H808: of:=IF(AND([.G808]<=[Unidades.$G$26];[.G808]<=[Unidades.$F$18];[Unidades.$F$18]>0);[Unidades.$D$18]+1-COUNTIFS([Unidades.$O$3:.$O$17];">="&[.G808]);"") ->  | I808: of:=IF([.H807]<>[.H808];"INICIO";IF([.H809]<>[.H808];"FIN";"")) ->  | J808: of:=IF([.K807]<>[.K808];"INICIO";IF([.K809]<>[.K808];"FIN";"")) -> 
A809: of:=IF([.B809]<>"";TODAY()>[.B809];"") ->  | B809: of:=IFERROR(IF(([.B808]+1)<[Calendario.$F$5];[.B808]+1;"");"") ->  | C809: of:=IF(AND([.B809]>=[Calendario.$F$8];[.B809]<=[Calendario.$F$9];1);1;IF(AND([.B809]>=[Calendario.$F$12];[.B809]<=[Calendario.$F$13]);2;IF(AND([.B809]>=[Calendario.$F$16];[.B809]<=[Calendario.$F$17]);3;""))) ->  | D809: of:=IF(COUNTIF([Calendario.$H$4:.$H$48];[.B809])>0;"FIESTA";"") -> FIESTA | E809: of:=IF([.B809]<>"";VLOOKUP(WEEKDAY([.B809];3);[Calendario.$A$4:.$C$11];2);"") ->  | F809: of:=IF([.B809]<>"";IF([.D809]<>"FIESTA";VLOOKUP(WEEKDAY([.B809];3);[Calendario.$A$4:.$C$11];3);0);"") ->  | G809: of:=IF(ISNUMBER([.F809]);[.F809]+[.G808];"") ->  | H809: of:=IF(AND([.G809]<=[Unidades.$G$26];[.G809]<=[Unidades.$F$18];[Unidades.$F$18]>0);[Unidades.$D$18]+1-COUNTIFS([Unidades.$O$3:.$O$17];">="&[.G809]);"") ->  | I809: of:=IF([.H808]<>[.H809];"INICIO";IF([.H810]<>[.H809];"FIN";"")) ->  | J809: of:=IF([.K808]<>[.K809];"INICIO";IF([.K810]<>[.K809];"FIN";"")) -> 
A810: of:=IF([.B810]<>"";TODAY()>[.B810];"") ->  | B810: of:=IFERROR(IF(([.B809]+1)<[Calendario.$F$5];[.B809]+1;"");"") ->  | C810: of:=IF(AND([.B810]>=[Calendario.$F$8];[.B810]<=[Calendario.$F$9];1);1;IF(AND([.B810]>=[Calendario.$F$12];[.B810]<=[Calendario.$F$13]);2;IF(AND([.B810]>=[Calendario.$F$16];[.B810]<=[Calendario.$F$17]);3;""))) ->  | D810: of:=IF(COUNTIF([Calendario.$H$4:.$H$48];[.B810])>0;"FIESTA";"") -> FIESTA | E810: of:=IF([.B810]<>"";VLOOKUP(WEEKDAY([.B810];3);[Calendario.$A$4:.$C$11];2);"") ->  | F810: of:=IF([.B810]<>"";IF([.D810]<>"FIESTA";VLOOKUP(WEEKDAY([.B810];3);[Calendario.$A$4:.$C$11];3);0);"") ->  | G810: of:=IF(ISNUMBER([.F810]);[.F810]+[.G809];"") ->  | H810: of:=IF(AND([.G810]<=[Unidades.$G$26];[.G810]<=[Unidades.$F$18];[Unidades.$F$18]>0);[Unidades.$D$18]+1-COUNTIFS([Unidades.$O$3:.$O$17];">="&[.G810]);"") ->  | I810: of:=IF([.H809]<>[.H810];"INICIO";IF([.H811]<>[.H810];"FIN";"")) ->  | J810: of:=IF([.K809]<>[.K810];"INICIO";IF([.K811]<>[.K810];"FIN";"")) -> 
A811: of:=IF([.B811]<>"";TODAY()>[.B811];"") ->  | B811: of:=IFERROR(IF(([.B810]+1)<[Calendario.$F$5];[.B810]+1;"");"") ->  | C811: of:=IF(AND([.B811]>=[Calendario.$F$8];[.B811]<=[Calendario.$F$9];1);1;IF(AND([.B811]>=[Calendario.$F$12];[.B811]<=[Calendario.$F$13]);2;IF(AND([.B811]>=[Calendario.$F$16];[.B811]<=[Calendario.$F$17]);3;""))) ->  | D811: of:=IF(COUNTIF([Calendario.$H$4:.$H$48];[.B811])>0;"FIESTA";"") -> FIESTA | E811: of:=IF([.B811]<>"";VLOOKUP(WEEKDAY([.B811];3);[Calendario.$A$4:.$C$11];2);"") ->  | F811: of:=IF([.B811]<>"";IF([.D811]<>"FIESTA";VLOOKUP(WEEKDAY([.B811];3);[Calendario.$A$4:.$C$11];3);0);"") ->  | G811: of:=IF(ISNUMBER([.F811]);[.F811]+[.G810];"") ->  | H811: of:=IF(AND([.G811]<=[Unidades.$G$26];[.G811]<=[Unidades.$F$18];[Unidades.$F$18]>0);[Unidades.$D$18]+1-COUNTIFS([Unidades.$O$3:.$O$17];">="&[.G811]);"") ->  | I811: of:=IF([.H810]<>[.H811];"INICIO";IF([.H812]<>[.H811];"FIN";"")) ->  | J811: of:=IF([.K810]<>[.K811];"INICIO";IF([.K812]<>[.K811];"FIN";"")) -> 
A812: of:=IF([.B812]<>"";TODAY()>[.B812];"") ->  | B812: of:=IFERROR(IF(([.B811]+1)<[Calendario.$F$5];[.B811]+1;"");"") ->  | C812: of:=IF(AND([.B812]>=[Calendario.$F$8];[.B812]<=[Calendario.$F$9];1);1;IF(AND([.B812]>=[Calendario.$F$12];[.B812]<=[Calendario.$F$13]);2;IF(AND([.B812]>=[Calendario.$F$16];[.B812]<=[Calendario.$F$17]);3;""))) ->  | D812: of:=IF(COUNTIF([Calendario.$H$4:.$H$48];[.B812])>0;"FIESTA";"") -> FIESTA | E812: of:=IF([.B812]<>"";VLOOKUP(WEEKDAY([.B812];3);[Calendario.$A$4:.$C$11];2);"") ->  | F812: of:=IF([.B812]<>"";IF([.D812]<>"FIESTA";VLOOKUP(WEEKDAY([.B812];3);[Calendario.$A$4:.$C$11];3);0);"") ->  | G812: of:=IF(ISNUMBER([.F812]);[.F812]+[.G811];"") ->  | H812: of:=IF(AND([.G812]<=[Unidades.$G$26];[.G812]<=[Unidades.$F$18];[Unidades.$F$18]>0);[Unidades.$D$18]+1-COUNTIFS([Unidades.$O$3:.$O$17];">="&[.G812]);"") ->  | I812: of:=IF([.H811]<>[.H812];"INICIO";IF([.H813]<>[.H812];"FIN";"")) ->  | J812: of:=IF([.K811]<>[.K812];"INICIO";IF([.K813]<>[.K812];"FIN";"")) -> 
A813: of:=IF([.B813]<>"";TODAY()>[.B813];"") ->  | B813: of:=IFERROR(IF(([.B812]+1)<[Calendario.$F$5];[.B812]+1;"");"") ->  | C813: of:=IF(AND([.B813]>=[Calendario.$F$8];[.B813]<=[Calendario.$F$9];1);1;IF(AND([.B813]>=[Calendario.$F$12];[.B813]<=[Calendario.$F$13]);2;IF(AND([.B813]>=[Calendario.$F$16];[.B813]<=[Calendario.$F$17]);3;""))) ->  | D813: of:=IF(COUNTIF([Calendario.$H$4:.$H$48];[.B813])>0;"FIESTA";"") -> FIESTA | E813: of:=IF([.B813]<>"";VLOOKUP(WEEKDAY([.B813];3);[Calendario.$A$4:.$C$11];2);"") ->  | F813: of:=IF([.B813]<>"";IF([.D813]<>"FIESTA";VLOOKUP(WEEKDAY([.B813];3);[Calendario.$A$4:.$C$11];3);0);"") ->  | G813: of:=IF(ISNUMBER([.F813]);[.F813]+[.G812];"") ->  | H813: of:=IF(AND([.G813]<=[Unidades.$G$26];[.G813]<=[Unidades.$F$18];[Unidades.$F$18]>0);[Unidades.$D$18]+1-COUNTIFS([Unidades.$O$3:.$O$17];">="&[.G813]);"") ->  | I813: of:=IF([.H812]<>[.H813];"INICIO";IF([.H814]<>[.H813];"FIN";"")) ->  | J813: of:=IF([.K812]<>[.K813];"INICIO";IF([.K814]<>[.K813];"FIN";"")) -> 
A814: of:=IF([.B814]<>"";TODAY()>[.B814];"") ->  | B814: of:=IFERROR(IF(([.B813]+1)<[Calendario.$F$5];[.B813]+1;"");"") ->  | C814: of:=IF(AND([.B814]>=[Calendario.$F$8];[.B814]<=[Calendario.$F$9];1);1;IF(AND([.B814]>=[Calendario.$F$12];[.B814]<=[Calendario.$F$13]);2;IF(AND([.B814]>=[Calendario.$F$16];[.B814]<=[Calendario.$F$17]);3;""))) ->  | D814: of:=IF(COUNTIF([Calendario.$H$4:.$H$48];[.B814])>0;"FIESTA";"") -> FIESTA | E814: of:=IF([.B814]<>"";VLOOKUP(WEEKDAY([.B814];3);[Calendario.$A$4:.$C$11];2);"") ->  | F814: of:=IF([.B814]<>"";IF([.D814]<>"FIESTA";VLOOKUP(WEEKDAY([.B814];3);[Calendario.$A$4:.$C$11];3);0);"") ->  | G814: of:=IF(ISNUMBER([.F814]);[.F814]+[.G813];"") ->  | H814: of:=IF(AND([.G814]<=[Unidades.$G$26];[.G814]<=[Unidades.$F$18];[Unidades.$F$18]>0);[Unidades.$D$18]+1-COUNTIFS([Unidades.$O$3:.$O$17];">="&[.G814]);"") ->  | I814: of:=IF([.H813]<>[.H814];"INICIO";IF([.H815]<>[.H814];"FIN";"")) ->  | J814: of:=IF([.K813]<>[.K814];"INICIO";IF([.K815]<>[.K814];"FIN";"")) -> 
A815: of:=IF([.B815]<>"";TODAY()>[.B815];"") ->  | B815: of:=IFERROR(IF(([.B814]+1)<[Calendario.$F$5];[.B814]+1;"");"") ->  | C815: of:=IF(AND([.B815]>=[Calendario.$F$8];[.B815]<=[Calendario.$F$9];1);1;IF(AND([.B815]>=[Calendario.$F$12];[.B815]<=[Calendario.$F$13]);2;IF(AND([.B815]>=[Calendario.$F$16];[.B815]<=[Calendario.$F$17]);3;""))) ->  | D815: of:=IF(COUNTIF([Calendario.$H$4:.$H$48];[.B815])>0;"FIESTA";"") -> FIESTA | E815: of:=IF([.B815]<>"";VLOOKUP(WEEKDAY([.B815];3);[Calendario.$A$4:.$C$11];2);"") ->  | F815: of:=IF([.B815]<>"";IF([.D815]<>"FIESTA";VLOOKUP(WEEKDAY([.B815];3);[Calendario.$A$4:.$C$11];3);0);"") ->  | G815: of:=IF(ISNUMBER([.F815]);[.F815]+[.G814];"") ->  | H815: of:=IF(AND([.G815]<=[Unidades.$G$26];[.G815]<=[Unidades.$F$18];[Unidades.$F$18]>0);[Unidades.$D$18]+1-COUNTIFS([Unidades.$O$3:.$O$17];">="&[.G815]);"") ->  | I815: of:=IF([.H814]<>[.H815];"INICIO";IF([.H816]<>[.H815];"FIN";"")) ->  | J815: of:=IF([.K814]<>[.K815];"INICIO";IF([.K816]<>[.K815];"FIN";"")) -> 
A816: of:=IF([.B816]<>"";TODAY()>[.B816];"") ->  | B816: of:=IFERROR(IF(([.B815]+1)<[Calendario.$F$5];[.B815]+1;"");"") ->  | C816: of:=IF(AND([.B816]>=[Calendario.$F$8];[.B816]<=[Calendario.$F$9];1);1;IF(AND([.B816]>=[Calendario.$F$12];[.B816]<=[Calendario.$F$13]);2;IF(AND([.B816]>=[Calendario.$F$16];[.B816]<=[Calendario.$F$17]);3;""))) ->  | D816: of:=IF(COUNTIF([Calendario.$H$4:.$H$48];[.B816])>0;"FIESTA";"") -> FIESTA | E816: of:=IF([.B816]<>"";VLOOKUP(WEEKDAY([.B816];3);[Calendario.$A$4:.$C$11];2);"") ->  | F816: of:=IF([.B816]<>"";IF([.D816]<>"FIESTA";VLOOKUP(WEEKDAY([.B816];3);[Calendario.$A$4:.$C$11];3);0);"") ->  | G816: of:=IF(ISNUMBER([.F816]);[.F816]+[.G815];"") ->  | H816: of:=IF(AND([.G816]<=[Unidades.$G$26];[.G816]<=[Unidades.$F$18];[Unidades.$F$18]>0);[Unidades.$D$18]+1-COUNTIFS([Unidades.$O$3:.$O$17];">="&[.G816]);"") ->  | I816: of:=IF([.H815]<>[.H816];"INICIO";IF([.H817]<>[.H816];"FIN";"")) ->  | J816: of:=IF([.K815]<>[.K816];"INICIO";IF([.K817]<>[.K816];"FIN";"")) -> 
A817: of:=IF([.B817]<>"";TODAY()>[.B817];"") ->  | B817: of:=IFERROR(IF(([.B816]+1)<[Calendario.$F$5];[.B816]+1;"");"") ->  | C817: of:=IF(AND([.B817]>=[Calendario.$F$8];[.B817]<=[Calendario.$F$9];1);1;IF(AND([.B817]>=[Calendario.$F$12];[.B817]<=[Calendario.$F$13]);2;IF(AND([.B817]>=[Calendario.$F$16];[.B817]<=[Calendario.$F$17]);3;""))) ->  | D817: of:=IF(COUNTIF([Calendario.$H$4:.$H$48];[.B817])>0;"FIESTA";"") -> FIESTA | E817: of:=IF([.B817]<>"";VLOOKUP(WEEKDAY([.B817];3);[Calendario.$A$4:.$C$11];2);"") ->  | F817: of:=IF([.B817]<>"";IF([.D817]<>"FIESTA";VLOOKUP(WEEKDAY([.B817];3);[Calendario.$A$4:.$C$11];3);0);"") ->  | G817: of:=IF(ISNUMBER([.F817]);[.F817]+[.G816];"") ->  | H817: of:=IF(AND([.G817]<=[Unidades.$G$26];[.G817]<=[Unidades.$F$18];[Unidades.$F$18]>0);[Unidades.$D$18]+1-COUNTIFS([Unidades.$O$3:.$O$17];">="&[.G817]);"") ->  | I817: of:=IF([.H816]<>[.H817];"INICIO";IF([.H818]<>[.H817];"FIN";"")) ->  | J817: of:=IF([.K816]<>[.K817];"INICIO";IF([.K818]<>[.K817];"FIN";"")) -> 
A818: of:=IF([.B818]<>"";TODAY()>[.B818];"") ->  | B818: of:=IFERROR(IF(([.B817]+1)<[Calendario.$F$5];[.B817]+1;"");"") ->  | C818: of:=IF(AND([.B818]>=[Calendario.$F$8];[.B818]<=[Calendario.$F$9];1);1;IF(AND([.B818]>=[Calendario.$F$12];[.B818]<=[Calendario.$F$13]);2;IF(AND([.B818]>=[Calendario.$F$16];[.B818]<=[Calendario.$F$17]);3;""))) ->  | D818: of:=IF(COUNTIF([Calendario.$H$4:.$H$48];[.B818])>0;"FIESTA";"") -> FIESTA | E818: of:=IF([.B818]<>"";VLOOKUP(WEEKDAY([.B818];3);[Calendario.$A$4:.$C$11];2);"") ->  | F818: of:=IF([.B818]<>"";IF([.D818]<>"FIESTA";VLOOKUP(WEEKDAY([.B818];3);[Calendario.$A$4:.$C$11];3);0);"") ->  | G818: of:=IF(ISNUMBER([.F818]);[.F818]+[.G817];"") ->  | H818: of:=IF(AND([.G818]<=[Unidades.$G$26];[.G818]<=[Unidades.$F$18];[Unidades.$F$18]>0);[Unidades.$D$18]+1-COUNTIFS([Unidades.$O$3:.$O$17];">="&[.G818]);"") ->  | I818: of:=IF([.H817]<>[.H818];"INICIO";IF([.H819]<>[.H818];"FIN";"")) ->  | J818: of:=IF([.K817]<>[.K818];"INICIO";IF([.K819]<>[.K818];"FIN";"")) -> 
A819: of:=IF([.B819]<>"";TODAY()>[.B819];"") ->  | B819: of:=IFERROR(IF(([.B818]+1)<[Calendario.$F$5];[.B818]+1;"");"") ->  | C819: of:=IF(AND([.B819]>=[Calendario.$F$8];[.B819]<=[Calendario.$F$9];1);1;IF(AND([.B819]>=[Calendario.$F$12];[.B819]<=[Calendario.$F$13]);2;IF(AND([.B819]>=[Calendario.$F$16];[.B819]<=[Calendario.$F$17]);3;""))) ->  | D819: of:=IF(COUNTIF([Calendario.$H$4:.$H$48];[.B819])>0;"FIESTA";"") -> FIESTA | E819: of:=IF([.B819]<>"";VLOOKUP(WEEKDAY([.B819];3);[Calendario.$A$4:.$C$11];2);"") ->  | F819: of:=IF([.B819]<>"";IF([.D819]<>"FIESTA";VLOOKUP(WEEKDAY([.B819];3);[Calendario.$A$4:.$C$11];3);0);"") ->  | G819: of:=IF(ISNUMBER([.F819]);[.F819]+[.G818];"") ->  | H819: of:=IF(AND([.G819]<=[Unidades.$G$26];[.G819]<=[Unidades.$F$18];[Unidades.$F$18]>0);[Unidades.$D$18]+1-COUNTIFS([Unidades.$O$3:.$O$17];">="&[.G819]);"") ->  | I819: of:=IF([.H818]<>[.H819];"INICIO";IF([.H820]<>[.H819];"FIN";"")) ->  | J819: of:=IF([.K818]<>[.K819];"INICIO";IF([.K820]<>[.K819];"FIN";"")) -> 
A820: of:=IF([.B820]<>"";TODAY()>[.B820];"") ->  | B820: of:=IFERROR(IF(([.B819]+1)<[Calendario.$F$5];[.B819]+1;"");"") ->  | C820: of:=IF(AND([.B820]>=[Calendario.$F$8];[.B820]<=[Calendario.$F$9];1);1;IF(AND([.B820]>=[Calendario.$F$12];[.B820]<=[Calendario.$F$13]);2;IF(AND([.B820]>=[Calendario.$F$16];[.B820]<=[Calendario.$F$17]);3;""))) ->  | D820: of:=IF(COUNTIF([Calendario.$H$4:.$H$48];[.B820])>0;"FIESTA";"") -> FIESTA | E820: of:=IF([.B820]<>"";VLOOKUP(WEEKDAY([.B820];3);[Calendario.$A$4:.$C$11];2);"") ->  | F820: of:=IF([.B820]<>"";IF([.D820]<>"FIESTA";VLOOKUP(WEEKDAY([.B820];3);[Calendario.$A$4:.$C$11];3);0);"") ->  | G820: of:=IF(ISNUMBER([.F820]);[.F820]+[.G819];"") ->  | H820: of:=IF(AND([.G820]<=[Unidades.$G$26];[.G820]<=[Unidades.$F$18];[Unidades.$F$18]>0);[Unidades.$D$18]+1-COUNTIFS([Unidades.$O$3:.$O$17];">="&[.G820]);"") ->  | I820: of:=IF([.H819]<>[.H820];"INICIO";IF([.H821]<>[.H820];"FIN";"")) ->  | J820: of:=IF([.K819]<>[.K820];"INICIO";IF([.K821]<>[.K820];"FIN";"")) -> 
A821: of:=IF([.B821]<>"";TODAY()>[.B821];"") ->  | B821: of:=IFERROR(IF(([.B820]+1)<[Calendario.$F$5];[.B820]+1;"");"") ->  | C821: of:=IF(AND([.B821]>=[Calendario.$F$8];[.B821]<=[Calendario.$F$9];1);1;IF(AND([.B821]>=[Calendario.$F$12];[.B821]<=[Calendario.$F$13]);2;IF(AND([.B821]>=[Calendario.$F$16];[.B821]<=[Calendario.$F$17]);3;""))) ->  | D821: of:=IF(COUNTIF([Calendario.$H$4:.$H$48];[.B821])>0;"FIESTA";"") -> FIESTA | E821: of:=IF([.B821]<>"";VLOOKUP(WEEKDAY([.B821];3);[Calendario.$A$4:.$C$11];2);"") ->  | F821: of:=IF([.B821]<>"";IF([.D821]<>"FIESTA";VLOOKUP(WEEKDAY([.B821];3);[Calendario.$A$4:.$C$11];3);0);"") ->  | G821: of:=IF(ISNUMBER([.F821]);[.F821]+[.G820];"") ->  | H821: of:=IF(AND([.G821]<=[Unidades.$G$26];[.G821]<=[Unidades.$F$18];[Unidades.$F$18]>0);[Unidades.$D$18]+1-COUNTIFS([Unidades.$O$3:.$O$17];">="&[.G821]);"") ->  | I821: of:=IF([.H820]<>[.H821];"INICIO";IF([.H822]<>[.H821];"FIN";"")) ->  | J821: of:=IF([.K820]<>[.K821];"INICIO";IF([.K822]<>[.K821];"FIN";"")) -> 
A822: of:=IF([.B822]<>"";TODAY()>[.B822];"") ->  | B822: of:=IFERROR(IF(([.B821]+1)<[Calendario.$F$5];[.B821]+1;"");"") ->  | C822: of:=IF(AND([.B822]>=[Calendario.$F$8];[.B822]<=[Calendario.$F$9];1);1;IF(AND([.B822]>=[Calendario.$F$12];[.B822]<=[Calendario.$F$13]);2;IF(AND([.B822]>=[Calendario.$F$16];[.B822]<=[Calendario.$F$17]);3;""))) ->  | D822: of:=IF(COUNTIF([Calendario.$H$4:.$H$48];[.B822])>0;"FIESTA";"") -> FIESTA | E822: of:=IF([.B822]<>"";VLOOKUP(WEEKDAY([.B822];3);[Calendario.$A$4:.$C$11];2);"") ->  | F822: of:=IF([.B822]<>"";IF([.D822]<>"FIESTA";VLOOKUP(WEEKDAY([.B822];3);[Calendario.$A$4:.$C$11];3);0);"") ->  | G822: of:=IF(ISNUMBER([.F822]);[.F822]+[.G821];"") ->  | H822: of:=IF(AND([.G822]<=[Unidades.$G$26];[.G822]<=[Unidades.$F$18];[Unidades.$F$18]>0);[Unidades.$D$18]+1-COUNTIFS([Unidades.$O$3:.$O$17];">="&[.G822]);"") ->  | I822: of:=IF([.H821]<>[.H822];"INICIO";IF([.H823]<>[.H822];"FIN";"")) ->  | J822: of:=IF([.K821]<>[.K822];"INICIO";IF([.K823]<>[.K822];"FIN";"")) -> 
A823: of:=IF([.B823]<>"";TODAY()>[.B823];"") ->  | B823: of:=IFERROR(IF(([.B822]+1)<[Calendario.$F$5];[.B822]+1;"");"") ->  | C823: of:=IF(AND([.B823]>=[Calendario.$F$8];[.B823]<=[Calendario.$F$9];1);1;IF(AND([.B823]>=[Calendario.$F$12];[.B823]<=[Calendario.$F$13]);2;IF(AND([.B823]>=[Calendario.$F$16];[.B823]<=[Calendario.$F$17]);3;""))) ->  | D823: of:=IF(COUNTIF([Calendario.$H$4:.$H$48];[.B823])>0;"FIESTA";"") -> FIESTA | E823: of:=IF([.B823]<>"";VLOOKUP(WEEKDAY([.B823];3);[Calendario.$A$4:.$C$11];2);"") ->  | F823: of:=IF([.B823]<>"";IF([.D823]<>"FIESTA";VLOOKUP(WEEKDAY([.B823];3);[Calendario.$A$4:.$C$11];3);0);"") ->  | G823: of:=IF(ISNUMBER([.F823]);[.F823]+[.G822];"") ->  | H823: of:=IF(AND([.G823]<=[Unidades.$G$26];[.G823]<=[Unidades.$F$18];[Unidades.$F$18]>0);[Unidades.$D$18]+1-COUNTIFS([Unidades.$O$3:.$O$17];">="&[.G823]);"") ->  | I823: of:=IF([.H822]<>[.H823];"INICIO";IF([.H824]<>[.H823];"FIN";"")) ->  | J823: of:=IF([.K822]<>[.K823];"INICIO";IF([.K824]<>[.K823];"FIN";"")) -> 
A824: of:=IF([.B824]<>"";TODAY()>[.B824];"") ->  | B824: of:=IFERROR(IF(([.B823]+1)<[Calendario.$F$5];[.B823]+1;"");"") ->  | C824: of:=IF(AND([.B824]>=[Calendario.$F$8];[.B824]<=[Calendario.$F$9];1);1;IF(AND([.B824]>=[Calendario.$F$12];[.B824]<=[Calendario.$F$13]);2;IF(AND([.B824]>=[Calendario.$F$16];[.B824]<=[Calendario.$F$17]);3;""))) ->  | D824: of:=IF(COUNTIF([Calendario.$H$4:.$H$48];[.B824])>0;"FIESTA";"") -> FIESTA | E824: of:=IF([.B824]<>"";VLOOKUP(WEEKDAY([.B824];3);[Calendario.$A$4:.$C$11];2);"") ->  | F824: of:=IF([.B824]<>"";IF([.D824]<>"FIESTA";VLOOKUP(WEEKDAY([.B824];3);[Calendario.$A$4:.$C$11];3);0);"") ->  | G824: of:=IF(ISNUMBER([.F824]);[.F824]+[.G823];"") ->  | H824: of:=IF(AND([.G824]<=[Unidades.$G$26];[.G824]<=[Unidades.$F$18];[Unidades.$F$18]>0);[Unidades.$D$18]+1-COUNTIFS([Unidades.$O$3:.$O$17];">="&[.G824]);"") ->  | I824: of:=IF([.H823]<>[.H824];"INICIO";IF([.H825]<>[.H824];"FIN";"")) ->  | J824: of:=IF([.K823]<>[.K824];"INICIO";IF([.K825]<>[.K824];"FIN";"")) -> 
A825: of:=IF([.B825]<>"";TODAY()>[.B825];"") ->  | B825: of:=IFERROR(IF(([.B824]+1)<[Calendario.$F$5];[.B824]+1;"");"") ->  | C825: of:=IF(AND([.B825]>=[Calendario.$F$8];[.B825]<=[Calendario.$F$9];1);1;IF(AND([.B825]>=[Calendario.$F$12];[.B825]<=[Calendario.$F$13]);2;IF(AND([.B825]>=[Calendario.$F$16];[.B825]<=[Calendario.$F$17]);3;""))) ->  | D825: of:=IF(COUNTIF([Calendario.$H$4:.$H$48];[.B825])>0;"FIESTA";"") -> FIESTA | E825: of:=IF([.B825]<>"";VLOOKUP(WEEKDAY([.B825];3);[Calendario.$A$4:.$C$11];2);"") ->  | F825: of:=IF([.B825]<>"";IF([.D825]<>"FIESTA";VLOOKUP(WEEKDAY([.B825];3);[Calendario.$A$4:.$C$11];3);0);"") ->  | G825: of:=IF(ISNUMBER([.F825]);[.F825]+[.G824];"") ->  | H825: of:=IF(AND([.G825]<=[Unidades.$G$26];[.G825]<=[Unidades.$F$18];[Unidades.$F$18]>0);[Unidades.$D$18]+1-COUNTIFS([Unidades.$O$3:.$O$17];">="&[.G825]);"") ->  | I825: of:=IF([.H824]<>[.H825];"INICIO";IF([.H826]<>[.H825];"FIN";"")) ->  | J825: of:=IF([.K824]<>[.K825];"INICIO";IF([.K826]<>[.K825];"FIN";"")) -> 
A826: of:=IF([.B826]<>"";TODAY()>[.B826];"") ->  | B826: of:=IFERROR(IF(([.B825]+1)<[Calendario.$F$5];[.B825]+1;"");"") ->  | C826: of:=IF(AND([.B826]>=[Calendario.$F$8];[.B826]<=[Calendario.$F$9];1);1;IF(AND([.B826]>=[Calendario.$F$12];[.B826]<=[Calendario.$F$13]);2;IF(AND([.B826]>=[Calendario.$F$16];[.B826]<=[Calendario.$F$17]);3;""))) ->  | D826: of:=IF(COUNTIF([Calendario.$H$4:.$H$48];[.B826])>0;"FIESTA";"") -> FIESTA | E826: of:=IF([.B826]<>"";VLOOKUP(WEEKDAY([.B826];3);[Calendario.$A$4:.$C$11];2);"") ->  | F826: of:=IF([.B826]<>"";IF([.D826]<>"FIESTA";VLOOKUP(WEEKDAY([.B826];3);[Calendario.$A$4:.$C$11];3);0);"") ->  | G826: of:=IF(ISNUMBER([.F826]);[.F826]+[.G825];"") ->  | H826: of:=IF(AND([.G826]<=[Unidades.$G$26];[.G826]<=[Unidades.$F$18];[Unidades.$F$18]>0);[Unidades.$D$18]+1-COUNTIFS([Unidades.$O$3:.$O$17];">="&[.G826]);"") ->  | I826: of:=IF([.H825]<>[.H826];"INICIO";IF([.H827]<>[.H826];"FIN";"")) ->  | J826: of:=IF([.K825]<>[.K826];"INICIO";IF([.K827]<>[.K826];"FIN";"")) -> 
A827: of:=IF([.B827]<>"";TODAY()>[.B827];"") ->  | B827: of:=IFERROR(IF(([.B826]+1)<[Calendario.$F$5];[.B826]+1;"");"") ->  | C827: of:=IF(AND([.B827]>=[Calendario.$F$8];[.B827]<=[Calendario.$F$9];1);1;IF(AND([.B827]>=[Calendario.$F$12];[.B827]<=[Calendario.$F$13]);2;IF(AND([.B827]>=[Calendario.$F$16];[.B827]<=[Calendario.$F$17]);3;""))) ->  | D827: of:=IF(COUNTIF([Calendario.$H$4:.$H$48];[.B827])>0;"FIESTA";"") -> FIESTA | E827: of:=IF([.B827]<>"";VLOOKUP(WEEKDAY([.B827];3);[Calendario.$A$4:.$C$11];2);"") ->  | F827: of:=IF([.B827]<>"";IF([.D827]<>"FIESTA";VLOOKUP(WEEKDAY([.B827];3);[Calendario.$A$4:.$C$11];3);0);"") ->  | G827: of:=IF(ISNUMBER([.F827]);[.F827]+[.G826];"") ->  | H827: of:=IF(AND([.G827]<=[Unidades.$G$26];[.G827]<=[Unidades.$F$18];[Unidades.$F$18]>0);[Unidades.$D$18]+1-COUNTIFS([Unidades.$O$3:.$O$17];">="&[.G827]);"") ->  | I827: of:=IF([.H826]<>[.H827];"INICIO";IF([.H828]<>[.H827];"FIN";"")) ->  | J827: of:=IF([.K826]<>[.K827];"INICIO";IF([.K828]<>[.K827];"FIN";"")) -> 
A828: of:=IF([.B828]<>"";TODAY()>[.B828];"") ->  | B828: of:=IFERROR(IF(([.B827]+1)<[Calendario.$F$5];[.B827]+1;"");"") ->  | C828: of:=IF(AND([.B828]>=[Calendario.$F$8];[.B828]<=[Calendario.$F$9];1);1;IF(AND([.B828]>=[Calendario.$F$12];[.B828]<=[Calendario.$F$13]);2;IF(AND([.B828]>=[Calendario.$F$16];[.B828]<=[Calendario.$F$17]);3;""))) ->  | D828: of:=IF(COUNTIF([Calendario.$H$4:.$H$48];[.B828])>0;"FIESTA";"") -> FIESTA | E828: of:=IF([.B828]<>"";VLOOKUP(WEEKDAY([.B828];3);[Calendario.$A$4:.$C$11];2);"") ->  | F828: of:=IF([.B828]<>"";IF([.D828]<>"FIESTA";VLOOKUP(WEEKDAY([.B828];3);[Calendario.$A$4:.$C$11];3);0);"") ->  | G828: of:=IF(ISNUMBER([.F828]);[.F828]+[.G827];"") ->  | H828: of:=IF(AND([.G828]<=[Unidades.$G$26];[.G828]<=[Unidades.$F$18];[Unidades.$F$18]>0);[Unidades.$D$18]+1-COUNTIFS([Unidades.$O$3:.$O$17];">="&[.G828]);"") ->  | I828: of:=IF([.H827]<>[.H828];"INICIO";IF([.H829]<>[.H828];"FIN";"")) ->  | J828: of:=IF([.K827]<>[.K828];"INICIO";IF([.K829]<>[.K828];"FIN";"")) -> 
A829: of:=IF([.B829]<>"";TODAY()>[.B829];"") ->  | B829: of:=IFERROR(IF(([.B828]+1)<[Calendario.$F$5];[.B828]+1;"");"") ->  | C829: of:=IF(AND([.B829]>=[Calendario.$F$8];[.B829]<=[Calendario.$F$9];1);1;IF(AND([.B829]>=[Calendario.$F$12];[.B829]<=[Calendario.$F$13]);2;IF(AND([.B829]>=[Calendario.$F$16];[.B829]<=[Calendario.$F$17]);3;""))) ->  | D829: of:=IF(COUNTIF([Calendario.$H$4:.$H$48];[.B829])>0;"FIESTA";"") -> FIESTA | E829: of:=IF([.B829]<>"";VLOOKUP(WEEKDAY([.B829];3);[Calendario.$A$4:.$C$11];2);"") ->  | F829: of:=IF([.B829]<>"";IF([.D829]<>"FIESTA";VLOOKUP(WEEKDAY([.B829];3);[Calendario.$A$4:.$C$11];3);0);"") ->  | G829: of:=IF(ISNUMBER([.F829]);[.F829]+[.G828];"") ->  | H829: of:=IF(AND([.G829]<=[Unidades.$G$26];[.G829]<=[Unidades.$F$18];[Unidades.$F$18]>0);[Unidades.$D$18]+1-COUNTIFS([Unidades.$O$3:.$O$17];">="&[.G829]);"") ->  | I829: of:=IF([.H828]<>[.H829];"INICIO";IF([.H830]<>[.H829];"FIN";"")) ->  | J829: of:=IF([.K828]<>[.K829];"INICIO";IF([.K830]<>[.K829];"FIN";"")) -> 
A830: of:=IF([.B830]<>"";TODAY()>[.B830];"") ->  | B830: of:=IFERROR(IF(([.B829]+1)<[Calendario.$F$5];[.B829]+1;"");"") ->  | C830: of:=IF(AND([.B830]>=[Calendario.$F$8];[.B830]<=[Calendario.$F$9];1);1;IF(AND([.B830]>=[Calendario.$F$12];[.B830]<=[Calendario.$F$13]);2;IF(AND([.B830]>=[Calendario.$F$16];[.B830]<=[Calendario.$F$17]);3;""))) ->  | D830: of:=IF(COUNTIF([Calendario.$H$4:.$H$48];[.B830])>0;"FIESTA";"") -> FIESTA | E830: of:=IF([.B830]<>"";VLOOKUP(WEEKDAY([.B830];3);[Calendario.$A$4:.$C$11];2);"") ->  | F830: of:=IF([.B830]<>"";IF([.D830]<>"FIESTA";VLOOKUP(WEEKDAY([.B830];3);[Calendario.$A$4:.$C$11];3);0);"") ->  | G830: of:=IF(ISNUMBER([.F830]);[.F830]+[.G829];"") ->  | H830: of:=IF(AND([.G830]<=[Unidades.$G$26];[.G830]<=[Unidades.$F$18];[Unidades.$F$18]>0);[Unidades.$D$18]+1-COUNTIFS([Unidades.$O$3:.$O$17];">="&[.G830]);"") ->  | I830: of:=IF([.H829]<>[.H830];"INICIO";IF([.H831]<>[.H830];"FIN";"")) ->  | J830: of:=IF([.K829]<>[.K830];"INICIO";IF([.K831]<>[.K830];"FIN";"")) -> 
A831: of:=IF([.B831]<>"";TODAY()>[.B831];"") ->  | B831: of:=IFERROR(IF(([.B830]+1)<[Calendario.$F$5];[.B830]+1;"");"") ->  | C831: of:=IF(AND([.B831]>=[Calendario.$F$8];[.B831]<=[Calendario.$F$9];1);1;IF(AND([.B831]>=[Calendario.$F$12];[.B831]<=[Calendario.$F$13]);2;IF(AND([.B831]>=[Calendario.$F$16];[.B831]<=[Calendario.$F$17]);3;""))) ->  | D831: of:=IF(COUNTIF([Calendario.$H$4:.$H$48];[.B831])>0;"FIESTA";"") -> FIESTA | E831: of:=IF([.B831]<>"";VLOOKUP(WEEKDAY([.B831];3);[Calendario.$A$4:.$C$11];2);"") ->  | F831: of:=IF([.B831]<>"";IF([.D831]<>"FIESTA";VLOOKUP(WEEKDAY([.B831];3);[Calendario.$A$4:.$C$11];3);0);"") ->  | G831: of:=IF(ISNUMBER([.F831]);[.F831]+[.G830];"") ->  | H831: of:=IF(AND([.G831]<=[Unidades.$G$26];[.G831]<=[Unidades.$F$18];[Unidades.$F$18]>0);[Unidades.$D$18]+1-COUNTIFS([Unidades.$O$3:.$O$17];">="&[.G831]);"") ->  | I831: of:=IF([.H830]<>[.H831];"INICIO";IF([.H832]<>[.H831];"FIN";"")) ->  | J831: of:=IF([.K830]<>[.K831];"INICIO";IF([.K832]<>[.K831];"FIN";"")) -> 
A832: of:=IF([.B832]<>"";TODAY()>[.B832];"") ->  | B832: of:=IFERROR(IF(([.B831]+1)<[Calendario.$F$5];[.B831]+1;"");"") ->  | C832: of:=IF(AND([.B832]>=[Calendario.$F$8];[.B832]<=[Calendario.$F$9];1);1;IF(AND([.B832]>=[Calendario.$F$12];[.B832]<=[Calendario.$F$13]);2;IF(AND([.B832]>=[Calendario.$F$16];[.B832]<=[Calendario.$F$17]);3;""))) ->  | D832: of:=IF(COUNTIF([Calendario.$H$4:.$H$48];[.B832])>0;"FIESTA";"") -> FIESTA | E832: of:=IF([.B832]<>"";VLOOKUP(WEEKDAY([.B832];3);[Calendario.$A$4:.$C$11];2);"") ->  | F832: of:=IF([.B832]<>"";IF([.D832]<>"FIESTA";VLOOKUP(WEEKDAY([.B832];3);[Calendario.$A$4:.$C$11];3);0);"") ->  | G832: of:=IF(ISNUMBER([.F832]);[.F832]+[.G831];"") ->  | H832: of:=IF(AND([.G832]<=[Unidades.$G$26];[.G832]<=[Unidades.$F$18];[Unidades.$F$18]>0);[Unidades.$D$18]+1-COUNTIFS([Unidades.$O$3:.$O$17];">="&[.G832]);"") ->  | I832: of:=IF([.H831]<>[.H832];"INICIO";IF([.H833]<>[.H832];"FIN";"")) ->  | J832: of:=IF([.K831]<>[.K832];"INICIO";IF([.K833]<>[.K832];"FIN";"")) -> 
A833: of:=IF([.B833]<>"";TODAY()>[.B833];"") ->  | B833: of:=IFERROR(IF(([.B832]+1)<[Calendario.$F$5];[.B832]+1;"");"") ->  | C833: of:=IF(AND([.B833]>=[Calendario.$F$8];[.B833]<=[Calendario.$F$9];1);1;IF(AND([.B833]>=[Calendario.$F$12];[.B833]<=[Calendario.$F$13]);2;IF(AND([.B833]>=[Calendario.$F$16];[.B833]<=[Calendario.$F$17]);3;""))) ->  | D833: of:=IF(COUNTIF([Calendario.$H$4:.$H$48];[.B833])>0;"FIESTA";"") -> FIESTA | E833: of:=IF([.B833]<>"";VLOOKUP(WEEKDAY([.B833];3);[Calendario.$A$4:.$C$11];2);"") ->  | F833: of:=IF([.B833]<>"";IF([.D833]<>"FIESTA";VLOOKUP(WEEKDAY([.B833];3);[Calendario.$A$4:.$C$11];3);0);"") ->  | G833: of:=IF(ISNUMBER([.F833]);[.F833]+[.G832];"") ->  | H833: of:=IF(AND([.G833]<=[Unidades.$G$26];[.G833]<=[Unidades.$F$18];[Unidades.$F$18]>0);[Unidades.$D$18]+1-COUNTIFS([Unidades.$O$3:.$O$17];">="&[.G833]);"") ->  | I833: of:=IF([.H832]<>[.H833];"INICIO";IF([.H834]<>[.H833];"FIN";"")) ->  | J833: of:=IF([.K832]<>[.K833];"INICIO";IF([.K834]<>[.K833];"FIN";"")) -> 
A834: of:=IF([.B834]<>"";TODAY()>[.B834];"") ->  | B834: of:=IFERROR(IF(([.B833]+1)<[Calendario.$F$5];[.B833]+1;"");"") ->  | C834: of:=IF(AND([.B834]>=[Calendario.$F$8];[.B834]<=[Calendario.$F$9];1);1;IF(AND([.B834]>=[Calendario.$F$12];[.B834]<=[Calendario.$F$13]);2;IF(AND([.B834]>=[Calendario.$F$16];[.B834]<=[Calendario.$F$17]);3;""))) ->  | D834: of:=IF(COUNTIF([Calendario.$H$4:.$H$48];[.B834])>0;"FIESTA";"") -> FIESTA | E834: of:=IF([.B834]<>"";VLOOKUP(WEEKDAY([.B834];3);[Calendario.$A$4:.$C$11];2);"") ->  | F834: of:=IF([.B834]<>"";IF([.D834]<>"FIESTA";VLOOKUP(WEEKDAY([.B834];3);[Calendario.$A$4:.$C$11];3);0);"") ->  | G834: of:=IF(ISNUMBER([.F834]);[.F834]+[.G833];"") ->  | H834: of:=IF(AND([.G834]<=[Unidades.$G$26];[.G834]<=[Unidades.$F$18];[Unidades.$F$18]>0);[Unidades.$D$18]+1-COUNTIFS([Unidades.$O$3:.$O$17];">="&[.G834]);"") ->  | I834: of:=IF([.H833]<>[.H834];"INICIO";IF([.H835]<>[.H834];"FIN";"")) ->  | J834: of:=IF([.K833]<>[.K834];"INICIO";IF([.K835]<>[.K834];"FIN";"")) -> 
A835: of:=IF([.B835]<>"";TODAY()>[.B835];"") ->  | B835: of:=IFERROR(IF(([.B834]+1)<[Calendario.$F$5];[.B834]+1;"");"") ->  | C835: of:=IF(AND([.B835]>=[Calendario.$F$8];[.B835]<=[Calendario.$F$9];1);1;IF(AND([.B835]>=[Calendario.$F$12];[.B835]<=[Calendario.$F$13]);2;IF(AND([.B835]>=[Calendario.$F$16];[.B835]<=[Calendario.$F$17]);3;""))) ->  | D835: of:=IF(COUNTIF([Calendario.$H$4:.$H$48];[.B835])>0;"FIESTA";"") -> FIESTA | E835: of:=IF([.B835]<>"";VLOOKUP(WEEKDAY([.B835];3);[Calendario.$A$4:.$C$11];2);"") ->  | F835: of:=IF([.B835]<>"";IF([.D835]<>"FIESTA";VLOOKUP(WEEKDAY([.B835];3);[Calendario.$A$4:.$C$11];3);0);"") ->  | G835: of:=IF(ISNUMBER([.F835]);[.F835]+[.G834];"") ->  | H835: of:=IF(AND([.G835]<=[Unidades.$G$26];[.G835]<=[Unidades.$F$18];[Unidades.$F$18]>0);[Unidades.$D$18]+1-COUNTIFS([Unidades.$O$3:.$O$17];">="&[.G835]);"") ->  | I835: of:=IF([.H834]<>[.H835];"INICIO";IF([.H836]<>[.H835];"FIN";"")) ->  | J835: of:=IF([.K834]<>[.K835];"INICIO";IF([.K836]<>[.K835];"FIN";"")) -> 
A836: of:=IF([.B836]<>"";TODAY()>[.B836];"") ->  | B836: of:=IFERROR(IF(([.B835]+1)<[Calendario.$F$5];[.B835]+1;"");"") ->  | C836: of:=IF(AND([.B836]>=[Calendario.$F$8];[.B836]<=[Calendario.$F$9];1);1;IF(AND([.B836]>=[Calendario.$F$12];[.B836]<=[Calendario.$F$13]);2;IF(AND([.B836]>=[Calendario.$F$16];[.B836]<=[Calendario.$F$17]);3;""))) ->  | D836: of:=IF(COUNTIF([Calendario.$H$4:.$H$48];[.B836])>0;"FIESTA";"") -> FIESTA | E836: of:=IF([.B836]<>"";VLOOKUP(WEEKDAY([.B836];3);[Calendario.$A$4:.$C$11];2);"") ->  | F836: of:=IF([.B836]<>"";IF([.D836]<>"FIESTA";VLOOKUP(WEEKDAY([.B836];3);[Calendario.$A$4:.$C$11];3);0);"") ->  | G836: of:=IF(ISNUMBER([.F836]);[.F836]+[.G835];"") ->  | H836: of:=IF(AND([.G836]<=[Unidades.$G$26];[.G836]<=[Unidades.$F$18];[Unidades.$F$18]>0);[Unidades.$D$18]+1-COUNTIFS([Unidades.$O$3:.$O$17];">="&[.G836]);"") ->  | I836: of:=IF([.H835]<>[.H836];"INICIO";IF([.H837]<>[.H836];"FIN";"")) ->  | J836: of:=IF([.K835]<>[.K836];"INICIO";IF([.K837]<>[.K836];"FIN";"")) -> 
A837: of:=IF([.B837]<>"";TODAY()>[.B837];"") ->  | B837: of:=IFERROR(IF(([.B836]+1)<[Calendario.$F$5];[.B836]+1;"");"") ->  | C837: of:=IF(AND([.B837]>=[Calendario.$F$8];[.B837]<=[Calendario.$F$9];1);1;IF(AND([.B837]>=[Calendario.$F$12];[.B837]<=[Calendario.$F$13]);2;IF(AND([.B837]>=[Calendario.$F$16];[.B837]<=[Calendario.$F$17]);3;""))) ->  | D837: of:=IF(COUNTIF([Calendario.$H$4:.$H$48];[.B837])>0;"FIESTA";"") -> FIESTA | E837: of:=IF([.B837]<>"";VLOOKUP(WEEKDAY([.B837];3);[Calendario.$A$4:.$C$11];2);"") ->  | F837: of:=IF([.B837]<>"";IF([.D837]<>"FIESTA";VLOOKUP(WEEKDAY([.B837];3);[Calendario.$A$4:.$C$11];3);0);"") ->  | G837: of:=IF(ISNUMBER([.F837]);[.F837]+[.G836];"") ->  | H837: of:=IF(AND([.G837]<=[Unidades.$G$26];[.G837]<=[Unidades.$F$18];[Unidades.$F$18]>0);[Unidades.$D$18]+1-COUNTIFS([Unidades.$O$3:.$O$17];">="&[.G837]);"") ->  | I837: of:=IF([.H836]<>[.H837];"INICIO";IF([.H838]<>[.H837];"FIN";"")) ->  | J837: of:=IF([.K836]<>[.K837];"INICIO";IF([.K838]<>[.K837];"FIN";"")) -> 
A838: of:=IF([.B838]<>"";TODAY()>[.B838];"") ->  | B838: of:=IFERROR(IF(([.B837]+1)<[Calendario.$F$5];[.B837]+1;"");"") ->  | C838: of:=IF(AND([.B838]>=[Calendario.$F$8];[.B838]<=[Calendario.$F$9];1);1;IF(AND([.B838]>=[Calendario.$F$12];[.B838]<=[Calendario.$F$13]);2;IF(AND([.B838]>=[Calendario.$F$16];[.B838]<=[Calendario.$F$17]);3;""))) ->  | D838: of:=IF(COUNTIF([Calendario.$H$4:.$H$48];[.B838])>0;"FIESTA";"") -> FIESTA | E838: of:=IF([.B838]<>"";VLOOKUP(WEEKDAY([.B838];3);[Calendario.$A$4:.$C$11];2);"") ->  | F838: of:=IF([.B838]<>"";IF([.D838]<>"FIESTA";VLOOKUP(WEEKDAY([.B838];3);[Calendario.$A$4:.$C$11];3);0);"") ->  | G838: of:=IF(ISNUMBER([.F838]);[.F838]+[.G837];"") ->  | H838: of:=IF(AND([.G838]<=[Unidades.$G$26];[.G838]<=[Unidades.$F$18];[Unidades.$F$18]>0);[Unidades.$D$18]+1-COUNTIFS([Unidades.$O$3:.$O$17];">="&[.G838]);"") ->  | I838: of:=IF([.H837]<>[.H838];"INICIO";IF([.H839]<>[.H838];"FIN";"")) ->  | J838: of:=IF([.K837]<>[.K838];"INICIO";IF([.K839]<>[.K838];"FIN";"")) -> 
A839: of:=IF([.B839]<>"";TODAY()>[.B839];"") ->  | B839: of:=IFERROR(IF(([.B838]+1)<[Calendario.$F$5];[.B838]+1;"");"") ->  | C839: of:=IF(AND([.B839]>=[Calendario.$F$8];[.B839]<=[Calendario.$F$9];1);1;IF(AND([.B839]>=[Calendario.$F$12];[.B839]<=[Calendario.$F$13]);2;IF(AND([.B839]>=[Calendario.$F$16];[.B839]<=[Calendario.$F$17]);3;""))) ->  | D839: of:=IF(COUNTIF([Calendario.$H$4:.$H$48];[.B839])>0;"FIESTA";"") -> FIESTA | E839: of:=IF([.B839]<>"";VLOOKUP(WEEKDAY([.B839];3);[Calendario.$A$4:.$C$11];2);"") ->  | F839: of:=IF([.B839]<>"";IF([.D839]<>"FIESTA";VLOOKUP(WEEKDAY([.B839];3);[Calendario.$A$4:.$C$11];3);0);"") ->  | G839: of:=IF(ISNUMBER([.F839]);[.F839]+[.G838];"") ->  | H839: of:=IF(AND([.G839]<=[Unidades.$G$26];[.G839]<=[Unidades.$F$18];[Unidades.$F$18]>0);[Unidades.$D$18]+1-COUNTIFS([Unidades.$O$3:.$O$17];">="&[.G839]);"") ->  | I839: of:=IF([.H838]<>[.H839];"INICIO";IF([.H840]<>[.H839];"FIN";"")) ->  | J839: of:=IF([.K838]<>[.K839];"INICIO";IF([.K840]<>[.K839];"FIN";"")) -> 
A840: of:=IF([.B840]<>"";TODAY()>[.B840];"") ->  | B840: of:=IFERROR(IF(([.B839]+1)<[Calendario.$F$5];[.B839]+1;"");"") ->  | C840: of:=IF(AND([.B840]>=[Calendario.$F$8];[.B840]<=[Calendario.$F$9];1);1;IF(AND([.B840]>=[Calendario.$F$12];[.B840]<=[Calendario.$F$13]);2;IF(AND([.B840]>=[Calendario.$F$16];[.B840]<=[Calendario.$F$17]);3;""))) ->  | D840: of:=IF(COUNTIF([Calendario.$H$4:.$H$48];[.B840])>0;"FIESTA";"") -> FIESTA | E840: of:=IF([.B840]<>"";VLOOKUP(WEEKDAY([.B840];3);[Calendario.$A$4:.$C$11];2);"") ->  | F840: of:=IF([.B840]<>"";IF([.D840]<>"FIESTA";VLOOKUP(WEEKDAY([.B840];3);[Calendario.$A$4:.$C$11];3);0);"") ->  | G840: of:=IF(ISNUMBER([.F840]);[.F840]+[.G839];"") ->  | H840: of:=IF(AND([.G840]<=[Unidades.$G$26];[.G840]<=[Unidades.$F$18];[Unidades.$F$18]>0);[Unidades.$D$18]+1-COUNTIFS([Unidades.$O$3:.$O$17];">="&[.G840]);"") ->  | I840: of:=IF([.H839]<>[.H840];"INICIO";IF([.H841]<>[.H840];"FIN";"")) ->  | J840: of:=IF([.K839]<>[.K840];"INICIO";IF([.K841]<>[.K840];"FIN";"")) -> 
A841: of:=IF([.B841]<>"";TODAY()>[.B841];"") ->  | B841: of:=IFERROR(IF(([.B840]+1)<[Calendario.$F$5];[.B840]+1;"");"") ->  | C841: of:=IF(AND([.B841]>=[Calendario.$F$8];[.B841]<=[Calendario.$F$9];1);1;IF(AND([.B841]>=[Calendario.$F$12];[.B841]<=[Calendario.$F$13]);2;IF(AND([.B841]>=[Calendario.$F$16];[.B841]<=[Calendario.$F$17]);3;""))) ->  | D841: of:=IF(COUNTIF([Calendario.$H$4:.$H$48];[.B841])>0;"FIESTA";"") -> FIESTA | E841: of:=IF([.B841]<>"";VLOOKUP(WEEKDAY([.B841];3);[Calendario.$A$4:.$C$11];2);"") ->  | F841: of:=IF([.B841]<>"";IF([.D841]<>"FIESTA";VLOOKUP(WEEKDAY([.B841];3);[Calendario.$A$4:.$C$11];3);0);"") ->  | G841: of:=IF(ISNUMBER([.F841]);[.F841]+[.G840];"") ->  | H841: of:=IF(AND([.G841]<=[Unidades.$G$26];[.G841]<=[Unidades.$F$18];[Unidades.$F$18]>0);[Unidades.$D$18]+1-COUNTIFS([Unidades.$O$3:.$O$17];">="&[.G841]);"") ->  | I841: of:=IF([.H840]<>[.H841];"INICIO";IF([.H842]<>[.H841];"FIN";"")) ->  | J841: of:=IF([.K840]<>[.K841];"INICIO";IF([.K842]<>[.K841];"FIN";"")) -> 
A842: of:=IF([.B842]<>"";TODAY()>[.B842];"") ->  | B842: of:=IFERROR(IF(([.B841]+1)<[Calendario.$F$5];[.B841]+1;"");"") ->  | C842: of:=IF(AND([.B842]>=[Calendario.$F$8];[.B842]<=[Calendario.$F$9];1);1;IF(AND([.B842]>=[Calendario.$F$12];[.B842]<=[Calendario.$F$13]);2;IF(AND([.B842]>=[Calendario.$F$16];[.B842]<=[Calendario.$F$17]);3;""))) ->  | D842: of:=IF(COUNTIF([Calendario.$H$4:.$H$48];[.B842])>0;"FIESTA";"") -> FIESTA | E842: of:=IF([.B842]<>"";VLOOKUP(WEEKDAY([.B842];3);[Calendario.$A$4:.$C$11];2);"") ->  | F842: of:=IF([.B842]<>"";IF([.D842]<>"FIESTA";VLOOKUP(WEEKDAY([.B842];3);[Calendario.$A$4:.$C$11];3);0);"") ->  | G842: of:=IF(ISNUMBER([.F842]);[.F842]+[.G841];"") ->  | H842: of:=IF(AND([.G842]<=[Unidades.$G$26];[.G842]<=[Unidades.$F$18];[Unidades.$F$18]>0);[Unidades.$D$18]+1-COUNTIFS([Unidades.$O$3:.$O$17];">="&[.G842]);"") ->  | I842: of:=IF([.H841]<>[.H842];"INICIO";IF([.H843]<>[.H842];"FIN";"")) ->  | J842: of:=IF([.K841]<>[.K842];"INICIO";IF([.K843]<>[.K842];"FIN";"")) -> 
A843: of:=IF([.B843]<>"";TODAY()>[.B843];"") ->  | B843: of:=IFERROR(IF(([.B842]+1)<[Calendario.$F$5];[.B842]+1;"");"") ->  | C843: of:=IF(AND([.B843]>=[Calendario.$F$8];[.B843]<=[Calendario.$F$9];1);1;IF(AND([.B843]>=[Calendario.$F$12];[.B843]<=[Calendario.$F$13]);2;IF(AND([.B843]>=[Calendario.$F$16];[.B843]<=[Calendario.$F$17]);3;""))) ->  | D843: of:=IF(COUNTIF([Calendario.$H$4:.$H$48];[.B843])>0;"FIESTA";"") -> FIESTA | E843: of:=IF([.B843]<>"";VLOOKUP(WEEKDAY([.B843];3);[Calendario.$A$4:.$C$11];2);"") ->  | F843: of:=IF([.B843]<>"";IF([.D843]<>"FIESTA";VLOOKUP(WEEKDAY([.B843];3);[Calendario.$A$4:.$C$11];3);0);"") ->  | G843: of:=IF(ISNUMBER([.F843]);[.F843]+[.G842];"") ->  | H843: of:=IF(AND([.G843]<=[Unidades.$G$26];[.G843]<=[Unidades.$F$18];[Unidades.$F$18]>0);[Unidades.$D$18]+1-COUNTIFS([Unidades.$O$3:.$O$17];">="&[.G843]);"") ->  | I843: of:=IF([.H842]<>[.H843];"INICIO";IF([.H844]<>[.H843];"FIN";"")) ->  | J843: of:=IF([.K842]<>[.K843];"INICIO";IF([.K844]<>[.K843];"FIN";"")) -> 
A844: of:=IF([.B844]<>"";TODAY()>[.B844];"") ->  | B844: of:=IFERROR(IF(([.B843]+1)<[Calendario.$F$5];[.B843]+1;"");"") ->  | C844: of:=IF(AND([.B844]>=[Calendario.$F$8];[.B844]<=[Calendario.$F$9];1);1;IF(AND([.B844]>=[Calendario.$F$12];[.B844]<=[Calendario.$F$13]);2;IF(AND([.B844]>=[Calendario.$F$16];[.B844]<=[Calendario.$F$17]);3;""))) ->  | D844: of:=IF(COUNTIF([Calendario.$H$4:.$H$48];[.B844])>0;"FIESTA";"") -> FIESTA | E844: of:=IF([.B844]<>"";VLOOKUP(WEEKDAY([.B844];3);[Calendario.$A$4:.$C$11];2);"") ->  | F844: of:=IF([.B844]<>"";IF([.D844]<>"FIESTA";VLOOKUP(WEEKDAY([.B844];3);[Calendario.$A$4:.$C$11];3);0);"") ->  | G844: of:=IF(ISNUMBER([.F844]);[.F844]+[.G843];"") ->  | H844: of:=IF(AND([.G844]<=[Unidades.$G$26];[.G844]<=[Unidades.$F$18];[Unidades.$F$18]>0);[Unidades.$D$18]+1-COUNTIFS([Unidades.$O$3:.$O$17];">="&[.G844]);"") ->  | I844: of:=IF([.H843]<>[.H844];"INICIO";IF([.H845]<>[.H844];"FIN";"")) ->  | J844: of:=IF([.K843]<>[.K844];"INICIO";IF([.K845]<>[.K844];"FIN";"")) -> 
A845: of:=IF([.B845]<>"";TODAY()>[.B845];"") ->  | B845: of:=IFERROR(IF(([.B844]+1)<[Calendario.$F$5];[.B844]+1;"");"") ->  | C845: of:=IF(AND([.B845]>=[Calendario.$F$8];[.B845]<=[Calendario.$F$9];1);1;IF(AND([.B845]>=[Calendario.$F$12];[.B845]<=[Calendario.$F$13]);2;IF(AND([.B845]>=[Calendario.$F$16];[.B845]<=[Calendario.$F$17]);3;""))) ->  | D845: of:=IF(COUNTIF([Calendario.$H$4:.$H$48];[.B845])>0;"FIESTA";"") -> FIESTA | E845: of:=IF([.B845]<>"";VLOOKUP(WEEKDAY([.B845];3);[Calendario.$A$4:.$C$11];2);"") ->  | F845: of:=IF([.B845]<>"";IF([.D845]<>"FIESTA";VLOOKUP(WEEKDAY([.B845];3);[Calendario.$A$4:.$C$11];3);0);"") ->  | G845: of:=IF(ISNUMBER([.F845]);[.F845]+[.G844];"") ->  | H845: of:=IF(AND([.G845]<=[Unidades.$G$26];[.G845]<=[Unidades.$F$18];[Unidades.$F$18]>0);[Unidades.$D$18]+1-COUNTIFS([Unidades.$O$3:.$O$17];">="&[.G845]);"") ->  | I845: of:=IF([.H844]<>[.H845];"INICIO";IF([.H846]<>[.H845];"FIN";"")) ->  | J845: of:=IF([.K844]<>[.K845];"INICIO";IF([.K846]<>[.K845];"FIN";"")) -> 
A846: of:=IF([.B846]<>"";TODAY()>[.B846];"") ->  | B846: of:=IFERROR(IF(([.B845]+1)<[Calendario.$F$5];[.B845]+1;"");"") ->  | C846: of:=IF(AND([.B846]>=[Calendario.$F$8];[.B846]<=[Calendario.$F$9];1);1;IF(AND([.B846]>=[Calendario.$F$12];[.B846]<=[Calendario.$F$13]);2;IF(AND([.B846]>=[Calendario.$F$16];[.B846]<=[Calendario.$F$17]);3;""))) ->  | D846: of:=IF(COUNTIF([Calendario.$H$4:.$H$48];[.B846])>0;"FIESTA";"") -> FIESTA | E846: of:=IF([.B846]<>"";VLOOKUP(WEEKDAY([.B846];3);[Calendario.$A$4:.$C$11];2);"") ->  | F846: of:=IF([.B846]<>"";IF([.D846]<>"FIESTA";VLOOKUP(WEEKDAY([.B846];3);[Calendario.$A$4:.$C$11];3);0);"") ->  | G846: of:=IF(ISNUMBER([.F846]);[.F846]+[.G845];"") ->  | H846: of:=IF(AND([.G846]<=[Unidades.$G$26];[.G846]<=[Unidades.$F$18];[Unidades.$F$18]>0);[Unidades.$D$18]+1-COUNTIFS([Unidades.$O$3:.$O$17];">="&[.G846]);"") ->  | I846: of:=IF([.H845]<>[.H846];"INICIO";IF([.H847]<>[.H846];"FIN";"")) ->  | J846: of:=IF([.K845]<>[.K846];"INICIO";IF([.K847]<>[.K846];"FIN";"")) -> 
A847: of:=IF([.B847]<>"";TODAY()>[.B847];"") ->  | B847: of:=IFERROR(IF(([.B846]+1)<[Calendario.$F$5];[.B846]+1;"");"") ->  | C847: of:=IF(AND([.B847]>=[Calendario.$F$8];[.B847]<=[Calendario.$F$9];1);1;IF(AND([.B847]>=[Calendario.$F$12];[.B847]<=[Calendario.$F$13]);2;IF(AND([.B847]>=[Calendario.$F$16];[.B847]<=[Calendario.$F$17]);3;""))) ->  | D847: of:=IF(COUNTIF([Calendario.$H$4:.$H$48];[.B847])>0;"FIESTA";"") -> FIESTA | E847: of:=IF([.B847]<>"";VLOOKUP(WEEKDAY([.B847];3);[Calendario.$A$4:.$C$11];2);"") ->  | F847: of:=IF([.B847]<>"";IF([.D847]<>"FIESTA";VLOOKUP(WEEKDAY([.B847];3);[Calendario.$A$4:.$C$11];3);0);"") ->  | G847: of:=IF(ISNUMBER([.F847]);[.F847]+[.G846];"") ->  | H847: of:=IF(AND([.G847]<=[Unidades.$G$26];[.G847]<=[Unidades.$F$18];[Unidades.$F$18]>0);[Unidades.$D$18]+1-COUNTIFS([Unidades.$O$3:.$O$17];">="&[.G847]);"") ->  | I847: of:=IF([.H846]<>[.H847];"INICIO";IF([.H848]<>[.H847];"FIN";"")) ->  | J847: of:=IF([.K846]<>[.K847];"INICIO";IF([.K848]<>[.K847];"FIN";"")) -> 
A848: of:=IF([.B848]<>"";TODAY()>[.B848];"") ->  | B848: of:=IFERROR(IF(([.B847]+1)<[Calendario.$F$5];[.B847]+1;"");"") ->  | C848: of:=IF(AND([.B848]>=[Calendario.$F$8];[.B848]<=[Calendario.$F$9];1);1;IF(AND([.B848]>=[Calendario.$F$12];[.B848]<=[Calendario.$F$13]);2;IF(AND([.B848]>=[Calendario.$F$16];[.B848]<=[Calendario.$F$17]);3;""))) ->  | D848: of:=IF(COUNTIF([Calendario.$H$4:.$H$48];[.B848])>0;"FIESTA";"") -> FIESTA | E848: of:=IF([.B848]<>"";VLOOKUP(WEEKDAY([.B848];3);[Calendario.$A$4:.$C$11];2);"") ->  | F848: of:=IF([.B848]<>"";IF([.D848]<>"FIESTA";VLOOKUP(WEEKDAY([.B848];3);[Calendario.$A$4:.$C$11];3);0);"") ->  | G848: of:=IF(ISNUMBER([.F848]);[.F848]+[.G847];"") ->  | H848: of:=IF(AND([.G848]<=[Unidades.$G$26];[.G848]<=[Unidades.$F$18];[Unidades.$F$18]>0);[Unidades.$D$18]+1-COUNTIFS([Unidades.$O$3:.$O$17];">="&[.G848]);"") ->  | I848: of:=IF([.H847]<>[.H848];"INICIO";IF([.H849]<>[.H848];"FIN";"")) ->  | J848: of:=IF([.K847]<>[.K848];"INICIO";IF([.K849]<>[.K848];"FIN";"")) -> 
A849: of:=IF([.B849]<>"";TODAY()>[.B849];"") ->  | B849: of:=IFERROR(IF(([.B848]+1)<[Calendario.$F$5];[.B848]+1;"");"") ->  | C849: of:=IF(AND([.B849]>=[Calendario.$F$8];[.B849]<=[Calendario.$F$9];1);1;IF(AND([.B849]>=[Calendario.$F$12];[.B849]<=[Calendario.$F$13]);2;IF(AND([.B849]>=[Calendario.$F$16];[.B849]<=[Calendario.$F$17]);3;""))) ->  | D849: of:=IF(COUNTIF([Calendario.$H$4:.$H$48];[.B849])>0;"FIESTA";"") -> FIESTA | E849: of:=IF([.B849]<>"";VLOOKUP(WEEKDAY([.B849];3);[Calendario.$A$4:.$C$11];2);"") ->  | F849: of:=IF([.B849]<>"";IF([.D849]<>"FIESTA";VLOOKUP(WEEKDAY([.B849];3);[Calendario.$A$4:.$C$11];3);0);"") ->  | G849: of:=IF(ISNUMBER([.F849]);[.F849]+[.G848];"") ->  | H849: of:=IF(AND([.G849]<=[Unidades.$G$26];[.G849]<=[Unidades.$F$18];[Unidades.$F$18]>0);[Unidades.$D$18]+1-COUNTIFS([Unidades.$O$3:.$O$17];">="&[.G849]);"") ->  | I849: of:=IF([.H848]<>[.H849];"INICIO";IF([.H850]<>[.H849];"FIN";"")) ->  | J849: of:=IF([.K848]<>[.K849];"INICIO";IF([.K850]<>[.K849];"FIN";"")) -> 
A850: of:=IF([.B850]<>"";TODAY()>[.B850];"") ->  | B850: of:=IFERROR(IF(([.B849]+1)<[Calendario.$F$5];[.B849]+1;"");"") ->  | C850: of:=IF(AND([.B850]>=[Calendario.$F$8];[.B850]<=[Calendario.$F$9];1);1;IF(AND([.B850]>=[Calendario.$F$12];[.B850]<=[Calendario.$F$13]);2;IF(AND([.B850]>=[Calendario.$F$16];[.B850]<=[Calendario.$F$17]);3;""))) ->  | D850: of:=IF(COUNTIF([Calendario.$H$4:.$H$48];[.B850])>0;"FIESTA";"") -> FIESTA | E850: of:=IF([.B850]<>"";VLOOKUP(WEEKDAY([.B850];3);[Calendario.$A$4:.$C$11];2);"") ->  | F850: of:=IF([.B850]<>"";IF([.D850]<>"FIESTA";VLOOKUP(WEEKDAY([.B850];3);[Calendario.$A$4:.$C$11];3);0);"") ->  | G850: of:=IF(ISNUMBER([.F850]);[.F850]+[.G849];"") ->  | H850: of:=IF(AND([.G850]<=[Unidades.$G$26];[.G850]<=[Unidades.$F$18];[Unidades.$F$18]>0);[Unidades.$D$18]+1-COUNTIFS([Unidades.$O$3:.$O$17];">="&[.G850]);"") ->  | I850: of:=IF([.H849]<>[.H850];"INICIO";IF([.H851]<>[.H850];"FIN";"")) ->  | J850: of:=IF([.K849]<>[.K850];"INICIO";IF([.K851]<>[.K850];"FIN";"")) -> 
A851: of:=IF([.B851]<>"";TODAY()>[.B851];"") ->  | B851: of:=IFERROR(IF(([.B850]+1)<[Calendario.$F$5];[.B850]+1;"");"") ->  | C851: of:=IF(AND([.B851]>=[Calendario.$F$8];[.B851]<=[Calendario.$F$9];1);1;IF(AND([.B851]>=[Calendario.$F$12];[.B851]<=[Calendario.$F$13]);2;IF(AND([.B851]>=[Calendario.$F$16];[.B851]<=[Calendario.$F$17]);3;""))) ->  | D851: of:=IF(COUNTIF([Calendario.$H$4:.$H$48];[.B851])>0;"FIESTA";"") -> FIESTA | E851: of:=IF([.B851]<>"";VLOOKUP(WEEKDAY([.B851];3);[Calendario.$A$4:.$C$11];2);"") ->  | F851: of:=IF([.B851]<>"";IF([.D851]<>"FIESTA";VLOOKUP(WEEKDAY([.B851];3);[Calendario.$A$4:.$C$11];3);0);"") ->  | G851: of:=IF(ISNUMBER([.F851]);[.F851]+[.G850];"") ->  | H851: of:=IF(AND([.G851]<=[Unidades.$G$26];[.G851]<=[Unidades.$F$18];[Unidades.$F$18]>0);[Unidades.$D$18]+1-COUNTIFS([Unidades.$O$3:.$O$17];">="&[.G851]);"") ->  | I851: of:=IF([.H850]<>[.H851];"INICIO";IF([.H852]<>[.H851];"FIN";"")) ->  | J851: of:=IF([.K850]<>[.K851];"INICIO";IF([.K852]<>[.K851];"FIN";"")) -> 
A852: of:=IF([.B852]<>"";TODAY()>[.B852];"") ->  | B852: of:=IFERROR(IF(([.B851]+1)<[Calendario.$F$5];[.B851]+1;"");"") ->  | C852: of:=IF(AND([.B852]>=[Calendario.$F$8];[.B852]<=[Calendario.$F$9];1);1;IF(AND([.B852]>=[Calendario.$F$12];[.B852]<=[Calendario.$F$13]);2;IF(AND([.B852]>=[Calendario.$F$16];[.B852]<=[Calendario.$F$17]);3;""))) ->  | D852: of:=IF(COUNTIF([Calendario.$H$4:.$H$48];[.B852])>0;"FIESTA";"") -> FIESTA | E852: of:=IF([.B852]<>"";VLOOKUP(WEEKDAY([.B852];3);[Calendario.$A$4:.$C$11];2);"") ->  | F852: of:=IF([.B852]<>"";IF([.D852]<>"FIESTA";VLOOKUP(WEEKDAY([.B852];3);[Calendario.$A$4:.$C$11];3);0);"") ->  | G852: of:=IF(ISNUMBER([.F852]);[.F852]+[.G851];"") ->  | H852: of:=IF(AND([.G852]<=[Unidades.$G$26];[.G852]<=[Unidades.$F$18];[Unidades.$F$18]>0);[Unidades.$D$18]+1-COUNTIFS([Unidades.$O$3:.$O$17];">="&[.G852]);"") ->  | I852: of:=IF([.H851]<>[.H852];"INICIO";IF([.H853]<>[.H852];"FIN";"")) ->  | J852: of:=IF([.K851]<>[.K852];"INICIO";IF([.K853]<>[.K852];"FIN";"")) -> 
A853: of:=IF([.B853]<>"";TODAY()>[.B853];"") ->  | B853: of:=IFERROR(IF(([.B852]+1)<[Calendario.$F$5];[.B852]+1;"");"") ->  | C853: of:=IF(AND([.B853]>=[Calendario.$F$8];[.B853]<=[Calendario.$F$9];1);1;IF(AND([.B853]>=[Calendario.$F$12];[.B853]<=[Calendario.$F$13]);2;IF(AND([.B853]>=[Calendario.$F$16];[.B853]<=[Calendario.$F$17]);3;""))) ->  | D853: of:=IF(COUNTIF([Calendario.$H$4:.$H$48];[.B853])>0;"FIESTA";"") -> FIESTA | E853: of:=IF([.B853]<>"";VLOOKUP(WEEKDAY([.B853];3);[Calendario.$A$4:.$C$11];2);"") ->  | F853: of:=IF([.B853]<>"";IF([.D853]<>"FIESTA";VLOOKUP(WEEKDAY([.B853];3);[Calendario.$A$4:.$C$11];3);0);"") ->  | G853: of:=IF(ISNUMBER([.F853]);[.F853]+[.G852];"") ->  | H853: of:=IF(AND([.G853]<=[Unidades.$G$26];[.G853]<=[Unidades.$F$18];[Unidades.$F$18]>0);[Unidades.$D$18]+1-COUNTIFS([Unidades.$O$3:.$O$17];">="&[.G853]);"") ->  | I853: of:=IF([.H852]<>[.H853];"INICIO";IF([.H854]<>[.H853];"FIN";"")) ->  | J853: of:=IF([.K852]<>[.K853];"INICIO";IF([.K854]<>[.K853];"FIN";"")) -> 
A854: of:=IF([.B854]<>"";TODAY()>[.B854];"") ->  | B854: of:=IFERROR(IF(([.B853]+1)<[Calendario.$F$5];[.B853]+1;"");"") ->  | C854: of:=IF(AND([.B854]>=[Calendario.$F$8];[.B854]<=[Calendario.$F$9];1);1;IF(AND([.B854]>=[Calendario.$F$12];[.B854]<=[Calendario.$F$13]);2;IF(AND([.B854]>=[Calendario.$F$16];[.B854]<=[Calendario.$F$17]);3;""))) ->  | D854: of:=IF(COUNTIF([Calendario.$H$4:.$H$48];[.B854])>0;"FIESTA";"") -> FIESTA | E854: of:=IF([.B854]<>"";VLOOKUP(WEEKDAY([.B854];3);[Calendario.$A$4:.$C$11];2);"") ->  | F854: of:=IF([.B854]<>"";IF([.D854]<>"FIESTA";VLOOKUP(WEEKDAY([.B854];3);[Calendario.$A$4:.$C$11];3);0);"") ->  | G854: of:=IF(ISNUMBER([.F854]);[.F854]+[.G853];"") ->  | H854: of:=IF(AND([.G854]<=[Unidades.$G$26];[.G854]<=[Unidades.$F$18];[Unidades.$F$18]>0);[Unidades.$D$18]+1-COUNTIFS([Unidades.$O$3:.$O$17];">="&[.G854]);"") ->  | I854: of:=IF([.H853]<>[.H854];"INICIO";IF([.H855]<>[.H854];"FIN";"")) ->  | J854: of:=IF([.K853]<>[.K854];"INICIO";IF([.K855]<>[.K854];"FIN";"")) -> 
A855: of:=IF([.B855]<>"";TODAY()>[.B855];"") ->  | B855: of:=IFERROR(IF(([.B854]+1)<[Calendario.$F$5];[.B854]+1;"");"") ->  | C855: of:=IF(AND([.B855]>=[Calendario.$F$8];[.B855]<=[Calendario.$F$9];1);1;IF(AND([.B855]>=[Calendario.$F$12];[.B855]<=[Calendario.$F$13]);2;IF(AND([.B855]>=[Calendario.$F$16];[.B855]<=[Calendario.$F$17]);3;""))) ->  | D855: of:=IF(COUNTIF([Calendario.$H$4:.$H$48];[.B855])>0;"FIESTA";"") -> FIESTA | E855: of:=IF([.B855]<>"";VLOOKUP(WEEKDAY([.B855];3);[Calendario.$A$4:.$C$11];2);"") ->  | F855: of:=IF([.B855]<>"";IF([.D855]<>"FIESTA";VLOOKUP(WEEKDAY([.B855];3);[Calendario.$A$4:.$C$11];3);0);"") ->  | G855: of:=IF(ISNUMBER([.F855]);[.F855]+[.G854];"") ->  | H855: of:=IF(AND([.G855]<=[Unidades.$G$26];[.G855]<=[Unidades.$F$18];[Unidades.$F$18]>0);[Unidades.$D$18]+1-COUNTIFS([Unidades.$O$3:.$O$17];">="&[.G855]);"") ->  | I855: of:=IF([.H854]<>[.H855];"INICIO";IF([.H856]<>[.H855];"FIN";"")) ->  | J855: of:=IF([.K854]<>[.K855];"INICIO";IF([.K856]<>[.K855];"FIN";"")) -> 
A856: of:=IF([.B856]<>"";TODAY()>[.B856];"") ->  | B856: of:=IFERROR(IF(([.B855]+1)<[Calendario.$F$5];[.B855]+1;"");"") ->  | C856: of:=IF(AND([.B856]>=[Calendario.$F$8];[.B856]<=[Calendario.$F$9];1);1;IF(AND([.B856]>=[Calendario.$F$12];[.B856]<=[Calendario.$F$13]);2;IF(AND([.B856]>=[Calendario.$F$16];[.B856]<=[Calendario.$F$17]);3;""))) ->  | D856: of:=IF(COUNTIF([Calendario.$H$4:.$H$48];[.B856])>0;"FIESTA";"") -> FIESTA | E856: of:=IF([.B856]<>"";VLOOKUP(WEEKDAY([.B856];3);[Calendario.$A$4:.$C$11];2);"") ->  | F856: of:=IF([.B856]<>"";IF([.D856]<>"FIESTA";VLOOKUP(WEEKDAY([.B856];3);[Calendario.$A$4:.$C$11];3);0);"") ->  | G856: of:=IF(ISNUMBER([.F856]);[.F856]+[.G855];"") ->  | H856: of:=IF(AND([.G856]<=[Unidades.$G$26];[.G856]<=[Unidades.$F$18];[Unidades.$F$18]>0);[Unidades.$D$18]+1-COUNTIFS([Unidades.$O$3:.$O$17];">="&[.G856]);"") ->  | I856: of:=IF([.H855]<>[.H856];"INICIO";IF([.H857]<>[.H856];"FIN";"")) ->  | J856: of:=IF([.K855]<>[.K856];"INICIO";IF([.K857]<>[.K856];"FIN";"")) -> 
A857: of:=IF([.B857]<>"";TODAY()>[.B857];"") ->  | B857: of:=IFERROR(IF(([.B856]+1)<[Calendario.$F$5];[.B856]+1;"");"") ->  | C857: of:=IF(AND([.B857]>=[Calendario.$F$8];[.B857]<=[Calendario.$F$9];1);1;IF(AND([.B857]>=[Calendario.$F$12];[.B857]<=[Calendario.$F$13]);2;IF(AND([.B857]>=[Calendario.$F$16];[.B857]<=[Calendario.$F$17]);3;""))) ->  | D857: of:=IF(COUNTIF([Calendario.$H$4:.$H$48];[.B857])>0;"FIESTA";"") -> FIESTA | E857: of:=IF([.B857]<>"";VLOOKUP(WEEKDAY([.B857];3);[Calendario.$A$4:.$C$11];2);"") ->  | F857: of:=IF([.B857]<>"";IF([.D857]<>"FIESTA";VLOOKUP(WEEKDAY([.B857];3);[Calendario.$A$4:.$C$11];3);0);"") ->  | G857: of:=IF(ISNUMBER([.F857]);[.F857]+[.G856];"") ->  | H857: of:=IF(AND([.G857]<=[Unidades.$G$26];[.G857]<=[Unidades.$F$18];[Unidades.$F$18]>0);[Unidades.$D$18]+1-COUNTIFS([Unidades.$O$3:.$O$17];">="&[.G857]);"") ->  | I857: of:=IF([.H856]<>[.H857];"INICIO";IF([.H858]<>[.H857];"FIN";"")) ->  | J857: of:=IF([.K856]<>[.K857];"INICIO";IF([.K858]<>[.K857];"FIN";"")) -> 
A858: of:=IF([.B858]<>"";TODAY()>[.B858];"") ->  | B858: of:=IFERROR(IF(([.B857]+1)<[Calendario.$F$5];[.B857]+1;"");"") ->  | C858: of:=IF(AND([.B858]>=[Calendario.$F$8];[.B858]<=[Calendario.$F$9];1);1;IF(AND([.B858]>=[Calendario.$F$12];[.B858]<=[Calendario.$F$13]);2;IF(AND([.B858]>=[Calendario.$F$16];[.B858]<=[Calendario.$F$17]);3;""))) ->  | D858: of:=IF(COUNTIF([Calendario.$H$4:.$H$48];[.B858])>0;"FIESTA";"") -> FIESTA | E858: of:=IF([.B858]<>"";VLOOKUP(WEEKDAY([.B858];3);[Calendario.$A$4:.$C$11];2);"") ->  | F858: of:=IF([.B858]<>"";IF([.D858]<>"FIESTA";VLOOKUP(WEEKDAY([.B858];3);[Calendario.$A$4:.$C$11];3);0);"") ->  | G858: of:=IF(ISNUMBER([.F858]);[.F858]+[.G857];"") ->  | H858: of:=IF(AND([.G858]<=[Unidades.$G$26];[.G858]<=[Unidades.$F$18];[Unidades.$F$18]>0);[Unidades.$D$18]+1-COUNTIFS([Unidades.$O$3:.$O$17];">="&[.G858]);"") ->  | I858: of:=IF([.H857]<>[.H858];"INICIO";IF([.H859]<>[.H858];"FIN";"")) ->  | J858: of:=IF([.K857]<>[.K858];"INICIO";IF([.K859]<>[.K858];"FIN";"")) -> 
A859: of:=IF([.B859]<>"";TODAY()>[.B859];"") ->  | B859: of:=IFERROR(IF(([.B858]+1)<[Calendario.$F$5];[.B858]+1;"");"") ->  | C859: of:=IF(AND([.B859]>=[Calendario.$F$8];[.B859]<=[Calendario.$F$9];1);1;IF(AND([.B859]>=[Calendario.$F$12];[.B859]<=[Calendario.$F$13]);2;IF(AND([.B859]>=[Calendario.$F$16];[.B859]<=[Calendario.$F$17]);3;""))) ->  | D859: of:=IF(COUNTIF([Calendario.$H$4:.$H$48];[.B859])>0;"FIESTA";"") -> FIESTA | E859: of:=IF([.B859]<>"";VLOOKUP(WEEKDAY([.B859];3);[Calendario.$A$4:.$C$11];2);"") ->  | F859: of:=IF([.B859]<>"";IF([.D859]<>"FIESTA";VLOOKUP(WEEKDAY([.B859];3);[Calendario.$A$4:.$C$11];3);0);"") ->  | G859: of:=IF(ISNUMBER([.F859]);[.F859]+[.G858];"") ->  | H859: of:=IF(AND([.G859]<=[Unidades.$G$26];[.G859]<=[Unidades.$F$18];[Unidades.$F$18]>0);[Unidades.$D$18]+1-COUNTIFS([Unidades.$O$3:.$O$17];">="&[.G859]);"") ->  | I859: of:=IF([.H858]<>[.H859];"INICIO";IF([.H860]<>[.H859];"FIN";"")) ->  | J859: of:=IF([.K858]<>[.K859];"INICIO";IF([.K860]<>[.K859];"FIN";"")) -> 
A860: of:=IF([.B860]<>"";TODAY()>[.B860];"") ->  | B860: of:=IFERROR(IF(([.B859]+1)<[Calendario.$F$5];[.B859]+1;"");"") ->  | C860: of:=IF(AND([.B860]>=[Calendario.$F$8];[.B860]<=[Calendario.$F$9];1);1;IF(AND([.B860]>=[Calendario.$F$12];[.B860]<=[Calendario.$F$13]);2;IF(AND([.B860]>=[Calendario.$F$16];[.B860]<=[Calendario.$F$17]);3;""))) ->  | D860: of:=IF(COUNTIF([Calendario.$H$4:.$H$48];[.B860])>0;"FIESTA";"") -> FIESTA | E860: of:=IF([.B860]<>"";VLOOKUP(WEEKDAY([.B860];3);[Calendario.$A$4:.$C$11];2);"") ->  | F860: of:=IF([.B860]<>"";IF([.D860]<>"FIESTA";VLOOKUP(WEEKDAY([.B860];3);[Calendario.$A$4:.$C$11];3);0);"") ->  | G860: of:=IF(ISNUMBER([.F860]);[.F860]+[.G859];"") ->  | H860: of:=IF(AND([.G860]<=[Unidades.$G$26];[.G860]<=[Unidades.$F$18];[Unidades.$F$18]>0);[Unidades.$D$18]+1-COUNTIFS([Unidades.$O$3:.$O$17];">="&[.G860]);"") ->  | I860: of:=IF([.H859]<>[.H860];"INICIO";IF([.H861]<>[.H860];"FIN";"")) ->  | J860: of:=IF([.K859]<>[.K860];"INICIO";IF([.K861]<>[.K860];"FIN";"")) -> 
A861: of:=IF([.B861]<>"";TODAY()>[.B861];"") ->  | B861: of:=IFERROR(IF(([.B860]+1)<[Calendario.$F$5];[.B860]+1;"");"") ->  | C861: of:=IF(AND([.B861]>=[Calendario.$F$8];[.B861]<=[Calendario.$F$9];1);1;IF(AND([.B861]>=[Calendario.$F$12];[.B861]<=[Calendario.$F$13]);2;IF(AND([.B861]>=[Calendario.$F$16];[.B861]<=[Calendario.$F$17]);3;""))) ->  | D861: of:=IF(COUNTIF([Calendario.$H$4:.$H$48];[.B861])>0;"FIESTA";"") -> FIESTA | E861: of:=IF([.B861]<>"";VLOOKUP(WEEKDAY([.B861];3);[Calendario.$A$4:.$C$11];2);"") ->  | F861: of:=IF([.B861]<>"";IF([.D861]<>"FIESTA";VLOOKUP(WEEKDAY([.B861];3);[Calendario.$A$4:.$C$11];3);0);"") ->  | G861: of:=IF(ISNUMBER([.F861]);[.F861]+[.G860];"") ->  | H861: of:=IF(AND([.G861]<=[Unidades.$G$26];[.G861]<=[Unidades.$F$18];[Unidades.$F$18]>0);[Unidades.$D$18]+1-COUNTIFS([Unidades.$O$3:.$O$17];">="&[.G861]);"") ->  | I861: of:=IF([.H860]<>[.H861];"INICIO";IF([.H862]<>[.H861];"FIN";"")) ->  | J861: of:=IF([.K860]<>[.K861];"INICIO";IF([.K862]<>[.K861];"FIN";"")) -> 
A862: of:=IF([.B862]<>"";TODAY()>[.B862];"") ->  | B862: of:=IFERROR(IF(([.B861]+1)<[Calendario.$F$5];[.B861]+1;"");"") ->  | C862: of:=IF(AND([.B862]>=[Calendario.$F$8];[.B862]<=[Calendario.$F$9];1);1;IF(AND([.B862]>=[Calendario.$F$12];[.B862]<=[Calendario.$F$13]);2;IF(AND([.B862]>=[Calendario.$F$16];[.B862]<=[Calendario.$F$17]);3;""))) ->  | D862: of:=IF(COUNTIF([Calendario.$H$4:.$H$48];[.B862])>0;"FIESTA";"") -> FIESTA | E862: of:=IF([.B862]<>"";VLOOKUP(WEEKDAY([.B862];3);[Calendario.$A$4:.$C$11];2);"") ->  | F862: of:=IF([.B862]<>"";IF([.D862]<>"FIESTA";VLOOKUP(WEEKDAY([.B862];3);[Calendario.$A$4:.$C$11];3);0);"") ->  | G862: of:=IF(ISNUMBER([.F862]);[.F862]+[.G861];"") ->  | H862: of:=IF(AND([.G862]<=[Unidades.$G$26];[.G862]<=[Unidades.$F$18];[Unidades.$F$18]>0);[Unidades.$D$18]+1-COUNTIFS([Unidades.$O$3:.$O$17];">="&[.G862]);"") ->  | I862: of:=IF([.H861]<>[.H862];"INICIO";IF([.H863]<>[.H862];"FIN";"")) ->  | J862: of:=IF([.K861]<>[.K862];"INICIO";IF([.K863]<>[.K862];"FIN";"")) -> 
A863: of:=IF([.B863]<>"";TODAY()>[.B863];"") ->  | B863: of:=IFERROR(IF(([.B862]+1)<[Calendario.$F$5];[.B862]+1;"");"") ->  | C863: of:=IF(AND([.B863]>=[Calendario.$F$8];[.B863]<=[Calendario.$F$9];1);1;IF(AND([.B863]>=[Calendario.$F$12];[.B863]<=[Calendario.$F$13]);2;IF(AND([.B863]>=[Calendario.$F$16];[.B863]<=[Calendario.$F$17]);3;""))) ->  | D863: of:=IF(COUNTIF([Calendario.$H$4:.$H$48];[.B863])>0;"FIESTA";"") -> FIESTA | E863: of:=IF([.B863]<>"";VLOOKUP(WEEKDAY([.B863];3);[Calendario.$A$4:.$C$11];2);"") ->  | F863: of:=IF([.B863]<>"";IF([.D863]<>"FIESTA";VLOOKUP(WEEKDAY([.B863];3);[Calendario.$A$4:.$C$11];3);0);"") ->  | G863: of:=IF(ISNUMBER([.F863]);[.F863]+[.G862];"") ->  | H863: of:=IF(AND([.G863]<=[Unidades.$G$26];[.G863]<=[Unidades.$F$18];[Unidades.$F$18]>0);[Unidades.$D$18]+1-COUNTIFS([Unidades.$O$3:.$O$17];">="&[.G863]);"") ->  | I863: of:=IF([.H862]<>[.H863];"INICIO";IF([.H864]<>[.H863];"FIN";"")) ->  | J863: of:=IF([.K862]<>[.K863];"INICIO";IF([.K864]<>[.K863];"FIN";"")) -> 
A864: of:=IF([.B864]<>"";TODAY()>[.B864];"") ->  | B864: of:=IFERROR(IF(([.B863]+1)<[Calendario.$F$5];[.B863]+1;"");"") ->  | C864: of:=IF(AND([.B864]>=[Calendario.$F$8];[.B864]<=[Calendario.$F$9];1);1;IF(AND([.B864]>=[Calendario.$F$12];[.B864]<=[Calendario.$F$13]);2;IF(AND([.B864]>=[Calendario.$F$16];[.B864]<=[Calendario.$F$17]);3;""))) ->  | D864: of:=IF(COUNTIF([Calendario.$H$4:.$H$48];[.B864])>0;"FIESTA";"") -> FIESTA | E864: of:=IF([.B864]<>"";VLOOKUP(WEEKDAY([.B864];3);[Calendario.$A$4:.$C$11];2);"") ->  | F864: of:=IF([.B864]<>"";IF([.D864]<>"FIESTA";VLOOKUP(WEEKDAY([.B864];3);[Calendario.$A$4:.$C$11];3);0);"") ->  | G864: of:=IF(ISNUMBER([.F864]);[.F864]+[.G863];"") ->  | H864: of:=IF(AND([.G864]<=[Unidades.$G$26];[.G864]<=[Unidades.$F$18];[Unidades.$F$18]>0);[Unidades.$D$18]+1-COUNTIFS([Unidades.$O$3:.$O$17];">="&[.G864]);"") ->  | I864: of:=IF([.H863]<>[.H864];"INICIO";IF([.H865]<>[.H864];"FIN";"")) ->  | J864: of:=IF([.K863]<>[.K864];"INICIO";IF([.K865]<>[.K864];"FIN";"")) -> 
A865: of:=IF([.B865]<>"";TODAY()>[.B865];"") ->  | B865: of:=IFERROR(IF(([.B864]+1)<[Calendario.$F$5];[.B864]+1;"");"") ->  | C865: of:=IF(AND([.B865]>=[Calendario.$F$8];[.B865]<=[Calendario.$F$9];1);1;IF(AND([.B865]>=[Calendario.$F$12];[.B865]<=[Calendario.$F$13]);2;IF(AND([.B865]>=[Calendario.$F$16];[.B865]<=[Calendario.$F$17]);3;""))) ->  | D865: of:=IF(COUNTIF([Calendario.$H$4:.$H$48];[.B865])>0;"FIESTA";"") -> FIESTA | E865: of:=IF([.B865]<>"";VLOOKUP(WEEKDAY([.B865];3);[Calendario.$A$4:.$C$11];2);"") ->  | F865: of:=IF([.B865]<>"";IF([.D865]<>"FIESTA";VLOOKUP(WEEKDAY([.B865];3);[Calendario.$A$4:.$C$11];3);0);"") ->  | G865: of:=IF(ISNUMBER([.F865]);[.F865]+[.G864];"") ->  | H865: of:=IF(AND([.G865]<=[Unidades.$G$26];[.G865]<=[Unidades.$F$18];[Unidades.$F$18]>0);[Unidades.$D$18]+1-COUNTIFS([Unidades.$O$3:.$O$17];">="&[.G865]);"") ->  | I865: of:=IF([.H864]<>[.H865];"INICIO";IF([.H866]<>[.H865];"FIN";"")) ->  | J865: of:=IF([.K864]<>[.K865];"INICIO";IF([.K866]<>[.K865];"FIN";"")) -> 
A866: of:=IF([.B866]<>"";TODAY()>[.B866];"") ->  | B866: of:=IFERROR(IF(([.B865]+1)<[Calendario.$F$5];[.B865]+1;"");"") ->  | C866: of:=IF(AND([.B866]>=[Calendario.$F$8];[.B866]<=[Calendario.$F$9];1);1;IF(AND([.B866]>=[Calendario.$F$12];[.B866]<=[Calendario.$F$13]);2;IF(AND([.B866]>=[Calendario.$F$16];[.B866]<=[Calendario.$F$17]);3;""))) ->  | D866: of:=IF(COUNTIF([Calendario.$H$4:.$H$48];[.B866])>0;"FIESTA";"") -> FIESTA | E866: of:=IF([.B866]<>"";VLOOKUP(WEEKDAY([.B866];3);[Calendario.$A$4:.$C$11];2);"") ->  | F866: of:=IF([.B866]<>"";IF([.D866]<>"FIESTA";VLOOKUP(WEEKDAY([.B866];3);[Calendario.$A$4:.$C$11];3);0);"") ->  | G866: of:=IF(ISNUMBER([.F866]);[.F866]+[.G865];"") ->  | H866: of:=IF(AND([.G866]<=[Unidades.$G$26];[.G866]<=[Unidades.$F$18];[Unidades.$F$18]>0);[Unidades.$D$18]+1-COUNTIFS([Unidades.$O$3:.$O$17];">="&[.G866]);"") ->  | I866: of:=IF([.H865]<>[.H866];"INICIO";IF([.H867]<>[.H866];"FIN";"")) ->  | J866: of:=IF([.K865]<>[.K866];"INICIO";IF([.K867]<>[.K866];"FIN";"")) -> 
A867: of:=IF([.B867]<>"";TODAY()>[.B867];"") ->  | B867: of:=IFERROR(IF(([.B866]+1)<[Calendario.$F$5];[.B866]+1;"");"") ->  | C867: of:=IF(AND([.B867]>=[Calendario.$F$8];[.B867]<=[Calendario.$F$9];1);1;IF(AND([.B867]>=[Calendario.$F$12];[.B867]<=[Calendario.$F$13]);2;IF(AND([.B867]>=[Calendario.$F$16];[.B867]<=[Calendario.$F$17]);3;""))) ->  | D867: of:=IF(COUNTIF([Calendario.$H$4:.$H$48];[.B867])>0;"FIESTA";"") -> FIESTA | E867: of:=IF([.B867]<>"";VLOOKUP(WEEKDAY([.B867];3);[Calendario.$A$4:.$C$11];2);"") ->  | F867: of:=IF([.B867]<>"";IF([.D867]<>"FIESTA";VLOOKUP(WEEKDAY([.B867];3);[Calendario.$A$4:.$C$11];3);0);"") ->  | G867: of:=IF(ISNUMBER([.F867]);[.F867]+[.G866];"") ->  | H867: of:=IF(AND([.G867]<=[Unidades.$G$26];[.G867]<=[Unidades.$F$18];[Unidades.$F$18]>0);[Unidades.$D$18]+1-COUNTIFS([Unidades.$O$3:.$O$17];">="&[.G867]);"") ->  | I867: of:=IF([.H866]<>[.H867];"INICIO";IF([.H868]<>[.H867];"FIN";"")) ->  | J867: of:=IF([.K866]<>[.K867];"INICIO";IF([.K868]<>[.K867];"FIN";"")) -> 
A868: of:=IF([.B868]<>"";TODAY()>[.B868];"") ->  | B868: of:=IFERROR(IF(([.B867]+1)<[Calendario.$F$5];[.B867]+1;"");"") ->  | C868: of:=IF(AND([.B868]>=[Calendario.$F$8];[.B868]<=[Calendario.$F$9];1);1;IF(AND([.B868]>=[Calendario.$F$12];[.B868]<=[Calendario.$F$13]);2;IF(AND([.B868]>=[Calendario.$F$16];[.B868]<=[Calendario.$F$17]);3;""))) ->  | D868: of:=IF(COUNTIF([Calendario.$H$4:.$H$48];[.B868])>0;"FIESTA";"") -> FIESTA | E868: of:=IF([.B868]<>"";VLOOKUP(WEEKDAY([.B868];3);[Calendario.$A$4:.$C$11];2);"") ->  | F868: of:=IF([.B868]<>"";IF([.D868]<>"FIESTA";VLOOKUP(WEEKDAY([.B868];3);[Calendario.$A$4:.$C$11];3);0);"") ->  | G868: of:=IF(ISNUMBER([.F868]);[.F868]+[.G867];"") ->  | H868: of:=IF(AND([.G868]<=[Unidades.$G$26];[.G868]<=[Unidades.$F$18];[Unidades.$F$18]>0);[Unidades.$D$18]+1-COUNTIFS([Unidades.$O$3:.$O$17];">="&[.G868]);"") ->  | I868: of:=IF([.H867]<>[.H868];"INICIO";IF([.H869]<>[.H868];"FIN";"")) ->  | J868: of:=IF([.K867]<>[.K868];"INICIO";IF([.K869]<>[.K868];"FIN";"")) -> 
A869: of:=IF([.B869]<>"";TODAY()>[.B869];"") ->  | B869: of:=IFERROR(IF(([.B868]+1)<[Calendario.$F$5];[.B868]+1;"");"") ->  | C869: of:=IF(AND([.B869]>=[Calendario.$F$8];[.B869]<=[Calendario.$F$9];1);1;IF(AND([.B869]>=[Calendario.$F$12];[.B869]<=[Calendario.$F$13]);2;IF(AND([.B869]>=[Calendario.$F$16];[.B869]<=[Calendario.$F$17]);3;""))) ->  | D869: of:=IF(COUNTIF([Calendario.$H$4:.$H$48];[.B869])>0;"FIESTA";"") -> FIESTA | E869: of:=IF([.B869]<>"";VLOOKUP(WEEKDAY([.B869];3);[Calendario.$A$4:.$C$11];2);"") ->  | F869: of:=IF([.B869]<>"";IF([.D869]<>"FIESTA";VLOOKUP(WEEKDAY([.B869];3);[Calendario.$A$4:.$C$11];3);0);"") ->  | G869: of:=IF(ISNUMBER([.F869]);[.F869]+[.G868];"") ->  | H869: of:=IF(AND([.G869]<=[Unidades.$G$26];[.G869]<=[Unidades.$F$18];[Unidades.$F$18]>0);[Unidades.$D$18]+1-COUNTIFS([Unidades.$O$3:.$O$17];">="&[.G869]);"") ->  | I869: of:=IF([.H868]<>[.H869];"INICIO";IF([.H870]<>[.H869];"FIN";"")) ->  | J869: of:=IF([.K868]<>[.K869];"INICIO";IF([.K870]<>[.K869];"FIN";"")) -> 
A870: of:=IF([.B870]<>"";TODAY()>[.B870];"") ->  | B870: of:=IFERROR(IF(([.B869]+1)<[Calendario.$F$5];[.B869]+1;"");"") ->  | C870: of:=IF(AND([.B870]>=[Calendario.$F$8];[.B870]<=[Calendario.$F$9];1);1;IF(AND([.B870]>=[Calendario.$F$12];[.B870]<=[Calendario.$F$13]);2;IF(AND([.B870]>=[Calendario.$F$16];[.B870]<=[Calendario.$F$17]);3;""))) ->  | D870: of:=IF(COUNTIF([Calendario.$H$4:.$H$48];[.B870])>0;"FIESTA";"") -> FIESTA | E870: of:=IF([.B870]<>"";VLOOKUP(WEEKDAY([.B870];3);[Calendario.$A$4:.$C$11];2);"") ->  | F870: of:=IF([.B870]<>"";IF([.D870]<>"FIESTA";VLOOKUP(WEEKDAY([.B870];3);[Calendario.$A$4:.$C$11];3);0);"") ->  | G870: of:=IF(ISNUMBER([.F870]);[.F870]+[.G869];"") ->  | H870: of:=IF(AND([.G870]<=[Unidades.$G$26];[.G870]<=[Unidades.$F$18];[Unidades.$F$18]>0);[Unidades.$D$18]+1-COUNTIFS([Unidades.$O$3:.$O$17];">="&[.G870]);"") ->  | I870: of:=IF([.H869]<>[.H870];"INICIO";IF([.H871]<>[.H870];"FIN";"")) ->  | J870: of:=IF([.K869]<>[.K870];"INICIO";IF([.K871]<>[.K870];"FIN";"")) -> 
A871: of:=IF([.B871]<>"";TODAY()>[.B871];"") ->  | B871: of:=IFERROR(IF(([.B870]+1)<[Calendario.$F$5];[.B870]+1;"");"") ->  | C871: of:=IF(AND([.B871]>=[Calendario.$F$8];[.B871]<=[Calendario.$F$9];1);1;IF(AND([.B871]>=[Calendario.$F$12];[.B871]<=[Calendario.$F$13]);2;IF(AND([.B871]>=[Calendario.$F$16];[.B871]<=[Calendario.$F$17]);3;""))) ->  | D871: of:=IF(COUNTIF([Calendario.$H$4:.$H$48];[.B871])>0;"FIESTA";"") -> FIESTA | E871: of:=IF([.B871]<>"";VLOOKUP(WEEKDAY([.B871];3);[Calendario.$A$4:.$C$11];2);"") ->  | F871: of:=IF([.B871]<>"";IF([.D871]<>"FIESTA";VLOOKUP(WEEKDAY([.B871];3);[Calendario.$A$4:.$C$11];3);0);"") ->  | G871: of:=IF(ISNUMBER([.F871]);[.F871]+[.G870];"") ->  | H871: of:=IF(AND([.G871]<=[Unidades.$G$26];[.G871]<=[Unidades.$F$18];[Unidades.$F$18]>0);[Unidades.$D$18]+1-COUNTIFS([Unidades.$O$3:.$O$17];">="&[.G871]);"") ->  | I871: of:=IF([.H870]<>[.H871];"INICIO";IF([.H872]<>[.H871];"FIN";"")) ->  | J871: of:=IF([.K870]<>[.K871];"INICIO";IF([.K872]<>[.K871];"FIN";"")) -> 
A872: of:=IF([.B872]<>"";TODAY()>[.B872];"") ->  | B872: of:=IFERROR(IF(([.B871]+1)<[Calendario.$F$5];[.B871]+1;"");"") ->  | C872: of:=IF(AND([.B872]>=[Calendario.$F$8];[.B872]<=[Calendario.$F$9];1);1;IF(AND([.B872]>=[Calendario.$F$12];[.B872]<=[Calendario.$F$13]);2;IF(AND([.B872]>=[Calendario.$F$16];[.B872]<=[Calendario.$F$17]);3;""))) ->  | D872: of:=IF(COUNTIF([Calendario.$H$4:.$H$48];[.B872])>0;"FIESTA";"") -> FIESTA | E872: of:=IF([.B872]<>"";VLOOKUP(WEEKDAY([.B872];3);[Calendario.$A$4:.$C$11];2);"") ->  | F872: of:=IF([.B872]<>"";IF([.D872]<>"FIESTA";VLOOKUP(WEEKDAY([.B872];3);[Calendario.$A$4:.$C$11];3);0);"") ->  | G872: of:=IF(ISNUMBER([.F872]);[.F872]+[.G871];"") ->  | H872: of:=IF(AND([.G872]<=[Unidades.$G$26];[.G872]<=[Unidades.$F$18];[Unidades.$F$18]>0);[Unidades.$D$18]+1-COUNTIFS([Unidades.$O$3:.$O$17];">="&[.G872]);"") ->  | I872: of:=IF([.H871]<>[.H872];"INICIO";IF([.H873]<>[.H872];"FIN";"")) ->  | J872: of:=IF([.K871]<>[.K872];"INICIO";IF([.K873]<>[.K872];"FIN";"")) -> 
A873: of:=IF([.B873]<>"";TODAY()>[.B873];"") ->  | B873: of:=IFERROR(IF(([.B872]+1)<[Calendario.$F$5];[.B872]+1;"");"") ->  | C873: of:=IF(AND([.B873]>=[Calendario.$F$8];[.B873]<=[Calendario.$F$9];1);1;IF(AND([.B873]>=[Calendario.$F$12];[.B873]<=[Calendario.$F$13]);2;IF(AND([.B873]>=[Calendario.$F$16];[.B873]<=[Calendario.$F$17]);3;""))) ->  | D873: of:=IF(COUNTIF([Calendario.$H$4:.$H$48];[.B873])>0;"FIESTA";"") -> FIESTA | E873: of:=IF([.B873]<>"";VLOOKUP(WEEKDAY([.B873];3);[Calendario.$A$4:.$C$11];2);"") ->  | F873: of:=IF([.B873]<>"";IF([.D873]<>"FIESTA";VLOOKUP(WEEKDAY([.B873];3);[Calendario.$A$4:.$C$11];3);0);"") ->  | G873: of:=IF(ISNUMBER([.F873]);[.F873]+[.G872];"") ->  | H873: of:=IF(AND([.G873]<=[Unidades.$G$26];[.G873]<=[Unidades.$F$18];[Unidades.$F$18]>0);[Unidades.$D$18]+1-COUNTIFS([Unidades.$O$3:.$O$17];">="&[.G873]);"") ->  | I873: of:=IF([.H872]<>[.H873];"INICIO";IF([.H874]<>[.H873];"FIN";"")) ->  | J873: of:=IF([.K872]<>[.K873];"INICIO";IF([.K874]<>[.K873];"FIN";"")) -> 
A874: of:=IF([.B874]<>"";TODAY()>[.B874];"") ->  | B874: of:=IFERROR(IF(([.B873]+1)<[Calendario.$F$5];[.B873]+1;"");"") ->  | C874: of:=IF(AND([.B874]>=[Calendario.$F$8];[.B874]<=[Calendario.$F$9];1);1;IF(AND([.B874]>=[Calendario.$F$12];[.B874]<=[Calendario.$F$13]);2;IF(AND([.B874]>=[Calendario.$F$16];[.B874]<=[Calendario.$F$17]);3;""))) ->  | D874: of:=IF(COUNTIF([Calendario.$H$4:.$H$48];[.B874])>0;"FIESTA";"") -> FIESTA | E874: of:=IF([.B874]<>"";VLOOKUP(WEEKDAY([.B874];3);[Calendario.$A$4:.$C$11];2);"") ->  | F874: of:=IF([.B874]<>"";IF([.D874]<>"FIESTA";VLOOKUP(WEEKDAY([.B874];3);[Calendario.$A$4:.$C$11];3);0);"") ->  | G874: of:=IF(ISNUMBER([.F874]);[.F874]+[.G873];"") ->  | H874: of:=IF(AND([.G874]<=[Unidades.$G$26];[.G874]<=[Unidades.$F$18];[Unidades.$F$18]>0);[Unidades.$D$18]+1-COUNTIFS([Unidades.$O$3:.$O$17];">="&[.G874]);"") ->  | I874: of:=IF([.H873]<>[.H874];"INICIO";IF([.H875]<>[.H874];"FIN";"")) ->  | J874: of:=IF([.K873]<>[.K874];"INICIO";IF([.K875]<>[.K874];"FIN";"")) -> 
A875: of:=IF([.B875]<>"";TODAY()>[.B875];"") ->  | B875: of:=IFERROR(IF(([.B874]+1)<[Calendario.$F$5];[.B874]+1;"");"") ->  | C875: of:=IF(AND([.B875]>=[Calendario.$F$8];[.B875]<=[Calendario.$F$9];1);1;IF(AND([.B875]>=[Calendario.$F$12];[.B875]<=[Calendario.$F$13]);2;IF(AND([.B875]>=[Calendario.$F$16];[.B875]<=[Calendario.$F$17]);3;""))) ->  | D875: of:=IF(COUNTIF([Calendario.$H$4:.$H$48];[.B875])>0;"FIESTA";"") -> FIESTA | E875: of:=IF([.B875]<>"";VLOOKUP(WEEKDAY([.B875];3);[Calendario.$A$4:.$C$11];2);"") ->  | F875: of:=IF([.B875]<>"";IF([.D875]<>"FIESTA";VLOOKUP(WEEKDAY([.B875];3);[Calendario.$A$4:.$C$11];3);0);"") ->  | G875: of:=IF(ISNUMBER([.F875]);[.F875]+[.G874];"") ->  | H875: of:=IF(AND([.G875]<=[Unidades.$G$26];[.G875]<=[Unidades.$F$18];[Unidades.$F$18]>0);[Unidades.$D$18]+1-COUNTIFS([Unidades.$O$3:.$O$17];">="&[.G875]);"") ->  | I875: of:=IF([.H874]<>[.H875];"INICIO";IF([.H876]<>[.H875];"FIN";"")) ->  | J875: of:=IF([.K874]<>[.K875];"INICIO";IF([.K876]<>[.K875];"FIN";"")) -> 
A876: of:=IF([.B876]<>"";TODAY()>[.B876];"") ->  | B876: of:=IFERROR(IF(([.B875]+1)<[Calendario.$F$5];[.B875]+1;"");"") ->  | C876: of:=IF(AND([.B876]>=[Calendario.$F$8];[.B876]<=[Calendario.$F$9];1);1;IF(AND([.B876]>=[Calendario.$F$12];[.B876]<=[Calendario.$F$13]);2;IF(AND([.B876]>=[Calendario.$F$16];[.B876]<=[Calendario.$F$17]);3;""))) ->  | D876: of:=IF(COUNTIF([Calendario.$H$4:.$H$48];[.B876])>0;"FIESTA";"") -> FIESTA | E876: of:=IF([.B876]<>"";VLOOKUP(WEEKDAY([.B876];3);[Calendario.$A$4:.$C$11];2);"") ->  | F876: of:=IF([.B876]<>"";IF([.D876]<>"FIESTA";VLOOKUP(WEEKDAY([.B876];3);[Calendario.$A$4:.$C$11];3);0);"") ->  | G876: of:=IF(ISNUMBER([.F876]);[.F876]+[.G875];"") ->  | H876: of:=IF(AND([.G876]<=[Unidades.$G$26];[.G876]<=[Unidades.$F$18];[Unidades.$F$18]>0);[Unidades.$D$18]+1-COUNTIFS([Unidades.$O$3:.$O$17];">="&[.G876]);"") ->  | I876: of:=IF([.H875]<>[.H876];"INICIO";IF([.H877]<>[.H876];"FIN";"")) ->  | J876: of:=IF([.K875]<>[.K876];"INICIO";IF([.K877]<>[.K876];"FIN";"")) -> 
A877: of:=IF([.B877]<>"";TODAY()>[.B877];"") ->  | B877: of:=IFERROR(IF(([.B876]+1)<[Calendario.$F$5];[.B876]+1;"");"") ->  | C877: of:=IF(AND([.B877]>=[Calendario.$F$8];[.B877]<=[Calendario.$F$9];1);1;IF(AND([.B877]>=[Calendario.$F$12];[.B877]<=[Calendario.$F$13]);2;IF(AND([.B877]>=[Calendario.$F$16];[.B877]<=[Calendario.$F$17]);3;""))) ->  | D877: of:=IF(COUNTIF([Calendario.$H$4:.$H$48];[.B877])>0;"FIESTA";"") -> FIESTA | E877: of:=IF([.B877]<>"";VLOOKUP(WEEKDAY([.B877];3);[Calendario.$A$4:.$C$11];2);"") ->  | F877: of:=IF([.B877]<>"";IF([.D877]<>"FIESTA";VLOOKUP(WEEKDAY([.B877];3);[Calendario.$A$4:.$C$11];3);0);"") ->  | G877: of:=IF(ISNUMBER([.F877]);[.F877]+[.G876];"") ->  | H877: of:=IF(AND([.G877]<=[Unidades.$G$26];[.G877]<=[Unidades.$F$18];[Unidades.$F$18]>0);[Unidades.$D$18]+1-COUNTIFS([Unidades.$O$3:.$O$17];">="&[.G877]);"") ->  | I877: of:=IF([.H876]<>[.H877];"INICIO";IF([.H878]<>[.H877];"FIN";"")) ->  | J877: of:=IF([.K876]<>[.K877];"INICIO";IF([.K878]<>[.K877];"FIN";"")) -> 
A878: of:=IF([.B878]<>"";TODAY()>[.B878];"") ->  | B878: of:=IFERROR(IF(([.B877]+1)<[Calendario.$F$5];[.B877]+1;"");"") ->  | C878: of:=IF(AND([.B878]>=[Calendario.$F$8];[.B878]<=[Calendario.$F$9];1);1;IF(AND([.B878]>=[Calendario.$F$12];[.B878]<=[Calendario.$F$13]);2;IF(AND([.B878]>=[Calendario.$F$16];[.B878]<=[Calendario.$F$17]);3;""))) ->  | D878: of:=IF(COUNTIF([Calendario.$H$4:.$H$48];[.B878])>0;"FIESTA";"") -> FIESTA | E878: of:=IF([.B878]<>"";VLOOKUP(WEEKDAY([.B878];3);[Calendario.$A$4:.$C$11];2);"") ->  | F878: of:=IF([.B878]<>"";IF([.D878]<>"FIESTA";VLOOKUP(WEEKDAY([.B878];3);[Calendario.$A$4:.$C$11];3);0);"") ->  | G878: of:=IF(ISNUMBER([.F878]);[.F878]+[.G877];"") ->  | H878: of:=IF(AND([.G878]<=[Unidades.$G$26];[.G878]<=[Unidades.$F$18];[Unidades.$F$18]>0);[Unidades.$D$18]+1-COUNTIFS([Unidades.$O$3:.$O$17];">="&[.G878]);"") ->  | I878: of:=IF([.H877]<>[.H878];"INICIO";IF([.H879]<>[.H878];"FIN";"")) ->  | J878: of:=IF([.K877]<>[.K878];"INICIO";IF([.K879]<>[.K878];"FIN";"")) -> 
A879: of:=IF([.B879]<>"";TODAY()>[.B879];"") ->  | B879: of:=IFERROR(IF(([.B878]+1)<[Calendario.$F$5];[.B878]+1;"");"") ->  | C879: of:=IF(AND([.B879]>=[Calendario.$F$8];[.B879]<=[Calendario.$F$9];1);1;IF(AND([.B879]>=[Calendario.$F$12];[.B879]<=[Calendario.$F$13]);2;IF(AND([.B879]>=[Calendario.$F$16];[.B879]<=[Calendario.$F$17]);3;""))) ->  | D879: of:=IF(COUNTIF([Calendario.$H$4:.$H$48];[.B879])>0;"FIESTA";"") -> FIESTA | E879: of:=IF([.B879]<>"";VLOOKUP(WEEKDAY([.B879];3);[Calendario.$A$4:.$C$11];2);"") ->  | F879: of:=IF([.B879]<>"";IF([.D879]<>"FIESTA";VLOOKUP(WEEKDAY([.B879];3);[Calendario.$A$4:.$C$11];3);0);"") ->  | G879: of:=IF(ISNUMBER([.F879]);[.F879]+[.G878];"") ->  | H879: of:=IF(AND([.G879]<=[Unidades.$G$26];[.G879]<=[Unidades.$F$18];[Unidades.$F$18]>0);[Unidades.$D$18]+1-COUNTIFS([Unidades.$O$3:.$O$17];">="&[.G879]);"") ->  | I879: of:=IF([.H878]<>[.H879];"INICIO";IF([.H880]<>[.H879];"FIN";"")) ->  | J879: of:=IF([.K878]<>[.K879];"INICIO";IF([.K880]<>[.K879];"FIN";"")) -> 
A880: of:=IF([.B880]<>"";TODAY()>[.B880];"") ->  | B880: of:=IFERROR(IF(([.B879]+1)<[Calendario.$F$5];[.B879]+1;"");"") ->  | C880: of:=IF(AND([.B880]>=[Calendario.$F$8];[.B880]<=[Calendario.$F$9];1);1;IF(AND([.B880]>=[Calendario.$F$12];[.B880]<=[Calendario.$F$13]);2;IF(AND([.B880]>=[Calendario.$F$16];[.B880]<=[Calendario.$F$17]);3;""))) ->  | D880: of:=IF(COUNTIF([Calendario.$H$4:.$H$48];[.B880])>0;"FIESTA";"") -> FIESTA | E880: of:=IF([.B880]<>"";VLOOKUP(WEEKDAY([.B880];3);[Calendario.$A$4:.$C$11];2);"") ->  | F880: of:=IF([.B880]<>"";IF([.D880]<>"FIESTA";VLOOKUP(WEEKDAY([.B880];3);[Calendario.$A$4:.$C$11];3);0);"") ->  | G880: of:=IF(ISNUMBER([.F880]);[.F880]+[.G879];"") ->  | H880: of:=IF(AND([.G880]<=[Unidades.$G$26];[.G880]<=[Unidades.$F$18];[Unidades.$F$18]>0);[Unidades.$D$18]+1-COUNTIFS([Unidades.$O$3:.$O$17];">="&[.G880]);"") ->  | I880: of:=IF([.H879]<>[.H880];"INICIO";IF([.H881]<>[.H880];"FIN";"")) ->  | J880: of:=IF([.K879]<>[.K880];"INICIO";IF([.K881]<>[.K880];"FIN";"")) -> 
A881: of:=IF([.B881]<>"";TODAY()>[.B881];"") ->  | B881: of:=IFERROR(IF(([.B880]+1)<[Calendario.$F$5];[.B880]+1;"");"") ->  | C881: of:=IF(AND([.B881]>=[Calendario.$F$8];[.B881]<=[Calendario.$F$9];1);1;IF(AND([.B881]>=[Calendario.$F$12];[.B881]<=[Calendario.$F$13]);2;IF(AND([.B881]>=[Calendario.$F$16];[.B881]<=[Calendario.$F$17]);3;""))) ->  | D881: of:=IF(COUNTIF([Calendario.$H$4:.$H$48];[.B881])>0;"FIESTA";"") -> FIESTA | E881: of:=IF([.B881]<>"";VLOOKUP(WEEKDAY([.B881];3);[Calendario.$A$4:.$C$11];2);"") ->  | F881: of:=IF([.B881]<>"";IF([.D881]<>"FIESTA";VLOOKUP(WEEKDAY([.B881];3);[Calendario.$A$4:.$C$11];3);0);"") ->  | G881: of:=IF(ISNUMBER([.F881]);[.F881]+[.G880];"") ->  | H881: of:=IF(AND([.G881]<=[Unidades.$G$26];[.G881]<=[Unidades.$F$18];[Unidades.$F$18]>0);[Unidades.$D$18]+1-COUNTIFS([Unidades.$O$3:.$O$17];">="&[.G881]);"") ->  | I881: of:=IF([.H880]<>[.H881];"INICIO";IF([.H882]<>[.H881];"FIN";"")) ->  | J881: of:=IF([.K880]<>[.K881];"INICIO";IF([.K882]<>[.K881];"FIN";"")) -> 
A882: of:=IF([.B882]<>"";TODAY()>[.B882];"") ->  | B882: of:=IFERROR(IF(([.B881]+1)<[Calendario.$F$5];[.B881]+1;"");"") ->  | C882: of:=IF(AND([.B882]>=[Calendario.$F$8];[.B882]<=[Calendario.$F$9];1);1;IF(AND([.B882]>=[Calendario.$F$12];[.B882]<=[Calendario.$F$13]);2;IF(AND([.B882]>=[Calendario.$F$16];[.B882]<=[Calendario.$F$17]);3;""))) ->  | D882: of:=IF(COUNTIF([Calendario.$H$4:.$H$48];[.B882])>0;"FIESTA";"") -> FIESTA | E882: of:=IF([.B882]<>"";VLOOKUP(WEEKDAY([.B882];3);[Calendario.$A$4:.$C$11];2);"") ->  | F882: of:=IF([.B882]<>"";IF([.D882]<>"FIESTA";VLOOKUP(WEEKDAY([.B882];3);[Calendario.$A$4:.$C$11];3);0);"") ->  | G882: of:=IF(ISNUMBER([.F882]);[.F882]+[.G881];"") ->  | H882: of:=IF(AND([.G882]<=[Unidades.$G$26];[.G882]<=[Unidades.$F$18];[Unidades.$F$18]>0);[Unidades.$D$18]+1-COUNTIFS([Unidades.$O$3:.$O$17];">="&[.G882]);"") ->  | I882: of:=IF([.H881]<>[.H882];"INICIO";IF([.H883]<>[.H882];"FIN";"")) ->  | J882: of:=IF([.K881]<>[.K882];"INICIO";IF([.K883]<>[.K882];"FIN";"")) -> 
A883: of:=IF([.B883]<>"";TODAY()>[.B883];"") ->  | B883: of:=IFERROR(IF(([.B882]+1)<[Calendario.$F$5];[.B882]+1;"");"") ->  | C883: of:=IF(AND([.B883]>=[Calendario.$F$8];[.B883]<=[Calendario.$F$9];1);1;IF(AND([.B883]>=[Calendario.$F$12];[.B883]<=[Calendario.$F$13]);2;IF(AND([.B883]>=[Calendario.$F$16];[.B883]<=[Calendario.$F$17]);3;""))) ->  | D883: of:=IF(COUNTIF([Calendario.$H$4:.$H$48];[.B883])>0;"FIESTA";"") -> FIESTA | E883: of:=IF([.B883]<>"";VLOOKUP(WEEKDAY([.B883];3);[Calendario.$A$4:.$C$11];2);"") ->  | F883: of:=IF([.B883]<>"";IF([.D883]<>"FIESTA";VLOOKUP(WEEKDAY([.B883];3);[Calendario.$A$4:.$C$11];3);0);"") ->  | G883: of:=IF(ISNUMBER([.F883]);[.F883]+[.G882];"") ->  | H883: of:=IF(AND([.G883]<=[Unidades.$G$26];[.G883]<=[Unidades.$F$18];[Unidades.$F$18]>0);[Unidades.$D$18]+1-COUNTIFS([Unidades.$O$3:.$O$17];">="&[.G883]);"") ->  | I883: of:=IF([.H882]<>[.H883];"INICIO";IF([.H884]<>[.H883];"FIN";"")) ->  | J883: of:=IF([.K882]<>[.K883];"INICIO";IF([.K884]<>[.K883];"FIN";"")) -> 
A884: of:=IF([.B884]<>"";TODAY()>[.B884];"") ->  | B884: of:=IFERROR(IF(([.B883]+1)<[Calendario.$F$5];[.B883]+1;"");"") ->  | C884: of:=IF(AND([.B884]>=[Calendario.$F$8];[.B884]<=[Calendario.$F$9];1);1;IF(AND([.B884]>=[Calendario.$F$12];[.B884]<=[Calendario.$F$13]);2;IF(AND([.B884]>=[Calendario.$F$16];[.B884]<=[Calendario.$F$17]);3;""))) ->  | D884: of:=IF(COUNTIF([Calendario.$H$4:.$H$48];[.B884])>0;"FIESTA";"") -> FIESTA | E884: of:=IF([.B884]<>"";VLOOKUP(WEEKDAY([.B884];3);[Calendario.$A$4:.$C$11];2);"") ->  | F884: of:=IF([.B884]<>"";IF([.D884]<>"FIESTA";VLOOKUP(WEEKDAY([.B884];3);[Calendario.$A$4:.$C$11];3);0);"") ->  | G884: of:=IF(ISNUMBER([.F884]);[.F884]+[.G883];"") ->  | H884: of:=IF(AND([.G884]<=[Unidades.$G$26];[.G884]<=[Unidades.$F$18];[Unidades.$F$18]>0);[Unidades.$D$18]+1-COUNTIFS([Unidades.$O$3:.$O$17];">="&[.G884]);"") ->  | I884: of:=IF([.H883]<>[.H884];"INICIO";IF([.H885]<>[.H884];"FIN";"")) ->  | J884: of:=IF([.K883]<>[.K884];"INICIO";IF([.K885]<>[.K884];"FIN";"")) -> 
A885: of:=IF([.B885]<>"";TODAY()>[.B885];"") ->  | B885: of:=IFERROR(IF(([.B884]+1)<[Calendario.$F$5];[.B884]+1;"");"") ->  | C885: of:=IF(AND([.B885]>=[Calendario.$F$8];[.B885]<=[Calendario.$F$9];1);1;IF(AND([.B885]>=[Calendario.$F$12];[.B885]<=[Calendario.$F$13]);2;IF(AND([.B885]>=[Calendario.$F$16];[.B885]<=[Calendario.$F$17]);3;""))) ->  | D885: of:=IF(COUNTIF([Calendario.$H$4:.$H$48];[.B885])>0;"FIESTA";"") -> FIESTA | E885: of:=IF([.B885]<>"";VLOOKUP(WEEKDAY([.B885];3);[Calendario.$A$4:.$C$11];2);"") ->  | F885: of:=IF([.B885]<>"";IF([.D885]<>"FIESTA";VLOOKUP(WEEKDAY([.B885];3);[Calendario.$A$4:.$C$11];3);0);"") ->  | G885: of:=IF(ISNUMBER([.F885]);[.F885]+[.G884];"") ->  | H885: of:=IF(AND([.G885]<=[Unidades.$G$26];[.G885]<=[Unidades.$F$18];[Unidades.$F$18]>0);[Unidades.$D$18]+1-COUNTIFS([Unidades.$O$3:.$O$17];">="&[.G885]);"") ->  | I885: of:=IF([.H884]<>[.H885];"INICIO";IF([.H886]<>[.H885];"FIN";"")) ->  | J885: of:=IF([.K884]<>[.K885];"INICIO";IF([.K886]<>[.K885];"FIN";"")) -> 
A886: of:=IF([.B886]<>"";TODAY()>[.B886];"") ->  | B886: of:=IFERROR(IF(([.B885]+1)<[Calendario.$F$5];[.B885]+1;"");"") ->  | C886: of:=IF(AND([.B886]>=[Calendario.$F$8];[.B886]<=[Calendario.$F$9];1);1;IF(AND([.B886]>=[Calendario.$F$12];[.B886]<=[Calendario.$F$13]);2;IF(AND([.B886]>=[Calendario.$F$16];[.B886]<=[Calendario.$F$17]);3;""))) ->  | D886: of:=IF(COUNTIF([Calendario.$H$4:.$H$48];[.B886])>0;"FIESTA";"") -> FIESTA | E886: of:=IF([.B886]<>"";VLOOKUP(WEEKDAY([.B886];3);[Calendario.$A$4:.$C$11];2);"") ->  | F886: of:=IF([.B886]<>"";IF([.D886]<>"FIESTA";VLOOKUP(WEEKDAY([.B886];3);[Calendario.$A$4:.$C$11];3);0);"") ->  | G886: of:=IF(ISNUMBER([.F886]);[.F886]+[.G885];"") ->  | H886: of:=IF(AND([.G886]<=[Unidades.$G$26];[.G886]<=[Unidades.$F$18];[Unidades.$F$18]>0);[Unidades.$D$18]+1-COUNTIFS([Unidades.$O$3:.$O$17];">="&[.G886]);"") ->  | I886: of:=IF([.H885]<>[.H886];"INICIO";IF([.H887]<>[.H886];"FIN";"")) ->  | J886: of:=IF([.K885]<>[.K886];"INICIO";IF([.K887]<>[.K886];"FIN";"")) -> 
A887: of:=IF([.B887]<>"";TODAY()>[.B887];"") ->  | B887: of:=IFERROR(IF(([.B886]+1)<[Calendario.$F$5];[.B886]+1;"");"") ->  | C887: of:=IF(AND([.B887]>=[Calendario.$F$8];[.B887]<=[Calendario.$F$9];1);1;IF(AND([.B887]>=[Calendario.$F$12];[.B887]<=[Calendario.$F$13]);2;IF(AND([.B887]>=[Calendario.$F$16];[.B887]<=[Calendario.$F$17]);3;""))) ->  | D887: of:=IF(COUNTIF([Calendario.$H$4:.$H$48];[.B887])>0;"FIESTA";"") -> FIESTA | E887: of:=IF([.B887]<>"";VLOOKUP(WEEKDAY([.B887];3);[Calendario.$A$4:.$C$11];2);"") ->  | F887: of:=IF([.B887]<>"";IF([.D887]<>"FIESTA";VLOOKUP(WEEKDAY([.B887];3);[Calendario.$A$4:.$C$11];3);0);"") ->  | G887: of:=IF(ISNUMBER([.F887]);[.F887]+[.G886];"") ->  | H887: of:=IF(AND([.G887]<=[Unidades.$G$26];[.G887]<=[Unidades.$F$18];[Unidades.$F$18]>0);[Unidades.$D$18]+1-COUNTIFS([Unidades.$O$3:.$O$17];">="&[.G887]);"") ->  | I887: of:=IF([.H886]<>[.H887];"INICIO";IF([.H888]<>[.H887];"FIN";"")) ->  | J887: of:=IF([.K886]<>[.K887];"INICIO";IF([.K888]<>[.K887];"FIN";"")) -> 
A888: of:=IF([.B888]<>"";TODAY()>[.B888];"") ->  | B888: of:=IFERROR(IF(([.B887]+1)<[Calendario.$F$5];[.B887]+1;"");"") ->  | C888: of:=IF(AND([.B888]>=[Calendario.$F$8];[.B888]<=[Calendario.$F$9];1);1;IF(AND([.B888]>=[Calendario.$F$12];[.B888]<=[Calendario.$F$13]);2;IF(AND([.B888]>=[Calendario.$F$16];[.B888]<=[Calendario.$F$17]);3;""))) ->  | D888: of:=IF(COUNTIF([Calendario.$H$4:.$H$48];[.B888])>0;"FIESTA";"") -> FIESTA | E888: of:=IF([.B888]<>"";VLOOKUP(WEEKDAY([.B888];3);[Calendario.$A$4:.$C$11];2);"") ->  | F888: of:=IF([.B888]<>"";IF([.D888]<>"FIESTA";VLOOKUP(WEEKDAY([.B888];3);[Calendario.$A$4:.$C$11];3);0);"") ->  | G888: of:=IF(ISNUMBER([.F888]);[.F888]+[.G887];"") ->  | H888: of:=IF(AND([.G888]<=[Unidades.$G$26];[.G888]<=[Unidades.$F$18];[Unidades.$F$18]>0);[Unidades.$D$18]+1-COUNTIFS([Unidades.$O$3:.$O$17];">="&[.G888]);"") ->  | I888: of:=IF([.H887]<>[.H888];"INICIO";IF([.H889]<>[.H888];"FIN";"")) ->  | J888: of:=IF([.K887]<>[.K888];"INICIO";IF([.K889]<>[.K888];"FIN";"")) -> 
A889: of:=IF([.B889]<>"";TODAY()>[.B889];"") ->  | B889: of:=IFERROR(IF(([.B888]+1)<[Calendario.$F$5];[.B888]+1;"");"") ->  | C889: of:=IF(AND([.B889]>=[Calendario.$F$8];[.B889]<=[Calendario.$F$9];1);1;IF(AND([.B889]>=[Calendario.$F$12];[.B889]<=[Calendario.$F$13]);2;IF(AND([.B889]>=[Calendario.$F$16];[.B889]<=[Calendario.$F$17]);3;""))) ->  | D889: of:=IF(COUNTIF([Calendario.$H$4:.$H$48];[.B889])>0;"FIESTA";"") -> FIESTA | E889: of:=IF([.B889]<>"";VLOOKUP(WEEKDAY([.B889];3);[Calendario.$A$4:.$C$11];2);"") ->  | F889: of:=IF([.B889]<>"";IF([.D889]<>"FIESTA";VLOOKUP(WEEKDAY([.B889];3);[Calendario.$A$4:.$C$11];3);0);"") ->  | G889: of:=IF(ISNUMBER([.F889]);[.F889]+[.G888];"") ->  | H889: of:=IF(AND([.G889]<=[Unidades.$G$26];[.G889]<=[Unidades.$F$18];[Unidades.$F$18]>0);[Unidades.$D$18]+1-COUNTIFS([Unidades.$O$3:.$O$17];">="&[.G889]);"") ->  | I889: of:=IF([.H888]<>[.H889];"INICIO";IF([.H890]<>[.H889];"FIN";"")) ->  | J889: of:=IF([.K888]<>[.K889];"INICIO";IF([.K890]<>[.K889];"FIN";"")) -> 
A890: of:=IF([.B890]<>"";TODAY()>[.B890];"") ->  | B890: of:=IFERROR(IF(([.B889]+1)<[Calendario.$F$5];[.B889]+1;"");"") ->  | C890: of:=IF(AND([.B890]>=[Calendario.$F$8];[.B890]<=[Calendario.$F$9];1);1;IF(AND([.B890]>=[Calendario.$F$12];[.B890]<=[Calendario.$F$13]);2;IF(AND([.B890]>=[Calendario.$F$16];[.B890]<=[Calendario.$F$17]);3;""))) ->  | D890: of:=IF(COUNTIF([Calendario.$H$4:.$H$48];[.B890])>0;"FIESTA";"") -> FIESTA | E890: of:=IF([.B890]<>"";VLOOKUP(WEEKDAY([.B890];3);[Calendario.$A$4:.$C$11];2);"") ->  | F890: of:=IF([.B890]<>"";IF([.D890]<>"FIESTA";VLOOKUP(WEEKDAY([.B890];3);[Calendario.$A$4:.$C$11];3);0);"") ->  | G890: of:=IF(ISNUMBER([.F890]);[.F890]+[.G889];"") ->  | H890: of:=IF(AND([.G890]<=[Unidades.$G$26];[.G890]<=[Unidades.$F$18];[Unidades.$F$18]>0);[Unidades.$D$18]+1-COUNTIFS([Unidades.$O$3:.$O$17];">="&[.G890]);"") ->  | I890: of:=IF([.H889]<>[.H890];"INICIO";IF([.H891]<>[.H890];"FIN";"")) ->  | J890: of:=IF([.K889]<>[.K890];"INICIO";IF([.K891]<>[.K890];"FIN";"")) -> 
A891: of:=IF([.B891]<>"";TODAY()>[.B891];"") ->  | B891: of:=IFERROR(IF(([.B890]+1)<[Calendario.$F$5];[.B890]+1;"");"") ->  | C891: of:=IF(AND([.B891]>=[Calendario.$F$8];[.B891]<=[Calendario.$F$9];1);1;IF(AND([.B891]>=[Calendario.$F$12];[.B891]<=[Calendario.$F$13]);2;IF(AND([.B891]>=[Calendario.$F$16];[.B891]<=[Calendario.$F$17]);3;""))) ->  | D891: of:=IF(COUNTIF([Calendario.$H$4:.$H$48];[.B891])>0;"FIESTA";"") -> FIESTA | E891: of:=IF([.B891]<>"";VLOOKUP(WEEKDAY([.B891];3);[Calendario.$A$4:.$C$11];2);"") ->  | F891: of:=IF([.B891]<>"";IF([.D891]<>"FIESTA";VLOOKUP(WEEKDAY([.B891];3);[Calendario.$A$4:.$C$11];3);0);"") ->  | G891: of:=IF(ISNUMBER([.F891]);[.F891]+[.G890];"") ->  | H891: of:=IF(AND([.G891]<=[Unidades.$G$26];[.G891]<=[Unidades.$F$18];[Unidades.$F$18]>0);[Unidades.$D$18]+1-COUNTIFS([Unidades.$O$3:.$O$17];">="&[.G891]);"") ->  | I891: of:=IF([.H890]<>[.H891];"INICIO";IF([.H892]<>[.H891];"FIN";"")) ->  | J891: of:=IF([.K890]<>[.K891];"INICIO";IF([.K892]<>[.K891];"FIN";"")) -> 
A892: of:=IF([.B892]<>"";TODAY()>[.B892];"") ->  | B892: of:=IFERROR(IF(([.B891]+1)<[Calendario.$F$5];[.B891]+1;"");"") ->  | C892: of:=IF(AND([.B892]>=[Calendario.$F$8];[.B892]<=[Calendario.$F$9];1);1;IF(AND([.B892]>=[Calendario.$F$12];[.B892]<=[Calendario.$F$13]);2;IF(AND([.B892]>=[Calendario.$F$16];[.B892]<=[Calendario.$F$17]);3;""))) ->  | D892: of:=IF(COUNTIF([Calendario.$H$4:.$H$48];[.B892])>0;"FIESTA";"") -> FIESTA | E892: of:=IF([.B892]<>"";VLOOKUP(WEEKDAY([.B892];3);[Calendario.$A$4:.$C$11];2);"") ->  | F892: of:=IF([.B892]<>"";IF([.D892]<>"FIESTA";VLOOKUP(WEEKDAY([.B892];3);[Calendario.$A$4:.$C$11];3);0);"") ->  | G892: of:=IF(ISNUMBER([.F892]);[.F892]+[.G891];"") ->  | H892: of:=IF(AND([.G892]<=[Unidades.$G$26];[.G892]<=[Unidades.$F$18];[Unidades.$F$18]>0);[Unidades.$D$18]+1-COUNTIFS([Unidades.$O$3:.$O$17];">="&[.G892]);"") ->  | I892: of:=IF([.H891]<>[.H892];"INICIO";IF([.H893]<>[.H892];"FIN";"")) ->  | J892: of:=IF([.K891]<>[.K892];"INICIO";IF([.K893]<>[.K892];"FIN";"")) -> 
A893: of:=IF([.B893]<>"";TODAY()>[.B893];"") ->  | B893: of:=IFERROR(IF(([.B892]+1)<[Calendario.$F$5];[.B892]+1;"");"") ->  | C893: of:=IF(AND([.B893]>=[Calendario.$F$8];[.B893]<=[Calendario.$F$9];1);1;IF(AND([.B893]>=[Calendario.$F$12];[.B893]<=[Calendario.$F$13]);2;IF(AND([.B893]>=[Calendario.$F$16];[.B893]<=[Calendario.$F$17]);3;""))) ->  | D893: of:=IF(COUNTIF([Calendario.$H$4:.$H$48];[.B893])>0;"FIESTA";"") -> FIESTA | E893: of:=IF([.B893]<>"";VLOOKUP(WEEKDAY([.B893];3);[Calendario.$A$4:.$C$11];2);"") ->  | F893: of:=IF([.B893]<>"";IF([.D893]<>"FIESTA";VLOOKUP(WEEKDAY([.B893];3);[Calendario.$A$4:.$C$11];3);0);"") ->  | G893: of:=IF(ISNUMBER([.F893]);[.F893]+[.G892];"") ->  | H893: of:=IF(AND([.G893]<=[Unidades.$G$26];[.G893]<=[Unidades.$F$18];[Unidades.$F$18]>0);[Unidades.$D$18]+1-COUNTIFS([Unidades.$O$3:.$O$17];">="&[.G893]);"") ->  | I893: of:=IF([.H892]<>[.H893];"INICIO";IF([.H894]<>[.H893];"FIN";"")) ->  | J893: of:=IF([.K892]<>[.K893];"INICIO";IF([.K894]<>[.K893];"FIN";"")) -> 
A894: of:=IF([.B894]<>"";TODAY()>[.B894];"") ->  | B894: of:=IFERROR(IF(([.B893]+1)<[Calendario.$F$5];[.B893]+1;"");"") ->  | C894: of:=IF(AND([.B894]>=[Calendario.$F$8];[.B894]<=[Calendario.$F$9];1);1;IF(AND([.B894]>=[Calendario.$F$12];[.B894]<=[Calendario.$F$13]);2;IF(AND([.B894]>=[Calendario.$F$16];[.B894]<=[Calendario.$F$17]);3;""))) ->  | D894: of:=IF(COUNTIF([Calendario.$H$4:.$H$48];[.B894])>0;"FIESTA";"") -> FIESTA | E894: of:=IF([.B894]<>"";VLOOKUP(WEEKDAY([.B894];3);[Calendario.$A$4:.$C$11];2);"") ->  | F894: of:=IF([.B894]<>"";IF([.D894]<>"FIESTA";VLOOKUP(WEEKDAY([.B894];3);[Calendario.$A$4:.$C$11];3);0);"") ->  | G894: of:=IF(ISNUMBER([.F894]);[.F894]+[.G893];"") ->  | H894: of:=IF(AND([.G894]<=[Unidades.$G$26];[.G894]<=[Unidades.$F$18];[Unidades.$F$18]>0);[Unidades.$D$18]+1-COUNTIFS([Unidades.$O$3:.$O$17];">="&[.G894]);"") ->  | I894: of:=IF([.H893]<>[.H894];"INICIO";IF([.H895]<>[.H894];"FIN";"")) ->  | J894: of:=IF([.K893]<>[.K894];"INICIO";IF([.K895]<>[.K894];"FIN";"")) -> 
A895: of:=IF([.B895]<>"";TODAY()>[.B895];"") ->  | B895: of:=IFERROR(IF(([.B894]+1)<[Calendario.$F$5];[.B894]+1;"");"") ->  | C895: of:=IF(AND([.B895]>=[Calendario.$F$8];[.B895]<=[Calendario.$F$9];1);1;IF(AND([.B895]>=[Calendario.$F$12];[.B895]<=[Calendario.$F$13]);2;IF(AND([.B895]>=[Calendario.$F$16];[.B895]<=[Calendario.$F$17]);3;""))) ->  | D895: of:=IF(COUNTIF([Calendario.$H$4:.$H$48];[.B895])>0;"FIESTA";"") -> FIESTA | E895: of:=IF([.B895]<>"";VLOOKUP(WEEKDAY([.B895];3);[Calendario.$A$4:.$C$11];2);"") ->  | F895: of:=IF([.B895]<>"";IF([.D895]<>"FIESTA";VLOOKUP(WEEKDAY([.B895];3);[Calendario.$A$4:.$C$11];3);0);"") ->  | G895: of:=IF(ISNUMBER([.F895]);[.F895]+[.G894];"") ->  | H895: of:=IF(AND([.G895]<=[Unidades.$G$26];[.G895]<=[Unidades.$F$18];[Unidades.$F$18]>0);[Unidades.$D$18]+1-COUNTIFS([Unidades.$O$3:.$O$17];">="&[.G895]);"") ->  | I895: of:=IF([.H894]<>[.H895];"INICIO";IF([.H896]<>[.H895];"FIN";"")) ->  | J895: of:=IF([.K894]<>[.K895];"INICIO";IF([.K896]<>[.K895];"FIN";"")) -> 
A896: of:=IF([.B896]<>"";TODAY()>[.B896];"") ->  | B896: of:=IFERROR(IF(([.B895]+1)<[Calendario.$F$5];[.B895]+1;"");"") ->  | C896: of:=IF(AND([.B896]>=[Calendario.$F$8];[.B896]<=[Calendario.$F$9];1);1;IF(AND([.B896]>=[Calendario.$F$12];[.B896]<=[Calendario.$F$13]);2;IF(AND([.B896]>=[Calendario.$F$16];[.B896]<=[Calendario.$F$17]);3;""))) ->  | D896: of:=IF(COUNTIF([Calendario.$H$4:.$H$48];[.B896])>0;"FIESTA";"") -> FIESTA | E896: of:=IF([.B896]<>"";VLOOKUP(WEEKDAY([.B896];3);[Calendario.$A$4:.$C$11];2);"") ->  | F896: of:=IF([.B896]<>"";IF([.D896]<>"FIESTA";VLOOKUP(WEEKDAY([.B896];3);[Calendario.$A$4:.$C$11];3);0);"") ->  | G896: of:=IF(ISNUMBER([.F896]);[.F896]+[.G895];"") ->  | H896: of:=IF(AND([.G896]<=[Unidades.$G$26];[.G896]<=[Unidades.$F$18];[Unidades.$F$18]>0);[Unidades.$D$18]+1-COUNTIFS([Unidades.$O$3:.$O$17];">="&[.G896]);"") ->  | I896: of:=IF([.H895]<>[.H896];"INICIO";IF([.H897]<>[.H896];"FIN";"")) ->  | J896: of:=IF([.K895]<>[.K896];"INICIO";IF([.K897]<>[.K896];"FIN";"")) -> 
A897: of:=IF([.B897]<>"";TODAY()>[.B897];"") ->  | B897: of:=IFERROR(IF(([.B896]+1)<[Calendario.$F$5];[.B896]+1;"");"") ->  | C897: of:=IF(AND([.B897]>=[Calendario.$F$8];[.B897]<=[Calendario.$F$9];1);1;IF(AND([.B897]>=[Calendario.$F$12];[.B897]<=[Calendario.$F$13]);2;IF(AND([.B897]>=[Calendario.$F$16];[.B897]<=[Calendario.$F$17]);3;""))) ->  | D897: of:=IF(COUNTIF([Calendario.$H$4:.$H$48];[.B897])>0;"FIESTA";"") -> FIESTA | E897: of:=IF([.B897]<>"";VLOOKUP(WEEKDAY([.B897];3);[Calendario.$A$4:.$C$11];2);"") ->  | F897: of:=IF([.B897]<>"";IF([.D897]<>"FIESTA";VLOOKUP(WEEKDAY([.B897];3);[Calendario.$A$4:.$C$11];3);0);"") ->  | G897: of:=IF(ISNUMBER([.F897]);[.F897]+[.G896];"") ->  | H897: of:=IF(AND([.G897]<=[Unidades.$G$26];[.G897]<=[Unidades.$F$18];[Unidades.$F$18]>0);[Unidades.$D$18]+1-COUNTIFS([Unidades.$O$3:.$O$17];">="&[.G897]);"") ->  | I897: of:=IF([.H896]<>[.H897];"INICIO";IF([.H898]<>[.H897];"FIN";"")) ->  | J897: of:=IF([.K896]<>[.K897];"INICIO";IF([.K898]<>[.K897];"FIN";"")) -> 
A898: of:=IF([.B898]<>"";TODAY()>[.B898];"") ->  | B898: of:=IFERROR(IF(([.B897]+1)<[Calendario.$F$5];[.B897]+1;"");"") ->  | C898: of:=IF(AND([.B898]>=[Calendario.$F$8];[.B898]<=[Calendario.$F$9];1);1;IF(AND([.B898]>=[Calendario.$F$12];[.B898]<=[Calendario.$F$13]);2;IF(AND([.B898]>=[Calendario.$F$16];[.B898]<=[Calendario.$F$17]);3;""))) ->  | D898: of:=IF(COUNTIF([Calendario.$H$4:.$H$48];[.B898])>0;"FIESTA";"") -> FIESTA | E898: of:=IF([.B898]<>"";VLOOKUP(WEEKDAY([.B898];3);[Calendario.$A$4:.$C$11];2);"") ->  | F898: of:=IF([.B898]<>"";IF([.D898]<>"FIESTA";VLOOKUP(WEEKDAY([.B898];3);[Calendario.$A$4:.$C$11];3);0);"") ->  | G898: of:=IF(ISNUMBER([.F898]);[.F898]+[.G897];"") ->  | H898: of:=IF(AND([.G898]<=[Unidades.$G$26];[.G898]<=[Unidades.$F$18];[Unidades.$F$18]>0);[Unidades.$D$18]+1-COUNTIFS([Unidades.$O$3:.$O$17];">="&[.G898]);"") ->  | I898: of:=IF([.H897]<>[.H898];"INICIO";IF([.H899]<>[.H898];"FIN";"")) ->  | J898: of:=IF([.K897]<>[.K898];"INICIO";IF([.K899]<>[.K898];"FIN";"")) -> 
A899: of:=IF([.B899]<>"";TODAY()>[.B899];"") ->  | B899: of:=IFERROR(IF(([.B898]+1)<[Calendario.$F$5];[.B898]+1;"");"") ->  | C899: of:=IF(AND([.B899]>=[Calendario.$F$8];[.B899]<=[Calendario.$F$9];1);1;IF(AND([.B899]>=[Calendario.$F$12];[.B899]<=[Calendario.$F$13]);2;IF(AND([.B899]>=[Calendario.$F$16];[.B899]<=[Calendario.$F$17]);3;""))) ->  | D899: of:=IF(COUNTIF([Calendario.$H$4:.$H$48];[.B899])>0;"FIESTA";"") -> FIESTA | E899: of:=IF([.B899]<>"";VLOOKUP(WEEKDAY([.B899];3);[Calendario.$A$4:.$C$11];2);"") ->  | F899: of:=IF([.B899]<>"";IF([.D899]<>"FIESTA";VLOOKUP(WEEKDAY([.B899];3);[Calendario.$A$4:.$C$11];3);0);"") ->  | G899: of:=IF(ISNUMBER([.F899]);[.F899]+[.G898];"") ->  | H899: of:=IF(AND([.G899]<=[Unidades.$G$26];[.G899]<=[Unidades.$F$18];[Unidades.$F$18]>0);[Unidades.$D$18]+1-COUNTIFS([Unidades.$O$3:.$O$17];">="&[.G899]);"") ->  | I899: of:=IF([.H898]<>[.H899];"INICIO";IF([.H900]<>[.H899];"FIN";"")) ->  | J899: of:=IF([.K898]<>[.K899];"INICIO";IF([.K900]<>[.K899];"FIN";"")) -> 
A900: of:=IF([.B900]<>"";TODAY()>[.B900];"") ->  | B900: of:=IFERROR(IF(([.B899]+1)<[Calendario.$F$5];[.B899]+1;"");"") ->  | C900: of:=IF(AND([.B900]>=[Calendario.$F$8];[.B900]<=[Calendario.$F$9];1);1;IF(AND([.B900]>=[Calendario.$F$12];[.B900]<=[Calendario.$F$13]);2;IF(AND([.B900]>=[Calendario.$F$16];[.B900]<=[Calendario.$F$17]);3;""))) ->  | D900: of:=IF(COUNTIF([Calendario.$H$4:.$H$48];[.B900])>0;"FIESTA";"") -> FIESTA | E900: of:=IF([.B900]<>"";VLOOKUP(WEEKDAY([.B900];3);[Calendario.$A$4:.$C$11];2);"") ->  | F900: of:=IF([.B900]<>"";IF([.D900]<>"FIESTA";VLOOKUP(WEEKDAY([.B900];3);[Calendario.$A$4:.$C$11];3);0);"") ->  | G900: of:=IF(ISNUMBER([.F900]);[.F900]+[.G899];"") ->  | H900: of:=IF(AND([.G900]<=[Unidades.$G$26];[.G900]<=[Unidades.$F$18];[Unidades.$F$18]>0);[Unidades.$D$18]+1-COUNTIFS([Unidades.$O$3:.$O$17];">="&[.G900]);"") ->  | I900: of:=IF([.H899]<>[.H900];"INICIO";IF([.H901]<>[.H900];"FIN";"")) ->  | J900: of:=IF([.K899]<>[.K900];"INICIO";IF([.K901]<>[.K900];"FIN";"")) -> 
A901: of:=IF([.B901]<>"";TODAY()>[.B901];"") ->  | B901: of:=IFERROR(IF(([.B900]+1)<[Calendario.$F$5];[.B900]+1;"");"") ->  | C901: of:=IF(AND([.B901]>=[Calendario.$F$8];[.B901]<=[Calendario.$F$9];1);1;IF(AND([.B901]>=[Calendario.$F$12];[.B901]<=[Calendario.$F$13]);2;IF(AND([.B901]>=[Calendario.$F$16];[.B901]<=[Calendario.$F$17]);3;""))) ->  | D901: of:=IF(COUNTIF([Calendario.$H$4:.$H$48];[.B901])>0;"FIESTA";"") -> FIESTA | E901: of:=IF([.B901]<>"";VLOOKUP(WEEKDAY([.B901];3);[Calendario.$A$4:.$C$11];2);"") ->  | F901: of:=IF([.B901]<>"";IF([.D901]<>"FIESTA";VLOOKUP(WEEKDAY([.B901];3);[Calendario.$A$4:.$C$11];3);0);"") ->  | G901: of:=IF(ISNUMBER([.F901]);[.F901]+[.G900];"") ->  | H901: of:=IF(AND([.G901]<=[Unidades.$G$26];[.G901]<=[Unidades.$F$18];[Unidades.$F$18]>0);[Unidades.$D$18]+1-COUNTIFS([Unidades.$O$3:.$O$17];">="&[.G901]);"") ->  | I901: of:=IF([.H900]<>[.H901];"INICIO";IF([.H902]<>[.H901];"FIN";"")) ->  | J901: of:=IF([.K900]<>[.K901];"INICIO";IF([.K902]<>[.K901];"FIN";"")) -> 
A902: of:=IF([.B902]<>"";TODAY()>[.B902];"") ->  | B902: of:=IFERROR(IF(([.B901]+1)<[Calendario.$F$5];[.B901]+1;"");"") ->  | C902: of:=IF(AND([.B902]>=[Calendario.$F$8];[.B902]<=[Calendario.$F$9];1);1;IF(AND([.B902]>=[Calendario.$F$12];[.B902]<=[Calendario.$F$13]);2;IF(AND([.B902]>=[Calendario.$F$16];[.B902]<=[Calendario.$F$17]);3;""))) ->  | D902: of:=IF(COUNTIF([Calendario.$H$4:.$H$48];[.B902])>0;"FIESTA";"") -> FIESTA | E902: of:=IF([.B902]<>"";VLOOKUP(WEEKDAY([.B902];3);[Calendario.$A$4:.$C$11];2);"") ->  | F902: of:=IF([.B902]<>"";IF([.D902]<>"FIESTA";VLOOKUP(WEEKDAY([.B902];3);[Calendario.$A$4:.$C$11];3);0);"") ->  | G902: of:=IF(ISNUMBER([.F902]);[.F902]+[.G901];"") ->  | H902: of:=IF(AND([.G902]<=[Unidades.$G$26];[.G902]<=[Unidades.$F$18];[Unidades.$F$18]>0);[Unidades.$D$18]+1-COUNTIFS([Unidades.$O$3:.$O$17];">="&[.G902]);"") ->  | I902: of:=IF([.H901]<>[.H902];"INICIO";IF([.H903]<>[.H902];"FIN";"")) ->  | J902: of:=IF([.K901]<>[.K902];"INICIO";IF([.K903]<>[.K902];"FIN";"")) -> 
A903: of:=IF([.B903]<>"";TODAY()>[.B903];"") ->  | B903: of:=IFERROR(IF(([.B902]+1)<[Calendario.$F$5];[.B902]+1;"");"") ->  | C903: of:=IF(AND([.B903]>=[Calendario.$F$8];[.B903]<=[Calendario.$F$9];1);1;IF(AND([.B903]>=[Calendario.$F$12];[.B903]<=[Calendario.$F$13]);2;IF(AND([.B903]>=[Calendario.$F$16];[.B903]<=[Calendario.$F$17]);3;""))) ->  | D903: of:=IF(COUNTIF([Calendario.$H$4:.$H$48];[.B903])>0;"FIESTA";"") -> FIESTA | E903: of:=IF([.B903]<>"";VLOOKUP(WEEKDAY([.B903];3);[Calendario.$A$4:.$C$11];2);"") ->  | F903: of:=IF([.B903]<>"";IF([.D903]<>"FIESTA";VLOOKUP(WEEKDAY([.B903];3);[Calendario.$A$4:.$C$11];3);0);"") ->  | G903: of:=IF(ISNUMBER([.F903]);[.F903]+[.G902];"") ->  | H903: of:=IF(AND([.G903]<=[Unidades.$G$26];[.G903]<=[Unidades.$F$18];[Unidades.$F$18]>0);[Unidades.$D$18]+1-COUNTIFS([Unidades.$O$3:.$O$17];">="&[.G903]);"") ->  | I903: of:=IF([.H902]<>[.H903];"INICIO";IF([.H904]<>[.H903];"FIN";"")) ->  | J903: of:=IF([.K902]<>[.K903];"INICIO";IF([.K904]<>[.K903];"FIN";"")) -> 
A904: of:=IF([.B904]<>"";TODAY()>[.B904];"") ->  | B904: of:=IFERROR(IF(([.B903]+1)<[Calendario.$F$5];[.B903]+1;"");"") ->  | C904: of:=IF(AND([.B904]>=[Calendario.$F$8];[.B904]<=[Calendario.$F$9];1);1;IF(AND([.B904]>=[Calendario.$F$12];[.B904]<=[Calendario.$F$13]);2;IF(AND([.B904]>=[Calendario.$F$16];[.B904]<=[Calendario.$F$17]);3;""))) ->  | D904: of:=IF(COUNTIF([Calendario.$H$4:.$H$48];[.B904])>0;"FIESTA";"") -> FIESTA | E904: of:=IF([.B904]<>"";VLOOKUP(WEEKDAY([.B904];3);[Calendario.$A$4:.$C$11];2);"") ->  | F904: of:=IF([.B904]<>"";IF([.D904]<>"FIESTA";VLOOKUP(WEEKDAY([.B904];3);[Calendario.$A$4:.$C$11];3);0);"") ->  | G904: of:=IF(ISNUMBER([.F904]);[.F904]+[.G903];"") ->  | H904: of:=IF(AND([.G904]<=[Unidades.$G$26];[.G904]<=[Unidades.$F$18];[Unidades.$F$18]>0);[Unidades.$D$18]+1-COUNTIFS([Unidades.$O$3:.$O$17];">="&[.G904]);"") ->  | I904: of:=IF([.H903]<>[.H904];"INICIO";IF([.H905]<>[.H904];"FIN";"")) ->  | J904: of:=IF([.K903]<>[.K904];"INICIO";IF([.K905]<>[.K904];"FIN";"")) -> 
A905: of:=IF([.B905]<>"";TODAY()>[.B905];"") ->  | B905: of:=IFERROR(IF(([.B904]+1)<[Calendario.$F$5];[.B904]+1;"");"") ->  | C905: of:=IF(AND([.B905]>=[Calendario.$F$8];[.B905]<=[Calendario.$F$9];1);1;IF(AND([.B905]>=[Calendario.$F$12];[.B905]<=[Calendario.$F$13]);2;IF(AND([.B905]>=[Calendario.$F$16];[.B905]<=[Calendario.$F$17]);3;""))) ->  | D905: of:=IF(COUNTIF([Calendario.$H$4:.$H$48];[.B905])>0;"FIESTA";"") -> FIESTA | E905: of:=IF([.B905]<>"";VLOOKUP(WEEKDAY([.B905];3);[Calendario.$A$4:.$C$11];2);"") ->  | F905: of:=IF([.B905]<>"";IF([.D905]<>"FIESTA";VLOOKUP(WEEKDAY([.B905];3);[Calendario.$A$4:.$C$11];3);0);"") ->  | G905: of:=IF(ISNUMBER([.F905]);[.F905]+[.G904];"") ->  | H905: of:=IF(AND([.G905]<=[Unidades.$G$26];[.G905]<=[Unidades.$F$18];[Unidades.$F$18]>0);[Unidades.$D$18]+1-COUNTIFS([Unidades.$O$3:.$O$17];">="&[.G905]);"") ->  | I905: of:=IF([.H904]<>[.H905];"INICIO";IF([.H906]<>[.H905];"FIN";"")) ->  | J905: of:=IF([.K904]<>[.K905];"INICIO";IF([.K906]<>[.K905];"FIN";"")) -> 
A906: of:=IF([.B906]<>"";TODAY()>[.B906];"") ->  | B906: of:=IFERROR(IF(([.B905]+1)<[Calendario.$F$5];[.B905]+1;"");"") ->  | C906: of:=IF(AND([.B906]>=[Calendario.$F$8];[.B906]<=[Calendario.$F$9];1);1;IF(AND([.B906]>=[Calendario.$F$12];[.B906]<=[Calendario.$F$13]);2;IF(AND([.B906]>=[Calendario.$F$16];[.B906]<=[Calendario.$F$17]);3;""))) ->  | D906: of:=IF(COUNTIF([Calendario.$H$4:.$H$48];[.B906])>0;"FIESTA";"") -> FIESTA | E906: of:=IF([.B906]<>"";VLOOKUP(WEEKDAY([.B906];3);[Calendario.$A$4:.$C$11];2);"") ->  | F906: of:=IF([.B906]<>"";IF([.D906]<>"FIESTA";VLOOKUP(WEEKDAY([.B906];3);[Calendario.$A$4:.$C$11];3);0);"") ->  | G906: of:=IF(ISNUMBER([.F906]);[.F906]+[.G905];"") ->  | H906: of:=IF(AND([.G906]<=[Unidades.$G$26];[.G906]<=[Unidades.$F$18];[Unidades.$F$18]>0);[Unidades.$D$18]+1-COUNTIFS([Unidades.$O$3:.$O$17];">="&[.G906]);"") ->  | I906: of:=IF([.H905]<>[.H906];"INICIO";IF([.H907]<>[.H906];"FIN";"")) ->  | J906: of:=IF([.K905]<>[.K906];"INICIO";IF([.K907]<>[.K906];"FIN";"")) -> 
A907: of:=IF([.B907]<>"";TODAY()>[.B907];"") ->  | B907: of:=IFERROR(IF(([.B906]+1)<[Calendario.$F$5];[.B906]+1;"");"") ->  | C907: of:=IF(AND([.B907]>=[Calendario.$F$8];[.B907]<=[Calendario.$F$9];1);1;IF(AND([.B907]>=[Calendario.$F$12];[.B907]<=[Calendario.$F$13]);2;IF(AND([.B907]>=[Calendario.$F$16];[.B907]<=[Calendario.$F$17]);3;""))) ->  | D907: of:=IF(COUNTIF([Calendario.$H$4:.$H$48];[.B907])>0;"FIESTA";"") -> FIESTA | E907: of:=IF([.B907]<>"";VLOOKUP(WEEKDAY([.B907];3);[Calendario.$A$4:.$C$11];2);"") ->  | F907: of:=IF([.B907]<>"";IF([.D907]<>"FIESTA";VLOOKUP(WEEKDAY([.B907];3);[Calendario.$A$4:.$C$11];3);0);"") ->  | G907: of:=IF(ISNUMBER([.F907]);[.F907]+[.G906];"") ->  | H907: of:=IF(AND([.G907]<=[Unidades.$G$26];[.G907]<=[Unidades.$F$18];[Unidades.$F$18]>0);[Unidades.$D$18]+1-COUNTIFS([Unidades.$O$3:.$O$17];">="&[.G907]);"") ->  | I907: of:=IF([.H906]<>[.H907];"INICIO";IF([.H908]<>[.H907];"FIN";"")) ->  | J907: of:=IF([.K906]<>[.K907];"INICIO";IF([.K908]<>[.K907];"FIN";"")) -> 
A908: of:=IF([.B908]<>"";TODAY()>[.B908];"") ->  | B908: of:=IFERROR(IF(([.B907]+1)<[Calendario.$F$5];[.B907]+1;"");"") ->  | C908: of:=IF(AND([.B908]>=[Calendario.$F$8];[.B908]<=[Calendario.$F$9];1);1;IF(AND([.B908]>=[Calendario.$F$12];[.B908]<=[Calendario.$F$13]);2;IF(AND([.B908]>=[Calendario.$F$16];[.B908]<=[Calendario.$F$17]);3;""))) ->  | D908: of:=IF(COUNTIF([Calendario.$H$4:.$H$48];[.B908])>0;"FIESTA";"") -> FIESTA | E908: of:=IF([.B908]<>"";VLOOKUP(WEEKDAY([.B908];3);[Calendario.$A$4:.$C$11];2);"") ->  | F908: of:=IF([.B908]<>"";IF([.D908]<>"FIESTA";VLOOKUP(WEEKDAY([.B908];3);[Calendario.$A$4:.$C$11];3);0);"") ->  | G908: of:=IF(ISNUMBER([.F908]);[.F908]+[.G907];"") ->  | H908: of:=IF(AND([.G908]<=[Unidades.$G$26];[.G908]<=[Unidades.$F$18];[Unidades.$F$18]>0);[Unidades.$D$18]+1-COUNTIFS([Unidades.$O$3:.$O$17];">="&[.G908]);"") ->  | I908: of:=IF([.H907]<>[.H908];"INICIO";IF([.H909]<>[.H908];"FIN";"")) ->  | J908: of:=IF([.K907]<>[.K908];"INICIO";IF([.K909]<>[.K908];"FIN";"")) -> 
A909: of:=IF([.B909]<>"";TODAY()>[.B909];"") ->  | B909: of:=IFERROR(IF(([.B908]+1)<[Calendario.$F$5];[.B908]+1;"");"") ->  | C909: of:=IF(AND([.B909]>=[Calendario.$F$8];[.B909]<=[Calendario.$F$9];1);1;IF(AND([.B909]>=[Calendario.$F$12];[.B909]<=[Calendario.$F$13]);2;IF(AND([.B909]>=[Calendario.$F$16];[.B909]<=[Calendario.$F$17]);3;""))) ->  | D909: of:=IF(COUNTIF([Calendario.$H$4:.$H$48];[.B909])>0;"FIESTA";"") -> FIESTA | E909: of:=IF([.B909]<>"";VLOOKUP(WEEKDAY([.B909];3);[Calendario.$A$4:.$C$11];2);"") ->  | F909: of:=IF([.B909]<>"";IF([.D909]<>"FIESTA";VLOOKUP(WEEKDAY([.B909];3);[Calendario.$A$4:.$C$11];3);0);"") ->  | G909: of:=IF(ISNUMBER([.F909]);[.F909]+[.G908];"") ->  | H909: of:=IF(AND([.G909]<=[Unidades.$G$26];[.G909]<=[Unidades.$F$18];[Unidades.$F$18]>0);[Unidades.$D$18]+1-COUNTIFS([Unidades.$O$3:.$O$17];">="&[.G909]);"") ->  | I909: of:=IF([.H908]<>[.H909];"INICIO";IF([.H910]<>[.H909];"FIN";"")) ->  | J909: of:=IF([.K908]<>[.K909];"INICIO";IF([.K910]<>[.K909];"FIN";"")) -> 
A910: of:=IF([.B910]<>"";TODAY()>[.B910];"") ->  | B910: of:=IFERROR(IF(([.B909]+1)<[Calendario.$F$5];[.B909]+1;"");"") ->  | C910: of:=IF(AND([.B910]>=[Calendario.$F$8];[.B910]<=[Calendario.$F$9];1);1;IF(AND([.B910]>=[Calendario.$F$12];[.B910]<=[Calendario.$F$13]);2;IF(AND([.B910]>=[Calendario.$F$16];[.B910]<=[Calendario.$F$17]);3;""))) ->  | D910: of:=IF(COUNTIF([Calendario.$H$4:.$H$48];[.B910])>0;"FIESTA";"") -> FIESTA | E910: of:=IF([.B910]<>"";VLOOKUP(WEEKDAY([.B910];3);[Calendario.$A$4:.$C$11];2);"") ->  | F910: of:=IF([.B910]<>"";IF([.D910]<>"FIESTA";VLOOKUP(WEEKDAY([.B910];3);[Calendario.$A$4:.$C$11];3);0);"") ->  | G910: of:=IF(ISNUMBER([.F910]);[.F910]+[.G909];"") ->  | H910: of:=IF(AND([.G910]<=[Unidades.$G$26];[.G910]<=[Unidades.$F$18];[Unidades.$F$18]>0);[Unidades.$D$18]+1-COUNTIFS([Unidades.$O$3:.$O$17];">="&[.G910]);"") ->  | I910: of:=IF([.H909]<>[.H910];"INICIO";IF([.H911]<>[.H910];"FIN";"")) ->  | J910: of:=IF([.K909]<>[.K910];"INICIO";IF([.K911]<>[.K910];"FIN";"")) -> 
A911: of:=IF([.B911]<>"";TODAY()>[.B911];"") ->  | B911: of:=IFERROR(IF(([.B910]+1)<[Calendario.$F$5];[.B910]+1;"");"") ->  | C911: of:=IF(AND([.B911]>=[Calendario.$F$8];[.B911]<=[Calendario.$F$9];1);1;IF(AND([.B911]>=[Calendario.$F$12];[.B911]<=[Calendario.$F$13]);2;IF(AND([.B911]>=[Calendario.$F$16];[.B911]<=[Calendario.$F$17]);3;""))) ->  | D911: of:=IF(COUNTIF([Calendario.$H$4:.$H$48];[.B911])>0;"FIESTA";"") -> FIESTA | E911: of:=IF([.B911]<>"";VLOOKUP(WEEKDAY([.B911];3);[Calendario.$A$4:.$C$11];2);"") ->  | F911: of:=IF([.B911]<>"";IF([.D911]<>"FIESTA";VLOOKUP(WEEKDAY([.B911];3);[Calendario.$A$4:.$C$11];3);0);"") ->  | G911: of:=IF(ISNUMBER([.F911]);[.F911]+[.G910];"") ->  | H911: of:=IF(AND([.G911]<=[Unidades.$G$26];[.G911]<=[Unidades.$F$18];[Unidades.$F$18]>0);[Unidades.$D$18]+1-COUNTIFS([Unidades.$O$3:.$O$17];">="&[.G911]);"") ->  | I911: of:=IF([.H910]<>[.H911];"INICIO";IF([.H912]<>[.H911];"FIN";"")) ->  | J911: of:=IF([.K910]<>[.K911];"INICIO";IF([.K912]<>[.K911];"FIN";"")) -> 
A912: of:=IF([.B912]<>"";TODAY()>[.B912];"") ->  | B912: of:=IFERROR(IF(([.B911]+1)<[Calendario.$F$5];[.B911]+1;"");"") ->  | C912: of:=IF(AND([.B912]>=[Calendario.$F$8];[.B912]<=[Calendario.$F$9];1);1;IF(AND([.B912]>=[Calendario.$F$12];[.B912]<=[Calendario.$F$13]);2;IF(AND([.B912]>=[Calendario.$F$16];[.B912]<=[Calendario.$F$17]);3;""))) ->  | D912: of:=IF(COUNTIF([Calendario.$H$4:.$H$48];[.B912])>0;"FIESTA";"") -> FIESTA | E912: of:=IF([.B912]<>"";VLOOKUP(WEEKDAY([.B912];3);[Calendario.$A$4:.$C$11];2);"") ->  | F912: of:=IF([.B912]<>"";IF([.D912]<>"FIESTA";VLOOKUP(WEEKDAY([.B912];3);[Calendario.$A$4:.$C$11];3);0);"") ->  | G912: of:=IF(ISNUMBER([.F912]);[.F912]+[.G911];"") ->  | H912: of:=IF(AND([.G912]<=[Unidades.$G$26];[.G912]<=[Unidades.$F$18];[Unidades.$F$18]>0);[Unidades.$D$18]+1-COUNTIFS([Unidades.$O$3:.$O$17];">="&[.G912]);"") ->  | I912: of:=IF([.H911]<>[.H912];"INICIO";IF([.H913]<>[.H912];"FIN";"")) ->  | J912: of:=IF([.K911]<>[.K912];"INICIO";IF([.K913]<>[.K912];"FIN";"")) -> 
A913: of:=IF([.B913]<>"";TODAY()>[.B913];"") ->  | B913: of:=IFERROR(IF(([.B912]+1)<[Calendario.$F$5];[.B912]+1;"");"") ->  | C913: of:=IF(AND([.B913]>=[Calendario.$F$8];[.B913]<=[Calendario.$F$9];1);1;IF(AND([.B913]>=[Calendario.$F$12];[.B913]<=[Calendario.$F$13]);2;IF(AND([.B913]>=[Calendario.$F$16];[.B913]<=[Calendario.$F$17]);3;""))) ->  | D913: of:=IF(COUNTIF([Calendario.$H$4:.$H$48];[.B913])>0;"FIESTA";"") -> FIESTA | E913: of:=IF([.B913]<>"";VLOOKUP(WEEKDAY([.B913];3);[Calendario.$A$4:.$C$11];2);"") ->  | F913: of:=IF([.B913]<>"";IF([.D913]<>"FIESTA";VLOOKUP(WEEKDAY([.B913];3);[Calendario.$A$4:.$C$11];3);0);"") ->  | G913: of:=IF(ISNUMBER([.F913]);[.F913]+[.G912];"") ->  | H913: of:=IF(AND([.G913]<=[Unidades.$G$26];[.G913]<=[Unidades.$F$18];[Unidades.$F$18]>0);[Unidades.$D$18]+1-COUNTIFS([Unidades.$O$3:.$O$17];">="&[.G913]);"") ->  | I913: of:=IF([.H912]<>[.H913];"INICIO";IF([.H914]<>[.H913];"FIN";"")) ->  | J913: of:=IF([.K912]<>[.K913];"INICIO";IF([.K914]<>[.K913];"FIN";"")) -> 
A914: of:=IF([.B914]<>"";TODAY()>[.B914];"") ->  | B914: of:=IFERROR(IF(([.B913]+1)<[Calendario.$F$5];[.B913]+1;"");"") ->  | C914: of:=IF(AND([.B914]>=[Calendario.$F$8];[.B914]<=[Calendario.$F$9];1);1;IF(AND([.B914]>=[Calendario.$F$12];[.B914]<=[Calendario.$F$13]);2;IF(AND([.B914]>=[Calendario.$F$16];[.B914]<=[Calendario.$F$17]);3;""))) ->  | D914: of:=IF(COUNTIF([Calendario.$H$4:.$H$48];[.B914])>0;"FIESTA";"") -> FIESTA | E914: of:=IF([.B914]<>"";VLOOKUP(WEEKDAY([.B914];3);[Calendario.$A$4:.$C$11];2);"") ->  | F914: of:=IF([.B914]<>"";IF([.D914]<>"FIESTA";VLOOKUP(WEEKDAY([.B914];3);[Calendario.$A$4:.$C$11];3);0);"") ->  | G914: of:=IF(ISNUMBER([.F914]);[.F914]+[.G913];"") ->  | H914: of:=IF(AND([.G914]<=[Unidades.$G$26];[.G914]<=[Unidades.$F$18];[Unidades.$F$18]>0);[Unidades.$D$18]+1-COUNTIFS([Unidades.$O$3:.$O$17];">="&[.G914]);"") ->  | I914: of:=IF([.H913]<>[.H914];"INICIO";IF([.H915]<>[.H914];"FIN";"")) ->  | J914: of:=IF([.K913]<>[.K914];"INICIO";IF([.K915]<>[.K914];"FIN";"")) -> 
A915: of:=IF([.B915]<>"";TODAY()>[.B915];"") ->  | B915: of:=IFERROR(IF(([.B914]+1)<[Calendario.$F$5];[.B914]+1;"");"") ->  | C915: of:=IF(AND([.B915]>=[Calendario.$F$8];[.B915]<=[Calendario.$F$9];1);1;IF(AND([.B915]>=[Calendario.$F$12];[.B915]<=[Calendario.$F$13]);2;IF(AND([.B915]>=[Calendario.$F$16];[.B915]<=[Calendario.$F$17]);3;""))) ->  | D915: of:=IF(COUNTIF([Calendario.$H$4:.$H$48];[.B915])>0;"FIESTA";"") -> FIESTA | E915: of:=IF([.B915]<>"";VLOOKUP(WEEKDAY([.B915];3);[Calendario.$A$4:.$C$11];2);"") ->  | F915: of:=IF([.B915]<>"";IF([.D915]<>"FIESTA";VLOOKUP(WEEKDAY([.B915];3);[Calendario.$A$4:.$C$11];3);0);"") ->  | G915: of:=IF(ISNUMBER([.F915]);[.F915]+[.G914];"") ->  | H915: of:=IF(AND([.G915]<=[Unidades.$G$26];[.G915]<=[Unidades.$F$18];[Unidades.$F$18]>0);[Unidades.$D$18]+1-COUNTIFS([Unidades.$O$3:.$O$17];">="&[.G915]);"") ->  | I915: of:=IF([.H914]<>[.H915];"INICIO";IF([.H916]<>[.H915];"FIN";"")) ->  | J915: of:=IF([.K914]<>[.K915];"INICIO";IF([.K916]<>[.K915];"FIN";"")) -> 
A916: of:=IF([.B916]<>"";TODAY()>[.B916];"") ->  | B916: of:=IFERROR(IF(([.B915]+1)<[Calendario.$F$5];[.B915]+1;"");"") ->  | C916: of:=IF(AND([.B916]>=[Calendario.$F$8];[.B916]<=[Calendario.$F$9];1);1;IF(AND([.B916]>=[Calendario.$F$12];[.B916]<=[Calendario.$F$13]);2;IF(AND([.B916]>=[Calendario.$F$16];[.B916]<=[Calendario.$F$17]);3;""))) ->  | D916: of:=IF(COUNTIF([Calendario.$H$4:.$H$48];[.B916])>0;"FIESTA";"") -> FIESTA | E916: of:=IF([.B916]<>"";VLOOKUP(WEEKDAY([.B916];3);[Calendario.$A$4:.$C$11];2);"") ->  | F916: of:=IF([.B916]<>"";IF([.D916]<>"FIESTA";VLOOKUP(WEEKDAY([.B916];3);[Calendario.$A$4:.$C$11];3);0);"") ->  | G916: of:=IF(ISNUMBER([.F916]);[.F916]+[.G915];"") ->  | H916: of:=IF(AND([.G916]<=[Unidades.$G$26];[.G916]<=[Unidades.$F$18];[Unidades.$F$18]>0);[Unidades.$D$18]+1-COUNTIFS([Unidades.$O$3:.$O$17];">="&[.G916]);"") ->  | I916: of:=IF([.H915]<>[.H916];"INICIO";IF([.H917]<>[.H916];"FIN";"")) ->  | J916: of:=IF([.K915]<>[.K916];"INICIO";IF([.K917]<>[.K916];"FIN";"")) -> 
A917: of:=IF([.B917]<>"";TODAY()>[.B917];"") ->  | B917: of:=IFERROR(IF(([.B916]+1)<[Calendario.$F$5];[.B916]+1;"");"") ->  | C917: of:=IF(AND([.B917]>=[Calendario.$F$8];[.B917]<=[Calendario.$F$9];1);1;IF(AND([.B917]>=[Calendario.$F$12];[.B917]<=[Calendario.$F$13]);2;IF(AND([.B917]>=[Calendario.$F$16];[.B917]<=[Calendario.$F$17]);3;""))) ->  | D917: of:=IF(COUNTIF([Calendario.$H$4:.$H$48];[.B917])>0;"FIESTA";"") -> FIESTA | E917: of:=IF([.B917]<>"";VLOOKUP(WEEKDAY([.B917];3);[Calendario.$A$4:.$C$11];2);"") ->  | F917: of:=IF([.B917]<>"";IF([.D917]<>"FIESTA";VLOOKUP(WEEKDAY([.B917];3);[Calendario.$A$4:.$C$11];3);0);"") ->  | G917: of:=IF(ISNUMBER([.F917]);[.F917]+[.G916];"") ->  | H917: of:=IF(AND([.G917]<=[Unidades.$G$26];[.G917]<=[Unidades.$F$18];[Unidades.$F$18]>0);[Unidades.$D$18]+1-COUNTIFS([Unidades.$O$3:.$O$17];">="&[.G917]);"") ->  | I917: of:=IF([.H916]<>[.H917];"INICIO";IF([.H918]<>[.H917];"FIN";"")) ->  | J917: of:=IF([.K916]<>[.K917];"INICIO";IF([.K918]<>[.K917];"FIN";"")) -> 
A918: of:=IF([.B918]<>"";TODAY()>[.B918];"") ->  | B918: of:=IFERROR(IF(([.B917]+1)<[Calendario.$F$5];[.B917]+1;"");"") ->  | C918: of:=IF(AND([.B918]>=[Calendario.$F$8];[.B918]<=[Calendario.$F$9];1);1;IF(AND([.B918]>=[Calendario.$F$12];[.B918]<=[Calendario.$F$13]);2;IF(AND([.B918]>=[Calendario.$F$16];[.B918]<=[Calendario.$F$17]);3;""))) ->  | D918: of:=IF(COUNTIF([Calendario.$H$4:.$H$48];[.B918])>0;"FIESTA";"") -> FIESTA | E918: of:=IF([.B918]<>"";VLOOKUP(WEEKDAY([.B918];3);[Calendario.$A$4:.$C$11];2);"") ->  | F918: of:=IF([.B918]<>"";IF([.D918]<>"FIESTA";VLOOKUP(WEEKDAY([.B918];3);[Calendario.$A$4:.$C$11];3);0);"") ->  | G918: of:=IF(ISNUMBER([.F918]);[.F918]+[.G917];"") ->  | H918: of:=IF(AND([.G918]<=[Unidades.$G$26];[.G918]<=[Unidades.$F$18];[Unidades.$F$18]>0);[Unidades.$D$18]+1-COUNTIFS([Unidades.$O$3:.$O$17];">="&[.G918]);"") ->  | I918: of:=IF([.H917]<>[.H918];"INICIO";IF([.H919]<>[.H918];"FIN";"")) ->  | J918: of:=IF([.K917]<>[.K918];"INICIO";IF([.K919]<>[.K918];"FIN";"")) -> 
A919: of:=IF([.B919]<>"";TODAY()>[.B919];"") ->  | B919: of:=IFERROR(IF(([.B918]+1)<[Calendario.$F$5];[.B918]+1;"");"") ->  | C919: of:=IF(AND([.B919]>=[Calendario.$F$8];[.B919]<=[Calendario.$F$9];1);1;IF(AND([.B919]>=[Calendario.$F$12];[.B919]<=[Calendario.$F$13]);2;IF(AND([.B919]>=[Calendario.$F$16];[.B919]<=[Calendario.$F$17]);3;""))) ->  | D919: of:=IF(COUNTIF([Calendario.$H$4:.$H$48];[.B919])>0;"FIESTA";"") -> FIESTA | E919: of:=IF([.B919]<>"";VLOOKUP(WEEKDAY([.B919];3);[Calendario.$A$4:.$C$11];2);"") ->  | F919: of:=IF([.B919]<>"";IF([.D919]<>"FIESTA";VLOOKUP(WEEKDAY([.B919];3);[Calendario.$A$4:.$C$11];3);0);"") ->  | G919: of:=IF(ISNUMBER([.F919]);[.F919]+[.G918];"") ->  | H919: of:=IF(AND([.G919]<=[Unidades.$G$26];[.G919]<=[Unidades.$F$18];[Unidades.$F$18]>0);[Unidades.$D$18]+1-COUNTIFS([Unidades.$O$3:.$O$17];">="&[.G919]);"") ->  | I919: of:=IF([.H918]<>[.H919];"INICIO";IF([.H920]<>[.H919];"FIN";"")) ->  | J919: of:=IF([.K918]<>[.K919];"INICIO";IF([.K920]<>[.K919];"FIN";"")) -> 
A920: of:=IF([.B920]<>"";TODAY()>[.B920];"") ->  | B920: of:=IFERROR(IF(([.B919]+1)<[Calendario.$F$5];[.B919]+1;"");"") ->  | C920: of:=IF(AND([.B920]>=[Calendario.$F$8];[.B920]<=[Calendario.$F$9];1);1;IF(AND([.B920]>=[Calendario.$F$12];[.B920]<=[Calendario.$F$13]);2;IF(AND([.B920]>=[Calendario.$F$16];[.B920]<=[Calendario.$F$17]);3;""))) ->  | D920: of:=IF(COUNTIF([Calendario.$H$4:.$H$48];[.B920])>0;"FIESTA";"") -> FIESTA | E920: of:=IF([.B920]<>"";VLOOKUP(WEEKDAY([.B920];3);[Calendario.$A$4:.$C$11];2);"") ->  | F920: of:=IF([.B920]<>"";IF([.D920]<>"FIESTA";VLOOKUP(WEEKDAY([.B920];3);[Calendario.$A$4:.$C$11];3);0);"") ->  | G920: of:=IF(ISNUMBER([.F920]);[.F920]+[.G919];"") ->  | H920: of:=IF(AND([.G920]<=[Unidades.$G$26];[.G920]<=[Unidades.$F$18];[Unidades.$F$18]>0);[Unidades.$D$18]+1-COUNTIFS([Unidades.$O$3:.$O$17];">="&[.G920]);"") ->  | I920: of:=IF([.H919]<>[.H920];"INICIO";IF([.H921]<>[.H920];"FIN";"")) ->  | J920: of:=IF([.K919]<>[.K920];"INICIO";IF([.K921]<>[.K920];"FIN";"")) -> 
A921: of:=IF([.B921]<>"";TODAY()>[.B921];"") ->  | B921: of:=IFERROR(IF(([.B920]+1)<[Calendario.$F$5];[.B920]+1;"");"") ->  | C921: of:=IF(AND([.B921]>=[Calendario.$F$8];[.B921]<=[Calendario.$F$9];1);1;IF(AND([.B921]>=[Calendario.$F$12];[.B921]<=[Calendario.$F$13]);2;IF(AND([.B921]>=[Calendario.$F$16];[.B921]<=[Calendario.$F$17]);3;""))) ->  | D921: of:=IF(COUNTIF([Calendario.$H$4:.$H$48];[.B921])>0;"FIESTA";"") -> FIESTA | E921: of:=IF([.B921]<>"";VLOOKUP(WEEKDAY([.B921];3);[Calendario.$A$4:.$C$11];2);"") ->  | F921: of:=IF([.B921]<>"";IF([.D921]<>"FIESTA";VLOOKUP(WEEKDAY([.B921];3);[Calendario.$A$4:.$C$11];3);0);"") ->  | G921: of:=IF(ISNUMBER([.F921]);[.F921]+[.G920];"") ->  | H921: of:=IF(AND([.G921]<=[Unidades.$G$26];[.G921]<=[Unidades.$F$18];[Unidades.$F$18]>0);[Unidades.$D$18]+1-COUNTIFS([Unidades.$O$3:.$O$17];">="&[.G921]);"") ->  | I921: of:=IF([.H920]<>[.H921];"INICIO";IF([.H922]<>[.H921];"FIN";"")) ->  | J921: of:=IF([.K920]<>[.K921];"INICIO";IF([.K922]<>[.K921];"FIN";"")) -> 
A922: of:=IF([.B922]<>"";TODAY()>[.B922];"") ->  | B922: of:=IFERROR(IF(([.B921]+1)<[Calendario.$F$5];[.B921]+1;"");"") ->  | C922: of:=IF(AND([.B922]>=[Calendario.$F$8];[.B922]<=[Calendario.$F$9];1);1;IF(AND([.B922]>=[Calendario.$F$12];[.B922]<=[Calendario.$F$13]);2;IF(AND([.B922]>=[Calendario.$F$16];[.B922]<=[Calendario.$F$17]);3;""))) ->  | D922: of:=IF(COUNTIF([Calendario.$H$4:.$H$48];[.B922])>0;"FIESTA";"") -> FIESTA | E922: of:=IF([.B922]<>"";VLOOKUP(WEEKDAY([.B922];3);[Calendario.$A$4:.$C$11];2);"") ->  | F922: of:=IF([.B922]<>"";IF([.D922]<>"FIESTA";VLOOKUP(WEEKDAY([.B922];3);[Calendario.$A$4:.$C$11];3);0);"") ->  | G922: of:=IF(ISNUMBER([.F922]);[.F922]+[.G921];"") ->  | H922: of:=IF(AND([.G922]<=[Unidades.$G$26];[.G922]<=[Unidades.$F$18];[Unidades.$F$18]>0);[Unidades.$D$18]+1-COUNTIFS([Unidades.$O$3:.$O$17];">="&[.G922]);"") ->  | I922: of:=IF([.H921]<>[.H922];"INICIO";IF([.H923]<>[.H922];"FIN";"")) ->  | J922: of:=IF([.K921]<>[.K922];"INICIO";IF([.K923]<>[.K922];"FIN";"")) -> 
A923: of:=IF([.B923]<>"";TODAY()>[.B923];"") ->  | B923: of:=IFERROR(IF(([.B922]+1)<[Calendario.$F$5];[.B922]+1;"");"") ->  | C923: of:=IF(AND([.B923]>=[Calendario.$F$8];[.B923]<=[Calendario.$F$9];1);1;IF(AND([.B923]>=[Calendario.$F$12];[.B923]<=[Calendario.$F$13]);2;IF(AND([.B923]>=[Calendario.$F$16];[.B923]<=[Calendario.$F$17]);3;""))) ->  | D923: of:=IF(COUNTIF([Calendario.$H$4:.$H$48];[.B923])>0;"FIESTA";"") -> FIESTA | E923: of:=IF([.B923]<>"";VLOOKUP(WEEKDAY([.B923];3);[Calendario.$A$4:.$C$11];2);"") ->  | F923: of:=IF([.B923]<>"";IF([.D923]<>"FIESTA";VLOOKUP(WEEKDAY([.B923];3);[Calendario.$A$4:.$C$11];3);0);"") ->  | G923: of:=IF(ISNUMBER([.F923]);[.F923]+[.G922];"") ->  | H923: of:=IF(AND([.G923]<=[Unidades.$G$26];[.G923]<=[Unidades.$F$18];[Unidades.$F$18]>0);[Unidades.$D$18]+1-COUNTIFS([Unidades.$O$3:.$O$17];">="&[.G923]);"") ->  | I923: of:=IF([.H922]<>[.H923];"INICIO";IF([.H924]<>[.H923];"FIN";"")) ->  | J923: of:=IF([.K922]<>[.K923];"INICIO";IF([.K924]<>[.K923];"FIN";"")) -> 
A924: of:=IF([.B924]<>"";TODAY()>[.B924];"") ->  | B924: of:=IFERROR(IF(([.B923]+1)<[Calendario.$F$5];[.B923]+1;"");"") ->  | C924: of:=IF(AND([.B924]>=[Calendario.$F$8];[.B924]<=[Calendario.$F$9];1);1;IF(AND([.B924]>=[Calendario.$F$12];[.B924]<=[Calendario.$F$13]);2;IF(AND([.B924]>=[Calendario.$F$16];[.B924]<=[Calendario.$F$17]);3;""))) ->  | D924: of:=IF(COUNTIF([Calendario.$H$4:.$H$48];[.B924])>0;"FIESTA";"") -> FIESTA | E924: of:=IF([.B924]<>"";VLOOKUP(WEEKDAY([.B924];3);[Calendario.$A$4:.$C$11];2);"") ->  | F924: of:=IF([.B924]<>"";IF([.D924]<>"FIESTA";VLOOKUP(WEEKDAY([.B924];3);[Calendario.$A$4:.$C$11];3);0);"") ->  | G924: of:=IF(ISNUMBER([.F924]);[.F924]+[.G923];"") ->  | H924: of:=IF(AND([.G924]<=[Unidades.$G$26];[.G924]<=[Unidades.$F$18];[Unidades.$F$18]>0);[Unidades.$D$18]+1-COUNTIFS([Unidades.$O$3:.$O$17];">="&[.G924]);"") ->  | I924: of:=IF([.H923]<>[.H924];"INICIO";IF([.H925]<>[.H924];"FIN";"")) ->  | J924: of:=IF([.K923]<>[.K924];"INICIO";IF([.K925]<>[.K924];"FIN";"")) -> 
A925: of:=IF([.B925]<>"";TODAY()>[.B925];"") ->  | B925: of:=IFERROR(IF(([.B924]+1)<[Calendario.$F$5];[.B924]+1;"");"") ->  | C925: of:=IF(AND([.B925]>=[Calendario.$F$8];[.B925]<=[Calendario.$F$9];1);1;IF(AND([.B925]>=[Calendario.$F$12];[.B925]<=[Calendario.$F$13]);2;IF(AND([.B925]>=[Calendario.$F$16];[.B925]<=[Calendario.$F$17]);3;""))) ->  | D925: of:=IF(COUNTIF([Calendario.$H$4:.$H$48];[.B925])>0;"FIESTA";"") -> FIESTA | E925: of:=IF([.B925]<>"";VLOOKUP(WEEKDAY([.B925];3);[Calendario.$A$4:.$C$11];2);"") ->  | F925: of:=IF([.B925]<>"";IF([.D925]<>"FIESTA";VLOOKUP(WEEKDAY([.B925];3);[Calendario.$A$4:.$C$11];3);0);"") ->  | G925: of:=IF(ISNUMBER([.F925]);[.F925]+[.G924];"") ->  | H925: of:=IF(AND([.G925]<=[Unidades.$G$26];[.G925]<=[Unidades.$F$18];[Unidades.$F$18]>0);[Unidades.$D$18]+1-COUNTIFS([Unidades.$O$3:.$O$17];">="&[.G925]);"") ->  | I925: of:=IF([.H924]<>[.H925];"INICIO";IF([.H926]<>[.H925];"FIN";"")) ->  | J925: of:=IF([.K924]<>[.K925];"INICIO";IF([.K926]<>[.K925];"FIN";"")) -> 
A926: of:=IF([.B926]<>"";TODAY()>[.B926];"") ->  | B926: of:=IFERROR(IF(([.B925]+1)<[Calendario.$F$5];[.B925]+1;"");"") ->  | C926: of:=IF(AND([.B926]>=[Calendario.$F$8];[.B926]<=[Calendario.$F$9];1);1;IF(AND([.B926]>=[Calendario.$F$12];[.B926]<=[Calendario.$F$13]);2;IF(AND([.B926]>=[Calendario.$F$16];[.B926]<=[Calendario.$F$17]);3;""))) ->  | D926: of:=IF(COUNTIF([Calendario.$H$4:.$H$48];[.B926])>0;"FIESTA";"") -> FIESTA | E926: of:=IF([.B926]<>"";VLOOKUP(WEEKDAY([.B926];3);[Calendario.$A$4:.$C$11];2);"") ->  | F926: of:=IF([.B926]<>"";IF([.D926]<>"FIESTA";VLOOKUP(WEEKDAY([.B926];3);[Calendario.$A$4:.$C$11];3);0);"") ->  | G926: of:=IF(ISNUMBER([.F926]);[.F926]+[.G925];"") ->  | H926: of:=IF(AND([.G926]<=[Unidades.$G$26];[.G926]<=[Unidades.$F$18];[Unidades.$F$18]>0);[Unidades.$D$18]+1-COUNTIFS([Unidades.$O$3:.$O$17];">="&[.G926]);"") ->  | I926: of:=IF([.H925]<>[.H926];"INICIO";IF([.H927]<>[.H926];"FIN";"")) ->  | J926: of:=IF([.K925]<>[.K926];"INICIO";IF([.K927]<>[.K926];"FIN";"")) -> 
A927: of:=IF([.B927]<>"";TODAY()>[.B927];"") ->  | B927: of:=IFERROR(IF(([.B926]+1)<[Calendario.$F$5];[.B926]+1;"");"") ->  | C927: of:=IF(AND([.B927]>=[Calendario.$F$8];[.B927]<=[Calendario.$F$9];1);1;IF(AND([.B927]>=[Calendario.$F$12];[.B927]<=[Calendario.$F$13]);2;IF(AND([.B927]>=[Calendario.$F$16];[.B927]<=[Calendario.$F$17]);3;""))) ->  | D927: of:=IF(COUNTIF([Calendario.$H$4:.$H$48];[.B927])>0;"FIESTA";"") -> FIESTA | E927: of:=IF([.B927]<>"";VLOOKUP(WEEKDAY([.B927];3);[Calendario.$A$4:.$C$11];2);"") ->  | F927: of:=IF([.B927]<>"";IF([.D927]<>"FIESTA";VLOOKUP(WEEKDAY([.B927];3);[Calendario.$A$4:.$C$11];3);0);"") ->  | G927: of:=IF(ISNUMBER([.F927]);[.F927]+[.G926];"") ->  | H927: of:=IF(AND([.G927]<=[Unidades.$G$26];[.G927]<=[Unidades.$F$18];[Unidades.$F$18]>0);[Unidades.$D$18]+1-COUNTIFS([Unidades.$O$3:.$O$17];">="&[.G927]);"") ->  | I927: of:=IF([.H926]<>[.H927];"INICIO";IF([.H928]<>[.H927];"FIN";"")) ->  | J927: of:=IF([.K926]<>[.K927];"INICIO";IF([.K928]<>[.K927];"FIN";"")) -> 
A928: of:=IF([.B928]<>"";TODAY()>[.B928];"") ->  | B928: of:=IFERROR(IF(([.B927]+1)<[Calendario.$F$5];[.B927]+1;"");"") ->  | C928: of:=IF(AND([.B928]>=[Calendario.$F$8];[.B928]<=[Calendario.$F$9];1);1;IF(AND([.B928]>=[Calendario.$F$12];[.B928]<=[Calendario.$F$13]);2;IF(AND([.B928]>=[Calendario.$F$16];[.B928]<=[Calendario.$F$17]);3;""))) ->  | D928: of:=IF(COUNTIF([Calendario.$H$4:.$H$48];[.B928])>0;"FIESTA";"") -> FIESTA | E928: of:=IF([.B928]<>"";VLOOKUP(WEEKDAY([.B928];3);[Calendario.$A$4:.$C$11];2);"") ->  | F928: of:=IF([.B928]<>"";IF([.D928]<>"FIESTA";VLOOKUP(WEEKDAY([.B928];3);[Calendario.$A$4:.$C$11];3);0);"") ->  | G928: of:=IF(ISNUMBER([.F928]);[.F928]+[.G927];"") ->  | H928: of:=IF(AND([.G928]<=[Unidades.$G$26];[.G928]<=[Unidades.$F$18];[Unidades.$F$18]>0);[Unidades.$D$18]+1-COUNTIFS([Unidades.$O$3:.$O$17];">="&[.G928]);"") ->  | I928: of:=IF([.H927]<>[.H928];"INICIO";IF([.H929]<>[.H928];"FIN";"")) ->  | J928: of:=IF([.K927]<>[.K928];"INICIO";IF([.K929]<>[.K928];"FIN";"")) -> 
A929: of:=IF([.B929]<>"";TODAY()>[.B929];"") ->  | B929: of:=IFERROR(IF(([.B928]+1)<[Calendario.$F$5];[.B928]+1;"");"") ->  | C929: of:=IF(AND([.B929]>=[Calendario.$F$8];[.B929]<=[Calendario.$F$9];1);1;IF(AND([.B929]>=[Calendario.$F$12];[.B929]<=[Calendario.$F$13]);2;IF(AND([.B929]>=[Calendario.$F$16];[.B929]<=[Calendario.$F$17]);3;""))) ->  | D929: of:=IF(COUNTIF([Calendario.$H$4:.$H$48];[.B929])>0;"FIESTA";"") -> FIESTA | E929: of:=IF([.B929]<>"";VLOOKUP(WEEKDAY([.B929];3);[Calendario.$A$4:.$C$11];2);"") ->  | F929: of:=IF([.B929]<>"";IF([.D929]<>"FIESTA";VLOOKUP(WEEKDAY([.B929];3);[Calendario.$A$4:.$C$11];3);0);"") ->  | G929: of:=IF(ISNUMBER([.F929]);[.F929]+[.G928];"") ->  | H929: of:=IF(AND([.G929]<=[Unidades.$G$26];[.G929]<=[Unidades.$F$18];[Unidades.$F$18]>0);[Unidades.$D$18]+1-COUNTIFS([Unidades.$O$3:.$O$17];">="&[.G929]);"") ->  | I929: of:=IF([.H928]<>[.H929];"INICIO";IF([.H930]<>[.H929];"FIN";"")) ->  | J929: of:=IF([.K928]<>[.K929];"INICIO";IF([.K930]<>[.K929];"FIN";"")) -> 
A930: of:=IF([.B930]<>"";TODAY()>[.B930];"") ->  | B930: of:=IFERROR(IF(([.B929]+1)<[Calendario.$F$5];[.B929]+1;"");"") ->  | C930: of:=IF(AND([.B930]>=[Calendario.$F$8];[.B930]<=[Calendario.$F$9];1);1;IF(AND([.B930]>=[Calendario.$F$12];[.B930]<=[Calendario.$F$13]);2;IF(AND([.B930]>=[Calendario.$F$16];[.B930]<=[Calendario.$F$17]);3;""))) ->  | D930: of:=IF(COUNTIF([Calendario.$H$4:.$H$48];[.B930])>0;"FIESTA";"") -> FIESTA | E930: of:=IF([.B930]<>"";VLOOKUP(WEEKDAY([.B930];3);[Calendario.$A$4:.$C$11];2);"") ->  | F930: of:=IF([.B930]<>"";IF([.D930]<>"FIESTA";VLOOKUP(WEEKDAY([.B930];3);[Calendario.$A$4:.$C$11];3);0);"") ->  | G930: of:=IF(ISNUMBER([.F930]);[.F930]+[.G929];"") ->  | H930: of:=IF(AND([.G930]<=[Unidades.$G$26];[.G930]<=[Unidades.$F$18];[Unidades.$F$18]>0);[Unidades.$D$18]+1-COUNTIFS([Unidades.$O$3:.$O$17];">="&[.G930]);"") ->  | I930: of:=IF([.H929]<>[.H930];"INICIO";IF([.H931]<>[.H930];"FIN";"")) ->  | J930: of:=IF([.K929]<>[.K930];"INICIO";IF([.K931]<>[.K930];"FIN";"")) -> 
A931: of:=IF([.B931]<>"";TODAY()>[.B931];"") ->  | B931: of:=IFERROR(IF(([.B930]+1)<[Calendario.$F$5];[.B930]+1;"");"") ->  | C931: of:=IF(AND([.B931]>=[Calendario.$F$8];[.B931]<=[Calendario.$F$9];1);1;IF(AND([.B931]>=[Calendario.$F$12];[.B931]<=[Calendario.$F$13]);2;IF(AND([.B931]>=[Calendario.$F$16];[.B931]<=[Calendario.$F$17]);3;""))) ->  | D931: of:=IF(COUNTIF([Calendario.$H$4:.$H$48];[.B931])>0;"FIESTA";"") -> FIESTA | E931: of:=IF([.B931]<>"";VLOOKUP(WEEKDAY([.B931];3);[Calendario.$A$4:.$C$11];2);"") ->  | F931: of:=IF([.B931]<>"";IF([.D931]<>"FIESTA";VLOOKUP(WEEKDAY([.B931];3);[Calendario.$A$4:.$C$11];3);0);"") ->  | G931: of:=IF(ISNUMBER([.F931]);[.F931]+[.G930];"") ->  | H931: of:=IF(AND([.G931]<=[Unidades.$G$26];[.G931]<=[Unidades.$F$18];[Unidades.$F$18]>0);[Unidades.$D$18]+1-COUNTIFS([Unidades.$O$3:.$O$17];">="&[.G931]);"") ->  | I931: of:=IF([.H930]<>[.H931];"INICIO";IF([.H932]<>[.H931];"FIN";"")) ->  | J931: of:=IF([.K930]<>[.K931];"INICIO";IF([.K932]<>[.K931];"FIN";"")) -> 
A932: of:=IF([.B932]<>"";TODAY()>[.B932];"") ->  | B932: of:=IFERROR(IF(([.B931]+1)<[Calendario.$F$5];[.B931]+1;"");"") ->  | C932: of:=IF(AND([.B932]>=[Calendario.$F$8];[.B932]<=[Calendario.$F$9];1);1;IF(AND([.B932]>=[Calendario.$F$12];[.B932]<=[Calendario.$F$13]);2;IF(AND([.B932]>=[Calendario.$F$16];[.B932]<=[Calendario.$F$17]);3;""))) ->  | D932: of:=IF(COUNTIF([Calendario.$H$4:.$H$48];[.B932])>0;"FIESTA";"") -> FIESTA | E932: of:=IF([.B932]<>"";VLOOKUP(WEEKDAY([.B932];3);[Calendario.$A$4:.$C$11];2);"") ->  | F932: of:=IF([.B932]<>"";IF([.D932]<>"FIESTA";VLOOKUP(WEEKDAY([.B932];3);[Calendario.$A$4:.$C$11];3);0);"") ->  | G932: of:=IF(ISNUMBER([.F932]);[.F932]+[.G931];"") ->  | H932: of:=IF(AND([.G932]<=[Unidades.$G$26];[.G932]<=[Unidades.$F$18];[Unidades.$F$18]>0);[Unidades.$D$18]+1-COUNTIFS([Unidades.$O$3:.$O$17];">="&[.G932]);"") ->  | I932: of:=IF([.H931]<>[.H932];"INICIO";IF([.H933]<>[.H932];"FIN";"")) ->  | J932: of:=IF([.K931]<>[.K932];"INICIO";IF([.K933]<>[.K932];"FIN";"")) -> 
A933: of:=IF([.B933]<>"";TODAY()>[.B933];"") ->  | B933: of:=IFERROR(IF(([.B932]+1)<[Calendario.$F$5];[.B932]+1;"");"") ->  | C933: of:=IF(AND([.B933]>=[Calendario.$F$8];[.B933]<=[Calendario.$F$9];1);1;IF(AND([.B933]>=[Calendario.$F$12];[.B933]<=[Calendario.$F$13]);2;IF(AND([.B933]>=[Calendario.$F$16];[.B933]<=[Calendario.$F$17]);3;""))) ->  | D933: of:=IF(COUNTIF([Calendario.$H$4:.$H$48];[.B933])>0;"FIESTA";"") -> FIESTA | E933: of:=IF([.B933]<>"";VLOOKUP(WEEKDAY([.B933];3);[Calendario.$A$4:.$C$11];2);"") ->  | F933: of:=IF([.B933]<>"";IF([.D933]<>"FIESTA";VLOOKUP(WEEKDAY([.B933];3);[Calendario.$A$4:.$C$11];3);0);"") ->  | G933: of:=IF(ISNUMBER([.F933]);[.F933]+[.G932];"") ->  | H933: of:=IF(AND([.G933]<=[Unidades.$G$26];[.G933]<=[Unidades.$F$18];[Unidades.$F$18]>0);[Unidades.$D$18]+1-COUNTIFS([Unidades.$O$3:.$O$17];">="&[.G933]);"") ->  | I933: of:=IF([.H932]<>[.H933];"INICIO";IF([.H934]<>[.H933];"FIN";"")) ->  | J933: of:=IF([.K932]<>[.K933];"INICIO";IF([.K934]<>[.K933];"FIN";"")) -> 
A934: of:=IF([.B934]<>"";TODAY()>[.B934];"") ->  | B934: of:=IFERROR(IF(([.B933]+1)<[Calendario.$F$5];[.B933]+1;"");"") ->  | C934: of:=IF(AND([.B934]>=[Calendario.$F$8];[.B934]<=[Calendario.$F$9];1);1;IF(AND([.B934]>=[Calendario.$F$12];[.B934]<=[Calendario.$F$13]);2;IF(AND([.B934]>=[Calendario.$F$16];[.B934]<=[Calendario.$F$17]);3;""))) ->  | D934: of:=IF(COUNTIF([Calendario.$H$4:.$H$48];[.B934])>0;"FIESTA";"") -> FIESTA | E934: of:=IF([.B934]<>"";VLOOKUP(WEEKDAY([.B934];3);[Calendario.$A$4:.$C$11];2);"") ->  | F934: of:=IF([.B934]<>"";IF([.D934]<>"FIESTA";VLOOKUP(WEEKDAY([.B934];3);[Calendario.$A$4:.$C$11];3);0);"") ->  | G934: of:=IF(ISNUMBER([.F934]);[.F934]+[.G933];"") ->  | H934: of:=IF(AND([.G934]<=[Unidades.$G$26];[.G934]<=[Unidades.$F$18];[Unidades.$F$18]>0);[Unidades.$D$18]+1-COUNTIFS([Unidades.$O$3:.$O$17];">="&[.G934]);"") ->  | I934: of:=IF([.H933]<>[.H934];"INICIO";IF([.H935]<>[.H934];"FIN";"")) ->  | J934: of:=IF([.K933]<>[.K934];"INICIO";IF([.K935]<>[.K934];"FIN";"")) -> 
A935: of:=IF([.B935]<>"";TODAY()>[.B935];"") ->  | B935: of:=IFERROR(IF(([.B934]+1)<[Calendario.$F$5];[.B934]+1;"");"") ->  | C935: of:=IF(AND([.B935]>=[Calendario.$F$8];[.B935]<=[Calendario.$F$9];1);1;IF(AND([.B935]>=[Calendario.$F$12];[.B935]<=[Calendario.$F$13]);2;IF(AND([.B935]>=[Calendario.$F$16];[.B935]<=[Calendario.$F$17]);3;""))) ->  | D935: of:=IF(COUNTIF([Calendario.$H$4:.$H$48];[.B935])>0;"FIESTA";"") -> FIESTA | E935: of:=IF([.B935]<>"";VLOOKUP(WEEKDAY([.B935];3);[Calendario.$A$4:.$C$11];2);"") ->  | F935: of:=IF([.B935]<>"";IF([.D935]<>"FIESTA";VLOOKUP(WEEKDAY([.B935];3);[Calendario.$A$4:.$C$11];3);0);"") ->  | G935: of:=IF(ISNUMBER([.F935]);[.F935]+[.G934];"") ->  | H935: of:=IF(AND([.G935]<=[Unidades.$G$26];[.G935]<=[Unidades.$F$18];[Unidades.$F$18]>0);[Unidades.$D$18]+1-COUNTIFS([Unidades.$O$3:.$O$17];">="&[.G935]);"") ->  | I935: of:=IF([.H934]<>[.H935];"INICIO";IF([.H936]<>[.H935];"FIN";"")) ->  | J935: of:=IF([.K934]<>[.K935];"INICIO";IF([.K936]<>[.K935];"FIN";"")) -> 
A936: of:=IF([.B936]<>"";TODAY()>[.B936];"") ->  | B936: of:=IFERROR(IF(([.B935]+1)<[Calendario.$F$5];[.B935]+1;"");"") ->  | C936: of:=IF(AND([.B936]>=[Calendario.$F$8];[.B936]<=[Calendario.$F$9];1);1;IF(AND([.B936]>=[Calendario.$F$12];[.B936]<=[Calendario.$F$13]);2;IF(AND([.B936]>=[Calendario.$F$16];[.B936]<=[Calendario.$F$17]);3;""))) ->  | D936: of:=IF(COUNTIF([Calendario.$H$4:.$H$48];[.B936])>0;"FIESTA";"") -> FIESTA | E936: of:=IF([.B936]<>"";VLOOKUP(WEEKDAY([.B936];3);[Calendario.$A$4:.$C$11];2);"") ->  | F936: of:=IF([.B936]<>"";IF([.D936]<>"FIESTA";VLOOKUP(WEEKDAY([.B936];3);[Calendario.$A$4:.$C$11];3);0);"") ->  | G936: of:=IF(ISNUMBER([.F936]);[.F936]+[.G935];"") ->  | H936: of:=IF(AND([.G936]<=[Unidades.$G$26];[.G936]<=[Unidades.$F$18];[Unidades.$F$18]>0);[Unidades.$D$18]+1-COUNTIFS([Unidades.$O$3:.$O$17];">="&[.G936]);"") ->  | I936: of:=IF([.H935]<>[.H936];"INICIO";IF([.H937]<>[.H936];"FIN";"")) ->  | J936: of:=IF([.K935]<>[.K936];"INICIO";IF([.K937]<>[.K936];"FIN";"")) -> 
A937: of:=IF([.B937]<>"";TODAY()>[.B937];"") ->  | B937: of:=IFERROR(IF(([.B936]+1)<[Calendario.$F$5];[.B936]+1;"");"") ->  | C937: of:=IF(AND([.B937]>=[Calendario.$F$8];[.B937]<=[Calendario.$F$9];1);1;IF(AND([.B937]>=[Calendario.$F$12];[.B937]<=[Calendario.$F$13]);2;IF(AND([.B937]>=[Calendario.$F$16];[.B937]<=[Calendario.$F$17]);3;""))) ->  | D937: of:=IF(COUNTIF([Calendario.$H$4:.$H$48];[.B937])>0;"FIESTA";"") -> FIESTA | E937: of:=IF([.B937]<>"";VLOOKUP(WEEKDAY([.B937];3);[Calendario.$A$4:.$C$11];2);"") ->  | F937: of:=IF([.B937]<>"";IF([.D937]<>"FIESTA";VLOOKUP(WEEKDAY([.B937];3);[Calendario.$A$4:.$C$11];3);0);"") ->  | G937: of:=IF(ISNUMBER([.F937]);[.F937]+[.G936];"") ->  | H937: of:=IF(AND([.G937]<=[Unidades.$G$26];[.G937]<=[Unidades.$F$18];[Unidades.$F$18]>0);[Unidades.$D$18]+1-COUNTIFS([Unidades.$O$3:.$O$17];">="&[.G937]);"") ->  | I937: of:=IF([.H936]<>[.H937];"INICIO";IF([.H938]<>[.H937];"FIN";"")) ->  | J937: of:=IF([.K936]<>[.K937];"INICIO";IF([.K938]<>[.K937];"FIN";"")) -> 
A938: of:=IF([.B938]<>"";TODAY()>[.B938];"") ->  | B938: of:=IFERROR(IF(([.B937]+1)<[Calendario.$F$5];[.B937]+1;"");"") ->  | C938: of:=IF(AND([.B938]>=[Calendario.$F$8];[.B938]<=[Calendario.$F$9];1);1;IF(AND([.B938]>=[Calendario.$F$12];[.B938]<=[Calendario.$F$13]);2;IF(AND([.B938]>=[Calendario.$F$16];[.B938]<=[Calendario.$F$17]);3;""))) ->  | D938: of:=IF(COUNTIF([Calendario.$H$4:.$H$48];[.B938])>0;"FIESTA";"") -> FIESTA | E938: of:=IF([.B938]<>"";VLOOKUP(WEEKDAY([.B938];3);[Calendario.$A$4:.$C$11];2);"") ->  | F938: of:=IF([.B938]<>"";IF([.D938]<>"FIESTA";VLOOKUP(WEEKDAY([.B938];3);[Calendario.$A$4:.$C$11];3);0);"") ->  | G938: of:=IF(ISNUMBER([.F938]);[.F938]+[.G937];"") ->  | H938: of:=IF(AND([.G938]<=[Unidades.$G$26];[.G938]<=[Unidades.$F$18];[Unidades.$F$18]>0);[Unidades.$D$18]+1-COUNTIFS([Unidades.$O$3:.$O$17];">="&[.G938]);"") ->  | I938: of:=IF([.H937]<>[.H938];"INICIO";IF([.H939]<>[.H938];"FIN";"")) ->  | J938: of:=IF([.K937]<>[.K938];"INICIO";IF([.K939]<>[.K938];"FIN";"")) -> 
A939: of:=IF([.B939]<>"";TODAY()>[.B939];"") ->  | B939: of:=IFERROR(IF(([.B938]+1)<[Calendario.$F$5];[.B938]+1;"");"") ->  | C939: of:=IF(AND([.B939]>=[Calendario.$F$8];[.B939]<=[Calendario.$F$9];1);1;IF(AND([.B939]>=[Calendario.$F$12];[.B939]<=[Calendario.$F$13]);2;IF(AND([.B939]>=[Calendario.$F$16];[.B939]<=[Calendario.$F$17]);3;""))) ->  | D939: of:=IF(COUNTIF([Calendario.$H$4:.$H$48];[.B939])>0;"FIESTA";"") -> FIESTA | E939: of:=IF([.B939]<>"";VLOOKUP(WEEKDAY([.B939];3);[Calendario.$A$4:.$C$11];2);"") ->  | F939: of:=IF([.B939]<>"";IF([.D939]<>"FIESTA";VLOOKUP(WEEKDAY([.B939];3);[Calendario.$A$4:.$C$11];3);0);"") ->  | G939: of:=IF(ISNUMBER([.F939]);[.F939]+[.G938];"") ->  | H939: of:=IF(AND([.G939]<=[Unidades.$G$26];[.G939]<=[Unidades.$F$18];[Unidades.$F$18]>0);[Unidades.$D$18]+1-COUNTIFS([Unidades.$O$3:.$O$17];">="&[.G939]);"") ->  | I939: of:=IF([.H938]<>[.H939];"INICIO";IF([.H940]<>[.H939];"FIN";"")) ->  | J939: of:=IF([.K938]<>[.K939];"INICIO";IF([.K940]<>[.K939];"FIN";"")) -> 
A940: of:=IF([.B940]<>"";TODAY()>[.B940];"") ->  | B940: of:=IFERROR(IF(([.B939]+1)<[Calendario.$F$5];[.B939]+1;"");"") ->  | C940: of:=IF(AND([.B940]>=[Calendario.$F$8];[.B940]<=[Calendario.$F$9];1);1;IF(AND([.B940]>=[Calendario.$F$12];[.B940]<=[Calendario.$F$13]);2;IF(AND([.B940]>=[Calendario.$F$16];[.B940]<=[Calendario.$F$17]);3;""))) ->  | D940: of:=IF(COUNTIF([Calendario.$H$4:.$H$48];[.B940])>0;"FIESTA";"") -> FIESTA | E940: of:=IF([.B940]<>"";VLOOKUP(WEEKDAY([.B940];3);[Calendario.$A$4:.$C$11];2);"") ->  | F940: of:=IF([.B940]<>"";IF([.D940]<>"FIESTA";VLOOKUP(WEEKDAY([.B940];3);[Calendario.$A$4:.$C$11];3);0);"") ->  | G940: of:=IF(ISNUMBER([.F940]);[.F940]+[.G939];"") ->  | H940: of:=IF(AND([.G940]<=[Unidades.$G$26];[.G940]<=[Unidades.$F$18];[Unidades.$F$18]>0);[Unidades.$D$18]+1-COUNTIFS([Unidades.$O$3:.$O$17];">="&[.G940]);"") ->  | I940: of:=IF([.H939]<>[.H940];"INICIO";IF([.H941]<>[.H940];"FIN";"")) ->  | J940: of:=IF([.K939]<>[.K940];"INICIO";IF([.K941]<>[.K940];"FIN";"")) -> 
A941: of:=IF([.B941]<>"";TODAY()>[.B941];"") ->  | B941: of:=IFERROR(IF(([.B940]+1)<[Calendario.$F$5];[.B940]+1;"");"") ->  | C941: of:=IF(AND([.B941]>=[Calendario.$F$8];[.B941]<=[Calendario.$F$9];1);1;IF(AND([.B941]>=[Calendario.$F$12];[.B941]<=[Calendario.$F$13]);2;IF(AND([.B941]>=[Calendario.$F$16];[.B941]<=[Calendario.$F$17]);3;""))) ->  | D941: of:=IF(COUNTIF([Calendario.$H$4:.$H$48];[.B941])>0;"FIESTA";"") -> FIESTA | E941: of:=IF([.B941]<>"";VLOOKUP(WEEKDAY([.B941];3);[Calendario.$A$4:.$C$11];2);"") ->  | F941: of:=IF([.B941]<>"";IF([.D941]<>"FIESTA";VLOOKUP(WEEKDAY([.B941];3);[Calendario.$A$4:.$C$11];3);0);"") ->  | G941: of:=IF(ISNUMBER([.F941]);[.F941]+[.G940];"") ->  | H941: of:=IF(AND([.G941]<=[Unidades.$G$26];[.G941]<=[Unidades.$F$18];[Unidades.$F$18]>0);[Unidades.$D$18]+1-COUNTIFS([Unidades.$O$3:.$O$17];">="&[.G941]);"") ->  | I941: of:=IF([.H940]<>[.H941];"INICIO";IF([.H942]<>[.H941];"FIN";"")) ->  | J941: of:=IF([.K940]<>[.K941];"INICIO";IF([.K942]<>[.K941];"FIN";"")) -> 
A942: of:=IF([.B942]<>"";TODAY()>[.B942];"") ->  | B942: of:=IFERROR(IF(([.B941]+1)<[Calendario.$F$5];[.B941]+1;"");"") ->  | C942: of:=IF(AND([.B942]>=[Calendario.$F$8];[.B942]<=[Calendario.$F$9];1);1;IF(AND([.B942]>=[Calendario.$F$12];[.B942]<=[Calendario.$F$13]);2;IF(AND([.B942]>=[Calendario.$F$16];[.B942]<=[Calendario.$F$17]);3;""))) ->  | D942: of:=IF(COUNTIF([Calendario.$H$4:.$H$48];[.B942])>0;"FIESTA";"") -> FIESTA | E942: of:=IF([.B942]<>"";VLOOKUP(WEEKDAY([.B942];3);[Calendario.$A$4:.$C$11];2);"") ->  | F942: of:=IF([.B942]<>"";IF([.D942]<>"FIESTA";VLOOKUP(WEEKDAY([.B942];3);[Calendario.$A$4:.$C$11];3);0);"") ->  | G942: of:=IF(ISNUMBER([.F942]);[.F942]+[.G941];"") ->  | H942: of:=IF(AND([.G942]<=[Unidades.$G$26];[.G942]<=[Unidades.$F$18];[Unidades.$F$18]>0);[Unidades.$D$18]+1-COUNTIFS([Unidades.$O$3:.$O$17];">="&[.G942]);"") ->  | I942: of:=IF([.H941]<>[.H942];"INICIO";IF([.H943]<>[.H942];"FIN";"")) ->  | J942: of:=IF([.K941]<>[.K942];"INICIO";IF([.K943]<>[.K942];"FIN";"")) -> 
A943: of:=IF([.B943]<>"";TODAY()>[.B943];"") ->  | B943: of:=IFERROR(IF(([.B942]+1)<[Calendario.$F$5];[.B942]+1;"");"") ->  | C943: of:=IF(AND([.B943]>=[Calendario.$F$8];[.B943]<=[Calendario.$F$9];1);1;IF(AND([.B943]>=[Calendario.$F$12];[.B943]<=[Calendario.$F$13]);2;IF(AND([.B943]>=[Calendario.$F$16];[.B943]<=[Calendario.$F$17]);3;""))) ->  | D943: of:=IF(COUNTIF([Calendario.$H$4:.$H$48];[.B943])>0;"FIESTA";"") -> FIESTA | E943: of:=IF([.B943]<>"";VLOOKUP(WEEKDAY([.B943];3);[Calendario.$A$4:.$C$11];2);"") ->  | F943: of:=IF([.B943]<>"";IF([.D943]<>"FIESTA";VLOOKUP(WEEKDAY([.B943];3);[Calendario.$A$4:.$C$11];3);0);"") ->  | G943: of:=IF(ISNUMBER([.F943]);[.F943]+[.G942];"") ->  | H943: of:=IF(AND([.G943]<=[Unidades.$G$26];[.G943]<=[Unidades.$F$18];[Unidades.$F$18]>0);[Unidades.$D$18]+1-COUNTIFS([Unidades.$O$3:.$O$17];">="&[.G943]);"") ->  | I943: of:=IF([.H942]<>[.H943];"INICIO";IF([.H944]<>[.H943];"FIN";"")) ->  | J943: of:=IF([.K942]<>[.K943];"INICIO";IF([.K944]<>[.K943];"FIN";"")) -> 
A944: of:=IF([.B944]<>"";TODAY()>[.B944];"") ->  | B944: of:=IFERROR(IF(([.B943]+1)<[Calendario.$F$5];[.B943]+1;"");"") ->  | C944: of:=IF(AND([.B944]>=[Calendario.$F$8];[.B944]<=[Calendario.$F$9];1);1;IF(AND([.B944]>=[Calendario.$F$12];[.B944]<=[Calendario.$F$13]);2;IF(AND([.B944]>=[Calendario.$F$16];[.B944]<=[Calendario.$F$17]);3;""))) ->  | D944: of:=IF(COUNTIF([Calendario.$H$4:.$H$48];[.B944])>0;"FIESTA";"") -> FIESTA | E944: of:=IF([.B944]<>"";VLOOKUP(WEEKDAY([.B944];3);[Calendario.$A$4:.$C$11];2);"") ->  | F944: of:=IF([.B944]<>"";IF([.D944]<>"FIESTA";VLOOKUP(WEEKDAY([.B944];3);[Calendario.$A$4:.$C$11];3);0);"") ->  | G944: of:=IF(ISNUMBER([.F944]);[.F944]+[.G943];"") ->  | H944: of:=IF(AND([.G944]<=[Unidades.$G$26];[.G944]<=[Unidades.$F$18];[Unidades.$F$18]>0);[Unidades.$D$18]+1-COUNTIFS([Unidades.$O$3:.$O$17];">="&[.G944]);"") ->  | I944: of:=IF([.H943]<>[.H944];"INICIO";IF([.H945]<>[.H944];"FIN";"")) ->  | J944: of:=IF([.K943]<>[.K944];"INICIO";IF([.K945]<>[.K944];"FIN";"")) -> 
A945: of:=IF([.B945]<>"";TODAY()>[.B945];"") ->  | B945: of:=IFERROR(IF(([.B944]+1)<[Calendario.$F$5];[.B944]+1;"");"") ->  | C945: of:=IF(AND([.B945]>=[Calendario.$F$8];[.B945]<=[Calendario.$F$9];1);1;IF(AND([.B945]>=[Calendario.$F$12];[.B945]<=[Calendario.$F$13]);2;IF(AND([.B945]>=[Calendario.$F$16];[.B945]<=[Calendario.$F$17]);3;""))) ->  | D945: of:=IF(COUNTIF([Calendario.$H$4:.$H$48];[.B945])>0;"FIESTA";"") -> FIESTA | E945: of:=IF([.B945]<>"";VLOOKUP(WEEKDAY([.B945];3);[Calendario.$A$4:.$C$11];2);"") ->  | F945: of:=IF([.B945]<>"";IF([.D945]<>"FIESTA";VLOOKUP(WEEKDAY([.B945];3);[Calendario.$A$4:.$C$11];3);0);"") ->  | G945: of:=IF(ISNUMBER([.F945]);[.F945]+[.G944];"") ->  | H945: of:=IF(AND([.G945]<=[Unidades.$G$26];[.G945]<=[Unidades.$F$18];[Unidades.$F$18]>0);[Unidades.$D$18]+1-COUNTIFS([Unidades.$O$3:.$O$17];">="&[.G945]);"") ->  | I945: of:=IF([.H944]<>[.H945];"INICIO";IF([.H946]<>[.H945];"FIN";"")) ->  | J945: of:=IF([.K944]<>[.K945];"INICIO";IF([.K946]<>[.K945];"FIN";"")) -> 
A946: of:=IF([.B946]<>"";TODAY()>[.B946];"") ->  | B946: of:=IFERROR(IF(([.B945]+1)<[Calendario.$F$5];[.B945]+1;"");"") ->  | C946: of:=IF(AND([.B946]>=[Calendario.$F$8];[.B946]<=[Calendario.$F$9];1);1;IF(AND([.B946]>=[Calendario.$F$12];[.B946]<=[Calendario.$F$13]);2;IF(AND([.B946]>=[Calendario.$F$16];[.B946]<=[Calendario.$F$17]);3;""))) ->  | D946: of:=IF(COUNTIF([Calendario.$H$4:.$H$48];[.B946])>0;"FIESTA";"") -> FIESTA | E946: of:=IF([.B946]<>"";VLOOKUP(WEEKDAY([.B946];3);[Calendario.$A$4:.$C$11];2);"") ->  | F946: of:=IF([.B946]<>"";IF([.D946]<>"FIESTA";VLOOKUP(WEEKDAY([.B946];3);[Calendario.$A$4:.$C$11];3);0);"") ->  | G946: of:=IF(ISNUMBER([.F946]);[.F946]+[.G945];"") ->  | H946: of:=IF(AND([.G946]<=[Unidades.$G$26];[.G946]<=[Unidades.$F$18];[Unidades.$F$18]>0);[Unidades.$D$18]+1-COUNTIFS([Unidades.$O$3:.$O$17];">="&[.G946]);"") ->  | I946: of:=IF([.H945]<>[.H946];"INICIO";IF([.H947]<>[.H946];"FIN";"")) ->  | J946: of:=IF([.K945]<>[.K946];"INICIO";IF([.K947]<>[.K946];"FIN";"")) -> 
A947: of:=IF([.B947]<>"";TODAY()>[.B947];"") ->  | B947: of:=IFERROR(IF(([.B946]+1)<[Calendario.$F$5];[.B946]+1;"");"") ->  | C947: of:=IF(AND([.B947]>=[Calendario.$F$8];[.B947]<=[Calendario.$F$9];1);1;IF(AND([.B947]>=[Calendario.$F$12];[.B947]<=[Calendario.$F$13]);2;IF(AND([.B947]>=[Calendario.$F$16];[.B947]<=[Calendario.$F$17]);3;""))) ->  | D947: of:=IF(COUNTIF([Calendario.$H$4:.$H$48];[.B947])>0;"FIESTA";"") -> FIESTA | E947: of:=IF([.B947]<>"";VLOOKUP(WEEKDAY([.B947];3);[Calendario.$A$4:.$C$11];2);"") ->  | F947: of:=IF([.B947]<>"";IF([.D947]<>"FIESTA";VLOOKUP(WEEKDAY([.B947];3);[Calendario.$A$4:.$C$11];3);0);"") ->  | G947: of:=IF(ISNUMBER([.F947]);[.F947]+[.G946];"") ->  | H947: of:=IF(AND([.G947]<=[Unidades.$G$26];[.G947]<=[Unidades.$F$18];[Unidades.$F$18]>0);[Unidades.$D$18]+1-COUNTIFS([Unidades.$O$3:.$O$17];">="&[.G947]);"") ->  | I947: of:=IF([.H946]<>[.H947];"INICIO";IF([.H948]<>[.H947];"FIN";"")) ->  | J947: of:=IF([.K946]<>[.K947];"INICIO";IF([.K948]<>[.K947];"FIN";"")) -> 
A948: of:=IF([.B948]<>"";TODAY()>[.B948];"") ->  | B948: of:=IFERROR(IF(([.B947]+1)<[Calendario.$F$5];[.B947]+1;"");"") ->  | C948: of:=IF(AND([.B948]>=[Calendario.$F$8];[.B948]<=[Calendario.$F$9];1);1;IF(AND([.B948]>=[Calendario.$F$12];[.B948]<=[Calendario.$F$13]);2;IF(AND([.B948]>=[Calendario.$F$16];[.B948]<=[Calendario.$F$17]);3;""))) ->  | D948: of:=IF(COUNTIF([Calendario.$H$4:.$H$48];[.B948])>0;"FIESTA";"") -> FIESTA | E948: of:=IF([.B948]<>"";VLOOKUP(WEEKDAY([.B948];3);[Calendario.$A$4:.$C$11];2);"") ->  | F948: of:=IF([.B948]<>"";IF([.D948]<>"FIESTA";VLOOKUP(WEEKDAY([.B948];3);[Calendario.$A$4:.$C$11];3);0);"") ->  | G948: of:=IF(ISNUMBER([.F948]);[.F948]+[.G947];"") ->  | H948: of:=IF(AND([.G948]<=[Unidades.$G$26];[.G948]<=[Unidades.$F$18];[Unidades.$F$18]>0);[Unidades.$D$18]+1-COUNTIFS([Unidades.$O$3:.$O$17];">="&[.G948]);"") ->  | I948: of:=IF([.H947]<>[.H948];"INICIO";IF([.H949]<>[.H948];"FIN";"")) ->  | J948: of:=IF([.K947]<>[.K948];"INICIO";IF([.K949]<>[.K948];"FIN";"")) -> 
A949: of:=IF([.B949]<>"";TODAY()>[.B949];"") ->  | B949: of:=IFERROR(IF(([.B948]+1)<[Calendario.$F$5];[.B948]+1;"");"") ->  | C949: of:=IF(AND([.B949]>=[Calendario.$F$8];[.B949]<=[Calendario.$F$9];1);1;IF(AND([.B949]>=[Calendario.$F$12];[.B949]<=[Calendario.$F$13]);2;IF(AND([.B949]>=[Calendario.$F$16];[.B949]<=[Calendario.$F$17]);3;""))) ->  | D949: of:=IF(COUNTIF([Calendario.$H$4:.$H$48];[.B949])>0;"FIESTA";"") -> FIESTA | E949: of:=IF([.B949]<>"";VLOOKUP(WEEKDAY([.B949];3);[Calendario.$A$4:.$C$11];2);"") ->  | F949: of:=IF([.B949]<>"";IF([.D949]<>"FIESTA";VLOOKUP(WEEKDAY([.B949];3);[Calendario.$A$4:.$C$11];3);0);"") ->  | G949: of:=IF(ISNUMBER([.F949]);[.F949]+[.G948];"") ->  | H949: of:=IF(AND([.G949]<=[Unidades.$G$26];[.G949]<=[Unidades.$F$18];[Unidades.$F$18]>0);[Unidades.$D$18]+1-COUNTIFS([Unidades.$O$3:.$O$17];">="&[.G949]);"") ->  | I949: of:=IF([.H948]<>[.H949];"INICIO";IF([.H950]<>[.H949];"FIN";"")) ->  | J949: of:=IF([.K948]<>[.K949];"INICIO";IF([.K950]<>[.K949];"FIN";"")) -> 
A950: of:=IF([.B950]<>"";TODAY()>[.B950];"") ->  | B950: of:=IFERROR(IF(([.B949]+1)<[Calendario.$F$5];[.B949]+1;"");"") ->  | C950: of:=IF(AND([.B950]>=[Calendario.$F$8];[.B950]<=[Calendario.$F$9];1);1;IF(AND([.B950]>=[Calendario.$F$12];[.B950]<=[Calendario.$F$13]);2;IF(AND([.B950]>=[Calendario.$F$16];[.B950]<=[Calendario.$F$17]);3;""))) ->  | D950: of:=IF(COUNTIF([Calendario.$H$4:.$H$48];[.B950])>0;"FIESTA";"") -> FIESTA | E950: of:=IF([.B950]<>"";VLOOKUP(WEEKDAY([.B950];3);[Calendario.$A$4:.$C$11];2);"") ->  | F950: of:=IF([.B950]<>"";IF([.D950]<>"FIESTA";VLOOKUP(WEEKDAY([.B950];3);[Calendario.$A$4:.$C$11];3);0);"") ->  | G950: of:=IF(ISNUMBER([.F950]);[.F950]+[.G949];"") ->  | H950: of:=IF(AND([.G950]<=[Unidades.$G$26];[.G950]<=[Unidades.$F$18];[Unidades.$F$18]>0);[Unidades.$D$18]+1-COUNTIFS([Unidades.$O$3:.$O$17];">="&[.G950]);"") ->  | I950: of:=IF([.H949]<>[.H950];"INICIO";IF([.H951]<>[.H950];"FIN";"")) ->  | J950: of:=IF([.K949]<>[.K950];"INICIO";IF([.K951]<>[.K950];"FIN";"")) -> 
A951: of:=IF([.B951]<>"";TODAY()>[.B951];"") ->  | B951: of:=IFERROR(IF(([.B950]+1)<[Calendario.$F$5];[.B950]+1;"");"") ->  | C951: of:=IF(AND([.B951]>=[Calendario.$F$8];[.B951]<=[Calendario.$F$9];1);1;IF(AND([.B951]>=[Calendario.$F$12];[.B951]<=[Calendario.$F$13]);2;IF(AND([.B951]>=[Calendario.$F$16];[.B951]<=[Calendario.$F$17]);3;""))) ->  | D951: of:=IF(COUNTIF([Calendario.$H$4:.$H$48];[.B951])>0;"FIESTA";"") -> FIESTA | E951: of:=IF([.B951]<>"";VLOOKUP(WEEKDAY([.B951];3);[Calendario.$A$4:.$C$11];2);"") ->  | F951: of:=IF([.B951]<>"";IF([.D951]<>"FIESTA";VLOOKUP(WEEKDAY([.B951];3);[Calendario.$A$4:.$C$11];3);0);"") ->  | G951: of:=IF(ISNUMBER([.F951]);[.F951]+[.G950];"") ->  | H951: of:=IF(AND([.G951]<=[Unidades.$G$26];[.G951]<=[Unidades.$F$18];[Unidades.$F$18]>0);[Unidades.$D$18]+1-COUNTIFS([Unidades.$O$3:.$O$17];">="&[.G951]);"") ->  | I951: of:=IF([.H950]<>[.H951];"INICIO";IF([.H952]<>[.H951];"FIN";"")) ->  | J951: of:=IF([.K950]<>[.K951];"INICIO";IF([.K952]<>[.K951];"FIN";"")) -> 
A952: of:=IF([.B952]<>"";TODAY()>[.B952];"") ->  | B952: of:=IFERROR(IF(([.B951]+1)<[Calendario.$F$5];[.B951]+1;"");"") ->  | C952: of:=IF(AND([.B952]>=[Calendario.$F$8];[.B952]<=[Calendario.$F$9];1);1;IF(AND([.B952]>=[Calendario.$F$12];[.B952]<=[Calendario.$F$13]);2;IF(AND([.B952]>=[Calendario.$F$16];[.B952]<=[Calendario.$F$17]);3;""))) ->  | D952: of:=IF(COUNTIF([Calendario.$H$4:.$H$48];[.B952])>0;"FIESTA";"") -> FIESTA | E952: of:=IF([.B952]<>"";VLOOKUP(WEEKDAY([.B952];3);[Calendario.$A$4:.$C$11];2);"") ->  | F952: of:=IF([.B952]<>"";IF([.D952]<>"FIESTA";VLOOKUP(WEEKDAY([.B952];3);[Calendario.$A$4:.$C$11];3);0);"") ->  | G952: of:=IF(ISNUMBER([.F952]);[.F952]+[.G951];"") ->  | H952: of:=IF(AND([.G952]<=[Unidades.$G$26];[.G952]<=[Unidades.$F$18];[Unidades.$F$18]>0);[Unidades.$D$18]+1-COUNTIFS([Unidades.$O$3:.$O$17];">="&[.G952]);"") ->  | I952: of:=IF([.H951]<>[.H952];"INICIO";IF([.H953]<>[.H952];"FIN";"")) ->  | J952: of:=IF([.K951]<>[.K952];"INICIO";IF([.K953]<>[.K952];"FIN";"")) -> 
A953: of:=IF([.B953]<>"";TODAY()>[.B953];"") ->  | B953: of:=IFERROR(IF(([.B952]+1)<[Calendario.$F$5];[.B952]+1;"");"") ->  | C953: of:=IF(AND([.B953]>=[Calendario.$F$8];[.B953]<=[Calendario.$F$9];1);1;IF(AND([.B953]>=[Calendario.$F$12];[.B953]<=[Calendario.$F$13]);2;IF(AND([.B953]>=[Calendario.$F$16];[.B953]<=[Calendario.$F$17]);3;""))) ->  | D953: of:=IF(COUNTIF([Calendario.$H$4:.$H$48];[.B953])>0;"FIESTA";"") -> FIESTA | E953: of:=IF([.B953]<>"";VLOOKUP(WEEKDAY([.B953];3);[Calendario.$A$4:.$C$11];2);"") ->  | F953: of:=IF([.B953]<>"";IF([.D953]<>"FIESTA";VLOOKUP(WEEKDAY([.B953];3);[Calendario.$A$4:.$C$11];3);0);"") ->  | G953: of:=IF(ISNUMBER([.F953]);[.F953]+[.G952];"") ->  | H953: of:=IF(AND([.G953]<=[Unidades.$G$26];[.G953]<=[Unidades.$F$18];[Unidades.$F$18]>0);[Unidades.$D$18]+1-COUNTIFS([Unidades.$O$3:.$O$17];">="&[.G953]);"") ->  | I953: of:=IF([.H952]<>[.H953];"INICIO";IF([.H954]<>[.H953];"FIN";"")) ->  | J953: of:=IF([.K952]<>[.K953];"INICIO";IF([.K954]<>[.K953];"FIN";"")) -> 
A954: of:=IF([.B954]<>"";TODAY()>[.B954];"") ->  | B954: of:=IFERROR(IF(([.B953]+1)<[Calendario.$F$5];[.B953]+1;"");"") ->  | C954: of:=IF(AND([.B954]>=[Calendario.$F$8];[.B954]<=[Calendario.$F$9];1);1;IF(AND([.B954]>=[Calendario.$F$12];[.B954]<=[Calendario.$F$13]);2;IF(AND([.B954]>=[Calendario.$F$16];[.B954]<=[Calendario.$F$17]);3;""))) ->  | D954: of:=IF(COUNTIF([Calendario.$H$4:.$H$48];[.B954])>0;"FIESTA";"") -> FIESTA | E954: of:=IF([.B954]<>"";VLOOKUP(WEEKDAY([.B954];3);[Calendario.$A$4:.$C$11];2);"") ->  | F954: of:=IF([.B954]<>"";IF([.D954]<>"FIESTA";VLOOKUP(WEEKDAY([.B954];3);[Calendario.$A$4:.$C$11];3);0);"") ->  | G954: of:=IF(ISNUMBER([.F954]);[.F954]+[.G953];"") ->  | H954: of:=IF(AND([.G954]<=[Unidades.$G$26];[.G954]<=[Unidades.$F$18];[Unidades.$F$18]>0);[Unidades.$D$18]+1-COUNTIFS([Unidades.$O$3:.$O$17];">="&[.G954]);"") ->  | I954: of:=IF([.H953]<>[.H954];"INICIO";IF([.H955]<>[.H954];"FIN";"")) ->  | J954: of:=IF([.K953]<>[.K954];"INICIO";IF([.K955]<>[.K954];"FIN";"")) -> 
A955: of:=IF([.B955]<>"";TODAY()>[.B955];"") ->  | B955: of:=IFERROR(IF(([.B954]+1)<[Calendario.$F$5];[.B954]+1;"");"") ->  | C955: of:=IF(AND([.B955]>=[Calendario.$F$8];[.B955]<=[Calendario.$F$9];1);1;IF(AND([.B955]>=[Calendario.$F$12];[.B955]<=[Calendario.$F$13]);2;IF(AND([.B955]>=[Calendario.$F$16];[.B955]<=[Calendario.$F$17]);3;""))) ->  | D955: of:=IF(COUNTIF([Calendario.$H$4:.$H$48];[.B955])>0;"FIESTA";"") -> FIESTA | E955: of:=IF([.B955]<>"";VLOOKUP(WEEKDAY([.B955];3);[Calendario.$A$4:.$C$11];2);"") ->  | F955: of:=IF([.B955]<>"";IF([.D955]<>"FIESTA";VLOOKUP(WEEKDAY([.B955];3);[Calendario.$A$4:.$C$11];3);0);"") ->  | G955: of:=IF(ISNUMBER([.F955]);[.F955]+[.G954];"") ->  | H955: of:=IF(AND([.G955]<=[Unidades.$G$26];[.G955]<=[Unidades.$F$18];[Unidades.$F$18]>0);[Unidades.$D$18]+1-COUNTIFS([Unidades.$O$3:.$O$17];">="&[.G955]);"") ->  | I955: of:=IF([.H954]<>[.H955];"INICIO";IF([.H956]<>[.H955];"FIN";"")) ->  | J955: of:=IF([.K954]<>[.K955];"INICIO";IF([.K956]<>[.K955];"FIN";"")) -> 
A956: of:=IF([.B956]<>"";TODAY()>[.B956];"") ->  | B956: of:=IFERROR(IF(([.B955]+1)<[Calendario.$F$5];[.B955]+1;"");"") ->  | C956: of:=IF(AND([.B956]>=[Calendario.$F$8];[.B956]<=[Calendario.$F$9];1);1;IF(AND([.B956]>=[Calendario.$F$12];[.B956]<=[Calendario.$F$13]);2;IF(AND([.B956]>=[Calendario.$F$16];[.B956]<=[Calendario.$F$17]);3;""))) ->  | D956: of:=IF(COUNTIF([Calendario.$H$4:.$H$48];[.B956])>0;"FIESTA";"") -> FIESTA | E956: of:=IF([.B956]<>"";VLOOKUP(WEEKDAY([.B956];3);[Calendario.$A$4:.$C$11];2);"") ->  | F956: of:=IF([.B956]<>"";IF([.D956]<>"FIESTA";VLOOKUP(WEEKDAY([.B956];3);[Calendario.$A$4:.$C$11];3);0);"") ->  | G956: of:=IF(ISNUMBER([.F956]);[.F956]+[.G955];"") ->  | H956: of:=IF(AND([.G956]<=[Unidades.$G$26];[.G956]<=[Unidades.$F$18];[Unidades.$F$18]>0);[Unidades.$D$18]+1-COUNTIFS([Unidades.$O$3:.$O$17];">="&[.G956]);"") ->  | I956: of:=IF([.H955]<>[.H956];"INICIO";IF([.H957]<>[.H956];"FIN";"")) ->  | J956: of:=IF([.K955]<>[.K956];"INICIO";IF([.K957]<>[.K956];"FIN";"")) -> 
A957: of:=IF([.B957]<>"";TODAY()>[.B957];"") ->  | B957: of:=IFERROR(IF(([.B956]+1)<[Calendario.$F$5];[.B956]+1;"");"") ->  | C957: of:=IF(AND([.B957]>=[Calendario.$F$8];[.B957]<=[Calendario.$F$9];1);1;IF(AND([.B957]>=[Calendario.$F$12];[.B957]<=[Calendario.$F$13]);2;IF(AND([.B957]>=[Calendario.$F$16];[.B957]<=[Calendario.$F$17]);3;""))) ->  | D957: of:=IF(COUNTIF([Calendario.$H$4:.$H$48];[.B957])>0;"FIESTA";"") -> FIESTA | E957: of:=IF([.B957]<>"";VLOOKUP(WEEKDAY([.B957];3);[Calendario.$A$4:.$C$11];2);"") ->  | F957: of:=IF([.B957]<>"";IF([.D957]<>"FIESTA";VLOOKUP(WEEKDAY([.B957];3);[Calendario.$A$4:.$C$11];3);0);"") ->  | G957: of:=IF(ISNUMBER([.F957]);[.F957]+[.G956];"") ->  | H957: of:=IF(AND([.G957]<=[Unidades.$G$26];[.G957]<=[Unidades.$F$18];[Unidades.$F$18]>0);[Unidades.$D$18]+1-COUNTIFS([Unidades.$O$3:.$O$17];">="&[.G957]);"") ->  | I957: of:=IF([.H956]<>[.H957];"INICIO";IF([.H958]<>[.H957];"FIN";"")) ->  | J957: of:=IF([.K956]<>[.K957];"INICIO";IF([.K958]<>[.K957];"FIN";"")) -> 
A958: of:=IF([.B958]<>"";TODAY()>[.B958];"") ->  | B958: of:=IFERROR(IF(([.B957]+1)<[Calendario.$F$5];[.B957]+1;"");"") ->  | C958: of:=IF(AND([.B958]>=[Calendario.$F$8];[.B958]<=[Calendario.$F$9];1);1;IF(AND([.B958]>=[Calendario.$F$12];[.B958]<=[Calendario.$F$13]);2;IF(AND([.B958]>=[Calendario.$F$16];[.B958]<=[Calendario.$F$17]);3;""))) ->  | D958: of:=IF(COUNTIF([Calendario.$H$4:.$H$48];[.B958])>0;"FIESTA";"") -> FIESTA | E958: of:=IF([.B958]<>"";VLOOKUP(WEEKDAY([.B958];3);[Calendario.$A$4:.$C$11];2);"") ->  | F958: of:=IF([.B958]<>"";IF([.D958]<>"FIESTA";VLOOKUP(WEEKDAY([.B958];3);[Calendario.$A$4:.$C$11];3);0);"") ->  | G958: of:=IF(ISNUMBER([.F958]);[.F958]+[.G957];"") ->  | H958: of:=IF(AND([.G958]<=[Unidades.$G$26];[.G958]<=[Unidades.$F$18];[Unidades.$F$18]>0);[Unidades.$D$18]+1-COUNTIFS([Unidades.$O$3:.$O$17];">="&[.G958]);"") ->  | I958: of:=IF([.H957]<>[.H958];"INICIO";IF([.H959]<>[.H958];"FIN";"")) ->  | J958: of:=IF([.K957]<>[.K958];"INICIO";IF([.K959]<>[.K958];"FIN";"")) -> 
A959: of:=IF([.B959]<>"";TODAY()>[.B959];"") ->  | B959: of:=IFERROR(IF(([.B958]+1)<[Calendario.$F$5];[.B958]+1;"");"") ->  | C959: of:=IF(AND([.B959]>=[Calendario.$F$8];[.B959]<=[Calendario.$F$9];1);1;IF(AND([.B959]>=[Calendario.$F$12];[.B959]<=[Calendario.$F$13]);2;IF(AND([.B959]>=[Calendario.$F$16];[.B959]<=[Calendario.$F$17]);3;""))) ->  | D959: of:=IF(COUNTIF([Calendario.$H$4:.$H$48];[.B959])>0;"FIESTA";"") -> FIESTA | E959: of:=IF([.B959]<>"";VLOOKUP(WEEKDAY([.B959];3);[Calendario.$A$4:.$C$11];2);"") ->  | F959: of:=IF([.B959]<>"";IF([.D959]<>"FIESTA";VLOOKUP(WEEKDAY([.B959];3);[Calendario.$A$4:.$C$11];3);0);"") ->  | G959: of:=IF(ISNUMBER([.F959]);[.F959]+[.G958];"") ->  | H959: of:=IF(AND([.G959]<=[Unidades.$G$26];[.G959]<=[Unidades.$F$18];[Unidades.$F$18]>0);[Unidades.$D$18]+1-COUNTIFS([Unidades.$O$3:.$O$17];">="&[.G959]);"") ->  | I959: of:=IF([.H958]<>[.H959];"INICIO";IF([.H960]<>[.H959];"FIN";"")) ->  | J959: of:=IF([.K958]<>[.K959];"INICIO";IF([.K960]<>[.K959];"FIN";"")) -> 
A960: of:=IF([.B960]<>"";TODAY()>[.B960];"") ->  | B960: of:=IFERROR(IF(([.B959]+1)<[Calendario.$F$5];[.B959]+1;"");"") ->  | C960: of:=IF(AND([.B960]>=[Calendario.$F$8];[.B960]<=[Calendario.$F$9];1);1;IF(AND([.B960]>=[Calendario.$F$12];[.B960]<=[Calendario.$F$13]);2;IF(AND([.B960]>=[Calendario.$F$16];[.B960]<=[Calendario.$F$17]);3;""))) ->  | D960: of:=IF(COUNTIF([Calendario.$H$4:.$H$48];[.B960])>0;"FIESTA";"") -> FIESTA | E960: of:=IF([.B960]<>"";VLOOKUP(WEEKDAY([.B960];3);[Calendario.$A$4:.$C$11];2);"") ->  | F960: of:=IF([.B960]<>"";IF([.D960]<>"FIESTA";VLOOKUP(WEEKDAY([.B960];3);[Calendario.$A$4:.$C$11];3);0);"") ->  | G960: of:=IF(ISNUMBER([.F960]);[.F960]+[.G959];"") ->  | H960: of:=IF(AND([.G960]<=[Unidades.$G$26];[.G960]<=[Unidades.$F$18];[Unidades.$F$18]>0);[Unidades.$D$18]+1-COUNTIFS([Unidades.$O$3:.$O$17];">="&[.G960]);"") ->  | I960: of:=IF([.H959]<>[.H960];"INICIO";IF([.H961]<>[.H960];"FIN";"")) ->  | J960: of:=IF([.K959]<>[.K960];"INICIO";IF([.K961]<>[.K960];"FIN";"")) -> 
A961: of:=IF([.B961]<>"";TODAY()>[.B961];"") ->  | B961: of:=IFERROR(IF(([.B960]+1)<[Calendario.$F$5];[.B960]+1;"");"") ->  | C961: of:=IF(AND([.B961]>=[Calendario.$F$8];[.B961]<=[Calendario.$F$9];1);1;IF(AND([.B961]>=[Calendario.$F$12];[.B961]<=[Calendario.$F$13]);2;IF(AND([.B961]>=[Calendario.$F$16];[.B961]<=[Calendario.$F$17]);3;""))) ->  | D961: of:=IF(COUNTIF([Calendario.$H$4:.$H$48];[.B961])>0;"FIESTA";"") -> FIESTA | E961: of:=IF([.B961]<>"";VLOOKUP(WEEKDAY([.B961];3);[Calendario.$A$4:.$C$11];2);"") ->  | F961: of:=IF([.B961]<>"";IF([.D961]<>"FIESTA";VLOOKUP(WEEKDAY([.B961];3);[Calendario.$A$4:.$C$11];3);0);"") ->  | G961: of:=IF(ISNUMBER([.F961]);[.F961]+[.G960];"") ->  | H961: of:=IF(AND([.G961]<=[Unidades.$G$26];[.G961]<=[Unidades.$F$18];[Unidades.$F$18]>0);[Unidades.$D$18]+1-COUNTIFS([Unidades.$O$3:.$O$17];">="&[.G961]);"") ->  | I961: of:=IF([.H960]<>[.H961];"INICIO";IF([.H962]<>[.H961];"FIN";"")) ->  | J961: of:=IF([.K960]<>[.K961];"INICIO";IF([.K962]<>[.K961];"FIN";"")) -> 
A962: of:=IF([.B962]<>"";TODAY()>[.B962];"") ->  | B962: of:=IFERROR(IF(([.B961]+1)<[Calendario.$F$5];[.B961]+1;"");"") ->  | C962: of:=IF(AND([.B962]>=[Calendario.$F$8];[.B962]<=[Calendario.$F$9];1);1;IF(AND([.B962]>=[Calendario.$F$12];[.B962]<=[Calendario.$F$13]);2;IF(AND([.B962]>=[Calendario.$F$16];[.B962]<=[Calendario.$F$17]);3;""))) ->  | D962: of:=IF(COUNTIF([Calendario.$H$4:.$H$48];[.B962])>0;"FIESTA";"") -> FIESTA | E962: of:=IF([.B962]<>"";VLOOKUP(WEEKDAY([.B962];3);[Calendario.$A$4:.$C$11];2);"") ->  | F962: of:=IF([.B962]<>"";IF([.D962]<>"FIESTA";VLOOKUP(WEEKDAY([.B962];3);[Calendario.$A$4:.$C$11];3);0);"") ->  | G962: of:=IF(ISNUMBER([.F962]);[.F962]+[.G961];"") ->  | H962: of:=IF(AND([.G962]<=[Unidades.$G$26];[.G962]<=[Unidades.$F$18];[Unidades.$F$18]>0);[Unidades.$D$18]+1-COUNTIFS([Unidades.$O$3:.$O$17];">="&[.G962]);"") ->  | I962: of:=IF([.H961]<>[.H962];"INICIO";IF([.H963]<>[.H962];"FIN";"")) ->  | J962: of:=IF([.K961]<>[.K962];"INICIO";IF([.K963]<>[.K962];"FIN";"")) -> 
A963: of:=IF([.B963]<>"";TODAY()>[.B963];"") ->  | B963: of:=IFERROR(IF(([.B962]+1)<[Calendario.$F$5];[.B962]+1;"");"") ->  | C963: of:=IF(AND([.B963]>=[Calendario.$F$8];[.B963]<=[Calendario.$F$9];1);1;IF(AND([.B963]>=[Calendario.$F$12];[.B963]<=[Calendario.$F$13]);2;IF(AND([.B963]>=[Calendario.$F$16];[.B963]<=[Calendario.$F$17]);3;""))) ->  | D963: of:=IF(COUNTIF([Calendario.$H$4:.$H$48];[.B963])>0;"FIESTA";"") -> FIESTA | E963: of:=IF([.B963]<>"";VLOOKUP(WEEKDAY([.B963];3);[Calendario.$A$4:.$C$11];2);"") ->  | F963: of:=IF([.B963]<>"";IF([.D963]<>"FIESTA";VLOOKUP(WEEKDAY([.B963];3);[Calendario.$A$4:.$C$11];3);0);"") ->  | G963: of:=IF(ISNUMBER([.F963]);[.F963]+[.G962];"") ->  | H963: of:=IF(AND([.G963]<=[Unidades.$G$26];[.G963]<=[Unidades.$F$18];[Unidades.$F$18]>0);[Unidades.$D$18]+1-COUNTIFS([Unidades.$O$3:.$O$17];">="&[.G963]);"") ->  | I963: of:=IF([.H962]<>[.H963];"INICIO";IF([.H964]<>[.H963];"FIN";"")) ->  | J963: of:=IF([.K962]<>[.K963];"INICIO";IF([.K964]<>[.K963];"FIN";"")) -> 
A964: of:=IF([.B964]<>"";TODAY()>[.B964];"") ->  | B964: of:=IFERROR(IF(([.B963]+1)<[Calendario.$F$5];[.B963]+1;"");"") ->  | C964: of:=IF(AND([.B964]>=[Calendario.$F$8];[.B964]<=[Calendario.$F$9];1);1;IF(AND([.B964]>=[Calendario.$F$12];[.B964]<=[Calendario.$F$13]);2;IF(AND([.B964]>=[Calendario.$F$16];[.B964]<=[Calendario.$F$17]);3;""))) ->  | D964: of:=IF(COUNTIF([Calendario.$H$4:.$H$48];[.B964])>0;"FIESTA";"") -> FIESTA | E964: of:=IF([.B964]<>"";VLOOKUP(WEEKDAY([.B964];3);[Calendario.$A$4:.$C$11];2);"") ->  | F964: of:=IF([.B964]<>"";IF([.D964]<>"FIESTA";VLOOKUP(WEEKDAY([.B964];3);[Calendario.$A$4:.$C$11];3);0);"") ->  | G964: of:=IF(ISNUMBER([.F964]);[.F964]+[.G963];"") ->  | H964: of:=IF(AND([.G964]<=[Unidades.$G$26];[.G964]<=[Unidades.$F$18];[Unidades.$F$18]>0);[Unidades.$D$18]+1-COUNTIFS([Unidades.$O$3:.$O$17];">="&[.G964]);"") ->  | I964: of:=IF([.H963]<>[.H964];"INICIO";IF([.H965]<>[.H964];"FIN";"")) ->  | J964: of:=IF([.K963]<>[.K964];"INICIO";IF([.K965]<>[.K964];"FIN";"")) -> 
A965: of:=IF([.B965]<>"";TODAY()>[.B965];"") ->  | B965: of:=IFERROR(IF(([.B964]+1)<[Calendario.$F$5];[.B964]+1;"");"") ->  | C965: of:=IF(AND([.B965]>=[Calendario.$F$8];[.B965]<=[Calendario.$F$9];1);1;IF(AND([.B965]>=[Calendario.$F$12];[.B965]<=[Calendario.$F$13]);2;IF(AND([.B965]>=[Calendario.$F$16];[.B965]<=[Calendario.$F$17]);3;""))) ->  | D965: of:=IF(COUNTIF([Calendario.$H$4:.$H$48];[.B965])>0;"FIESTA";"") -> FIESTA | E965: of:=IF([.B965]<>"";VLOOKUP(WEEKDAY([.B965];3);[Calendario.$A$4:.$C$11];2);"") ->  | F965: of:=IF([.B965]<>"";IF([.D965]<>"FIESTA";VLOOKUP(WEEKDAY([.B965];3);[Calendario.$A$4:.$C$11];3);0);"") ->  | G965: of:=IF(ISNUMBER([.F965]);[.F965]+[.G964];"") ->  | H965: of:=IF(AND([.G965]<=[Unidades.$G$26];[.G965]<=[Unidades.$F$18];[Unidades.$F$18]>0);[Unidades.$D$18]+1-COUNTIFS([Unidades.$O$3:.$O$17];">="&[.G965]);"") ->  | I965: of:=IF([.H964]<>[.H965];"INICIO";IF([.H966]<>[.H965];"FIN";"")) ->  | J965: of:=IF([.K964]<>[.K965];"INICIO";IF([.K966]<>[.K965];"FIN";"")) -> 
A966: of:=IF([.B966]<>"";TODAY()>[.B966];"") ->  | B966: of:=IFERROR(IF(([.B965]+1)<[Calendario.$F$5];[.B965]+1;"");"") ->  | C966: of:=IF(AND([.B966]>=[Calendario.$F$8];[.B966]<=[Calendario.$F$9];1);1;IF(AND([.B966]>=[Calendario.$F$12];[.B966]<=[Calendario.$F$13]);2;IF(AND([.B966]>=[Calendario.$F$16];[.B966]<=[Calendario.$F$17]);3;""))) ->  | D966: of:=IF(COUNTIF([Calendario.$H$4:.$H$48];[.B966])>0;"FIESTA";"") -> FIESTA | E966: of:=IF([.B966]<>"";VLOOKUP(WEEKDAY([.B966];3);[Calendario.$A$4:.$C$11];2);"") ->  | F966: of:=IF([.B966]<>"";IF([.D966]<>"FIESTA";VLOOKUP(WEEKDAY([.B966];3);[Calendario.$A$4:.$C$11];3);0);"") ->  | G966: of:=IF(ISNUMBER([.F966]);[.F966]+[.G965];"") ->  | H966: of:=IF(AND([.G966]<=[Unidades.$G$26];[.G966]<=[Unidades.$F$18];[Unidades.$F$18]>0);[Unidades.$D$18]+1-COUNTIFS([Unidades.$O$3:.$O$17];">="&[.G966]);"") ->  | I966: of:=IF([.H965]<>[.H966];"INICIO";IF([.H967]<>[.H966];"FIN";"")) ->  | J966: of:=IF([.K965]<>[.K966];"INICIO";IF([.K967]<>[.K966];"FIN";"")) -> 
A967: of:=IF([.B967]<>"";TODAY()>[.B967];"") ->  | B967: of:=IFERROR(IF(([.B966]+1)<[Calendario.$F$5];[.B966]+1;"");"") ->  | C967: of:=IF(AND([.B967]>=[Calendario.$F$8];[.B967]<=[Calendario.$F$9];1);1;IF(AND([.B967]>=[Calendario.$F$12];[.B967]<=[Calendario.$F$13]);2;IF(AND([.B967]>=[Calendario.$F$16];[.B967]<=[Calendario.$F$17]);3;""))) ->  | D967: of:=IF(COUNTIF([Calendario.$H$4:.$H$48];[.B967])>0;"FIESTA";"") -> FIESTA | E967: of:=IF([.B967]<>"";VLOOKUP(WEEKDAY([.B967];3);[Calendario.$A$4:.$C$11];2);"") ->  | F967: of:=IF([.B967]<>"";IF([.D967]<>"FIESTA";VLOOKUP(WEEKDAY([.B967];3);[Calendario.$A$4:.$C$11];3);0);"") ->  | G967: of:=IF(ISNUMBER([.F967]);[.F967]+[.G966];"") ->  | H967: of:=IF(AND([.G967]<=[Unidades.$G$26];[.G967]<=[Unidades.$F$18];[Unidades.$F$18]>0);[Unidades.$D$18]+1-COUNTIFS([Unidades.$O$3:.$O$17];">="&[.G967]);"") ->  | I967: of:=IF([.H966]<>[.H967];"INICIO";IF([.H968]<>[.H967];"FIN";"")) ->  | J967: of:=IF([.K966]<>[.K967];"INICIO";IF([.K968]<>[.K967];"FIN";"")) -> 
A968: of:=IF([.B968]<>"";TODAY()>[.B968];"") ->  | B968: of:=IFERROR(IF(([.B967]+1)<[Calendario.$F$5];[.B967]+1;"");"") ->  | C968: of:=IF(AND([.B968]>=[Calendario.$F$8];[.B968]<=[Calendario.$F$9];1);1;IF(AND([.B968]>=[Calendario.$F$12];[.B968]<=[Calendario.$F$13]);2;IF(AND([.B968]>=[Calendario.$F$16];[.B968]<=[Calendario.$F$17]);3;""))) ->  | D968: of:=IF(COUNTIF([Calendario.$H$4:.$H$48];[.B968])>0;"FIESTA";"") -> FIESTA | E968: of:=IF([.B968]<>"";VLOOKUP(WEEKDAY([.B968];3);[Calendario.$A$4:.$C$11];2);"") ->  | F968: of:=IF([.B968]<>"";IF([.D968]<>"FIESTA";VLOOKUP(WEEKDAY([.B968];3);[Calendario.$A$4:.$C$11];3);0);"") ->  | G968: of:=IF(ISNUMBER([.F968]);[.F968]+[.G967];"") ->  | H968: of:=IF(AND([.G968]<=[Unidades.$G$26];[.G968]<=[Unidades.$F$18];[Unidades.$F$18]>0);[Unidades.$D$18]+1-COUNTIFS([Unidades.$O$3:.$O$17];">="&[.G968]);"") ->  | I968: of:=IF([.H967]<>[.H968];"INICIO";IF([.H969]<>[.H968];"FIN";"")) ->  | J968: of:=IF([.K967]<>[.K968];"INICIO";IF([.K969]<>[.K968];"FIN";"")) -> 
A969: of:=IF([.B969]<>"";TODAY()>[.B969];"") ->  | B969: of:=IFERROR(IF(([.B968]+1)<[Calendario.$F$5];[.B968]+1;"");"") ->  | C969: of:=IF(AND([.B969]>=[Calendario.$F$8];[.B969]<=[Calendario.$F$9];1);1;IF(AND([.B969]>=[Calendario.$F$12];[.B969]<=[Calendario.$F$13]);2;IF(AND([.B969]>=[Calendario.$F$16];[.B969]<=[Calendario.$F$17]);3;""))) ->  | D969: of:=IF(COUNTIF([Calendario.$H$4:.$H$48];[.B969])>0;"FIESTA";"") -> FIESTA | E969: of:=IF([.B969]<>"";VLOOKUP(WEEKDAY([.B969];3);[Calendario.$A$4:.$C$11];2);"") ->  | F969: of:=IF([.B969]<>"";IF([.D969]<>"FIESTA";VLOOKUP(WEEKDAY([.B969];3);[Calendario.$A$4:.$C$11];3);0);"") ->  | G969: of:=IF(ISNUMBER([.F969]);[.F969]+[.G968];"") ->  | H969: of:=IF(AND([.G969]<=[Unidades.$G$26];[.G969]<=[Unidades.$F$18];[Unidades.$F$18]>0);[Unidades.$D$18]+1-COUNTIFS([Unidades.$O$3:.$O$17];">="&[.G969]);"") ->  | I969: of:=IF([.H968]<>[.H969];"INICIO";IF([.H970]<>[.H969];"FIN";"")) ->  | J969: of:=IF([.K968]<>[.K969];"INICIO";IF([.K970]<>[.K969];"FIN";"")) -> 
A970: of:=IF([.B970]<>"";TODAY()>[.B970];"") ->  | B970: of:=IFERROR(IF(([.B969]+1)<[Calendario.$F$5];[.B969]+1;"");"") ->  | C970: of:=IF(AND([.B970]>=[Calendario.$F$8];[.B970]<=[Calendario.$F$9];1);1;IF(AND([.B970]>=[Calendario.$F$12];[.B970]<=[Calendario.$F$13]);2;IF(AND([.B970]>=[Calendario.$F$16];[.B970]<=[Calendario.$F$17]);3;""))) ->  | D970: of:=IF(COUNTIF([Calendario.$H$4:.$H$48];[.B970])>0;"FIESTA";"") -> FIESTA | E970: of:=IF([.B970]<>"";VLOOKUP(WEEKDAY([.B970];3);[Calendario.$A$4:.$C$11];2);"") ->  | F970: of:=IF([.B970]<>"";IF([.D970]<>"FIESTA";VLOOKUP(WEEKDAY([.B970];3);[Calendario.$A$4:.$C$11];3);0);"") ->  | G970: of:=IF(ISNUMBER([.F970]);[.F970]+[.G969];"") ->  | H970: of:=IF(AND([.G970]<=[Unidades.$G$26];[.G970]<=[Unidades.$F$18];[Unidades.$F$18]>0);[Unidades.$D$18]+1-COUNTIFS([Unidades.$O$3:.$O$17];">="&[.G970]);"") ->  | I970: of:=IF([.H969]<>[.H970];"INICIO";IF([.H971]<>[.H970];"FIN";"")) ->  | J970: of:=IF([.K969]<>[.K970];"INICIO";IF([.K971]<>[.K970];"FIN";"")) -> 
A971: of:=IF([.B971]<>"";TODAY()>[.B971];"") ->  | B971: of:=IFERROR(IF(([.B970]+1)<[Calendario.$F$5];[.B970]+1;"");"") ->  | C971: of:=IF(AND([.B971]>=[Calendario.$F$8];[.B971]<=[Calendario.$F$9];1);1;IF(AND([.B971]>=[Calendario.$F$12];[.B971]<=[Calendario.$F$13]);2;IF(AND([.B971]>=[Calendario.$F$16];[.B971]<=[Calendario.$F$17]);3;""))) ->  | D971: of:=IF(COUNTIF([Calendario.$H$4:.$H$48];[.B971])>0;"FIESTA";"") -> FIESTA | E971: of:=IF([.B971]<>"";VLOOKUP(WEEKDAY([.B971];3);[Calendario.$A$4:.$C$11];2);"") ->  | F971: of:=IF([.B971]<>"";IF([.D971]<>"FIESTA";VLOOKUP(WEEKDAY([.B971];3);[Calendario.$A$4:.$C$11];3);0);"") ->  | G971: of:=IF(ISNUMBER([.F971]);[.F971]+[.G970];"") ->  | H971: of:=IF(AND([.G971]<=[Unidades.$G$26];[.G971]<=[Unidades.$F$18];[Unidades.$F$18]>0);[Unidades.$D$18]+1-COUNTIFS([Unidades.$O$3:.$O$17];">="&[.G971]);"") ->  | I971: of:=IF([.H970]<>[.H971];"INICIO";IF([.H972]<>[.H971];"FIN";"")) ->  | J971: of:=IF([.K970]<>[.K971];"INICIO";IF([.K972]<>[.K971];"FIN";"")) -> 
A972: of:=IF([.B972]<>"";TODAY()>[.B972];"") ->  | B972: of:=IFERROR(IF(([.B971]+1)<[Calendario.$F$5];[.B971]+1;"");"") ->  | C972: of:=IF(AND([.B972]>=[Calendario.$F$8];[.B972]<=[Calendario.$F$9];1);1;IF(AND([.B972]>=[Calendario.$F$12];[.B972]<=[Calendario.$F$13]);2;IF(AND([.B972]>=[Calendario.$F$16];[.B972]<=[Calendario.$F$17]);3;""))) ->  | D972: of:=IF(COUNTIF([Calendario.$H$4:.$H$48];[.B972])>0;"FIESTA";"") -> FIESTA | E972: of:=IF([.B972]<>"";VLOOKUP(WEEKDAY([.B972];3);[Calendario.$A$4:.$C$11];2);"") ->  | F972: of:=IF([.B972]<>"";IF([.D972]<>"FIESTA";VLOOKUP(WEEKDAY([.B972];3);[Calendario.$A$4:.$C$11];3);0);"") ->  | G972: of:=IF(ISNUMBER([.F972]);[.F972]+[.G971];"") ->  | H972: of:=IF(AND([.G972]<=[Unidades.$G$26];[.G972]<=[Unidades.$F$18];[Unidades.$F$18]>0);[Unidades.$D$18]+1-COUNTIFS([Unidades.$O$3:.$O$17];">="&[.G972]);"") ->  | I972: of:=IF([.H971]<>[.H972];"INICIO";IF([.H973]<>[.H972];"FIN";"")) ->  | J972: of:=IF([.K971]<>[.K972];"INICIO";IF([.K973]<>[.K972];"FIN";"")) -> 
A973: of:=IF([.B973]<>"";TODAY()>[.B973];"") ->  | B973: of:=IFERROR(IF(([.B972]+1)<[Calendario.$F$5];[.B972]+1;"");"") ->  | C973: of:=IF(AND([.B973]>=[Calendario.$F$8];[.B973]<=[Calendario.$F$9];1);1;IF(AND([.B973]>=[Calendario.$F$12];[.B973]<=[Calendario.$F$13]);2;IF(AND([.B973]>=[Calendario.$F$16];[.B973]<=[Calendario.$F$17]);3;""))) ->  | D973: of:=IF(COUNTIF([Calendario.$H$4:.$H$48];[.B973])>0;"FIESTA";"") -> FIESTA | E973: of:=IF([.B973]<>"";VLOOKUP(WEEKDAY([.B973];3);[Calendario.$A$4:.$C$11];2);"") ->  | F973: of:=IF([.B973]<>"";IF([.D973]<>"FIESTA";VLOOKUP(WEEKDAY([.B973];3);[Calendario.$A$4:.$C$11];3);0);"") ->  | G973: of:=IF(ISNUMBER([.F973]);[.F973]+[.G972];"") ->  | H973: of:=IF(AND([.G973]<=[Unidades.$G$26];[.G973]<=[Unidades.$F$18];[Unidades.$F$18]>0);[Unidades.$D$18]+1-COUNTIFS([Unidades.$O$3:.$O$17];">="&[.G973]);"") ->  | I973: of:=IF([.H972]<>[.H973];"INICIO";IF([.H974]<>[.H973];"FIN";"")) ->  | J973: of:=IF([.K972]<>[.K973];"INICIO";IF([.K974]<>[.K973];"FIN";"")) -> 
A974: of:=IF([.B974]<>"";TODAY()>[.B974];"") ->  | B974: of:=IFERROR(IF(([.B973]+1)<[Calendario.$F$5];[.B973]+1;"");"") ->  | C974: of:=IF(AND([.B974]>=[Calendario.$F$8];[.B974]<=[Calendario.$F$9];1);1;IF(AND([.B974]>=[Calendario.$F$12];[.B974]<=[Calendario.$F$13]);2;IF(AND([.B974]>=[Calendario.$F$16];[.B974]<=[Calendario.$F$17]);3;""))) ->  | D974: of:=IF(COUNTIF([Calendario.$H$4:.$H$48];[.B974])>0;"FIESTA";"") -> FIESTA | E974: of:=IF([.B974]<>"";VLOOKUP(WEEKDAY([.B974];3);[Calendario.$A$4:.$C$11];2);"") ->  | F974: of:=IF([.B974]<>"";IF([.D974]<>"FIESTA";VLOOKUP(WEEKDAY([.B974];3);[Calendario.$A$4:.$C$11];3);0);"") ->  | G974: of:=IF(ISNUMBER([.F974]);[.F974]+[.G973];"") ->  | H974: of:=IF(AND([.G974]<=[Unidades.$G$26];[.G974]<=[Unidades.$F$18];[Unidades.$F$18]>0);[Unidades.$D$18]+1-COUNTIFS([Unidades.$O$3:.$O$17];">="&[.G974]);"") ->  | I974: of:=IF([.H973]<>[.H974];"INICIO";IF([.H975]<>[.H974];"FIN";"")) ->  | J974: of:=IF([.K973]<>[.K974];"INICIO";IF([.K975]<>[.K974];"FIN";"")) -> 
A975: of:=IF([.B975]<>"";TODAY()>[.B975];"") ->  | B975: of:=IFERROR(IF(([.B974]+1)<[Calendario.$F$5];[.B974]+1;"");"") ->  | C975: of:=IF(AND([.B975]>=[Calendario.$F$8];[.B975]<=[Calendario.$F$9];1);1;IF(AND([.B975]>=[Calendario.$F$12];[.B975]<=[Calendario.$F$13]);2;IF(AND([.B975]>=[Calendario.$F$16];[.B975]<=[Calendario.$F$17]);3;""))) ->  | D975: of:=IF(COUNTIF([Calendario.$H$4:.$H$48];[.B975])>0;"FIESTA";"") -> FIESTA | E975: of:=IF([.B975]<>"";VLOOKUP(WEEKDAY([.B975];3);[Calendario.$A$4:.$C$11];2);"") ->  | F975: of:=IF([.B975]<>"";IF([.D975]<>"FIESTA";VLOOKUP(WEEKDAY([.B975];3);[Calendario.$A$4:.$C$11];3);0);"") ->  | G975: of:=IF(ISNUMBER([.F975]);[.F975]+[.G974];"") ->  | H975: of:=IF(AND([.G975]<=[Unidades.$G$26];[.G975]<=[Unidades.$F$18];[Unidades.$F$18]>0);[Unidades.$D$18]+1-COUNTIFS([Unidades.$O$3:.$O$17];">="&[.G975]);"") ->  | I975: of:=IF([.H974]<>[.H975];"INICIO";IF([.H976]<>[.H975];"FIN";"")) ->  | J975: of:=IF([.K974]<>[.K975];"INICIO";IF([.K976]<>[.K975];"FIN";"")) -> 
A976: of:=IF([.B976]<>"";TODAY()>[.B976];"") ->  | B976: of:=IFERROR(IF(([.B975]+1)<[Calendario.$F$5];[.B975]+1;"");"") ->  | C976: of:=IF(AND([.B976]>=[Calendario.$F$8];[.B976]<=[Calendario.$F$9];1);1;IF(AND([.B976]>=[Calendario.$F$12];[.B976]<=[Calendario.$F$13]);2;IF(AND([.B976]>=[Calendario.$F$16];[.B976]<=[Calendario.$F$17]);3;""))) ->  | D976: of:=IF(COUNTIF([Calendario.$H$4:.$H$48];[.B976])>0;"FIESTA";"") -> FIESTA | E976: of:=IF([.B976]<>"";VLOOKUP(WEEKDAY([.B976];3);[Calendario.$A$4:.$C$11];2);"") ->  | F976: of:=IF([.B976]<>"";IF([.D976]<>"FIESTA";VLOOKUP(WEEKDAY([.B976];3);[Calendario.$A$4:.$C$11];3);0);"") ->  | G976: of:=IF(ISNUMBER([.F976]);[.F976]+[.G975];"") ->  | H976: of:=IF(AND([.G976]<=[Unidades.$G$26];[.G976]<=[Unidades.$F$18];[Unidades.$F$18]>0);[Unidades.$D$18]+1-COUNTIFS([Unidades.$O$3:.$O$17];">="&[.G976]);"") ->  | I976: of:=IF([.H975]<>[.H976];"INICIO";IF([.H977]<>[.H976];"FIN";"")) ->  | J976: of:=IF([.K975]<>[.K976];"INICIO";IF([.K977]<>[.K976];"FIN";"")) -> 
A977: of:=IF([.B977]<>"";TODAY()>[.B977];"") ->  | B977: of:=IFERROR(IF(([.B976]+1)<[Calendario.$F$5];[.B976]+1;"");"") ->  | C977: of:=IF(AND([.B977]>=[Calendario.$F$8];[.B977]<=[Calendario.$F$9];1);1;IF(AND([.B977]>=[Calendario.$F$12];[.B977]<=[Calendario.$F$13]);2;IF(AND([.B977]>=[Calendario.$F$16];[.B977]<=[Calendario.$F$17]);3;""))) ->  | D977: of:=IF(COUNTIF([Calendario.$H$4:.$H$48];[.B977])>0;"FIESTA";"") -> FIESTA | E977: of:=IF([.B977]<>"";VLOOKUP(WEEKDAY([.B977];3);[Calendario.$A$4:.$C$11];2);"") ->  | F977: of:=IF([.B977]<>"";IF([.D977]<>"FIESTA";VLOOKUP(WEEKDAY([.B977];3);[Calendario.$A$4:.$C$11];3);0);"") ->  | G977: of:=IF(ISNUMBER([.F977]);[.F977]+[.G976];"") ->  | H977: of:=IF(AND([.G977]<=[Unidades.$G$26];[.G977]<=[Unidades.$F$18];[Unidades.$F$18]>0);[Unidades.$D$18]+1-COUNTIFS([Unidades.$O$3:.$O$17];">="&[.G977]);"") ->  | I977: of:=IF([.H976]<>[.H977];"INICIO";IF([.H978]<>[.H977];"FIN";"")) ->  | J977: of:=IF([.K976]<>[.K977];"INICIO";IF([.K978]<>[.K977];"FIN";"")) -> 
A978: of:=IF([.B978]<>"";TODAY()>[.B978];"") ->  | B978: of:=IFERROR(IF(([.B977]+1)<[Calendario.$F$5];[.B977]+1;"");"") ->  | C978: of:=IF(AND([.B978]>=[Calendario.$F$8];[.B978]<=[Calendario.$F$9];1);1;IF(AND([.B978]>=[Calendario.$F$12];[.B978]<=[Calendario.$F$13]);2;IF(AND([.B978]>=[Calendario.$F$16];[.B978]<=[Calendario.$F$17]);3;""))) ->  | D978: of:=IF(COUNTIF([Calendario.$H$4:.$H$48];[.B978])>0;"FIESTA";"") -> FIESTA | E978: of:=IF([.B978]<>"";VLOOKUP(WEEKDAY([.B978];3);[Calendario.$A$4:.$C$11];2);"") ->  | F978: of:=IF([.B978]<>"";IF([.D978]<>"FIESTA";VLOOKUP(WEEKDAY([.B978];3);[Calendario.$A$4:.$C$11];3);0);"") ->  | G978: of:=IF(ISNUMBER([.F978]);[.F978]+[.G977];"") ->  | H978: of:=IF(AND([.G978]<=[Unidades.$G$26];[.G978]<=[Unidades.$F$18];[Unidades.$F$18]>0);[Unidades.$D$18]+1-COUNTIFS([Unidades.$O$3:.$O$17];">="&[.G978]);"") ->  | I978: of:=IF([.H977]<>[.H978];"INICIO";IF([.H979]<>[.H978];"FIN";"")) ->  | J978: of:=IF([.K977]<>[.K978];"INICIO";IF([.K979]<>[.K978];"FIN";"")) -> 
A979: of:=IF([.B979]<>"";TODAY()>[.B979];"") ->  | B979: of:=IFERROR(IF(([.B978]+1)<[Calendario.$F$5];[.B978]+1;"");"") ->  | C979: of:=IF(AND([.B979]>=[Calendario.$F$8];[.B979]<=[Calendario.$F$9];1);1;IF(AND([.B979]>=[Calendario.$F$12];[.B979]<=[Calendario.$F$13]);2;IF(AND([.B979]>=[Calendario.$F$16];[.B979]<=[Calendario.$F$17]);3;""))) ->  | D979: of:=IF(COUNTIF([Calendario.$H$4:.$H$48];[.B979])>0;"FIESTA";"") -> FIESTA | E979: of:=IF([.B979]<>"";VLOOKUP(WEEKDAY([.B979];3);[Calendario.$A$4:.$C$11];2);"") ->  | F979: of:=IF([.B979]<>"";IF([.D979]<>"FIESTA";VLOOKUP(WEEKDAY([.B979];3);[Calendario.$A$4:.$C$11];3);0);"") ->  | G979: of:=IF(ISNUMBER([.F979]);[.F979]+[.G978];"") ->  | H979: of:=IF(AND([.G979]<=[Unidades.$G$26];[.G979]<=[Unidades.$F$18];[Unidades.$F$18]>0);[Unidades.$D$18]+1-COUNTIFS([Unidades.$O$3:.$O$17];">="&[.G979]);"") ->  | I979: of:=IF([.H978]<>[.H979];"INICIO";IF([.H980]<>[.H979];"FIN";"")) ->  | J979: of:=IF([.K978]<>[.K979];"INICIO";IF([.K980]<>[.K979];"FIN";"")) -> 
A980: of:=IF([.B980]<>"";TODAY()>[.B980];"") ->  | B980: of:=IFERROR(IF(([.B979]+1)<[Calendario.$F$5];[.B979]+1;"");"") ->  | C980: of:=IF(AND([.B980]>=[Calendario.$F$8];[.B980]<=[Calendario.$F$9];1);1;IF(AND([.B980]>=[Calendario.$F$12];[.B980]<=[Calendario.$F$13]);2;IF(AND([.B980]>=[Calendario.$F$16];[.B980]<=[Calendario.$F$17]);3;""))) ->  | D980: of:=IF(COUNTIF([Calendario.$H$4:.$H$48];[.B980])>0;"FIESTA";"") -> FIESTA | E980: of:=IF([.B980]<>"";VLOOKUP(WEEKDAY([.B980];3);[Calendario.$A$4:.$C$11];2);"") ->  | F980: of:=IF([.B980]<>"";IF([.D980]<>"FIESTA";VLOOKUP(WEEKDAY([.B980];3);[Calendario.$A$4:.$C$11];3);0);"") ->  | G980: of:=IF(ISNUMBER([.F980]);[.F980]+[.G979];"") ->  | H980: of:=IF(AND([.G980]<=[Unidades.$G$26];[.G980]<=[Unidades.$F$18];[Unidades.$F$18]>0);[Unidades.$D$18]+1-COUNTIFS([Unidades.$O$3:.$O$17];">="&[.G980]);"") ->  | I980: of:=IF([.H979]<>[.H980];"INICIO";IF([.H981]<>[.H980];"FIN";"")) ->  | J980: of:=IF([.K979]<>[.K980];"INICIO";IF([.K981]<>[.K980];"FIN";"")) -> 
A981: of:=IF([.B981]<>"";TODAY()>[.B981];"") ->  | B981: of:=IFERROR(IF(([.B980]+1)<[Calendario.$F$5];[.B980]+1;"");"") ->  | C981: of:=IF(AND([.B981]>=[Calendario.$F$8];[.B981]<=[Calendario.$F$9];1);1;IF(AND([.B981]>=[Calendario.$F$12];[.B981]<=[Calendario.$F$13]);2;IF(AND([.B981]>=[Calendario.$F$16];[.B981]<=[Calendario.$F$17]);3;""))) ->  | D981: of:=IF(COUNTIF([Calendario.$H$4:.$H$48];[.B981])>0;"FIESTA";"") -> FIESTA | E981: of:=IF([.B981]<>"";VLOOKUP(WEEKDAY([.B981];3);[Calendario.$A$4:.$C$11];2);"") ->  | F981: of:=IF([.B981]<>"";IF([.D981]<>"FIESTA";VLOOKUP(WEEKDAY([.B981];3);[Calendario.$A$4:.$C$11];3);0);"") ->  | G981: of:=IF(ISNUMBER([.F981]);[.F981]+[.G980];"") ->  | H981: of:=IF(AND([.G981]<=[Unidades.$G$26];[.G981]<=[Unidades.$F$18];[Unidades.$F$18]>0);[Unidades.$D$18]+1-COUNTIFS([Unidades.$O$3:.$O$17];">="&[.G981]);"") ->  | I981: of:=IF([.H980]<>[.H981];"INICIO";IF([.H982]<>[.H981];"FIN";"")) ->  | J981: of:=IF([.K980]<>[.K981];"INICIO";IF([.K982]<>[.K981];"FIN";"")) -> 
A982: of:=IF([.B982]<>"";TODAY()>[.B982];"") ->  | B982: of:=IFERROR(IF(([.B981]+1)<[Calendario.$F$5];[.B981]+1;"");"") ->  | C982: of:=IF(AND([.B982]>=[Calendario.$F$8];[.B982]<=[Calendario.$F$9];1);1;IF(AND([.B982]>=[Calendario.$F$12];[.B982]<=[Calendario.$F$13]);2;IF(AND([.B982]>=[Calendario.$F$16];[.B982]<=[Calendario.$F$17]);3;""))) ->  | D982: of:=IF(COUNTIF([Calendario.$H$4:.$H$48];[.B982])>0;"FIESTA";"") -> FIESTA | E982: of:=IF([.B982]<>"";VLOOKUP(WEEKDAY([.B982];3);[Calendario.$A$4:.$C$11];2);"") ->  | F982: of:=IF([.B982]<>"";IF([.D982]<>"FIESTA";VLOOKUP(WEEKDAY([.B982];3);[Calendario.$A$4:.$C$11];3);0);"") ->  | G982: of:=IF(ISNUMBER([.F982]);[.F982]+[.G981];"") ->  | H982: of:=IF(AND([.G982]<=[Unidades.$G$26];[.G982]<=[Unidades.$F$18];[Unidades.$F$18]>0);[Unidades.$D$18]+1-COUNTIFS([Unidades.$O$3:.$O$17];">="&[.G982]);"") ->  | I982: of:=IF([.H981]<>[.H982];"INICIO";IF([.H983]<>[.H982];"FIN";"")) ->  | J982: of:=IF([.K981]<>[.K982];"INICIO";IF([.K983]<>[.K982];"FIN";"")) -> 
A983: of:=IF([.B983]<>"";TODAY()>[.B983];"") ->  | B983: of:=IFERROR(IF(([.B982]+1)<[Calendario.$F$5];[.B982]+1;"");"") ->  | C983: of:=IF(AND([.B983]>=[Calendario.$F$8];[.B983]<=[Calendario.$F$9];1);1;IF(AND([.B983]>=[Calendario.$F$12];[.B983]<=[Calendario.$F$13]);2;IF(AND([.B983]>=[Calendario.$F$16];[.B983]<=[Calendario.$F$17]);3;""))) ->  | D983: of:=IF(COUNTIF([Calendario.$H$4:.$H$48];[.B983])>0;"FIESTA";"") -> FIESTA | E983: of:=IF([.B983]<>"";VLOOKUP(WEEKDAY([.B983];3);[Calendario.$A$4:.$C$11];2);"") ->  | F983: of:=IF([.B983]<>"";IF([.D983]<>"FIESTA";VLOOKUP(WEEKDAY([.B983];3);[Calendario.$A$4:.$C$11];3);0);"") ->  | G983: of:=IF(ISNUMBER([.F983]);[.F983]+[.G982];"") ->  | H983: of:=IF(AND([.G983]<=[Unidades.$G$26];[.G983]<=[Unidades.$F$18];[Unidades.$F$18]>0);[Unidades.$D$18]+1-COUNTIFS([Unidades.$O$3:.$O$17];">="&[.G983]);"") ->  | I983: of:=IF([.H982]<>[.H983];"INICIO";IF([.H984]<>[.H983];"FIN";"")) ->  | J983: of:=IF([.K982]<>[.K983];"INICIO";IF([.K984]<>[.K983];"FIN";"")) -> 
A984: of:=IF([.B984]<>"";TODAY()>[.B984];"") ->  | B984: of:=IFERROR(IF(([.B983]+1)<[Calendario.$F$5];[.B983]+1;"");"") ->  | C984: of:=IF(AND([.B984]>=[Calendario.$F$8];[.B984]<=[Calendario.$F$9];1);1;IF(AND([.B984]>=[Calendario.$F$12];[.B984]<=[Calendario.$F$13]);2;IF(AND([.B984]>=[Calendario.$F$16];[.B984]<=[Calendario.$F$17]);3;""))) ->  | D984: of:=IF(COUNTIF([Calendario.$H$4:.$H$48];[.B984])>0;"FIESTA";"") -> FIESTA | E984: of:=IF([.B984]<>"";VLOOKUP(WEEKDAY([.B984];3);[Calendario.$A$4:.$C$11];2);"") ->  | F984: of:=IF([.B984]<>"";IF([.D984]<>"FIESTA";VLOOKUP(WEEKDAY([.B984];3);[Calendario.$A$4:.$C$11];3);0);"") ->  | G984: of:=IF(ISNUMBER([.F984]);[.F984]+[.G983];"") ->  | H984: of:=IF(AND([.G984]<=[Unidades.$G$26];[.G984]<=[Unidades.$F$18];[Unidades.$F$18]>0);[Unidades.$D$18]+1-COUNTIFS([Unidades.$O$3:.$O$17];">="&[.G984]);"") ->  | I984: of:=IF([.H983]<>[.H984];"INICIO";IF([.H985]<>[.H984];"FIN";"")) ->  | J984: of:=IF([.K983]<>[.K984];"INICIO";IF([.K985]<>[.K984];"FIN";"")) -> 
A985: of:=IF([.B985]<>"";TODAY()>[.B985];"") ->  | B985: of:=IFERROR(IF(([.B984]+1)<[Calendario.$F$5];[.B984]+1;"");"") ->  | C985: of:=IF(AND([.B985]>=[Calendario.$F$8];[.B985]<=[Calendario.$F$9];1);1;IF(AND([.B985]>=[Calendario.$F$12];[.B985]<=[Calendario.$F$13]);2;IF(AND([.B985]>=[Calendario.$F$16];[.B985]<=[Calendario.$F$17]);3;""))) ->  | D985: of:=IF(COUNTIF([Calendario.$H$4:.$H$48];[.B985])>0;"FIESTA";"") -> FIESTA | E985: of:=IF([.B985]<>"";VLOOKUP(WEEKDAY([.B985];3);[Calendario.$A$4:.$C$11];2);"") ->  | F985: of:=IF([.B985]<>"";IF([.D985]<>"FIESTA";VLOOKUP(WEEKDAY([.B985];3);[Calendario.$A$4:.$C$11];3);0);"") ->  | G985: of:=IF(ISNUMBER([.F985]);[.F985]+[.G984];"") ->  | H985: of:=IF(AND([.G985]<=[Unidades.$G$26];[.G985]<=[Unidades.$F$18];[Unidades.$F$18]>0);[Unidades.$D$18]+1-COUNTIFS([Unidades.$O$3:.$O$17];">="&[.G985]);"") ->  | I985: of:=IF([.H984]<>[.H985];"INICIO";IF([.H986]<>[.H985];"FIN";"")) ->  | J985: of:=IF([.K984]<>[.K985];"INICIO";IF([.K986]<>[.K985];"FIN";"")) -> 
A986: of:=IF([.B986]<>"";TODAY()>[.B986];"") ->  | B986: of:=IFERROR(IF(([.B985]+1)<[Calendario.$F$5];[.B985]+1;"");"") ->  | C986: of:=IF(AND([.B986]>=[Calendario.$F$8];[.B986]<=[Calendario.$F$9];1);1;IF(AND([.B986]>=[Calendario.$F$12];[.B986]<=[Calendario.$F$13]);2;IF(AND([.B986]>=[Calendario.$F$16];[.B986]<=[Calendario.$F$17]);3;""))) ->  | D986: of:=IF(COUNTIF([Calendario.$H$4:.$H$48];[.B986])>0;"FIESTA";"") -> FIESTA | E986: of:=IF([.B986]<>"";VLOOKUP(WEEKDAY([.B986];3);[Calendario.$A$4:.$C$11];2);"") ->  | F986: of:=IF([.B986]<>"";IF([.D986]<>"FIESTA";VLOOKUP(WEEKDAY([.B986];3);[Calendario.$A$4:.$C$11];3);0);"") ->  | G986: of:=IF(ISNUMBER([.F986]);[.F986]+[.G985];"") ->  | H986: of:=IF(AND([.G986]<=[Unidades.$G$26];[.G986]<=[Unidades.$F$18];[Unidades.$F$18]>0);[Unidades.$D$18]+1-COUNTIFS([Unidades.$O$3:.$O$17];">="&[.G986]);"") ->  | I986: of:=IF([.H985]<>[.H986];"INICIO";IF([.H987]<>[.H986];"FIN";"")) ->  | J986: of:=IF([.K985]<>[.K986];"INICIO";IF([.K987]<>[.K986];"FIN";"")) -> 
A987: of:=IF([.B987]<>"";TODAY()>[.B987];"") ->  | B987: of:=IFERROR(IF(([.B986]+1)<[Calendario.$F$5];[.B986]+1;"");"") ->  | C987: of:=IF(AND([.B987]>=[Calendario.$F$8];[.B987]<=[Calendario.$F$9];1);1;IF(AND([.B987]>=[Calendario.$F$12];[.B987]<=[Calendario.$F$13]);2;IF(AND([.B987]>=[Calendario.$F$16];[.B987]<=[Calendario.$F$17]);3;""))) ->  | D987: of:=IF(COUNTIF([Calendario.$H$4:.$H$48];[.B987])>0;"FIESTA";"") -> FIESTA | E987: of:=IF([.B987]<>"";VLOOKUP(WEEKDAY([.B987];3);[Calendario.$A$4:.$C$11];2);"") ->  | F987: of:=IF([.B987]<>"";IF([.D987]<>"FIESTA";VLOOKUP(WEEKDAY([.B987];3);[Calendario.$A$4:.$C$11];3);0);"") ->  | G987: of:=IF(ISNUMBER([.F987]);[.F987]+[.G986];"") ->  | H987: of:=IF(AND([.G987]<=[Unidades.$G$26];[.G987]<=[Unidades.$F$18];[Unidades.$F$18]>0);[Unidades.$D$18]+1-COUNTIFS([Unidades.$O$3:.$O$17];">="&[.G987]);"") ->  | I987: of:=IF([.H986]<>[.H987];"INICIO";IF([.H988]<>[.H987];"FIN";"")) ->  | J987: of:=IF([.K986]<>[.K987];"INICIO";IF([.K988]<>[.K987];"FIN";"")) -> 
A988: of:=IF([.B988]<>"";TODAY()>[.B988];"") ->  | B988: of:=IFERROR(IF(([.B987]+1)<[Calendario.$F$5];[.B987]+1;"");"") ->  | C988: of:=IF(AND([.B988]>=[Calendario.$F$8];[.B988]<=[Calendario.$F$9];1);1;IF(AND([.B988]>=[Calendario.$F$12];[.B988]<=[Calendario.$F$13]);2;IF(AND([.B988]>=[Calendario.$F$16];[.B988]<=[Calendario.$F$17]);3;""))) ->  | D988: of:=IF(COUNTIF([Calendario.$H$4:.$H$48];[.B988])>0;"FIESTA";"") -> FIESTA | E988: of:=IF([.B988]<>"";VLOOKUP(WEEKDAY([.B988];3);[Calendario.$A$4:.$C$11];2);"") ->  | F988: of:=IF([.B988]<>"";IF([.D988]<>"FIESTA";VLOOKUP(WEEKDAY([.B988];3);[Calendario.$A$4:.$C$11];3);0);"") ->  | G988: of:=IF(ISNUMBER([.F988]);[.F988]+[.G987];"") ->  | H988: of:=IF(AND([.G988]<=[Unidades.$G$26];[.G988]<=[Unidades.$F$18];[Unidades.$F$18]>0);[Unidades.$D$18]+1-COUNTIFS([Unidades.$O$3:.$O$17];">="&[.G988]);"") ->  | I988: of:=IF([.H987]<>[.H988];"INICIO";IF([.H989]<>[.H988];"FIN";"")) ->  | J988: of:=IF([.K987]<>[.K988];"INICIO";IF([.K989]<>[.K988];"FIN";"")) -> 
A989: of:=IF([.B989]<>"";TODAY()>[.B989];"") ->  | B989: of:=IFERROR(IF(([.B988]+1)<[Calendario.$F$5];[.B988]+1;"");"") ->  | C989: of:=IF(AND([.B989]>=[Calendario.$F$8];[.B989]<=[Calendario.$F$9];1);1;IF(AND([.B989]>=[Calendario.$F$12];[.B989]<=[Calendario.$F$13]);2;IF(AND([.B989]>=[Calendario.$F$16];[.B989]<=[Calendario.$F$17]);3;""))) ->  | D989: of:=IF(COUNTIF([Calendario.$H$4:.$H$48];[.B989])>0;"FIESTA";"") -> FIESTA | E989: of:=IF([.B989]<>"";VLOOKUP(WEEKDAY([.B989];3);[Calendario.$A$4:.$C$11];2);"") ->  | F989: of:=IF([.B989]<>"";IF([.D989]<>"FIESTA";VLOOKUP(WEEKDAY([.B989];3);[Calendario.$A$4:.$C$11];3);0);"") ->  | G989: of:=IF(ISNUMBER([.F989]);[.F989]+[.G988];"") ->  | H989: of:=IF(AND([.G989]<=[Unidades.$G$26];[.G989]<=[Unidades.$F$18];[Unidades.$F$18]>0);[Unidades.$D$18]+1-COUNTIFS([Unidades.$O$3:.$O$17];">="&[.G989]);"") ->  | I989: of:=IF([.H988]<>[.H989];"INICIO";IF([.H990]<>[.H989];"FIN";"")) ->  | J989: of:=IF([.K988]<>[.K989];"INICIO";IF([.K990]<>[.K989];"FIN";"")) -> 
A990: of:=IF([.B990]<>"";TODAY()>[.B990];"") ->  | B990: of:=IFERROR(IF(([.B989]+1)<[Calendario.$F$5];[.B989]+1;"");"") ->  | C990: of:=IF(AND([.B990]>=[Calendario.$F$8];[.B990]<=[Calendario.$F$9];1);1;IF(AND([.B990]>=[Calendario.$F$12];[.B990]<=[Calendario.$F$13]);2;IF(AND([.B990]>=[Calendario.$F$16];[.B990]<=[Calendario.$F$17]);3;""))) ->  | D990: of:=IF(COUNTIF([Calendario.$H$4:.$H$48];[.B990])>0;"FIESTA";"") -> FIESTA | E990: of:=IF([.B990]<>"";VLOOKUP(WEEKDAY([.B990];3);[Calendario.$A$4:.$C$11];2);"") ->  | F990: of:=IF([.B990]<>"";IF([.D990]<>"FIESTA";VLOOKUP(WEEKDAY([.B990];3);[Calendario.$A$4:.$C$11];3);0);"") ->  | G990: of:=IF(ISNUMBER([.F990]);[.F990]+[.G989];"") ->  | H990: of:=IF(AND([.G990]<=[Unidades.$G$26];[.G990]<=[Unidades.$F$18];[Unidades.$F$18]>0);[Unidades.$D$18]+1-COUNTIFS([Unidades.$O$3:.$O$17];">="&[.G990]);"") ->  | I990: of:=IF([.H989]<>[.H990];"INICIO";IF([.H991]<>[.H990];"FIN";"")) ->  | J990: of:=IF([.K989]<>[.K990];"INICIO";IF([.K991]<>[.K990];"FIN";"")) -> 
A991: of:=IF([.B991]<>"";TODAY()>[.B991];"") ->  | B991: of:=IFERROR(IF(([.B990]+1)<[Calendario.$F$5];[.B990]+1;"");"") ->  | C991: of:=IF(AND([.B991]>=[Calendario.$F$8];[.B991]<=[Calendario.$F$9];1);1;IF(AND([.B991]>=[Calendario.$F$12];[.B991]<=[Calendario.$F$13]);2;IF(AND([.B991]>=[Calendario.$F$16];[.B991]<=[Calendario.$F$17]);3;""))) ->  | D991: of:=IF(COUNTIF([Calendario.$H$4:.$H$48];[.B991])>0;"FIESTA";"") -> FIESTA | E991: of:=IF([.B991]<>"";VLOOKUP(WEEKDAY([.B991];3);[Calendario.$A$4:.$C$11];2);"") ->  | F991: of:=IF([.B991]<>"";IF([.D991]<>"FIESTA";VLOOKUP(WEEKDAY([.B991];3);[Calendario.$A$4:.$C$11];3);0);"") ->  | G991: of:=IF(ISNUMBER([.F991]);[.F991]+[.G990];"") ->  | H991: of:=IF(AND([.G991]<=[Unidades.$G$26];[.G991]<=[Unidades.$F$18];[Unidades.$F$18]>0);[Unidades.$D$18]+1-COUNTIFS([Unidades.$O$3:.$O$17];">="&[.G991]);"") ->  | I991: of:=IF([.H990]<>[.H991];"INICIO";IF([.H992]<>[.H991];"FIN";"")) ->  | J991: of:=IF([.K990]<>[.K991];"INICIO";IF([.K992]<>[.K991];"FIN";"")) -> 
A992: of:=IF([.B992]<>"";TODAY()>[.B992];"") ->  | B992: of:=IFERROR(IF(([.B991]+1)<[Calendario.$F$5];[.B991]+1;"");"") ->  | C992: of:=IF(AND([.B992]>=[Calendario.$F$8];[.B992]<=[Calendario.$F$9];1);1;IF(AND([.B992]>=[Calendario.$F$12];[.B992]<=[Calendario.$F$13]);2;IF(AND([.B992]>=[Calendario.$F$16];[.B992]<=[Calendario.$F$17]);3;""))) ->  | D992: of:=IF(COUNTIF([Calendario.$H$4:.$H$48];[.B992])>0;"FIESTA";"") -> FIESTA | E992: of:=IF([.B992]<>"";VLOOKUP(WEEKDAY([.B992];3);[Calendario.$A$4:.$C$11];2);"") ->  | F992: of:=IF([.B992]<>"";IF([.D992]<>"FIESTA";VLOOKUP(WEEKDAY([.B992];3);[Calendario.$A$4:.$C$11];3);0);"") ->  | G992: of:=IF(ISNUMBER([.F992]);[.F992]+[.G991];"") ->  | H992: of:=IF(AND([.G992]<=[Unidades.$G$26];[.G992]<=[Unidades.$F$18];[Unidades.$F$18]>0);[Unidades.$D$18]+1-COUNTIFS([Unidades.$O$3:.$O$17];">="&[.G992]);"") ->  | I992: of:=IF([.H991]<>[.H992];"INICIO";IF([.H993]<>[.H992];"FIN";"")) ->  | J992: of:=IF([.K991]<>[.K992];"INICIO";IF([.K993]<>[.K992];"FIN";"")) -> 
A993: of:=IF([.B993]<>"";TODAY()>[.B993];"") ->  | B993: of:=IFERROR(IF(([.B992]+1)<[Calendario.$F$5];[.B992]+1;"");"") ->  | C993: of:=IF(AND([.B993]>=[Calendario.$F$8];[.B993]<=[Calendario.$F$9];1);1;IF(AND([.B993]>=[Calendario.$F$12];[.B993]<=[Calendario.$F$13]);2;IF(AND([.B993]>=[Calendario.$F$16];[.B993]<=[Calendario.$F$17]);3;""))) ->  | D993: of:=IF(COUNTIF([Calendario.$H$4:.$H$48];[.B993])>0;"FIESTA";"") -> FIESTA | E993: of:=IF([.B993]<>"";VLOOKUP(WEEKDAY([.B993];3);[Calendario.$A$4:.$C$11];2);"") ->  | F993: of:=IF([.B993]<>"";IF([.D993]<>"FIESTA";VLOOKUP(WEEKDAY([.B993];3);[Calendario.$A$4:.$C$11];3);0);"") ->  | G993: of:=IF(ISNUMBER([.F993]);[.F993]+[.G992];"") ->  | H993: of:=IF(AND([.G993]<=[Unidades.$G$26];[.G993]<=[Unidades.$F$18];[Unidades.$F$18]>0);[Unidades.$D$18]+1-COUNTIFS([Unidades.$O$3:.$O$17];">="&[.G993]);"") ->  | I993: of:=IF([.H992]<>[.H993];"INICIO";IF([.H994]<>[.H993];"FIN";"")) ->  | J993: of:=IF([.K992]<>[.K993];"INICIO";IF([.K994]<>[.K993];"FIN";"")) -> 
A994: of:=IF([.B994]<>"";TODAY()>[.B994];"") ->  | B994: of:=IFERROR(IF(([.B993]+1)<[Calendario.$F$5];[.B993]+1;"");"") ->  | C994: of:=IF(AND([.B994]>=[Calendario.$F$8];[.B994]<=[Calendario.$F$9];1);1;IF(AND([.B994]>=[Calendario.$F$12];[.B994]<=[Calendario.$F$13]);2;IF(AND([.B994]>=[Calendario.$F$16];[.B994]<=[Calendario.$F$17]);3;""))) ->  | D994: of:=IF(COUNTIF([Calendario.$H$4:.$H$48];[.B994])>0;"FIESTA";"") -> FIESTA | E994: of:=IF([.B994]<>"";VLOOKUP(WEEKDAY([.B994];3);[Calendario.$A$4:.$C$11];2);"") ->  | F994: of:=IF([.B994]<>"";IF([.D994]<>"FIESTA";VLOOKUP(WEEKDAY([.B994];3);[Calendario.$A$4:.$C$11];3);0);"") ->  | G994: of:=IF(ISNUMBER([.F994]);[.F994]+[.G993];"") ->  | H994: of:=IF(AND([.G994]<=[Unidades.$G$26];[.G994]<=[Unidades.$F$18];[Unidades.$F$18]>0);[Unidades.$D$18]+1-COUNTIFS([Unidades.$O$3:.$O$17];">="&[.G994]);"") ->  | I994: of:=IF([.H993]<>[.H994];"INICIO";IF([.H995]<>[.H994];"FIN";"")) ->  | J994: of:=IF([.K993]<>[.K994];"INICIO";IF([.K995]<>[.K994];"FIN";"")) -> 
A995: of:=IF([.B995]<>"";TODAY()>[.B995];"") ->  | B995: of:=IFERROR(IF(([.B994]+1)<[Calendario.$F$5];[.B994]+1;"");"") ->  | C995: of:=IF(AND([.B995]>=[Calendario.$F$8];[.B995]<=[Calendario.$F$9];1);1;IF(AND([.B995]>=[Calendario.$F$12];[.B995]<=[Calendario.$F$13]);2;IF(AND([.B995]>=[Calendario.$F$16];[.B995]<=[Calendario.$F$17]);3;""))) ->  | D995: of:=IF(COUNTIF([Calendario.$H$4:.$H$48];[.B995])>0;"FIESTA";"") -> FIESTA | E995: of:=IF([.B995]<>"";VLOOKUP(WEEKDAY([.B995];3);[Calendario.$A$4:.$C$11];2);"") ->  | F995: of:=IF([.B995]<>"";IF([.D995]<>"FIESTA";VLOOKUP(WEEKDAY([.B995];3);[Calendario.$A$4:.$C$11];3);0);"") ->  | G995: of:=IF(ISNUMBER([.F995]);[.F995]+[.G994];"") ->  | H995: of:=IF(AND([.G995]<=[Unidades.$G$26];[.G995]<=[Unidades.$F$18];[Unidades.$F$18]>0);[Unidades.$D$18]+1-COUNTIFS([Unidades.$O$3:.$O$17];">="&[.G995]);"") ->  | I995: of:=IF([.H994]<>[.H995];"INICIO";IF([.H996]<>[.H995];"FIN";"")) ->  | J995: of:=IF([.K994]<>[.K995];"INICIO";IF([.K996]<>[.K995];"FIN";"")) -> 
A996: of:=IF([.B996]<>"";TODAY()>[.B996];"") ->  | B996: of:=IFERROR(IF(([.B995]+1)<[Calendario.$F$5];[.B995]+1;"");"") ->  | C996: of:=IF(AND([.B996]>=[Calendario.$F$8];[.B996]<=[Calendario.$F$9];1);1;IF(AND([.B996]>=[Calendario.$F$12];[.B996]<=[Calendario.$F$13]);2;IF(AND([.B996]>=[Calendario.$F$16];[.B996]<=[Calendario.$F$17]);3;""))) ->  | D996: of:=IF(COUNTIF([Calendario.$H$4:.$H$48];[.B996])>0;"FIESTA";"") -> FIESTA | E996: of:=IF([.B996]<>"";VLOOKUP(WEEKDAY([.B996];3);[Calendario.$A$4:.$C$11];2);"") ->  | F996: of:=IF([.B996]<>"";IF([.D996]<>"FIESTA";VLOOKUP(WEEKDAY([.B996];3);[Calendario.$A$4:.$C$11];3);0);"") ->  | G996: of:=IF(ISNUMBER([.F996]);[.F996]+[.G995];"") ->  | H996: of:=IF(AND([.G996]<=[Unidades.$G$26];[.G996]<=[Unidades.$F$18];[Unidades.$F$18]>0);[Unidades.$D$18]+1-COUNTIFS([Unidades.$O$3:.$O$17];">="&[.G996]);"") ->  | I996: of:=IF([.H995]<>[.H996];"INICIO";IF([.H997]<>[.H996];"FIN";"")) ->  | J996: of:=IF([.K995]<>[.K996];"INICIO";IF([.K997]<>[.K996];"FIN";"")) -> 
A997: of:=IF([.B997]<>"";TODAY()>[.B997];"") ->  | B997: of:=IFERROR(IF(([.B996]+1)<[Calendario.$F$5];[.B996]+1;"");"") ->  | C997: of:=IF(AND([.B997]>=[Calendario.$F$8];[.B997]<=[Calendario.$F$9];1);1;IF(AND([.B997]>=[Calendario.$F$12];[.B997]<=[Calendario.$F$13]);2;IF(AND([.B997]>=[Calendario.$F$16];[.B997]<=[Calendario.$F$17]);3;""))) ->  | D997: of:=IF(COUNTIF([Calendario.$H$4:.$H$48];[.B997])>0;"FIESTA";"") -> FIESTA | E997: of:=IF([.B997]<>"";VLOOKUP(WEEKDAY([.B997];3);[Calendario.$A$4:.$C$11];2);"") ->  | F997: of:=IF([.B997]<>"";IF([.D997]<>"FIESTA";VLOOKUP(WEEKDAY([.B997];3);[Calendario.$A$4:.$C$11];3);0);"") ->  | G997: of:=IF(ISNUMBER([.F997]);[.F997]+[.G996];"") ->  | H997: of:=IF(AND([.G997]<=[Unidades.$G$26];[.G997]<=[Unidades.$F$18];[Unidades.$F$18]>0);[Unidades.$D$18]+1-COUNTIFS([Unidades.$O$3:.$O$17];">="&[.G997]);"") ->  | I997: of:=IF([.H996]<>[.H997];"INICIO";IF([.H998]<>[.H997];"FIN";"")) ->  | J997: of:=IF([.K996]<>[.K997];"INICIO";IF([.K998]<>[.K997];"FIN";"")) -> 
A998: of:=IF([.B998]<>"";TODAY()>[.B998];"") ->  | B998: of:=IFERROR(IF(([.B997]+1)<[Calendario.$F$5];[.B997]+1;"");"") ->  | C998: of:=IF(AND([.B998]>=[Calendario.$F$8];[.B998]<=[Calendario.$F$9];1);1;IF(AND([.B998]>=[Calendario.$F$12];[.B998]<=[Calendario.$F$13]);2;IF(AND([.B998]>=[Calendario.$F$16];[.B998]<=[Calendario.$F$17]);3;""))) ->  | D998: of:=IF(COUNTIF([Calendario.$H$4:.$H$48];[.B998])>0;"FIESTA";"") -> FIESTA | E998: of:=IF([.B998]<>"";VLOOKUP(WEEKDAY([.B998];3);[Calendario.$A$4:.$C$11];2);"") ->  | F998: of:=IF([.B998]<>"";IF([.D998]<>"FIESTA";VLOOKUP(WEEKDAY([.B998];3);[Calendario.$A$4:.$C$11];3);0);"") ->  | G998: of:=IF(ISNUMBER([.F998]);[.F998]+[.G997];"") ->  | H998: of:=IF(AND([.G998]<=[Unidades.$G$26];[.G998]<=[Unidades.$F$18];[Unidades.$F$18]>0);[Unidades.$D$18]+1-COUNTIFS([Unidades.$O$3:.$O$17];">="&[.G998]);"") ->  | I998: of:=IF([.H997]<>[.H998];"INICIO";IF([.H999]<>[.H998];"FIN";"")) ->  | J998: of:=IF([.K997]<>[.K998];"INICIO";IF([.K999]<>[.K998];"FIN";"")) -> 
A999: of:=IF([.B999]<>"";TODAY()>[.B999];"") ->  | B999: of:=IFERROR(IF(([.B998]+1)<[Calendario.$F$5];[.B998]+1;"");"") ->  | C999: of:=IF(AND([.B999]>=[Calendario.$F$8];[.B999]<=[Calendario.$F$9];1);1;IF(AND([.B999]>=[Calendario.$F$12];[.B999]<=[Calendario.$F$13]);2;IF(AND([.B999]>=[Calendario.$F$16];[.B999]<=[Calendario.$F$17]);3;""))) ->  | D999: of:=IF(COUNTIF([Calendario.$H$4:.$H$48];[.B999])>0;"FIESTA";"") -> FIESTA | E999: of:=IF([.B999]<>"";VLOOKUP(WEEKDAY([.B999];3);[Calendario.$A$4:.$C$11];2);"") ->  | F999: of:=IF([.B999]<>"";IF([.D999]<>"FIESTA";VLOOKUP(WEEKDAY([.B999];3);[Calendario.$A$4:.$C$11];3);0);"") ->  | G999: of:=IF(ISNUMBER([.F999]);[.F999]+[.G998];"") ->  | H999: of:=IF(AND([.G999]<=[Unidades.$G$26];[.G999]<=[Unidades.$F$18];[Unidades.$F$18]>0);[Unidades.$D$18]+1-COUNTIFS([Unidades.$O$3:.$O$17];">="&[.G999]);"") ->  | I999: of:=IF([.H998]<>[.H999];"INICIO";IF([.H1000]<>[.H999];"FIN";"")) ->  | J999: of:=IF([.K998]<>[.K999];"INICIO";IF([.K1000]<>[.K999];"FIN";"")) -> 
A1000: of:=IF([.B1000]<>"";TODAY()>[.B1000];"") ->  | B1000: of:=IFERROR(IF(([.B999]+1)<[Calendario.$F$5];[.B999]+1;"");"") ->  | C1000: of:=IF(AND([.B1000]>=[Calendario.$F$8];[.B1000]<=[Calendario.$F$9];1);1;IF(AND([.B1000]>=[Calendario.$F$12];[.B1000]<=[Calendario.$F$13]);2;IF(AND([.B1000]>=[Calendario.$F$16];[.B1000]<=[Calendario.$F$17]);3;""))) ->  | D1000: of:=IF(COUNTIF([Calendario.$H$4:.$H$48];[.B1000])>0;"FIESTA";"") -> FIESTA | E1000: of:=IF([.B1000]<>"";VLOOKUP(WEEKDAY([.B1000];3);[Calendario.$A$4:.$C$11];2);"") ->  | F1000: of:=IF([.B1000]<>"";IF([.D1000]<>"FIESTA";VLOOKUP(WEEKDAY([.B1000];3);[Calendario.$A$4:.$C$11];3);0);"") ->  | G1000: of:=IF(ISNUMBER([.F1000]);[.F1000]+[.G999];"") ->  | H1000: of:=IF(AND([.G1000]<=[Unidades.$G$26];[.G1000]<=[Unidades.$F$18];[Unidades.$F$18]>0);[Unidades.$D$18]+1-COUNTIFS([Unidades.$O$3:.$O$17];">="&[.G1000]);"") ->  | I1000: of:=IF([.H999]<>[.H1000];"INICIO";IF([.H1001]<>[.H1000];"FIN";"")) ->  | J1000: of:=IF([.K999]<>[.K1000];"INICIO";IF([.K1001]<>[.K1000];"FIN";"")) -> 